Title,Media URL,Pinterest board,Thumbnail,Link,Publish date,Description,Keywords
The Ultimate Pool Leaf Removal Checklist,https://res.cloudinary.com/dbcpfy04c/image/upload/v1747645199/pin_2_17_rt3oy2.webp,pool-cleaning-tips,,https://www.beacleaner.com/how-to-clean-a-pool-full-of-leaves?utm_source=pinterest&utm_campaign=the-ultimate-pool-le,2025-05-19,"Don't forget a step! This post provides a comprehensive checklist for cleaning leaves from your pool, ensuring you cover all the bases.  From skimming to vacuuming to filter cleaning, we've got you covered.  Stay organized and achieve a perfectly clean pool! Click to download the checklist.","Pool Checklist,Leaf Removal,Cleaning Guide,Pool Organization"
Pool Leaf Removal: Common Mistakes,https://res.cloudinary.com/dbcpfy04c/image/upload/v1747645205/pin_2_18_yuz76j.webp,pool-cleaning-tips,,https://www.beacleaner.com/how-to-clean-a-pool-full-of-leaves?utm_source=pinterest&utm_campaign=pool-leaf-removal-co,2025-05-19,"Avoid these common mistakes when cleaning leaves from your pool! This post highlights pitfalls to avoid, helping you save time and effort.  We'll help you clean your pool efficiently and effectively.  Don't make these errors! Click to learn more.","Pool Mistakes,Leaf Removal,Cleaning Tips,Avoid Errors"
Pool Leaf Removal: Tools You Need,https://res.cloudinary.com/dbcpfy04c/image/upload/v1747645211/pin_2_19_lf4vlr.webp,pool-cleaning-tips,,https://www.beacleaner.com/how-to-clean-a-pool-full-of-leaves?utm_source=pinterest&utm_campaign=pool-leaf-removal-to,2025-05-19,"What tools do you *really* need to clean leaves from your pool? This post breaks down the essential tools, from leaf nets to vacuums, and helps you choose the right ones for your budget and needs.  Get equipped for success! Click to see our recommendations.","Pool Tools,Leaf Removal,Equipment Guide,Pool Essentials"
Is Your Pool Pump Helping with Leaves?,https://res.cloudinary.com/dbcpfy04c/image/upload/v1747645219/pin_2_20_lgdsy6.webp,pool-care-tips,,https://www.beacleaner.com/how-to-clean-a-pool-full-of-leaves?utm_source=pinterest&utm_campaign=is-your-pool-pump-he,2025-05-19,Your pool pump is a powerful ally in the fight against leaves. This post explains how to optimize your pump for leaf removal and prevent clogs.  We'll help you keep your pump running efficiently and extend its lifespan.  Maximize your pump's performance! Click to learn more.,"Pool Pump,Leaf Removal,Pump Maintenance,Pool Efficiency"
Dealing with Decaying Leaves in Pool,https://res.cloudinary.com/dbcpfy04c/image/upload/v1747645228/pin_2_21_clh1lh.webp,pool-care-tips,,https://www.beacleaner.com/how-to-clean-a-pool-full-of-leaves?utm_source=pinterest&utm_campaign=dealing-with-decayin,2025-05-19,Decaying leaves can create algae and other problems. This post explains how to deal with decaying leaves in your pool and prevent water quality issues.  We'll help you maintain a healthy and balanced pool environment.  Protect your pool from harmful bacteria! Click to read now.,"Decaying Leaves,Pool Water Quality,Algae Prevention,Pool Health"
Robot Pool Cleaner for Leafy Messes,https://res.cloudinary.com/dbcpfy04c/image/upload/v1747645234/pin_2_22_xj2p9w.webp,pool-cleaning-ideas,,https://www.beacleaner.com/how-to-clean-a-pool-full-of-leaves?utm_source=pinterest&utm_campaign=robot-pool-cleaner-f,2025-05-19,Let a robot do the work! This post reviews the best robot pool cleaners for tackling leaf debris.  We'll help you find a hands-free solution to keep your pool sparkling clean.  Enjoy more free time and less cleaning! Click to see our top picks.,"Robot Pool Cleaner,Automatic Cleaner,Leaf Removal,Pool Technology"
Pool Leaf Removal: Quick Skimming Guide,https://res.cloudinary.com/dbcpfy04c/image/upload/v1747645241/pin_2_23_gifcx7.webp,pool-cleaning-tips,,https://www.beacleaner.com/how-to-clean-a-pool-full-of-leaves?utm_source=pinterest&utm_campaign=pool-leaf-removal-qu,2025-05-19,"Short on time? This post provides a quick guide to skimming leaves from your pool, offering efficient techniques and tips.  Maintain a clean pool with minimal effort.  A few minutes of skimming can make a big difference! Click to learn more.","Quick Skimming,Leaf Removal,Pool Maintenance,Fast Cleaning"
Pool Leaf Removal: The Cost of Ignoring It,https://res.cloudinary.com/dbcpfy04c/image/upload/v1747645247/pin_2_24_wp2rgm.webp,pool-cleaning-tips,,https://www.beacleaner.com/how-to-clean-a-pool-full-of-leaves?utm_source=pinterest&utm_campaign=pool-leaf-removal-th,2025-05-19,"Ignoring leaves in your pool can lead to costly problems. This post explains the potential consequences of neglecting leaf removal, from filter damage to algae blooms.  Protect your investment and avoid expensive repairs! Click to learn more.","Pool Costs,Leaf Removal,Pool Damage,Preventative Maintenance"
"Beautiful Pool, No Leaves: Dream Achieved!",https://res.cloudinary.com/dbcpfy04c/image/upload/v1747645255/pin_2_25_osvqrj.webp,pool-inspiration,,https://www.beacleaner.com/how-to-clean-a-pool-full-of-leaves?utm_source=pinterest&utm_campaign=beautiful-pool-no-le,2025-05-19,"Imagine a sparkling clean pool, free from leaves and debris. This post shows you how to make that dream a reality! We provide practical advice and inspiring tips for maintaining a pristine pool environment.  Enjoy the ultimate pool experience! Click to learn more.","Dream Pool,Leaf Removal,Pool Inspiration,Pool Lifestyle"
Title,https://res.cloudinary.com/dbcpfy04c/image/upload/v1747645300/pin_3_1_bo2imh.webp,please-provide-the-title-and-keywords-i-need-that-information-to-suggest-a-board-name-once,,https://www.beacleaner.com/how-to-clean-black-shoes?utm_source=pinterest&utm_campaign=title,2025-05-19,Description,Keywords
Revive Black Shoes: Easy Guide,https://res.cloudinary.com/dbcpfy04c/image/upload/v1747645307/pin_3_2_hkx1b4.webp,shoe-care-tips,,https://www.beacleaner.com/how-to-clean-black-shoes?utm_source=pinterest&utm_campaign=revive-black-shoes-e,2025-05-19,"Is your favorite pair of black shoes looking dull and dirty? Don't toss them! This guide reveals simple, effective methods to clean black shoes – from suede to leather – using everyday household items. Learn how to remove scuffs, stains, and restore their original shine.  We'll cover everything from quick wipes to deep cleaning techniques, saving you money and keeping your shoes looking their best. Click to learn how to extend the life of your footwear and step out in style!  Don't let dirty shoes ruin your outfit – get cleaning!","Black shoes, shoe cleaning, leather care, suede cleaning"
Black Shoe Rescue: From Drab to Fab!,https://res.cloudinary.com/dbcpfy04c/image/upload/v1747645316/pin_3_3_vxwfyu.webp,shoe-care-tips,,https://www.beacleaner.com/how-to-clean-black-shoes?utm_source=pinterest&utm_campaign=black-shoe-rescue-fr,2025-05-19,"Feeling down because your black shoes are looking worse for wear?  We get it!  Dirty shoes can make even the cutest outfit feel…off. This post is your ultimate rescue plan! Discover the best cleaning methods for different materials, including leather, canvas, and suede.  We'll show you how to tackle stubborn stains and restore that polished look you love.  Imagine the confidence boost of rocking a fresh, clean pair of shoes! Click to learn more and bring your shoes back to life.","Shoe care, black leather, cleaning tips, shoe repair"
Suede Shoe Cleaning: A Step-by-Step Guide,https://res.cloudinary.com/dbcpfy04c/image/upload/v1747645325/pin_3_4_mssbdw.webp,shoe-care-tips,,https://www.beacleaner.com/how-to-clean-black-shoes?utm_source=pinterest&utm_campaign=suede-shoe-cleaning-,2025-05-19,"Suede shoes are gorgeous, but notoriously tricky to clean!  Don't be intimidated. This guide breaks down the process into easy-to-follow steps, ensuring you don't damage your delicate suede.  Learn the right tools to use, how to remove water stains, and how to protect your shoes from future dirt.  Keep your suede looking luxurious for years to come! Click to read the full guide and say goodbye to suede stress.","Suede shoes, suede cleaner, shoe maintenance, leather care"
Leather Shoe Shine: The Ultimate Hack,https://res.cloudinary.com/dbcpfy04c/image/upload/v1747645332/pin_3_5_g7hnlz.webp,shoe-care-tips,,https://www.beacleaner.com/how-to-clean-black-shoes?utm_source=pinterest&utm_campaign=leather-shoe-shine-t,2025-05-19,"Want your leather shoes to look brand new?  This post reveals the secret to a professional-level shine, using simple techniques and products you likely already have at home.  We'll cover everything from cleaning and conditioning to polishing for a lasting gleam.  Imagine the compliments you'll receive!  Don't settle for dull shoes – invest a little time and effort for a big impact. Click to learn the ultimate leather shoe shine hack!","Leather shoes, shoe polish, shoe shine, leather conditioner"
Clean Black Canvas Shoes: Easy & Fast!,https://res.cloudinary.com/dbcpfy04c/image/upload/v1747645338/pin_3_6_kt88ft.webp,shoe-cleaning-tips,,https://www.beacleaner.com/how-to-clean-black-shoes?utm_source=pinterest&utm_campaign=clean-black-canvas-s,2025-05-19,"Canvas shoes are a wardrobe staple, but they get dirty FAST!  This guide provides quick and easy methods to clean your black canvas shoes, removing dirt, grime, and stains in minutes.  Perfect for busy lifestyles!  We'll show you how to hand wash or machine wash your canvas shoes safely and effectively.  Keep your casual shoes looking fresh and stylish. Click to learn how!","Canvas shoes, shoe cleaning, white shoe cleaner, sneaker cleaning"
Black Shoe Stain Removal: The Fix!,https://res.cloudinary.com/dbcpfy04c/image/upload/v1747645345/pin_3_7_draoz5.webp,cleaning-tips,,https://www.beacleaner.com/how-to-clean-black-shoes?utm_source=pinterest&utm_campaign=black-shoe-stain-rem,2025-05-19,"Spilled coffee? Mud splatters? Don't panic! This post tackles the toughest stains on your black shoes.  We'll show you how to remove everything from oil and grease to ink and scuff marks, using targeted cleaning solutions.  Save your favorite shoes from permanent damage!  Click to learn the stain removal secrets that will keep your shoes looking their best.","Stain removal, shoe cleaner, black shoes, cleaning hacks"
DIY Black Shoe Cleaner: Save Money!,https://res.cloudinary.com/dbcpfy04c/image/upload/v1747645351/pin_3_8_jrnho3.webp,shoe-care-tips,,https://www.beacleaner.com/how-to-clean-black-shoes?utm_source=pinterest&utm_campaign=diy-black-shoe-clean,2025-05-19,"Why buy expensive shoe cleaners when you can make your own? This post provides simple, effective DIY recipes using household ingredients.  Save money and reduce your environmental impact!  We'll show you how to create cleaners for leather, suede, and canvas shoes.  Get cleaning without breaking the bank! Click to learn the DIY recipes.","DIY cleaner, shoe cleaning, homemade cleaner, leather care"
Protect Your Black Shoes: Preventative Care,https://res.cloudinary.com/dbcpfy04c/image/upload/v1747645360/pin_3_9_romous.webp,shoe-care-tips,,https://www.beacleaner.com/how-to-clean-black-shoes?utm_source=pinterest&utm_campaign=protect-your-black-s,2025-05-19,"Don't wait until your shoes are dirty to take action! This post focuses on preventative care, helping you protect your black shoes from dirt, stains, and damage.  Learn how to waterproof your shoes, condition leather, and store them properly.  Extend the life of your footwear and keep them looking their best. Click to learn more!","Shoe protection, leather conditioner, waterproofing, shoe care tips"
Black Shoe Cleaning for Men: A Guide,https://res.cloudinary.com/dbcpfy04c/image/upload/v1747645368/pin_3_10_gdfajw.webp,mens-shoe-tips,,https://www.beacleaner.com/how-to-clean-black-shoes?utm_source=pinterest&utm_campaign=black-shoe-cleaning-,2025-05-19,"Gentlemen, keep your shoes looking sharp! This guide provides specific cleaning tips for men's black shoes, covering leather, suede, and other materials.  Maintain a polished and professional appearance with these easy-to-follow steps.  Invest in your style and make a lasting impression. Click to learn more!","Men's shoes, shoe cleaning, leather care, shoe polish"
Black Shoe Cleaning for Women: Style Tips,https://res.cloudinary.com/dbcpfy04c/image/upload/v1747645373/pin_3_11_fnyxhe.webp,mens-shoe-tips,,https://www.beacleaner.com/how-to-clean-black-shoes?utm_source=pinterest&utm_campaign=black-shoe-cleaning-,2025-05-19,"Ladies, keep your footwear fabulous! This guide offers cleaning tips tailored for women's black shoes, from delicate heels to everyday flats.  Maintain your style and confidence with these simple techniques.  Don't let dirty shoes ruin your look! Click to learn more.","Women's shoes, shoe cleaning, heel care, shoe maintenance"
Quick Shoe Clean: 5-Minute Fix!,https://res.cloudinary.com/dbcpfy04c/image/upload/v1747645380/pin_3_12_uh6jzg.webp,shoe-care-tips,,https://www.beacleaner.com/how-to-clean-black-shoes?utm_source=pinterest&utm_campaign=quick-shoe-clean-5-m,2025-05-19,"Short on time? No problem! This post provides a 5-minute cleaning routine for black shoes, perfect for busy mornings or quick touch-ups.  Keep your shoes looking presentable with minimal effort.  A little cleaning goes a long way! Click to learn the quick fix.","Quick cleaning, shoe care, leather shoes, time saving"
Black Leather Shoe Care: The Complete Guide,https://res.cloudinary.com/dbcpfy04c/image/upload/v1747645386/pin_3_13_wp09ts.webp,shoe-care-tips,,https://www.beacleaner.com/how-to-clean-black-shoes?utm_source=pinterest&utm_campaign=black-leather-shoe-c,2025-05-19,"Everything you need to know about caring for your black leather shoes! This comprehensive guide covers cleaning, conditioning, polishing, and protecting your leather footwear.  Invest in quality leather and keep it looking beautiful for years to come. Click to read the complete guide!","Leather care, shoe polish, leather conditioner, shoe maintenance"
Revitalize Old Black Shoes: Bring Them Back!,https://res.cloudinary.com/dbcpfy04c/image/upload/v1747645395/pin_3_14_kbwrwj.webp,shoe-repair-tips,,https://www.beacleaner.com/how-to-clean-black-shoes?utm_source=pinterest&utm_campaign=revitalize-old-black,2025-05-19,"Don't give up on your old black shoes! This post shows you how to revitalize worn-out footwear, restoring their shine and extending their lifespan.  Save money and reduce waste by giving your shoes a second life. Click to learn how to breathe new life into your shoes!","Old shoes, shoe repair, shoe cleaning, leather restoration"
Black Shoe Scuff Removal: Easy Solutions,https://res.cloudinary.com/dbcpfy04c/image/upload/v1747645401/pin_3_15_gkj2ao.webp,shoe-care-tips,,https://www.beacleaner.com/how-to-clean-black-shoes?utm_source=pinterest&utm_campaign=black-shoe-scuff-rem,2025-05-19,"Scuffs happen! But they don't have to ruin your shoes. This post provides easy solutions for removing scuffs from black shoes, restoring their smooth appearance.  Don't let minor imperfections detract from your style. Click to learn the scuff removal secrets!","Scuff removal, shoe repair, leather care, shoe cleaning"
Water Stains on Shoes? Here's How to Fix!,https://res.cloudinary.com/dbcpfy04c/image/upload/v1747645408/pin_3_16_jalmeq.webp,shoe-care-tips,,https://www.beacleaner.com/how-to-clean-black-shoes?utm_source=pinterest&utm_campaign=water-stains-on-shoe,2025-05-19,"Water stains are a common shoe problem. This post shows you how to remove water stains from black shoes, restoring their original color and appearance.  Don't let water damage ruin your favorite pair! Click to learn the water stain removal techniques.","Water stains, shoe cleaning, leather care, suede cleaning"
The Best Shoe Cleaning Tools: Must-Haves!,https://res.cloudinary.com/dbcpfy04c/image/upload/v1747645415/pin_3_17_uby4nj.webp,shoe-care-tips,,https://www.beacleaner.com/how-to-clean-black-shoes?utm_source=pinterest&utm_campaign=the-best-shoe-cleani,2025-05-19,"Wondering what tools you need to clean your black shoes effectively? This post reviews the best shoe cleaning brushes, cloths, and solutions, helping you choose the right products for your needs.  Invest in quality tools for optimal results. Click to see the must-have shoe cleaning tools!","Shoe cleaning tools, brushes, shoe polish, leather care"
Black Shoe Cleaning Mistakes to Avoid,https://res.cloudinary.com/dbcpfy04c/image/upload/v1747645420/pin_3_18_wcalvy.webp,mens-shoe-tips,,https://www.beacleaner.com/how-to-clean-black-shoes?utm_source=pinterest&utm_campaign=black-shoe-cleaning-,2025-05-19,"Avoid these common shoe cleaning mistakes that can damage your footwear! This post highlights the pitfalls to watch out for, ensuring you clean your black shoes safely and effectively.  Protect your investment and keep your shoes looking their best. Click to learn what *not* to do!","Shoe cleaning mistakes, leather care, suede cleaning, shoe care tips"
Deep Cleaning Black Shoes: A Detailed Guide,https://res.cloudinary.com/dbcpfy04c/image/upload/v1747645426/pin_3_19_pl1dxs.webp,shoe-care-tips,,https://www.beacleaner.com/how-to-clean-black-shoes?utm_source=pinterest&utm_campaign=deep-cleaning-black-,2025-05-19,"Give your black shoes a thorough cleaning with this detailed guide! We'll cover every step, from removing dirt and grime to conditioning and polishing.  Perfect for shoes that haven't been cleaned in a while. Click to learn the deep cleaning process!","Deep cleaning, shoe care, leather care, suede cleaning"
Black Shoe Care Routine: Stay Consistent!,https://res.cloudinary.com/dbcpfy04c/image/upload/v1747645433/pin_3_20_x10zmz.webp,shoe-care-tips,,https://www.beacleaner.com/how-to-clean-black-shoes?utm_source=pinterest&utm_campaign=black-shoe-care-rout,2025-05-19,"Establish a regular shoe care routine to keep your black shoes looking their best! This post provides a simple schedule for cleaning, conditioning, and protecting your footwear.  Consistency is key to extending the life of your shoes. Click to learn the routine!","Shoe care routine, leather care, shoe maintenance, preventative care"
Cleaning Black Shoes with Baking Soda,https://res.cloudinary.com/dbcpfy04c/image/upload/v1747645439/pin_3_21_sdgslm.webp,shoe-cleaning-tips,,https://www.beacleaner.com/how-to-clean-black-shoes?utm_source=pinterest&utm_campaign=cleaning-black-shoes,2025-05-19,"Baking soda isn't just for baking! Discover how to use this versatile household ingredient to clean your black shoes, removing stains and odors. A natural and effective cleaning solution! Click to learn the baking soda trick!","Baking soda, shoe cleaning, DIY cleaner, natural cleaning"
Black Suede Shoe Care: Expert Tips,https://res.cloudinary.com/dbcpfy04c/image/upload/v1747645447/pin_3_22_iril2f.webp,shoe-care-tips,,https://www.beacleaner.com/how-to-clean-black-shoes?utm_source=pinterest&utm_campaign=black-suede-shoe-car,2025-05-19,"Suede requires special care. This post provides expert tips for cleaning and protecting your black suede shoes, ensuring they stay looking luxurious. Learn the do's and don'ts of suede care. Click for expert advice!","Suede care, suede cleaner, shoe maintenance, leather care"
How to Clean Black Shoes Without Water,https://res.cloudinary.com/dbcpfy04c/image/upload/v1747645453/pin_3_23_g0wxeh.webp,shoe-care-tips,,https://www.beacleaner.com/how-to-clean-black-shoes?utm_source=pinterest&utm_campaign=how-to-clean-black-s,2025-05-19,"Worried about damaging your shoes with water? This post shows you how to clean black shoes without using water, perfect for delicate materials like suede. A safe and effective cleaning method! Click to learn the waterless cleaning technique!","Waterless cleaning, shoe care, suede cleaning, leather care"
Black Shoe Cleaning: Before & After Results,https://res.cloudinary.com/dbcpfy04c/image/upload/v1747645458/pin_3_24_bfk54r.webp,mens-shoe-tips,,https://www.beacleaner.com/how-to-clean-black-shoes?utm_source=pinterest&utm_campaign=black-shoe-cleaning-,2025-05-19,See the amazing transformation! This post showcases before & after photos of black shoes cleaned using the techniques described in the blog post.  Proof that a little effort can make a big difference! Click to see the stunning results!,"Before and after, shoe cleaning, leather care, shoe restoration"
Extend the Life of Your Black Shoes,https://res.cloudinary.com/dbcpfy04c/image/upload/v1747645465/pin_3_25_rwpu2x.webp,shoe-care-tips,,https://www.beacleaner.com/how-to-clean-black-shoes?utm_source=pinterest&utm_campaign=extend-the-life-of-y,2025-05-19,"Don't replace, restore! Learn how to extend the life of your black shoes with proper cleaning and care. Save money and reduce waste by keeping your footwear in top condition. Click to learn how to make your shoes last!","Shoe longevity, shoe care, leather care, sustainable fashion"
Title,https://res.cloudinary.com/dbcpfy04c/image/upload/v1747645511/pin_4_1_boupie.webp,please-provide-the-title-and-keywords-i-need-that-information-to-suggest-a-board-name-once,,https://www.beacleaner.com/how-often-to-clean-oxygen-concentrator-filter?utm_source=pinterest&utm_campaign=title,2025-05-19,Description,Keywords
Breathe Easy: Oxygen Concentrator Filter Cleaning,https://res.cloudinary.com/dbcpfy04c/image/upload/v1747645517/pin_4_2_vokurk.webp,home-health-tips,,https://www.beacleaner.com/how-often-to-clean-oxygen-concentrator-filter?utm_source=pinterest&utm_campaign=breathe-easy-oxygen-,2025-05-19,"Is your oxygen concentrator working its best? Dirty filters can reduce oxygen output & impact your health! Learn how often to clean it for optimal performance & peace of mind. This guide breaks down cleaning schedules, step-by-step instructions, and signs your filter *needs* attention. Don't compromise your well-being – a clean filter means cleaner air! Click to learn more and breathe easier today. Protect your health and your investment!","Oxygen Concentrator,Filter Cleaning,Respiratory Health,Home Healthcare"
Oxygen Filter: When to Change It?,https://res.cloudinary.com/dbcpfy04c/image/upload/v1747645524/pin_4_3_f1gpyi.webp,medical-tips,,https://www.beacleaner.com/how-often-to-clean-oxygen-concentrator-filter?utm_source=pinterest&utm_campaign=oxygen-filter-when-t,2025-05-19,"Don't wait until you notice a difference in your breathing! Knowing when to clean *and* replace your oxygen concentrator filter is crucial. This post details the lifespan of filters, different filter types, and how environmental factors affect cleaning frequency.  We'll help you avoid costly repairs and ensure consistent oxygen delivery.  Your health deserves it! Read now for a comprehensive guide.","Oxygen Therapy,Filter Replacement,Breathing Problems,Medical Equipment"
"Clean Air, Healthy Lungs: OC Filter Guide",https://res.cloudinary.com/dbcpfy04c/image/upload/v1747645531/pin_4_4_gq1yy6.webp,lung-health-tips,,https://www.beacleaner.com/how-often-to-clean-oxygen-concentrator-filter?utm_source=pinterest&utm_campaign=clean-air-healthy-lu,2025-05-19,"Worried about the air quality you're receiving from your oxygen concentrator? You should be! A neglected filter can harbor dust, allergens, and even bacteria. This article provides a simple, actionable plan to keep your filter clean and your air pure.  We cover everything from daily checks to deep cleaning routines.  Take control of your respiratory health – click to learn how!","Air Quality,Lung Health,Oxygen Concentrator Maintenance,Home Medical"
Extend Your OC's Life: Filter Care,https://res.cloudinary.com/dbcpfy04c/image/upload/v1747645537/pin_4_5_c2la67.webp,medical-tips-ideas,,https://www.beacleaner.com/how-often-to-clean-oxygen-concentrator-filter?utm_source=pinterest&utm_campaign=extend-your-ocs-life,2025-05-19,"Your oxygen concentrator is an investment in your health. Protect it! Regular filter cleaning extends its lifespan and prevents breakdowns. This post reveals the secrets to proper filter maintenance, saving you money and ensuring reliable oxygen delivery.  Don't let a dirty filter ruin your day – learn the easy steps now!  Click to read and safeguard your health.","Oxygen Concentrator,Maintenance Tips,Medical Device,Long-Term Health"
Is Your Oxygen Concentrator Filter Dirty?,https://res.cloudinary.com/dbcpfy04c/image/upload/v1747645543/pin_4_6_vok5yk.webp,health-tips,,https://www.beacleaner.com/how-often-to-clean-oxygen-concentrator-filter?utm_source=pinterest&utm_campaign=is-your-oxygen-conce,2025-05-19,Can't remember the last time you cleaned your oxygen concentrator filter? You're not alone! But it's vital for your health. This guide provides a quick checklist to determine if your filter needs attention *right now*.  We'll show you the telltale signs and how to address them.  Don't risk compromised oxygen levels – check your filter today!,"Filter Check,Oxygen Levels,Respiratory Care,Health Alert"
DIY Oxygen Concentrator Filter Cleaning,https://res.cloudinary.com/dbcpfy04c/image/upload/v1747645550/pin_4_7_faplt0.webp,home-repair-tips,,https://www.beacleaner.com/how-often-to-clean-oxygen-concentrator-filter?utm_source=pinterest&utm_campaign=diy-oxygen-concentra,2025-05-19,"Save money and keep your oxygen concentrator running smoothly with our DIY filter cleaning guide! We provide step-by-step instructions, recommended cleaning solutions, and safety tips.  You don't need to be a technician to keep your filter in top shape.  Empower yourself and breathe easier! Click to learn how.","DIY Cleaning,Oxygen Concentrator,Filter Maintenance,Cost Savings"
