Title,Media URL,Pinterest board,Thumbnail,Link,Publish date,Description,Keywords
The Ultimate Oxygen Filter Cleaning Schedule,https://res.cloudinary.com/dbcpfy04c/image/upload/v1747645566/pin_4_8_og5im4.webp,health-tips,,https://www.beacleaner.com/how-often-to-clean-oxygen-concentrator-filter?utm_source=pinterest&utm_campaign=the-ultimate-oxygen-,2025-05-19,"Confused about how often to clean your oxygen concentrator filter? We've got you covered! This post lays out a clear, easy-to-follow cleaning schedule based on your environment and usage.  From daily checks to monthly deep cleans, we'll help you stay on track.  Breathe confidently – read the schedule now!","Cleaning Schedule,Oxygen Concentrator,Preventative Care,Respiratory Wellness"
Protect Your Health: OC Filter Facts,https://res.cloudinary.com/dbcpfy04c/image/upload/v1747645572/pin_4_9_bfypfr.webp,health-tips,,https://www.beacleaner.com/how-often-to-clean-oxygen-concentrator-filter?utm_source=pinterest&utm_campaign=protect-your-health-,2025-05-19,Did you know a dirty oxygen concentrator filter can worsen respiratory conditions? This article reveals the hidden dangers of neglecting your filter and the benefits of regular cleaning.  We'll empower you with the knowledge to make informed decisions about your health.  Don't take chances – read now and breathe safely!,"Respiratory Disease,Health Risks,Oxygen Concentrator,Filter Importance"
Oxygen Concentrator Filter: What You Need to Know,https://res.cloudinary.com/dbcpfy04c/image/upload/v1747645579/pin_4_10_tgr7us.webp,oxygen-therapy-tips,,https://www.beacleaner.com/how-often-to-clean-oxygen-concentrator-filter?utm_source=pinterest&utm_campaign=oxygen-concentrator-,2025-05-19,"Everything you need to know about your oxygen concentrator filter in one place! This comprehensive guide covers filter types, cleaning methods, replacement schedules, and troubleshooting tips.  We'll answer all your questions and help you maintain optimal oxygen delivery.  Click to become an OC filter expert!","Filter Types,Troubleshooting,Oxygen Therapy,Medical Information"
Breathe Easier with a Clean OC Filter,https://res.cloudinary.com/dbcpfy04c/image/upload/v1747645585/pin_4_11_gqu90d.webp,clean-air-tips,,https://www.beacleaner.com/how-often-to-clean-oxygen-concentrator-filter?utm_source=pinterest&utm_campaign=breathe-easier-with-,2025-05-19,"Imagine breathing cleaner, fresher air with every breath. It's possible with a clean oxygen concentrator filter! This post shows you how easy it is to maintain your filter and enjoy the benefits of optimal oxygen delivery.  Invest in your health – click to learn more and breathe easier today!","Clean Air,Oxygen Delivery,Health Benefits,Respiratory Support"
Don't Ignore These OC Filter Warning Signs!,https://res.cloudinary.com/dbcpfy04c/image/upload/v1747645592/pin_4_12_zk3heq.webp,health-tips,,https://www.beacleaner.com/how-often-to-clean-oxygen-concentrator-filter?utm_source=pinterest&utm_campaign=dont-ignore-these-oc,2025-05-19,Is your oxygen concentrator making strange noises? Is your oxygen saturation dropping? These could be signs of a dirty filter! This post details the warning signs to watch out for and how to address them quickly.  Don't wait until it's too late – read now and protect your health!,"Warning Signs,Oxygen Saturation,Filter Problems,Emergency Care"
Simple Steps to a Cleaner OC Filter,https://res.cloudinary.com/dbcpfy04c/image/upload/v1747645598/pin_4_13_jgmovt.webp,home-health-tips,,https://www.beacleaner.com/how-often-to-clean-oxygen-concentrator-filter?utm_source=pinterest&utm_campaign=simple-steps-to-a-cl,2025-05-19,"Cleaning your oxygen concentrator filter doesn't have to be a chore! This post breaks down the process into simple, easy-to-follow steps.  We'll show you how to clean your filter quickly and effectively, without any special tools or expertise.  Take control of your health – click to learn more!","Easy Cleaning,Step-by-Step Guide,Oxygen Concentrator,Home Healthcare"
The Impact of Dust on Your OC Filter,https://res.cloudinary.com/dbcpfy04c/image/upload/v1747645604/pin_4_14_hijxrb.webp,air-quality-tips,,https://www.beacleaner.com/how-often-to-clean-oxygen-concentrator-filter?utm_source=pinterest&utm_campaign=the-impact-of-dust-o,2025-05-19,Dust is the enemy of a clean oxygen concentrator filter! This article explains how dust affects filter performance and what you can do to minimize its impact.  We'll provide tips for keeping your environment clean and protecting your filter from dust buildup.  Breathe easier – read now!,"Dust Control,Air Filtration,Oxygen Concentrator,Environmental Health"
Choosing the Right OC Filter for You,https://res.cloudinary.com/dbcpfy04c/image/upload/v1747645610/pin_4_15_cavcyi.webp,medical-tips,,https://www.beacleaner.com/how-often-to-clean-oxygen-concentrator-filter?utm_source=pinterest&utm_campaign=choosing-the-right-o,2025-05-19,"Not all oxygen concentrator filters are created equal! This post helps you choose the right filter for your specific needs and environment.  We'll cover different filter types, materials, and features.  Make an informed decision – click to learn more!","Filter Selection,Oxygen Concentrator,Medical Supplies,Product Guide"
OC Filter Cleaning: Common Mistakes to Avoid,https://res.cloudinary.com/dbcpfy04c/image/upload/v1747645616/pin_4_16_zhobku.webp,home-maintenance-tips,,https://www.beacleaner.com/how-often-to-clean-oxygen-concentrator-filter?utm_source=pinterest&utm_campaign=oc-filter-cleaning-c,2025-05-19,Are you making these common mistakes when cleaning your oxygen concentrator filter? This post reveals the pitfalls to avoid and ensures you're cleaning your filter correctly.  Protect your health and your investment – read now and learn from the experts!,"Cleaning Mistakes,Oxygen Concentrator,Filter Care,Preventative Maintenance"
Oxygen Concentrator Filter & Allergies,https://res.cloudinary.com/dbcpfy04c/image/upload/v1747645625/pin_4_17_yjmia4.webp,oxygen-therapy-tips,,https://www.beacleaner.com/how-often-to-clean-oxygen-concentrator-filter?utm_source=pinterest&utm_campaign=oxygen-concentrator-,2025-05-19,Struggling with allergies? A clean oxygen concentrator filter can make a big difference! This post explains how a dirty filter can exacerbate allergy symptoms and how regular cleaning can provide relief.  Breathe easier and enjoy life – read now!,"Allergies,Air Purification,Oxygen Concentrator,Respiratory Relief"
Filter Cleaning: A Guide for Caregivers,https://res.cloudinary.com/dbcpfy04c/image/upload/v1747645631/pin_4_18_bgoxg0.webp,home-health-tips,,https://www.beacleaner.com/how-often-to-clean-oxygen-concentrator-filter?utm_source=pinterest&utm_campaign=filter-cleaning-a-gu,2025-05-19,"Caring for someone who uses an oxygen concentrator? This guide is for you! We provide clear, concise instructions on how to clean and maintain the filter, ensuring optimal oxygen delivery for your loved one.  Show your care – read now!","Caregiver Support,Oxygen Concentrator,Filter Maintenance,Home Health"
How Your Location Affects OC Filter Cleaning,https://res.cloudinary.com/dbcpfy04c/image/upload/v1747645638/pin_4_19_x9ht8d.webp,health-tips,,https://www.beacleaner.com/how-often-to-clean-oxygen-concentrator-filter?utm_source=pinterest&utm_campaign=how-your-location-af,2025-05-19,Do you live in a dusty or polluted area? Your oxygen concentrator filter may need more frequent cleaning! This post explains how your location impacts filter lifespan and provides tailored cleaning recommendations.  Breathe safely – read now!,"Location-Based Care,Oxygen Concentrator,Air Pollution,Environmental Factors"
Beyond Cleaning: When to *Replace* Your Filter,https://res.cloudinary.com/dbcpfy04c/image/upload/v1747645644/pin_4_20_qdhc0d.webp,medical-tips,,https://www.beacleaner.com/how-often-to-clean-oxygen-concentrator-filter?utm_source=pinterest&utm_campaign=beyond-cleaning-when,2025-05-19,"Cleaning is important, but sometimes you need to replace your oxygen concentrator filter. This post details the signs that it's time for a replacement and how to choose the right new filter.  Don't compromise your health – read now!","Filter Replacement,Oxygen Concentrator,Medical Supplies,Lifespan"
The Cost of a Dirty OC Filter: More Than You Think,https://res.cloudinary.com/dbcpfy04c/image/upload/v1747645652/pin_4_21_kxq5vu.webp,health-tips,,https://www.beacleaner.com/how-often-to-clean-oxygen-concentrator-filter?utm_source=pinterest&utm_campaign=the-cost-of-a-dirty-,2025-05-19,"Ignoring your oxygen concentrator filter can cost you more than just money. This post reveals the hidden costs of a dirty filter, including reduced oxygen output, increased energy consumption, and potential health risks.  Invest in your health – read now!","Cost Analysis,Oxygen Concentrator,Health Investment,Preventative Care"
Troubleshooting Your Oxygen Concentrator Filter,https://res.cloudinary.com/dbcpfy04c/image/upload/v1747645658/pin_4_22_j5pk7c.webp,medical-tips,,https://www.beacleaner.com/how-often-to-clean-oxygen-concentrator-filter?utm_source=pinterest&utm_campaign=troubleshooting-your,2025-05-19,Is your oxygen concentrator filter clogged or damaged? This post provides troubleshooting tips to help you identify and resolve common filter problems.  Don't let a faulty filter disrupt your oxygen therapy – read now!,"Troubleshooting,Oxygen Concentrator,Filter Repair,Technical Support"
Maximize Oxygen Output: Clean Your Filter!,https://res.cloudinary.com/dbcpfy04c/image/upload/v1747645665/pin_4_23_d1fpxj.webp,oxygen-therapy-tips,,https://www.beacleaner.com/how-often-to-clean-oxygen-concentrator-filter?utm_source=pinterest&utm_campaign=maximize-oxygen-outp,2025-05-19,Want to get the most out of your oxygen concentrator? A clean filter is key! This post explains how a dirty filter reduces oxygen output and how regular cleaning can maximize your therapy.  Breathe deeply – read now!,"Oxygen Output,Filter Efficiency,Oxygen Concentrator,Therapy Optimization"
Easy OC Filter Cleaning Checklist (Printable!),https://res.cloudinary.com/dbcpfy04c/image/upload/v1747645672/pin_4_24_n76a98.webp,home-health-tips,,https://www.beacleaner.com/how-often-to-clean-oxygen-concentrator-filter?utm_source=pinterest&utm_campaign=easy-oc-filter-clean,2025-05-19,Keep your oxygen concentrator filter cleaning on track with our printable checklist! This handy resource provides a quick and easy way to remember when to clean and replace your filter.  Download now and breathe easier!,"Printable Checklist,Oxygen Concentrator,Filter Reminder,Home Organization"
Ask the Expert: OC Filter FAQs,https://res.cloudinary.com/dbcpfy04c/image/upload/v1747645679/pin_4_25_yvra2q.webp,medical-tips,,https://www.beacleaner.com/how-often-to-clean-oxygen-concentrator-filter?utm_source=pinterest&utm_campaign=ask-the-expert-oc-fi,2025-05-19,"Got questions about your oxygen concentrator filter? We've got answers! This post addresses frequently asked questions about filter cleaning, replacement, and maintenance.  Get the information you need – read now!","FAQ,Oxygen Concentrator,Filter Questions,Expert Advice"
Breathe Confidently: OC Filter Maintenance,https://res.cloudinary.com/dbcpfy04c/image/upload/v1747645685/pin_4_26_s9hm9t.webp,oxygen-tips,,https://www.beacleaner.com/how-often-to-clean-oxygen-concentrator-filter?utm_source=pinterest&utm_campaign=breathe-confidently-,2025-05-19,"Your peace of mind is priceless. Regular oxygen concentrator filter maintenance ensures you're breathing clean, safe air. This post provides a comprehensive guide to keeping your filter in top shape.  Breathe confidently – read now!","Peace of Mind,Oxygen Concentrator,Filter Maintenance,Respiratory Safety"
Title,https://res.cloudinary.com/dbcpfy04c/image/upload/v1747645729/pin_5_1_ocmbfm.webp,please-provide-the-title-and-keywords-i-need-that-information-to-suggest-a-board-name-once,,https://www.beacleaner.com/how-to-clean-algae-from-fountain?utm_source=pinterest&utm_campaign=title,2025-05-19,Description,Keywords
Bye Bye Fountain Algae!,https://res.cloudinary.com/dbcpfy04c/image/upload/v1747645737/pin_5_2_h7whgv.webp,pond-tips,,https://www.beacleaner.com/how-to-clean-algae-from-fountain?utm_source=pinterest&utm_campaign=bye-bye-fountain-alg,2025-05-19,Is your beautiful fountain looking green and gross? Don't let algae ruin your outdoor oasis! This guide reveals simple,effective methods to clean algae from your fountain
"Sparkling Fountain, Happy You!",https://res.cloudinary.com/dbcpfy04c/image/upload/v1747645744/pin_5_3_utlpib.webp,garden-fountain-ideas,,https://www.beacleaner.com/how-to-clean-algae-from-fountain?utm_source=pinterest&utm_campaign=sparkling-fountain-h,2025-05-19,Dreaming of a relaxing fountain but battling stubborn algae? You're not alone! This post provides a step-by-step guide to banishing algae from your fountain,making it a stunning focal point once more. Discover easy DIY solutions and professional tips to keep your fountain looking its best. Imagine the peaceful sound of flowing water without the unsightly green! Click to learn more and create your dream outdoor space. #FountainMaintenance #CleanFountain #GardenDecor #AlgaeControl
Algae-Free Fountain in Minutes!,https://res.cloudinary.com/dbcpfy04c/image/upload/v1747645750/pin_5_4_ts40ts.webp,outdoor-tips,,https://www.beacleaner.com/how-to-clean-algae-from-fountain?utm_source=pinterest&utm_campaign=algae-free-fountain-,2025-05-19,Don't let algae take over your fountain! This quick and easy guide shows you how to effectively clean algae and restore your fountain's beauty in no time. We'll share the best tools,cleaning solutions
Fountain Algae: Causes & Cures,https://res.cloudinary.com/dbcpfy04c/image/upload/v1747645757/pin_5_5_za1ouq.webp,pond-tips,,https://www.beacleaner.com/how-to-clean-algae-from-fountain?utm_source=pinterest&utm_campaign=fountain-algae-cause,2025-05-19,Wondering *why* your fountain is covered in algae? This post dives deep into the causes of algae growth and provides practical solutions to eliminate it and prevent it from returning. Learn about water balance,sunlight exposure
Natural Ways to Clean Fountain Algae,https://res.cloudinary.com/dbcpfy04c/image/upload/v1747645764/pin_5_6_lvsv6u.webp,pond-tips,,https://www.beacleaner.com/how-to-clean-algae-from-fountain?utm_source=pinterest&utm_campaign=natural-ways-to-clea,2025-05-19,Want to clean your fountain algae without harsh chemicals? This guide reveals natural and eco-friendly methods to keep your water feature sparkling clean. Discover the power of vinegar,baking soda
Protect Your Fountain From Algae,https://res.cloudinary.com/dbcpfy04c/image/upload/v1747645773/pin_5_7_nrksfs.webp,pond-tips,,https://www.beacleaner.com/how-to-clean-algae-from-fountain?utm_source=pinterest&utm_campaign=protect-your-fountai,2025-05-19,Prevention is key! This post focuses on proactive measures to prevent algae growth in your fountain,saving you time and effort in the long run. Learn about water circulation
The Ultimate Fountain Cleaning Checklist,https://res.cloudinary.com/dbcpfy04c/image/upload/v1747645779/pin_5_8_qhagzr.webp,outdoor-cleaning-tips,,https://www.beacleaner.com/how-to-clean-algae-from-fountain?utm_source=pinterest&utm_campaign=the-ultimate-fountai,2025-05-19,Don't know where to start? This comprehensive checklist guides you through every step of cleaning your fountain,from initial assessment to final polish.  Ensure a thorough and effective cleaning process for a sparkling result.  Download the checklist and get cleaning today! #FountainChecklist #CleaningGuide #FountainTips #OutdoorCleaning
Is Your Fountain Algae Toxic?,https://res.cloudinary.com/dbcpfy04c/image/upload/v1747645785/pin_5_9_s3thzw.webp,pond-tips,,https://www.beacleaner.com/how-to-clean-algae-from-fountain?utm_source=pinterest&utm_campaign=is-your-fountain-alg,2025-05-19,Concerned about the safety of fountain algae? This post addresses the potential toxicity of different types of algae and provides guidance on safe handling and removal.  Protect yourself,your family
Choosing the Right Fountain Cleaner,https://res.cloudinary.com/dbcpfy04c/image/upload/v1747645793/pin_5_10_h0heau.webp,medical-tips,,https://www.beacleaner.com/how-to-clean-algae-from-fountain?utm_source=pinterest&utm_campaign=choosing-the-right-f,2025-05-19,Overwhelmed by choices? This post reviews the best fountain cleaners available,comparing their effectiveness
Fountain Algae: A Seasonal Guide,https://res.cloudinary.com/dbcpfy04c/image/upload/v1747645799/pin_5_11_pmigio.webp,pond-tips,,https://www.beacleaner.com/how-to-clean-algae-from-fountain?utm_source=pinterest&utm_campaign=fountain-algae-a-sea,2025-05-19,Algae growth varies with the seasons. This post provides a seasonal guide to fountain algae control,offering tailored advice for spring
Fountain Algae & Water Hardness,https://res.cloudinary.com/dbcpfy04c/image/upload/v1747645805/pin_5_12_pbfxq2.webp,water-garden-tips,,https://www.beacleaner.com/how-to-clean-algae-from-fountain?utm_source=pinterest&utm_campaign=fountain-algae-water,2025-05-19,Did you know water hardness can contribute to algae growth? This post explores the connection between water quality and algae,providing tips on how to balance your fountain water.  Enjoy a healthier and cleaner fountain ecosystem. Click to learn more! #WaterHardness #FountainWater #WaterQuality #AlgaeGrowth
Revive Your Old Fountain!,https://res.cloudinary.com/dbcpfy04c/image/upload/v1747645812/pin_5_13_nyrozn.webp,garden-ideas,,https://www.beacleaner.com/how-to-clean-algae-from-fountain?utm_source=pinterest&utm_campaign=revive-your-old-foun,2025-05-19,Is your old fountain looking neglected? This post provides a comprehensive guide to reviving an old fountain,including algae removal
The Best Tools for Fountain Cleaning,https://res.cloudinary.com/dbcpfy04c/image/upload/v1747645818/pin_5_14_jvvnwr.webp,outdoor-cleaning-tips,,https://www.beacleaner.com/how-to-clean-algae-from-fountain?utm_source=pinterest&utm_campaign=the-best-tools-for-f,2025-05-19,Equip yourself for success! This post recommends the best tools for cleaning your fountain,from brushes and scrubbers to pumps and filters.  Make the job easier and more effective with the right equipment. Click to see our top picks! #FountainTools #CleaningEquipment #OutdoorTools #FountainCare
Fountain Algae: Black vs. Green,https://res.cloudinary.com/dbcpfy04c/image/upload/v1747645824/pin_5_15_bgmba6.webp,pond-tips,,https://www.beacleaner.com/how-to-clean-algae-from-fountain?utm_source=pinterest&utm_campaign=fountain-algae-black,2025-05-19,Not all algae is created equal! This post explains the difference between black and green algae,their causes
Fountain Algae & Sunlight: The Connection,https://res.cloudinary.com/dbcpfy04c/image/upload/v1747645830/pin_5_16_acwfb4.webp,water-garden-tips,,https://www.beacleaner.com/how-to-clean-algae-from-fountain?utm_source=pinterest&utm_campaign=fountain-algae-sunli,2025-05-19,Sunlight is essential for plant life,but it also fuels algae growth. This post explores the relationship between sunlight exposure and fountain algae
Fountain Cleaning: A Beginner's Guide,https://res.cloudinary.com/dbcpfy04c/image/upload/v1747645837/pin_5_17_li2h85.webp,fountain-tips,,https://www.beacleaner.com/how-to-clean-algae-from-fountain?utm_source=pinterest&utm_campaign=fountain-cleaning-a-,2025-05-19,New to fountain ownership? This post provides a beginner-friendly guide to fountain cleaning,covering everything from basic maintenance to algae removal.  Feel confident and prepared to keep your fountain sparkling clean. Click to get started! #BeginnerGuide #FountainOwnership #FountainMaintenance #EasyCleaning
Fountain Algae: A Visual Guide,https://res.cloudinary.com/dbcpfy04c/image/upload/v1747645843/pin_5_18_hy4ohf.webp,pond-tips,,https://www.beacleaner.com/how-to-clean-algae-from-fountain?utm_source=pinterest&utm_campaign=fountain-algae-a-vis,2025-05-19,Sometimes a picture is worth a thousand words! This post features a visual guide to identifying different types of fountain algae,making it easier to diagnose the problem and choose the right solution. Click to view the guide! #AlgaeIdentification #VisualGuide #FountainProblems #CleaningSolutions
Troubleshooting Common Fountain Algae Issues,https://res.cloudinary.com/dbcpfy04c/image/upload/v1747645849/pin_5_19_ifrjmv.webp,medical-tips,,https://www.beacleaner.com/how-to-clean-algae-from-fountain?utm_source=pinterest&utm_campaign=troubleshooting-comm,2025-05-19,Facing a stubborn algae problem? This post provides troubleshooting tips for common fountain algae issues,helping you identify the cause and find a solution. Click to get help! #FountainTroubleshooting #AlgaeProblems #CleaningTips #OutdoorHelp
Create a Stunning Fountain Display!,https://res.cloudinary.com/dbcpfy04c/image/upload/v1747645855/pin_5_20_kki9po.webp,garden-ideas,,https://www.beacleaner.com/how-to-clean-algae-from-fountain?utm_source=pinterest&utm_campaign=create-a-stunning-fo,2025-05-19,Once your fountain is clean,it's time to enhance its beauty! This post offers ideas for creating a stunning fountain display
