Title,Media URL,Pinterest board,Thumbnail,Description,Link,Publish date,Keywords,Source URL
Gravely ZT HD: Understanding the Operator Console,https://res.cloudinary.com/dbcpfy04c/image/upload/v1745838454/pin_1_21_jpuhdv.webp,lawn-mower-ideas,,"Familiarize yourself with the operator console of your Gravely ZT HD. This guide explains the functions of each control and indicator.  Maximize your mowing efficiency and safety. Click to learn more. #OperatorConsole #GravelyZT #ZeroTurnControls #LawnMowerControls,Operator Console,Gravely,Zero Turn",https://lawntrend.com/gravely-zt-hd-zero-turn-mower-troubleshoot-guide/?utm_source=pinterest&utm_campaign=gravely-zt-hd-unders,2025-04-28,Controls,https://lawntrend.com/gravely-zt-hd-zero-turn-mower-troubleshoot-guide/
ZT HD: Preventing Rust & Corrosion,https://res.cloudinary.com/dbcpfy04c/image/upload/v1745838460/pin_1_22_nadtri.webp,rust-prevention-ideas,,"Protect your Gravely ZT HD from rust and corrosion with these preventative measures. This guide provides tips for keeping your mower looking and performing its best.  Extend its lifespan and maintain its value. Click to learn more. #RustPrevention #GravelyMaintenance #ZeroTurnCare #MowerCare,Rust Prevention,Gravely,Zero Turn",https://lawntrend.com/gravely-zt-hd-zero-turn-mower-troubleshoot-guide/?utm_source=pinterest&utm_campaign=zt-hd-preventing-rus,2025-04-28,Corrosion,https://lawntrend.com/gravely-zt-hd-zero-turn-mower-troubleshoot-guide/
Gravely ZT HD: Common Error Codes Explained,https://res.cloudinary.com/dbcpfy04c/image/upload/v1745838466/pin_1_23_tcir4k.webp,lawn-mower-ideas,,"Decoding error codes on your Gravely ZT HD can save you time and money. This guide explains common error codes and their meanings.  Diagnose problems quickly and efficiently. Click to learn more. #ErrorCodes #GravelyZT #ZeroTurnDiagnostics #MowerDiagnostics,Error Codes,Gravely,Zero Turn",https://lawntrend.com/gravely-zt-hd-zero-turn-mower-troubleshoot-guide/?utm_source=pinterest&utm_campaign=gravely-zt-hd-common,2025-04-28,Diagnostics,https://lawntrend.com/gravely-zt-hd-zero-turn-mower-troubleshoot-guide/
ZT HD: Maximizing Mowing Speed & Efficiency,https://res.cloudinary.com/dbcpfy04c/image/upload/v1745838473/pin_1_24_jwz8fl.webp,lawn-care-ideas,,"Want to get the most out of your Gravely ZT HD? This guide provides tips for maximizing mowing speed and efficiency.  Save time and effort while achieving a perfectly manicured lawn. Click to learn more. #MowingTips #GravelyZT #ZeroTurnSpeed #LawnCareEfficiency,Mowing Speed,Gravely,Zero Turn",https://lawntrend.com/gravely-zt-hd-zero-turn-mower-troubleshoot-guide/?utm_source=pinterest&utm_campaign=zt-hd-maximizing-mow,2025-04-28,Efficiency,https://lawntrend.com/gravely-zt-hd-zero-turn-mower-troubleshoot-guide/
Gravely ZT HD: Winterizing Your Mower,https://res.cloudinary.com/dbcpfy04c/image/upload/v1745838479/pin_1_25_ik2hxr.webp,lawn-mower-ideas,,"Prepare your Gravely ZT HD for winter storage with these essential steps. This guide ensures your mower is ready to go when spring arrives.  Protect your investment and avoid costly repairs. Click to learn more. #Winterizing #GravelyMaintenance #ZeroTurnStorage #MowerWinterPrep,Winterizing,Gravely,Zero Turn",https://lawntrend.com/gravely-zt-hd-zero-turn-mower-troubleshoot-guide/?utm_source=pinterest&utm_campaign=gravely-zt-hd-winter,2025-04-28,Storage,https://lawntrend.com/gravely-zt-hd-zero-turn-mower-troubleshoot-guide/
