Title,Media URL,Pinterest board,Thumbnail,Link,Publish date,Description,Keywords
Title,https://res.cloudinary.com/dbcpfy04c/image/upload/v1747644885/pin_1_1_loldxc.webp,please-provide-the-title-and-keywords-i-need-that-information-to-suggest-a-board-name-once,,https://www.beacleaner.com/how-to-clean-a-motherboard?utm_source=pinterest&utm_campaign=title,2025-05-19,Description,Keywords
Revive Your PC: Motherboard Cleaning Guide,https://res.cloudinary.com/dbcpfy04c/image/upload/v1747644892/pin_1_2_v3smif.webp,pc-repair-tips,,https://www.beacleaner.com/how-to-clean-a-motherboard?utm_source=pinterest&utm_campaign=revive-your-pc-mothe,2025-05-19,"Is your computer running slow or overheating? Dust buildup on your motherboard could be the culprit! This guide walks you through safely cleaning your motherboard, step-by-step, to boost performance and prevent costly repairs. Don't let a dusty motherboard ruin your gaming experience or work productivity. Learn how to identify problem areas, choose the right tools, and avoid static discharge. A clean motherboard = a happy computer! Click to learn more and breathe new life into your PC.","Motherboard,Cleaning,PC Repair,Computer Maintenance"
Motherboard Cleaning: A Beginner's Guide,https://res.cloudinary.com/dbcpfy04c/image/upload/v1747644899/pin_1_3_a7esz1.webp,pc-repair-tips,,https://www.beacleaner.com/how-to-clean-a-motherboard?utm_source=pinterest&utm_campaign=motherboard-cleaning,2025-05-19,"Feeling intimidated by the thought of cleaning your motherboard? Don't be! This easy-to-follow guide breaks down the process into manageable steps, even for complete beginners. We'll show you exactly what you need and how to do it without damaging your precious components. Protect your investment and keep your computer running smoothly. Click to read the full guide and gain confidence in your PC maintenance skills!","PC Cleaning,DIY Repair,Tech Tips,Motherboard"
Stop Overheating! Clean Your Motherboard Now,https://res.cloudinary.com/dbcpfy04c/image/upload/v1747644907/pin_1_4_u8esjs.webp,pc-repair-tips,,https://www.beacleaner.com/how-to-clean-a-motherboard?utm_source=pinterest&utm_campaign=stop-overheating-cle,2025-05-19,"Is your computer constantly overheating? A dusty motherboard can severely impact cooling efficiency. This guide provides a detailed walkthrough on how to safely and effectively clean your motherboard, reducing temperatures and extending the lifespan of your components. Don't risk damaging your expensive hardware – learn how to prevent overheating today! Click to read and keep your PC cool.","Overheating,PC Cooling,Motherboard Cleaning,Computer Repair"
Extend Your PC's Life: Motherboard Care,https://res.cloudinary.com/dbcpfy04c/image/upload/v1747644913/pin_1_5_mrbp8a.webp,computer-care-tips,,https://www.beacleaner.com/how-to-clean-a-motherboard?utm_source=pinterest&utm_campaign=extend-your-pcs-life,2025-05-19,"Want to keep your computer running like new for years to come? Regular motherboard cleaning is essential! This guide shows you how to remove dust and debris, preventing performance issues and potential damage. It's a small investment of time that can save you a lot of money in the long run. Click to learn the secrets to long-lasting PC performance!","PC Maintenance,Longevity,Motherboard,Computer Care"
DIY Motherboard Cleaning: Save Money!,https://res.cloudinary.com/dbcpfy04c/image/upload/v1747644920/pin_1_6_iugu8a.webp,pc-repair-tips,,https://www.beacleaner.com/how-to-clean-a-motherboard?utm_source=pinterest&utm_campaign=diy-motherboard-clea,2025-05-19,"Don't pay a technician! This guide empowers you to clean your motherboard yourself, saving you money and giving you a sense of accomplishment. We cover everything from static prevention to choosing the right cleaning solutions. It's easier than you think! Click to learn how to become your own PC repair expert.","DIY,PC Repair,Save Money,Motherboard Cleaning"
Is Dust Killing Your PC? Find Out Now!,https://res.cloudinary.com/dbcpfy04c/image/upload/v1747644927/pin_1_7_qcvy0f.webp,pc-tips,,https://www.beacleaner.com/how-to-clean-a-motherboard?utm_source=pinterest&utm_campaign=is-dust-killing-your,2025-05-19,"Dust is the silent killer of computers. It insulates components, causing overheating and performance drops. This guide focuses specifically on cleaning your motherboard, the central hub of your PC. Learn how to identify dust buildup and remove it safely. Don't let dust ruin your gaming or work – click to learn more!","Dust Removal,PC Performance,Motherboard,Computer Health"
Motherboard Cleaning: Before & After Results,https://res.cloudinary.com/dbcpfy04c/image/upload/v1747644933/pin_1_8_vbgcvb.webp,pc-repair-tips,,https://www.beacleaner.com/how-to-clean-a-motherboard?utm_source=pinterest&utm_campaign=motherboard-cleaning,2025-05-19,"See the difference! This guide showcases the dramatic impact of cleaning your motherboard. From clogged heatsinks to pristine components, we'll show you what you're dealing with and how to fix it. Visual learners will love the step-by-step photos. Click to see the transformation and learn how to achieve these results!","Before and After,Cleaning Results,Motherboard,PC Upgrade"
Safely Clean Your Motherboard: Static Prevention,https://res.cloudinary.com/dbcpfy04c/image/upload/v1747644941/pin_1_9_qszhmh.webp,pc-building-tips,,https://www.beacleaner.com/how-to-clean-a-motherboard?utm_source=pinterest&utm_campaign=safely-clean-your-mo,2025-05-19,Static electricity is a motherboard's worst enemy. This guide emphasizes the importance of static prevention during cleaning. We'll show you how to ground yourself and use anti-static tools to protect your valuable components. Don't risk frying your motherboard – learn the safe way to clean! Click to read the full guide.,"Static Electricity,Safety,Motherboard,PC Protection"
The Ultimate Motherboard Cleaning Checklist,https://res.cloudinary.com/dbcpfy04c/image/upload/v1747644947/pin_1_10_ksar98.webp,pc-maintenance-tips,,https://www.beacleaner.com/how-to-clean-a-motherboard?utm_source=pinterest&utm_campaign=the-ultimate-motherb,2025-05-19,"Don't miss a step! This guide provides a comprehensive checklist for cleaning your motherboard, ensuring you cover every area and use the right tools. From removing the CPU cooler to cleaning the RAM slots, we've got you covered. Click to download the checklist and make your cleaning process a breeze!","Checklist,Cleaning Guide,Motherboard,PC Maintenance"
Motherboard Cleaning Tools: What You Need,https://res.cloudinary.com/dbcpfy04c/image/upload/v1747644953/pin_1_11_dyrhdg.webp,pc-repair-tips,,https://www.beacleaner.com/how-to-clean-a-motherboard?utm_source=pinterest&utm_campaign=motherboard-cleaning,2025-05-19,"Confused about which tools to use? This guide breaks down the essential tools for cleaning your motherboard, from isopropyl alcohol to anti-static brushes. We'll help you choose the right products for a safe and effective cleaning. Click to learn what you need to get started!","Cleaning Tools,Isopropyl Alcohol,Motherboard,PC Supplies"
Fix Slow PC Performance: Clean Motherboard,https://res.cloudinary.com/dbcpfy04c/image/upload/v1747644960/pin_1_12_x4rh90.webp,computer-tips,,https://www.beacleaner.com/how-to-clean-a-motherboard?utm_source=pinterest&utm_campaign=fix-slow-pc-performa,2025-05-19,Is your PC sluggish? A dirty motherboard could be the reason. This guide shows you how to clean your motherboard and restore your computer's performance. Don't suffer through lag and crashes – learn how to fix the problem today! Click to read the full guide and enjoy a faster PC.,"Slow PC,Performance Boost,Motherboard,Computer Optimization"
Motherboard Cleaning: A Visual Guide,https://res.cloudinary.com/dbcpfy04c/image/upload/v1747644965/pin_1_13_jmmuph.webp,pc-repair-tips,,https://www.beacleaner.com/how-to-clean-a-motherboard?utm_source=pinterest&utm_campaign=motherboard-cleaning,2025-05-19,"Sometimes, seeing is believing! This guide features detailed photos and illustrations to guide you through the motherboard cleaning process. No more guesswork – just clear, concise instructions. Click to view the visual guide and learn how to clean your motherboard with confidence!","Visual Guide,Step-by-Step,Motherboard,PC Cleaning"
Deep Clean Your Motherboard: Pro Tips,https://res.cloudinary.com/dbcpfy04c/image/upload/v1747644973/pin_1_14_h9nxpn.webp,pc-cleaning-tips,,https://www.beacleaner.com/how-to-clean-a-motherboard?utm_source=pinterest&utm_campaign=deep-clean-your-moth,2025-05-19,"Take your motherboard cleaning to the next level with these pro tips! We'll share advanced techniques for removing stubborn dust and grime, ensuring a thorough and effective cleaning. Click to learn the secrets of the pros and keep your PC running at its best.","Pro Tips,Advanced Cleaning,Motherboard,PC Experts"
Motherboard Cleaning: Prevent Future Dust Buildup,https://res.cloudinary.com/dbcpfy04c/image/upload/v1747644979/pin_1_15_audnw5.webp,pc-repair-tips,,https://www.beacleaner.com/how-to-clean-a-motherboard?utm_source=pinterest&utm_campaign=motherboard-cleaning,2025-05-19,"Cleaning is great, but prevention is better! This guide offers tips on how to prevent dust buildup on your motherboard, reducing the frequency of cleaning and extending the lifespan of your components. Click to learn how to keep your PC clean and dust-free.","Dust Prevention,PC Care,Motherboard,Computer Hygiene"
Motherboard Cleaning: Is It Worth It?,https://res.cloudinary.com/dbcpfy04c/image/upload/v1747644985/pin_1_16_y4mn5x.webp,pc-repair-tips,,https://www.beacleaner.com/how-to-clean-a-motherboard?utm_source=pinterest&utm_campaign=motherboard-cleaning,2025-05-19,"Wondering if cleaning your motherboard is worth the effort? This guide explains the benefits of regular cleaning, from improved performance to increased longevity. We'll show you why it's a crucial part of PC maintenance. Click to learn why you should clean your motherboard today!","Worth It,Benefits,Motherboard,PC Value"
Motherboard Cleaning: Common Mistakes to Avoid,https://res.cloudinary.com/dbcpfy04c/image/upload/v1747644990/pin_1_17_j0slnk.webp,pc-repair-tips,,https://www.beacleaner.com/how-to-clean-a-motherboard?utm_source=pinterest&utm_campaign=motherboard-cleaning,2025-05-19,"Don't make these mistakes! This guide highlights common errors people make when cleaning their motherboard, and how to avoid them. Protect your valuable components and ensure a safe and effective cleaning. Click to learn from the mistakes of others!","Common Mistakes,Avoid Errors,Motherboard,PC Safety"
Motherboard Cleaning: For Gamers!,https://res.cloudinary.com/dbcpfy04c/image/upload/v1747644999/pin_1_18_pvlqgn.webp,pc-repair-tips,,https://www.beacleaner.com/how-to-clean-a-motherboard?utm_source=pinterest&utm_campaign=motherboard-cleaning,2025-05-19,"Gamers, don't let a dusty motherboard ruin your experience! This guide focuses on cleaning your motherboard to optimize performance for gaming. Reduce lag, prevent overheating, and enjoy smoother gameplay. Click to learn how to keep your gaming PC running at its peak!","Gaming PC,Performance,Motherboard,PC Gaming"
Motherboard Cleaning: For Workstations!,https://res.cloudinary.com/dbcpfy04c/image/upload/v1747645007/pin_1_19_l1ercx.webp,pc-repair-tips,,https://www.beacleaner.com/how-to-clean-a-motherboard?utm_source=pinterest&utm_campaign=motherboard-cleaning,2025-05-19,"Professionals, keep your workstation running smoothly! This guide shows you how to clean your motherboard to ensure reliable performance for demanding tasks. Don't let a dusty motherboard disrupt your workflow. Click to learn how to maintain a productive workstation!","Workstation,Productivity,Motherboard,PC Reliability"
Motherboard Cleaning: A Quick Guide,https://res.cloudinary.com/dbcpfy04c/image/upload/v1747645013/pin_1_20_n9z2kq.webp,pc-repair-tips,,https://www.beacleaner.com/how-to-clean-a-motherboard?utm_source=pinterest&utm_campaign=motherboard-cleaning,2025-05-19,Short on time? This guide provides a quick and easy walkthrough on how to clean your motherboard. Get back to what you love without spending hours on maintenance. Click to learn the essentials and keep your PC running smoothly!,"Quick Guide,Easy Cleaning,Motherboard,PC Speed"
Motherboard Cleaning: Troubleshooting Guide,https://res.cloudinary.com/dbcpfy04c/image/upload/v1747645018/pin_1_21_x1g6km.webp,pc-repair-tips,,https://www.beacleaner.com/how-to-clean-a-motherboard?utm_source=pinterest&utm_campaign=motherboard-cleaning,2025-05-19,"Having trouble cleaning your motherboard? This guide offers troubleshooting tips for common issues, such as stuck dust or difficult-to-reach areas. Get the help you need to clean your motherboard effectively. Click to find solutions to your cleaning challenges!","Troubleshooting,Help,Motherboard,PC Problems"
Motherboard Cleaning: The Right Isopropyl Alcohol,https://res.cloudinary.com/dbcpfy04c/image/upload/v1747645024/pin_1_22_sqsgwn.webp,pc-repair-tips,,https://www.beacleaner.com/how-to-clean-a-motherboard?utm_source=pinterest&utm_campaign=motherboard-cleaning,2025-05-19,Not all isopropyl alcohol is created equal! This guide explains the importance of using the correct concentration of isopropyl alcohol for cleaning your motherboard. Protect your components and ensure a safe and effective cleaning. Click to learn more!,"Isopropyl Alcohol,Concentration,Motherboard,PC Chemicals"
Motherboard Cleaning: Aftercare Tips,https://res.cloudinary.com/dbcpfy04c/image/upload/v1747645030/pin_1_23_upovr9.webp,pc-repair-tips,,https://www.beacleaner.com/how-to-clean-a-motherboard?utm_source=pinterest&utm_campaign=motherboard-cleaning,2025-05-19,"You've cleaned your motherboard – now what? This guide provides aftercare tips to keep your PC running smoothly and prevent future dust buildup. Extend the lifespan of your components and enjoy a clean, reliable computer. Click to learn the aftercare essentials!","Aftercare,Maintenance,Motherboard,PC Longevity"
Motherboard Cleaning: Don't Forget These Spots!,https://res.cloudinary.com/dbcpfy04c/image/upload/v1747645035/pin_1_24_iasigh.webp,pc-repair-tips,,https://www.beacleaner.com/how-to-clean-a-motherboard?utm_source=pinterest&utm_campaign=motherboard-cleaning,2025-05-19,Hidden dust traps! This guide highlights often-overlooked areas on your motherboard that accumulate dust. Ensure a thorough cleaning by paying attention to these key spots. Click to learn where to focus your efforts!,"Hidden Dust,Thorough Cleaning,Motherboard,PC Details"
Motherboard Cleaning: A Step-by-Step Photo Guide,https://res.cloudinary.com/dbcpfy04c/image/upload/v1747645041/pin_1_25_bizi82.webp,pc-repair-tips,,https://www.beacleaner.com/how-to-clean-a-motherboard?utm_source=pinterest&utm_campaign=motherboard-cleaning,2025-05-19,Follow along with our detailed photo guide! This pin links to a step-by-step visual tutorial on cleaning your motherboard. Perfect for visual learners and beginners. Click to see the process unfold!,"Photo Guide,Visual Tutorial,Motherboard,PC Beginners"
Title,https://res.cloudinary.com/dbcpfy04c/image/upload/v1747645088/pin_2_1_iwg2ql.webp,please-provide-the-title-and-keywords-i-need-that-information-to-suggest-a-board-name-once,,https://www.beacleaner.com/how-to-clean-a-pool-full-of-leaves?utm_source=pinterest&utm_campaign=title,2025-05-19,Description,Keywords
Leaf-Free Pool: Your Quick Guide,https://res.cloudinary.com/dbcpfy04c/image/upload/v1747645095/pin_2_2_qnbxxr.webp,pool-cleaning-tips,,https://www.beacleaner.com/how-to-clean-a-pool-full-of-leaves?utm_source=pinterest&utm_campaign=leaf-free-pool-your-,2025-05-19,"Is your pool looking more like a fall foliage display than a refreshing oasis? Don't let leaves ruin your summer fun! This guide breaks down exactly how to clean a pool full of leaves, from skimming to vacuuming, and even preventing future messes. We cover all pool types – inground, above ground, and even mesh safety covers. Reclaim your pool and enjoy crystal-clear water again! Click to learn the fastest, most effective methods. Don't spend your weekend scrubbing, spend it swimming!","Pool Cleaning,Leaf Removal,Pool Maintenance,Summer Fun"
Pool Covered in Leaves? SOS!,https://res.cloudinary.com/dbcpfy04c/image/upload/v1747645101/pin_2_3_qf9ekf.webp,pool-care-tips,,https://www.beacleaner.com/how-to-clean-a-pool-full-of-leaves?utm_source=pinterest&utm_campaign=pool-covered-in-leav,2025-05-19,"Ugh, the dreaded leaf-filled pool! It's a common problem, but not one you have to tackle alone. This post provides a step-by-step solution to get your pool sparkling clean, even after a major leaf drop. Learn about the best tools (leaf nets, vacuums, pumps) and how to use them efficiently. We'll help you avoid costly repairs and keep your pool healthy.  Don't let a messy pool stress you out – we've got you covered! Click to read now.","Leafy Pool,Pool Care,Cleaning Tips,Pool Problems"
Fastest Way to Clean Leaves From Pool,https://res.cloudinary.com/dbcpfy04c/image/upload/v1747645108/pin_2_4_hj7iwo.webp,pool-cleaning-tips,,https://www.beacleaner.com/how-to-clean-a-pool-full-of-leaves?utm_source=pinterest&utm_campaign=fastest-way-to-clean,2025-05-19,"Time is precious, especially during pool season! This blog post reveals the quickest and most efficient methods for removing leaves from your pool.  We compare manual skimming vs. automatic pool cleaners, and offer tips for dealing with stubborn debris.  Imagine diving into a pristine pool without spending hours cleaning.  Stop dreaming and start doing! Click to learn how.  Plus, learn preventative measures to minimize leaf buildup.","Quick Pool Clean,Pool Leaf Removal,Automatic Cleaners,Pool Time"
Pool Leaf Cleanup: A Beginner's Guide,https://res.cloudinary.com/dbcpfy04c/image/upload/v1747645114/pin_2_5_zag9iv.webp,pool-cleaning-tips,,https://www.beacleaner.com/how-to-clean-a-pool-full-of-leaves?utm_source=pinterest&utm_campaign=pool-leaf-cleanup-a-,2025-05-19,"New to pool ownership? Don't be intimidated by a pool full of leaves! This beginner-friendly guide walks you through the entire process, from gathering supplies to finishing touches. We explain everything in simple terms, so you can confidently tackle this common pool maintenance task.  Enjoy a beautiful, inviting pool without the overwhelm. Click to learn more and become a pool pro!","Pool Beginners,Pool Cleaning Guide,Leaf Cleanup,Pool Ownership"
Save Your Pool From Leaf Overload!,https://res.cloudinary.com/dbcpfy04c/image/upload/v1747645123/pin_2_6_nvfccb.webp,pool-care-tips,,https://www.beacleaner.com/how-to-clean-a-pool-full-of-leaves?utm_source=pinterest&utm_campaign=save-your-pool-from-,2025-05-19,"Don't let falling leaves turn your pool into a swamp! This post offers practical advice on how to prevent and clean up leaf debris. We discuss the importance of pool covers, regular skimming, and proper filtration.  Protect your investment and keep your pool looking its best.  A clean pool is a happy pool! Click to discover our expert tips.","Pool Protection,Leaf Prevention,Pool Covers,Pool Filtration"
DIY Pool Leaf Removal: Save Money!,https://res.cloudinary.com/dbcpfy04c/image/upload/v1747645130/pin_2_7_hbi5ik.webp,pool-cleaning-tips,,https://www.beacleaner.com/how-to-clean-a-pool-full-of-leaves?utm_source=pinterest&utm_campaign=diy-pool-leaf-remova,2025-05-19,"Skip the expensive pool service and learn how to clean leaves from your pool yourself! This post provides a detailed, step-by-step guide to DIY leaf removal, using tools you likely already have.  Save money and enjoy the satisfaction of a job well done.  We'll show you how to get professional results without the professional price tag. Click to learn more!","DIY Pool Cleaning,Save Money,Leaf Removal,Pool Maintenance"
Above Ground Pool Leaf Cleanup Tips,https://res.cloudinary.com/dbcpfy04c/image/upload/v1747645136/pin_2_8_yclrhv.webp,pool-care-tips,,https://www.beacleaner.com/how-to-clean-a-pool-full-of-leaves?utm_source=pinterest&utm_campaign=above-ground-pool-le,2025-05-19,"Above ground pools require a little extra care when it comes to leaf removal. This post focuses specifically on cleaning leaves from above ground pools, offering tailored advice and techniques.  We'll help you navigate the unique challenges and keep your pool sparkling clean.  Don't let leaves ruin your above ground pool experience! Click to read now.","Above Ground Pool,Leaf Removal,Pool Care,Pool Cleaning"
Inground Pool Leaf Cleaning Secrets,https://res.cloudinary.com/dbcpfy04c/image/upload/v1747645146/pin_2_9_rk7juj.webp,pool-cleaning-tips,,https://www.beacleaner.com/how-to-clean-a-pool-full-of-leaves?utm_source=pinterest&utm_campaign=inground-pool-leaf-c,2025-05-19,"Inground pools can get overwhelmed with leaves quickly. This post reveals the secrets to effectively cleaning leaves from inground pools, including the best tools and techniques for different pool surfaces.  We'll help you maintain a pristine pool environment.  Enjoy a luxurious swimming experience without the hassle of leaf cleanup! Click to learn more.","Inground Pool,Pool Cleaning,Leaf Removal,Pool Secrets"
Mesh Pool Cover & Leaf Removal: A Guide,https://res.cloudinary.com/dbcpfy04c/image/upload/v1747645153/pin_2_10_pbvpbk.webp,pool-care-tips,,https://www.beacleaner.com/how-to-clean-a-pool-full-of-leaves?utm_source=pinterest&utm_campaign=mesh-pool-cover-leaf,2025-05-19,"Using a mesh pool cover is a great first step in preventing leaf buildup, but it still requires cleaning! This post explains how to effectively remove leaves from a mesh pool cover and maintain a clean pool underneath.  We'll help you maximize the benefits of your pool cover.  Protect your pool and simplify your cleaning routine! Click to read now.","Mesh Pool Cover,Leaf Removal,Pool Cover,Pool Maintenance"
Pool Vacuum for Leaves: Which One?,https://res.cloudinary.com/dbcpfy04c/image/upload/v1747645160/pin_2_11_rnqyes.webp,pool-cleaning-tips,,https://www.beacleaner.com/how-to-clean-a-pool-full-of-leaves?utm_source=pinterest&utm_campaign=pool-vacuum-for-leav,2025-05-19,"Struggling to vacuum leaves from your pool? This post compares different types of pool vacuums – manual, automatic, and robotic – and helps you choose the best one for your needs.  We'll help you find the perfect vacuum to tackle even the most stubborn leaf debris.  Say goodbye to endless scrubbing! Click to learn more.","Pool Vacuum,Leaf Vacuum,Automatic Cleaner,Pool Equipment"
Leaf Net vs. Skimmer: Which is Best?,https://res.cloudinary.com/dbcpfy04c/image/upload/v1747645166/pin_2_12_jdz9ef.webp,pool-cleaning-tips,,https://www.beacleaner.com/how-to-clean-a-pool-full-of-leaves?utm_source=pinterest&utm_campaign=leaf-net-vs-skimmer-,2025-05-19,"Confused about which tool to use for leaf removal? This post breaks down the pros and cons of leaf nets and skimmers, helping you choose the best option for your pool.  We'll help you streamline your cleaning process and achieve sparkling results.  Don't waste time with the wrong tools! Click to read now.","Leaf Net,Pool Skimmer,Pool Tools,Cleaning Comparison"
Prevent Leaves in Your Pool: Pro Tips,https://res.cloudinary.com/dbcpfy04c/image/upload/v1747645172/pin_2_13_vystgq.webp,pool-care-tips,,https://www.beacleaner.com/how-to-clean-a-pool-full-of-leaves?utm_source=pinterest&utm_campaign=prevent-leaves-in-yo,2025-05-19,"Don't just react to leaves, prevent them! This post offers proactive tips for minimizing leaf buildup in your pool, including landscaping strategies and preventative maintenance.  Save time and effort by keeping leaves out of your pool in the first place.  Enjoy a cleaner pool with less work! Click to learn more.","Leaf Prevention,Pool Maintenance,Landscaping,Pro Tips"
Pool Filter & Leaf Removal: The Connection,https://res.cloudinary.com/dbcpfy04c/image/upload/v1747645179/pin_2_14_uyv3to.webp,pool-care-tips,,https://www.beacleaner.com/how-to-clean-a-pool-full-of-leaves?utm_source=pinterest&utm_campaign=pool-filter-leaf-rem,2025-05-19,Your pool filter plays a crucial role in removing leaves and debris. This post explains how your filter works and how to optimize it for leaf removal.  We'll help you keep your filter running efficiently and prevent clogs.  A healthy filter means a cleaner pool! Click to read now.,"Pool Filter,Leaf Removal,Filter Maintenance,Pool Health"
Fall Pool Cleanup: Get Ready for Winter,https://res.cloudinary.com/dbcpfy04c/image/upload/v1747645185/pin_2_15_nc77zt.webp,pool-care-tips,,https://www.beacleaner.com/how-to-clean-a-pool-full-of-leaves?utm_source=pinterest&utm_campaign=fall-pool-cleanup-ge,2025-05-19,"Fall is a beautiful time of year, but it also means a lot of falling leaves! This post provides a comprehensive guide to fall pool cleanup, preparing your pool for winter.  We'll help you protect your investment and ensure a smooth opening next spring.  Don't skip this important step! Click to learn more.","Fall Pool Cleanup,Winterizing Pool,Leaf Removal,Pool Preparation"
Pool Leaf Removal: Before & After!,https://res.cloudinary.com/dbcpfy04c/image/upload/v1747645193/pin_2_16_sdzkll.webp,pool-cleaning-tips,,https://www.beacleaner.com/how-to-clean-a-pool-full-of-leaves?utm_source=pinterest&utm_campaign=pool-leaf-removal-be,2025-05-19,See the dramatic difference a good leaf removal can make! This post features before-and-after photos showcasing the power of our cleaning techniques.  Get inspired and motivated to tackle your own leaf-filled pool.  Imagine diving into a sparkling clean oasis! Click to see the transformation.,"Before & After,Pool Cleaning,Leaf Removal,Pool Transformation"
