Title,Media URL,Pinterest board,Thumbnail,Description,Link,Publish date,Keywords,Source URL
Title,https://res.cloudinary.com/dbcpfy04c/image/upload/v1745836980/pin_1_1_knfrov.webp,please-provide-the-title-and-keywords-i-need-that-information-to-suggest-a-board-name-once,,Description,https://lawntrend.com/husqvarna-zero-turn-one-side-not-working-troubleshooting-guide/?utm_source=pinterest&utm_campaign=title,2025-04-28,Keywords,https://lawntrend.com/husqvarna-zero-turn-one-side-not-working-troubleshooting-guide/
Husqvarna Zero Turn: One Side Not Moving?,https://res.cloudinary.com/dbcpfy04c/image/upload/v1745836986/pin_1_2_iuxwyz.webp,lawn-repair-ideas,,Is your Husqvarna zero turn refusing to cooperate? Don't let a frustrating mowing experience ruin your weekend! This guide dives deep into troubleshooting why one side isn't working,https://lawntrend.com/husqvarna-zero-turn-one-side-not-working-troubleshooting-guide/?utm_source=pinterest&utm_campaign=husqvarna-zero-turn-,2025-04-28,from simple fixes like checking the drive belt to more complex hydraulic issues. We'll help you diagnose the problem quickly and get back to enjoying a perfectly manicured lawn. Save time & money - DIY repair is possible! Click to learn more and reclaim your yard! #Husqvarna #ZeroTurn #LawnMower #DIYRepair,https://lawntrend.com/husqvarna-zero-turn-one-side-not-working-troubleshooting-guide/
Husqvarna Zero Turn Troubleshooting,https://res.cloudinary.com/dbcpfy04c/image/upload/v1745836992/pin_1_3_xinfyz.webp,lawn-repair-ideas,,"Don't panic! A Husqvarna zero turn with one side not working can be fixed. This guide provides a step-by-step approach to diagnosing common issues, including belt problems, hydraulic leaks",https://lawntrend.com/husqvarna-zero-turn-one-side-not-working-troubleshooting-guide/?utm_source=pinterest&utm_campaign=husqvarna-zero-turn-,2025-04-28,and deck engagement issues.  We'll empower you to tackle the repair yourself and avoid costly mechanic bills.  Get your lawn looking pristine again! Learn how now! #ZeroTurnMower #HusqvarnaRepair #LawnCare #Troubleshooting,https://lawntrend.com/husqvarna-zero-turn-one-side-not-working-troubleshooting-guide/
Fix a Stuck Zero Turn - Fast!,https://res.cloudinary.com/dbcpfy04c/image/upload/v1745836997/pin_1_4_mq6uwd.webp,lawn-repair-ideas,,Is your Husqvarna zero turn stuck in place? One side not responding?  This guide is your lifeline! We break down the most common reasons for this frustrating problem,https://lawntrend.com/husqvarna-zero-turn-one-side-not-working-troubleshooting-guide/?utm_source=pinterest&utm_campaign=fix-a-stuck-zero-tur,2025-04-28,offering clear instructions and helpful visuals.  Don't waste another sunny day struggling with your mower.  Click to learn how to get moving again! #HusqvarnaZeroTurn #ZeroTurnRepair #LawnMaintenance #DIY,https://lawntrend.com/husqvarna-zero-turn-one-side-not-working-troubleshooting-guide/
Husqvarna Drive Belt Issues?,https://res.cloudinary.com/dbcpfy04c/image/upload/v1745837003/pin_1_5_pgohst.webp,lawn-repair-ideas,,"A broken or worn drive belt is a frequent culprit when a Husqvarna zero turn only moves on one side. This guide shows you how to inspect, replace",https://lawntrend.com/husqvarna-zero-turn-one-side-not-working-troubleshooting-guide/?utm_source=pinterest&utm_campaign=husqvarna-drive-belt,2025-04-28,and tension your drive belt correctly.  Avoid getting stranded mid-mow!  We'll help you keep your mower running smoothly. Click to learn more! #DriveBelt #Husqvarna #ZeroTurnMaintenance #LawnRepair,https://lawntrend.com/husqvarna-zero-turn-one-side-not-working-troubleshooting-guide/
Hydraulic Problems? Zero Turn Help,https://res.cloudinary.com/dbcpfy04c/image/upload/v1745837009/pin_1_6_gklxhs.webp,lawn-care-ideas,,"Suspect a hydraulic issue with your Husqvarna zero turn?  One side not moving is a classic sign.  This guide explains how to check hydraulic fluid levels, identify leaks",https://lawntrend.com/husqvarna-zero-turn-one-side-not-working-troubleshooting-guide/?utm_source=pinterest&utm_campaign=hydraulic-problems-z,2025-04-28,and understand the basics of the hydraulic system.  Don't let hydraulic problems stop you! Learn how to diagnose and potentially fix it yourself. #HydraulicRepair #ZeroTurn #Husqvarna #LawnCareTips,https://lawntrend.com/husqvarna-zero-turn-one-side-not-working-troubleshooting-guide/
Zero Turn Deck Engagement Issues,https://res.cloudinary.com/dbcpfy04c/image/upload/v1745837016/pin_1_7_og8peh.webp,lawn-repair-ideas,,"Is your Husqvarna zero turn's deck not engaging properly on one side? This can cause uneven cutting and frustration.  Our guide walks you through checking the engagement cables, linkages",https://lawntrend.com/husqvarna-zero-turn-one-side-not-working-troubleshooting-guide/?utm_source=pinterest&utm_campaign=zero-turn-deck-engag,2025-04-28,and PTO clutch.  Get a professional-quality cut every time! Click to learn how. #DeckEngagement #HusqvarnaZeroTurn #LawnMowing #RepairGuide,https://lawntrend.com/husqvarna-zero-turn-one-side-not-working-troubleshooting-guide/
Husqvarna Zero Turn Won't Start?,https://res.cloudinary.com/dbcpfy04c/image/upload/v1745837021/pin_1_8_psg5dl.webp,lawn-repair-ideas,,"While not directly one-side movement, starting issues can *seem* that way. This guide covers common starting problems with Husqvarna zero turns, including battery issues, fuel problems",https://lawntrend.com/husqvarna-zero-turn-one-side-not-working-troubleshooting-guide/?utm_source=pinterest&utm_campaign=husqvarna-zero-turn-,2025-04-28,and safety switch malfunctions.  Don't let a dead battery ruin your day! Learn how to get your mower started. #Husqvarna #ZeroTurn #StartingProblems #LawnMowerRepair,https://lawntrend.com/husqvarna-zero-turn-one-side-not-working-troubleshooting-guide/
Easy Husqvarna Zero Turn Checks,https://res.cloudinary.com/dbcpfy04c/image/upload/v1745837027/pin_1_9_nzimyd.webp,lawn-care-ideas,,"Before diving into complex repairs, start with these simple checks! This guide outlines quick inspections for loose connections, debris buildup",https://lawntrend.com/husqvarna-zero-turn-one-side-not-working-troubleshooting-guide/?utm_source=pinterest&utm_campaign=easy-husqvarna-zero-,2025-04-28,and obvious damage.  You might be surprised how often a simple fix solves the problem.  Save time and frustration! Click to learn more. #ZeroTurnMaintenance #Husqvarna #LawnCare #QuickFix,https://lawntrend.com/husqvarna-zero-turn-one-side-not-working-troubleshooting-guide/
Husqvarna Zero Turn Safety First!,https://res.cloudinary.com/dbcpfy04c/image/upload/v1745837032/pin_1_10_kbonas.webp,lawn-repair-ideas,,"Working on a zero turn mower can be dangerous. This guide emphasizes essential safety precautions, including disconnecting the spark plug, wearing gloves",https://lawntrend.com/husqvarna-zero-turn-one-side-not-working-troubleshooting-guide/?utm_source=pinterest&utm_campaign=husqvarna-zero-turn-,2025-04-28,and using proper lifting techniques.  Protect yourself while you repair!  Safety is our top priority. #ZeroTurnSafety #HusqvarnaRepair #LawnMowerSafety #DIY,https://lawntrend.com/husqvarna-zero-turn-one-side-not-working-troubleshooting-guide/
Troubleshooting Hydraulic Leaks,https://res.cloudinary.com/dbcpfy04c/image/upload/v1745837038/pin_1_11_udrqd0.webp,lawn-repair-ideas,,Hydraulic leaks are a common cause of one-sided movement in Husqvarna zero turns. This guide shows you how to locate and identify different types of leaks,https://lawntrend.com/husqvarna-zero-turn-one-side-not-working-troubleshooting-guide/?utm_source=pinterest&utm_campaign=troubleshooting-hydr,2025-04-28,and offers advice on whether you can repair them yourself.  Don't ignore those drips! Learn how to address them. #HydraulicLeak #ZeroTurnRepair #Husqvarna #LawnCare,https://lawntrend.com/husqvarna-zero-turn-one-side-not-working-troubleshooting-guide/
Zero Turn Mower Maintenance Tips,https://res.cloudinary.com/dbcpfy04c/image/upload/v1745837044/pin_1_12_fqwnn7.webp,lawn-care-ideas,,"Preventative maintenance is key to avoiding breakdowns. This guide offers essential maintenance tips for your Husqvarna zero turn, including regular cleaning, lubrication",https://lawntrend.com/husqvarna-zero-turn-one-side-not-working-troubleshooting-guide/?utm_source=pinterest&utm_campaign=zero-turn-mower-main,2025-04-28,and inspection.  Keep your mower running like new!  Invest in preventative care. #ZeroTurnMaintenance #Husqvarna #LawnCareTips #PreventativeMaintenance,https://lawntrend.com/husqvarna-zero-turn-one-side-not-working-troubleshooting-guide/
Husqvarna Zero Turn: Common Problems,https://res.cloudinary.com/dbcpfy04c/image/upload/v1745837051/pin_1_13_t49fj8.webp,lawn-repair-ideas,,"Discover the most common problems that plague Husqvarna zero turns, including one-side movement issues, starting problems",https://lawntrend.com/husqvarna-zero-turn-one-side-not-working-troubleshooting-guide/?utm_source=pinterest&utm_campaign=husqvarna-zero-turn-,2025-04-28,and deck engagement failures.  Be prepared for potential issues and learn how to address them.  Knowledge is power! #Husqvarna #ZeroTurn #CommonProblems #LawnMower,https://lawntrend.com/husqvarna-zero-turn-one-side-not-working-troubleshooting-guide/
Zero Turn Blade Engagement Fix,https://res.cloudinary.com/dbcpfy04c/image/upload/v1745837057/pin_1_14_y6qhhb.webp,lawn-repair-ideas,,"If your Husqvarna zero turn blades aren't engaging on one side, this guide is for you! We cover the common causes and provide clear instructions for fixing the problem.  Get a clean",https://lawntrend.com/husqvarna-zero-turn-one-side-not-working-troubleshooting-guide/?utm_source=pinterest&utm_campaign=zero-turn-blade-enga,2025-04-28,even cut every time! Click to learn more. #BladeEngagement #HusqvarnaZeroTurn #LawnMowing #Repair,https://lawntrend.com/husqvarna-zero-turn-one-side-not-working-troubleshooting-guide/
Zero Turn Mower: When to Call a Pro,https://res.cloudinary.com/dbcpfy04c/image/upload/v1745837064/pin_1_15_s7yvaa.webp,lawn-care-ideas,,Sometimes,https://lawntrend.com/husqvarna-zero-turn-one-side-not-working-troubleshooting-guide/?utm_source=pinterest&utm_campaign=zero-turn-mower-when,2025-04-28,a repair is best left to the professionals. This guide helps you determine when it's time to call a qualified mechanic for your Husqvarna zero turn.  Don't risk making the problem worse! #ZeroTurnRepair #Husqvarna #LawnCare #ProfessionalHelp,https://lawntrend.com/husqvarna-zero-turn-one-side-not-working-troubleshooting-guide/
Troubleshooting a Weak Zero Turn,https://res.cloudinary.com/dbcpfy04c/image/upload/v1745837069/pin_1_16_qv0fuj.webp,lawn-repair-ideas,,"Is your Husqvarna zero turn moving, but lacking power on one side? This guide explores potential causes",https://lawntrend.com/husqvarna-zero-turn-one-side-not-working-troubleshooting-guide/?utm_source=pinterest&utm_campaign=troubleshooting-a-we,2025-04-28,such as low hydraulic fluid or a partially clogged filter.  Don't ignore a loss of power! Learn how to diagnose it. #ZeroTurnPower #Husqvarna #LawnCare #Troubleshooting,https://lawntrend.com/husqvarna-zero-turn-one-side-not-working-troubleshooting-guide/
Title,https://res.cloudinary.com/dbcpfy04c/image/upload/v1745838329/pin_1_1_bcaosp.webp,please-provide-the-title-and-keywords-i-need-that-information-to-suggest-a-board-name-once,,Description,https://lawntrend.com/gravely-zt-hd-zero-turn-mower-troubleshoot-guide/?utm_source=pinterest&utm_campaign=title,2025-04-28,Keywords,https://lawntrend.com/gravely-zt-hd-zero-turn-mower-troubleshoot-guide/
Gravely ZT HD Troubleshooting: Quick Fixes!,https://res.cloudinary.com/dbcpfy04c/image/upload/v1745838336/pin_1_2_vob9h9.webp,lawn-repair-ideas,,"Is your Gravely ZT HD zero-turn mower giving you headaches? Don't let lawn care be a struggle! This guide tackles common issues like starting problems, uneven cuts, and blade engagement failures. We break down troubleshooting steps even a beginner can follow, saving you time & money on repairs.  Get back to enjoying your perfectly manicured lawn! Click to learn how to diagnose & fix your mower quickly.  Don't delay, a beautiful lawn awaits! #Gravely #ZeroTurnMower #LawnCare #MowerRepair,Gravely,Zero Turn,Troubleshooting",https://lawntrend.com/gravely-zt-hd-zero-turn-mower-troubleshoot-guide/?utm_source=pinterest&utm_campaign=gravely-zt-hd-troubl,2025-04-28,Repair,https://lawntrend.com/gravely-zt-hd-zero-turn-mower-troubleshoot-guide/
ZT HD Won't Start? Diagnose It Now!,https://res.cloudinary.com/dbcpfy04c/image/upload/v1745838342/pin_1_3_dolbrc.webp,small-engine-ideas,,"Frustrated with a Gravely ZT HD that refuses to start?  Before calling a repair shop, check these simple solutions! We cover everything from fuel issues and battery problems to safety switch malfunctions.  This guide empowers you to identify the root cause and get your mower running smoothly again.  Avoid the expense of professional service and reclaim your weekend! Click to read the full troubleshooting guide. #GravelyZT #ZeroTurn #MowerProblems #DIYRepair,Starting Issues,Gravely,Zero Turn",https://lawntrend.com/gravely-zt-hd-zero-turn-mower-troubleshoot-guide/?utm_source=pinterest&utm_campaign=zt-hd-wont-start-dia,2025-04-28,Battery,https://lawntrend.com/gravely-zt-hd-zero-turn-mower-troubleshoot-guide/
Uneven Cut? Gravely ZT HD Blade Fixes,https://res.cloudinary.com/dbcpfy04c/image/upload/v1745838349/pin_1_4_nm9tto.webp,lawn-care-ideas,,"An uneven cut is frustrating! This guide dives into the reasons why your Gravely ZT HD might be leaving streaks. We cover blade sharpening, deck leveling, tire pressure, and more.  Achieve a professional-looking lawn without the professional price tag.  Don't settle for less than perfection – a lush, even lawn is within reach! Click to learn how to fix it. #GravelyMower #LawnStripes #BladeSharpening #DeckLeveling,Blade Adjustment,Uneven Cut,Gravely",https://lawntrend.com/gravely-zt-hd-zero-turn-mower-troubleshoot-guide/?utm_source=pinterest&utm_campaign=uneven-cut-gravely-z,2025-04-28,Deck Leveling,https://lawntrend.com/gravely-zt-hd-zero-turn-mower-troubleshoot-guide/
Gravely ZT HD: Fuel System Troubleshooting,https://res.cloudinary.com/dbcpfy04c/image/upload/v1745838355/pin_1_5_g5c2vk.webp,lawn-mower-ideas,,"Is your Gravely ZT HD experiencing fuel delivery problems?  This guide provides a step-by-step approach to diagnosing and resolving issues with the fuel filter, fuel lines, and carburetor.  Don't let a clogged fuel system ruin your mowing experience.  Keep your mower running efficiently and powerfully! Click to learn more and get back to mowing. #FuelSystem #GravelyRepair #ZeroTurnLife #MowerMaintenance,Fuel Filter,Carburetor,Gravely",https://lawntrend.com/gravely-zt-hd-zero-turn-mower-troubleshoot-guide/?utm_source=pinterest&utm_campaign=gravely-zt-hd-fuel-s,2025-04-28,Fuel System,https://lawntrend.com/gravely-zt-hd-zero-turn-mower-troubleshoot-guide/
ZT HD Safety Switch Issues? We Can Help!,https://res.cloudinary.com/dbcpfy04c/image/upload/v1745838362/pin_1_6_rckiyu.webp,electrical-ideas,,"Safety first!  If your Gravely ZT HD won't engage due to a safety switch, this guide is for you. We explain how to test and potentially repair common safety switch failures.  Don't risk injury – ensure your mower is operating safely.  Click to learn how to troubleshoot and get mowing with peace of mind. #SafetyFirst #GravelyZT #MowerSafety #ZeroTurn,Safety Switch,Gravely,Zero Turn",https://lawntrend.com/gravely-zt-hd-zero-turn-mower-troubleshoot-guide/?utm_source=pinterest&utm_campaign=zt-hd-safety-switch-,2025-04-28,Safety,https://lawntrend.com/gravely-zt-hd-zero-turn-mower-troubleshoot-guide/
Gravely ZT HD: Belt Replacement Guide,https://res.cloudinary.com/dbcpfy04c/image/upload/v1745838368/pin_1_7_et6lm4.webp,lawn-mower-ideas,,"A worn or broken belt can bring your Gravely ZT HD to a halt. This guide walks you through the process of replacing the mower deck belt and other drive belts.  Save money on repair costs and keep your mower running smoothly.  Don't let a broken belt ruin your day! Click to learn how. #BeltReplacement #GravelyMower #DIYMowerRepair #ZeroTurnBelt,Belt Replacement,Gravely,Zero Turn",https://lawntrend.com/gravely-zt-hd-zero-turn-mower-troubleshoot-guide/?utm_source=pinterest&utm_campaign=gravely-zt-hd-belt-r,2025-04-28,Drive Belt,https://lawntrend.com/gravely-zt-hd-zero-turn-mower-troubleshoot-guide/
Troubleshooting Gravely ZT HD Hydrostatic,https://res.cloudinary.com/dbcpfy04c/image/upload/v1745838375/pin_1_8_jpmwbb.webp,mower-repair-ideas,,"Hydrostatic issues causing slow movement or no movement? This guide helps you diagnose problems with the hydrostatic transmission in your Gravely ZT HD.  We cover common causes and potential solutions.  Get your mower moving again and tackle your lawn with ease! Click to read the full guide. #HydrostaticTransmission #GravelyRepair #ZeroTurnProblems #MowerFix,Hydrostatic,Gravely,Zero Turn",https://lawntrend.com/gravely-zt-hd-zero-turn-mower-troubleshoot-guide/?utm_source=pinterest&utm_campaign=troubleshooting-grav,2025-04-28,Transmission,https://lawntrend.com/gravely-zt-hd-zero-turn-mower-troubleshoot-guide/
Gravely ZT HD: Electrical System Diagnosis,https://res.cloudinary.com/dbcpfy04c/image/upload/v1745838381/pin_1_9_merv3t.webp,lawn-mower-ideas,,"Electrical problems can be tricky. This guide provides a systematic approach to diagnosing issues with the electrical system of your Gravely ZT HD.  From wiring to solenoids, we've got you covered.  Don't be intimidated – we make it easy to understand! Click to learn more. #ElectricalRepair #GravelyZT #ZeroTurnElectrical #MowerWiring,Electrical System,Gravely,Zero Turn",https://lawntrend.com/gravely-zt-hd-zero-turn-mower-troubleshoot-guide/?utm_source=pinterest&utm_campaign=gravely-zt-hd-electr,2025-04-28,Wiring,https://lawntrend.com/gravely-zt-hd-zero-turn-mower-troubleshoot-guide/
ZT HD Mower Deck Maintenance Tips,https://res.cloudinary.com/dbcpfy04c/image/upload/v1618237451/placeholder.jpg,home-inspiration,,"Keep your Gravely ZT HD mower deck in top condition with these essential maintenance tips.  We cover cleaning, scraping, and preventing rust.  A well-maintained deck ensures a clean cut and extends the life of your mower.  Invest a little time and reap the rewards! Click to learn more. #MowerDeck #GravelyMaintenance #LawnCareTips #ZeroTurnDeck,Mower Deck,Gravely,Zero Turn",https://lawntrend.com/gravely-zt-hd-zero-turn-mower-troubleshoot-guide/?utm_source=pinterest&utm_campaign=zt-hd-mower-deck-mai,2025-04-28,Maintenance,https://lawntrend.com/gravely-zt-hd-zero-turn-mower-troubleshoot-guide/
Gravely ZT HD: Starting System Explained,https://res.cloudinary.com/dbcpfy04c/image/upload/v1745838389/pin_1_11_fl7cg1.webp,lawn-mower-ideas,,"Understand the starting system of your Gravely ZT HD. This guide breaks down the components and how they work together.  Learn how to diagnose and fix common starting problems.  Don't get stuck with a mower that won't start – be prepared! Click to read the full guide. #StartingSystem #GravelyZT #ZeroTurnEngine #MowerEngine,Starting System,Gravely,Zero Turn",https://lawntrend.com/gravely-zt-hd-zero-turn-mower-troubleshoot-guide/?utm_source=pinterest&utm_campaign=gravely-zt-hd-starti,2025-04-28,Engine,https://lawntrend.com/gravely-zt-hd-zero-turn-mower-troubleshoot-guide/
Fixing a Gravely ZT HD That Vibrates!,https://res.cloudinary.com/dbcpfy04c/image/upload/v1745838396/pin_1_12_w1spli.webp,lawn-mower-ideas,,"Excessive vibration can indicate a serious problem. This guide helps you identify the causes of vibration in your Gravely ZT HD, from loose parts to blade imbalances.  Don't ignore the warning signs – address the issue before it gets worse! Click to learn how. #MowerVibration #GravelyRepair #ZeroTurnFix #LawnMower,Vibration,Gravely,Zero Turn",https://lawntrend.com/gravely-zt-hd-zero-turn-mower-troubleshoot-guide/?utm_source=pinterest&utm_campaign=fixing-a-gravely-zt-,2025-04-28,Blade Balance,https://lawntrend.com/gravely-zt-hd-zero-turn-mower-troubleshoot-guide/
Gravely ZT HD: Oil Change Guide (Step-by-Step),https://res.cloudinary.com/dbcpfy04c/image/upload/v1745838402/pin_1_13_fkajfa.webp,lawn-mower-ideas,,"Regular oil changes are crucial for engine longevity. This guide provides a step-by-step process for changing the oil in your Gravely ZT HD.  Keep your engine running smoothly and protect your investment.  Don't skip this essential maintenance task! Click to learn more. #OilChange #GravelyMaintenance #ZeroTurnEngine #MowerOil,Oil Change,Gravely,Zero Turn",https://lawntrend.com/gravely-zt-hd-zero-turn-mower-troubleshoot-guide/?utm_source=pinterest&utm_campaign=gravely-zt-hd-oil-ch,2025-04-28,Engine Oil,https://lawntrend.com/gravely-zt-hd-zero-turn-mower-troubleshoot-guide/
ZT HD: Diagnosing Low Power Issues,https://res.cloudinary.com/dbcpfy04c/image/upload/v1745838409/pin_1_14_nrua4o.webp,auto-repair-ideas,,"Is your Gravely ZT HD lacking power? This guide helps you diagnose the causes of low power, from air filter issues to fuel problems.  Get your mower back to its full potential and tackle even the toughest grass.  Click to learn how to restore your mower's power. #LowPower #GravelyZT #ZeroTurnPerformance #MowerPower,Low Power,Gravely,Zero Turn",https://lawntrend.com/gravely-zt-hd-zero-turn-mower-troubleshoot-guide/?utm_source=pinterest&utm_campaign=zt-hd-diagnosing-low,2025-04-28,Engine Performance,https://lawntrend.com/gravely-zt-hd-zero-turn-mower-troubleshoot-guide/
Gravely ZT HD: Tire Pressure & Handling,https://res.cloudinary.com/dbcpfy04c/image/upload/v1745838414/pin_1_15_nqtxac.webp,lawn-mower-ideas,,"Proper tire pressure is essential for optimal handling and a clean cut. This guide explains how to check and adjust the tire pressure on your Gravely ZT HD.  Improve your mowing experience and protect your lawn. Click to learn more. #TirePressure #GravelyZT #ZeroTurnHandling #LawnMowerTires,Tire Pressure,Gravely,Zero Turn",https://lawntrend.com/gravely-zt-hd-zero-turn-mower-troubleshoot-guide/?utm_source=pinterest&utm_campaign=gravely-zt-hd-tire-p,2025-04-28,Handling,https://lawntrend.com/gravely-zt-hd-zero-turn-mower-troubleshoot-guide/
ZT HD: Cooling System Troubleshooting,https://res.cloudinary.com/dbcpfy04c/image/upload/v1745838422/pin_1_16_xqsrbk.webp,auto-repair-ideas,,"Overheating can damage your engine. This guide helps you diagnose and resolve cooling system issues in your Gravely ZT HD.  Keep your engine running cool and prevent costly repairs.  Click to learn how to protect your mower. #CoolingSystem #GravelyRepair #ZeroTurnEngine #MowerCooling,Cooling System,Gravely,Zero Turn",https://lawntrend.com/gravely-zt-hd-zero-turn-mower-troubleshoot-guide/?utm_source=pinterest&utm_campaign=zt-hd-cooling-system,2025-04-28,Engine Cooling,https://lawntrend.com/gravely-zt-hd-zero-turn-mower-troubleshoot-guide/
Gravely ZT HD: Clutch Engagement Problems,https://res.cloudinary.com/dbcpfy04c/image/upload/v1745838429/pin_1_17_sg7szi.webp,lawn-mower-ideas,,"Struggling with clutch engagement? This guide provides troubleshooting steps for common clutch issues in your Gravely ZT HD.  Get your blades spinning and start mowing with confidence.  Click to learn how to fix it. #ClutchEngagement #GravelyZT #ZeroTurnClutch #MowerClutch,Clutch,Gravely,Zero Turn",https://lawntrend.com/gravely-zt-hd-zero-turn-mower-troubleshoot-guide/?utm_source=pinterest&utm_campaign=gravely-zt-hd-clutch,2025-04-28,Blade Engagement,https://lawntrend.com/gravely-zt-hd-zero-turn-mower-troubleshoot-guide/
ZT HD: Cleaning & Storage Best Practices,https://res.cloudinary.com/dbcpfy04c/image/upload/v1745838435/pin_1_18_bjlbgv.webp,cleaning-ideas,,"Proper cleaning and storage are essential for extending the life of your Gravely ZT HD. This guide provides best practices for preparing your mower for storage and keeping it in top condition.  Protect your investment and ensure years of reliable service. Click to learn more. #MowerStorage #GravelyMaintenance #ZeroTurnCare #LawnMower,Storage,Gravely,Zero Turn",https://lawntrend.com/gravely-zt-hd-zero-turn-mower-troubleshoot-guide/?utm_source=pinterest&utm_campaign=zt-hd-cleaning-stora,2025-04-28,Cleaning,https://lawntrend.com/gravely-zt-hd-zero-turn-mower-troubleshoot-guide/
Gravely ZT HD: Identifying Strange Noises,https://res.cloudinary.com/dbcpfy04c/image/upload/v1745838441/pin_1_19_ed8zjb.webp,lawn-mower-ideas,,"Hearing strange noises from your Gravely ZT HD? This guide helps you identify common sounds and their potential causes.  Address issues early to prevent more serious problems.  Click to learn how to diagnose the noise. #MowerNoises #GravelyRepair #ZeroTurnSounds #LawnMowerSounds,Noise,Gravely,Zero Turn",https://lawntrend.com/gravely-zt-hd-zero-turn-mower-troubleshoot-guide/?utm_source=pinterest&utm_campaign=gravely-zt-hd-identi,2025-04-28,Diagnosis,https://lawntrend.com/gravely-zt-hd-zero-turn-mower-troubleshoot-guide/
ZT HD: Diagnosing & Fixing Leaks,https://res.cloudinary.com/dbcpfy04c/image/upload/v1745838448/pin_1_20_ennwbc.webp,auto-repair-ideas,,"Leaks can indicate serious problems. This guide helps you identify and fix common leaks in your Gravely ZT HD.  Protect your mower and the environment.  Click to learn how to stop the leaks. #MowerLeaks #GravelyZT #ZeroTurnRepair #LawnMowerLeaks,Leaks,Gravely,Zero Turn",https://lawntrend.com/gravely-zt-hd-zero-turn-mower-troubleshoot-guide/?utm_source=pinterest&utm_campaign=zt-hd-diagnosing-fix,2025-04-28,Fluid Leaks,https://lawntrend.com/gravely-zt-hd-zero-turn-mower-troubleshoot-guide/
