Title,Media URL,Pinterest board,Thumbnail,Link,Publish date,Description,Keywords
Black Toilet Ring? Don't Scrub Forever!,https://res.cloudinary.com/dbcpfy04c/image/upload/v1747650077/pin_1_8_pnunkw.webp,bathroom-cleaning-tips,,https://www.beacleaner.com/how-to-clean-black-stuff-in-toilet-bowl?utm_source=pinterest&utm_campaign=black-toilet-ring-do,2025-05-19,Stop wasting your energy! This post reveals the *smartest* ways to clean a black ring in your toilet bowl. We'll show you techniques that minimize scrubbing and maximize results.  Imagine having a clean toilet with minimal effort!  Click to learn the secrets to effortless cleaning.  You'll thank us later!,"Easy toilet cleaning,Cleaning shortcuts,Black stain removal,Bathroom efficiency"
Vinegar & Baking Soda: Toilet Cleaning Power!,https://res.cloudinary.com/dbcpfy04c/image/upload/v1747650084/pin_1_9_rbbvw7.webp,cleaning-tips,,https://www.beacleaner.com/how-to-clean-black-stuff-in-toilet-bowl?utm_source=pinterest&utm_campaign=vinegar-baking-soda-,2025-05-19,"Unlock the cleaning power of vinegar and baking soda! This post demonstrates how to use these natural ingredients to effectively remove black rings and other stains from your toilet bowl.  A safe, affordable, and eco-friendly solution for a sparkling clean bathroom. Click to learn the recipe!","Vinegar cleaning,Baking soda,Natural toilet cleaner,Eco-friendly cleaning"
Black Ring in Toilet: Prevent It From Returning!,https://res.cloudinary.com/dbcpfy04c/image/upload/v1747650091/pin_1_10_kh1tpn.webp,bathroom-cleaning-tips,,https://www.beacleaner.com/how-to-clean-black-stuff-in-toilet-bowl?utm_source=pinterest&utm_campaign=black-ring-in-toilet,2025-05-19,Cleaning is only half the battle! This post focuses on *preventing* black rings from forming in your toilet bowl in the first place.  We'll share simple habits and maintenance tips to keep your toilet sparkling clean for longer.  Enjoy a consistently fresh and hygienic bathroom. Click to learn how!,"Toilet maintenance,Preventative cleaning,Bathroom hygiene,Cleaning schedule"
Is Your Toilet Ring Hiding Mold? Find Out!,https://res.cloudinary.com/dbcpfy04c/image/upload/v1747650098/pin_1_11_ajmxam.webp,bathroom-cleaning-tips,,https://www.beacleaner.com/how-to-clean-black-stuff-in-toilet-bowl?utm_source=pinterest&utm_campaign=is-your-toilet-ring-,2025-05-19,Concerned about mold? This post addresses the possibility of mold growth contributing to black rings in your toilet bowl.  We'll explain how to identify mold and how to safely remove it.  Protect your family's health and enjoy a truly clean bathroom. Click to learn more!,"Mold removal,Toilet mold,Bathroom safety,Cleaning for health"
Black Toilet Ring: When to Call a Pro,https://res.cloudinary.com/dbcpfy04c/image/upload/v1747650104/pin_1_12_przumz.webp,bathroom-cleaning-tips,,https://www.beacleaner.com/how-to-clean-black-stuff-in-toilet-bowl?utm_source=pinterest&utm_campaign=black-toilet-ring-wh,2025-05-19,"Sometimes, DIY isn't enough. This post helps you determine when it's time to call a professional plumber to address a stubborn black ring or potential plumbing issues.  Don't risk damaging your toilet – know when to seek expert help. Click to read!","Plumber,Toilet repair,Black stain,Professional cleaning"
The Ultimate Black Toilet Ring Guide,https://res.cloudinary.com/dbcpfy04c/image/upload/v1747650110/pin_1_13_sek0wm.webp,bathroom-cleaning-tips,,https://www.beacleaner.com/how-to-clean-black-stuff-in-toilet-bowl?utm_source=pinterest&utm_campaign=the-ultimate-black-t,2025-05-19,"Everything you need to know about black toilet rings in one place! This comprehensive guide covers causes, prevention, DIY cleaning methods, and when to call a pro.  From mild stains to severe buildup, we've got you covered. Click to become a toilet cleaning expert!","Toilet cleaning,Black ring,Bathroom guide,Cleaning tips"
Black Toilet Ring? Try This First!,https://res.cloudinary.com/dbcpfy04c/image/upload/v1747650117/pin_1_14_jpcdx1.webp,bathroom-cleaning-tips,,https://www.beacleaner.com/how-to-clean-black-stuff-in-toilet-bowl?utm_source=pinterest&utm_campaign=black-toilet-ring-tr,2025-05-19,"Before you reach for harsh chemicals, try this simple solution! This post highlights a quick and effective method for removing black rings from your toilet bowl using readily available supplies.  A fast and easy fix for a frustrating problem. Click to learn the trick!","Quick cleaning,Toilet hack,Black stain,Easy fix"
Say Goodbye to Toilet Bowl Embarrassment!,https://res.cloudinary.com/dbcpfy04c/image/upload/v1747650122/pin_1_15_lunxpa.webp,bathroom-cleaning-tips,,https://www.beacleaner.com/how-to-clean-black-stuff-in-toilet-bowl?utm_source=pinterest&utm_campaign=say-goodbye-to-toile,2025-05-19,Tired of hiding your toilet? This post empowers you to tackle that unsightly black ring and restore your bathroom to its former glory.  A clean toilet is a sign of a well-cared-for home.  Click to learn how to create a bathroom you're proud to show off!,"Bathroom pride,Toilet cleaning,Black ring removal,Home improvement"
Black Ring Removal: Step-by-Step Photos!,https://res.cloudinary.com/dbcpfy04c/image/upload/v1747650131/pin_1_16_s5sbum.webp,cleaning-tips,,https://www.beacleaner.com/how-to-clean-black-stuff-in-toilet-bowl?utm_source=pinterest&utm_campaign=black-ring-removal-s,2025-05-19,"Visual learners rejoice! This post provides a detailed, step-by-step guide to removing black rings from your toilet bowl, complete with helpful photos.  Follow along and achieve a sparkling clean result. Click to see the process!","Step-by-step cleaning,Toilet cleaning,Black ring,Visual guide"
Black Toilet Ring: The Mineral Buildup Mystery,https://res.cloudinary.com/dbcpfy04c/image/upload/v1747650137/pin_1_17_nqqtrb.webp,bathroom-cleaning-tips,,https://www.beacleaner.com/how-to-clean-black-stuff-in-toilet-bowl?utm_source=pinterest&utm_campaign=black-toilet-ring-th,2025-05-19,Unravel the mystery of mineral buildup! This post explains how hard water and mineral deposits contribute to black rings in your toilet bowl.  Learn how to combat these deposits and keep your toilet clean. Click to understand the science!,"Mineral buildup,Hard water,Toilet cleaning,Bathroom science"
Clean Your Toilet Like a Pro!,https://res.cloudinary.com/dbcpfy04c/image/upload/v1747650146/pin_1_18_lk2e8o.webp,cleaning-tips,,https://www.beacleaner.com/how-to-clean-black-stuff-in-toilet-bowl?utm_source=pinterest&utm_campaign=clean-your-toilet-li,2025-05-19,Want a professional-level clean without the cost? This post shares the secrets used by cleaning professionals to remove black rings and other stains from toilets.  Impress your guests with a sparkling clean bathroom. Click to learn the techniques!,"Professional cleaning,Toilet cleaning,Black ring,Cleaning secrets"
Black Toilet Ring? It's Easier Than You Think!,https://res.cloudinary.com/dbcpfy04c/image/upload/v1747650153/pin_1_19_blswon.webp,bathroom-cleaning-tips,,https://www.beacleaner.com/how-to-clean-black-stuff-in-toilet-bowl?utm_source=pinterest&utm_campaign=black-toilet-ring-it,2025-05-19,"Don't let a black toilet ring intimidate you! This post breaks down the cleaning process into simple, manageable steps.  Anyone can achieve a sparkling clean toilet with a little effort. Click to get started!","Easy cleaning,Toilet cleaning,Black ring,Beginner cleaning"
The Best Toilet Bowl Cleaner (DIY or Store-Bought),https://res.cloudinary.com/dbcpfy04c/image/upload/v1747650159/pin_1_20_n6mhwp.webp,cleaning-tips,,https://www.beacleaner.com/how-to-clean-black-stuff-in-toilet-bowl?utm_source=pinterest&utm_campaign=the-best-toilet-bowl,2025-05-19,"Choosing the right cleaner can make all the difference! This post compares DIY cleaning solutions to commercial toilet bowl cleaners, helping you find the best option for your needs.  Click to discover the perfect cleaner for your toilet!","Toilet bowl cleaner,DIY cleaner,Commercial cleaner,Cleaning comparison"
Black Ring in Toilet: A Health Concern?,https://res.cloudinary.com/dbcpfy04c/image/upload/v1747650165/pin_1_21_ttxyxv.webp,bathroom-cleaning-tips,,https://www.beacleaner.com/how-to-clean-black-stuff-in-toilet-bowl?utm_source=pinterest&utm_campaign=black-ring-in-toilet,2025-05-19,Is that black ring more than just unsightly? This post explores the potential health implications of mold and bacteria growth in your toilet bowl.  Protect your family's health with a thorough cleaning routine. Click to learn more!,"Toilet hygiene,Bathroom health,Mold removal,Cleaning for health"
From Grime to Shine: Black Ring Transformation!,https://res.cloudinary.com/dbcpfy04c/image/upload/v1747650171/pin_1_22_srmotj.webp,cleaning-tips,,https://www.beacleaner.com/how-to-clean-black-stuff-in-toilet-bowl?utm_source=pinterest&utm_campaign=from-grime-to-shine-,2025-05-19,Witness the incredible transformation! This post showcases before & after photos of toilets with stubborn black rings that have been restored to sparkling clean.  Get inspired and motivated to tackle your own bathroom cleaning project. Click to see the results!,"Before and after,Toilet cleaning,Black ring,Cleaning transformation"
Black Toilet Ring: The Ultimate FAQ,https://res.cloudinary.com/dbcpfy04c/image/upload/v1747650177/pin_1_23_cncqoj.webp,bathroom-cleaning-tips,,https://www.beacleaner.com/how-to-clean-black-stuff-in-toilet-bowl?utm_source=pinterest&utm_campaign=black-toilet-ring-th,2025-05-19,"Got questions about black toilet rings? This post answers frequently asked questions about causes, prevention, and cleaning methods.  Find all the information you need in one convenient place. Click to get answers!","Toilet FAQ,Black ring,Cleaning questions,Bathroom help"
Don't Live With a Dirty Toilet!,https://res.cloudinary.com/dbcpfy04c/image/upload/v1747650184/pin_1_24_zcfgpu.webp,bathroom-cleaning-tips,,https://www.beacleaner.com/how-to-clean-black-stuff-in-toilet-bowl?utm_source=pinterest&utm_campaign=dont-live-with-a-dir,2025-05-19,You deserve a clean and inviting bathroom. This post provides the motivation and the knowledge you need to finally tackle that black ring in your toilet bowl.  Take control of your bathroom and enjoy a more pleasant living space. Click to start cleaning!,"Bathroom motivation,Toilet cleaning,Black ring,Home comfort"
Black Ring in Toilet: A Quick Fix Guide,https://res.cloudinary.com/dbcpfy04c/image/upload/v1747650190/pin_1_25_kpezw9.webp,bathroom-cleaning-tips,,https://www.beacleaner.com/how-to-clean-black-stuff-in-toilet-bowl?utm_source=pinterest&utm_campaign=black-ring-in-toilet,2025-05-19,Short on time? This post offers a super-fast guide to removing black rings from your toilet bowl.  Perfect for busy schedules and unexpected guests. Click for a quick solution!,"Quick fix,Toilet cleaning,Black ring,Fast cleaning"
Restore Your Toilet's Shine Today!,https://res.cloudinary.com/dbcpfy04c/image/upload/v1747650196/pin_1_26_izv8if.webp,bathroom-cleaning-tips,,https://www.beacleaner.com/how-to-clean-black-stuff-in-toilet-bowl?utm_source=pinterest&utm_campaign=restore-your-toilets,2025-05-19,Don't wait any longer to tackle that black ring! This post provides a clear and concise guide to restoring your toilet to its original shine.  A clean toilet is within reach. Click to get started!,"Toilet shine,Black ring removal,Bathroom cleaning,Cleaning today"
Title,https://res.cloudinary.com/dbcpfy04c/image/upload/v1747650238/pin_2_1_vgmjqn.webp,please-provide-the-title-and-keywords-i-need-that-information-to-suggest-a-board-name-once,,https://www.beacleaner.com/how-to-clean-a-park?utm_source=pinterest&utm_campaign=title,2025-05-19,Description,Keywords
Park Cleanup Guide: Make a Difference!,https://res.cloudinary.com/dbcpfy04c/image/upload/v1747650246/pin_2_2_o2hh2p.webp,community-service-ideas,,https://www.beacleaner.com/how-to-clean-a-park?utm_source=pinterest&utm_campaign=park-cleanup-guide-m,2025-05-19,Want to give back to your community & enjoy the outdoors? This guide shows you exactly how to clean a park,from organizing a group to safely removing litter. Learn about essential supplies
Park Cleaning Checklist: Easy Steps,https://res.cloudinary.com/dbcpfy04c/image/upload/v1747650252/pin_2_3_fkrssc.webp,outdoor-cleanup-tips,,https://www.beacleaner.com/how-to-clean-a-park?utm_source=pinterest&utm_campaign=park-cleaning-checkl,2025-05-19,Feeling overwhelmed by the thought of cleaning a park? Don't be! This checklist breaks down the process into manageable steps. From planning & gathering supplies to the actual cleanup & disposal,we've got you covered.  A clean park is a happy park – and it's within your reach!  Help us keep our green spaces pristine for future generations. Read the full guide for a detailed plan. #ParkMaintenance #CleanParks #OutdoorCleanup #GreenSpaces
Organize a Park Cleanup Event!,https://res.cloudinary.com/dbcpfy04c/image/upload/v1747650259/pin_2_4_iearpj.webp,community-service-ideas,,https://www.beacleaner.com/how-to-clean-a-park?utm_source=pinterest&utm_campaign=organize-a-park-clea,2025-05-19,Ready to rally your friends & neighbors? This post provides a complete guide to organizing a successful park cleanup event.  Learn how to promote it,recruit volunteers
Safe Park Cleanup: What to Avoid,https://res.cloudinary.com/dbcpfy04c/image/upload/v1747650266/pin_2_5_gbzwvh.webp,safety-tips,,https://www.beacleaner.com/how-to-clean-a-park?utm_source=pinterest&utm_campaign=safe-park-cleanup-wh,2025-05-19,Safety first!  Cleaning a park can expose you to hazards. This guide details what *not* to touch (needles,hazardous materials) and how to protect yourself.  We cover proper glove use
Park Cleanup Supplies: Your Toolkit,https://res.cloudinary.com/dbcpfy04c/image/upload/v1747650272/pin_2_6_xhhmqs.webp,outdoor-tips,,https://www.beacleaner.com/how-to-clean-a-park?utm_source=pinterest&utm_campaign=park-cleanup-supplie,2025-05-19,Don't start cleaning a park without the right tools! This post lists essential supplies – gloves,bags
DIY Park Cleanup: Budget-Friendly Tips,https://res.cloudinary.com/dbcpfy04c/image/upload/v1747650279/pin_2_7_olhro8.webp,community-tips,,https://www.beacleaner.com/how-to-clean-a-park?utm_source=pinterest&utm_campaign=diy-park-cleanup-bud,2025-05-19,Cleaning a park doesn't have to be expensive! This post shares budget-friendly tips for gathering supplies and organizing a cleanup.  Repurpose items,ask for donations
Dealing with Litter: Park Cleanup Guide,https://res.cloudinary.com/dbcpfy04c/image/upload/v1747650287/pin_2_8_uumncf.webp,park-cleanup-tips,,https://www.beacleaner.com/how-to-clean-a-park?utm_source=pinterest&utm_campaign=dealing-with-litter-,2025-05-19,Litter is a major problem in parks. This post provides practical tips for dealing with different types of litter,from plastic bottles to cigarette butts.  Learn how to properly dispose of waste and prevent future littering.  Let's keep our parks beautiful and healthy.  Read the guide for effective strategies. #LitterRemoval #WasteManagement #ParkPollution #CleanEnvironment
The Benefits of a Clean Park,https://res.cloudinary.com/dbcpfy04c/image/upload/v1747650301/pin_2_9_p5bklu.webp,outdoor-living-ideas,,https://www.beacleaner.com/how-to-clean-a-park?utm_source=pinterest&utm_campaign=the-benefits-of-a-cl,2025-05-19,A clean park isn't just aesthetically pleasing – it's good for our health and well-being! This post explores the many benefits of maintaining clean parks,from increased physical activity to improved mental health.  Invest in your community's health and happiness.  Learn why park cleanup matters. #ParkBenefits #CommunityHealth #Wellbeing #OutdoorLiving
Park Cleanup: Reduce,https://res.cloudinary.com/dbcpfy04c/image/upload/v1747650313/pin_2_10_lgqn8a.webp,eco-friendly-ideas,,https://www.beacleaner.com/how-to-clean-a-park?utm_source=pinterest&utm_campaign=park-cleanup-reduce,2025-05-19,Reuse,Recycle
Park Cleanup: Reporting Issues,https://res.cloudinary.com/dbcpfy04c/image/upload/v1747650319/pin_2_11_yqvxwz.webp,eco-friendly-ideas,,https://www.beacleaner.com/how-to-clean-a-park?utm_source=pinterest&utm_campaign=park-cleanup-reporti,2025-05-19,Found something more serious than litter? This post explains how to report issues like broken equipment,vandalism
Park Cleanup: Long-Term Maintenance,https://res.cloudinary.com/dbcpfy04c/image/upload/v1747650325/pin_2_12_x9psiw.webp,park-maintenance-tips,,https://www.beacleaner.com/how-to-clean-a-park?utm_source=pinterest&utm_campaign=park-cleanup-long-te,2025-05-19,Cleaning a park is just the first step. This post discusses long-term maintenance strategies to keep your park clean and beautiful for years to come.  Learn about regular litter patrols,preventative measures
Park Cleanup: The Power of Community,https://res.cloudinary.com/dbcpfy04c/image/upload/v1747650331/pin_2_13_x2atq2.webp,community-service-ideas,,https://www.beacleaner.com/how-to-clean-a-park?utm_source=pinterest&utm_campaign=park-cleanup-the-pow,2025-05-19,Cleaning a park is more than just a task – it's a community-building activity! This post highlights the social benefits of working together to improve our shared spaces.  Strengthen bonds,foster a sense of belonging
Park Cleanup: Inspiring Stories,https://res.cloudinary.com/dbcpfy04c/image/upload/v1747650338/pin_2_14_zsltf5.webp,community-inspiration,,https://www.beacleaner.com/how-to-clean-a-park?utm_source=pinterest&utm_campaign=park-cleanup-inspiri,2025-05-19,Read inspiring stories of individuals and groups who are making a difference through park cleanups.  Get motivated and learn from their experiences.  Every effort,no matter how small
Park Cleanup: Before You Start Checklist,https://res.cloudinary.com/dbcpfy04c/image/upload/v1747650344/pin_2_15_xzoeq0.webp,outdoor-tips,,https://www.beacleaner.com/how-to-clean-a-park?utm_source=pinterest&utm_campaign=park-cleanup-before-,2025-05-19,Don't head to the park unprepared! This post provides a quick checklist of things to do *before* you start cleaning.  From checking the weather to notifying park authorities,ensure a smooth and successful cleanup. #CleanupPreparation #ParkChecklist #PlanAhead #ParkReadiness
Park Cleanup: Preventing Future Litter,https://res.cloudinary.com/dbcpfy04c/image/upload/v1747650352/pin_2_16_po4avg.webp,park-cleanup-tips,,https://www.beacleaner.com/how-to-clean-a-park?utm_source=pinterest&utm_campaign=park-cleanup-prevent,2025-05-19,Cleaning up is great,but preventing litter is even better! This post offers tips for reducing litter in parks
Title,https://res.cloudinary.com/dbcpfy04c/image/upload/v1747650393/pin_3_1_mnqfgo.webp,please-provide-the-title-and-keywords-i-need-that-information-to-suggest-a-board-name-once,,https://www.beacleaner.com/how-to-clean-acrylic-paint-off-brushes-between-colors?utm_source=pinterest&utm_campaign=title,2025-05-19,Description,Keywords
Acrylic Paint Brush Cleaning SOS!,https://res.cloudinary.com/dbcpfy04c/image/upload/v1747650399/pin_3_2_azsnmd.webp,painting-tips,,https://www.beacleaner.com/how-to-clean-acrylic-paint-off-brushes-between-colors?utm_source=pinterest&utm_campaign=acrylic-paint-brush-,2025-05-19,Is acrylic paint turning your brushes into stiff,unusable tools? Don't panic! This post is your rescue guide. Discover how to effectively clean acrylic paint off brushes *mid-painting* so you can seamlessly switch colors and achieve beautiful blends. We'll cover water techniques
Perfectly Clean Brushes Every Time ✨,https://res.cloudinary.com/dbcpfy04c/image/upload/v1747650405/pin_3_3_e4waqi.webp,brush-cleaning-tips,,https://www.beacleaner.com/how-to-clean-acrylic-paint-off-brushes-between-colors?utm_source=pinterest&utm_campaign=perfectly-clean-brus,2025-05-19,Imagine effortlessly switching between acrylic paint colors without muddying your results. It's possible! This guide shows you how to clean your brushes *between colors* like a pro. Learn the best water temperatures,cleaning motions
Extend Brush Life: Acrylic Secrets,https://res.cloudinary.com/dbcpfy04c/image/upload/v1747650412/pin_3_4_idgxip.webp,acrylic-painting-tips,,https://www.beacleaner.com/how-to-clean-acrylic-paint-off-brushes-between-colors?utm_source=pinterest&utm_campaign=extend-brush-life-ac,2025-05-19,Are you throwing away brushes too soon? You might be cleaning them wrong! This post reveals the simple steps to clean acrylic paint off brushes *between colors* and dramatically extend their lifespan. We'll debunk common myths and share pro tips for keeping your brushes soft,flexible
Acrylic Paint Brush Cleaning Guide,https://res.cloudinary.com/dbcpfy04c/image/upload/v1747650418/pin_3_5_ztkuq1.webp,painting-tips,,https://www.beacleaner.com/how-to-clean-acrylic-paint-off-brushes-between-colors?utm_source=pinterest&utm_campaign=acrylic-paint-brush-,2025-05-19,A comprehensive guide to cleaning acrylic paint off brushes *between colors* and after painting. From choosing the right cleaning solution to proper drying techniques,we cover everything you need to know. Keep your brushes in top condition and enjoy years of creative expression. Click to read the ultimate brush cleaning guide! #AcrylicBrushCleaning #ArtEducation #PaintingResources #BrushCareTips
Keep Acrylic Colors Vibrant! 🌈,https://res.cloudinary.com/dbcpfy04c/image/upload/v1747650426/pin_3_6_lnlwls.webp,acrylic-painting-tips,,https://www.beacleaner.com/how-to-clean-acrylic-paint-off-brushes-between-colors?utm_source=pinterest&utm_campaign=keep-acrylic-colors-,2025-05-19,Muddy colors ruining your paintings? It might be your brushes! This post explains how cleaning acrylic paint off brushes *between colors* is crucial for maintaining color purity. Learn how to prevent cross-contamination and achieve vibrant,beautiful results. Click to read and unlock your color potential! #ColorMixing #AcrylicVibrancy #PaintingColors #ArtisticResults
Acrylic Paint & Brush Cleaning FAQs,https://res.cloudinary.com/dbcpfy04c/image/upload/v1747650433/pin_3_7_som9rs.webp,art-tips-ideas,,https://www.beacleaner.com/how-to-clean-acrylic-paint-off-brushes-between-colors?utm_source=pinterest&utm_campaign=acrylic-paint-brush-,2025-05-19,Got questions about cleaning acrylic paint off brushes? This post answers frequently asked questions about brush cleaning *between colors*,including the best cleaning solutions
Prevent Dried Acrylic Paint: Tips,https://res.cloudinary.com/dbcpfy04c/image/upload/v1747650439/pin_3_8_lntiho.webp,painting-tips,,https://www.beacleaner.com/how-to-clean-acrylic-paint-off-brushes-between-colors?utm_source=pinterest&utm_campaign=prevent-dried-acryli,2025-05-19,Tired of battling dried acrylic paint on your brushes? This post offers practical tips for preventing paint from drying *between colors* and making the cleaning process easier. Click to read and say goodbye to stiff,unusable brushes! #PreventDriedPaint #AcrylicPrevention #BrushTips #PaintingSolutions
Acrylic Brush Cleaning: Deep Dive,https://res.cloudinary.com/dbcpfy04c/image/upload/v1747650445/pin_3_9_kfxtze.webp,art-cleaning-tips,,https://www.beacleaner.com/how-to-clean-acrylic-paint-off-brushes-between-colors?utm_source=pinterest&utm_campaign=acrylic-brush-cleani,2025-05-19,Go beyond the basics! This post provides an in-depth look at cleaning acrylic paint off brushes *between colors*,covering advanced techniques and troubleshooting common problems. Click to read and become a true brush cleaning master! #DeepCleaning #AcrylicMastery #ArtTechniques #BrushExpert
Acrylic Brush Cleaning Checklist 📝,https://res.cloudinary.com/dbcpfy04c/image/upload/v1747650450/pin_3_10_bn6z5a.webp,art-cleaning-tips,,https://www.beacleaner.com/how-to-clean-acrylic-paint-off-brushes-between-colors?utm_source=pinterest&utm_campaign=acrylic-brush-cleani,2025-05-19,Never forget a step! This post provides a handy checklist for cleaning acrylic paint off brushes *between colors*,ensuring a thorough and effective clean every time. Click to read and stay organized! #CleaningChecklist #AcrylicOrganization #ArtRoutine #PaintingProcess
Title,https://res.cloudinary.com/dbcpfy04c/image/upload/v1747650491/pin_4_1_udltfq.webp,please-provide-the-title-and-keywords-i-need-that-information-to-suggest-a-board-name-once,,https://www.beacleaner.com/how-to-clean-bissell-revolution-pet-pro?utm_source=pinterest&utm_campaign=title,2025-05-19,Description,Keywords
Bissell Revolution Pet Pro: Deep Clean Guide,https://res.cloudinary.com/dbcpfy04c/image/upload/v1747650498/pin_4_2_jomzol.webp,cleaning-tips,,https://www.beacleaner.com/how-to-clean-bissell-revolution-pet-pro?utm_source=pinterest&utm_campaign=bissell-revolution-p,2025-05-19,Is your Bissell Revolution Pet Pro losing suction? Don't replace it,revive it! This step-by-step guide shows you exactly how to clean every part of your Bissell
Bissell Revolution Pro: Suction SOS,https://res.cloudinary.com/dbcpfy04c/image/upload/v1747650504/pin_4_3_bn6g7r.webp,cleaning-tips,,https://www.beacleaner.com/how-to-clean-bissell-revolution-pet-pro?utm_source=pinterest&utm_campaign=bissell-revolution-p,2025-05-19,Is your Bissell losing suction? This pin tackles common suction problems with your Bissell Revolution Pet Pro. We'll show you how to identify blockages,clean filters
Bissell Pet Pro: Odor Elimination Tips,https://res.cloudinary.com/dbcpfy04c/image/upload/v1747650510/pin_4_4_gouydi.webp,pet-odor-tips,,https://www.beacleaner.com/how-to-clean-bissell-revolution-pet-pro?utm_source=pinterest&utm_campaign=bissell-pet-pro-odor,2025-05-19,Pet odors lingering? This pin shares tips for eliminating odors from your Bissell Revolution Pet Pro and your home. From filter cleaning to using baking soda,we've got you covered. Enjoy a fresh-smelling home and happy pets! Click to learn more. #BissellOdorRemoval #PetOdors #HomeFragrance #CleaningSolutions
