Title,Media URL,Pinterest board,Thumbnail,Link,Publish date,Description,Keywords,
Husqvarna YTA24V48: Transmission SOS!,https://res.cloudinary.com/dbcpfy04c/image/upload/v1618237451/placeholder.jpg,home-inspiration,,https://lawntrend.com/husqvarna-yta24v48-transmission-problems/?utm_source=pinterest&utm_campaign=husqvarna-yta24v48-t,2025-05-16,"Is your Husqvarna YTA24V48 refusing to shift or move? Don't let a faulty transmission ruin your lawn care! This guide dives deep into common YTA24V48 transmission problems, from low fluid to complete failure. Learn to diagnose the issue yourself and explore repair options – saving you time & money. We cover everything from belt checks to full transmission replacement.  Don't stress",get back to enjoying your perfectly manicured lawn! Click to learn more and get your mower running smoothly again. #Husqvarna #YTA24V48 #LawnMowerRepair #Transmission,get back to enjoying your perfectly manicured lawn! Click to learn more and get your mower running smoothly again. #Husqvarna #YTA24V48 #LawnMowerRepair #Transmission
YTA24V48: Shifting Problems?,https://res.cloudinary.com/dbcpfy04c/image/upload/v1618237451/placeholder.jpg,home-inspiration,,https://lawntrend.com/husqvarna-yta24v48-transmission-problems/?utm_source=pinterest&utm_campaign=yta24v48-shifting-pr,2025-05-16,Is your Husqvarna YTA24V48 struggling to shift gears?  That frustrating lag or complete refusal to shift can be a sign of a deeper transmission issue.  We break down the common causes of shifting problems in the YTA24V48,including worn components and low fluid levels.  Get a clear understanding of what's happening and how to fix it.  Don't let a small problem become a big expense! #HusqvarnaYTA24V48 #ShiftingIssues #MowerProblems #LawnMower,including worn components and low fluid levels.  Get a clear understanding of what's happening and how to fix it.  Don't let a small problem become a big expense! #HusqvarnaYTA24V48 #ShiftingIssues #MowerProblems #LawnMower
Husqvarna Transmission Fluid Check,https://res.cloudinary.com/dbcpfy04c/image/upload/v1618237451/placeholder.jpg,home-inspiration,,https://lawntrend.com/husqvarna-yta24v48-transmission-problems/?utm_source=pinterest&utm_campaign=husqvarna-transmissi,2025-05-16,Keep your Husqvarna YTA24V48 transmission healthy!  Low or contaminated transmission fluid is a major culprit behind many YTA24V48 transmission problems.  Learn how to easily check your fluid level and condition,and discover the right type of fluid to use.  Preventative maintenance is key to a long-lasting mower.  Don't wait for a breakdown – check your fluid today! #TransmissionFluid #HusqvarnaMaintenance #LawnMowerTips #PreventativeMaintenance,and discover the right type of fluid to use.  Preventative maintenance is key to a long-lasting mower.  Don't wait for a breakdown – check your fluid today! #TransmissionFluid #HusqvarnaMaintenance #LawnMowerTips #PreventativeMaintenance
YTA24V48 Belt Replacement Guide,https://res.cloudinary.com/dbcpfy04c/image/upload/v1618237451/placeholder.jpg,home-inspiration,,https://lawntrend.com/husqvarna-yta24v48-transmission-problems/?utm_source=pinterest&utm_campaign=yta24v48-belt-replac,2025-05-16,A worn or broken belt is a common cause of YTA24V48 transmission issues.  This guide provides a clear,step-by-step walkthrough of how to replace the transmission belt on your Husqvarna YTA24V48.  Save money on repair costs and get your mower back in action quickly.  Includes helpful diagrams and tips for a smooth installation.  Don't get stuck with a broken mower! #BeltReplacement #HusqvarnaRepair #DIYMower #LawnEquipment,step-by-step walkthrough of how to replace the transmission belt on your Husqvarna YTA24V48.  Save money on repair costs and get your mower back in action quickly.  Includes helpful diagrams and tips for a smooth installation.  Don't get stuck with a broken mower! #BeltReplacement #HusqvarnaRepair #DIYMower #LawnEquipment
Diagnose Your YTA24V48 Transmission,https://res.cloudinary.com/dbcpfy04c/image/upload/v1618237451/placeholder.jpg,home-inspiration,,https://lawntrend.com/husqvarna-yta24v48-transmission-problems/?utm_source=pinterest&utm_campaign=diagnose-your-yta24v,2025-05-16,Feeling helpless with a broken Husqvarna YTA24V48?  We'll empower you to diagnose the transmission problem yourself!  This post outlines the key symptoms to look for,from unusual noises to complete loss of power.  Learn to pinpoint the issue and determine the best course of action.  Take control of your lawn care and avoid unnecessary repairs. #TransmissionDiagnosis #HusqvarnaTroubleshooting #MowerRepairHelp #LawnCareTips,from unusual noises to complete loss of power.  Learn to pinpoint the issue and determine the best course of action.  Take control of your lawn care and avoid unnecessary repairs. #TransmissionDiagnosis #HusqvarnaTroubleshooting #MowerRepairHelp #LawnCareTips
Husqvarna Transmission: Cost to Repair?,https://res.cloudinary.com/dbcpfy04c/image/upload/v1618237451/placeholder.jpg,home-inspiration,,https://lawntrend.com/husqvarna-yta24v48-transmission-problems/?utm_source=pinterest&utm_campaign=husqvarna-transmissi,2025-05-16,Worried about the cost of fixing your Husqvarna YTA24V48 transmission?  We break down the typical repair costs for common YTA24V48 transmission problems,including parts and labor.  Get a realistic estimate and decide if DIY repair or professional service is the right choice for you.  Don't get caught off guard by unexpected expenses! #HusqvarnaRepairCost #TransmissionCost #MowerRepairEstimate #LawnMowerBudget,including parts and labor.  Get a realistic estimate and decide if DIY repair or professional service is the right choice for you.  Don't get caught off guard by unexpected expenses! #HusqvarnaRepairCost #TransmissionCost #MowerRepairEstimate #LawnMowerBudget
YTA24V48: No Forward Motion?,https://res.cloudinary.com/dbcpfy04c/image/upload/v1618237451/placeholder.jpg,home-inspiration,,https://lawntrend.com/husqvarna-yta24v48-transmission-problems/?utm_source=pinterest&utm_campaign=yta24v48-no-forward-,2025-05-16,Your Husqvarna YTA24V48 won't move forward? This is a common transmission issue! We explore the potential causes,from a broken drive belt to a faulty forward/reverse clutch.  Learn how to troubleshoot the problem and get your mower moving again.  Don't let a stalled mower ruin your weekend! Click to find the solution. #NoForwardMotion #HusqvarnaProblems #MowerFix #LawnMowerHelp,from a broken drive belt to a faulty forward/reverse clutch.  Learn how to troubleshoot the problem and get your mower moving again.  Don't let a stalled mower ruin your weekend! Click to find the solution. #NoForwardMotion #HusqvarnaProblems #MowerFix #LawnMowerHelp
Husqvarna Transmission Overhaul,https://res.cloudinary.com/dbcpfy04c/image/upload/v1618237451/placeholder.jpg,home-inspiration,,https://lawntrend.com/husqvarna-yta24v48-transmission-problems/?utm_source=pinterest&utm_campaign=husqvarna-transmissi,2025-05-16,"Is your Husqvarna YTA24V48 transmission severely damaged?  Sometimes a complete overhaul is the most cost-effective solution.  This guide walks you through the process of disassembling, inspecting",and rebuilding your YTA24V48 transmission.  A challenging but rewarding DIY project for experienced mechanics. #TransmissionOverhaul #HusqvarnaDIY #MowerRebuild #LawnEquipmentRepair,and rebuilding your YTA24V48 transmission.  A challenging but rewarding DIY project for experienced mechanics. #TransmissionOverhaul #HusqvarnaDIY #MowerRebuild #LawnEquipmentRepair
YTA24V48: Reverse Not Working?,https://res.cloudinary.com/dbcpfy04c/image/upload/v1618237451/placeholder.jpg,home-inspiration,,https://lawntrend.com/husqvarna-yta24v48-transmission-problems/?utm_source=pinterest&utm_campaign=yta24v48-reverse-not,2025-05-16,"Lost your reverse gear on your Husqvarna YTA24V48?  Don't worry, it's a fixable problem!  We identify the common causes of reverse gear failure in the YTA24V48, including worn clutches and linkage issues.  Learn how to diagnose and repair the problem",and get back to maneuvering your mower with ease. #ReverseGear #HusqvarnaFix #MowerRepairTips #LawnCareSolutions,and get back to maneuvering your mower with ease. #ReverseGear #HusqvarnaFix #MowerRepairTips #LawnCareSolutions
Husqvarna Transmission Parts Guide,https://res.cloudinary.com/dbcpfy04c/image/upload/v1618237451/placeholder.jpg,home-inspiration,,https://lawntrend.com/husqvarna-yta24v48-transmission-problems/?utm_source=pinterest&utm_campaign=husqvarna-transmissi,2025-05-16,"Need replacement parts for your Husqvarna YTA24V48 transmission?  We provide a comprehensive guide to the essential parts you'll need, including belts, clutches",and gears.  Find the right parts for your mower and ensure a successful repair.  Don't waste time searching – we've got you covered! #HusqvarnaParts #TransmissionParts #MowerParts #LawnEquipment,and gears.  Find the right parts for your mower and ensure a successful repair.  Don't waste time searching – we've got you covered! #HusqvarnaParts #TransmissionParts #MowerParts #LawnEquipment
YTA24V48: Transmission Noise?,https://res.cloudinary.com/dbcpfy04c/image/upload/v1618237451/placeholder.jpg,home-inspiration,,https://lawntrend.com/husqvarna-yta24v48-transmission-problems/?utm_source=pinterest&utm_campaign=yta24v48-transmissio,2025-05-16,"Hearing strange noises from your Husqvarna YTA24V48 transmission?  That grinding, whining",or clicking sound could indicate a serious problem.  We help you identify the source of the noise and determine the appropriate course of action.  Don't ignore the warning signs – address the issue before it gets worse! #TransmissionNoise #HusqvarnaSounds #MowerTroubleshooting #LawnMowerProblems,or clicking sound could indicate a serious problem.  We help you identify the source of the noise and determine the appropriate course of action.  Don't ignore the warning signs – address the issue before it gets worse! #TransmissionNoise #HusqvarnaSounds #MowerTroubleshooting #LawnMowerProblems
Husqvarna Transmission: Preventative Care,https://res.cloudinary.com/dbcpfy04c/image/upload/v1618237451/placeholder.jpg,home-inspiration,,https://lawntrend.com/husqvarna-yta24v48-transmission-problems/?utm_source=pinterest&utm_campaign=husqvarna-transmissi,2025-05-16,"Want to avoid YTA24V48 transmission problems altogether?  This post focuses on preventative maintenance tips to keep your transmission running smoothly for years to come.  Learn about proper fluid changes, belt inspections",and other essential care practices.  A little prevention goes a long way! #PreventativeCare #HusqvarnaMaintenance #LawnMowerCare #TransmissionHealth,and other essential care practices.  A little prevention goes a long way! #PreventativeCare #HusqvarnaMaintenance #LawnMowerCare #TransmissionHealth
YTA24V48: Clutch Problems & Transmission,https://res.cloudinary.com/dbcpfy04c/image/upload/v1618237451/placeholder.jpg,home-inspiration,,https://lawntrend.com/husqvarna-yta24v48-transmission-problems/?utm_source=pinterest&utm_campaign=yta24v48-clutch-prob,2025-05-16,Is a slipping or failing clutch causing transmission issues on your Husqvarna YTA24V48?  We explain the connection between the clutch and transmission,and how to diagnose and repair clutch-related problems.  Get your mower engaging properly and enjoy a smooth mowing experience. #ClutchRepair #HusqvarnaClutch #TransmissionLink #LawnMowerFix,and how to diagnose and repair clutch-related problems.  Get your mower engaging properly and enjoy a smooth mowing experience. #ClutchRepair #HusqvarnaClutch #TransmissionLink #LawnMowerFix
Husqvarna Transmission: DIY vs. Pro?,https://res.cloudinary.com/dbcpfy04c/image/upload/v1618237451/placeholder.jpg,home-inspiration,,https://lawntrend.com/husqvarna-yta24v48-transmission-problems/?utm_source=pinterest&utm_campaign=husqvarna-transmissi,2025-05-16,"Should you tackle your YTA24V48 transmission repair yourself, or hire a professional?  We weigh the pros and cons of each option, considering your skill level, time constraints",and budget.  Make an informed decision and get your mower fixed the right way. #DIYvsPro #HusqvarnaRepair #MowerService #LawnCareDecision,and budget.  Make an informed decision and get your mower fixed the right way. #DIYvsPro #HusqvarnaRepair #MowerService #LawnCareDecision
YTA24V48 Transmission: Common Mistakes,https://res.cloudinary.com/dbcpfy04c/image/upload/v1618237451/placeholder.jpg,home-inspiration,,https://lawntrend.com/husqvarna-yta24v48-transmission-problems/?utm_source=pinterest&utm_campaign=yta24v48-transmissio,2025-05-16,"Avoid these common mistakes when working on your Husqvarna YTA24V48 transmission!  We share valuable insights to help you prevent damage and ensure a successful repair.  Learn from our experience and save yourself time, money",and frustration. #CommonMistakes #HusqvarnaTips #MowerRepairGuide #LawnEquipmentHelp,and frustration. #CommonMistakes #HusqvarnaTips #MowerRepairGuide #LawnEquipmentHelp
Husqvarna YTA24V48: Full Repair Checklist,https://res.cloudinary.com/dbcpfy04c/image/upload/v1618237451/placeholder.jpg,home-inspiration,,https://lawntrend.com/husqvarna-yta24v48-transmission-problems/?utm_source=pinterest&utm_campaign=husqvarna-yta24v48-f,2025-05-16,Don't miss a step! This comprehensive checklist guides you through a complete YTA24V48 transmission repair. From diagnosis to final testing,we've got you covered. Ensure a thorough and reliable fix for your mower. #RepairChecklist #HusqvarnaGuide #MowerMaintenance #LawnCare,we've got you covered. Ensure a thorough and reliable fix for your mower. #RepairChecklist #HusqvarnaGuide #MowerMaintenance #LawnCare
YTA24V48: Transmission Linkage Issues?,https://res.cloudinary.com/dbcpfy04c/image/upload/v1618237451/placeholder.jpg,home-inspiration,,https://lawntrend.com/husqvarna-yta24v48-transmission-problems/?utm_source=pinterest&utm_campaign=yta24v48-transmissio,2025-05-16,Is the transmission linkage on your Husqvarna YTA24V48 loose or damaged? We explain how to inspect and repair the linkage,ensuring proper gear shifting and operation. Restore smooth control of your mower. #TransmissionLinkage #HusqvarnaFix #MowerControl #LawnEquipment,ensuring proper gear shifting and operation. Restore smooth control of your mower. #TransmissionLinkage #HusqvarnaFix #MowerControl #LawnEquipment
YTA24V48: Transmission Replacement Cost?,https://res.cloudinary.com/dbcpfy04c/image/upload/v1618237451/placeholder.jpg,home-inspiration,,https://lawntrend.com/husqvarna-yta24v48-transmission-problems/?utm_source=pinterest&utm_campaign=yta24v48-transmissio,2025-05-16,"Considering a full transmission replacement for your Husqvarna YTA24V48? We detail the costs involved, including parts and labor",to help you make an informed decision. Understand your options and budget accordingly. #TransmissionReplacement #HusqvarnaCost #MowerRepairBudget #LawnCareFinance,to help you make an informed decision. Understand your options and budget accordingly. #TransmissionReplacement #HusqvarnaCost #MowerRepairBudget #LawnCareFinance
Husqvarna YTA24V48: Winter Storage & Transmission,https://res.cloudinary.com/dbcpfy04c/image/upload/v1618237451/placeholder.jpg,home-inspiration,,https://lawntrend.com/husqvarna-yta24v48-transmission-problems/?utm_source=pinterest&utm_campaign=husqvarna-yta24v48-w,2025-05-16,Protect your YTA24V48 transmission during winter storage! We provide essential tips for preparing your mower for the off-season,preventing corrosion and ensuring a smooth start in the spring. #WinterStorage #HusqvarnaPrep #MowerMaintenance #LawnCareSeason,preventing corrosion and ensuring a smooth start in the spring. #WinterStorage #HusqvarnaPrep #MowerMaintenance #LawnCareSeason
YTA24V48: Transmission Troubleshooting Flowchart,https://res.cloudinary.com/dbcpfy04c/image/upload/v1618237451/placeholder.jpg,home-inspiration,,https://lawntrend.com/husqvarna-yta24v48-transmission-problems/?utm_source=pinterest&utm_campaign=yta24v48-transmissio,2025-05-16,Confused about where to start with your YTA24V48 transmission problem? Our easy-to-follow flowchart guides you through the troubleshooting process,helping you pinpoint the issue quickly and efficiently. #TroubleshootingFlowchart #HusqvarnaHelp #MowerDiagnosis #LawnCareGuide,helping you pinpoint the issue quickly and efficiently. #TroubleshootingFlowchart #HusqvarnaHelp #MowerDiagnosis #LawnCareGuide
Title,https://res.cloudinary.com/dbcpfy04c/image/upload/v1618237451/placeholder.jpg,home-inspiration,,https://lawntrend.com/husqvarna-riding-mower-steering-problems/?utm_source=pinterest&utm_campaign=title,2025-05-16,Description,Keywords,Keywords
Husqvarna Mower Steering Fix!,https://res.cloudinary.com/dbcpfy04c/image/upload/v1618237451/placeholder.jpg,home-inspiration,,https://lawntrend.com/husqvarna-riding-mower-steering-problems/?utm_source=pinterest&utm_campaign=husqvarna-mower-stee,2025-05-16,"Is your Husqvarna riding mower steering feeling loose, jerky, or unresponsive? Don't let a frustrating steering issue ruin your lawn care! This guide dives deep into common problems – from worn tie rods to hydraulic issues – and provides clear",step-by-step solutions you can tackle yourself. Save money on expensive repairs and get back to enjoying a perfectly manicured lawn. Click to learn how to diagnose & fix it! #HusqvarnaMower #RidingMower #SteeringRepair #DIYLawnCare,step-by-step solutions you can tackle yourself. Save money on expensive repairs and get back to enjoying a perfectly manicured lawn. Click to learn how to diagnose & fix it! #HusqvarnaMower #RidingMower #SteeringRepair #DIYLawnCare
Husqvarna Steering: Easy Fixes,https://res.cloudinary.com/dbcpfy04c/image/upload/v1618237451/placeholder.jpg,home-inspiration,,https://lawntrend.com/husqvarna-riding-mower-steering-problems/?utm_source=pinterest&utm_campaign=husqvarna-steering-e,2025-05-16,Don't despair if your Husqvarna mower's steering is off! This post breaks down the most frequent steering problems,offering practical solutions for every skill level. We cover everything from simple adjustments to more involved repairs. Imagine effortlessly gliding across your yard again – it's closer than you think! Learn to troubleshoot and restore smooth steering today. #Husqvarna #MowerRepair #SteeringIssues #LawnMower,offering practical solutions for every skill level. We cover everything from simple adjustments to more involved repairs. Imagine effortlessly gliding across your yard again – it's closer than you think! Learn to troubleshoot and restore smooth steering today. #Husqvarna #MowerRepair #SteeringIssues #LawnMower
Loose Steering? Husqvarna Help,https://res.cloudinary.com/dbcpfy04c/image/upload/v1618237451/placeholder.jpg,home-inspiration,,https://lawntrend.com/husqvarna-riding-mower-steering-problems/?utm_source=pinterest&utm_campaign=loose-steering-husqv,2025-05-16,"Is your Husqvarna riding mower pulling to one side? A loose steering wheel can be a safety hazard and a major annoyance. This guide provides a comprehensive look at diagnosing and fixing steering problems, including checking for worn components and proper adjustments. Reclaim control of your mower and enjoy a safer",more efficient mowing experience! #HusqvarnaRidingMower #SteeringWheel #MowerMaintenance #LawnCareTips,more efficient mowing experience! #HusqvarnaRidingMower #SteeringWheel #MowerMaintenance #LawnCareTips
Husqvarna Mower Steering Guide,https://res.cloudinary.com/dbcpfy04c/image/upload/v1618237451/placeholder.jpg,home-inspiration,,https://lawntrend.com/husqvarna-riding-mower-steering-problems/?utm_source=pinterest&utm_campaign=husqvarna-mower-stee,2025-05-16,"Confused about your Husqvarna mower's steering system? We've got you covered! This detailed guide explains the components, common issues, and how to address them. From hydraulic fluid levels to linkage adjustments",we'll walk you through everything you need to know. Don't let steering problems slow you down – get back to mowing! #HusqvarnaSteering #RidingMowerRepair #LawnEquipment #DIYRepair,we'll walk you through everything you need to know. Don't let steering problems slow you down – get back to mowing! #HusqvarnaSteering #RidingMowerRepair #LawnEquipment #DIYRepair
Fix Husqvarna Steering Yourself,https://res.cloudinary.com/dbcpfy04c/image/upload/v1618237451/placeholder.jpg,home-inspiration,,https://lawntrend.com/husqvarna-riding-mower-steering-problems/?utm_source=pinterest&utm_campaign=fix-husqvarna-steeri,2025-05-16,"Save hundreds on repair costs! This blog post empowers you to diagnose and fix common Husqvarna riding mower steering problems. We provide clear instructions, helpful diagrams",and a list of tools you'll need. Take control of your lawn care and enjoy the satisfaction of a job well done. Click to learn more! #HusqvarnaDIY #MowerSteering #RepairGuide #LawnMowing,and a list of tools you'll need. Take control of your lawn care and enjoy the satisfaction of a job well done. Click to learn more! #HusqvarnaDIY #MowerSteering #RepairGuide #LawnMowing
Husqvarna Hydraulic Steering Fix,https://res.cloudinary.com/dbcpfy04c/image/upload/v1618237451/placeholder.jpg,home-inspiration,,https://lawntrend.com/husqvarna-riding-mower-steering-problems/?utm_source=pinterest&utm_campaign=husqvarna-hydraulic-,2025-05-16,"Is your Husqvarna mower's hydraulic steering acting up? This guide focuses specifically on hydraulic steering issues, including leaks, low fluid, and pump problems. Learn how to identify the source of the problem and implement effective solutions. Restore smooth",responsive steering and enjoy a hassle-free mowing experience. #HusqvarnaHydraulic #SteeringPump #MowerHydraulics #LawnCare,responsive steering and enjoy a hassle-free mowing experience. #HusqvarnaHydraulic #SteeringPump #MowerHydraulics #LawnCare
Steering Linkage Problems? Solved!,https://res.cloudinary.com/dbcpfy04c/image/upload/v1618237451/placeholder.jpg,home-inspiration,,https://lawntrend.com/husqvarna-riding-mower-steering-problems/?utm_source=pinterest&utm_campaign=steering-linkage-pro,2025-05-16,"Worn or damaged steering linkage can cause all sorts of problems with your Husqvarna riding mower. This post details how to inspect, repair",and replace steering linkage components. Don't let a simple fix turn into a costly repair – learn how to do it yourself! Get back to a smooth ride today. #SteeringLinkage #HusqvarnaParts #MowerFix #LawnMaintenance,and replace steering linkage components. Don't let a simple fix turn into a costly repair – learn how to do it yourself! Get back to a smooth ride today. #SteeringLinkage #HusqvarnaParts #MowerFix #LawnMaintenance
Husqvarna Steering Wheel Play?,https://res.cloudinary.com/dbcpfy04c/image/upload/v1618237451/placeholder.jpg,home-inspiration,,https://lawntrend.com/husqvarna-riding-mower-steering-problems/?utm_source=pinterest&utm_campaign=husqvarna-steering-w,2025-05-16,A wobbly steering wheel on your Husqvarna mower isn't just annoying – it's a sign of a potential problem. This guide explains how to diagnose and fix excessive steering wheel play,ensuring safe and precise control. Don't ignore this warning sign – address it now! #SteeringWheelPlay #HusqvarnaTroubleshooting #MowerSafety #LawnTips,ensuring safe and precise control. Don't ignore this warning sign – address it now! #SteeringWheelPlay #HusqvarnaTroubleshooting #MowerSafety #LawnTips
Troubleshooting Husqvarna Steering,https://res.cloudinary.com/dbcpfy04c/image/upload/v1618237451/placeholder.jpg,home-inspiration,,https://lawntrend.com/husqvarna-riding-mower-steering-problems/?utm_source=pinterest&utm_campaign=troubleshooting-husq,2025-05-16,Feeling frustrated with your Husqvarna mower's steering? This comprehensive troubleshooting guide will help you pinpoint the problem and find the right solution. We cover a wide range of issues,from loose connections to hydraulic failures. Don't give up – we're here to help! #HusqvarnaTroubleshoot #MowerProblems #SteeringSolutions #LawnHelp,from loose connections to hydraulic failures. Don't give up – we're here to help! #HusqvarnaTroubleshoot #MowerProblems #SteeringSolutions #LawnHelp
Husqvarna Mower Steering Noise?,https://res.cloudinary.com/dbcpfy04c/image/upload/v1618237451/placeholder.jpg,home-inspiration,,https://lawntrend.com/husqvarna-riding-mower-steering-problems/?utm_source=pinterest&utm_campaign=husqvarna-mower-stee,2025-05-16,Hearing strange noises while steering your Husqvarna mower? This post explores the potential causes of steering noise and provides solutions to quiet things down. From worn bearings to loose components,we'll help you identify the source of the problem. #HusqvarnaNoise #SteeringSounds #MowerDiagnosis #LawnQuiet,we'll help you identify the source of the problem. #HusqvarnaNoise #SteeringSounds #MowerDiagnosis #LawnQuiet
Husqvarna Steering: Parts Guide,https://res.cloudinary.com/dbcpfy04c/image/upload/v1618237451/placeholder.jpg,home-inspiration,,https://lawntrend.com/husqvarna-riding-mower-steering-problems/?utm_source=pinterest&utm_campaign=husqvarna-steering-p,2025-05-16,Need to replace a steering component on your Husqvarna mower? This guide provides a comprehensive overview of the parts involved in the steering system,along with helpful tips for finding the right replacements. Get your mower back in top shape! #HusqvarnaPartsGuide #MowerComponents #SteeringParts #LawnRepair,along with helpful tips for finding the right replacements. Get your mower back in top shape! #HusqvarnaPartsGuide #MowerComponents #SteeringParts #LawnRepair
