Title,Media URL,Pinterest board,Thumbnail,Link,Publish date,Description,Keywords,
2025R: Transmission Issues?,https://res.cloudinary.com/dbcpfy04c/image/upload/v1747254118/pin_2_11_zfixpr.webp,tractor-repair-ideas,,https://lawntrend.com/john-deere-2025r-problems/?utm_source=pinterest&utm_campaign=2025r-transmission-i,2025-05-14,"Experiencing shifting problems or unusual noises from your 2025R's transmission? This pin focuses on common transmission issues, including low fluid levels, worn clutches",and gear problems. We provide troubleshooting tips and advice on transmission maintenance. Keep your tractor moving – click to read the full article! #JohnDeereTransmission #2025RTransmission #TractorTransmission #TransmissionRepair,and gear problems. We provide troubleshooting tips and advice on transmission maintenance. Keep your tractor moving – click to read the full article! #JohnDeereTransmission #2025RTransmission #TractorTransmission #TransmissionRepair
John Deere 2025R: DIY Fixes?,https://res.cloudinary.com/dbcpfy04c/image/upload/v1747254124/pin_2_12_ylxt0f.webp,tractor-repair-ideas,,https://lawntrend.com/john-deere-2025r-problems/?utm_source=pinterest&utm_campaign=john-deere-2025r-diy,2025-05-14,Empower yourself! This pin highlights simple DIY fixes you can perform on your John Deere 2025R,saving you money on repair costs. We cover basic maintenance tasks and common troubleshooting steps.  Learn to take care of your tractor yourself! Click to read our guide to DIY tractor repair. #JohnDeereDIY #2025RDiy #TractorRepair #DIYMaintenance,saving you money on repair costs. We cover basic maintenance tasks and common troubleshooting steps.  Learn to take care of your tractor yourself! Click to read our guide to DIY tractor repair. #JohnDeereDIY #2025RDiy #TractorRepair #DIYMaintenance
2025R: Common Sensor Failures,https://res.cloudinary.com/dbcpfy04c/image/upload/v1747254130/pin_2_13_p3tbxs.webp,tractor-repair-ideas,,https://lawntrend.com/john-deere-2025r-problems/?utm_source=pinterest&utm_campaign=2025r-common-sensor-,2025-05-14,"Sensors play a crucial role in your 2025R's performance. This pin focuses on common sensor failures, including temperature sensors, pressure sensors",and speed sensors. We explain how to diagnose sensor problems and offer replacement advice. Keep your tractor running accurately – click to learn more! #JohnDeereSensors #2025RSensors #TractorSensors #SensorRepair,and speed sensors. We explain how to diagnose sensor problems and offer replacement advice. Keep your tractor running accurately – click to learn more! #JohnDeereSensors #2025RSensors #TractorSensors #SensorRepair
John Deere 2025R: Cost of Repairs,https://res.cloudinary.com/dbcpfy04c/image/upload/v1747254136/pin_2_14_gdjs2u.webp,tractor-repair-ideas,,https://lawntrend.com/john-deere-2025r-problems/?utm_source=pinterest&utm_campaign=john-deere-2025r-cos,2025-05-14,Worried about repair bills? This pin provides a realistic overview of the potential cost of common repairs for the John Deere 2025R.  We break down the costs of parts and labor,helping you budget for maintenance.  Be prepared and avoid unexpected expenses! Click to read the full article. #JohnDeereRepairCost #2025RCost #TractorRepairCost #RepairBudget,helping you budget for maintenance.  Be prepared and avoid unexpected expenses! Click to read the full article. #JohnDeereRepairCost #2025RCost #TractorRepairCost #RepairBudget
2025R: Finding Reliable Parts,https://res.cloudinary.com/dbcpfy04c/image/upload/v1747254142/pin_2_15_wbms04.webp,tractor-parts-ideas,,https://lawntrend.com/john-deere-2025r-problems/?utm_source=pinterest&utm_campaign=2025r-finding-reliab,2025-05-14,Where to source quality parts for your John Deere 2025R? This pin guides you to reliable sources for genuine and aftermarket parts.  We discuss the pros and cons of each option,helping you make informed decisions.  Don't compromise on quality – click to learn more! #JohnDeereParts #2025RParts #TractorParts #PartsSource,helping you make informed decisions.  Don't compromise on quality – click to learn more! #JohnDeereParts #2025RParts #TractorParts #PartsSource
John Deere 2025R: Troubleshooting Guide,https://res.cloudinary.com/dbcpfy04c/image/upload/v1747254147/pin_2_16_xdlg5u.webp,tractor-repair-ideas,,https://lawntrend.com/john-deere-2025r-problems/?utm_source=pinterest&utm_campaign=john-deere-2025r-tro,2025-05-14,A comprehensive guide to tackling problems with your 2025R. This pin links to the full blog post,offering a detailed troubleshooting resource for common issues.  Don't feel helpless – empower yourself with knowledge! Click to access the complete guide. #JohnDeereTroubleshooting #2025RTroubleshooting #TractorGuide #TroubleshootingTips,offering a detailed troubleshooting resource for common issues.  Don't feel helpless – empower yourself with knowledge! Click to access the complete guide. #JohnDeereTroubleshooting #2025RTroubleshooting #TractorGuide #TroubleshootingTips
2025R: Is it Worth Repairing?,https://res.cloudinary.com/dbcpfy04c/image/upload/v1747254153/pin_2_17_fcjdw1.webp,tractor-repair-ideas,,https://lawntrend.com/john-deere-2025r-problems/?utm_source=pinterest&utm_campaign=2025r-is-it-worth-re,2025-05-14,Facing a major repair on your 2025R? This pin helps you decide whether it's worth repairing or time to consider a replacement. We discuss factors to consider,including repair costs and the tractor's overall condition. Make an informed decision! Click to read the full article. #JohnDeereRepairOrReplace #2025RDecision #TractorValue #RepairAssessment,including repair costs and the tractor's overall condition. Make an informed decision! Click to read the full article. #JohnDeereRepairOrReplace #2025RDecision #TractorValue #RepairAssessment
John Deere 2025R: Common Mistakes,https://res.cloudinary.com/dbcpfy04c/image/upload/v1747254159/pin_2_18_jslkgk.webp,tractor-repair-ideas,,https://lawntrend.com/john-deere-2025r-problems/?utm_source=pinterest&utm_campaign=john-deere-2025r-com,2025-05-14,Avoid these common mistakes that can damage your John Deere 2025R! This pin highlights preventable errors that owners often make,leading to costly repairs. Learn from others' mistakes and protect your investment. Click to read the full article. #JohnDeereMistakes #2025RErrors #TractorTips #AvoidThese,leading to costly repairs. Learn from others' mistakes and protect your investment. Click to read the full article. #JohnDeereMistakes #2025RErrors #TractorTips #AvoidThese
2025R: Winterizing Your Tractor,https://res.cloudinary.com/dbcpfy04c/image/upload/v1747254165/pin_2_19_gf8n1b.webp,tractor-tips-ideas,,https://lawntrend.com/john-deere-2025r-problems/?utm_source=pinterest&utm_campaign=2025r-winterizing-yo,2025-05-14,Prepare your John Deere 2025R for the cold winter months! This pin provides a step-by-step guide to winterizing your tractor,protecting it from damage and ensuring it's ready to go when spring arrives. Don't let winter take its toll – click to learn more! #JohnDeereWinterizing #2025RWinter #TractorWinter #WinterPrep,protecting it from damage and ensuring it's ready to go when spring arrives. Don't let winter take its toll – click to learn more! #JohnDeereWinterizing #2025RWinter #TractorWinter #WinterPrep
2025R: Dealing with Vibration,https://res.cloudinary.com/dbcpfy04c/image/upload/v1747254173/pin_2_20_utwcxj.webp,tractor-repair-ideas,,https://lawntrend.com/john-deere-2025r-problems/?utm_source=pinterest&utm_campaign=2025r-dealing-with-v,2025-05-14,"Is your 2025R vibrating excessively? This pin addresses the causes of vibration, including loose components, unbalanced tires",and engine problems. We offer troubleshooting tips and advice on resolving vibration issues. Enjoy a smoother ride – click to learn more! #JohnDeereVibration #2025RVibration #TractorVibration #SmoothRide,and engine problems. We offer troubleshooting tips and advice on resolving vibration issues. Enjoy a smoother ride – click to learn more! #JohnDeereVibration #2025RVibration #TractorVibration #SmoothRide
2025R: Battery Maintenance Guide,https://res.cloudinary.com/dbcpfy04c/image/upload/v1747254179/pin_2_21_j8xgpw.webp,tractor-care-ideas,,https://lawntrend.com/john-deere-2025r-problems/?utm_source=pinterest&utm_campaign=2025r-battery-mainte,2025-05-14,"Keep your 2025R's battery in top condition! This pin provides a comprehensive guide to battery maintenance, including cleaning, charging",and testing. A healthy battery is essential for reliable starting. Click to read the full article. #JohnDeereBattery #2025RBattery #TractorBattery #BatteryCare,and testing. A healthy battery is essential for reliable starting. Click to read the full article. #JohnDeereBattery #2025RBattery #TractorBattery #BatteryCare
2025R: When to Call a Pro,https://res.cloudinary.com/dbcpfy04c/image/upload/v1747254187/pin_2_22_vldzhv.webp,tractor-repair-ideas,,https://lawntrend.com/john-deere-2025r-problems/?utm_source=pinterest&utm_campaign=2025r-when-to-call-a,2025-05-14,Sometimes,DIY isn't enough. This pin helps you determine when it's time to call a professional mechanic for repairs on your John Deere 2025R. Don't risk making things worse – know your limits! Click to read the full article. #JohnDeereProRepair #2025RService #TractorMechanic #WhenToCall,DIY isn't enough. This pin helps you determine when it's time to call a professional mechanic for repairs on your John Deere 2025R. Don't risk making things worse – know your limits! Click to read the full article. #JohnDeereProRepair #2025RService #TractorMechanic #WhenToCall
Title,https://res.cloudinary.com/dbcpfy04c/image/upload/v1747254232/pin_3_1_emua1z.webp,please-provide-the-title-and-keywords-i-need-that-information-to-suggest-a-board-name-once,,https://lawntrend.com/john-deere-2010-problems/?utm_source=pinterest&utm_campaign=title,2025-05-14,Description,Keywords,Keywords
John Deere 2010: Common Issues,https://res.cloudinary.com/dbcpfy04c/image/upload/v1747254238/pin_3_2_cbuerd.webp,tractor-repair-ideas,,https://lawntrend.com/john-deere-2010-problems/?utm_source=pinterest&utm_campaign=john-deere-2010-comm,2025-05-14,"Is your John Deere 2010 giving you trouble? Don't let frustrating breakdowns ruin your work! This guide dives deep into the most common problems with the 2010 model – from hydraulic failures to engine issues. Learn to diagnose, troubleshoot, and even potentially fix these issues yourself",saving you time and money. We cover everything from fuel system concerns to transmission woes.  Don't suffer through another season of downtime! Click to learn how to keep your Deere running smoothly. #JohnDeere2010 #TractorProblems #FarmEquipment #DIYRepair,saving you time and money. We cover everything from fuel system concerns to transmission woes.  Don't suffer through another season of downtime! Click to learn how to keep your Deere running smoothly. #JohnDeere2010 #TractorProblems #FarmEquipment #DIYRepair
2010 Deere: Hydraulic Headache?,https://res.cloudinary.com/dbcpfy04c/image/upload/v1747254244/pin_3_3_qdmcol.webp,tractor-repair-ideas,,https://lawntrend.com/john-deere-2010-problems/?utm_source=pinterest&utm_campaign=2010-deere-hydraulic,2025-05-14,"Dealing with hydraulic problems on your John Deere 2010? It's a common issue! This pin highlights the most frequent hydraulic failures, their causes, and practical solutions.  We break down complex systems into easy-to-understand steps, helping you identify leaks, pump failures",and cylinder issues.  Avoid costly repairs by learning preventative maintenance tips.  Don't let a hydraulic issue sideline your productivity – get the answers you need now! #JohnDeereHydraulics #TractorRepair #HydraulicProblems #FarmLife,and cylinder issues.  Avoid costly repairs by learning preventative maintenance tips.  Don't let a hydraulic issue sideline your productivity – get the answers you need now! #JohnDeereHydraulics #TractorRepair #HydraulicProblems #FarmLife
Transmission Issues: 2010 Deere,https://res.cloudinary.com/dbcpfy04c/image/upload/v1747254252/pin_3_4_en2caj.webp,tractor-repair-ideas,,https://lawntrend.com/john-deere-2010-problems/?utm_source=pinterest&utm_campaign=transmission-issues-,2025-05-14,"Don't ignore transmission problems on your John Deere 2010! A failing transmission can lead to major downtime and expensive repairs. This pin details common transmission issues, including slipping gears, rough shifting, and complete failure. Learn how to identify the symptoms and explore potential solutions",from fluid checks to complete overhauls.  Protect your investment and keep moving forward! #JohnDeereTransmission #TractorTransmission #TransmissionRepair #FarmWork,from fluid checks to complete overhauls.  Protect your investment and keep moving forward! #JohnDeereTransmission #TractorTransmission #TransmissionRepair #FarmWork
Fuel System Fixes for Deere 2010,https://res.cloudinary.com/dbcpfy04c/image/upload/v1747254259/pin_3_5_omjx70.webp,tractor-repair-ideas,,https://lawntrend.com/john-deere-2010-problems/?utm_source=pinterest&utm_campaign=fuel-system-fixes-fo,2025-05-14,"Is your John Deere 2010 struggling with fuel delivery? This pin tackles common fuel system problems, including clogged filters, faulty fuel pumps, and injector issues.  We provide a clear guide to diagnosing and resolving these problems",ensuring optimal engine performance.  Don't let a fuel issue slow you down – get back to work quickly!  Click for expert advice. #JohnDeereFuelSystem #FuelPump #FuelFilter #TractorFuel,ensuring optimal engine performance.  Don't let a fuel issue slow you down – get back to work quickly!  Click for expert advice. #JohnDeereFuelSystem #FuelPump #FuelFilter #TractorFuel
2010 Deere: Electrical Gremlins?,https://res.cloudinary.com/dbcpfy04c/image/upload/v1747254265/pin_3_6_fnuvly.webp,tractor-repair-ideas,,https://lawntrend.com/john-deere-2010-problems/?utm_source=pinterest&utm_campaign=2010-deere-electrica,2025-05-14,"Electrical problems can be incredibly frustrating. This pin focuses on diagnosing and fixing common electrical issues on your John Deere 2010, including faulty wiring, bad sensors, and starter problems.  We provide a step-by-step guide to troubleshooting and repair",helping you get your tractor back up and running.  Don't let electrical issues leave you in the dark! #JohnDeereElectrical #TractorWiring #ElectricalRepair #FarmTech,helping you get your tractor back up and running.  Don't let electrical issues leave you in the dark! #JohnDeereElectrical #TractorWiring #ElectricalRepair #FarmTech
John Deere 2010: Coolant Concerns,https://res.cloudinary.com/dbcpfy04c/image/upload/v1747254272/pin_3_7_ac5a4m.webp,tractor-repair-ideas,,https://lawntrend.com/john-deere-2010-problems/?utm_source=pinterest&utm_campaign=john-deere-2010-cool,2025-05-14,"Overheating is a serious issue! This pin addresses common cooling system problems on your John Deere 2010, including radiator leaks, thermostat failures",and water pump issues.  Learn how to diagnose and fix these problems to prevent engine damage.  Keep your engine cool and running efficiently. Click to learn more! #JohnDeereCoolingSystem #RadiatorRepair #Thermostat #TractorCoolant,and water pump issues.  Learn how to diagnose and fix these problems to prevent engine damage.  Keep your engine cool and running efficiently. Click to learn more! #JohnDeereCoolingSystem #RadiatorRepair #Thermostat #TractorCoolant
2010 Deere: PTO Problems Solved,https://res.cloudinary.com/dbcpfy04c/image/upload/v1747254278/pin_3_8_oq8q83.webp,tractor-repair-ideas,,https://lawntrend.com/john-deere-2010-problems/?utm_source=pinterest&utm_campaign=2010-deere-pto-probl,2025-05-14,"Having trouble with your John Deere 2010's PTO? This pin dives into common PTO issues, including slipping clutches, broken shafts, and engagement problems.  We provide a detailed guide to troubleshooting and repair",helping you get your implements working smoothly.  Don't let PTO problems disrupt your work! #JohnDeerePTO #PTORepair #TractorPTO #FarmImplements,helping you get your implements working smoothly.  Don't let PTO problems disrupt your work! #JohnDeerePTO #PTORepair #TractorPTO #FarmImplements
John Deere 2010: Steering Issues?,https://res.cloudinary.com/dbcpfy04c/image/upload/v1747254283/pin_3_9_ksxh0z.webp,tractor-repair-ideas,,https://lawntrend.com/john-deere-2010-problems/?utm_source=pinterest&utm_campaign=john-deere-2010-stee,2025-05-14,"Is your John Deere 2010 steering feeling loose or unresponsive? This pin focuses on diagnosing and fixing common steering problems, including power steering pump failures, worn tie rods",and loose connections.  Ensure safe and precise control of your tractor. Click to learn how! #JohnDeereSteering #SteeringRepair #PowerSteering #TractorControl,and loose connections.  Ensure safe and precise control of your tractor. Click to learn how! #JohnDeereSteering #SteeringRepair #PowerSteering #TractorControl
2010 Deere: Battery & Charging Tips,https://res.cloudinary.com/dbcpfy04c/image/upload/v1747254290/pin_3_10_lgv2bz.webp,tractor-repair-ideas,,https://lawntrend.com/john-deere-2010-problems/?utm_source=pinterest&utm_campaign=2010-deere-battery-c,2025-05-14,"A dead battery can ruin your day. This pin provides essential tips for maintaining your John Deere 2010's battery and charging system.  We cover common problems like corroded terminals, faulty alternators",and weak batteries.  Keep your tractor powered up and ready to work! #JohnDeereBattery #ChargingSystem #TractorBattery #FarmPower,and weak batteries.  Keep your tractor powered up and ready to work! #JohnDeereBattery #ChargingSystem #TractorBattery #FarmPower
DIY Repair: Deere 2010 Guide,https://res.cloudinary.com/dbcpfy04c/image/upload/v1747254296/pin_3_11_wbrycn.webp,tractor-repair-ideas,,https://lawntrend.com/john-deere-2010-problems/?utm_source=pinterest&utm_campaign=diy-repair-deere-201,2025-05-14,Empower yourself with the knowledge to tackle common repairs on your John Deere 2010! This pin highlights the blog post's DIY-friendly approach,offering step-by-step instructions and helpful tips. Save money and gain valuable skills.  Don't be intimidated – you can do it! #DIYTractorRepair #JohnDeereDIY #TractorMaintenance #FarmHacks,offering step-by-step instructions and helpful tips. Save money and gain valuable skills.  Don't be intimidated – you can do it! #DIYTractorRepair #JohnDeereDIY #TractorMaintenance #FarmHacks
John Deere 2010: Common Warning Signs,https://res.cloudinary.com/dbcpfy04c/image/upload/v1747254302/pin_3_12_dpqm0b.webp,tractor-repair-ideas,,https://lawntrend.com/john-deere-2010-problems/?utm_source=pinterest&utm_campaign=john-deere-2010-comm,2025-05-14,"Learn to recognize the early warning signs of potential problems with your John Deere 2010. This pin highlights key indicators of engine, hydraulic, and transmission issues.  Early detection can save you time, money",and frustration.  Stay ahead of the curve! #JohnDeereWarningSigns #TractorTroubleshooting #FarmEquipmentProblems #EarlyDetection,and frustration.  Stay ahead of the curve! #JohnDeereWarningSigns #TractorTroubleshooting #FarmEquipmentProblems #EarlyDetection
John Deere 2010: Troubleshooting Guide,https://res.cloudinary.com/dbcpfy04c/image/upload/v1747254307/pin_3_13_ezralq.webp,tractor-repair-ideas,,https://lawntrend.com/john-deere-2010-problems/?utm_source=pinterest&utm_campaign=john-deere-2010-trou,2025-05-14,Feeling overwhelmed by tractor problems? This pin promotes the blog post as a comprehensive troubleshooting guide for your John Deere 2010.  We break down complex issues into manageable steps,helping you diagnose and resolve problems quickly. #JohnDeereTroubleshooting #TractorGuide #FarmEquipmentHelp #DIYFix,helping you diagnose and resolve problems quickly. #JohnDeereTroubleshooting #TractorGuide #FarmEquipmentHelp #DIYFix
John Deere 2010: Filter Replacement,https://res.cloudinary.com/dbcpfy04c/image/upload/v1747254312/pin_3_14_oevhdn.webp,tractor-repair-ideas,,https://lawntrend.com/john-deere-2010-problems/?utm_source=pinterest&utm_campaign=john-deere-2010-filt,2025-05-14,"Keep your John Deere 2010 running clean and efficient with regular filter replacements. This pin emphasizes the importance of changing air, fuel",and oil filters.  We provide guidance on selecting the right filters and performing the replacements correctly. #JohnDeereFilters #TractorFilters #AirFilter #OilFilter,and oil filters.  We provide guidance on selecting the right filters and performing the replacements correctly. #JohnDeereFilters #TractorFilters #AirFilter #OilFilter
John Deere 2010: Starter Problems?,https://res.cloudinary.com/dbcpfy04c/image/upload/v1747254318/pin_3_15_itn1ej.webp,tractor-repair-ideas,,https://lawntrend.com/john-deere-2010-problems/?utm_source=pinterest&utm_campaign=john-deere-2010-star,2025-05-14,"Is your John Deere 2010 struggling to start? This pin focuses on diagnosing and fixing common starter problems, including faulty solenoids, worn brushes",and weak batteries.  Get your tractor started quickly and reliably. #JohnDeereStarter #StarterRepair #TractorStartingProblems #FarmEquipmentStartup,and weak batteries.  Get your tractor started quickly and reliably. #JohnDeereStarter #StarterRepair #TractorStartingProblems #FarmEquipmentStartup
2010 Deere: Save Money on Repairs,https://res.cloudinary.com/dbcpfy04c/image/upload/v1747254325/pin_3_16_o1w2n0.webp,tractor-repair-ideas,,https://lawntrend.com/john-deere-2010-problems/?utm_source=pinterest&utm_campaign=2010-deere-save-mone,2025-05-14,Don't break the bank on tractor repairs! This pin highlights the blog post's focus on DIY solutions and preventative maintenance,helping you save money on your John Deere 2010.  Take control of your tractor's maintenance and keep your budget in check. #JohnDeereRepairSavings #DIYTractorRepair #FarmEquipmentBudget #TractorMaintenanceCost,helping you save money on your John Deere 2010.  Take control of your tractor's maintenance and keep your budget in check. #JohnDeereRepairSavings #DIYTractorRepair #FarmEquipmentBudget #TractorMaintenanceCost
Title,https://res.cloudinary.com/dbcpfy04c/image/upload/v1747254370/pin_4_1_vsleco.webp,please-provide-the-title-and-keywords-i-need-that-information-to-suggest-a-board-name-once,,https://lawntrend.com/cub-cadet-2518-problems/?utm_source=pinterest&utm_campaign=title,2025-05-14,Description,Keywords,Keywords
Cub Cadet 2518 Issues: Fix It!,https://res.cloudinary.com/dbcpfy04c/image/upload/v1747254376/pin_4_2_mrzpqm.webp,lawn-repair-ideas,,https://lawntrend.com/cub-cadet-2518-problems/?utm_source=pinterest&utm_campaign=cub-cadet-2518-issue,2025-05-14,"Is your Cub Cadet 2518 giving you trouble? Don't let lawn care be a headache! This guide tackles common problems like starting issues, blade engagement failures, and erratic movement. We break down troubleshooting steps, from simple fixes to more complex repairs",empowering you to get back to enjoying your perfectly manicured lawn.  Avoid costly repairs & keep your mower running smoothly. Click to learn how to diagnose & fix your Cub Cadet! #CubCadet #LawnMowerRepair #DIYRepair #2518,empowering you to get back to enjoying your perfectly manicured lawn.  Avoid costly repairs & keep your mower running smoothly. Click to learn how to diagnose & fix your Cub Cadet! #CubCadet #LawnMowerRepair #DIYRepair #2518
Blade Engagement Issues? Solved!,https://res.cloudinary.com/dbcpfy04c/image/upload/v1747254382/pin_4_3_k0kowz.webp,lawn-care-ideas,,https://lawntrend.com/cub-cadet-2518-problems/?utm_source=pinterest&utm_campaign=blade-engagement-iss,2025-05-14,"Is your Cub Cadet 2518 blade refusing to engage?  This is a common issue, and we've got the answers! Our guide walks you through checking belts, spindles",and the engagement cable.  Don't let overgrown grass win!  Restore your cutting power and enjoy a beautifully maintained lawn. Click to learn how! #BladeEngagement #CubCadetRepair #LawnCare #MowerFix,and the engagement cable.  Don't let overgrown grass win!  Restore your cutting power and enjoy a beautifully maintained lawn. Click to learn how! #BladeEngagement #CubCadetRepair #LawnCare #MowerFix
2518 Mower Running Rough? Find Out Why,https://res.cloudinary.com/dbcpfy04c/image/upload/v1747254389/pin_4_4_gaaymf.webp,lawn-repair-ideas,,https://lawntrend.com/cub-cadet-2518-problems/?utm_source=pinterest&utm_campaign=2518-mower-running-r,2025-05-14,"Is your Cub Cadet 2518 running rough or sputtering? Don't ignore it! This pin directs you to a guide that covers potential causes like dirty air filters, old spark plugs",and fuel issues.  A smooth-running mower means a beautiful lawn.  Learn how to diagnose and fix it yourself! #RoughRunning #CubCadet2518 #EngineRepair #LawnMowerMaintenance,and fuel issues.  A smooth-running mower means a beautiful lawn.  Learn how to diagnose and fix it yourself! #RoughRunning #CubCadet2518 #EngineRepair #LawnMowerMaintenance
Fixing Cub Cadet 2518 Drive Issues,https://res.cloudinary.com/dbcpfy04c/image/upload/v1747254395/pin_4_5_t3yh2m.webp,lawn-repair-ideas,,https://lawntrend.com/cub-cadet-2518-problems/?utm_source=pinterest&utm_campaign=fixing-cub-cadet-251,2025-05-14,"Experiencing drive problems with your Cub Cadet 2518?  This pin points to a guide covering issues with the transmission, drive belt",and drive engagement.  Don't struggle with a mower that won't move!  Get expert advice and get your mower rolling again.  Click to learn more! #DriveProblems #CubCadet2518 #TransmissionRepair #LawnMowerFix,and drive engagement.  Don't struggle with a mower that won't move!  Get expert advice and get your mower rolling again.  Click to learn more! #DriveProblems #CubCadet2518 #TransmissionRepair #LawnMowerFix
