Title,Media URL,Pinterest board,Thumbnail,Link,Publish date,Description,Keywords
Title,https://res.cloudinary.com/dbcpfy04c/image/upload/v1747765564/pin_1_1_sku1pa.webp,please-provide-the-title-and-keywords-i-need-that-information-to-suggest-a-board-name-once,,https://www.beacleaner.com/how-to-clean-karndean-flooring?utm_source=pinterest&utm_campaign=title,2025-05-20,Description,Keywords
Karndean Cleaning: Your Guide!,https://res.cloudinary.com/dbcpfy04c/image/upload/v1747765571/pin_1_2_oxl5vq.webp,flooring-tips,,https://www.beacleaner.com/how-to-clean-karndean-flooring?utm_source=pinterest&utm_campaign=karndean-cleaning-yo,2025-05-20,Is your Karndean flooring looking dull? Don't worry! This guide reveals the secrets to a sparkling clean,protecting your investment for years to come. Learn the best cleaning solutions
Karndean Floor Care Tips,https://res.cloudinary.com/dbcpfy04c/image/upload/v1747765579/pin_1_3_lppk1w.webp,flooring-tips,,https://www.beacleaner.com/how-to-clean-karndean-flooring?utm_source=pinterest&utm_campaign=karndean-floor-care-,2025-05-20,Worried about scratching or damaging your Karndean floors? We've got you covered! This post breaks down everything you need to know about proper care,from daily sweeping to deep cleaning. Protect your beautiful floors and enjoy a worry-free home. Discover the simple steps to lasting beauty!  #KarndeanTips #VinylFlooring #CleaningHacks #HomeImprovement
The BEST Karndean Cleaner,https://res.cloudinary.com/dbcpfy04c/image/upload/v1747765587/pin_1_4_axvyyu.webp,floor-cleaning-tips,,https://www.beacleaner.com/how-to-clean-karndean-flooring?utm_source=pinterest&utm_campaign=the-best-karndean-cl,2025-05-20,Stop wasting money on ineffective cleaners! We reveal the absolute best products for your Karndean flooring,ensuring a streak-free shine and lasting protection.  Don't risk damaging your investment with harsh chemicals.  Find the perfect solution for a spotless home. Click to read now! #KarndeanCleaner #FloorCleaning #VinylFloorCare #CleaningProducts
Karndean: Do's & Don'ts,https://res.cloudinary.com/dbcpfy04c/image/upload/v1747765594/pin_1_5_ea8uge.webp,vinyl-floor-tips,,https://www.beacleaner.com/how-to-clean-karndean-flooring?utm_source=pinterest&utm_campaign=karndean-dos-donts,2025-05-20,Protect your Karndean investment! This guide outlines the essential do's and don'ts of cleaning,preventing damage and ensuring longevity. Avoid common mistakes that can dull the shine or even ruin your floors.  Keep your home looking its best with these simple rules. #KarndeanDoAndDont #FloorProtection #VinylFloors #CleaningGuide
Deep Clean Your Karndean!,https://res.cloudinary.com/dbcpfy04c/image/upload/v1747765604/pin_1_6_gqubuz.webp,floor-cleaning-tips,,https://www.beacleaner.com/how-to-clean-karndean-flooring?utm_source=pinterest&utm_campaign=deep-clean-your-karn,2025-05-20,Give your Karndean floors the deep clean they deserve! This step-by-step guide walks you through the process,removing stubborn dirt and grime for a truly refreshed look.  Enjoy the feeling of a sparkling clean home.  Click to learn the secrets! #KarndeanDeepClean #FloorRefresh #VinylCleaning #HomeCleaning
Karndean: Spot Cleaning Guide,https://res.cloudinary.com/dbcpfy04c/image/upload/v1747765611/pin_1_7_vl1pzk.webp,floor-cleaning-tips,,https://www.beacleaner.com/how-to-clean-karndean-flooring?utm_source=pinterest&utm_campaign=karndean-spot-cleani,2025-05-20,Spills happen! Learn how to quickly and effectively spot clean your Karndean flooring,preventing stains and keeping it looking pristine.  Don't let accidents ruin your beautiful floors.  This guide has you covered! #KarndeanSpotClean #StainRemoval #VinylFloor #QuickCleaning
Karndean vs. Other Flooring,https://res.cloudinary.com/dbcpfy04c/image/upload/v1747765619/pin_1_8_cysfxb.webp,flooring-ideas,,https://www.beacleaner.com/how-to-clean-karndean-flooring?utm_source=pinterest&utm_campaign=karndean-vs-other-fl,2025-05-20,Considering Karndean?  See how it stacks up against other flooring options in terms of cleaning and maintenance.  Make an informed decision for your home and enjoy a beautiful,easy-to-care-for floor. #KarndeanVs #FlooringOptions #VinylComparison #HomeDesign
Karndean: Removing Scuffs,https://res.cloudinary.com/dbcpfy04c/image/upload/v1747765626/pin_1_9_mslbos.webp,flooring-tips,,https://www.beacleaner.com/how-to-clean-karndean-flooring?utm_source=pinterest&utm_campaign=karndean-removing-sc,2025-05-20,Ugh,scuffs! Don't despair. This guide shows you how to easily remove scuffs from your Karndean flooring
Karndean: Pet-Friendly Cleaning,https://res.cloudinary.com/dbcpfy04c/image/upload/v1747765633/pin_1_10_ejwwrw.webp,pet-friendly-tips,,https://www.beacleaner.com/how-to-clean-karndean-flooring?utm_source=pinterest&utm_campaign=karndean-pet-friendl,2025-05-20,Love your pets,love your floors! Learn how to clean your Karndean flooring while keeping your furry friends safe and happy.  Enjoy a clean home without compromising their well-being. #KarndeanPets #PetFriendlyCleaning #VinylAndPets #HomeWithPets
Karndean: Kid-Proof Cleaning,https://res.cloudinary.com/dbcpfy04c/image/upload/v1747765640/pin_1_11_kho0jo.webp,family-cleaning-tips,,https://www.beacleaner.com/how-to-clean-karndean-flooring?utm_source=pinterest&utm_campaign=karndean-kid-proof-c,2025-05-20,Kids and messes go hand-in-hand! This guide provides tips for cleaning Karndean flooring in a busy household with children.  Keep your floors looking great,even with little ones around. #KarndeanKids #KidProofCleaning #VinylFamily #EasyHomeCleaning
Karndean: Avoiding Damage,https://res.cloudinary.com/dbcpfy04c/image/upload/v1747765646/pin_1_12_d6zt9q.webp,floor-care-tips,,https://www.beacleaner.com/how-to-clean-karndean-flooring?utm_source=pinterest&utm_campaign=karndean-avoiding-da,2025-05-20,Protect your investment! Learn the common mistakes to avoid when cleaning Karndean flooring,preventing damage and ensuring its longevity.  Keep your floors looking beautiful for years to come. #KarndeanDamage #FloorCareTips #VinylProtection #HomeMaintenance
Karndean: Shine Boosters,https://res.cloudinary.com/dbcpfy04c/image/upload/v1747765655/pin_1_13_unrqi7.webp,flooring-ideas,,https://www.beacleaner.com/how-to-clean-karndean-flooring?utm_source=pinterest&utm_campaign=karndean-shine-boost,2025-05-20,Want extra shine? Discover the secrets to boosting the shine of your Karndean flooring,leaving it looking like new.  Enjoy a radiant
Karndean: Before & After Cleaning,https://res.cloudinary.com/dbcpfy04c/image/upload/v1747765663/pin_1_14_f2dfsm.webp,floor-cleaning-tips,,https://www.beacleaner.com/how-to-clean-karndean-flooring?utm_source=pinterest&utm_campaign=karndean-before-afte,2025-05-20,See the amazing results! Check out our before & after photos of Karndean flooring cleaning,showcasing the transformative power of proper care.  Get inspired to clean your own floors! #KarndeanBeforeAfter #FloorTransformation #VinylCleaningResults #HomeMakeover
Karndean: Cleaning Under Furniture,https://res.cloudinary.com/dbcpfy04c/image/upload/v1747765670/pin_1_15_oygmms.webp,home-cleaning-tips,,https://www.beacleaner.com/how-to-clean-karndean-flooring?utm_source=pinterest&utm_campaign=karndean-cleaning-un,2025-05-20,Don't forget those hard-to-reach areas! This guide shows you how to easily clean under furniture and appliances,ensuring a thorough clean.  Enjoy a truly spotless home. #KarndeanUnderFurniture #HiddenCleaning #VinylDetail #HomeCleaningHacks
Karndean: Preventing Future Dirt,https://res.cloudinary.com/dbcpfy04c/image/upload/v1747765678/pin_1_16_ahgo8u.webp,floor-cleaning-tips,,https://www.beacleaner.com/how-to-clean-karndean-flooring?utm_source=pinterest&utm_campaign=karndean-preventing-,2025-05-20,Stop dirt at the door! Learn how to prevent dirt and grime from building up on your Karndean flooring,reducing cleaning time and effort.  Enjoy a consistently clean home. #KarndeanPrevention #DirtControl #VinylMaintenance #HomeTips
Karndean: Long-Term Care Guide,https://res.cloudinary.com/dbcpfy04c/image/upload/v1747765688/pin_1_17_ywokpv.webp,flooring-tips,,https://www.beacleaner.com/how-to-clean-karndean-flooring?utm_source=pinterest&utm_campaign=karndean-long-term-c,2025-05-20,Invest in the longevity of your floors! This comprehensive guide covers everything you need to know about long-term Karndean care,ensuring years of beauty and enjoyment. #KarndeanLongTerm #FloorLongevity #VinylCareGuide #HomeInvestment
Title,https://res.cloudinary.com/dbcpfy04c/image/upload/v1747765734/pin_2_1_ixtckx.webp,please-provide-the-title-and-keywords-i-need-that-information-to-suggest-a-board-name-once,,https://www.beacleaner.com/how-to-clean-kohler-acrylic-tub?utm_source=pinterest&utm_campaign=title,2025-05-20,Description,Keywords
Title,https://res.cloudinary.com/dbcpfy04c/image/upload/v1747765777/pin_3_1_yrqyxb.webp,please-provide-the-title-and-keywords-i-need-that-information-to-suggest-a-board-name-once,,https://www.beacleaner.com/how-to-clean-lagos-bracelet?utm_source=pinterest&utm_campaign=title,2025-05-20,Description,Keywords
Title,https://res.cloudinary.com/dbcpfy04c/image/upload/v1747765821/pin_4_1_mkpidz.webp,please-provide-the-title-and-keywords-i-need-that-information-to-suggest-a-board-name-once,,https://www.beacleaner.com/how-to-clean-mesh-outdoor-furniture?utm_source=pinterest&utm_campaign=title,2025-05-20,Description,Keywords
Revive Your Patio: Mesh Furniture Cleaning,https://res.cloudinary.com/dbcpfy04c/image/upload/v1747765830/pin_4_2_nec6qt.webp,patio-cleaning-tips,,https://www.beacleaner.com/how-to-clean-mesh-outdoor-furniture?utm_source=pinterest&utm_campaign=revive-your-patio-me,2025-05-20,"Is your mesh outdoor furniture looking dingy and worn? Don't replace it – restore it! This guide shows you exactly how to clean mesh outdoor furniture, from simple wiping to tackling tough stains. We'll cover everything from choosing the right cleaning solutions to preventing mildew. Imagine relaxing on beautifully clean furniture all summer long! Click to learn the secrets to a sparkling patio and extend the life of your favorite outdoor pieces. Don't let dirt ruin your outdoor fun!","Mesh Furniture,Outdoor Cleaning,Patio Care,Cleaning Tips"
Dirty Mesh Furniture? Fix It Fast!,https://res.cloudinary.com/dbcpfy04c/image/upload/v1747765837/pin_4_3_ztaikj.webp,outdoor-cleaning-tips,,https://www.beacleaner.com/how-to-clean-mesh-outdoor-furniture?utm_source=pinterest&utm_campaign=dirty-mesh-furniture,2025-05-20,"Don't let a dirty patio ruin your summer! This easy-to-follow guide will show you how to clean mesh outdoor furniture quickly and effectively. We'll break down the process step-by-step, so even beginners can achieve professional results. Learn how to remove dirt, grime, and even stubborn stains without damaging the delicate mesh.  A clean patio is a happy patio – reclaim your outdoor space today! Click to read now and enjoy your summer!","Mesh Cleaning,Outdoor Furniture,DIY Cleaning,Summer Prep"
Mesh Furniture Cleaning: The Ultimate Guide,https://res.cloudinary.com/dbcpfy04c/image/upload/v1747765844/pin_4_4_e6hilc.webp,patio-tips,,https://www.beacleaner.com/how-to-clean-mesh-outdoor-furniture?utm_source=pinterest&utm_campaign=mesh-furniture-clean,2025-05-20,"Worried about damaging your mesh outdoor furniture while cleaning?  This comprehensive guide takes the guesswork out of it! We cover the best cleaning methods for different types of mesh, plus tips for preventing future dirt buildup.  Protect your investment and keep your outdoor furniture looking its best for years to come.  A little effort goes a long way – click to learn how!  Enjoy relaxing outdoors without the stress of a dirty patio.","Outdoor Furniture Care,Mesh Material,Cleaning Guide,Patio Furniture"
Say Goodbye to Patio Grime!,https://res.cloudinary.com/dbcpfy04c/image/upload/v1747765851/pin_4_5_xgmx4u.webp,outdoor-cleaning-tips,,https://www.beacleaner.com/how-to-clean-mesh-outdoor-furniture?utm_source=pinterest&utm_campaign=say-goodbye-to-patio,2025-05-20,"Dreaming of a spotless patio?  This guide reveals the secrets to cleaning mesh outdoor furniture like a pro.  We'll show you how to tackle everything from everyday dirt to stubborn mildew stains.  Don't spend another summer battling grime – reclaim your outdoor oasis!  Click to learn the simple steps to a cleaner, more inviting patio.  You deserve a relaxing outdoor space!","Patio Cleaning,Mesh Furniture,Outdoor Living,Mildew Removal"
Easy Mesh Furniture Cleaning Hacks,https://res.cloudinary.com/dbcpfy04c/image/upload/v1747765858/pin_4_6_umld6k.webp,patio-tips,,https://www.beacleaner.com/how-to-clean-mesh-outdoor-furniture?utm_source=pinterest&utm_campaign=easy-mesh-furniture-,2025-05-20,Short on time?  These quick and easy mesh furniture cleaning hacks will save you hours of scrubbing!  We'll share our favorite tips and tricks for keeping your outdoor furniture looking its best with minimal effort.  Don't let a busy schedule prevent you from enjoying a clean and comfortable patio.  Click to discover the secrets to effortless outdoor cleaning!,"Quick Cleaning,Mesh Furniture,Outdoor Hacks,Patio Maintenance"
Protect Your Investment: Mesh Furniture,https://res.cloudinary.com/dbcpfy04c/image/upload/v1747765866/pin_4_7_fewznx.webp,furniture-care-tips,,https://www.beacleaner.com/how-to-clean-mesh-outdoor-furniture?utm_source=pinterest&utm_campaign=protect-your-investm,2025-05-20,"Your outdoor furniture is an investment – protect it! This guide shows you how to clean mesh outdoor furniture properly, preventing damage and extending its lifespan. Learn about the best cleaning solutions and techniques to keep your furniture looking new for years to come. Don't let the elements take their toll – click to learn how to preserve your patio paradise!","Furniture Protection,Mesh Care,Outdoor Investment,Cleaning Solutions"
From Dirty to Delightful: Mesh Cleaning,https://res.cloudinary.com/dbcpfy04c/image/upload/v1747765872/pin_4_8_tihsbm.webp,patio-cleaning-tips,,https://www.beacleaner.com/how-to-clean-mesh-outdoor-furniture?utm_source=pinterest&utm_campaign=from-dirty-to-deligh,2025-05-20,"Transform your dirty mesh outdoor furniture into a sparkling showpiece! This guide provides a step-by-step process for cleaning and restoring your patio furniture. We'll cover everything from pre-treatment to rinsing, ensuring a thorough and effective clean.  Imagine the satisfaction of a beautifully clean patio – click to learn how!","Mesh Restoration,Outdoor Furniture,Cleaning Process,Patio Transformation"
Mesh Furniture: Cleaning for Beginners,https://res.cloudinary.com/dbcpfy04c/image/upload/v1747765881/pin_4_9_ze2zuo.webp,outdoor-cleaning-tips,,https://www.beacleaner.com/how-to-clean-mesh-outdoor-furniture?utm_source=pinterest&utm_campaign=mesh-furniture-clean,2025-05-20,"New to outdoor furniture cleaning? No problem! This beginner-friendly guide will walk you through the process of cleaning mesh outdoor furniture with ease. We'll explain everything in simple terms, so you can achieve professional results without any stress.  Click to learn how to keep your patio looking its best!","Beginner Cleaning,Mesh Furniture,Outdoor Guide,Easy Cleaning"
The Secret to Spotless Mesh Furniture,https://res.cloudinary.com/dbcpfy04c/image/upload/v1747765888/pin_4_10_jpdvf9.webp,outdoor-cleaning-tips,,https://www.beacleaner.com/how-to-clean-mesh-outdoor-furniture?utm_source=pinterest&utm_campaign=the-secret-to-spotle,2025-05-20,"Unlock the secret to spotless mesh outdoor furniture! This guide reveals the best techniques for removing stubborn stains and keeping your furniture looking its best. We'll cover everything from food spills to bird droppings, ensuring a pristine patio all season long. Click to learn the secrets to a cleaner, more inviting outdoor space!","Stain Removal,Mesh Furniture,Outdoor Tips,Cleaning Secrets"
"Don't Replace It, Clean It! Mesh Furniture",https://res.cloudinary.com/dbcpfy04c/image/upload/v1747765897/pin_4_11_jdjqbk.webp,furniture-restoration-ideas,,https://www.beacleaner.com/how-to-clean-mesh-outdoor-furniture?utm_source=pinterest&utm_campaign=dont-replace-it-clea,2025-05-20,"Before you toss out your dirty mesh outdoor furniture, try cleaning it! This guide shows you how to restore your furniture to its former glory, saving you money and reducing waste. We'll cover everything from gentle cleaning to tackling tough stains. Click to learn how to give your furniture a new lease on life!","Furniture Restoration,Mesh Cleaning,Eco Friendly,Save Money"
Mildew on Mesh? We've Got You Covered!,https://res.cloudinary.com/dbcpfy04c/image/upload/v1747765904/pin_4_12_cffyot.webp,outdoor-cleaning-tips,,https://www.beacleaner.com/how-to-clean-mesh-outdoor-furniture?utm_source=pinterest&utm_campaign=mildew-on-mesh-weve-,2025-05-20,Don't let mildew ruin your outdoor fun! This guide provides a step-by-step process for removing mildew from mesh outdoor furniture. We'll cover the best cleaning solutions and techniques to eliminate mildew and prevent it from returning. Click to learn how to keep your patio fresh and inviting!,"Mildew Removal,Mesh Furniture,Outdoor Cleaning,Patio Fresh"
Mesh Furniture Cleaning: Before & After,https://res.cloudinary.com/dbcpfy04c/image/upload/v1747765911/pin_4_13_ektkls.webp,patio-tips,,https://www.beacleaner.com/how-to-clean-mesh-outdoor-furniture?utm_source=pinterest&utm_campaign=mesh-furniture-clean,2025-05-20,"See the amazing transformation! This guide showcases before-and-after photos of mesh outdoor furniture cleaning, inspiring you to tackle your own patio project. We'll provide a step-by-step process for achieving similar results, ensuring a sparkling clean patio. Click to see the incredible difference!","Before and After,Mesh Cleaning,Outdoor Transformation,Patio Inspiration"
Keep Your Patio Looking New: Mesh Care,https://res.cloudinary.com/dbcpfy04c/image/upload/v1747765918/pin_4_14_xckwh6.webp,patio-tips,,https://www.beacleaner.com/how-to-clean-mesh-outdoor-furniture?utm_source=pinterest&utm_campaign=keep-your-patio-look,2025-05-20,"Want to keep your patio looking new all season long? This guide provides essential tips for maintaining mesh outdoor furniture. We'll cover everything from regular cleaning to protective measures, ensuring your furniture stays in top condition. Click to learn how to preserve your outdoor oasis!","Patio Maintenance,Mesh Care,Outdoor Furniture,Long Lasting"
The Best Cleaning Solutions for Mesh,https://res.cloudinary.com/dbcpfy04c/image/upload/v1747765924/pin_4_15_c0gkyv.webp,outdoor-cleaning-tips,,https://www.beacleaner.com/how-to-clean-mesh-outdoor-furniture?utm_source=pinterest&utm_campaign=the-best-cleaning-so,2025-05-20,"Confused about which cleaning solutions to use on your mesh outdoor furniture? This guide breaks down the best options, ensuring a safe and effective clean. We'll cover everything from mild detergents to specialized cleaners. Click to learn which solutions will work best for your furniture!","Cleaning Solutions,Mesh Furniture,Outdoor Cleaning,Product Guide"
Mesh Furniture Cleaning: A Quick Checklist,https://res.cloudinary.com/dbcpfy04c/image/upload/v1747765931/pin_4_16_lcnhhu.webp,patio-tips,,https://www.beacleaner.com/how-to-clean-mesh-outdoor-furniture?utm_source=pinterest&utm_campaign=mesh-furniture-clean,2025-05-20,"Need a quick and easy reminder for cleaning your mesh outdoor furniture? This checklist provides a step-by-step guide, ensuring you don't miss a thing. We'll cover everything from pre-treatment to rinsing, making the process simple and efficient. Click to download your free checklist!","Cleaning Checklist,Mesh Furniture,Outdoor Guide,Quick Reference"
Extend the Life of Your Patio Furniture,https://res.cloudinary.com/dbcpfy04c/image/upload/v1747765938/pin_4_17_j0unhd.webp,patio-tips,,https://www.beacleaner.com/how-to-clean-mesh-outdoor-furniture?utm_source=pinterest&utm_campaign=extend-the-life-of-y,2025-05-20,"Don't let your patio furniture fall into disrepair! This guide shows you how to clean and maintain mesh outdoor furniture, extending its lifespan and saving you money. We'll cover everything from regular cleaning to protective measures. Click to learn how to protect your investment!","Furniture Lifespan,Mesh Care,Outdoor Investment,Patio Protection"
DIY Mesh Furniture Cleaning: Save Money!,https://res.cloudinary.com/dbcpfy04c/image/upload/v1747765944/pin_4_18_g9f0vu.webp,home-cleaning-tips,,https://www.beacleaner.com/how-to-clean-mesh-outdoor-furniture?utm_source=pinterest&utm_campaign=diy-mesh-furniture-c,2025-05-20,Skip the expensive cleaning services and DIY! This guide provides a cost-effective solution for cleaning mesh outdoor furniture. We'll show you how to achieve professional results using readily available supplies. Click to learn how to save money and keep your patio sparkling!,"DIY Cleaning,Mesh Furniture,Save Money,Outdoor Hacks"
Mesh Furniture Cleaning: Preventative Care,https://res.cloudinary.com/dbcpfy04c/image/upload/v1747765952/pin_4_19_ykpjyj.webp,patio-tips,,https://www.beacleaner.com/how-to-clean-mesh-outdoor-furniture?utm_source=pinterest&utm_campaign=mesh-furniture-clean,2025-05-20,"Prevention is key! This guide focuses on preventative care for mesh outdoor furniture, helping you avoid dirt buildup and stains. We'll cover everything from protective covers to regular brushing. Click to learn how to keep your patio looking its best with minimal effort!","Preventative Care,Mesh Furniture,Outdoor Maintenance,Patio Protection"
Refresh Your Outdoor Space: Mesh Cleaning,https://res.cloudinary.com/dbcpfy04c/image/upload/v1747765964/pin_4_20_kcit8a.webp,outdoor-cleaning-tips,,https://www.beacleaner.com/how-to-clean-mesh-outdoor-furniture?utm_source=pinterest&utm_campaign=refresh-your-outdoor,2025-05-20,Give your outdoor space a refresh with a thorough mesh furniture cleaning! This guide provides a step-by-step process for restoring your patio furniture to its former glory. We'll cover everything from gentle cleaning to tackling tough stains. Click to learn how to create a more inviting outdoor oasis!,"Outdoor Refresh,Mesh Cleaning,Patio Transformation,Outdoor Oasis"
Mesh Furniture: Cleaning Tips & Tricks,https://res.cloudinary.com/dbcpfy04c/image/upload/v1747765972/pin_4_21_z8zvbe.webp,outdoor-cleaning-tips,,https://www.beacleaner.com/how-to-clean-mesh-outdoor-furniture?utm_source=pinterest&utm_campaign=mesh-furniture-clean,2025-05-20,"Unlock the secrets to a sparkling clean patio with these mesh furniture cleaning tips and tricks! This guide shares our favorite hacks for removing dirt, grime, and stains. Click to learn how to make your outdoor furniture look its best!","Cleaning Tips,Mesh Furniture,Outdoor Hacks,Patio Secrets"
Is Your Mesh Furniture Fading? Clean It!,https://res.cloudinary.com/dbcpfy04c/image/upload/v1747765980/pin_4_22_ktuetk.webp,outdoor-furniture-tips,,https://www.beacleaner.com/how-to-clean-mesh-outdoor-furniture?utm_source=pinterest&utm_campaign=is-your-mesh-furnitu,2025-05-20,Sun exposure can cause mesh furniture to fade. This guide shows you how to clean mesh outdoor furniture to help restore its color and protect it from further damage. Click to learn how to keep your patio looking vibrant!,"Fading Furniture,Mesh Cleaning,Outdoor Protection,Color Restoration"
The Easiest Way to Clean Mesh Furniture,https://res.cloudinary.com/dbcpfy04c/image/upload/v1747765987/pin_4_23_gkvjsc.webp,home-cleaning-tips,,https://www.beacleaner.com/how-to-clean-mesh-outdoor-furniture?utm_source=pinterest&utm_campaign=the-easiest-way-to-c,2025-05-20,"Looking for the easiest way to clean your mesh outdoor furniture? This guide provides a simple and effective process, requiring minimal effort and supplies. Click to learn how to achieve a sparkling clean patio without the hassle!","Easy Cleaning,Mesh Furniture,Outdoor Guide,Simple Process"
Don't Let Dirt Ruin Your Summer!,https://res.cloudinary.com/dbcpfy04c/image/upload/v1747765994/pin_4_24_nxe0b3.webp,outdoor-living-ideas,,https://www.beacleaner.com/how-to-clean-mesh-outdoor-furniture?utm_source=pinterest&utm_campaign=dont-let-dirt-ruin-y,2025-05-20,"Don't let a dirty patio ruin your summer fun! This guide shows you how to clean mesh outdoor furniture quickly and effectively, so you can relax and enjoy the sunshine. Click to learn how to reclaim your outdoor space!","Summer Cleaning,Mesh Furniture,Outdoor Fun,Patio Enjoyment"
Mesh Furniture Cleaning: A Visual Guide,https://res.cloudinary.com/dbcpfy04c/image/upload/v1747766000/pin_4_25_eni4bd.webp,patio-tips,,https://www.beacleaner.com/how-to-clean-mesh-outdoor-furniture?utm_source=pinterest&utm_campaign=mesh-furniture-clean,2025-05-20,"Learn how to clean mesh outdoor furniture with this visual guide! We'll provide step-by-step photos and instructions, making the process easy to follow. Click to see how to achieve a sparkling clean patio!","Visual Guide,Mesh Cleaning,Outdoor Furniture,Step by Step"
Title,https://res.cloudinary.com/dbcpfy04c/image/upload/v1747766041/pin_5_1_puaxwn.webp,please-provide-the-title-and-keywords-i-need-that-information-to-suggest-a-board-name-once,,https://www.beacleaner.com/how-to-clean-mold-from-concrete-floor?utm_source=pinterest&utm_campaign=title,2025-05-20,Description,Keywords
Bye Bye Basement Mold!,https://res.cloudinary.com/dbcpfy04c/image/upload/v1747766048/pin_5_2_ar7cus.webp,mold-removal-tips,,https://www.beacleaner.com/how-to-clean-mold-from-concrete-floor?utm_source=pinterest&utm_campaign=bye-bye-basement-mol,2025-05-20,Don't let mold ruin your concrete floors (and your peace of mind)! This guide breaks down exactly how to safely and effectively clean mold from concrete,restoring your space to a healthy
