Title,Media URL,Pinterest board,Thumbnail,Link,Publish date,Description,Keywords
Grill Briquettes: Ash Removal Guide,https://res.cloudinary.com/dbcpfy04c/image/upload/v1748018115/pin_5_16_qjp8iw.webp,grilling-tips,,https://www.beacleaner.com/how-to-clean-grill-briquettes?utm_source=pinterest&utm_campaign=grill-briquettes-ash,2025-05-23,Struggling with ash removal? This post provides a detailed guide on how to safely and effectively remove ash from your grill briquettes.  We'll share tips for minimizing mess and maximizing efficiency.  Don't struggle!  Click to learn how to remove ash like a pro and prepare your grill for the next BBQ.  It's easier than you think.,Ash Removal
Grill Briquettes: Grease Removal,https://res.cloudinary.com/dbcpfy04c/image/upload/v1748018121/pin_5_17_repnfn.webp,grilling-tips,,https://www.beacleaner.com/how-to-clean-grill-briquettes?utm_source=pinterest&utm_campaign=grill-briquettes-gre,2025-05-23,Grease buildup ruining your BBQ? This post reveals how to effectively remove grease from grill briquettes,ensuring a clean and flavorful grilling surface.  We'll share tips for tackling stubborn grease stains.  Say goodbye to grease!  Click to learn how to remove grease and enjoy perfectly grilled meals.  It's a game-changer.
Grill Briquettes: Drying Methods,https://res.cloudinary.com/dbcpfy04c/image/upload/v1748018126/pin_5_18_bejedj.webp,grilling-tips,,https://www.beacleaner.com/how-to-clean-grill-briquettes?utm_source=pinterest&utm_campaign=grill-briquettes-dry,2025-05-23,Proper drying is crucial after cleaning! This post explores different methods for drying grill briquettes,preventing rust and ensuring optimal performance.  We'll share tips for achieving a thorough dry.  Don't skip this step!  Click to learn how to dry your briquettes properly and extend their lifespan.  It's essential for longevity.
Grill Briquettes: Storage Tips,https://res.cloudinary.com/dbcpfy04c/image/upload/v1748018134/pin_5_19_gkvewb.webp,grilling-tips,,https://www.beacleaner.com/how-to-clean-grill-briquettes?utm_source=pinterest&utm_campaign=grill-briquettes-sto,2025-05-23,How should you store clean grill briquettes? This post provides expert storage tips for keeping your briquettes in top condition,protecting them from moisture and damage.  We'll share best practices for long-term storage.  Store them right!  Click to learn how to store your briquettes and ensure they're ready for your next BBQ.  It's all about preparation.
Grill Briquettes: Cleaning Checklist,https://res.cloudinary.com/dbcpfy04c/image/upload/v1748018139/pin_5_20_g5wti3.webp,grilling-tips,,https://www.beacleaner.com/how-to-clean-grill-briquettes?utm_source=pinterest&utm_campaign=grill-briquettes-cle,2025-05-23,Need a quick reference? This post provides a handy cleaning checklist for grill briquettes,ensuring you don't miss a step.  We'll cover everything from ash removal to drying.  Stay organized!  Click to download our free cleaning checklist and make grill maintenance a breeze.  It's a lifesaver.
Grill Briquettes: DIY Cleaning Solution,https://res.cloudinary.com/dbcpfy04c/image/upload/v1748018147/pin_5_21_o4se1h.webp,grilling-tips,,https://www.beacleaner.com/how-to-clean-grill-briquettes?utm_source=pinterest&utm_campaign=grill-briquettes-diy,2025-05-23,Skip the store-bought cleaners! This post shares a DIY cleaning solution for grill briquettes,using simple ingredients you probably already have at home.  We'll show you how to create an effective and eco-friendly cleaner.  Get creative!  Click to learn how to make your own cleaning solution and save money.  It's a natural choice.
Grill Briquettes: Cleaning FAQs,https://res.cloudinary.com/dbcpfy04c/image/upload/v1748018153/pin_5_22_cyazk2.webp,grilling-tips,,https://www.beacleaner.com/how-to-clean-grill-briquettes?utm_source=pinterest&utm_campaign=grill-briquettes-cle,2025-05-23,Got questions about cleaning grill briquettes? This post answers frequently asked questions,providing clear and concise answers to common concerns.  We'll address everything from safety to effectiveness.  Get informed!  Click to read our FAQs and become a grill cleaning expert.  We've got you covered.
Grill Briquettes: Cleaning Safety,https://res.cloudinary.com/dbcpfy04c/image/upload/v1748018159/pin_5_23_bnxulq.webp,grilling-tips,,https://www.beacleaner.com/how-to-clean-grill-briquettes?utm_source=pinterest&utm_campaign=grill-briquettes-cle,2025-05-23,Safety first! This post emphasizes important safety precautions to take when cleaning grill briquettes,protecting you from burns and injuries.  We'll share tips for handling hot briquettes and cleaning solutions.  Stay safe!  Click to learn how to clean your briquettes safely and avoid accidents.  It's a priority.
Grill Briquettes: Cleaning for Flavor,https://res.cloudinary.com/dbcpfy04c/image/upload/v1748018164/pin_5_24_bstf5i.webp,grilling-tips,,https://www.beacleaner.com/how-to-clean-grill-briquettes?utm_source=pinterest&utm_campaign=grill-briquettes-cle,2025-05-23,Unlock the best BBQ flavor! This post explains how cleaning grill briquettes can significantly improve the taste of your food.  We'll show you how to remove unwanted flavors and enhance your grilling experience.  Taste the difference!  Click to learn how cleaning impacts flavor and enjoy a truly delicious BBQ.  It's a flavor boost.,BBQ Flavor
Grill Briquettes: Cleaning & Seasoning,https://res.cloudinary.com/dbcpfy04c/image/upload/v1748018169/pin_5_25_lgehco.webp,grilling-tips,,https://www.beacleaner.com/how-to-clean-grill-briquettes?utm_source=pinterest&utm_campaign=grill-briquettes-cle,2025-05-23,Clean *and* season your grill briquettes for optimal performance! This post explains how to season briquettes after cleaning,creating a protective layer and preventing sticking.  We'll share tips for achieving a perfectly seasoned grill.  Get seasoned!  Click to learn how to season your briquettes and enjoy a flawless grilling experience.  It's the finishing touch.
