Title,Media URL,Pinterest board,Thumbnail,Link,Publish date,Description,Keywords
Title,https://res.cloudinary.com/dsxuwwnsc/image/upload/v1748895856/pin_1_1_tqltvk.webp,please-provide-the-title-and-keywords-i-need-that-information-to-suggest-a-board-name-once,,https://www.beacleaner.com/how-to-remove-coffee-stains-from-carpet?utm_source=pinterest&utm_campaign=title,2025-06-02,Description,Keywords
Bye Bye Coffee Stains!,https://res.cloudinary.com/dsxuwwnsc/image/upload/v1748895865/pin_1_2_rml1gq.webp,carpet-cleaning-tips,,https://www.beacleaner.com/how-to-remove-coffee-stains-from-carpet?utm_source=pinterest&utm_campaign=bye-bye-coffee-stain,2025-06-02,Spilled coffee on your carpet? Don't panic! This guide reveals the *fastest* & most effective ways to remove coffee stains,from fresh spills to set-in disasters. Save your carpet (and your sanity!) with our simple
Coffee Stain SOS!,https://res.cloudinary.com/dsxuwwnsc/image/upload/v1748895871/pin_1_3_hcbxkf.webp,stain-removal-tips,,https://www.beacleaner.com/how-to-remove-coffee-stains-from-carpet?utm_source=pinterest&utm_campaign=coffee-stain-sos,2025-06-02,Is your carpet the latest victim of a coffee spill? ☕️ Don't resign yourself to a permanent stain! Our blog post breaks down exactly how to tackle coffee stains on *any* carpet type. Learn the best cleaning agents,blotting techniques
DIY Coffee Stain Remover,https://res.cloudinary.com/dsxuwwnsc/image/upload/v1748895878/pin_1_4_yhz5b4.webp,cleaning-tips,,https://www.beacleaner.com/how-to-remove-coffee-stains-from-carpet?utm_source=pinterest&utm_campaign=diy-coffee-stain-rem,2025-06-02,Skip the expensive cleaners! This pin focuses on powerful,*DIY* coffee stain removal solutions you can make with ingredients you probably already have. Vinegar
Set-In Stain Solutions,https://res.cloudinary.com/dsxuwwnsc/image/upload/v1748895884/pin_1_5_fkgjn2.webp,stain-removal-tips,,https://www.beacleaner.com/how-to-remove-coffee-stains-from-carpet?utm_source=pinterest&utm_campaign=set-in-stain-solutio,2025-06-02,Don't give up on those old,stubborn coffee stains! This pin tackles the toughest cases
Vinegar & Coffee Stains,https://res.cloudinary.com/dsxuwwnsc/image/upload/v1748895890/pin_1_6_lhwuhk.webp,cleaning-tips,,https://www.beacleaner.com/how-to-remove-coffee-stains-from-carpet?utm_source=pinterest&utm_campaign=vinegar-coffee-stain,2025-06-02,Vinegar to the rescue! This pin highlights the amazing stain-fighting power of vinegar. Learn how to use vinegar to neutralize coffee stains and restore your carpet's color. A safe,effective
Baking Soda Magic,https://res.cloudinary.com/dsxuwwnsc/image/upload/v1748895898/pin_1_7_e4kgse.webp,cleaning-tips,,https://www.beacleaner.com/how-to-remove-coffee-stains-from-carpet?utm_source=pinterest&utm_campaign=baking-soda-magic,2025-06-02,Baking soda isn't just for baking! This pin showcases how baking soda can absorb coffee stains and deodorize your carpet. A simple,natural
Protect Your Carpet!,https://res.cloudinary.com/dsxuwwnsc/image/upload/v1748895904/pin_1_8_rv1ltl.webp,home-care-tips,,https://www.beacleaner.com/how-to-remove-coffee-stains-from-carpet?utm_source=pinterest&utm_campaign=protect-your-carpet,2025-06-02,Prevent coffee stains before they happen! This pin offers tips on protecting your carpet from future spills,including using rugs and coasters. A little prevention goes a long way! Keep your carpet looking its best. Click for preventative measures. #CarpetProtection #StainPrevention #HomeMaintenance #CleanHome
When to Call a Pro,https://res.cloudinary.com/dsxuwwnsc/image/upload/v1748895911/pin_1_9_evvocs.webp,carpet-cleaning-tips,,https://www.beacleaner.com/how-to-remove-coffee-stains-from-carpet?utm_source=pinterest&utm_campaign=when-to-call-a-pro,2025-06-02,Sometimes,a professional is the best solution. This pin helps you determine when a coffee stain is beyond DIY treatment and when to call a professional carpet cleaner. Don't risk damaging your carpet! #ProfessionalCleaning #CarpetCleaner #StainRemovalService #WhenToCallAPro
Avoid These Mistakes!,https://res.cloudinary.com/dsxuwwnsc/image/upload/v1748895919/pin_1_10_faeu6h.webp,cleaning-tips,,https://www.beacleaner.com/how-to-remove-coffee-stains-from-carpet?utm_source=pinterest&utm_campaign=avoid-these-mistakes,2025-06-02,Don't make these common coffee stain removal mistakes! This pin highlights what *not* to do when cleaning a coffee spill,such as rubbing or using harsh chemicals. Avoid damage and get the best results. #CleaningMistakes #StainRemovalErrors #CarpetCareTips #AvoidThese
The Ultimate Guide,https://res.cloudinary.com/dsxuwwnsc/image/upload/v1748895925/pin_1_11_u8lpjx.webp,cleaning-tips,,https://www.beacleaner.com/how-to-remove-coffee-stains-from-carpet?utm_source=pinterest&utm_campaign=the-ultimate-guide,2025-06-02,This pin links directly to the full blog post,promising a comprehensive guide to removing coffee stains from carpet. Everything you need to know in one place! #UltimateGuide #CoffeeStainRemoval #CarpetCleaningGuide #CompleteSolution
Before & After Photos,https://res.cloudinary.com/dsxuwwnsc/image/upload/v1748895934/pin_1_12_c4zghd.webp,cleaning-tips,,https://www.beacleaner.com/how-to-remove-coffee-stains-from-carpet?utm_source=pinterest&utm_campaign=before-after-photos,2025-06-02,See the amazing results! This pin features before-and-after photos of coffee stain removal,showcasing the effectiveness of the techniques discussed in the blog post. Visual proof that it works! #BeforeAndAfter #StainRemovalResults #CarpetTransformation #CleaningMotivation
Long-Term Carpet Care,https://res.cloudinary.com/dsxuwwnsc/image/upload/v1748895940/pin_1_13_ku180w.webp,carpet-care-tips,,https://www.beacleaner.com/how-to-remove-coffee-stains-from-carpet?utm_source=pinterest&utm_campaign=long-term-carpet-car,2025-06-02,Beyond stain removal,this pin offers tips for long-term carpet care to keep your floors looking their best. Prevent future stains and extend the life of your carpet. #CarpetMaintenance #LongTermCare #FloorCare #HealthyHome
Don't Replace,https://res.cloudinary.com/dsxuwwnsc/image/upload/v1748895947/pin_1_14_cwz1oi.webp,carpet-tips,,https://www.beacleaner.com/how-to-remove-coffee-stains-from-carpet?utm_source=pinterest&utm_campaign=dont-replace,2025-06-02,Restore!,Before you consider replacing your carpet
Title,https://res.cloudinary.com/dsxuwwnsc/image/upload/v1748895987/pin_2_1_ravc5z.webp,please-provide-the-title-and-keywords-i-need-that-information-to-suggest-a-board-name-once,,https://www.beacleaner.com/how-to-get-flour-out-of-carpet?utm_source=pinterest&utm_campaign=title,2025-06-02,Description,Keywords
Flour Spill? Don't Panic! ✨,https://res.cloudinary.com/dsxuwwnsc/image/upload/v1748895995/pin_2_2_thoonq.webp,cleaning-tips,,https://www.beacleaner.com/how-to-get-flour-out-of-carpet?utm_source=pinterest&utm_campaign=flour-spill-dont-pan,2025-06-02,Don't let a flour disaster ruin your day! This pin shows you quick & easy steps to remove flour from your carpet *before* it sets. We'll cover everything from vacuuming to DIY solutions,saving you time
DIY Flour Carpet Cleaner 🍋,https://res.cloudinary.com/dsxuwwnsc/image/upload/v1748896002/pin_2_3_ywwwv2.webp,cleaning-tips,,https://www.beacleaner.com/how-to-get-flour-out-of-carpet?utm_source=pinterest&utm_campaign=diy-flour-carpet-cle,2025-06-02,Skip the expensive cleaners! This pin showcases a simple,effective DIY solution for removing flour from carpet using ingredients you likely already have.  It's gentle on your carpet and tough on stains.  Feel good about cleaning with natural ingredients and saving money. Click to get the recipe and restore your carpet's beauty! #DIYCleaner #NaturalCleaning #FlourStainRemoval #EcoFriendlyCleaning
Flour & Carpet: A Stain Guide,https://res.cloudinary.com/dsxuwwnsc/image/upload/v1748896010/pin_2_4_szhzow.webp,cleaning-tips,,https://www.beacleaner.com/how-to-get-flour-out-of-carpet?utm_source=pinterest&utm_campaign=flour-carpet-a-stain,2025-06-02,Worried about a lingering flour stain? 😟 This pin provides a comprehensive guide to identifying and treating different types of flour stains on carpet. From dry spills to sticky messes,we've got you covered.  Don't let a stain ruin your carpet – learn how to tackle it head-on! Click to read the full article. #StainRemoval #CarpetStainGuide #FlourStains #CleaningSolutions
The BEST Way to Remove Flour,https://res.cloudinary.com/dsxuwwnsc/image/upload/v1748896017/pin_2_5_igrzzu.webp,cleaning-tips,,https://www.beacleaner.com/how-to-get-flour-out-of-carpet?utm_source=pinterest&utm_campaign=the-best-way-to-remo,2025-06-02,Discover the *most effective* method for removing flour from carpet,according to our experts! This pin highlights a proven technique that delivers amazing results.  Say goodbye to stubborn flour residue and hello to a fresh
Prevent Flour Messes: Tips!,https://res.cloudinary.com/dsxuwwnsc/image/upload/v1748896024/pin_2_6_u8jg14.webp,kitchen-cleaning-tips,,https://www.beacleaner.com/how-to-get-flour-out-of-carpet?utm_source=pinterest&utm_campaign=prevent-flour-messes,2025-06-02,Stop flour spills before they happen! This pin shares practical tips for preventing flour messes in the kitchen and beyond.  From storage solutions to careful handling techniques,we've got you covered.  A little prevention goes a long way! Click to read the full article. #PreventativeCleaning #FlourMessPrevention #KitchenCleaning #HomeOrganization
The Ultimate Flour Cleanup Guide,https://res.cloudinary.com/dsxuwwnsc/image/upload/v1748896031/pin_2_7_gui1ik.webp,cleaning-tips,,https://www.beacleaner.com/how-to-get-flour-out-of-carpet?utm_source=pinterest&utm_campaign=the-ultimate-flour-c,2025-06-02,Everything you need to know about removing flour from carpet in one place! This pin links to the comprehensive blog post,offering a complete solution to your flour spill woes.  Click to read the ultimate guide! #UltimateGuide #FlourCleanup #CarpetCleaningSolutions #CompleteGuide
Flour Spill? Breathe Easy! 😌,https://res.cloudinary.com/dsxuwwnsc/image/upload/v1748896040/pin_2_8_m2fmtk.webp,cleaning-tips,,https://www.beacleaner.com/how-to-get-flour-out-of-carpet?utm_source=pinterest&utm_campaign=flour-spill-breathe-,2025-06-02,Don't stress over a flour spill! This pin offers a calming and reassuring message,reminding you that a clean carpet is achievable.  Learn our easy methods and restore your peace of mind. Click to read the full guide! #StressFreeCleaning #CalmingTips #FlourSpillSolution #HomePeace
Flour on Carpet: Long-Term Care,https://res.cloudinary.com/dsxuwwnsc/image/upload/v1748896049/pin_2_9_rgwopy.webp,carpet-care-tips,,https://www.beacleaner.com/how-to-get-flour-out-of-carpet?utm_source=pinterest&utm_campaign=flour-on-carpet-long,2025-06-02,Keep your carpet looking its best! This pin focuses on long-term carpet care after a flour spill,including regular vacuuming and stain protection.  Extend the life of your carpet and enjoy a clean home. Click to learn more! #CarpetMaintenance #LongTermCare #FlourPrevention #HomeCareTips
Title,https://res.cloudinary.com/dsxuwwnsc/image/upload/v1748896090/pin_3_1_bkuiye.webp,please-provide-the-title-and-keywords-i-need-that-information-to-suggest-a-board-name-once,,https://www.beacleaner.com/how-to-use-baking-soda-as-a-carpet-cleaner?utm_source=pinterest&utm_campaign=title,2025-06-02,Description,Keywords
Baking Soda Carpet Magic!,https://res.cloudinary.com/dsxuwwnsc/image/upload/v1748896100/pin_3_2_qft856.webp,cleaning-tips,,https://www.beacleaner.com/how-to-use-baking-soda-as-a-carpet-cleaner?utm_source=pinterest&utm_campaign=baking-soda-carpet-m,2025-06-02,Is your carpet looking dull & dingy? ✨ Revive it with the power of baking soda! This simple,natural cleaner lifts dirt
Freshen Up Your Carpets!,https://res.cloudinary.com/dsxuwwnsc/image/upload/v1748896105/pin_3_3_zlmrnm.webp,cleaning-tips,,https://www.beacleaner.com/how-to-use-baking-soda-as-a-carpet-cleaner?utm_source=pinterest&utm_campaign=freshen-up-your-carp,2025-06-02,Don't let pet odors or spills ruin your carpets! 🐾 Baking soda is a fantastic,affordable solution for eliminating smells and tackling stains. This guide shows you how to use it effectively for a deep clean that's safe for kids & pets. Reclaim your fresh-smelling home today! Click to read more & breathe easy. 👃 #PetOdorRemoval #CarpetStainRemoval #BakingSodaHacks #HomeCleaning
DIY Carpet Deodorizer!,https://res.cloudinary.com/dsxuwwnsc/image/upload/v1748896113/pin_3_4_kvys5l.webp,cleaning-tips,,https://www.beacleaner.com/how-to-use-baking-soda-as-a-carpet-cleaner?utm_source=pinterest&utm_campaign=diy-carpet-deodorize,2025-06-02,Tired of masking odors instead of eliminating them? 👃 Baking soda naturally absorbs smells,leaving your carpets truly fresh. This post reveals the secrets to using baking soda as a powerful carpet deodorizer. It's quick
Baking Soda: Carpet Rescue!,https://res.cloudinary.com/dsxuwwnsc/image/upload/v1748896120/pin_3_5_yd9fmx.webp,cleaning-tips,,https://www.beacleaner.com/how-to-use-baking-soda-as-a-carpet-cleaner?utm_source=pinterest&utm_campaign=baking-soda-carpet-r,2025-06-02,Spilled something on your carpet? 😱 Don't panic! Baking soda can help! This guide provides a quick & effective method for tackling fresh spills and preventing permanent stains. Learn how to blot,sprinkle
Revive Dull Carpets!,https://res.cloudinary.com/dsxuwwnsc/image/upload/v1748896127/pin_3_6_jd6gjx.webp,carpet-cleaning-tips,,https://www.beacleaner.com/how-to-use-baking-soda-as-a-carpet-cleaner?utm_source=pinterest&utm_campaign=revive-dull-carpets,2025-06-02,Is your carpet looking lifeless? 😩 Bring it back to life with baking soda! This guide shows you how to use it to brighten colors,lift dirt
Baking Soda Carpet Cleaning 101!,https://res.cloudinary.com/dsxuwwnsc/image/upload/v1748896135/pin_3_7_sz3m5b.webp,cleaning-tips,,https://www.beacleaner.com/how-to-use-baking-soda-as-a-carpet-cleaner?utm_source=pinterest&utm_campaign=baking-soda-carpet-c,2025-06-02,New to using baking soda for carpet cleaning? 🤔 This post is your ultimate guide! We cover everything from application to vacuuming,ensuring a perfect clean every time. Learn the best techniques for different carpet types. Click to become a baking soda cleaning pro! 🎓 #CarpetCleaningGuide #BakingSodaTutorial #DIYHomeCleaning #CleaningTips
Save Money on Carpet Cleaning!,https://res.cloudinary.com/dsxuwwnsc/image/upload/v1748896144/pin_3_8_gzf38i.webp,cleaning-tips,,https://www.beacleaner.com/how-to-use-baking-soda-as-a-carpet-cleaner?utm_source=pinterest&utm_campaign=save-money-on-carpet,2025-06-02,Stop spending a fortune on professional carpet cleaning! 💰 Baking soda offers a cost-effective solution for maintaining clean,fresh carpets. This post reveals how to achieve professional-level results at home. Click to save money and time! 💸 #BudgetCleaning #CheapCarpetClean #BakingSodaSavings #MoneySavingTips
Baking Soda for Pet Messes!,https://res.cloudinary.com/dsxuwwnsc/image/upload/v1748896151/pin_3_9_ra41tq.webp,pet-cleaning-tips,,https://www.beacleaner.com/how-to-use-baking-soda-as-a-carpet-cleaner?utm_source=pinterest&utm_campaign=baking-soda-for-pet-,2025-06-02,Pets are wonderful,but their messes aren't! 🐾 Baking soda is a safe and effective way to clean up after your furry friends. This post provides specific tips for tackling pet stains and odors. Click to keep your home clean and pet-friendly! 🐶 #PetCleaning #DogMess #CatMess #BakingSodaForPets
Quick Carpet Refresh!,https://res.cloudinary.com/dsxuwwnsc/image/upload/v1748896157/pin_3_10_cr85w5.webp,quick-cleaning-tips,,https://www.beacleaner.com/how-to-use-baking-soda-as-a-carpet-cleaner?utm_source=pinterest&utm_campaign=quick-carpet-refresh,2025-06-02,Need a quick carpet refresh before guests arrive? 💨 Baking soda is your secret weapon! This post shows you how to quickly deodorize and freshen up your carpets in minutes. Impress your guests with a clean,inviting home. Click for a speedy clean! ⏱️ #QuickCleaning #LastMinuteCleaning #CarpetRefresh #HomePrep
Easy Carpet Cleaning Routine!,https://res.cloudinary.com/dsxuwwnsc/image/upload/v1748896165/pin_3_11_ic7zm2.webp,cleaning-tips,,https://www.beacleaner.com/how-to-use-baking-soda-as-a-carpet-cleaner?utm_source=pinterest&utm_campaign=easy-carpet-cleaning,2025-06-02,Struggling to keep your carpets clean? 😩 This post provides a simple,effective carpet cleaning routine using baking soda. Incorporate it into your weekly chores for a consistently fresh home. Click to simplify your cleaning! 🗓️ #CleaningRoutine #WeeklyCleaning #CarpetMaintenance #EasyCleaning
Baking Soda: Safe for Kids & Pets!,https://res.cloudinary.com/dsxuwwnsc/image/upload/v1748896172/pin_3_12_ygsupg.webp,safe-cleaning-tips,,https://www.beacleaner.com/how-to-use-baking-soda-as-a-carpet-cleaner?utm_source=pinterest&utm_campaign=baking-soda-safe-for,2025-06-02,Worried about harsh chemicals? 👶🐾 Baking soda is a safe and natural alternative for cleaning carpets,making it perfect for homes with kids and pets. Click to learn more about a worry-free clean! 💖 #SafeCleaning #KidFriendlyCleaning #PetSafeCleaning #NaturalSolutions
Revitalize High-Traffic Areas!,https://res.cloudinary.com/dsxuwwnsc/image/upload/v1748896178/pin_3_13_ok2yll.webp,living-room-ideas,,https://www.beacleaner.com/how-to-use-baking-soda-as-a-carpet-cleaner?utm_source=pinterest&utm_campaign=revitalize-high-traf,2025-06-02,High-traffic areas need extra attention! 🚶‍♀️ This post focuses on using baking soda to revitalize carpets in hallways,living rooms
Title,https://res.cloudinary.com/dsxuwwnsc/image/upload/v1748896217/pin_4_1_dvsdgr.webp,please-provide-the-title-and-keywords-i-need-that-information-to-suggest-a-board-name-once,,https://www.beacleaner.com/how-to-get-water-stains-out-of-couch?utm_source=pinterest&utm_campaign=title,2025-06-02,Description,Keywords
Bye Bye Water Stains! (Couch Rescue),https://res.cloudinary.com/dsxuwwnsc/image/upload/v1748896223/pin_4_2_dtygdg.webp,furniture-tips,,https://www.beacleaner.com/how-to-get-water-stains-out-of-couch?utm_source=pinterest&utm_campaign=bye-bye-water-stains,2025-06-02,Don't let unsightly water stains ruin your favorite couch! This guide reveals simple,effective methods to lift those marks and restore your furniture's beauty. From quick blotting techniques to DIY cleaning solutions
Couch Water Stain SOS!,https://res.cloudinary.com/dsxuwwnsc/image/upload/v1748896230/pin_4_3_cb75f8.webp,furniture-tips,,https://www.beacleaner.com/how-to-get-water-stains-out-of-couch?utm_source=pinterest&utm_campaign=couch-water-stain-so,2025-06-02,Is a water ring ruining your living room vibe?  Don't panic! This post breaks down exactly how to get water stains out of your couch,no matter the fabric. We cover everything from microfiber to leather
Microfiber Couch Stain Remover,https://res.cloudinary.com/dsxuwwnsc/image/upload/v1748896237/pin_4_4_lqkgz6.webp,cleaning-tips,,https://www.beacleaner.com/how-to-get-water-stains-out-of-couch?utm_source=pinterest&utm_campaign=microfiber-couch-sta,2025-06-02,Microfiber couches are comfy,but stains can be tricky! This guide gives you the secrets to removing water stains from microfiber
DIY Couch Stain Remover Recipe,https://res.cloudinary.com/dsxuwwnsc/image/upload/v1748896244/pin_4_5_tl9qua.webp,cleaning-tips,,https://www.beacleaner.com/how-to-get-water-stains-out-of-couch?utm_source=pinterest&utm_campaign=diy-couch-stain-remo,2025-06-02,Skip the expensive cleaners! This post shares a simple,DIY solution for removing water stains from your couch using ingredients you probably already have.  It's effective
Water Stain Prevention Tips,https://res.cloudinary.com/dsxuwwnsc/image/upload/v1748896251/pin_4_6_zggqwc.webp,home-cleaning-tips,,https://www.beacleaner.com/how-to-get-water-stains-out-of-couch?utm_source=pinterest&utm_campaign=water-stain-preventi,2025-06-02,Don't wait for a stain to happen! This post offers proactive tips to prevent water stains on your couch in the first place.  From coasters to fabric protectors,we'll help you keep your furniture looking its best.  A little prevention goes a long way! Click to read and protect your couch. #StainPrevention #CouchProtection #HomeTips #CleaningHacks
The Ultimate Couch Cleaning Guide,https://res.cloudinary.com/dsxuwwnsc/image/upload/v1748896258/pin_4_7_aj0j8z.webp,cleaning-tips,,https://www.beacleaner.com/how-to-get-water-stains-out-of-couch?utm_source=pinterest&utm_campaign=the-ultimate-couch-c,2025-06-02,Everything you need to know about keeping your couch clean and stain-free! This post covers water stain removal,general cleaning tips
Deep Cleaning Your Couch (Water Stains!),https://res.cloudinary.com/dsxuwwnsc/image/upload/v1748896264/pin_4_8_fnpu0p.webp,cleaning-tips,,https://www.beacleaner.com/how-to-get-water-stains-out-of-couch?utm_source=pinterest&utm_campaign=deep-cleaning-your-c,2025-06-02,Give your couch the deep clean it deserves! This post combines water stain removal techniques with general couch cleaning tips for a truly refreshed look.  Enjoy a cleaner,healthier
Water Stains on Dark Fabric?,https://res.cloudinary.com/dsxuwwnsc/image/upload/v1748896272/pin_4_9_zrfful.webp,couch-cleaning-tips,,https://www.beacleaner.com/how-to-get-water-stains-out-of-couch?utm_source=pinterest&utm_campaign=water-stains-on-dark,2025-06-02,Dark couches show water stains easily! This post provides specific advice for removing water stains from dark-colored fabrics,preventing rings and discoloration.  Keep your dark couch looking its best with these expert tips. Click to learn more. #DarkFabricCare #CouchCleaning #StainRemoval #ColorCare
Water Stains on Light Fabric?,https://res.cloudinary.com/dsxuwwnsc/image/upload/v1748896278/pin_4_10_j57ioy.webp,couch-cleaning-tips,,https://www.beacleaner.com/how-to-get-water-stains-out-of-couch?utm_source=pinterest&utm_campaign=water-stains-on-ligh,2025-06-02,Light-colored couches need gentle care! This post offers a delicate yet effective method for removing water stains from light fabrics,avoiding damage and preserving the color.  Enjoy a bright and clean living space. Click to read the guide. #LightFabricCare #CouchCleaning #GentleCleaning #StainRemoval
Water Stain Removal for Busy People,https://res.cloudinary.com/dsxuwwnsc/image/upload/v1748896284/pin_4_11_zpq7co.webp,cleaning-tips,,https://www.beacleaner.com/how-to-get-water-stains-out-of-couch?utm_source=pinterest&utm_campaign=water-stain-removal-,2025-06-02,Short on time? No problem! This post provides quick and easy methods for removing water stains from your couch,even with a busy schedule.  Get a clean couch without spending hours cleaning. Click to read the guide. #QuickCleaning #BusyLife #CouchCare #EasyCleaning
Protect Your Couch Investment,https://res.cloudinary.com/dsxuwwnsc/image/upload/v1748896291/pin_4_12_stnwab.webp,home-cleaning-tips,,https://www.beacleaner.com/how-to-get-water-stains-out-of-couch?utm_source=pinterest&utm_campaign=protect-your-couch-i,2025-06-02,Your couch is a significant investment! This post emphasizes the importance of proper care and maintenance,including water stain removal
Water Stain Removal: Step-by-Step,https://res.cloudinary.com/dsxuwwnsc/image/upload/v1748896297/pin_4_13_ux6pdf.webp,cleaning-tips,,https://www.beacleaner.com/how-to-get-water-stains-out-of-couch?utm_source=pinterest&utm_campaign=water-stain-removal-,2025-06-02,Follow along with our easy-to-follow,step-by-step guide to removing water stains from your couch.  We'll walk you through each process
Avoid These Couch Cleaning Mistakes!,https://res.cloudinary.com/dsxuwwnsc/image/upload/v1748896304/pin_4_14_zb4m8p.webp,cleaning-tips,,https://www.beacleaner.com/how-to-get-water-stains-out-of-couch?utm_source=pinterest&utm_campaign=avoid-these-couch-cl,2025-06-02,Don't make these common mistakes when cleaning your couch! This post highlights pitfalls to avoid,ensuring you remove water stains effectively without causing damage. Click to read and learn from our expertise. #CleaningMistakes #CouchCare #AvoidDamage #ExpertTips
Water Stains & Kids/Pets: A Guide,https://res.cloudinary.com/dsxuwwnsc/image/upload/v1748896311/pin_4_15_agk5vg.webp,cleaning-tips,,https://www.beacleaner.com/how-to-get-water-stains-out-of-couch?utm_source=pinterest&utm_campaign=water-stains-kidspet,2025-06-02,Life happens! This post addresses the challenges of water stains caused by kids and pets,offering practical solutions for busy households.  Keep your couch clean and your family happy. Click to read the guide. #KidsAndPets #CouchCleaning #FamilyLife #StainSolutions
The Best Tools for Couch Cleaning,https://res.cloudinary.com/dsxuwwnsc/image/upload/v1748896317/pin_4_16_mekvq2.webp,home-cleaning-tips,,https://www.beacleaner.com/how-to-get-water-stains-out-of-couch?utm_source=pinterest&utm_campaign=the-best-tools-for-c,2025-06-02,Equip yourself with the right tools! This post recommends the best cleaning supplies and tools for removing water stains from your couch,making the process easier and more effective. Click to read the list. #CleaningTools #CouchCare #EssentialSupplies #HomeCleaning
Save Money: DIY vs. Professional,https://res.cloudinary.com/dsxuwwnsc/image/upload/v1748896325/pin_4_17_ykyv1r.webp,home-savings-tips,,https://www.beacleaner.com/how-to-get-water-stains-out-of-couch?utm_source=pinterest&utm_campaign=save-money-diy-vs-pr,2025-06-02,Should you DIY or hire a professional? This post compares the costs and benefits of DIY water stain removal versus professional couch cleaning,helping you make the best decision for your budget. Click to read the comparison. #DIYvsProfessional #CouchCleaning #BudgetFriendly #HomeSavings
