Title,Media URL,Pinterest board,Thumbnail,Link,Publish date,Description,Keywords
DIY Louis Vuitton Cleaning Kit,https://res.cloudinary.com/dbcpfy04c/image/upload/v1748090675/pin_4_10_ts2ntm.webp,handbag-care-tips,,https://www.beacleaner.com/how-to-clean-my-louis-vuitton-bag?utm_source=pinterest&utm_campaign=diy-louis-vuitton-cl,2025-05-24,Want to create your own Louis Vuitton cleaning kit? Our guide lists all the essential supplies you'll need to safely and effectively clean your bag at home.  Save money and have everything on hand when you need it.  Click to discover the must-have items for LV care!,"Cleaning kit, LV supplies, handbag care, DIY cleaning"
Louis Vuitton: Before & After Cleaning,https://res.cloudinary.com/dbcpfy04c/image/upload/v1748090682/pin_4_11_vowsjj.webp,bag-cleaning-tips,,https://www.beacleaner.com/how-to-clean-my-louis-vuitton-bag?utm_source=pinterest&utm_campaign=louis-vuitton-before,2025-05-24,See the amazing results! This pin showcases before-and-after photos of Louis Vuitton bags cleaned using our guide's techniques.  Proof that you can restore your bag's beauty at home!  Get inspired and learn how to achieve similar results. Click to see the transformation!,"Before and after, LV cleaning, bag restoration, cleaning results"
Extend the Life of Your LV Bag,https://res.cloudinary.com/dbcpfy04c/image/upload/v1748090689/pin_4_12_sk6qeh.webp,tile-care-tips,,https://www.beacleaner.com/how-to-clean-my-louis-vuitton-bag?utm_source=pinterest&utm_campaign=extend-the-life-of-y,2025-05-24,"Want your Louis Vuitton bag to last a lifetime? Our cleaning guide provides the knowledge you need to properly care for it, preventing damage and extending its lifespan.  Protect your investment and enjoy it for years to come. Click to learn the secrets to longevity!","LV longevity, bag care, investment, leather preservation"
Gentle Cleaning for Delicate LV Leather,https://res.cloudinary.com/dbcpfy04c/image/upload/v1748090695/pin_4_13_l5fsjx.webp,tile-cleaning-tips,,https://www.beacleaner.com/how-to-clean-my-louis-vuitton-bag?utm_source=pinterest&utm_campaign=gentle-cleaning-for-,2025-05-24,"Worried about harsh chemicals? Our guide focuses on gentle cleaning methods for your delicate Louis Vuitton leather, ensuring its beauty and integrity are preserved.  Safe and effective cleaning for your precious bag. Click to learn more!","Gentle cleaning, LV leather, delicate care, handbag safety"
The Ultimate LV Cleaning Checklist,https://res.cloudinary.com/dbcpfy04c/image/upload/v1748090701/pin_4_14_gdogw3.webp,handbag-care-tips,,https://www.beacleaner.com/how-to-clean-my-louis-vuitton-bag?utm_source=pinterest&utm_campaign=the-ultimate-lv-clea,2025-05-24,"Don't miss a step! This pin links to a comprehensive checklist for cleaning your Louis Vuitton bag, ensuring you cover all the bases.  From canvas to hardware, we've got you covered.  Click to download the checklist and make cleaning a breeze!","Cleaning checklist, LV care, handbag maintenance, step-by-step"
Louis Vuitton: Preventative Care Tips,https://res.cloudinary.com/dbcpfy04c/image/upload/v1748090708/pin_4_15_x2ynqu.webp,bag-cleaning-tips,,https://www.beacleaner.com/how-to-clean-my-louis-vuitton-bag?utm_source=pinterest&utm_campaign=louis-vuitton-preven,2025-05-24,"Prevention is key! This pin directs you to our guide on preventative care tips for your Louis Vuitton bag, helping you avoid stains and damage in the first place.  Keep your bag looking its best with these simple habits. Click to learn how!","Preventative care, LV tips, handbag protection, stain prevention"
Cleaning Louis Vuitton: Common Mistakes,https://res.cloudinary.com/dbcpfy04c/image/upload/v1748090718/pin_4_16_cw9hgg.webp,handbag-care-tips,,https://www.beacleaner.com/how-to-clean-my-louis-vuitton-bag?utm_source=pinterest&utm_campaign=cleaning-louis-vuitt,2025-05-24,"Avoid these common mistakes when cleaning your Louis Vuitton bag! Our guide highlights what *not* to do, protecting your investment from potential damage.  Learn from our expertise and keep your bag in top condition. Click to read now!","Cleaning mistakes, LV care, handbag errors, avoid damage"
Louis Vuitton Bag: Deep Cleaning Guide,https://res.cloudinary.com/dbcpfy04c/image/upload/v1748090724/pin_4_17_gboubp.webp,handbag-care-tips,,https://www.beacleaner.com/how-to-clean-my-louis-vuitton-bag?utm_source=pinterest&utm_campaign=louis-vuitton-bag-de,2025-05-24,Give your Louis Vuitton bag a deep clean with our comprehensive guide! We cover everything from surface cleaning to tackling stubborn stains.  Restore your bag's original beauty and enjoy it like new. Click to learn the deep cleaning secrets!,"Deep cleaning, LV care, handbag restoration, thorough cleaning"
Luxury Handbag Cleaning: LV Edition,https://res.cloudinary.com/dbcpfy04c/image/upload/v1748090731/pin_4_18_rkakm2.webp,handbag-care-tips,,https://www.beacleaner.com/how-to-clean-my-louis-vuitton-bag?utm_source=pinterest&utm_campaign=luxury-handbag-clean,2025-05-24,Treat your Louis Vuitton bag with the luxury it deserves! This pin leads to our guide on professional-level cleaning techniques you can do at home.  Maintain its value and enjoy its timeless elegance. Click to learn the secrets!,"Luxury cleaning, LV care, handbag maintenance, professional tips"
Leather Conditioner for Louis Vuitton,https://res.cloudinary.com/dbcpfy04c/image/upload/v1748090738/pin_4_19_hnkhvj.webp,leather-care-tips,,https://www.beacleaner.com/how-to-clean-my-louis-vuitton-bag?utm_source=pinterest&utm_campaign=leather-conditioner-,2025-05-24,"After cleaning, conditioning is crucial! This pin links to our guide on choosing and applying the best leather conditioner for your Louis Vuitton bag, keeping it soft and supple.  Protect and nourish your leather. Click to learn more!","Leather conditioner, LV care, leather nourishment, handbag softness"
Louis Vuitton: Cleaning for Different Materials,https://res.cloudinary.com/dbcpfy04c/image/upload/v1748090744/pin_4_20_lae5kc.webp,bag-cleaning-tips,,https://www.beacleaner.com/how-to-clean-my-louis-vuitton-bag?utm_source=pinterest&utm_campaign=louis-vuitton-cleani,2025-05-24,"Not all LV materials are created equal! Our guide breaks down cleaning techniques for canvas, Vachetta leather, and hardware, ensuring you use the right method for each.  Click to learn the material-specific cleaning tips!","Material cleaning, LV care, canvas, Vachetta leather"
Revive Your Faded LV Monogram,https://res.cloudinary.com/dbcpfy04c/image/upload/v1748090752/pin_4_21_jzrtag.webp,handbag-care-tips,,https://www.beacleaner.com/how-to-clean-my-louis-vuitton-bag?utm_source=pinterest&utm_campaign=revive-your-faded-lv,2025-05-24,"Is your Louis Vuitton monogram looking faded? Our guide shares tips on how to revive its color and vibrancy, restoring its iconic look.  Bring back the beauty of your bag! Click to learn the restoration techniques.","Monogram revival, LV care, color restoration, handbag vibrancy"
Louis Vuitton Cleaning: Quick Tips,https://res.cloudinary.com/dbcpfy04c/image/upload/v1748090758/pin_4_22_ktzpst.webp,handbag-care-tips,,https://www.beacleaner.com/how-to-clean-my-louis-vuitton-bag?utm_source=pinterest&utm_campaign=louis-vuitton-cleani,2025-05-24,Short on time? This pin links to our guide's quick tips for maintaining your Louis Vuitton bag between deep cleans.  Simple habits for a consistently beautiful bag. Click to learn the easy maintenance tricks!,"Quick tips, LV care, handbag maintenance, easy cleaning"
Louis Vuitton Bag: Cleaning FAQs,https://res.cloudinary.com/dbcpfy04c/image/upload/v1748090764/pin_4_23_xygpif.webp,handbag-care-tips,,https://www.beacleaner.com/how-to-clean-my-louis-vuitton-bag?utm_source=pinterest&utm_campaign=louis-vuitton-bag-cl,2025-05-24,"Got questions about cleaning your Louis Vuitton bag? Our guide answers frequently asked questions, providing clear and concise information.  Get the answers you need to confidently care for your bag. Click to read the FAQs!","Cleaning FAQs, LV care, handbag questions, helpful answers"
From Dirty to Dazzling: LV Transformation,https://res.cloudinary.com/dbcpfy04c/image/upload/v1748090770/pin_4_24_oxxiag.webp,bag-restoration-ideas,,https://www.beacleaner.com/how-to-clean-my-louis-vuitton-bag?utm_source=pinterest&utm_campaign=from-dirty-to-dazzli,2025-05-24,Witness the incredible transformation! This pin showcases a Louis Vuitton bag before and after a thorough cleaning using our guide's techniques.  Get inspired and see the power of proper care. Click to see the stunning results!,"Transformation, LV cleaning, before and after, bag restoration"
Louis Vuitton: The Ultimate Care Guide,https://res.cloudinary.com/dbcpfy04c/image/upload/v1748090776/pin_4_25_hbrc9h.webp,bag-cleaning-tips,,https://www.beacleaner.com/how-to-clean-my-louis-vuitton-bag?utm_source=pinterest&utm_campaign=louis-vuitton-the-ul,2025-05-24,"Everything you need to know about caring for your Louis Vuitton bag is in this ultimate guide! From cleaning to storage, we've got you covered.  Protect your investment and enjoy your bag for years to come. Click to read the complete guide!","Ultimate guide, LV care, handbag maintenance, comprehensive tips"
Title,https://res.cloudinary.com/dbcpfy04c/image/upload/v1748090820/pin_5_1_k33ipc.webp,please-provide-the-title-and-keywords-i-need-that-information-to-suggest-a-board-name-once,,https://www.beacleaner.com/how-to-clean-natural-stone-countertops?utm_source=pinterest&utm_campaign=title,2025-05-24,Description,Keywords
Shine On! Natural Stone Cleaning Guide,https://res.cloudinary.com/dbcpfy04c/image/upload/v1748090827/pin_5_2_lhi7fz.webp,stone-cleaning-tips,,https://www.beacleaner.com/how-to-clean-natural-stone-countertops?utm_source=pinterest&utm_campaign=shine-on-natural-sto,2025-05-24,"Dreaming of sparkling, spotless natural stone countertops? ✨ This guide reveals the secrets to cleaning granite, marble, quartz & more *without* damaging their beauty! Learn the best (and worst!) cleaning products, simple DIY solutions, and pro tips to keep your kitchen looking magazine-worthy. Don't let stains & grime win – reclaim your gorgeous countertops today! Click to learn how to protect your investment and enjoy a cleaner, healthier home.  We'll cover daily care, deep cleaning, and stain removal.","Natural Stone, Countertop Cleaning, Granite, Marble"
Marble Magic: Cleaning & Care Tips,https://res.cloudinary.com/dbcpfy04c/image/upload/v1748090834/pin_5_3_fpnizi.webp,stone-care-tips,,https://www.beacleaner.com/how-to-clean-natural-stone-countertops?utm_source=pinterest&utm_campaign=marble-magic-cleanin,2025-05-24,"Is your marble countertop losing its luster? 😩 Don't despair! This pin leads to a comprehensive guide on how to clean and care for marble, preventing etching and keeping it brilliantly white. Discover gentle cleaning methods, avoid common mistakes, and learn how to seal your marble for long-lasting protection.  A little care goes a long way in preserving this luxurious surface.  Click to unlock the secrets to marble perfection!","Marble Cleaning, Stone Care, Etch Prevention, Sealing"
Granite Gleam: Easy Cleaning Hacks,https://res.cloudinary.com/dbcpfy04c/image/upload/v1748090841/pin_5_4_qqe2cr.webp,kitchen-cleaning-tips,,https://www.beacleaner.com/how-to-clean-natural-stone-countertops?utm_source=pinterest&utm_campaign=granite-gleam-easy-c,2025-05-24,"Love your granite countertops but dread cleaning them? 🤔 We've got you covered! This pin links to a blog post packed with easy, effective granite cleaning hacks. From daily wipe-downs to tackling stubborn stains, you'll learn how to keep your granite looking its best with minimal effort.  Protect your investment and enjoy a beautiful, hygienic kitchen. Click to discover the simple steps to granite bliss!","Granite Cleaning, Kitchen Cleaning, Stain Removal, Countertops"
Quartz Countertops: The Ultimate Guide,https://res.cloudinary.com/dbcpfy04c/image/upload/v1748090848/pin_5_5_o968os.webp,kitchen-countertops-ideas,,https://www.beacleaner.com/how-to-clean-natural-stone-countertops?utm_source=pinterest&utm_campaign=quartz-countertops-t,2025-05-24,"Quartz countertops are beautiful *and* durable, but they still need proper care! 💎 This pin directs you to a guide on cleaning quartz, preventing damage, and maintaining its stunning appearance. Learn the best cleaning solutions, avoid harsh chemicals, and keep your quartz looking brand new for years to come.  Click to unlock the secrets to quartz countertop longevity!","Quartz Cleaning, Durable Countertops, Kitchen Design, Non-Porous"
DIY Stone Countertop Cleaner Recipes,https://res.cloudinary.com/dbcpfy04c/image/upload/v1748090856/pin_5_6_mhalxu.webp,cleaning-tips,,https://www.beacleaner.com/how-to-clean-natural-stone-countertops?utm_source=pinterest&utm_campaign=diy-stone-countertop,2025-05-24,"Skip the harsh chemicals! 🌿 This pin leads to DIY cleaning recipes for natural stone countertops using ingredients you probably already have.  Safe, effective, and eco-friendly – what's not to love?  Learn how to create your own cleaning solutions for granite, marble, and quartz.  Protect your family and the environment while keeping your kitchen sparkling. Click to get the recipes!","DIY Cleaner, Natural Cleaning, Stone Care, Eco-Friendly"
Stain SOS: Removing Stains from Stone,https://res.cloudinary.com/dbcpfy04c/image/upload/v1748090863/pin_5_7_z3f5zp.webp,stone-care-tips,,https://www.beacleaner.com/how-to-clean-natural-stone-countertops?utm_source=pinterest&utm_campaign=stain-sos-removing-s,2025-05-24,Spilled wine? Coffee mishap? 🍷 Don't panic! This pin links to a guide on removing common stains from natural stone countertops.  Learn how to tackle everything from oil-based stains to water spots with the right techniques and products.  Save your countertops and your sanity! Click to learn how to banish those blemishes.,"Stain Removal, Countertop Repair, Granite Stains, Marble Stains"
Protect Your Investment: Stone Sealing,https://res.cloudinary.com/dbcpfy04c/image/upload/v1748090869/pin_5_8_gjwwde.webp,handbag-care-tips,,https://www.beacleaner.com/how-to-clean-natural-stone-countertops?utm_source=pinterest&utm_campaign=protect-your-investm,2025-05-24,"Sealing your natural stone countertops is crucial for preventing stains and damage. 🛡️ This pin directs you to a guide on stone sealing, including when to seal, what products to use, and how to apply the sealer correctly.  Protect your investment and enjoy long-lasting beauty. Click to learn how to seal your countertops like a pro!","Stone Sealing, Countertop Protection, Granite Sealer, Marble Sealer"
Daily Stone Countertop Care Routine,https://res.cloudinary.com/dbcpfy04c/image/upload/v1748090878/pin_5_9_feea8x.webp,kitchen-tips,,https://www.beacleaner.com/how-to-clean-natural-stone-countertops?utm_source=pinterest&utm_campaign=daily-stone-countert,2025-05-24,A little daily care goes a long way! ✨ This pin links to a simple routine for keeping your natural stone countertops clean and beautiful.  Learn quick and easy habits to prevent buildup and maintain their shine.  Make countertop care a breeze! Click to discover the daily habits for a sparkling kitchen.,"Daily Cleaning, Countertop Care, Kitchen Routine, Stone Maintenance"
The Dos & Don'ts of Stone Cleaning,https://res.cloudinary.com/dbcpfy04c/image/upload/v1748090885/pin_5_10_aw7mjg.webp,stone-care-tips,,https://www.beacleaner.com/how-to-clean-natural-stone-countertops?utm_source=pinterest&utm_campaign=the-dos-donts-of-sto,2025-05-24,"Avoid costly mistakes! ❌ This pin leads to a guide outlining the dos and don'ts of cleaning natural stone countertops.  Learn what products to avoid, what techniques to use, and how to protect your investment.  Don't risk damaging your beautiful surfaces! Click to learn the essential rules of stone cleaning.","Cleaning Mistakes, Stone Care, Granite, Marble"
Deep Cleaning Natural Stone: Step-by-Step,https://res.cloudinary.com/dbcpfy04c/image/upload/v1748090892/pin_5_11_ggr5rc.webp,kitchen-cleaning-tips,,https://www.beacleaner.com/how-to-clean-natural-stone-countertops?utm_source=pinterest&utm_campaign=deep-cleaning-natura,2025-05-24,"Give your countertops a refresh! 🧼 This pin directs you to a step-by-step guide on deep cleaning natural stone countertops.  Learn how to remove stubborn grime, restore shine, and leave your kitchen looking sparkling clean.  It's easier than you think! Click to get the deep cleaning guide.","Deep Cleaning, Kitchen Refresh, Stone Restoration, Countertop Shine"
Is Your Cleaner Safe for Stone?,https://res.cloudinary.com/dbcpfy04c/image/upload/v1748090910/pin_5_12_waw6kc.webp,stone-care-tips,,https://www.beacleaner.com/how-to-clean-natural-stone-countertops?utm_source=pinterest&utm_campaign=is-your-cleaner-safe,2025-05-24,Not all cleaners are created equal! ⚠️ This pin links to a guide on choosing the right cleaning products for natural stone countertops.  Learn which ingredients to avoid and which ones are safe and effective.  Protect your investment and your family's health. Click to learn about safe stone cleaning.,"Safe Cleaners, Stone Care, Chemical Free, Kitchen Health"
From Dull to Dazzling: Stone Revival,https://res.cloudinary.com/dbcpfy04c/image/upload/v1748090917/pin_5_13_tejwbk.webp,stone-repair-ideas,,https://www.beacleaner.com/how-to-clean-natural-stone-countertops?utm_source=pinterest&utm_campaign=from-dull-to-dazzlin,2025-05-24,"Bring back the brilliance! ✨ This pin leads to a guide on reviving dull or damaged natural stone countertops.  Learn how to restore shine, remove etching, and repair minor imperfections.  Don't replace – restore! Click to learn how to revive your countertops.","Stone Restoration, Countertop Repair, Etch Removal, Shine Restoration"
Natural Stone vs. Engineered Stone: Cleaning Differences,https://res.cloudinary.com/dbcpfy04c/image/upload/v1748090926/pin_5_14_v0h3np.webp,stone-countertops-tips,,https://www.beacleaner.com/how-to-clean-natural-stone-countertops?utm_source=pinterest&utm_campaign=natural-stone-vs-eng,2025-05-24,Know your stone! 🤔 This pin directs you to a guide explaining the cleaning differences between natural and engineered stone countertops.  Learn how to properly care for each type to maximize its lifespan and beauty.  Get the facts before you clean! Click to learn the differences.,"Natural Stone, Engineered Stone, Quartz, Granite"
The Ultimate Guide to Granite Cleaning,https://res.cloudinary.com/dbcpfy04c/image/upload/v1748090934/pin_5_15_w5htw3.webp,kitchen-cleaning-tips,,https://www.beacleaner.com/how-to-clean-natural-stone-countertops?utm_source=pinterest&utm_campaign=the-ultimate-guide-t,2025-05-24,"Granite deserves the best care! 💎 This pin links to a comprehensive guide on cleaning granite countertops, covering everything from daily maintenance to stain removal.  Keep your granite looking stunning for years to come. Click to unlock the secrets to granite care.","Granite Cleaning, Kitchen Countertops, Stone Care, Stain Prevention"
Marble Countertops: A Luxury Worth Protecting,https://res.cloudinary.com/dbcpfy04c/image/upload/v1748090941/pin_5_16_fb6hrv.webp,kitchen-inspiration,,https://www.beacleaner.com/how-to-clean-natural-stone-countertops?utm_source=pinterest&utm_campaign=marble-countertops-a,2025-05-24,"Indulge in marble's beauty! 💖 This pin leads to a guide on protecting and maintaining marble countertops, ensuring they remain a stunning focal point in your kitchen.  Learn how to prevent etching, staining, and damage. Click to learn how to preserve marble's elegance.","Marble Countertops, Luxury Kitchen, Stone Protection, Etch Prevention"
Quick & Easy Stone Countertop Refresh,https://res.cloudinary.com/dbcpfy04c/image/upload/v1748090947/pin_5_17_rrpfbl.webp,kitchen-tips,,https://www.beacleaner.com/how-to-clean-natural-stone-countertops?utm_source=pinterest&utm_campaign=quick-easy-stone-cou,2025-05-24,Short on time? No problem! ⏱️ This pin directs you to a guide on quickly refreshing your natural stone countertops for a sparkling clean look.  Simple tips and tricks for busy homeowners. Click to get the quick refresh guide.,"Quick Cleaning, Stone Care, Kitchen Hacks, Time Saving"
Preventing Water Spots on Stone,https://res.cloudinary.com/dbcpfy04c/image/upload/v1748090963/pin_5_18_eawrgu.webp,stone-care-tips,,https://www.beacleaner.com/how-to-clean-natural-stone-countertops?utm_source=pinterest&utm_campaign=preventing-water-spo,2025-05-24,"Say goodbye to water spots!💧 This pin links to a guide on preventing water spots on natural stone countertops, keeping them looking pristine.  Learn how to dry your countertops properly and protect them from damage. Click to learn how to prevent water spots.","Water Spots, Stone Care, Countertop Protection, Drying Tips"
Choosing the Right Stone Sealer,https://res.cloudinary.com/dbcpfy04c/image/upload/v1748090971/pin_5_19_v2bgzc.webp,stone-care-tips,,https://www.beacleaner.com/how-to-clean-natural-stone-countertops?utm_source=pinterest&utm_campaign=choosing-the-right-s,2025-05-24,"Finding the perfect sealer! 🔍 This pin directs you to a guide on choosing the right stone sealer for your natural stone countertops, ensuring optimal protection.  Learn about different types of sealers and their benefits. Click to learn about stone sealers.","Stone Sealer, Countertop Protection, Granite Sealer, Marble Sealer"
Extend the Life of Your Stone Countertops,https://res.cloudinary.com/dbcpfy04c/image/upload/v1748090977/pin_5_20_h6ttvh.webp,tile-care-tips,,https://www.beacleaner.com/how-to-clean-natural-stone-countertops?utm_source=pinterest&utm_campaign=extend-the-life-of-y,2025-05-24,Love your countertops for years! ❤️ This pin leads to a guide on extending the life of your natural stone countertops with proper care and maintenance.  Protect your investment and enjoy lasting beauty. Click to learn how to extend countertop life.,"Countertop Longevity, Stone Care, Kitchen Investment, Maintenance Tips"
The Best Tools for Cleaning Stone,https://res.cloudinary.com/dbcpfy04c/image/upload/v1748090983/pin_5_21_mmrr2g.webp,stone-care-tips,,https://www.beacleaner.com/how-to-clean-natural-stone-countertops?utm_source=pinterest&utm_campaign=the-best-tools-for-c,2025-05-24,"Equip yourself for success! 🧽 This pin directs you to a guide on the best tools for cleaning natural stone countertops, making the job easier and more effective.  From microfiber cloths to soft brushes, learn what you need. Click to learn about the best cleaning tools.","Cleaning Tools, Stone Care, Kitchen Essentials, Microfiber Cloths"
Natural Stone Countertop Cleaning Checklist,https://res.cloudinary.com/dbcpfy04c/image/upload/v1748090990/pin_5_22_rete12.webp,kitchen-cleaning-tips,,https://www.beacleaner.com/how-to-clean-natural-stone-countertops?utm_source=pinterest&utm_campaign=natural-stone-counte,2025-05-24,"Stay on track with this checklist! ✅ This pin links to a printable checklist for cleaning natural stone countertops, ensuring you never miss a step.  Keep your kitchen sparkling clean with ease. Click to get the cleaning checklist.","Cleaning Checklist, Stone Care, Kitchen Organization, Printable"
Common Mistakes to Avoid When Cleaning Stone,https://res.cloudinary.com/dbcpfy04c/image/upload/v1748091000/pin_5_23_ptuwzr.webp,stone-care-tips,,https://www.beacleaner.com/how-to-clean-natural-stone-countertops?utm_source=pinterest&utm_campaign=common-mistakes-to-a,2025-05-24,"Don't make these errors! 🚫 This pin leads to a guide on common mistakes to avoid when cleaning natural stone countertops, preventing damage and preserving their beauty.  Learn from the experts! Click to learn about cleaning mistakes.","Cleaning Mistakes, Stone Care, Granite, Marble"
Revive Dull Marble with These Simple Steps,https://res.cloudinary.com/dbcpfy04c/image/upload/v1748091007/pin_5_24_ue7e9v.webp,stone-care-tips,,https://www.beacleaner.com/how-to-clean-natural-stone-countertops?utm_source=pinterest&utm_campaign=revive-dull-marble-w,2025-05-24,"Bring back the shine to your marble! ✨ This pin directs you to a guide on reviving dull marble countertops with simple, effective steps.  Restore their natural beauty and elegance. Click to learn how to revive dull marble.","Marble Restoration, Stone Care, Shine Restoration, Countertop Revival"
Protect Your Quartz from Scratches & Stains,https://res.cloudinary.com/dbcpfy04c/image/upload/v1748091014/pin_5_25_zbgnup.webp,countertop-tips,,https://www.beacleaner.com/how-to-clean-natural-stone-countertops?utm_source=pinterest&utm_campaign=protect-your-quartz-,2025-05-24,"Keep your quartz looking new! 🛡️ This pin links to a guide on protecting quartz countertops from scratches and stains, ensuring long-lasting beauty.  Learn preventative measures and proper cleaning techniques. Click to learn about quartz protection.","Quartz Protection, Scratch Prevention, Stain Prevention, Countertop Care"
