Title,Media URL,Pinterest board,Thumbnail,Link,Publish date,Description,Keywords
Granite Floor Cleaning for Pet Owners,https://res.cloudinary.com/dbcpfy04c/image/upload/v1747737168/pin_5_18_awaqyn.webp,floor-cleaning-tips,,https://www.beacleaner.com/how-do-you-clean-granite-floors?utm_source=pinterest&utm_campaign=granite-floor-cleani,2025-05-20,"Pet messes got you down? 🐾 This guide provides tips for cleaning granite floors when you have furry friends.  Remove pet stains, odors, and paw prints with ease.  Enjoy a clean and happy home! Click for pet-friendly cleaning solutions!","Pet cleaning,Granite floors,Floor stains,Home cleaning"
Granite Floor Cleaning: A Checklist for Success,https://res.cloudinary.com/dbcpfy04c/image/upload/v1747737173/pin_5_19_lwvxcf.webp,floor-cleaning-tips,,https://www.beacleaner.com/how-do-you-clean-granite-floors?utm_source=pinterest&utm_campaign=granite-floor-cleani,2025-05-20,"Stay organized with our granite floor cleaning checklist! ✅  This handy checklist will help you remember all the important steps, from sweeping to sealing.  Enjoy a sparkling clean without missing a beat. Click to download the checklist!","Cleaning checklist,Granite floors,Floor care,Home organization"
Granite Floor Cleaning: Eco-Friendly Options,https://res.cloudinary.com/dbcpfy04c/image/upload/v1747737178/pin_5_20_imp5jb.webp,floor-cleaning-tips,,https://www.beacleaner.com/how-do-you-clean-granite-floors?utm_source=pinterest&utm_campaign=granite-floor-cleani,2025-05-20,"Go green with your cleaning routine! 🌿 This post explores eco-friendly options for cleaning granite floors, using natural ingredients and sustainable practices.  Protect your floors and the planet. Click for eco-friendly cleaning solutions!","Eco-friendly cleaning,Granite floors,Natural cleaning,Sustainable living"
Granite Floor Cleaning: Troubleshooting Guide,https://res.cloudinary.com/dbcpfy04c/image/upload/v1747737184/pin_5_21_u9o5jo.webp,floor-cleaning-tips,,https://www.beacleaner.com/how-do-you-clean-granite-floors?utm_source=pinterest&utm_campaign=granite-floor-cleani,2025-05-20,"Facing a tough cleaning challenge? 🤔 This troubleshooting guide provides solutions for common granite floor problems, from stubborn stains to dull finishes.  Get the answers you need to restore your floors. Click for expert advice!","Troubleshooting,Granite floors,Floor problems,Cleaning guide"
Granite Floor Cleaning: The Power of pH Balance,https://res.cloudinary.com/dbcpfy04c/image/upload/v1747737190/pin_5_22_wwtqf5.webp,floor-cleaning-tips,,https://www.beacleaner.com/how-do-you-clean-granite-floors?utm_source=pinterest&utm_campaign=granite-floor-cleani,2025-05-20,Understanding pH is key! 🧪 Learn how pH balance affects your granite floors and how to choose cleaning products that won't cause damage.  Protect your investment with informed cleaning practices. Click to learn more!,"pH balance,Granite floors,Cleaning science,Home care"
Granite Floor Cleaning: Professional Tips,https://res.cloudinary.com/dbcpfy04c/image/upload/v1747737196/pin_5_23_esiocf.webp,floor-cleaning-tips,,https://www.beacleaner.com/how-do-you-clean-granite-floors?utm_source=pinterest&utm_campaign=granite-floor-cleani,2025-05-20,Learn from the pros! 🧑‍🔧 We share insider tips from professional granite cleaners to help you achieve a sparkling clean.  Elevate your cleaning game and enjoy stunning results. Click for expert advice!,"Professional cleaning,Granite floors,Floor care,Cleaning tips"
Granite Floor Cleaning: Long-Term Care Secrets,https://res.cloudinary.com/dbcpfy04c/image/upload/v1747737201/pin_5_24_zlggn9.webp,floor-cleaning-tips,,https://www.beacleaner.com/how-do-you-clean-granite-floors?utm_source=pinterest&utm_campaign=granite-floor-cleani,2025-05-20,"Keep your granite floors beautiful for decades! ⏳ This post reveals the secrets to long-term granite floor care, ensuring they stay stunning for years to come.  Invest in your home and enjoy lasting beauty. Click to learn the secrets!","Long-term care,Granite floors,Floor maintenance,Home investment"
Granite Floor Cleaning: Quick Fixes for Busy Days,https://res.cloudinary.com/dbcpfy04c/image/upload/v1747737209/pin_5_25_wfd60e.webp,floor-cleaning-tips,,https://www.beacleaner.com/how-do-you-clean-granite-floors?utm_source=pinterest&utm_campaign=granite-floor-cleani,2025-05-20,No time to scrub? 💨 These quick fixes will help you keep your granite floors looking presentable even on your busiest days.  Simple solutions for a sparkling home. Click for time-saving tips!,"Quick fixes,Granite floors,Busy schedule,Home cleaning"
