Title,Media URL,Pinterest board,Thumbnail,Link,Publish date,Description,Keywords,
Cub Cadet 2518: Electrical Problems?,https://res.cloudinary.com/dbcpfy04c/image/upload/v1747254401/pin_4_6_zizqnh.webp,lawn-repair-ideas,,https://lawntrend.com/cub-cadet-2518-problems/?utm_source=pinterest&utm_campaign=cub-cadet-2518-elect,2025-05-14,Electrical issues can be tricky. This pin leads to a guide on troubleshooting common electrical problems in your Cub Cadet 2518,including faulty safety switches and wiring issues.  Don't get shocked by repair costs!  Learn how to diagnose and fix it yourself. #ElectricalRepair #CubCadet #SafetySwitch #LawnMowerProblems,including faulty safety switches and wiring issues.  Don't get shocked by repair costs!  Learn how to diagnose and fix it yourself. #ElectricalRepair #CubCadet #SafetySwitch #LawnMowerProblems
Keep Your 2518 Running Like New!,https://res.cloudinary.com/dbcpfy04c/image/upload/v1747254408/pin_4_7_xbxwrz.webp,lawn-care-ideas,,https://lawntrend.com/cub-cadet-2518-problems/?utm_source=pinterest&utm_campaign=keep-your-2518-runni,2025-05-14,Don't wait for problems to arise! This pin links to our Cub Cadet 2518 troubleshooting guide,helping you proactively identify and address potential issues.  Preventative maintenance is key to a long-lasting mower.  Enjoy a beautiful lawn for years to come! #PreventativeMaintenance #CubCadet2518 #LawnMowerCare #DIY,helping you proactively identify and address potential issues.  Preventative maintenance is key to a long-lasting mower.  Enjoy a beautiful lawn for years to come! #PreventativeMaintenance #CubCadet2518 #LawnMowerCare #DIY
Cub Cadet 2518: Spindle Repair Guide,https://res.cloudinary.com/dbcpfy04c/image/upload/v1747254413/pin_4_8_hjg6dg.webp,lawn-repair-ideas,,https://lawntrend.com/cub-cadet-2518-problems/?utm_source=pinterest&utm_campaign=cub-cadet-2518-spind,2025-05-14,A damaged spindle can cause vibrations and uneven cutting. This pin directs you to a guide on diagnosing and repairing spindle issues on your Cub Cadet 2518.  Restore your mower's performance and enjoy a smooth,even cut.  Click to learn how! #SpindleRepair #CubCadet #LawnMower #MowerMaintenance,even cut.  Click to learn how! #SpindleRepair #CubCadet #LawnMower #MowerMaintenance
Troubleshooting a Noisy 2518 Mower,https://res.cloudinary.com/dbcpfy04c/image/upload/v1747254419/pin_4_9_qjnda7.webp,lawn-repair-ideas,,https://lawntrend.com/cub-cadet-2518-problems/?utm_source=pinterest&utm_campaign=troubleshooting-a-no,2025-05-14,Is your Cub Cadet 2518 making strange noises?  Don't ignore it! This pin leads to a guide on identifying and resolving common noise issues,from loose parts to worn bearings.  A quiet mower means a peaceful lawn care experience.  Learn how to fix it! #NoisyMower #CubCadet2518 #LawnMowerRepair #Troubleshooting,from loose parts to worn bearings.  A quiet mower means a peaceful lawn care experience.  Learn how to fix it! #NoisyMower #CubCadet2518 #LawnMowerRepair #Troubleshooting
Cub Cadet 2518: Easy Maintenance Tips,https://res.cloudinary.com/dbcpfy04c/image/upload/v1747254425/pin_4_10_yqbqdf.webp,lawn-repair-ideas,,https://lawntrend.com/cub-cadet-2518-problems/?utm_source=pinterest&utm_campaign=cub-cadet-2518-easy-,2025-05-14,Simple maintenance can prevent major problems. This pin links to our guide,offering easy-to-follow maintenance tips for your Cub Cadet 2518.  Keep your mower running smoothly and extend its lifespan.  A little effort goes a long way! #LawnMowerMaintenance #CubCadet #DIYTips #LawnCare,offering easy-to-follow maintenance tips for your Cub Cadet 2518.  Keep your mower running smoothly and extend its lifespan.  A little effort goes a long way! #LawnMowerMaintenance #CubCadet #DIYTips #LawnCare
Fixing a Cub Cadet 2518 That Smokes,https://res.cloudinary.com/dbcpfy04c/image/upload/v1747254432/pin_4_11_xxsjfa.webp,lawn-repair-ideas,,https://lawntrend.com/cub-cadet-2518-problems/?utm_source=pinterest&utm_campaign=fixing-a-cub-cadet-2,2025-05-14,Is your Cub Cadet 2518 smoking? This pin leads to a guide on diagnosing and resolving smoking issues,which could indicate oil leaks or engine problems.  Don't let a smoking mower ruin your day!  Get expert advice and fix it yourself. #SmokingMower #CubCadet2518 #EngineProblems #LawnMowerRepair,which could indicate oil leaks or engine problems.  Don't let a smoking mower ruin your day!  Get expert advice and fix it yourself. #SmokingMower #CubCadet2518 #EngineProblems #LawnMowerRepair
Cub Cadet 2518: Deck Problems Solved,https://res.cloudinary.com/dbcpfy04c/image/upload/v1747254438/pin_4_12_pmydz7.webp,lawn-repair-ideas,,https://lawntrend.com/cub-cadet-2518-problems/?utm_source=pinterest&utm_campaign=cub-cadet-2518-deck-,2025-05-14,"Issues with your mower deck? This pin directs you to a guide covering common deck problems, like bent blades and damaged deck components.  Ensure a clean",even cut with a properly maintained deck.  Click to learn how to fix it! #MowerDeck #CubCadet #BladeRepair #LawnCare,even cut with a properly maintained deck.  Click to learn how to fix it! #MowerDeck #CubCadet #BladeRepair #LawnCare
Save Money: 2518 DIY Repairs,https://res.cloudinary.com/dbcpfy04c/image/upload/v1747254444/pin_4_13_grj0sm.webp,diy-repair-ideas,,https://lawntrend.com/cub-cadet-2518-problems/?utm_source=pinterest&utm_campaign=save-money-2518-diy-,2025-05-14,Don't overpay for repairs! This pin links to our comprehensive Cub Cadet 2518 troubleshooting guide,empowering you to tackle common issues yourself.  Save money and gain valuable skills.  Take control of your lawn care! #DIYRepair #CubCadet2518 #SaveMoney #LawnMower,empowering you to tackle common issues yourself.  Save money and gain valuable skills.  Take control of your lawn care! #DIYRepair #CubCadet2518 #SaveMoney #LawnMower
Cub Cadet 2518: Winterizing Your Mower,https://res.cloudinary.com/dbcpfy04c/image/upload/v1747254449/pin_4_14_yyv1xt.webp,lawn-repair-ideas,,https://lawntrend.com/cub-cadet-2518-problems/?utm_source=pinterest&utm_campaign=cub-cadet-2518-winte,2025-05-14,Prepare your Cub Cadet 2518 for winter storage! This pin links to a guide on winterizing your mower,protecting it from damage and ensuring it's ready to go in the spring.  Extend the life of your mower with proper winter care. #Winterizing #CubCadet2518 #LawnMowerStorage #OffSeasonCare,protecting it from damage and ensuring it's ready to go in the spring.  Extend the life of your mower with proper winter care. #Winterizing #CubCadet2518 #LawnMowerStorage #OffSeasonCare
Diagnose Your 2518's Engine Problems,https://res.cloudinary.com/dbcpfy04c/image/upload/v1747254456/pin_4_15_f7easo.webp,engine-repair-ideas,,https://lawntrend.com/cub-cadet-2518-problems/?utm_source=pinterest&utm_campaign=diagnose-your-2518s-,2025-05-14,Engine trouble? This pin directs you to a guide on diagnosing common engine problems in your Cub Cadet 2518.  From compression issues to carburetor problems,we've got you covered.  Get your engine running smoothly again! #EngineRepair #CubCadet #LawnMowerEngine #Troubleshooting,we've got you covered.  Get your engine running smoothly again! #EngineRepair #CubCadet #LawnMowerEngine #Troubleshooting
Cub Cadet 2518: The Ultimate Guide,https://res.cloudinary.com/dbcpfy04c/image/upload/v1747254462/pin_4_16_n6i9tr.webp,lawn-repair-ideas,,https://lawntrend.com/cub-cadet-2518-problems/?utm_source=pinterest&utm_campaign=cub-cadet-2518-the-u,2025-05-14,Need help with your Cub Cadet 2518? This pin leads to our ultimate troubleshooting guide,covering everything from starting issues to blade engagement problems.  Your one-stop resource for keeping your mower running smoothly. #CubCadet2518 #LawnMowerGuide #DIYRepair #LawnCare,covering everything from starting issues to blade engagement problems.  Your one-stop resource for keeping your mower running smoothly. #CubCadet2518 #LawnMowerGuide #DIYRepair #LawnCare
Fixing a Cub Cadet 2518 That Vibrates,https://res.cloudinary.com/dbcpfy04c/image/upload/v1747254468/pin_4_17_mcpfek.webp,lawn-repair-ideas,,https://lawntrend.com/cub-cadet-2518-problems/?utm_source=pinterest&utm_campaign=fixing-a-cub-cadet-2,2025-05-14,"Excessive vibration? This pin links to a guide on diagnosing and resolving vibration issues in your Cub Cadet 2518, which could indicate blade imbalance or spindle problems.  Enjoy a smoother",more comfortable mowing experience. #VibrationRepair #CubCadet #LawnMowerFix #Troubleshooting,more comfortable mowing experience. #VibrationRepair #CubCadet #LawnMowerFix #Troubleshooting
Easy Cub Cadet 2518 Tune-Up Guide,https://res.cloudinary.com/dbcpfy04c/image/upload/v1747254475/pin_4_18_xok9qk.webp,lawn-care-ideas,,https://lawntrend.com/cub-cadet-2518-problems/?utm_source=pinterest&utm_campaign=easy-cub-cadet-2518-,2025-05-14,Give your Cub Cadet 2518 a tune-up! This pin links to a guide on performing a simple tune-up,including changing the spark plug and air filter.  Keep your mower running at its best. #TuneUp #CubCadet2518 #LawnMowerMaintenance #DIY,including changing the spark plug and air filter.  Keep your mower running at its best. #TuneUp #CubCadet2518 #LawnMowerMaintenance #DIY
Don't Replace It,https://res.cloudinary.com/dbcpfy04c/image/upload/v1747254482/pin_4_19_jmzlv0.webp,lawn-repair-ideas,,https://lawntrend.com/cub-cadet-2518-problems/?utm_source=pinterest&utm_campaign=dont-replace-it,2025-05-14,"Repair It! (2518),Before you buy a new mower, see if you can fix your Cub Cadet 2518! This pin leads to our comprehensive troubleshooting guide",helping you save money and extend the life of your mower.  Don't give up on your mower just yet! #RepairDontReplace #CubCadet #LawnMowerRepair #DIY,helping you save money and extend the life of your mower.  Don't give up on your mower just yet! #RepairDontReplace #CubCadet #LawnMowerRepair #DIY
Title,https://res.cloudinary.com/dbcpfy04c/image/upload/v1747254535/pin_5_1_uun1hq.webp,please-provide-the-title-and-keywords-i-need-that-information-to-suggest-a-board-name-once,,https://lawntrend.com/cub-cadet-ltx-1045-problems/?utm_source=pinterest&utm_campaign=title,2025-05-14,Description,Keywords,Keywords
Cub Cadet LTX 1045: Fix It Yourself!,https://res.cloudinary.com/dbcpfy04c/image/upload/v1747254541/pin_5_2_spog3d.webp,lawn-repair-ideas,,https://lawntrend.com/cub-cadet-ltx-1045-problems/?utm_source=pinterest&utm_campaign=cub-cadet-ltx-1045-f,2025-05-14,"Is your Cub Cadet LTX 1045 giving you trouble? Don't let lawn care become a headache! This guide dives deep into common problems – from engine issues to blade problems – and provides clear, step-by-step solutions you can tackle yourself. Save money on repairs and get back to enjoying your beautiful lawn. We cover everything from diagnosing the issue to finding the right parts.  Don't surrender to a broken mower, reclaim your weekends! Click to learn more and get mowing again! #CubCadet #LawnMowerRepair #LTX1045 #DIYRepair,Cub Cadet,Lawn Mower,Repair",LTX 1045,LTX 1045
LTX 1045 Won't Start? Quick Fixes,https://res.cloudinary.com/dbcpfy04c/image/upload/v1747254547/pin_5_3_bvnsyd.webp,lawn-mower-ideas,,https://lawntrend.com/cub-cadet-ltx-1045-problems/?utm_source=pinterest&utm_campaign=ltx-1045-wont-start-,2025-05-14,"Frustrated with a Cub Cadet LTX 1045 that refuses to start? You're not alone! This pin leads to a comprehensive guide detailing the most frequent causes of starting problems, including fuel issues, spark plugs, and safety switches.  We'll help you pinpoint the culprit and get your mower roaring back to life.  Don't waste another sunny day – get your lawnmower running smoothly!  Click to diagnose and fix it now! #CubCadetLTX1045 #LawnMowerProblems #StartingIssues #FixIt,Starting Issues,Cub Cadet,Lawn Mower",Troubleshooting,Troubleshooting
Cub Cadet LTX 1045: Blade Problems Solved,https://res.cloudinary.com/dbcpfy04c/image/upload/v1747254552/pin_5_4_jxchgn.webp,lawn-repair-ideas,,https://lawntrend.com/cub-cadet-ltx-1045-problems/?utm_source=pinterest&utm_campaign=cub-cadet-ltx-1045-b,2025-05-14,"Dull or damaged blades ruining your lawn's appearance?  Our guide to Cub Cadet LTX 1045 blade issues is here to help! Learn how to safely remove, sharpen, and replace blades for a pristine cut.  We cover common blade problems and provide tips for preventing future damage.  A beautiful lawn is within reach – click to learn how!  Don't settle for a ragged cut! #LawnMowerBlades #CubCadetRepair #LawnCareTips #BladeReplacement,Blade Replacement,Lawn Care,Cub Cadet",Lawn Mower,Lawn Mower
LTX 1045: Fuel System Troubleshooting,https://res.cloudinary.com/dbcpfy04c/image/upload/v1747254559/pin_5_5_s3zl1k.webp,auto-repair-ideas,,https://lawntrend.com/cub-cadet-ltx-1045-problems/?utm_source=pinterest&utm_campaign=ltx-1045-fuel-system,2025-05-14,"Is your Cub Cadet LTX 1045 sputtering or running rough?  A clogged fuel system could be the culprit.  This pin links to a detailed guide on diagnosing and fixing fuel-related problems, including fuel filters, fuel lines, and carburetors.  Don't let a dirty fuel system ruin your mowing experience! Click to learn how to restore optimal performance. #FuelSystem #CubCadetProblems #LawnMowerMaintenance #CarburetorRepair,Fuel System,Lawn Mower,Cub Cadet",Maintenance,Maintenance
Cub Cadet LTX 1045: Belt Replacement Guide,https://res.cloudinary.com/dbcpfy04c/image/upload/v1747254564/pin_5_6_iuaau3.webp,lawn-repair-ideas,,https://lawntrend.com/cub-cadet-ltx-1045-problems/?utm_source=pinterest&utm_campaign=cub-cadet-ltx-1045-b,2025-05-14,"A broken or worn belt can bring your Cub Cadet LTX 1045 to a halt.  This pin directs you to a step-by-step guide on how to safely and effectively replace the drive belt and deck belt.  Save money on professional repairs and keep your mower running smoothly.  Don't get stuck – learn how to replace your belts today! #LawnMowerBelt #CubCadetLTX1045 #DIYLawnCare #BeltReplacement,Belt Replacement,Lawn Mower,Cub Cadet",DIY,DIY
LTX 1045: Electrical Issues? We Can Help!,https://res.cloudinary.com/dbcpfy04c/image/upload/v1747254571/pin_5_7_rfmeut.webp,electrical-ideas,,https://lawntrend.com/cub-cadet-ltx-1045-problems/?utm_source=pinterest&utm_campaign=ltx-1045-electrical-,2025-05-14,"Dealing with electrical problems on your Cub Cadet LTX 1045?  This guide covers common electrical issues, from faulty wiring to blown fuses.  Learn how to diagnose and repair these problems safely and effectively.  Don't let electrical gremlins ruin your lawn care routine! Click for solutions. #ElectricalRepair #CubCadet #LawnMowerFix #WiringDiagram,Electrical Repair,Lawn Mower,Cub Cadet",Troubleshooting,Troubleshooting
Cub Cadet LTX 1045: Engine Problems & Fixes,https://res.cloudinary.com/dbcpfy04c/image/upload/v1747254578/pin_5_8_xmizbt.webp,lawn-repair-ideas,,https://lawntrend.com/cub-cadet-ltx-1045-problems/?utm_source=pinterest&utm_campaign=cub-cadet-ltx-1045-e,2025-05-14,"Is your LTX 1045 engine misfiring or losing power?  Our guide provides a comprehensive overview of common engine problems and their solutions.  From oil changes to carburetor adjustments, we've got you covered.  Keep your engine running strong – click to learn more! #EngineRepair #CubCadetLTX1045 #LawnMowerEngine #SmallEngineRepair,Engine Repair,Lawn Mower,Cub Cadet",Small Engine,Small Engine
LTX 1045: Steering Issues? Diagnose Now!,https://res.cloudinary.com/dbcpfy04c/image/upload/v1747254585/pin_5_9_dojkdl.webp,auto-repair-ideas,,https://lawntrend.com/cub-cadet-ltx-1045-problems/?utm_source=pinterest&utm_campaign=ltx-1045-steering-is,2025-05-14,"Experiencing steering problems with your Cub Cadet LTX 1045?  This pin leads to a guide that helps you diagnose and fix common steering issues, from loose connections to worn components.  Enjoy smooth and effortless mowing again! Click to learn how to restore control. #SteeringRepair #CubCadetProblems #LawnMowerSteering #FixItYourself,Steering Repair,Lawn Mower,Cub Cadet",Troubleshooting,Troubleshooting
Cub Cadet LTX 1045: Preventative Maintenance,https://res.cloudinary.com/dbcpfy04c/image/upload/v1747254590/pin_5_10_wi38ls.webp,lawn-repair-ideas,,https://lawntrend.com/cub-cadet-ltx-1045-problems/?utm_source=pinterest&utm_campaign=cub-cadet-ltx-1045-p,2025-05-14,"Don't wait for problems to arise! This pin links to a guide on preventative maintenance for your Cub Cadet LTX 1045.  Learn how to keep your mower running smoothly for years to come with regular checks and maintenance tasks.  Protect your investment and enjoy hassle-free lawn care! #LawnMowerMaintenance #CubCadetCare #PreventativeMaintenance #LawnCare,Maintenance,Lawn Mower,Cub Cadet",Preventative Care,Preventative Care
LTX 1045: Mowing Deck Repair Guide,https://res.cloudinary.com/dbcpfy04c/image/upload/v1747254596/pin_5_11_fgtu1r.webp,lawn-repair-ideas,,https://lawntrend.com/cub-cadet-ltx-1045-problems/?utm_source=pinterest&utm_campaign=ltx-1045-mowing-deck,2025-05-14,"A damaged mowing deck can affect your lawn's cut quality.  This pin directs you to a guide on repairing common mowing deck issues, from bent metal to worn spindles.  Restore your deck to its former glory and achieve a professional-looking lawn! Click to learn how. #MowingDeck #CubCadetRepair #LawnMowerDeck #DeckRepair,Mowing Deck,Lawn Mower,Cub Cadet",Repair,Repair
Cub Cadet LTX 1045: Safety Switch Problems,https://res.cloudinary.com/dbcpfy04c/image/upload/v1747254603/pin_5_12_aclk4w.webp,lawn-repair-ideas,,https://lawntrend.com/cub-cadet-ltx-1045-problems/?utm_source=pinterest&utm_campaign=cub-cadet-ltx-1045-s,2025-05-14,"Safety first! This pin leads to a guide on troubleshooting safety switch issues on your Cub Cadet LTX 1045.  Learn how to diagnose and repair faulty switches to ensure safe operation.  Don't compromise on safety – click to learn more! #SafetySwitches #CubCadetSafety #LawnMowerSafety #RepairGuide,Safety Switch,Lawn Mower,Cub Cadet",Safety,Safety
LTX 1045: Tire Pressure & Maintenance Tips,https://res.cloudinary.com/dbcpfy04c/image/upload/v1747254609/pin_5_13_rcbhaj.webp,tire-maintenance-ideas,,https://lawntrend.com/cub-cadet-ltx-1045-problems/?utm_source=pinterest&utm_campaign=ltx-1045-tire-pressu,2025-05-14,"Proper tire pressure is crucial for optimal performance.  This pin links to a guide on checking and maintaining your Cub Cadet LTX 1045 tires.  Improve traction, handling, and fuel efficiency – click to learn more! #LawnMowerTires #CubCadetMaintenance #TirePressure #LawnCareTips,Tires,Lawn Mower,Cub Cadet",Maintenance,Maintenance
Cub Cadet LTX 1045: Oil Change Guide,https://res.cloudinary.com/dbcpfy04c/image/upload/v1747254616/pin_5_14_zctrev.webp,lawn-repair-ideas,,https://lawntrend.com/cub-cadet-ltx-1045-problems/?utm_source=pinterest&utm_campaign=cub-cadet-ltx-1045-o,2025-05-14,"Keep your engine running smoothly with regular oil changes.  This pin directs you to a step-by-step guide on how to change the oil in your Cub Cadet LTX 1045.  Protect your engine and extend its lifespan! Click to learn how. #OilChange #CubCadetLTX1045 #LawnMowerOil #EngineMaintenance,Oil Change,Lawn Mower,Cub Cadet",Engine,Engine
LTX 1045: Common Error Codes Explained,https://res.cloudinary.com/dbcpfy04c/image/upload/v1747254623/pin_5_15_ygwg1k.webp,error-codes-ideas,,https://lawntrend.com/cub-cadet-ltx-1045-problems/?utm_source=pinterest&utm_campaign=ltx-1045-common-erro,2025-05-14,"Confused by error codes on your Cub Cadet LTX 1045?  This pin leads to a guide that explains common error codes and their meanings.  Diagnose problems quickly and efficiently – click to learn more! #ErrorCodes #CubCadetDiagnostics #LawnMowerProblems #Troubleshooting,Error Codes,Lawn Mower,Cub Cadet",Diagnostics,Diagnostics
Cub Cadet LTX 1045: Winter Storage Prep,https://res.cloudinary.com/dbcpfy04c/image/upload/v1747254628/pin_5_16_bik4uh.webp,lawn-repair-ideas,,https://lawntrend.com/cub-cadet-ltx-1045-problems/?utm_source=pinterest&utm_campaign=cub-cadet-ltx-1045-w,2025-05-14,"Preparing your LTX 1045 for winter storage?  This pin links to a guide on how to properly winterize your mower to protect it from damage and ensure it's ready to go in the spring.  Don't let winter ruin your mower – click to learn how! #WinterStorage #CubCadetPrep #LawnMowerWinterizing #LawnCare,Winter Storage,Lawn Mower,Cub Cadet",Preparation,Preparation
LTX 1045: Clutch Problems & Solutions,https://res.cloudinary.com/dbcpfy04c/image/upload/v1747254635/pin_5_17_zu4yg8.webp,tractor-repair-ideas,,https://lawntrend.com/cub-cadet-ltx-1045-problems/?utm_source=pinterest&utm_campaign=ltx-1045-clutch-prob,2025-05-14,"Is your Cub Cadet LTX 1045 clutch slipping or engaging poorly? This pin leads to a guide detailing common clutch issues and how to resolve them. Get back to smooth operation and a perfectly manicured lawn! Click to learn more. #ClutchRepair #CubCadetLTX1045 #LawnMowerClutch #DIYFix,Clutch Repair,Lawn Mower,Cub Cadet",Repair,Repair
Cub Cadet LTX 1045: Hydrostatic Transmission,https://res.cloudinary.com/dbcpfy04c/image/upload/v1747254640/pin_5_18_p0apbu.webp,lawn-repair-ideas,,https://lawntrend.com/cub-cadet-ltx-1045-problems/?utm_source=pinterest&utm_campaign=cub-cadet-ltx-1045-h,2025-05-14,"Understanding your LTX 1045's hydrostatic transmission is key to smooth operation. This pin links to a guide explaining how it works and how to troubleshoot common problems. Don't struggle with jerky movements – click to learn! #HydrostaticTransmission #CubCadetRepair #LawnMowerTransmission #SmoothRide,Transmission,Lawn Mower,Cub Cadet",Repair,Repair
LTX 1045: Battery Care & Replacement,https://res.cloudinary.com/dbcpfy04c/image/upload/v1747254647/pin_5_19_dztgfv.webp,battery-care-ideas,,https://lawntrend.com/cub-cadet-ltx-1045-problems/?utm_source=pinterest&utm_campaign=ltx-1045-battery-car,2025-05-14,"A dead battery can ruin your mowing day. This pin directs you to a guide on battery care, testing, and replacement for your Cub Cadet LTX 1045. Keep your mower powered up and ready to go! Click to learn more. #LawnMowerBattery #CubCadetCare #BatteryReplacement #PowerUp,Battery,Lawn Mower,Cub Cadet",Maintenance,Maintenance
Cub Cadet LTX 1045: Spindle Repair Guide,https://res.cloudinary.com/dbcpfy04c/image/upload/v1747254651/pin_5_20_v7kxu3.webp,lawn-repair-ideas,,https://lawntrend.com/cub-cadet-ltx-1045-problems/?utm_source=pinterest&utm_campaign=cub-cadet-ltx-1045-s,2025-05-14,"Worn spindles can cause vibration and poor cut quality. This pin links to a guide on diagnosing and repairing spindle issues on your LTX 1045. Restore a smooth, even cut – click to learn how! #SpindleRepair #CubCadetLTX1045 #LawnMowerSpindle #SmoothCut,Spindle,Lawn Mower,Cub Cadet",Repair,Repair
LTX 1045: Finding Replacement Parts Easily,https://res.cloudinary.com/dbcpfy04c/image/upload/v1747254657/pin_5_21_ji0qav.webp,repair-ideas,,https://lawntrend.com/cub-cadet-ltx-1045-problems/?utm_source=pinterest&utm_campaign=ltx-1045-finding-rep,2025-05-14,"Need parts for your Cub Cadet LTX 1045? This pin directs you to resources for finding genuine replacement parts quickly and easily. Don't waste time searching – click to find what you need! #CubCadetParts #LawnMowerParts #ReplacementParts #FindItFast,Parts,Lawn Mower,Cub Cadet",Replacement,Replacement
Cub Cadet LTX 1045: Diagnose Vibrations,https://res.cloudinary.com/dbcpfy04c/image/upload/v1747254664/pin_5_22_kixrxc.webp,lawn-repair-ideas,,https://lawntrend.com/cub-cadet-ltx-1045-problems/?utm_source=pinterest&utm_campaign=cub-cadet-ltx-1045-d,2025-05-14,"Excessive vibration can indicate serious problems. This pin leads to a guide on diagnosing the causes of vibration in your LTX 1045 and how to fix them. Protect your mower and enjoy a smoother ride! Click to learn more. #LawnMowerVibration #CubCadetProblems #Troubleshooting #SmoothOperation,Vibration,Lawn Mower,Cub Cadet",Troubleshooting,Troubleshooting
LTX 1045: Cleaning & Detailing Tips,https://res.cloudinary.com/dbcpfy04c/image/upload/v1747254672/pin_5_23_sxumqp.webp,cleaning-inspiration,,https://lawntrend.com/cub-cadet-ltx-1045-problems/?utm_source=pinterest&utm_campaign=ltx-1045-cleaning-de,2025-05-14,"Keep your Cub Cadet LTX 1045 looking its best! This pin links to a guide on cleaning and detailing your mower for optimal appearance and performance. A clean mower is a happy mower! Click to learn how. #LawnMowerCleaning #CubCadetCare #DetailingTips #SparklingClean,Cleaning,Lawn Mower,Cub Cadet",Maintenance,Maintenance
Cub Cadet LTX 1045: PTO Clutch Issues,https://res.cloudinary.com/dbcpfy04c/image/upload/v1747254678/pin_5_24_q9boxh.webp,lawn-repair-ideas,,https://lawntrend.com/cub-cadet-ltx-1045-problems/?utm_source=pinterest&utm_campaign=cub-cadet-ltx-1045-p,2025-05-14,"Is your PTO clutch not engaging? This pin directs you to a guide on diagnosing and repairing PTO clutch problems on your LTX 1045. Get your blades spinning again – click to learn how! #PTOCutch #CubCadetRepair #LawnMowerPTO #BladeEngagement,PTO Clutch,Lawn Mower,Cub Cadet",Repair,Repair
LTX 1045: Leveling Your Mower Deck,https://res.cloudinary.com/dbcpfy04c/image/upload/v1747254684/pin_5_25_htjuaf.webp,lawn-care-ideas,,https://lawntrend.com/cub-cadet-ltx-1045-problems/?utm_source=pinterest&utm_campaign=ltx-1045-leveling-yo,2025-05-14,"Achieve a perfect cut with a properly leveled mower deck. This pin links to a guide on how to level the deck on your Cub Cadet LTX 1045. Say goodbye to scalping and uneven cuts! Click to learn more. #MowerDeckLeveling #CubCadetLTX1045 #PerfectCut #LawnCareTips,Deck Leveling,Lawn Mower,Cub Cadet",Maintenance,Maintenance
