Title,Media URL,Pinterest board,Thumbnail,Link,Publish date,Description,Keywords
Title,https://res.cloudinary.com/dbcpfy04c/image/upload/v1747736427/pin_1_1_vyuojz.webp,please-provide-the-title-and-keywords-i-need-that-information-to-suggest-a-board-name-once,,https://www.beacleaner.com/how-to-clean-metal-handles-on-kitchen-cabinets?utm_source=pinterest&utm_campaign=title,2025-05-20,Description,Keywords
Sparkling Kitchen Handles: Easy Guide,https://res.cloudinary.com/dbcpfy04c/image/upload/v1747736434/pin_1_2_vmoev8.webp,kitchen-hardware-ideas,,https://www.beacleaner.com/how-to-clean-metal-handles-on-kitchen-cabinets?utm_source=pinterest&utm_campaign=sparkling-kitchen-ha,2025-05-20,"Tired of grimy, dull kitchen cabinet handles ruining your beautiful kitchen? This guide reveals the *easiest* ways to restore their shine! From gentle daily cleaning to tackling stubborn grease, we cover everything. Learn how to identify your handle's metal type (brass, stainless steel, nickel) for the *best* results. Don't let dirty hardware drag down your space – a little effort makes a HUGE difference! Click to learn how to make your kitchen feel new again! ✨ #KitchenCleaning #CabinetHardware #MetalCleaning #HomeHacks",Kitchen Handles
Bye-Bye Fingerprints! Handle Cleaning,https://res.cloudinary.com/dbcpfy04c/image/upload/v1747736441/pin_1_3_doozyl.webp,kitchen-cleaning-tips,,https://www.beacleaner.com/how-to-clean-metal-handles-on-kitchen-cabinets?utm_source=pinterest&utm_campaign=bye-bye-fingerprints,2025-05-20,"Ugh, kitchen cabinet handles… magnets for fingerprints and grime! 😩 This post shows you how to banish those unsightly marks *fast*. We'll walk you through simple DIY cleaning solutions using things you probably already have.  Plus, learn preventative tips to keep them looking pristine longer.  A clean kitchen is a happy kitchen – let's get started! Click to read now! 🏡 #CleanKitchen #FingerprintFree #HomeMaintenance #EasyCleaning",Kitchen Cabinets
Brass Handle Revival: Step-by-Step,https://res.cloudinary.com/dbcpfy04c/image/upload/v1747736447/pin_1_4_yyigit.webp,hardware-ideas,,https://www.beacleaner.com/how-to-clean-metal-handles-on-kitchen-cabinets?utm_source=pinterest&utm_campaign=brass-handle-revival,2025-05-20,"Is your beautiful brass hardware looking tarnished and dull? 😔 Don't replace it – *restore* it! This guide provides a detailed, step-by-step process for cleaning and polishing brass handles, bringing back their warm glow.  We'll cover gentle methods to avoid damage and keep your kitchen looking luxurious. Click to learn the secrets to brass brilliance! ✨ #BrassCleaning #KitchenUpgrade #HardwareRefresh #DIYCleaning",Brass Handles
Stainless Steel Shine: Quick & Easy,https://res.cloudinary.com/dbcpfy04c/image/upload/v1747736454/pin_1_5_dthqgc.webp,cleaning-tips,,https://www.beacleaner.com/how-to-clean-metal-handles-on-kitchen-cabinets?utm_source=pinterest&utm_campaign=stainless-steel-shin,2025-05-20,"Love the sleek look of stainless steel but hate the smudges? 😫 This post is your solution! Discover the quickest and easiest ways to clean stainless steel kitchen cabinet handles, leaving them sparkling and streak-free.  We'll share pro tips for avoiding scratches and maintaining that beautiful shine. Click to get a spotless kitchen! 🌟 #StainlessSteel #KitchenClean #CleaningHacks #HomeTips",Stainless Steel
Nickel Handle Care: Protect the Finish,https://res.cloudinary.com/dbcpfy04c/image/upload/v1747736460/pin_1_6_svtqyi.webp,home-hardware-tips,,https://www.beacleaner.com/how-to-clean-metal-handles-on-kitchen-cabinets?utm_source=pinterest&utm_campaign=nickel-handle-care-p,2025-05-20,"Nickel handles add a touch of elegance, but they require special care. ✨ This guide teaches you how to clean nickel cabinet hardware *without* damaging the finish.  Learn the best cleaning solutions and techniques to preserve their luster for years to come.  Protect your investment – click to read now! 💎 #NickelCleaning #CabinetCare #HardwareMaintenance #HomeDecor",Nickel Handles
Grease-Busting Handle Cleaning,https://res.cloudinary.com/dbcpfy04c/image/upload/v1747736466/pin_1_7_risooj.webp,cleaning-tips,,https://www.beacleaner.com/how-to-clean-metal-handles-on-kitchen-cabinets?utm_source=pinterest&utm_campaign=grease-busting-handl,2025-05-20,Kitchen grease is the enemy! ⚔️ This post tackles even the most stubborn grease buildup on your cabinet handles. We'll show you effective cleaning methods that cut through grime and leave your hardware sparkling clean.  Don't let grease ruin your kitchen's look – click to learn how to win the battle! 💪 #GreaseCleaning #KitchenHacks #DeepClean #HomeCleaningTips,Grease Removal
DIY Handle Cleaner: Save Money!,https://res.cloudinary.com/dbcpfy04c/image/upload/v1747736472/pin_1_8_d2jnnl.webp,cleaning-tips,,https://www.beacleaner.com/how-to-clean-metal-handles-on-kitchen-cabinets?utm_source=pinterest&utm_campaign=diy-handle-cleaner-s,2025-05-20,Skip the expensive cleaners! 💰 This post reveals how to make your own effective and affordable cleaning solutions for kitchen cabinet handles.  We'll share recipes using common household ingredients.  Save money and get a sparkling clean kitchen – it's a win-win! Click to learn more! 🌿 #DIYCleaner #NaturalCleaning #KitchenTips #SaveMoney,DIY Cleaning
Preventative Handle Cleaning: Stay Clean,https://res.cloudinary.com/dbcpfy04c/image/upload/v1747736478/pin_1_9_q3chga.webp,cleaning-tips,,https://www.beacleaner.com/how-to-clean-metal-handles-on-kitchen-cabinets?utm_source=pinterest&utm_campaign=preventative-handle-,2025-05-20,Don't wait for grime to build up! ⏰ This post focuses on preventative cleaning techniques to keep your kitchen cabinet handles looking their best.  Simple daily habits can make a huge difference.  A little maintenance goes a long way – click to learn how! ✨ #PreventativeCleaning #KitchenMaintenance #CleanHome #EasyHabits,Preventative Care
Handle Cleaning for Busy Moms,https://res.cloudinary.com/dbcpfy04c/image/upload/v1747736484/pin_1_10_nk2bbo.webp,cleaning-tips,,https://www.beacleaner.com/how-to-clean-metal-handles-on-kitchen-cabinets?utm_source=pinterest&utm_campaign=handle-cleaning-for-,2025-05-20,"Busy mom? No problem! 👩‍👧‍👦 This post offers quick and easy cleaning solutions for kitchen cabinet handles, perfect for a hectic lifestyle.  Get a sparkling clean kitchen without spending hours scrubbing.  You deserve a beautiful and clean home – click to learn how! 💖 #MomLife #QuickCleaning #KitchenHacks #BusyMom",Quick Cleaning
Restore Antique Handles: Gentle Care,https://res.cloudinary.com/dbcpfy04c/image/upload/v1747736490/pin_1_11_umiwnm.webp,antique-restoration-ideas,,https://www.beacleaner.com/how-to-clean-metal-handles-on-kitchen-cabinets?utm_source=pinterest&utm_campaign=restore-antique-hand,2025-05-20,Have antique kitchen cabinet handles? 🕰️ This post provides gentle cleaning methods to preserve their beauty and value.  Learn how to clean delicate finishes without causing damage.  Protect your treasures – click to read now! 💎 #AntiqueCleaning #VintageHardware #CabinetRestoration #HomePreservation,Antique Cleaning
The Ultimate Handle Cleaning Checklist,https://res.cloudinary.com/dbcpfy04c/image/upload/v1747736496/pin_1_12_jgh6jv.webp,cleaning-tips,,https://www.beacleaner.com/how-to-clean-metal-handles-on-kitchen-cabinets?utm_source=pinterest&utm_campaign=the-ultimate-handle-,2025-05-20,"Don't miss a step! ✅ This post provides a comprehensive checklist for cleaning kitchen cabinet handles, covering everything from identifying the metal type to polishing for a brilliant shine.  Get a perfectly clean kitchen every time – click to download the checklist! 📝 #CleaningChecklist #KitchenCleaning #HomeOrganization #CleaningTips",Cleaning Checklist
Before & After: Handle Cleaning Magic,https://res.cloudinary.com/dbcpfy04c/image/upload/v1747736504/pin_1_13_oxeoc1.webp,cleaning-tips,,https://www.beacleaner.com/how-to-clean-metal-handles-on-kitchen-cabinets?utm_source=pinterest&utm_campaign=before-after-handle-,2025-05-20,See the amazing transformation! ✨ This post features stunning before & after photos of dirty kitchen cabinet handles being restored to their former glory.  Get inspired and learn how to achieve similar results in your own kitchen. Click to see the magic! 🤩 #BeforeAndAfter #KitchenTransformation #CleaningMotivation #HomeImprovement,Before and After
Protect Your Handles: Cleaning Mistakes,https://res.cloudinary.com/dbcpfy04c/image/upload/v1747736510/pin_1_14_ybdffk.webp,cleaning-tips,,https://www.beacleaner.com/how-to-clean-metal-handles-on-kitchen-cabinets?utm_source=pinterest&utm_campaign=protect-your-handles,2025-05-20,Avoid these common mistakes! ❌ This post reveals the cleaning errors that can damage your kitchen cabinet handles.  Learn how to protect your hardware and keep it looking its best.  Don't risk ruining your investment – click to read now! ⚠️ #CleaningMistakes #HardwareCare #KitchenTips #AvoidDamage,Cleaning Mistakes
Deep Cleaning Kitchen Handles: The Guide,https://res.cloudinary.com/dbcpfy04c/image/upload/v1747736517/pin_1_15_eef7gf.webp,kitchen-cleaning-tips,,https://www.beacleaner.com/how-to-clean-metal-handles-on-kitchen-cabinets?utm_source=pinterest&utm_campaign=deep-cleaning-kitche,2025-05-20,"Ready for a deep clean? 💪 This post provides a detailed guide to thoroughly cleaning kitchen cabinet handles, removing even the most stubborn grime.  Get a sparkling clean kitchen that you'll love – click to learn how! ✨ #DeepCleaning #KitchenClean #HomeCleaning #GrimeRemoval",Deep Cleaning
Easy Handle Cleaning Routine: 5 Minutes!,https://res.cloudinary.com/dbcpfy04c/image/upload/v1747736524/pin_1_16_zc4kfq.webp,cleaning-tips,,https://www.beacleaner.com/how-to-clean-metal-handles-on-kitchen-cabinets?utm_source=pinterest&utm_campaign=easy-handle-cleaning,2025-05-20,"5 minutes is all it takes! ⏱️ This post shows you how to establish a quick and easy cleaning routine for kitchen cabinet handles, keeping them looking their best with minimal effort.  A clean kitchen doesn't have to be a chore – click to learn more! 💖 #CleaningRoutine #QuickClean #KitchenHacks #EasyCleaning",Cleaning Routine
Cleaning Handles with Baking Soda,https://res.cloudinary.com/dbcpfy04c/image/upload/v1747736530/pin_1_17_iszhwk.webp,cleaning-tips,,https://www.beacleaner.com/how-to-clean-metal-handles-on-kitchen-cabinets?utm_source=pinterest&utm_campaign=cleaning-handles-wit,2025-05-20,"Baking soda to the rescue! 🦸‍♀️ This post reveals how to use baking soda to effectively clean kitchen cabinet handles, removing grime and restoring shine.  A natural and affordable cleaning solution – click to learn more! 🌿 #BakingSoda #NaturalCleaning #KitchenHacks #DIYCleaning",Baking Soda
Lemon Juice for Shiny Handles,https://res.cloudinary.com/dbcpfy04c/image/upload/v1747736536/pin_1_18_yefg3f.webp,cleaning-tips,,https://www.beacleaner.com/how-to-clean-metal-handles-on-kitchen-cabinets?utm_source=pinterest&utm_campaign=lemon-juice-for-shin,2025-05-20,"Brighten your kitchen with lemon! 🍋 This post shows you how to use lemon juice to clean and polish kitchen cabinet handles, leaving them sparkling and fresh.  A natural and effective cleaning solution – click to learn more! ✨ #LemonCleaning #NaturalCleaning #KitchenTips #ShinyHandles",Lemon Juice
Cleaning Handles After Renovations,https://res.cloudinary.com/dbcpfy04c/image/upload/v1747736543/pin_1_19_q0m9fn.webp,cleaning-tips,,https://www.beacleaner.com/how-to-clean-metal-handles-on-kitchen-cabinets?utm_source=pinterest&utm_campaign=cleaning-handles-aft,2025-05-20,"Post-renovation cleanup? 🛠️ This post provides tips for cleaning kitchen cabinet handles after a remodel, removing dust, debris, and construction residue.  Get your kitchen sparkling clean after your project – click to learn more! 🌟 #RenovationCleaning #KitchenClean #PostConstruction #HomeImprovement",Renovation Cleaning
Handle Cleaning: Stainless Steel vs. Brass,https://res.cloudinary.com/dbcpfy04c/image/upload/v1747736549/pin_1_20_dsqgoz.webp,cleaning-tips,,https://www.beacleaner.com/how-to-clean-metal-handles-on-kitchen-cabinets?utm_source=pinterest&utm_campaign=handle-cleaning-stai,2025-05-20,"Which method is best? 🤔 This post compares and contrasts cleaning methods for stainless steel and brass kitchen cabinet handles, helping you choose the right approach for your hardware.  Get the perfect shine – click to learn more! ✨ #StainlessSteel #BrassCleaning #KitchenTips #HardwareCare",Stainless Steel
The Secret to Streak-Free Handles,https://res.cloudinary.com/dbcpfy04c/image/upload/v1747736555/pin_1_21_rs6t13.webp,cleaning-tips,,https://www.beacleaner.com/how-to-clean-metal-handles-on-kitchen-cabinets?utm_source=pinterest&utm_campaign=the-secret-to-streak,2025-05-20,"Say goodbye to streaks! 👋 This post reveals the secret to achieving streak-free kitchen cabinet handles, leaving them sparkling and pristine.  A clean kitchen is a happy kitchen – click to learn more! 💖 #StreakFree #KitchenCleaning #HomeTips #CleaningHacks",Streak Free
Handle Cleaning: A Room-by-Room Guide,https://res.cloudinary.com/dbcpfy04c/image/upload/v1747736560/pin_1_22_gsf6rw.webp,cleaning-tips,,https://www.beacleaner.com/how-to-clean-metal-handles-on-kitchen-cabinets?utm_source=pinterest&utm_campaign=handle-cleaning-a-ro,2025-05-20,"Beyond the kitchen! 🏡 This post expands on handle cleaning techniques, offering tips for cleaning hardware throughout your home.  A consistently clean home is a beautiful home – click to learn more! ✨ #HomeCleaning #HardwareCare #CleaningTips #RoomByRoom",Home Cleaning
Protecting Painted Handles: Cleaning Guide,https://res.cloudinary.com/dbcpfy04c/image/upload/v1747736569/pin_1_23_eol5hr.webp,home-tips-ideas,,https://www.beacleaner.com/how-to-clean-metal-handles-on-kitchen-cabinets?utm_source=pinterest&utm_campaign=protecting-painted-h,2025-05-20,"Painted handles need extra love! 🎨 This post provides gentle cleaning methods for painted kitchen cabinet hardware, preserving the color and finish.  Protect your unique style – click to learn more! 💎 #PaintedHandles #CabinetCare #CleaningTips #HomeDecor",Painted Handles
Quick Tip: Disinfecting Handles,https://res.cloudinary.com/dbcpfy04c/image/upload/v1747736576/pin_1_24_cimdta.webp,cleaning-tips,,https://www.beacleaner.com/how-to-clean-metal-handles-on-kitchen-cabinets?utm_source=pinterest&utm_campaign=quick-tip-disinfecti,2025-05-20,"Stay healthy! 🦠 This post offers a quick and easy tip for disinfecting kitchen cabinet handles, helping to prevent the spread of germs.  A clean and healthy home is a happy home – click to learn more! 💖 #Disinfecting #KitchenClean #HomeHealth #GermFree",Disinfecting
Handle Cleaning: The Ultimate FAQ,https://res.cloudinary.com/dbcpfy04c/image/upload/v1747736582/pin_1_25_j7j7gi.webp,cleaning-tips,,https://www.beacleaner.com/how-to-clean-metal-handles-on-kitchen-cabinets?utm_source=pinterest&utm_campaign=handle-cleaning-the-,2025-05-20,"Got questions? 🤔 This post answers frequently asked questions about cleaning kitchen cabinet handles, providing expert advice and solutions.  Get all your cleaning questions answered – click to read now! 💡 #FAQ #KitchenCleaning #HomeTips #CleaningAdvice",FAQ
Title,https://res.cloudinary.com/dbcpfy04c/image/upload/v1747736624/pin_2_1_jkt3em.webp,please-provide-the-title-and-keywords-i-need-that-information-to-suggest-a-board-name-once,,https://www.beacleaner.com/how-long-for-air-purifier-to-clean-room?utm_source=pinterest&utm_campaign=title,2025-05-20,Description,Keywords
How Soon Will You Breathe Easier?,https://res.cloudinary.com/dbcpfy04c/image/upload/v1747736631/pin_2_2_v8iiz9.webp,air-purification-ideas,,https://www.beacleaner.com/how-long-for-air-purifier-to-clean-room?utm_source=pinterest&utm_campaign=how-soon-will-you-br,2025-05-20,Is your air purifier working as fast as it should? Don't wait forever for clean air! This guide breaks down exactly how long it takes an air purifier to clean a room,factoring in room size
Air Purifier Timing: A Quick Guide,https://res.cloudinary.com/dbcpfy04c/image/upload/v1747736637/pin_2_3_abnuxf.webp,healthy-home-tips,,https://www.beacleaner.com/how-long-for-air-purifier-to-clean-room?utm_source=pinterest&utm_campaign=air-purifier-timing-,2025-05-20,Feeling stuffy? Wondering if your air purifier is actually making a difference? This post reveals the realistic timeline for air purification,from initial impact to complete room cleaning. We cover everything from smoke & dust to allergens & VOCs. Don't guess – know! Get the facts and create a healthier home environment for you and your family. Click to read and breathe easier today!
Fastest Way to Clean Air: Secrets!,https://res.cloudinary.com/dbcpfy04c/image/upload/v1747736644/pin_2_4_ijcj3x.webp,cleaning-tips,,https://www.beacleaner.com/how-long-for-air-purifier-to-clean-room?utm_source=pinterest&utm_campaign=fastest-way-to-clean,2025-05-20,Unlock the secrets to rapid air purification! This article dives deep into the factors affecting how quickly your air purifier cleans a room. Discover how to optimize placement,fan speed
Air Purifier: How Long is *Too* Long?,https://res.cloudinary.com/dbcpfy04c/image/upload/v1747736650/pin_2_5_gwetxv.webp,home-air-tips,,https://www.beacleaner.com/how-long-for-air-purifier-to-clean-room?utm_source=pinterest&utm_campaign=air-purifier-how-lon,2025-05-20,Is your air purifier taking ages to clean the air? You might be doing something wrong! This guide helps you troubleshoot slow purification,identify common mistakes
Breathe Easy: Air Purifier Timeline,https://res.cloudinary.com/dbcpfy04c/image/upload/v1747736658/pin_2_6_q5azxp.webp,clean-air-ideas,,https://www.beacleaner.com/how-long-for-air-purifier-to-clean-room?utm_source=pinterest&utm_campaign=breathe-easy-air-pur,2025-05-20,Imagine a home free from allergens,dust
CADR Explained: Air Purifier Speed,https://res.cloudinary.com/dbcpfy04c/image/upload/v1747736666/pin_2_7_s8acc2.webp,air-purifiers-tips,,https://www.beacleaner.com/how-long-for-air-purifier-to-clean-room?utm_source=pinterest&utm_campaign=cadr-explained-air-p,2025-05-20,Confused by CADR ratings? This article demystifies this crucial air purifier spec and shows you how to use it to determine how quickly a purifier will clean your room. Learn to compare models effectively and choose the best purifier for your needs. Don't get stuck with a slow or underpowered unit – click to learn!,CADR rating
Air Purifier & Room Size: The Match,https://res.cloudinary.com/dbcpfy04c/image/upload/v1747736672/pin_2_8_ef6idp.webp,air-purifier-ideas,,https://www.beacleaner.com/how-long-for-air-purifier-to-clean-room?utm_source=pinterest&utm_campaign=air-purifier-room-si,2025-05-20,Is your air purifier the right size for your room? A mismatch can lead to slow or ineffective cleaning. This post provides a simple guide to calculating the ideal air purifier size based on your room's square footage and ceiling height. Don't compromise on air quality – get the right fit! Click to learn more.,room size
Smoke Removal: How Fast Can It Work?,https://res.cloudinary.com/dbcpfy04c/image/upload/v1747736679/pin_2_9_zjjq0z.webp,home-cleaning-tips,,https://www.beacleaner.com/how-long-for-air-purifier-to-clean-room?utm_source=pinterest&utm_campaign=smoke-removal-how-fa,2025-05-20,Dealing with smoke from wildfires or cooking? This article focuses on how quickly an air purifier can remove smoke particles from your room. We discuss the importance of HEPA filters and activated carbon for smoke removal and provide realistic timelines. Protect your lungs – click to learn!,smoke removal
Allergy Season Survival: Air Purifier Help,https://res.cloudinary.com/dbcpfy04c/image/upload/v1747736685/pin_2_10_x97rfa.webp,allergy-tips,,https://www.beacleaner.com/how-long-for-air-purifier-to-clean-room?utm_source=pinterest&utm_campaign=allergy-season-survi,2025-05-20,Allergy season got you down? An air purifier can be a lifesaver! This post explains how long it takes an air purifier to remove allergens like pollen,dust mites
VOCs & Air Purifiers: What You Need to Know,https://res.cloudinary.com/dbcpfy04c/image/upload/v1747736692/pin_2_11_gw40yn.webp,healthy-home-tips,,https://www.beacleaner.com/how-long-for-air-purifier-to-clean-room?utm_source=pinterest&utm_campaign=vocs-air-purifiers-w,2025-05-20,Volatile Organic Compounds (VOCs) are hidden pollutants that can harm your health. This article explains how air purifiers with activated carbon filters can remove VOCs from your room and how long it takes to see results. Protect your family – click to learn!,VOC removal
Air Purifier Filters: How Often to Change?,https://res.cloudinary.com/dbcpfy04c/image/upload/v1747736701/pin_2_12_waxss2.webp,home-air-tips,,https://www.beacleaner.com/how-long-for-air-purifier-to-clean-room?utm_source=pinterest&utm_campaign=air-purifier-filters,2025-05-20,Your air purifier is only as good as its filters! This post explains how often to change your filters to maintain optimal performance and how filter condition affects cleaning time. Don't let dirty filters slow down your purification – click to learn!,filter replacement
DIY Air Purifier Boost: Speed Up Cleaning,https://res.cloudinary.com/dbcpfy04c/image/upload/v1747736707/pin_2_13_vidniw.webp,home-air-tips,,https://www.beacleaner.com/how-long-for-air-purifier-to-clean-room?utm_source=pinterest&utm_campaign=diy-air-purifier-boo,2025-05-20,Want to speed up your air purifier's cleaning time? This article offers simple DIY tips to optimize its performance,including placement
Air Purifier vs. Air Freshener: The Difference,https://res.cloudinary.com/dbcpfy04c/image/upload/v1747736713/pin_2_14_h8xxbb.webp,clean-air-tips,,https://www.beacleaner.com/how-long-for-air-purifier-to-clean-room?utm_source=pinterest&utm_campaign=air-purifier-vs-air-,2025-05-20,Don't just mask odors – eliminate them! This post explains the key differences between air purifiers and air fresheners and why an air purifier is the superior choice for improving indoor air quality. Breathe healthier air – click to learn!,air purifier vs air freshener
Pet Owners: Air Purifier Cleaning Times,https://res.cloudinary.com/dbcpfy04c/image/upload/v1747736719/pin_2_15_gvwigt.webp,pet-care-tips,,https://www.beacleaner.com/how-long-for-air-purifier-to-clean-room?utm_source=pinterest&utm_campaign=pet-owners-air-purif,2025-05-20,Got pets? Pet dander and odors can quickly fill your home. This article focuses on how long it takes an air purifier to remove pet allergens and odors from your room. Keep your home fresh and your pets happy – click to learn!,pet dander removal
Asthma & Air Purifiers: A Breath of Fresh Air,https://res.cloudinary.com/dbcpfy04c/image/upload/v1747736725/pin_2_16_msd36l.webp,asthma-relief-tips,,https://www.beacleaner.com/how-long-for-air-purifier-to-clean-room?utm_source=pinterest&utm_campaign=asthma-air-purifiers,2025-05-20,Living with asthma can be challenging. This post explains how an air purifier can help reduce asthma triggers and improve your breathing. Learn how long it takes to see results and choose the right purifier for your needs. Breathe easier – click to learn!,asthma relief
Air Purifier Placement: Maximize Efficiency,https://res.cloudinary.com/dbcpfy04c/image/upload/v1747736731/pin_2_17_jlhdxo.webp,home-air-tips,,https://www.beacleaner.com/how-long-for-air-purifier-to-clean-room?utm_source=pinterest&utm_campaign=air-purifier-placeme,2025-05-20,Where you place your air purifier matters! This article provides tips on optimal placement for maximum efficiency,ensuring it can effectively clean the entire room. Don't let your purifier work harder than it needs to – click to learn!
The Science of Air Purification: A Deep Dive,https://res.cloudinary.com/dbcpfy04c/image/upload/v1747736738/pin_2_18_nmtyst.webp,air-purification-tips,,https://www.beacleaner.com/how-long-for-air-purifier-to-clean-room?utm_source=pinterest&utm_campaign=the-science-of-air-p,2025-05-20,Curious about the science behind air purification? This post delves into the technology behind HEPA filters,activated carbon
Air Purifier & Dust: A Winning Combo,https://res.cloudinary.com/dbcpfy04c/image/upload/v1747736744/pin_2_19_inu6be.webp,air-purifier-ideas,,https://www.beacleaner.com/how-long-for-air-purifier-to-clean-room?utm_source=pinterest&utm_campaign=air-purifier-dust-a-,2025-05-20,Tired of dusting? An air purifier can significantly reduce dust levels in your home. This article explains how long it takes to see a noticeable difference and how to choose a purifier that's effective at dust removal. Breathe easier and dust less – click to learn!,dust removal
Air Purifier: Initial Run-In Period?,https://res.cloudinary.com/dbcpfy04c/image/upload/v1747736750/pin_2_20_hygkwr.webp,air-quality-tips,,https://www.beacleaner.com/how-long-for-air-purifier-to-clean-room?utm_source=pinterest&utm_campaign=air-purifier-initial,2025-05-20,Did you know your air purifier needs a break-in period? This post explains why it takes longer to clean the air initially and how to optimize performance during the first few days. Get the best results from day one – click to learn!,air purifier break-in
Air Purifier & Mold Spores: Can It Help?,https://res.cloudinary.com/dbcpfy04c/image/upload/v1747736756/pin_2_21_sh1ji8.webp,air-purifier-ideas,,https://www.beacleaner.com/how-long-for-air-purifier-to-clean-room?utm_source=pinterest&utm_campaign=air-purifier-mold-sp,2025-05-20,Worried about mold spores? This article explores whether an air purifier can help remove mold spores from the air and how long it takes to see results. Protect your health – click to learn!,mold spore removal
