Title,Media URL,Pinterest board,Thumbnail,Link,Publish date,Description,Keywords
Title,https://res.cloudinary.com/dbcpfy04c/image/upload/v1748089981/pin_1_1_qsvppo.webp,please-provide-the-title-and-keywords-i-need-that-information-to-suggest-a-board-name-once,,https://www.beacleaner.com/how-to-clean-mosaic-tiles?utm_source=pinterest&utm_campaign=title,2025-05-24,Description,Keywords
Sparkling Mosaic Tiles: A Guide,https://res.cloudinary.com/dbcpfy04c/image/upload/v1748089988/pin_1_2_sec0uq.webp,tile-cleaning-tips,,https://www.beacleaner.com/how-to-clean-mosaic-tiles?utm_source=pinterest&utm_campaign=sparkling-mosaic-til,2025-05-24,"Dreaming of a gleaming mosaic tile surface? Don't let grime and dirt dull its beauty! This guide reveals the secrets to cleaning mosaic tiles, from gentle daily upkeep to tackling stubborn stains. Learn the best cleaning solutions (you probably already have them!), tools, and techniques to restore your mosaic's vibrant colors.  Protect your investment and enjoy a stunning space. Click to learn how to keep your mosaic looking brand new for years to come!  We'll cover everything from glass to stone mosaics.","Mosaic Tile Cleaning, Tile Care, Grout Cleaning, Home Maintenance"
Mosaic Tile Cleaning: Easy Steps!,https://res.cloudinary.com/dbcpfy04c/image/upload/v1748089994/pin_1_3_m9aimw.webp,tile-cleaning-tips,,https://www.beacleaner.com/how-to-clean-mosaic-tiles?utm_source=pinterest&utm_campaign=mosaic-tile-cleaning,2025-05-24,"Is your mosaic tile looking tired and dull?  You don't need harsh chemicals or expensive cleaners! This post breaks down mosaic tile cleaning into simple, manageable steps. Discover how to identify your tile type (glass, ceramic, stone) and choose the right cleaning method.  We'll show you how to avoid damaging delicate tesserae and keep your grout looking fresh.  Say goodbye to grime and hello to a sparkling clean mosaic! Click to read now!","Cleaning Tips, Mosaic Restoration, Tile Maintenance, DIY Cleaning"
Grout Cleaning for Mosaic Tiles,https://res.cloudinary.com/dbcpfy04c/image/upload/v1748090001/pin_1_4_yoe3sc.webp,tile-cleaning-tips,,https://www.beacleaner.com/how-to-clean-mosaic-tiles?utm_source=pinterest&utm_campaign=grout-cleaning-for-m,2025-05-24,"Don't overlook the grout! Dirty grout can make even the most beautiful mosaic look neglected. This guide focuses specifically on cleaning mosaic tile grout, offering effective solutions for removing mildew, stains, and discoloration.  Learn how to prevent future buildup and keep your grout lines bright and clean.  A little effort goes a long way in preserving your mosaic's beauty. Click to learn more!","Grout Cleaner, Mosaic Grout, Tile Grout, Cleaning Hacks"
DIY Mosaic Tile Cleaner Recipes,https://res.cloudinary.com/dbcpfy04c/image/upload/v1748090007/pin_1_5_o034va.webp,cleaning-tips,,https://www.beacleaner.com/how-to-clean-mosaic-tiles?utm_source=pinterest&utm_campaign=diy-mosaic-tile-clea,2025-05-24,"Skip the store-bought cleaners! This post shares easy-to-make DIY mosaic tile cleaning recipes using ingredients you likely already have at home.  Save money and reduce harsh chemicals while still achieving a sparkling clean.  We'll cover solutions for different tile types and stain levels.  Feel good about cleaning your home with natural, effective ingredients. Click to discover the recipes!","DIY Cleaner, Natural Cleaning, Mosaic Tiles, Homemade Solutions"
Protect Your Mosaic: Cleaning Tips,https://res.cloudinary.com/dbcpfy04c/image/upload/v1748090015/pin_1_6_dn9xi7.webp,tile-care-tips,,https://www.beacleaner.com/how-to-clean-mosaic-tiles?utm_source=pinterest&utm_campaign=protect-your-mosaic-,2025-05-24,"Worried about damaging your beautiful mosaic tiles?  This guide provides essential do's and don'ts for mosaic tile cleaning.  Learn which cleaning agents to avoid, the best tools to use, and how to prevent scratches and discoloration.  Protect your investment and enjoy your mosaic for years to come.  Click to read the full guide and keep your mosaic safe!","Mosaic Protection, Tile Care, Cleaning Guide, Prevent Damage"
Glass Mosaic Tile Cleaning Guide,https://res.cloudinary.com/dbcpfy04c/image/upload/v1748090022/pin_1_7_blepci.webp,tile-cleaning-tips,,https://www.beacleaner.com/how-to-clean-mosaic-tiles?utm_source=pinterest&utm_campaign=glass-mosaic-tile-cl,2025-05-24,"Specifically for glass mosaic tiles!  Glass mosaics require gentle care to maintain their shine. This post details the best cleaning methods for glass mosaics, avoiding harsh abrasives that can scratch the surface.  Learn how to remove soap scum, water spots, and everyday grime.  Keep your glass mosaic sparkling and beautiful! Click to learn more.","Glass Mosaic, Tile Cleaning, Glass Tile, Cleaning Solutions"
Stone Mosaic Tile Cleaning Secrets,https://res.cloudinary.com/dbcpfy04c/image/upload/v1748090038/pin_1_8_iskp9a.webp,tile-cleaning-tips,,https://www.beacleaner.com/how-to-clean-mosaic-tiles?utm_source=pinterest&utm_campaign=stone-mosaic-tile-cl,2025-05-24,"Stone mosaics add a touch of luxury to any space. But they require special cleaning care! This guide reveals the secrets to cleaning stone mosaic tiles, protecting their natural beauty and preventing damage. Learn about pH-neutral cleaners and gentle scrubbing techniques.  Keep your stone mosaic looking its best! Click to read now.","Stone Mosaic, Natural Stone, Tile Care, Cleaning Tips"
Revive Dull Mosaic Tiles: A How-To,https://res.cloudinary.com/dbcpfy04c/image/upload/v1748090044/pin_1_9_zekom5.webp,tile-revival-tips,,https://www.beacleaner.com/how-to-clean-mosaic-tiles?utm_source=pinterest&utm_campaign=revive-dull-mosaic-t,2025-05-24,Is your mosaic tile looking faded and lifeless?  Don't replace it – revive it! This post shows you how to restore the vibrancy of dull mosaic tiles with the right cleaning techniques.  We'll cover deep cleaning methods and tips for bringing back the original color.  Give your mosaic a new lease on life! Click to learn how.,"Mosaic Restoration, Tile Revival, Deep Cleaning, Home Improvement"
Cleaning Mosaic Backsplashes: Easy!,https://res.cloudinary.com/dbcpfy04c/image/upload/v1748090051/pin_1_10_ccn8kz.webp,kitchen-cleaning-tips,,https://www.beacleaner.com/how-to-clean-mosaic-tiles?utm_source=pinterest&utm_campaign=cleaning-mosaic-back,2025-05-24,"Keep your kitchen or bathroom backsplash sparkling clean with these easy mosaic tile cleaning tips! This post focuses on the unique challenges of cleaning mosaic backsplashes, including grease, food splatters, and soap scum.  Learn how to maintain a hygienic and beautiful space. Click to read now!","Mosaic Backsplash, Kitchen Cleaning, Bathroom Cleaning, Tile Care"
Mosaic Tile Floor Cleaning Guide,https://res.cloudinary.com/dbcpfy04c/image/upload/v1748090057/pin_1_11_evvo7h.webp,floor-cleaning-tips,,https://www.beacleaner.com/how-to-clean-mosaic-tiles?utm_source=pinterest&utm_campaign=mosaic-tile-floor-cl,2025-05-24,"Keep your mosaic tile floors looking their best with this comprehensive cleaning guide!  We'll cover everything from daily sweeping to deep cleaning, including the best mops and cleaning solutions.  Protect your investment and enjoy beautiful floors for years to come. Click to learn more!","Mosaic Floor, Tile Floor, Floor Cleaning, Home Maintenance"
The Ultimate Mosaic Cleaning Checklist,https://res.cloudinary.com/dbcpfy04c/image/upload/v1748090064/pin_1_12_zn5nne.webp,cleaning-tips,,https://www.beacleaner.com/how-to-clean-mosaic-tiles?utm_source=pinterest&utm_campaign=the-ultimate-mosaic-,2025-05-24,"Don't miss a spot! This ultimate mosaic cleaning checklist ensures you cover every aspect of mosaic tile care. From grout to tile surface, we've got you covered.  Print it out and use it as a guide for a thorough and effective cleaning. Click to download the checklist!","Cleaning Checklist, Mosaic Care, Tile Maintenance, Home Organization"
Avoid These Mosaic Cleaning Mistakes!,https://res.cloudinary.com/dbcpfy04c/image/upload/v1748090071/pin_1_13_axczz8.webp,tile-care-tips,,https://www.beacleaner.com/how-to-clean-mosaic-tiles?utm_source=pinterest&utm_campaign=avoid-these-mosaic-c,2025-05-24,"Protect your investment! This post highlights common mosaic cleaning mistakes that can damage your tiles and grout. Learn what *not* to do to avoid scratches, discoloration, and other problems.  Clean smarter, not harder! Click to read now.","Cleaning Mistakes, Mosaic Protection, Tile Care, Avoid Damage"
Quick Mosaic Tile Cleaning Routine,https://res.cloudinary.com/dbcpfy04c/image/upload/v1748090078/pin_1_14_ltejnl.webp,tile-cleaning-tips,,https://www.beacleaner.com/how-to-clean-mosaic-tiles?utm_source=pinterest&utm_campaign=quick-mosaic-tile-cl,2025-05-24,Busy schedule? This quick mosaic tile cleaning routine will help you maintain a sparkling clean surface with minimal effort.  Learn how to incorporate simple cleaning tasks into your daily or weekly routine.  A little maintenance goes a long way! Click to learn more.,"Quick Cleaning, Routine Cleaning, Mosaic Maintenance, Time Saving"
Mosaic Tile Cleaning for Beginners,https://res.cloudinary.com/dbcpfy04c/image/upload/v1748090083/pin_1_15_lo4ojy.webp,tile-cleaning-tips,,https://www.beacleaner.com/how-to-clean-mosaic-tiles?utm_source=pinterest&utm_campaign=mosaic-tile-cleaning,2025-05-24,"New to mosaic tile cleaning? This guide is perfect for beginners! We'll walk you through the basics, from identifying your tile type to choosing the right cleaning solutions.  Don't be intimidated – cleaning mosaic tiles is easier than you think! Click to read now.","Beginner Cleaning, Mosaic Tiles, Tile Care, Easy Guide"
Stubborn Stain Removal on Mosaic Tiles,https://res.cloudinary.com/dbcpfy04c/image/upload/v1748090090/pin_1_16_edojww.webp,tile-cleaning-tips,,https://www.beacleaner.com/how-to-clean-mosaic-tiles?utm_source=pinterest&utm_campaign=stubborn-stain-remov,2025-05-24,"Got a tough stain on your mosaic tile? This post provides solutions for removing stubborn stains, including wine, coffee, grease, and mildew.  Learn how to tackle even the most challenging messes.  Restore your mosaic's beauty! Click to learn more.","Stain Removal, Mosaic Cleaning, Tile Cleaning, Cleaning Hacks"
Best Mops for Mosaic Tile Floors,https://res.cloudinary.com/dbcpfy04c/image/upload/v1748090097/pin_1_17_hhl44j.webp,floor-cleaning-tips,,https://www.beacleaner.com/how-to-clean-mosaic-tiles?utm_source=pinterest&utm_campaign=best-mops-for-mosaic,2025-05-24,"Choosing the right mop can make all the difference! This post reviews the best mops for cleaning mosaic tile floors, considering factors like tile type, grout lines, and ease of use.  Find the perfect mop for your needs! Click to read now.","Best Mops, Mosaic Floor, Tile Floor, Cleaning Tools"
Mosaic Tile Cleaning: Before & After,https://res.cloudinary.com/dbcpfy04c/image/upload/v1748090105/pin_1_18_ofgcwm.webp,tile-cleaning-tips,,https://www.beacleaner.com/how-to-clean-mosaic-tiles?utm_source=pinterest&utm_campaign=mosaic-tile-cleaning,2025-05-24,See the amazing results! This post features stunning before & after photos of mosaic tile cleaning transformations.  Get inspired and see how a little effort can make a big difference.  Click to view the transformations!,"Before and After, Mosaic Cleaning, Tile Restoration, Cleaning Results"
Gentle Cleaning for Delicate Mosaics,https://res.cloudinary.com/dbcpfy04c/image/upload/v1748090113/pin_1_19_hubcmu.webp,tile-cleaning-tips,,https://www.beacleaner.com/how-to-clean-mosaic-tiles?utm_source=pinterest&utm_campaign=gentle-cleaning-for-,2025-05-24,Worried about damaging antique or delicate mosaics? This post provides gentle cleaning methods for preserving these precious surfaces. Learn how to clean without causing harm. Click to learn more!,"Delicate Mosaics, Antique Tiles, Gentle Cleaning, Tile Preservation"
Cleaning Mosaic Tiles in Showers,https://res.cloudinary.com/dbcpfy04c/image/upload/v1748090119/pin_1_20_txd7gp.webp,kitchen-cleaning-tips,,https://www.beacleaner.com/how-to-clean-mosaic-tiles?utm_source=pinterest&utm_campaign=cleaning-mosaic-tile,2025-05-24,"Combat soap scum and mildew! This guide focuses on cleaning mosaic tiles in showers, offering effective solutions for maintaining a hygienic and beautiful space. Click to read now!","Shower Cleaning, Mosaic Tiles, Bathroom Cleaning, Mildew Removal"
Mosaic Tile Cleaning: FAQs Answered,https://res.cloudinary.com/dbcpfy04c/image/upload/v1748090125/pin_1_21_ohnkg5.webp,tile-cleaning-tips,,https://www.beacleaner.com/how-to-clean-mosaic-tiles?utm_source=pinterest&utm_campaign=mosaic-tile-cleaning,2025-05-24,"Got questions about mosaic tile cleaning? This post answers frequently asked questions, providing clear and concise answers to common concerns. Click to find your answers!","FAQ, Mosaic Cleaning, Tile Care, Cleaning Questions"
Extend the Life of Your Mosaic Tiles,https://res.cloudinary.com/dbcpfy04c/image/upload/v1748090132/pin_1_22_ztnpbu.webp,tile-care-tips,,https://www.beacleaner.com/how-to-clean-mosaic-tiles?utm_source=pinterest&utm_campaign=extend-the-life-of-y,2025-05-24,Want your mosaic to last a lifetime? This post shares tips for extending the life of your mosaic tiles through proper cleaning and maintenance. Click to learn more!,"Mosaic Longevity, Tile Maintenance, Tile Care, Home Improvement"
The Secret to Sparkling Mosaic Grout,https://res.cloudinary.com/dbcpfy04c/image/upload/v1748090139/pin_1_23_sryej2.webp,tile-cleaning-tips,,https://www.beacleaner.com/how-to-clean-mosaic-tiles?utm_source=pinterest&utm_campaign=the-secret-to-sparkl,2025-05-24,"Say goodbye to dingy grout! This post reveals the secret to sparkling clean mosaic grout, restoring its original brightness and enhancing the beauty of your tiles. Click to learn more!","Grout Cleaning, Mosaic Grout, Tile Grout, Cleaning Secrets"
Eco-Friendly Mosaic Tile Cleaning,https://res.cloudinary.com/dbcpfy04c/image/upload/v1748090146/pin_1_24_oisu0y.webp,tile-cleaning-tips,,https://www.beacleaner.com/how-to-clean-mosaic-tiles?utm_source=pinterest&utm_campaign=eco-friendly-mosaic-,2025-05-24,Clean green! This post shares eco-friendly mosaic tile cleaning solutions that are safe for your family and the environment. Click to learn more!,"Eco-Friendly Cleaning, Natural Cleaning, Mosaic Tiles, Green Cleaning"
Mosaic Tile Cleaning: A Step-by-Step Photo Guide,https://res.cloudinary.com/dbcpfy04c/image/upload/v1748090152/pin_1_25_qspbwi.webp,tile-cleaning-tips,,https://www.beacleaner.com/how-to-clean-mosaic-tiles?utm_source=pinterest&utm_campaign=mosaic-tile-cleaning,2025-05-24,"Visual learners rejoice! This post provides a step-by-step photo guide to mosaic tile cleaning, making it easy to follow along and achieve professional results. Click to view the guide!","Photo Guide, Mosaic Cleaning, Tile Care, Step-by-Step Instructions"
Title,https://res.cloudinary.com/dbcpfy04c/image/upload/v1748090198/pin_2_1_lwxant.webp,please-provide-the-title-and-keywords-i-need-that-information-to-suggest-a-board-name-once,,https://www.beacleaner.com/how-to-clean-msr-dromedary-bag?utm_source=pinterest&utm_campaign=title,2025-05-24,Description,Keywords
MSR Dromedary Cleaning: A Step-by-Step Guide,https://res.cloudinary.com/dbcpfy04c/image/upload/v1748090204/pin_2_2_rz47g4.webp,hydration-tips,,https://www.beacleaner.com/how-to-clean-msr-dromedary-bag?utm_source=pinterest&utm_campaign=msr-dromedary-cleani,2025-05-24,"Is your MSR Dromedary bag looking a little…lived in? Don't let grime ruin your adventures! This guide breaks down exactly how to clean your hydration pack, keeping it fresh and bacteria-free. We cover everything from daily rinses to deep cleans, ensuring safe & delicious water on every hike.  Protect your investment and your health – a clean Dromedary means peace of mind. Click to learn the simple steps and keep your water tasting great! Don't risk getting sick on the trail!","MSR Dromedary,Hydration Pack,Cleaning Guide,Water Safety"
Say Goodbye to Dromedary Bag Bacteria!,https://res.cloudinary.com/dbcpfy04c/image/upload/v1748090211/pin_2_3_wkvjsw.webp,backpacking-tips,,https://www.beacleaner.com/how-to-clean-msr-dromedary-bag?utm_source=pinterest&utm_campaign=say-goodbye-to-drome,2025-05-24,"Worried about what's growing inside your MSR Dromedary? You should be! This post details how to eliminate bacteria and prevent funky tastes. We'll show you the best cleaning solutions and techniques for a truly hygienic hydration experience.  Imagine enjoying crisp, clean water on your next backpacking trip – it's easier than you think!  Click to learn how to keep your Dromedary sparkling clean and your adventures worry-free.","Backpacking,Water Filter,Hydration,Cleaning Tips"
Extend Your Dromedary's Life: Cleaning Secrets,https://res.cloudinary.com/dbcpfy04c/image/upload/v1748090218/pin_2_4_s3hpmn.webp,camel-care-tips,,https://www.beacleaner.com/how-to-clean-msr-dromedary-bag?utm_source=pinterest&utm_campaign=extend-your-dromedar,2025-05-24,"Your MSR Dromedary bag is an investment. Learn how to properly clean and maintain it to ensure it lasts for years of adventures! This guide covers everything from preventing mold to addressing stubborn stains.  Don't replace it, restore it!  We'll show you how to keep your Dromedary in top condition, saving you money and reducing waste. Click to discover the secrets to a long-lasting hydration pack!","Dromedary Care,Hydration Reservoir,Maintenance,Backpacking Gear"
Quick Dromedary Rinse: Daily Hydration Hygiene,https://res.cloudinary.com/dbcpfy04c/image/upload/v1748090225/pin_2_5_sueqtv.webp,horse-care-tips,,https://www.beacleaner.com/how-to-clean-msr-dromedary-bag?utm_source=pinterest&utm_campaign=quick-dromedary-rins,2025-05-24,Don't wait for a deep clean! This pin highlights the importance of a quick daily rinse for your MSR Dromedary bag.  It's a simple habit that makes a HUGE difference in preventing buildup and keeping your water tasting fresh.  A few seconds each day can save you hours of scrubbing later. Click to learn the easy rinse routine and enjoy consistently clean water!,"Daily Cleaning,Hydration,Water Quality,Quick Tips"
Deep Clean Your Dromedary: The Ultimate Guide,https://res.cloudinary.com/dbcpfy04c/image/upload/v1748090232/pin_2_6_buynjw.webp,backpacking-tips,,https://www.beacleaner.com/how-to-clean-msr-dromedary-bag?utm_source=pinterest&utm_campaign=deep-clean-your-drom,2025-05-24,"Time for a thorough cleaning? This pin leads to a comprehensive guide on deep cleaning your MSR Dromedary bag. We cover everything from soaking to scrubbing, ensuring every nook and cranny is spotless.  Don't let hidden grime ruin your next adventure!  Click to learn the ultimate deep cleaning method and enjoy the purest water possible.","Deep Cleaning,MSR,Hydration Pack,Backpacking Essentials"
Dromedary Cleaning: Prevent Mold & Mildew,https://res.cloudinary.com/dbcpfy04c/image/upload/v1748090239/pin_2_7_ovvplq.webp,cleaning-tips,,https://www.beacleaner.com/how-to-clean-msr-dromedary-bag?utm_source=pinterest&utm_campaign=dromedary-cleaning-p,2025-05-24,"Mold and mildew in your hydration pack? No thanks! This pin focuses on preventing these nasty growths in your MSR Dromedary bag.  We share tips on drying, storage, and regular cleaning to keep your pack fresh and safe.  Protect your health and enjoy worry-free hydration. Click to learn how to banish mold for good!","Mold Prevention,Hydration,Water Safety,Cleaning Hacks"
Stinky Dromedary? Fix It With This Guide!,https://res.cloudinary.com/dbcpfy04c/image/upload/v1748090246/pin_2_8_i8syho.webp,hydration-tips,,https://www.beacleaner.com/how-to-clean-msr-dromedary-bag?utm_source=pinterest&utm_campaign=stinky-dromedary-fix,2025-05-24,"Is your MSR Dromedary bag emitting unpleasant odors? Don't suffer through funky-tasting water! This guide provides solutions for eliminating stubborn smells and restoring your pack to its former glory.  Enjoy fresh, clean water on every adventure. Click to learn how to say goodbye to the stink!","Odor Removal,Hydration Pack,Cleaning Solutions,Water Taste"
MSR Dromedary Cleaning: What NOT to Do,https://res.cloudinary.com/dbcpfy04c/image/upload/v1748090251/pin_2_9_w3dvmx.webp,hydration-tips,,https://www.beacleaner.com/how-to-clean-msr-dromedary-bag?utm_source=pinterest&utm_campaign=msr-dromedary-cleani,2025-05-24,Avoid these common mistakes when cleaning your MSR Dromedary bag! This pin highlights what *not* to do to prevent damage and ensure a thorough clean.  Protect your investment and keep your hydration pack in top condition. Click to learn the dos and don'ts of Dromedary cleaning!,"Cleaning Mistakes,MSR,Hydration,Pack Care"
The Best Cleaning Solutions for Your Dromedary,https://res.cloudinary.com/dbcpfy04c/image/upload/v1748090259/pin_2_10_jebbyx.webp,hydration-tips,,https://www.beacleaner.com/how-to-clean-msr-dromedary-bag?utm_source=pinterest&utm_campaign=the-best-cleaning-so,2025-05-24,"Wondering what cleaning solutions are safe for your MSR Dromedary bag? This pin reveals the best options for effective and gentle cleaning.  We'll help you choose the right solution for your needs, ensuring a safe and hygienic hydration experience. Click to discover the perfect cleaning solution!","Cleaning Solutions,MSR Dromedary,Hydration,Water Safety"
Dromedary Cleaning: A Visual Step-by-Step,https://res.cloudinary.com/dbcpfy04c/image/upload/v1748090265/pin_2_11_zxcyts.webp,cleaning-tips,,https://www.beacleaner.com/how-to-clean-msr-dromedary-bag?utm_source=pinterest&utm_campaign=dromedary-cleaning-a,2025-05-24,"Need a visual guide? This pin links to a post with clear, step-by-step photos showing you exactly how to clean your MSR Dromedary bag.  No more guesswork!  Follow along and enjoy a sparkling clean hydration pack. Click to see the visual guide!","Step-by-Step,Cleaning Guide,MSR,Visual Tutorial"
Backpacking Hydration: Keep Your Dromedary Clean,https://res.cloudinary.com/dbcpfy04c/image/upload/v1748090272/pin_2_12_xpcel2.webp,backpacking-tips,,https://www.beacleaner.com/how-to-clean-msr-dromedary-bag?utm_source=pinterest&utm_campaign=backpacking-hydratio,2025-05-24,Backpacking demands clean water! This pin emphasizes the importance of a clean MSR Dromedary bag for safe and enjoyable hydration on the trail.  Don't risk getting sick – prioritize hygiene. Click to learn how to keep your Dromedary clean on your next adventure!,"Backpacking,Hydration,Water Safety,Trail Tips"
Dromedary Cleaning: Drying Tips for Success,https://res.cloudinary.com/dbcpfy04c/image/upload/v1748090278/pin_2_13_hdhfdt.webp,cleaning-tips,,https://www.beacleaner.com/how-to-clean-msr-dromedary-bag?utm_source=pinterest&utm_campaign=dromedary-cleaning-d,2025-05-24,Proper drying is crucial! This pin focuses on the best techniques for drying your MSR Dromedary bag to prevent mold and mildew.  We'll show you how to ensure your pack is completely dry before storage. Click to learn the drying secrets!,"Drying Tips,MSR,Hydration,Mold Prevention"
MSR Dromedary: Cleaning for Long-Term Use,https://res.cloudinary.com/dbcpfy04c/image/upload/v1748090285/pin_2_14_lauivo.webp,gear-maintenance-tips,,https://www.beacleaner.com/how-to-clean-msr-dromedary-bag?utm_source=pinterest&utm_campaign=msr-dromedary-cleani,2025-05-24,Want your Dromedary to last? This pin highlights the importance of regular cleaning for extending the life of your MSR Dromedary bag.  Protect your investment and enjoy years of reliable hydration. Click to learn how to make your Dromedary last!,"Long-Term Care,MSR,Hydration,Gear Maintenance"
Easy Dromedary Cleaning: 5-Minute Routine,https://res.cloudinary.com/dbcpfy04c/image/upload/v1748090291/pin_2_15_gcawui.webp,hydration-tips,,https://www.beacleaner.com/how-to-clean-msr-dromedary-bag?utm_source=pinterest&utm_campaign=easy-dromedary-clean,2025-05-24,Short on time? This pin showcases a quick and easy 5-minute cleaning routine for your MSR Dromedary bag.  Perfect for after every hike! Click to learn the speedy cleaning method!,"Quick Clean,MSR,Hydration,Time Saving"
Dromedary Cleaning: Tackle Stubborn Stains,https://res.cloudinary.com/dbcpfy04c/image/upload/v1748090297/pin_2_16_gs7uxi.webp,cleaning-tips,,https://www.beacleaner.com/how-to-clean-msr-dromedary-bag?utm_source=pinterest&utm_campaign=dromedary-cleaning-t,2025-05-24,Got stubborn stains in your MSR Dromedary? This pin provides solutions for removing tough stains and restoring your pack to its original condition.  Don't let stains ruin your hydration experience. Click to learn how to tackle those stains!,"Stain Removal,MSR,Hydration,Cleaning Hacks"
Hydration Pack Hygiene: Dromedary Cleaning Guide,https://res.cloudinary.com/dbcpfy04c/image/upload/v1748090305/pin_2_17_wnhk0f.webp,outdoor-tips,,https://www.beacleaner.com/how-to-clean-msr-dromedary-bag?utm_source=pinterest&utm_campaign=hydration-pack-hygie,2025-05-24,Prioritize your health! This pin emphasizes the importance of hydration pack hygiene and links to a comprehensive guide on cleaning your MSR Dromedary bag.  Enjoy safe and delicious water on every adventure. Click to learn about hydration pack hygiene!,"Hydration Hygiene,MSR,Water Safety,Health"
MSR Dromedary Cleaning: Before & After Results,https://res.cloudinary.com/dbcpfy04c/image/upload/v1748090313/pin_2_18_npz73x.webp,hydration-tips,,https://www.beacleaner.com/how-to-clean-msr-dromedary-bag?utm_source=pinterest&utm_campaign=msr-dromedary-cleani,2025-05-24,See the difference! This pin features before-and-after photos showcasing the amazing results of cleaning your MSR Dromedary bag.  Get inspired to tackle your own cleaning project! Click to see the transformation!,"Before & After,MSR,Hydration,Cleaning Results"
