Title,Media URL,Pinterest board,Thumbnail,Link,Publish date,Description,Keywords
Prevent Sliding Door Dirt Build-Up,https://res.cloudinary.com/dbcpfy04c/image/upload/v1748402871/pin_5_10_xtfpye.webp,home-cleaning-tips,,https://www.beacleaner.com/how-to-clean-in-between-sliding-glass-doors?utm_source=pinterest&utm_campaign=prevent-sliding-door,2025-05-28,“Stop dirt from accumulating in the first place! This post shares preventative measures you can take to keep your sliding glass doors clean and sparkling.  Simple habits can save you time and effort in the long run. Click to learn how to maintain clean doors! #PreventativeCleaning #SlidingDoorMaintenance #CleanHomeTips #HomeCare”,"preventative cleaning,sliding door maintenance,clean home tips,home care"
Sliding Door Cleaning for Allergies,https://res.cloudinary.com/dbcpfy04c/image/upload/v1748402878/pin_5_11_jry5mg.webp,allergy-tips,,https://www.beacleaner.com/how-to-clean-in-between-sliding-glass-doors?utm_source=pinterest&utm_campaign=sliding-door-cleanin,2025-05-28,“Suffering from allergies? Dirty sliding glass doors can harbor dust and pollen,exacerbating your symptoms. This post shows you how to deep clean your doors and improve your indoor air quality. Breathe easier with a cleaner home! Click to learn more! #AllergyCleaning #IndoorAirQuality #SlidingDoors #HealthyHome”
Deep Clean Sliding Door Screens,https://res.cloudinary.com/dbcpfy04c/image/upload/v1748402885/pin_5_12_uicmec.webp,cleaning-tips,,https://www.beacleaner.com/how-to-clean-in-between-sliding-glass-doors?utm_source=pinterest&utm_campaign=deep-clean-sliding-d,2025-05-28,“Don't forget the screens! This post provides a step-by-step guide to cleaning your sliding glass door screens,removing dirt
Sliding Door Cleaning Checklist,https://res.cloudinary.com/dbcpfy04c/image/upload/v1748402891/pin_5_13_xftaz4.webp,allergy-tips,,https://www.beacleaner.com/how-to-clean-in-between-sliding-glass-doors?utm_source=pinterest&utm_campaign=sliding-door-cleanin,2025-05-28,“Stay on top of your cleaning routine with our handy sliding door cleaning checklist! This printable checklist will help you remember all the important steps,ensuring a consistently clean and sparkling result. Click to download the checklist! #CleaningChecklist #SlidingDoorCleaning #HomeOrganization #CleaningRoutine”
Remove Hard Water Stains from Glass,https://res.cloudinary.com/dbcpfy04c/image/upload/v1748402898/pin_5_14_g4drkr.webp,cleaning-tips,,https://www.beacleaner.com/how-to-clean-in-between-sliding-glass-doors?utm_source=pinterest&utm_campaign=remove-hard-water-st,2025-05-28,“Ugly hard water stains ruining your view? This post reveals effective methods for removing those stubborn marks from your sliding glass doors. Restore clarity and enjoy a spotless finish. Click to learn the secrets! #HardWaterStains #GlassCleaning #SlidingDoors #CleaningSolutions”,"hard water stains,glass cleaning,sliding doors,cleaning solutions"
Cleaning Sliding Doors with Vinegar,https://res.cloudinary.com/dbcpfy04c/image/upload/v1748402904/pin_5_15_vthrgd.webp,cleaning-tips,,https://www.beacleaner.com/how-to-clean-in-between-sliding-glass-doors?utm_source=pinterest&utm_campaign=cleaning-sliding-doo,2025-05-28,“Vinegar is a cleaning powerhouse! This post shows you how to use vinegar to effectively clean your sliding glass doors,removing grime and leaving them sparkling. It's a natural
Sliding Door Cleaning: Pet Owners,https://res.cloudinary.com/dbcpfy04c/image/upload/v1748402910/pin_5_16_bp8vgs.webp,allergy-tips,,https://www.beacleaner.com/how-to-clean-in-between-sliding-glass-doors?utm_source=pinterest&utm_campaign=sliding-door-cleanin,2025-05-28,“Pet hair and paw prints on your sliding glass doors? We get it! This post offers specific tips for cleaning sliding doors when you have furry friends. Keep your home clean and pet-friendly. Click for pet-owner specific advice! #PetCleaning #SlidingDoors #PetFriendlyHome #HomeCleaning”,"pet cleaning,sliding doors,pet-friendly home,home cleaning"
Sliding Door Track Vacuuming Tips,https://res.cloudinary.com/dbcpfy04c/image/upload/v1748402917/pin_5_17_sgdxux.webp,cleaning-tips,,https://www.beacleaner.com/how-to-clean-in-between-sliding-glass-doors?utm_source=pinterest&utm_campaign=sliding-door-track-v,2025-05-28,“Vacuuming the tracks is crucial! This post shares the best techniques and attachments for effectively vacuuming the dirt and debris from your sliding glass door tracks. A clean vacuum is key! Click to learn the best methods! #VacuumingTips #SlidingDoorTracks #CleaningHacks #HomeCleaning”,"vacuuming tips,sliding door tracks,cleaning hacks,home cleaning"
Protect Your Sliding Door Rollers,https://res.cloudinary.com/dbcpfy04c/image/upload/v1748402924/pin_5_18_fmkzqd.webp,home-repair-tips,,https://www.beacleaner.com/how-to-clean-in-between-sliding-glass-doors?utm_source=pinterest&utm_campaign=protect-your-sliding,2025-05-28,“Smooth gliding doors depend on healthy rollers! This post explains how to clean and lubricate your sliding door rollers,ensuring smooth operation and preventing damage. Extend the life of your doors! Click to learn more! #SlidingDoorRollers #HomeMaintenance #DIYRepair #SlidingDoors”
Sliding Door Cleaning Mistakes to Avoid,https://res.cloudinary.com/dbcpfy04c/image/upload/v1748402931/pin_5_19_pnpx3e.webp,allergy-tips,,https://www.beacleaner.com/how-to-clean-in-between-sliding-glass-doors?utm_source=pinterest&utm_campaign=sliding-door-cleanin,2025-05-28,“Don't make these common cleaning mistakes! This post highlights the errors people often make when cleaning their sliding glass doors and how to avoid them. Save time,effort
Sliding Door Cleaning for Renters,https://res.cloudinary.com/dbcpfy04c/image/upload/v1748402936/pin_5_20_mgmfgy.webp,allergy-tips,,https://www.beacleaner.com/how-to-clean-in-between-sliding-glass-doors?utm_source=pinterest&utm_campaign=sliding-door-cleanin,2025-05-28,“Renting? No problem! This post provides tips for cleaning your sliding glass doors without damaging them or violating your lease agreement. Keep your security deposit safe! Click for renter-friendly cleaning advice! #RenterCleaning #SlidingDoors #ApartmentCleaning #CleaningTips”,"renter cleaning,sliding doors,apartment cleaning,cleaning tips"
The Easiest Way to Clean Sliding Doors,https://res.cloudinary.com/dbcpfy04c/image/upload/v1748402943/pin_5_21_ycwmrm.webp,cleaning-tips,,https://www.beacleaner.com/how-to-clean-in-between-sliding-glass-doors?utm_source=pinterest&utm_campaign=the-easiest-way-to-c,2025-05-28,“Looking for the *simplest* way to clean your sliding glass doors? This post reveals a quick and easy method that requires minimal effort and supplies. Get sparkling results fast! Click to discover the easy method! #EasyCleaning #SlidingDoors #QuickClean #HomeCleaning”,"easy cleaning,sliding doors,quick clean,home cleaning"
Sliding Door Cleaning: Seasonal Guide,https://res.cloudinary.com/dbcpfy04c/image/upload/v1748402951/pin_5_22_kne6nd.webp,allergy-tips,,https://www.beacleaner.com/how-to-clean-in-between-sliding-glass-doors?utm_source=pinterest&utm_campaign=sliding-door-cleanin,2025-05-28,“Keep your sliding doors clean year-round! This post provides a seasonal cleaning guide,outlining the best cleaning tasks for each time of year. Stay ahead of the grime! Click to view the seasonal guide! #SeasonalCleaning #SlidingDoors #HomeMaintenance #CleaningSchedule”
Restore Shine to Sliding Glass Doors,https://res.cloudinary.com/dbcpfy04c/image/upload/v1748402958/pin_5_23_amcavq.webp,home-improvement-tips,,https://www.beacleaner.com/how-to-clean-in-between-sliding-glass-doors?utm_source=pinterest&utm_campaign=restore-shine-to-sli,2025-05-28,“Is the glass on your sliding doors looking dull and cloudy? This post shares tips for restoring shine and clarity,making your doors look like new. Enjoy a brighter
Sliding Door Cleaning: A Room-by-Room Guide,https://res.cloudinary.com/dbcpfy04c/image/upload/v1748402966/pin_5_24_foyksu.webp,allergy-tips,,https://www.beacleaner.com/how-to-clean-in-between-sliding-glass-doors?utm_source=pinterest&utm_campaign=sliding-door-cleanin,2025-05-28,“From the living room to the patio,this post provides tailored cleaning tips for sliding doors in different rooms of your home. Address specific cleaning challenges in each space. Click for room-specific advice! #RoomByRoomCleaning #SlidingDoors #HomeCleaning #CleaningTips”
Sliding Door Cleaning: Save Time & Money,https://res.cloudinary.com/dbcpfy04c/image/upload/v1748402972/pin_5_25_o47i4h.webp,allergy-tips,,https://www.beacleaner.com/how-to-clean-in-between-sliding-glass-doors?utm_source=pinterest&utm_campaign=sliding-door-cleanin,2025-05-28,“Cleaning doesn't have to be expensive or time-consuming! This post shares budget-friendly cleaning solutions and time-saving techniques for your sliding glass doors. Click to learn how to clean smarter,not harder! #BudgetCleaning #TimeSavingTips #SlidingDoors #HomeCleaning”
