Title,Media URL,Pinterest board,Thumbnail,Link,Publish date,Description,Keywords
Title,https://res.cloudinary.com/dbcpfy04c/image/upload/v1748017333/pin_1_1_lgeeko.webp,please-provide-the-title-and-keywords-i-need-that-information-to-suggest-a-board-name-once,,https://www.beacleaner.com/how-to-clean-garage-door-windows?utm_source=pinterest&utm_campaign=title,2025-05-23,Description,Keywords
Sparkling Garage Door Windows!,https://res.cloudinary.com/dbcpfy04c/image/upload/v1748017339/pin_1_2_fxs5cx.webp,home-maintenance-tips,,https://www.beacleaner.com/how-to-clean-garage-door-windows?utm_source=pinterest&utm_campaign=sparkling-garage-doo,2025-05-23,Tired of looking through grimy garage door windows? This easy guide shows you how to get them crystal clear! We break down the process step-by-step,from gathering supplies to choosing the right cleaning solutions. Don't let dirty windows block your sunshine and curb appeal! A clean garage door boosts your home's value and makes your life brighter. Click to learn how to achieve streak-free results and enjoy a clearer view. It's easier than you think! #GarageDoorCleaning #WindowCleaning #HomeMaintenance #CurbAppeal
Garage Door Window Cleaning Guide,https://res.cloudinary.com/dbcpfy04c/image/upload/v1748017346/pin_1_3_mj2jxo.webp,home-cleaning-tips,,https://www.beacleaner.com/how-to-clean-garage-door-windows?utm_source=pinterest&utm_campaign=garage-door-window-c,2025-05-23,Is your garage door looking dull and dirty? Don't forget the windows! They often get overlooked,but cleaning them makes a HUGE difference. This post reveals the best techniques for removing grime
Streak-Free Garage Windows: How To,https://res.cloudinary.com/dbcpfy04c/image/upload/v1748017352/pin_1_4_za1xe4.webp,cleaning-tips-ideas,,https://www.beacleaner.com/how-to-clean-garage-door-windows?utm_source=pinterest&utm_campaign=streak-free-garage-w,2025-05-23,Say goodbye to streaks and hello to sparkling garage door windows! This guide provides a simple,effective method for achieving professional-looking results. We cover everything from the best cleaning tools to the proper washing technique. Don't spend hours scrubbing – learn the secrets to a quick and easy clean. A little effort goes a long way in enhancing your home's appearance. Click to learn more! #GarageWindowCleaning #CleaningTips #HomeHacks #SparklingClean
Quick Garage Window Cleaning Tips,https://res.cloudinary.com/dbcpfy04c/image/upload/v1748017359/pin_1_5_kjkkih.webp,home-cleaning-tips,,https://www.beacleaner.com/how-to-clean-garage-door-windows?utm_source=pinterest&utm_campaign=quick-garage-window-,2025-05-23,Short on time? No problem! These quick and easy garage door window cleaning tips will help you achieve a sparkling clean in minutes. We focus on efficiency and effectiveness,so you can get back to enjoying your day. Don't let a dirty garage door detract from your home's beauty. Click to learn the fastest way to clean your windows! #QuickClean #EasyCleaning #GarageGoals #TimeSavingTips
The Best Cleaning Solution for Garage Windows,https://res.cloudinary.com/dbcpfy04c/image/upload/v1748017366/pin_1_6_tncajo.webp,cleaning-tips,,https://www.beacleaner.com/how-to-clean-garage-door-windows?utm_source=pinterest&utm_campaign=the-best-cleaning-so,2025-05-23,Wondering what cleaning solution works best for garage door windows? We've tested them all! This post reveals our top recommendations for removing dirt,grime
Protect Your Garage Door Windows,https://res.cloudinary.com/dbcpfy04c/image/upload/v1748017372/pin_1_7_tvmduo.webp,garage-improvements-ideas,,https://www.beacleaner.com/how-to-clean-garage-door-windows?utm_source=pinterest&utm_campaign=protect-your-garage-,2025-05-23,Cleaning isn't just about aesthetics – it's about protecting your investment! This post explains how regular cleaning can prevent damage and extend the life of your garage door windows. Learn how to avoid scratches,fading
Garage Window Cleaning Checklist,https://res.cloudinary.com/dbcpfy04c/image/upload/v1748017379/pin_1_8_ceavah.webp,cleaning-tips,,https://www.beacleaner.com/how-to-clean-garage-door-windows?utm_source=pinterest&utm_campaign=garage-window-cleani,2025-05-23,Don't miss a step! This handy checklist will guide you through the entire garage door window cleaning process,ensuring a thorough and effective clean. From gathering supplies to final inspection
Cleaning Garage Windows: A Step-by-Step Guide,https://res.cloudinary.com/dbcpfy04c/image/upload/v1748017385/pin_1_9_davlxn.webp,cleaning-tips,,https://www.beacleaner.com/how-to-clean-garage-door-windows?utm_source=pinterest&utm_campaign=cleaning-garage-wind,2025-05-23,Confused about where to start? This step-by-step guide makes cleaning garage door windows a breeze. We break down the process into easy-to-follow instructions,with clear photos and helpful tips. No experience necessary! Click to learn how to achieve a sparkling clean
Garage Door Window Cleaning for Curb Appeal,https://res.cloudinary.com/dbcpfy04c/image/upload/v1748017391/pin_1_10_vqb7zk.webp,home-cleaning-tips,,https://www.beacleaner.com/how-to-clean-garage-door-windows?utm_source=pinterest&utm_campaign=garage-door-window-c,2025-05-23,Boost your home's curb appeal with sparkling clean garage door windows! First impressions matter,and clean windows make a HUGE difference. This post explains how to enhance your home's exterior with a simple cleaning project. Don't underestimate the power of a clean garage. Click to learn more! #CurbAppealBoost #HomeExterior #GarageStyle #FirstImpressions
Cleaning Garage Windows in the Fall,https://res.cloudinary.com/dbcpfy04c/image/upload/v1748017399/pin_1_11_fluhlq.webp,cleaning-tips,,https://www.beacleaner.com/how-to-clean-garage-door-windows?utm_source=pinterest&utm_campaign=cleaning-garage-wind,2025-05-23,Fall is the perfect time to tackle outdoor cleaning projects! This post focuses on cleaning garage door windows to prepare your home for the colder months. Remove leaves,dirt
Garage Window Cleaning: Tools You Need,https://res.cloudinary.com/dbcpfy04c/image/upload/v1748017406/pin_1_12_ob63zw.webp,cleaning-tips,,https://www.beacleaner.com/how-to-clean-garage-door-windows?utm_source=pinterest&utm_campaign=garage-window-cleani,2025-05-23,Having the right tools makes all the difference! This post lists the essential tools you'll need to clean garage door windows effectively. From squeegees to microfiber cloths,we've got you covered. Simplify your cleaning routine and achieve professional-looking results. Click to see the list! #CleaningTools #GarageEssentials #HomeSupplies #CleaningEquipment
How Often Should You Clean Garage Windows?,https://res.cloudinary.com/dbcpfy04c/image/upload/v1748017413/pin_1_13_njsn8g.webp,home-cleaning-tips,,https://www.beacleaner.com/how-to-clean-garage-door-windows?utm_source=pinterest&utm_campaign=how-often-should-you,2025-05-23,Wondering how often to clean your garage door windows? This post provides a recommended cleaning schedule to keep them looking their best. We'll consider factors like location,weather
Easy Garage Window Cleaning for Seniors,https://res.cloudinary.com/dbcpfy04c/image/upload/v1748017419/pin_1_14_m5u0q6.webp,senior-cleaning-tips,,https://www.beacleaner.com/how-to-clean-garage-door-windows?utm_source=pinterest&utm_campaign=easy-garage-window-c,2025-05-23,Cleaning can be challenging as we age. This post provides easy and accessible garage door window cleaning tips for seniors. We'll focus on safety and simplicity,making the task manageable and enjoyable. Maintain a clean home without straining yourself. Click to learn more! #SeniorCleaning #AccessibleCleaning #EasyHomeCare #AgingInPlace
Garage Door Window Cleaning: Avoid These Mistakes,https://res.cloudinary.com/dbcpfy04c/image/upload/v1748017425/pin_1_15_vp9qk6.webp,home-cleaning-tips,,https://www.beacleaner.com/how-to-clean-garage-door-windows?utm_source=pinterest&utm_campaign=garage-door-window-c,2025-05-23,Don't make these common mistakes when cleaning garage door windows! This post highlights potential pitfalls to avoid,ensuring a safe and effective clean. Learn from our experience and achieve professional-looking results. Click to learn more! #CleaningMistakes #AvoidTheseErrors #GarageTips #HomeCleaningErrors
Transform Your Garage with Clean Windows,https://res.cloudinary.com/dbcpfy04c/image/upload/v1748017437/pin_1_16_kkncvz.webp,garage-inspiration,,https://www.beacleaner.com/how-to-clean-garage-door-windows?utm_source=pinterest&utm_campaign=transform-your-garag,2025-05-23,Imagine a brighter,more inviting garage! This post emphasizes the transformative power of clean garage door windows. A simple cleaning project can make a HUGE difference in your home's overall appearance. Click to get inspired and start cleaning today! #GarageTransformation #HomeImprovementIdeas #CleanHome #GarageGoals
Title,https://res.cloudinary.com/dbcpfy04c/image/upload/v1748017481/pin_2_1_s1ggpm.webp,please-provide-the-title-and-keywords-i-need-that-information-to-suggest-a-board-name-once,,https://www.beacleaner.com/how-to-clean-glass-tile-in-a-pool?utm_source=pinterest&utm_campaign=title,2025-05-23,Description,Keywords
Sparkling Pool Tile: Your Guide!,https://res.cloudinary.com/dbcpfy04c/image/upload/v1748017487/pin_2_2_le0fnp.webp,pool-ideas,,https://www.beacleaner.com/how-to-clean-glass-tile-in-a-pool?utm_source=pinterest&utm_campaign=sparkling-pool-tile-,2025-05-23,Is your pool tile looking dull and grimy? Don't let algae & calcium buildup ruin your summer fun! This guide reveals the *easy* steps to restore your glass tile to its original brilliance. Learn the best cleaners,tools
Pool Tile Cleaning Secrets REVEALED,https://res.cloudinary.com/dbcpfy04c/image/upload/v1748017494/pin_2_3_gp33rj.webp,pool-cleaning-tips,,https://www.beacleaner.com/how-to-clean-glass-tile-in-a-pool?utm_source=pinterest&utm_campaign=pool-tile-cleaning-s,2025-05-23,Dreaming of a dazzling pool but battling stubborn stains on your glass tile? We've got you covered! This post breaks down everything you need to know about cleaning glass tile in your pool,from identifying the type of buildup to choosing the right cleaning solution.  Avoid costly repairs and keep your pool looking its best with our expert tips.  A clean pool is a happy pool! Learn more now. #PoolCleaningTips #GlassPoolTile #PoolCare #DIYPoolCleaning
Goodbye Pool Stains! Easy Steps,https://res.cloudinary.com/dbcpfy04c/image/upload/v1748017503/pin_2_4_pcjxzx.webp,pool-cleaning-tips,,https://www.beacleaner.com/how-to-clean-glass-tile-in-a-pool?utm_source=pinterest&utm_campaign=goodbye-pool-stains-,2025-05-23,Ugh,pool stains are the worst! But don't despair. This guide provides a simple
Glass Tile: Preventative Pool Care,https://res.cloudinary.com/dbcpfy04c/image/upload/v1748017511/pin_2_5_a5qikz.webp,pool-care-tips,,https://www.beacleaner.com/how-to-clean-glass-tile-in-a-pool?utm_source=pinterest&utm_campaign=glass-tile-preventat,2025-05-23,Don't wait for stains to appear! This guide focuses on *preventative* pool tile care,helping you maintain a sparkling clean surface with minimal effort. Learn simple habits and regular maintenance tasks that will save you time and money in the long run.  A little prevention goes a long way! Click to learn how to protect your pool's beauty. #PoolPrevention #TileMaintenance #PoolRoutine #CleanLiving
DIY Pool Tile Cleaning: Save Money!,https://res.cloudinary.com/dbcpfy04c/image/upload/v1748017518/pin_2_6_wu0wrb.webp,pool-cleaning-tips,,https://www.beacleaner.com/how-to-clean-glass-tile-in-a-pool?utm_source=pinterest&utm_campaign=diy-pool-tile-cleani,2025-05-23,Skip the expensive pool service! This post empowers you to clean your glass tile yourself,saving you money and giving you the satisfaction of a job well done. We provide clear instructions and affordable solutions.  Take control of your pool's cleanliness and enjoy a beautiful
The Ultimate Glass Tile Guide,https://res.cloudinary.com/dbcpfy04c/image/upload/v1748017526/pin_2_7_aqdqoz.webp,tile-ideas,,https://www.beacleaner.com/how-to-clean-glass-tile-in-a-pool?utm_source=pinterest&utm_campaign=the-ultimate-glass-t,2025-05-23,Everything you need to know about cleaning and maintaining glass tile in your pool is right here! This post is a one-stop resource for all your pool tile questions.  We cover different types of tile,common problems
Calcium Buildup? We Have Solutions!,https://res.cloudinary.com/dbcpfy04c/image/upload/v1748017535/pin_2_8_x7021y.webp,pool-cleaning-tips,,https://www.beacleaner.com/how-to-clean-glass-tile-in-a-pool?utm_source=pinterest&utm_campaign=calcium-buildup-we-h,2025-05-23,Calcium buildup on your pool tile is a common problem,but it doesn't have to be a permanent one! This post provides effective solutions for removing calcium deposits and restoring your tile's shine.  We'll show you how to tackle this issue without damaging your pool. Click to learn how to say goodbye to calcium! #CalciumBuildup #PoolProblems #TileSolutions #PoolFix
Algae on Pool Tile? Get Rid of It!,https://res.cloudinary.com/dbcpfy04c/image/upload/v1748017541/pin_2_9_snhdnr.webp,pool-cleaning-tips,,https://www.beacleaner.com/how-to-clean-glass-tile-in-a-pool?utm_source=pinterest&utm_campaign=algae-on-pool-tile-g,2025-05-23,Don't let algae ruin your pool experience! This post details how to effectively remove algae from your glass tile and prevent it from returning.  We'll cover different types of algae and the best cleaning methods for each.  Enjoy a clean,healthy pool all season long. Click to learn how! #AlgaeRemoval #PoolHealth #CleanPoolWater #GlassTileAlgae
Glass Tile Cleaning: Step-by-Step,https://res.cloudinary.com/dbcpfy04c/image/upload/v1748017550/pin_2_10_jivaq7.webp,cleaning-tips,,https://www.beacleaner.com/how-to-clean-glass-tile-in-a-pool?utm_source=pinterest&utm_campaign=glass-tile-cleaning-,2025-05-23,Need a clear,concise guide to cleaning your glass tile? Look no further! This post provides a step-by-step process that anyone can follow.  We'll walk you through each stage
The Right Tools for Pool Tile,https://res.cloudinary.com/dbcpfy04c/image/upload/v1748017565/pin_2_11_dbyfih.webp,pool-cleaning-tips,,https://www.beacleaner.com/how-to-clean-glass-tile-in-a-pool?utm_source=pinterest&utm_campaign=the-right-tools-for-,2025-05-23,Using the right tools is essential for effective pool tile cleaning. This post details the best brushes,cleaners
Maintaining a Pristine Pool Surface,https://res.cloudinary.com/dbcpfy04c/image/upload/v1748017572/pin_2_12_t0msht.webp,pool-care-tips,,https://www.beacleaner.com/how-to-clean-glass-tile-in-a-pool?utm_source=pinterest&utm_campaign=maintaining-a-pristi,2025-05-23,Want a pool that always looks its best? This post focuses on maintaining a pristine glass tile surface with regular cleaning and preventative care.  We'll share tips for keeping your pool sparkling clean all season long.  Enjoy a beautiful,inviting pool that you'll be proud to show off. Click to read now! #PoolMaintenance #PristinePool #CleanPoolSurface #GlassTileBeauty
Glass Tile vs. Other Pool Finishes,https://res.cloudinary.com/dbcpfy04c/image/upload/v1748017578/pin_2_13_gpeddu.webp,pool-design-ideas,,https://www.beacleaner.com/how-to-clean-glass-tile-in-a-pool?utm_source=pinterest&utm_campaign=glass-tile-vs-other-,2025-05-23,Considering different pool finishes? This post compares glass tile to other options,highlighting its benefits and cleaning requirements.  Learn why glass tile is a popular choice and how to keep it looking its best.  Make an informed decision and create the pool of your dreams. Click to learn more! #PoolFinishes #GlassTileBenefits #PoolComparison #PoolDesign
The Secret to Streak-Free Glass Tile,https://res.cloudinary.com/dbcpfy04c/image/upload/v1748017584/pin_2_14_fylras.webp,cleaning-tips,,https://www.beacleaner.com/how-to-clean-glass-tile-in-a-pool?utm_source=pinterest&utm_campaign=the-secret-to-streak,2025-05-23,Tired of streaks on your pool tile? This post reveals the secret to achieving a streak-free shine.  We'll share tips for rinsing,drying
The Best Brushes for Glass Tile,https://res.cloudinary.com/dbcpfy04c/image/upload/v1748017590/pin_2_15_e7ume7.webp,tile-tips,,https://www.beacleaner.com/how-to-clean-glass-tile-in-a-pool?utm_source=pinterest&utm_campaign=the-best-brushes-for,2025-05-23,Choosing the right brush is crucial for effective pool tile cleaning. This post reviews the best brushes for glass tile,considering bristle type
Deep Cleaning Your Glass Tile,https://res.cloudinary.com/dbcpfy04c/image/upload/v1748017597/pin_2_16_lwonel.webp,pool-cleaning-tips,,https://www.beacleaner.com/how-to-clean-glass-tile-in-a-pool?utm_source=pinterest&utm_campaign=deep-cleaning-your-g,2025-05-23,Give your glass tile a deep clean with our expert guide! This post provides a comprehensive cleaning process for tackling stubborn stains and buildup.  Restore your pool's sparkle and enjoy a beautiful,inviting space. Click to read now! #DeepCleaning #PoolRevival #GlassTileRefresh #PoolTransformation
Title,https://res.cloudinary.com/dbcpfy04c/image/upload/v1748017638/pin_3_1_a2wn9x.webp,please-provide-the-title-and-keywords-i-need-that-information-to-suggest-a-board-name-once,,https://www.beacleaner.com/how-to-clean-glass-tile-shower?utm_source=pinterest&utm_campaign=title,2025-05-23,Description,Keywords
Sparkling Shower: Glass Tile Cleaning Guide,https://res.cloudinary.com/dbcpfy04c/image/upload/v1748017644/pin_3_2_nhsgts.webp,bathroom-cleaning-tips,,https://www.beacleaner.com/how-to-clean-glass-tile-shower?utm_source=pinterest&utm_campaign=sparkling-shower-gla,2025-05-23,Is your glass tile shower looking dull and dingy? Don't let soap scum & hard water ruin your beautiful bathroom! This guide reveals the *easiest* way to get a streak-free shine,using simple ingredients you probably already have. Say goodbye to endless scrubbing and hello to a spa-like shower experience. Learn the secrets to preventing buildup and keeping your shower gorgeous for years to come. Click to read the full tutorial and reclaim your weekend! #GlassTileShower #ShowerCleaning #BathroomCleaning #CleanHome
Glass Shower Shine: DIY Cleaning Secrets,https://res.cloudinary.com/dbcpfy04c/image/upload/v1748017652/pin_3_3_jnkr6o.webp,cleaning-tips,,https://www.beacleaner.com/how-to-clean-glass-tile-shower?utm_source=pinterest&utm_campaign=glass-shower-shine-d,2025-05-23,Dreaming of a sparkling clean glass tile shower but dread the work? This post breaks down the process into simple,manageable steps. We'll show you how to tackle stubborn stains
Bye Bye Soap Scum! Glass Tile Rescue,https://res.cloudinary.com/dbcpfy04c/image/upload/v1748017658/pin_3_4_qxtkrp.webp,cleaning-tips,,https://www.beacleaner.com/how-to-clean-glass-tile-shower?utm_source=pinterest&utm_campaign=bye-bye-soap-scum-gl,2025-05-23,Ugh,soap scum! It's the bane of every shower owner's existence. But don't despair! This guide provides a powerful
The Ultimate Glass Tile Shower Guide,https://res.cloudinary.com/dbcpfy04c/image/upload/v1748017663/pin_3_5_ole8hi.webp,tile-ideas,,https://www.beacleaner.com/how-to-clean-glass-tile-shower?utm_source=pinterest&utm_campaign=the-ultimate-glass-t,2025-05-23,Confused about how to clean your glass tile shower *properly*? This comprehensive guide covers everything you need to know,from choosing the right cleaning products to mastering the perfect scrubbing technique. We'll help you avoid common mistakes that can damage your tile and ensure a long-lasting shine. Read now for a shower you'll love! #ShowerGuide #GlassTileCleaning #BathroomMaintenance #HomeImprovement
Streak-Free Glass Shower: It's Possible!,https://res.cloudinary.com/dbcpfy04c/image/upload/v1748017673/pin_3_6_gwbftu.webp,cleaning-tips,,https://www.beacleaner.com/how-to-clean-glass-tile-shower?utm_source=pinterest&utm_campaign=streak-free-glass-sh,2025-05-23,Tired of streaks after cleaning your glass tile shower? You're not alone! This post reveals the secret to achieving a truly streak-free shine,using a simple technique and readily available tools.  Imagine the satisfaction of a flawlessly clean shower!  Click to learn how to banish streaks forever and enjoy a sparkling bathroom. #StreakFreeShower #GlassCleaning #ShowerHacks #CleaningMotivation
Protect Your Investment: Glass Tile Care,https://res.cloudinary.com/dbcpfy04c/image/upload/v1748017679/pin_3_7_g4gzqw.webp,bathroom-tips,,https://www.beacleaner.com/how-to-clean-glass-tile-shower?utm_source=pinterest&utm_campaign=protect-your-investm,2025-05-23,Your glass tile shower is a beautiful investment – protect it! This guide teaches you how to clean and maintain your shower to prevent damage and extend its lifespan. We'll cover everything from daily maintenance to deep cleaning,ensuring your shower stays gorgeous for years to come. Learn how to keep it looking new! #GlassTileMaintenance #ShowerCare #BathroomDesign #HomeOwnership
Easy Glass Shower Cleaning Routine,https://res.cloudinary.com/dbcpfy04c/image/upload/v1748017687/pin_3_8_jsmiif.webp,bathroom-cleaning-tips,,https://www.beacleaner.com/how-to-clean-glass-tile-shower?utm_source=pinterest&utm_campaign=easy-glass-shower-cl,2025-05-23,Short on time? This post provides a quick and easy glass tile shower cleaning routine that fits into even the busiest schedules. We'll show you how to maintain a clean shower with minimal effort,so you can spend more time enjoying your bathroom and less time cleaning it. Get started today! #QuickCleaning #ShowerRoutine #EasyCleaning #BathroomGoals
Hard Water Stains Gone! Glass Tile Fix,https://res.cloudinary.com/dbcpfy04c/image/upload/v1748017693/pin_3_9_ivndlp.webp,cleaning-tips,,https://www.beacleaner.com/how-to-clean-glass-tile-shower?utm_source=pinterest&utm_campaign=hard-water-stains-go,2025-05-23,Hard water stains ruining your glass tile shower? Don't worry,you can fix it! This guide provides a powerful solution for removing stubborn hard water stains and restoring your shower's sparkle. We'll share tips for preventing future buildup and keeping your shower looking its best. Click to learn more! #HardWaterStains #GlassTileRepair #ShowerRestoration #CleaningSolutions
DIY Glass Shower Cleaner: Save Money!,https://res.cloudinary.com/dbcpfy04c/image/upload/v1748017702/pin_3_10_gmqddi.webp,cleaning-tips,,https://www.beacleaner.com/how-to-clean-glass-tile-shower?utm_source=pinterest&utm_campaign=diy-glass-shower-cle,2025-05-23,Skip the expensive store-bought cleaners! This post reveals a simple,effective DIY glass shower cleaner that you can make with ingredients you probably already have. Save money and enjoy a sparkling clean shower without harsh chemicals. It's a win-win! #DIYCleaner #GlassShowerCleaner #NaturalCleaning #SaveMoney
Prevent Shower Mildew: Glass Tile Tips,https://res.cloudinary.com/dbcpfy04c/image/upload/v1748017708/pin_3_11_feu9va.webp,shower-cleaning-tips,,https://www.beacleaner.com/how-to-clean-glass-tile-shower?utm_source=pinterest&utm_campaign=prevent-shower-milde,2025-05-23,Mildew is a common problem in showers,but it doesn't have to be! This post provides practical tips for preventing mildew growth on your glass tile shower
Gentle Cleaning for Glass Tile Showers,https://res.cloudinary.com/dbcpfy04c/image/upload/v1748017714/pin_3_12_u9y3ht.webp,shower-cleaning-tips,,https://www.beacleaner.com/how-to-clean-glass-tile-shower?utm_source=pinterest&utm_campaign=gentle-cleaning-for-,2025-05-23,Worried about damaging your delicate glass tile? This post focuses on gentle cleaning methods that are effective yet safe for your shower. We'll show you how to clean without scratching or dulling the tile,ensuring a long-lasting shine. #GentleCleaning #GlassTileCare #ShowerSafety #CleaningDelicately
Deep Clean Your Glass Tile Shower Now!,https://res.cloudinary.com/dbcpfy04c/image/upload/v1748017721/pin_3_13_q5hfch.webp,bathroom-cleaning-tips,,https://www.beacleaner.com/how-to-clean-glass-tile-shower?utm_source=pinterest&utm_campaign=deep-clean-your-glas,2025-05-23,It's time for a deep clean! This post provides a step-by-step guide to thoroughly cleaning your glass tile shower,removing stubborn stains and restoring its original beauty.  Don't put it off any longer – a sparkling shower is just a click away! #DeepCleaning #GlassTileShower #BathroomRefresh #CleaningSchedule
The Best Tools for Glass Tile Cleaning,https://res.cloudinary.com/dbcpfy04c/image/upload/v1748017728/pin_3_14_afwjqa.webp,bathroom-cleaning-tips,,https://www.beacleaner.com/how-to-clean-glass-tile-shower?utm_source=pinterest&utm_campaign=the-best-tools-for-g,2025-05-23,Having the right tools makes all the difference! This post recommends the best tools for cleaning your glass tile shower,from microfiber cloths to specialized scrub brushes.  Make cleaning easier and more effective with these essential items. #CleaningTools #GlassTileCleaning #ShowerEssentials #BathroomGadgets
Glass Shower Cleaning: A Step-by-Step Guide,https://res.cloudinary.com/dbcpfy04c/image/upload/v1748017735/pin_3_15_xqtgi7.webp,cleaning-tips,,https://www.beacleaner.com/how-to-clean-glass-tile-shower?utm_source=pinterest&utm_campaign=glass-shower-cleanin,2025-05-23,Need a clear,concise guide to cleaning your glass tile shower? This post provides a simple
The Ultimate Guide to Glass Tile Grout,https://res.cloudinary.com/dbcpfy04c/image/upload/v1748017740/pin_3_16_ajfako.webp,bathroom-cleaning-tips,,https://www.beacleaner.com/how-to-clean-glass-tile-shower?utm_source=pinterest&utm_campaign=the-ultimate-guide-t,2025-05-23,Don't forget the grout! This post focuses on cleaning and maintaining the grout in your glass tile shower,preventing stains and mildew.  A clean grout line makes all the difference in the overall appearance of your shower. #GroutCleaning #GlassTileGrout #ShowerDetailing #BathroomCleaningTips
