Title,Media URL,Pinterest board,Thumbnail,Link,Publish date,Description,Keywords
Title,https://res.cloudinary.com/dbcpfy04c/image/upload/v1748370573/pin_1_1_ngbxv6.webp,please-provide-the-title-and-keywords-i-need-that-information-to-suggest-a-board-name-once,,https://www.beacleaner.com/how-to-clean-canvas-awnings?utm_source=pinterest&utm_campaign=title,2025-05-27,Description,Keywords
Revive Your Canvas Awning!,https://res.cloudinary.com/dbcpfy04c/image/upload/v1748370579/pin_1_2_sqjdje.webp,awning-cleaning-tips,,https://www.beacleaner.com/how-to-clean-canvas-awnings?utm_source=pinterest&utm_campaign=revive-your-canvas-a,2025-05-27,Is your canvas awning looking drab and dirty? Don't replace it – restore it! This guide walks you through a simple,step-by-step process to deep clean your awning and bring back its vibrant color. Learn the best cleaning solutions
Dirty Awning? Clean It Now!,https://res.cloudinary.com/dbcpfy04c/image/upload/v1748370586/pin_1_3_aopcrx.webp,home-cleaning-tips,,https://www.beacleaner.com/how-to-clean-canvas-awnings?utm_source=pinterest&utm_campaign=dirty-awning-clean-i,2025-05-27,Don't let a dirty awning ruin your curb appeal! This post reveals the secrets to safely and effectively cleaning your canvas awning,removing mildew
Awning Cleaning: A Step-by-Step Guide,https://res.cloudinary.com/dbcpfy04c/image/upload/v1748370593/pin_1_4_ljm1kb.webp,home-cleaning-tips,,https://www.beacleaner.com/how-to-clean-canvas-awnings?utm_source=pinterest&utm_campaign=awning-cleaning-a-st,2025-05-27,Feeling overwhelmed by a grimy canvas awning? We break down the cleaning process into easy-to-follow steps. From mild soap solutions to tackling stubborn stains,we've got you covered.  This guide will save you money and the hassle of professional cleaning.  Enjoy a sparkling clean awning and a more inviting outdoor space! Click to learn more. #CanvasAwningGuide #CleaningHacks #OutdoorSpace #HomeTips
Mildew on Your Awning? Fix It!,https://res.cloudinary.com/dbcpfy04c/image/upload/v1748370600/pin_1_5_mtnerr.webp,awning-tips,,https://www.beacleaner.com/how-to-clean-canvas-awnings?utm_source=pinterest&utm_campaign=mildew-on-your-awnin,2025-05-27,Mildew ruining your canvas awning? Don't panic! This guide provides effective solutions for removing mildew and preventing it from returning. Learn how to identify mildew,choose the right cleaning products
Protect Your Investment: Awning Care,https://res.cloudinary.com/dbcpfy04c/image/upload/v1748370607/pin_1_6_p2rdrv.webp,home-maintenance-tips,,https://www.beacleaner.com/how-to-clean-canvas-awnings?utm_source=pinterest&utm_campaign=protect-your-investm,2025-05-27,Your canvas awning is an investment – protect it! This post details essential awning care tips,including regular cleaning
DIY Canvas Awning Cleaning,https://res.cloudinary.com/dbcpfy04c/image/upload/v1748370615/pin_1_7_wjvelw.webp,outdoor-cleaning-tips,,https://www.beacleaner.com/how-to-clean-canvas-awnings?utm_source=pinterest&utm_campaign=diy-canvas-awning-cl,2025-05-27,Save money and get a professional-level clean with our DIY canvas awning cleaning guide! We share our best tips and tricks for tackling dirt,stains
The Best Soap for Canvas Awnings,https://res.cloudinary.com/dbcpfy04c/image/upload/v1748370621/pin_1_8_kheswn.webp,awning-care-tips,,https://www.beacleaner.com/how-to-clean-canvas-awnings?utm_source=pinterest&utm_campaign=the-best-soap-for-ca,2025-05-27,Choosing the right soap is crucial for cleaning your canvas awning. This post reveals the best soap options for gentle yet effective cleaning,avoiding damage and discoloration.  Learn what to look for and what to avoid.  Keep your awning looking vibrant and new! Read the full article. #CanvasAwningSoap #CleaningProducts #AwningCareTips #HomeCleaning
Awning Cleaning: Before & After!,https://res.cloudinary.com/dbcpfy04c/image/upload/v1748370628/pin_1_9_kjyx7e.webp,home-cleaning-tips,,https://www.beacleaner.com/how-to-clean-canvas-awnings?utm_source=pinterest&utm_campaign=awning-cleaning-befo,2025-05-27,See the amazing transformation! This post showcases stunning before & after photos of canvas awning cleaning,proving that even the dirtiest awnings can be restored to their former glory.  Get inspired and learn how to achieve similar results. Click to see the incredible difference! #AwningTransformation #BeforeAndAfter #CleaningResults #HomeRenovation
Extend Your Awning's Lifespan,https://res.cloudinary.com/dbcpfy04c/image/upload/v1748370634/pin_1_10_u3c3la.webp,awning-tips,,https://www.beacleaner.com/how-to-clean-canvas-awnings?utm_source=pinterest&utm_campaign=extend-your-awnings-,2025-05-27,Want your canvas awning to last longer? This guide provides essential tips for extending its lifespan,including regular cleaning
Canvas Awning Stain Removal Guide,https://res.cloudinary.com/dbcpfy04c/image/upload/v1748370642/pin_1_11_meq3w1.webp,awning-cleaning-tips,,https://www.beacleaner.com/how-to-clean-canvas-awnings?utm_source=pinterest&utm_campaign=canvas-awning-stain-,2025-05-27,Stubborn stains on your canvas awning? We've got you covered! This guide provides targeted solutions for removing common stains,from bird droppings to mildew.  Learn how to tackle any stain and restore your awning's appearance.  Read now for stain-fighting power! #StainRemoval #AwningCleaning #CanvasCare #HomeMaintenance
Awning Cleaning: Tools You'll Need,https://res.cloudinary.com/dbcpfy04c/image/upload/v1748370648/pin_1_12_jh7sgj.webp,home-cleaning-tips,,https://www.beacleaner.com/how-to-clean-canvas-awnings?utm_source=pinterest&utm_campaign=awning-cleaning-tool,2025-05-27,Before you start cleaning your canvas awning,make sure you have the right tools! This post lists all the essential tools you'll need for a successful clean
Preventative Awning Care Tips,https://res.cloudinary.com/dbcpfy04c/image/upload/v1748370654/pin_1_13_nqhcti.webp,awning-tips,,https://www.beacleaner.com/how-to-clean-canvas-awnings?utm_source=pinterest&utm_campaign=preventative-awning-,2025-05-27,Don't wait for your awning to get dirty – prevent it! This post shares preventative care tips to keep your canvas awning looking its best,minimizing the need for deep cleaning.  Enjoy a consistently clean and beautiful awning. Read now for proactive care! #PreventativeCare #AwningMaintenance #OutdoorLiving #HomeTips
Canvas Awning Cleaning: Common Mistakes,https://res.cloudinary.com/dbcpfy04c/image/upload/v1748370661/pin_1_14_dlb21a.webp,home-cleaning-tips,,https://www.beacleaner.com/how-to-clean-canvas-awnings?utm_source=pinterest&utm_campaign=canvas-awning-cleani,2025-05-27,Avoid these common mistakes when cleaning your canvas awning! This post highlights pitfalls to avoid,ensuring a safe and effective clean.  Protect your awning and achieve professional-level results.  Learn from our experience! #AwningCleaningMistakes #CanvasCare #HomeImprovement #CleaningTips
Restore Your Faded Canvas Awning,https://res.cloudinary.com/dbcpfy04c/image/upload/v1748370669/pin_1_15_a3ikk3.webp,outdoor-tips,,https://www.beacleaner.com/how-to-clean-canvas-awnings?utm_source=pinterest&utm_campaign=restore-your-faded-c,2025-05-27,Is your canvas awning looking faded and worn? This guide provides tips for restoring its color and vibrancy,bringing it back to life.  Enjoy a brighter
Canvas Awning Cleaning for Beginners,https://res.cloudinary.com/dbcpfy04c/image/upload/v1748370675/pin_1_16_rjgwab.webp,home-cleaning-tips,,https://www.beacleaner.com/how-to-clean-canvas-awnings?utm_source=pinterest&utm_campaign=canvas-awning-cleani,2025-05-27,New to awning cleaning? This post is perfect for beginners! We provide a simple,step-by-step guide with clear instructions and helpful tips.  Gain confidence and achieve a beautifully clean awning.  Start cleaning today! #BeginnerCleaning #AwningCare #CanvasCleaning #HomeProjects
Title,https://res.cloudinary.com/dbcpfy04c/image/upload/v1748370715/pin_2_1_e2hrcc.webp,please-provide-the-title-and-keywords-i-need-that-information-to-suggest-a-board-name-once,,https://www.beacleaner.com/how-to-clean-casement-windows?utm_source=pinterest&utm_campaign=title,2025-05-27,Description,Keywords
Sparkling Casement Windows: A Guide,https://res.cloudinary.com/dbcpfy04c/image/upload/v1748370721/pin_2_2_qv5oso.webp,window-cleaning-tips,,https://www.beacleaner.com/how-to-clean-casement-windows?utm_source=pinterest&utm_campaign=sparkling-casement-w,2025-05-27,Tired of streaky,dirty casement windows? This guide breaks down the cleaning process step-by-step
Casement Window Cleaning Hacks,https://res.cloudinary.com/dbcpfy04c/image/upload/v1748370728/pin_2_3_hlfcnk.webp,window-cleaning-tips,,https://www.beacleaner.com/how-to-clean-casement-windows?utm_source=pinterest&utm_campaign=casement-window-clea,2025-05-27,Unlock the secrets to effortlessly clean casement windows! This pin reveals pro tips for tackling stubborn dirt,pollen
DIY Window Cleaner for Casement Windows,https://res.cloudinary.com/dbcpfy04c/image/upload/v1748370735/pin_2_4_fwxhy1.webp,cleaning-tips,,https://www.beacleaner.com/how-to-clean-casement-windows?utm_source=pinterest&utm_campaign=diy-window-cleaner-f,2025-05-27,Skip the harsh chemicals! This pin shows you how to make a powerful,eco-friendly window cleaner using ingredients you probably already have. Perfect for casement windows
Cleaning Casement Windows: Step-by-Step,https://res.cloudinary.com/dbcpfy04c/image/upload/v1748370741/pin_2_5_gomu2p.webp,window-cleaning-tips,,https://www.beacleaner.com/how-to-clean-casement-windows?utm_source=pinterest&utm_campaign=cleaning-casement-wi,2025-05-27,Confused about cleaning casement windows? This pin provides a clear,visual step-by-step guide. From prepping your supplies to the final polish
Streak-Free Casement Windows: The Secret,https://res.cloudinary.com/dbcpfy04c/image/upload/v1748370750/pin_2_6_dnxpqg.webp,window-cleaning-tips,,https://www.beacleaner.com/how-to-clean-casement-windows?utm_source=pinterest&utm_campaign=streak-free-casement,2025-05-27,Say goodbye to streaks! This pin reveals the secret to achieving a perfectly streak-free finish on your casement windows. Learn the right tools,techniques
Casement Window Cleaning Tools You Need,https://res.cloudinary.com/dbcpfy04c/image/upload/v1748370756/pin_2_7_b3d4g9.webp,window-cleaning-tips,,https://www.beacleaner.com/how-to-clean-casement-windows?utm_source=pinterest&utm_campaign=casement-window-clea,2025-05-27,Don't start cleaning without these essential tools! This pin showcases the best brushes,squeegees
Protecting Your Casement Windows While Cleaning,https://res.cloudinary.com/dbcpfy04c/image/upload/v1748370762/pin_2_8_qka9vy.webp,window-cleaning-tips,,https://www.beacleaner.com/how-to-clean-casement-windows?utm_source=pinterest&utm_campaign=protecting-your-case,2025-05-27,Worried about damaging your casement windows? This pin offers valuable tips for protecting the frames and glass during cleaning.  Avoid scratches,streaks
Cleaning Casement Windows: Safety First!,https://res.cloudinary.com/dbcpfy04c/image/upload/v1748370768/pin_2_9_junvfa.webp,window-cleaning-tips,,https://www.beacleaner.com/how-to-clean-casement-windows?utm_source=pinterest&utm_campaign=cleaning-casement-wi,2025-05-27,Safety is paramount! This pin emphasizes important safety precautions to take when cleaning casement windows,especially when working at heights.  Protect yourself and avoid accidents.  Clean with confidence! Click for safety guidelines. #WindowCleaningSafety #CasementWindow #HomeSafety #CleaningPrecautions
Cleaning Casement Windows: A Visual Guide,https://res.cloudinary.com/dbcpfy04c/image/upload/v1748370774/pin_2_10_elu4wd.webp,window-cleaning-tips,,https://www.beacleaner.com/how-to-clean-casement-windows?utm_source=pinterest&utm_campaign=cleaning-casement-wi,2025-05-27,Learn by seeing! This pin features a series of clear,high-quality photos demonstrating each step of the casement window cleaning process.  Easy to follow and understand.  Visual learning at its best! Click to see the visual guide. #VisualGuide #WindowCleaning #CasementWindow #CleaningTutorial
Casement Window Cleaning: Common Mistakes to Avoid,https://res.cloudinary.com/dbcpfy04c/image/upload/v1748370779/pin_2_11_ujkb9a.webp,window-cleaning-tips,,https://www.beacleaner.com/how-to-clean-casement-windows?utm_source=pinterest&utm_campaign=casement-window-clea,2025-05-27,Don't make these mistakes! This pin highlights common errors people make when cleaning casement windows and how to avoid them.  Save time,effort
Title,https://res.cloudinary.com/dbcpfy04c/image/upload/v1748370820/pin_3_1_i7393l.webp,please-provide-the-title-and-keywords-i-need-that-information-to-suggest-a-board-name-once,,https://www.beacleaner.com/how-to-clean-caulking-around-windows?utm_source=pinterest&utm_campaign=title,2025-05-27,Description,Keywords
Bye Bye Moldy Caulking!,https://res.cloudinary.com/dbcpfy04c/image/upload/v1748370826/pin_3_2_tssx7o.webp,home-cleaning-tips,,https://www.beacleaner.com/how-to-clean-caulking-around-windows?utm_source=pinterest&utm_campaign=bye-bye-moldy-caulki,2025-05-27,Is dingy,stained caulking ruining your window views? Don't replace it - restore it! This easy guide shows you how to clean caulking around windows like a pro
Caulking Cleaning: The Easy Way,https://res.cloudinary.com/dbcpfy04c/image/upload/v1748370836/pin_3_3_nlbfiu.webp,cleaning-tips,,https://www.beacleaner.com/how-to-clean-caulking-around-windows?utm_source=pinterest&utm_campaign=caulking-cleaning-th,2025-05-27,Tired of staring at grimy caulking? You're not alone! This blog post breaks down the process of cleaning caulking around windows into manageable steps. We'll show you how to tackle stubborn stains and prevent future buildup.  Protect your investment and enjoy brighter,cleaner windows.  Don't delay
Mold & Mildew on Caulking? FIX IT!,https://res.cloudinary.com/dbcpfy04c/image/upload/v1748370842/pin_3_4_w0hytb.webp,home-repair-tips,,https://www.beacleaner.com/how-to-clean-caulking-around-windows?utm_source=pinterest&utm_campaign=mold-mildew-on-caulk,2025-05-27,Discover how to eliminate unsightly mold and mildew from your window caulking! This guide provides practical solutions and preventative measures to keep your windows looking their best.  Don't let mold compromise your home's air quality or structural integrity.  Take control and restore a healthy,beautiful living space. Click to learn more! #MoldPrevention #MildewRemoval #WindowMaintenance #HealthyHome
"Save Money: Clean, Don't Replace!",https://res.cloudinary.com/dbcpfy04c/image/upload/v1748370849/pin_3_5_zc3lfd.webp,home-hacks-tips,,https://www.beacleaner.com/how-to-clean-caulking-around-windows?utm_source=pinterest&utm_campaign=save-money-clean-don,2025-05-27,Before you spend a fortune on new windows,try cleaning the caulking! This post demonstrates how to effectively clean caulking around windows
Brighten Your Home: Window Caulking,https://res.cloudinary.com/dbcpfy04c/image/upload/v1748370855/pin_3_6_o5wk7o.webp,home-cleaning-tips,,https://www.beacleaner.com/how-to-clean-caulking-around-windows?utm_source=pinterest&utm_campaign=brighten-your-home-w,2025-05-27,Dirty caulking can make your entire home look dull. Learn how to brighten up your windows and your mood by cleaning the caulking around them! This guide offers simple,effective techniques for a sparkling clean finish.  Enjoy the sunshine streaming through pristine windows. Click to read! #HomeDecor #WindowStyle #CleaningMotivation #BrightHome
The Ultimate Caulking Cleaning Guide,https://res.cloudinary.com/dbcpfy04c/image/upload/v1748370861/pin_3_7_ocwegq.webp,cleaning-tips,,https://www.beacleaner.com/how-to-clean-caulking-around-windows?utm_source=pinterest&utm_campaign=the-ultimate-caulkin,2025-05-27,Everything you need to know about cleaning caulking around windows is right here! From identifying caulking types to choosing the best cleaning solutions,this comprehensive guide has you covered.  Don't let dirty caulking be an eyesore any longer.  Get the knowledge you need for a flawless finish. #CaulkingGuide #WindowCare #CleaningHacks #HomeTips
Is Your Caulking Ruining Your View?,https://res.cloudinary.com/dbcpfy04c/image/upload/v1748370867/pin_3_8_ubm6f4.webp,window-cleaning-tips,,https://www.beacleaner.com/how-to-clean-caulking-around-windows?utm_source=pinterest&utm_campaign=is-your-caulking-rui,2025-05-27,Don't let dirty caulking obstruct your beautiful view! This guide provides a step-by-step process for cleaning caulking around windows,restoring clarity and brightness.  Enjoy the scenery without distractions.  Click to learn how to reclaim your view! #WindowViews #CleanHome #HomeMaintenance #ClearWindows
The Secret to Long-Lasting Caulking,https://res.cloudinary.com/dbcpfy04c/image/upload/v1748370873/pin_3_9_jewjdx.webp,home-repair-tips,,https://www.beacleaner.com/how-to-clean-caulking-around-windows?utm_source=pinterest&utm_campaign=the-secret-to-long-l,2025-05-27,Cleaning your caulking isn't just about aesthetics – it's about longevity! This post explains how regular cleaning can extend the life of your caulking,saving you money on replacements.  Protect your investment and enjoy years of beautiful
Quick Tip: Cleaning Window Caulking,https://res.cloudinary.com/dbcpfy04c/image/upload/v1748370879/pin_3_10_d2cch6.webp,cleaning-tips,,https://www.beacleaner.com/how-to-clean-caulking-around-windows?utm_source=pinterest&utm_campaign=quick-tip-cleaning-w,2025-05-27,Short on time? This quick tip shows you how to clean caulking around windows in minutes!  We'll share a simple,effective method for a fast and easy refresh.  No more excuses – get those windows sparkling! #QuickCleaning #CleaningHacks #TimeSavingTips #WindowCleaningFast
"Don't Replace, Restore: Caulking Guide",https://res.cloudinary.com/dbcpfy04c/image/upload/v1748370887/pin_3_11_wo4vmx.webp,home-repair-tips,,https://www.beacleaner.com/how-to-clean-caulking-around-windows?utm_source=pinterest&utm_campaign=dont-replace-restore,2025-05-27,Thinking about replacing your window caulking? Think again! This guide demonstrates how to restore dirty,stained caulking to its former glory.  Save money and effort with these simple cleaning techniques.  Click to learn how to revive your windows! #CaulkingRestoration #DIYRepair #HomeSavings #WindowRenewal
The Best Cleaning Solutions for Caulking,https://res.cloudinary.com/dbcpfy04c/image/upload/v1748370894/pin_3_12_mecctx.webp,cleaning-tips,,https://www.beacleaner.com/how-to-clean-caulking-around-windows?utm_source=pinterest&utm_campaign=the-best-cleaning-so,2025-05-27,Wondering what cleaning solutions work best on window caulking? This post reveals the most effective options,including DIY recipes and store-bought products.  Get the right tools for the job and achieve a sparkling clean finish. Click to learn more! #CleaningSolutions #DIYCleaners #WindowCleaningProducts #CaulkingCleaner
Caulking Cleaning: A Beginner's Guide,https://res.cloudinary.com/dbcpfy04c/image/upload/v1748370899/pin_3_13_qi5xl0.webp,cleaning-tips,,https://www.beacleaner.com/how-to-clean-caulking-around-windows?utm_source=pinterest&utm_campaign=caulking-cleaning-a-,2025-05-27,New to home maintenance? This beginner's guide makes cleaning caulking around windows easy and accessible.  We'll walk you through each step,ensuring a successful outcome.  Don't be intimidated – you can do this! #BeginnerCleaning #HomeMaintenanceForBeginners #DIYGuide #EasyHomeImprovement
Say Goodbye to Grime: Window Caulking,https://res.cloudinary.com/dbcpfy04c/image/upload/v1748370906/pin_3_14_wzx0g9.webp,home-improvement-tips,,https://www.beacleaner.com/how-to-clean-caulking-around-windows?utm_source=pinterest&utm_campaign=say-goodbye-to-grime,2025-05-27,Tired of looking at grime-covered window caulking? This post provides a comprehensive solution for removing dirt,stains
The Power of Clean Caulking,https://res.cloudinary.com/dbcpfy04c/image/upload/v1748370912/pin_3_15_gdnlxb.webp,home-cleaning-tips,,https://www.beacleaner.com/how-to-clean-caulking-around-windows?utm_source=pinterest&utm_campaign=the-power-of-clean-c,2025-05-27,You'd be surprised how much cleaner caulking can make your windows look! This post demonstrates the transformative power of cleaning caulking around windows.  Enjoy a brighter,more inviting home. Click to see the difference! #HomeTransformation #WindowAppeal #CleaningPower #BrightenYourHome
Don't Let Mold Ruin Your Windows!,https://res.cloudinary.com/dbcpfy04c/image/upload/v1748370918/pin_3_16_sgunyf.webp,home-repair-tips,,https://www.beacleaner.com/how-to-clean-caulking-around-windows?utm_source=pinterest&utm_campaign=dont-let-mold-ruin-y,2025-05-27,Mold on window caulking isn't just unsightly – it's a health hazard. This post teaches you how to effectively remove mold and prevent its return,protecting your home and family. Click to learn more! #MoldRemediation #HealthyHomeEnvironment #WindowSafety #MoldFreeHome
Revive Your Windows Today!,https://res.cloudinary.com/dbcpfy04c/image/upload/v1748370925/pin_3_17_khlbmo.webp,home-improvement-ideas,,https://www.beacleaner.com/how-to-clean-caulking-around-windows?utm_source=pinterest&utm_campaign=revive-your-windows-,2025-05-27,Don't wait any longer to clean your window caulking! This post provides the motivation and instructions you need to revive your windows and enjoy a brighter,more beautiful home. Click to get started! #WindowRevival #HomeImprovementProject #CleaningMotivation #FreshHome
Title,https://res.cloudinary.com/dbcpfy04c/image/upload/v1748370971/pin_4_1_jvxfo5.webp,please-provide-the-title-and-keywords-i-need-that-information-to-suggest-a-board-name-once,,https://www.beacleaner.com/how-to-clean-chamois?utm_source=pinterest&utm_campaign=title,2025-05-27,Description,Keywords
Revive Your Chamois: Cleaning Guide,https://res.cloudinary.com/dbcpfy04c/image/upload/v1748370977/pin_4_2_k8lss5.webp,auto-care-tips,,https://www.beacleaner.com/how-to-clean-chamois?utm_source=pinterest&utm_campaign=revive-your-chamois-,2025-05-27,"Is your favorite chamois looking dull and losing its absorbency? Don't replace it, restore it! This guide reveals the secrets to cleaning and conditioning your chamois, bringing it back to life for sparkling clean cars. Learn how to remove dirt, grime, and even stubborn water spots with simple household items.  A clean chamois means a scratch-free finish and a professional shine.  Click to learn the easy steps and keep your car looking its best!  Protect your investment and enjoy a flawless finish every time.","Chamois cleaning,Car detailing,Auto care,Leather care"
Chamois Care 101: Keep it Soft!,https://res.cloudinary.com/dbcpfy04c/image/upload/v1748370983/pin_4_3_goxlai.webp,car-detailing-tips,,https://www.beacleaner.com/how-to-clean-chamois?utm_source=pinterest&utm_campaign=chamois-care-101-kee,2025-05-27,"A dirty chamois can actually *damage* your paint!  Don't risk swirls and scratches. This pin leads to a comprehensive guide on how to properly clean, store, and maintain your chamois for years of use.  We cover everything from rinsing to conditioning, ensuring maximum absorbency and a gentle touch on your vehicle.  Imagine the satisfaction of a perfectly clean car, achieved with a perfectly maintained chamois.  Learn the pro tips now!","Car wash,Chamois leather,Detailing tips,Paint protection"
Dirty Chamois? Don't Throw it Away!,https://res.cloudinary.com/dbcpfy04c/image/upload/v1748370991/pin_4_4_gejajg.webp,car-cleaning-tips,,https://www.beacleaner.com/how-to-clean-chamois?utm_source=pinterest&utm_campaign=dirty-chamois-dont-t,2025-05-27,"Before you toss that grimy chamois, read this!  You can save money and the environment by learning how to effectively clean and restore it.  Our step-by-step guide shows you how to remove embedded dirt, oil, and grime, leaving your chamois soft, supple, and ready to tackle any cleaning job.  A little effort goes a long way – get a showroom shine without the expense of constant replacements. Click to learn more!","Chamois restoration,Car cleaning,DIY auto,Cleaning hacks"
The Ultimate Chamois Cleaning Checklist,https://res.cloudinary.com/dbcpfy04c/image/upload/v1748370997/pin_4_5_b6fqpk.webp,car-care-tips,,https://www.beacleaner.com/how-to-clean-chamois?utm_source=pinterest&utm_campaign=the-ultimate-chamois,2025-05-27,"Never wonder if your chamois is truly clean again! This pin links to a detailed checklist that walks you through every step of the cleaning process, from initial rinse to final conditioning.  We've broken down the process into easy-to-follow instructions, so even beginners can achieve professional results.  Ensure a spotless finish and protect your car's paint.  Download the checklist and start cleaning today!","Chamois guide,Detailing checklist,Auto maintenance,Car care tips"
Chamois Cleaning: Mistakes to Avoid,https://res.cloudinary.com/dbcpfy04c/image/upload/v1748371004/pin_4_6_ud9xvq.webp,car-detailing-tips,,https://www.beacleaner.com/how-to-clean-chamois?utm_source=pinterest&utm_campaign=chamois-cleaning-mis,2025-05-27,"Are you making these common chamois cleaning mistakes?  You could be damaging your chamois and reducing its lifespan!  This guide reveals the pitfalls to avoid, ensuring you clean your chamois correctly every time.  Learn the right detergents to use (and the ones to skip!), proper drying techniques, and storage solutions.  Protect your investment and keep your chamois performing at its best.","Chamois errors,Cleaning mistakes,Car detailing,Leather care tips"
