Title,Media URL,Pinterest board,Thumbnail,Link,Publish date,Description,Keywords
Title,https://res.cloudinary.com/dbcpfy04c/image/upload/v1747923504/pin_1_1_zflqzs.webp,please-provide-the-title-and-keywords-i-need-that-information-to-suggest-a-board-name-once,,https://www.beacleaner.com/how-to-clean-tumi-nylon-bag?utm_source=pinterest&utm_campaign=title,2025-05-22,Description,Keywords
Revive Your Tumi: Nylon Cleaning Guide,https://res.cloudinary.com/dbcpfy04c/image/upload/v1747923513/pin_1_2_jc5k1b.webp,bag-care-tips,,https://www.beacleaner.com/how-to-clean-tumi-nylon-bag?utm_source=pinterest&utm_campaign=revive-your-tumi-nyl,2025-05-22,"Is your beloved Tumi bag looking dull and dirty? Don't replace it, restore it! This guide reveals the secrets to cleaning your Tumi nylon bag like a pro, bringing back its original luster. Learn simple, effective techniques to remove stains, dirt, and grime without damaging the fabric. Protect your investment and keep your Tumi looking its best for years to come. Click to learn how to keep your Tumi looking brand new!","Tumi cleaning, nylon bag, bag care, stain removal"
Tumi Bag Cleaning: Step-by-Step,https://res.cloudinary.com/dbcpfy04c/image/upload/v1747923518/pin_1_3_zcgh4f.webp,bag-care-tips,,https://www.beacleaner.com/how-to-clean-tumi-nylon-bag?utm_source=pinterest&utm_campaign=tumi-bag-cleaning-st,2025-05-22,"Worried about ruining your expensive Tumi bag? We get it! This step-by-step guide takes the stress out of cleaning your nylon Tumi. From gentle washing to stubborn stain removal, we cover it all.  Discover the best products and methods to use, and avoid common mistakes that can damage your bag.  Keep your Tumi looking sharp and ready for any adventure! Click to read now!","Tumi, cleaning guide, nylon, bag maintenance"
Say Goodbye to Tumi Stains!,https://res.cloudinary.com/dbcpfy04c/image/upload/v1747923527/pin_1_4_sxzklw.webp,bag-cleaning-tips,,https://www.beacleaner.com/how-to-clean-tumi-nylon-bag?utm_source=pinterest&utm_campaign=say-goodbye-to-tumi-,2025-05-22,"Don't let spills and dirt ruin your favorite Tumi bag! This post is your ultimate resource for tackling tough stains on nylon. We'll show you how to treat everything from watermarks to ink, restoring your bag's pristine appearance.  Imagine confidently carrying your Tumi, knowing it always looks its best.  Click to learn the stain-busting secrets!","Stain removal, Tumi nylon, cleaning tips, bag restoration"
Protect Your Investment: Tumi Care,https://res.cloudinary.com/dbcpfy04c/image/upload/v1747923534/pin_1_5_pvwcrp.webp,bag-care-tips,,https://www.beacleaner.com/how-to-clean-tumi-nylon-bag?utm_source=pinterest&utm_campaign=protect-your-investm,2025-05-22,"Your Tumi bag is more than just an accessory; it's an investment.  Learn how to protect it with our comprehensive cleaning guide. We'll show you how to prevent dirt buildup, maintain the nylon's quality, and extend the life of your bag.  Don't wait until it's too late – proactive care is key! Click to learn more and keep your Tumi protected.","Tumi care, nylon protection, bag longevity, investment protection"
Tumi Nylon Cleaning: Quick & Easy,https://res.cloudinary.com/dbcpfy04c/image/upload/v1747923540/pin_1_6_omwfi3.webp,bag-care-tips,,https://www.beacleaner.com/how-to-clean-tumi-nylon-bag?utm_source=pinterest&utm_campaign=tumi-nylon-cleaning-,2025-05-22,Short on time? No problem! This guide provides quick and easy methods for cleaning your Tumi nylon bag.  Learn how to refresh your bag between deep cleans and tackle minor dirt and grime in minutes.  Keep your Tumi looking great without spending hours scrubbing. Click for a fast cleaning solution!,"Quick cleaning, Tumi nylon, easy care, bag refresh"
The Ultimate Tumi Cleaning Checklist,https://res.cloudinary.com/dbcpfy04c/image/upload/v1747923545/pin_1_7_v91tgi.webp,bag-care-tips,,https://www.beacleaner.com/how-to-clean-tumi-nylon-bag?utm_source=pinterest&utm_campaign=the-ultimate-tumi-cl,2025-05-22,"Never forget a step! This checklist ensures you clean your Tumi nylon bag thoroughly and effectively. From gathering supplies to final inspection, we've got you covered.  Print it out and keep it handy for a stress-free cleaning experience. Click to download the checklist and keep your Tumi spotless!","Cleaning checklist, Tumi, nylon, bag care routine"
DIY Tumi Cleaner: Save Money!,https://res.cloudinary.com/dbcpfy04c/image/upload/v1747923551/pin_1_8_kjrwo1.webp,bag-cleaning-tips,,https://www.beacleaner.com/how-to-clean-tumi-nylon-bag?utm_source=pinterest&utm_campaign=diy-tumi-cleaner-sav,2025-05-22,Skip the expensive cleaners! This post reveals how to make your own effective Tumi nylon cleaning solution using common household ingredients. Save money and achieve professional results.  It's gentle on the fabric and tough on dirt. Click to learn the DIY recipe!,"DIY cleaner, Tumi nylon, homemade solution, cost effective"
Tumi Bag Transformation: Before & After,https://res.cloudinary.com/dbcpfy04c/image/upload/v1747923558/pin_1_9_jcrsye.webp,bag-restoration-tips,,https://www.beacleaner.com/how-to-clean-tumi-nylon-bag?utm_source=pinterest&utm_campaign=tumi-bag-transformat,2025-05-22,See the incredible results! This post features stunning before-and-after photos of Tumi nylon bags transformed with our cleaning techniques.  Get inspired and see how easy it is to restore your bag's original beauty.  Don't just take our word for it – see the proof! Click to view the transformation!,"Before and after, Tumi cleaning, nylon restoration, visual guide"
Is Your Tumi Looking Tired?,https://res.cloudinary.com/dbcpfy04c/image/upload/v1747923563/pin_1_10_hysihy.webp,bag-care-tips,,https://www.beacleaner.com/how-to-clean-tumi-nylon-bag?utm_source=pinterest&utm_campaign=is-your-tumi-looking,2025-05-22,"Give your Tumi bag a new lease on life!  If your bag is looking worn and faded, this guide will show you how to revive its color and texture.  Learn the best cleaning methods to restore its original vibrancy.  Don't let a dirty bag hold you back – feel confident and stylish! Click to learn how to revitalize your Tumi.","Tumi revival, nylon cleaning, bag restoration, color refresh"
Gentle Cleaning for Your Tumi,https://res.cloudinary.com/dbcpfy04c/image/upload/v1747923569/pin_1_11_pvd2o9.webp,bag-care-tips,,https://www.beacleaner.com/how-to-clean-tumi-nylon-bag?utm_source=pinterest&utm_campaign=gentle-cleaning-for-,2025-05-22,Worried about damaging your delicate Tumi nylon?  This guide focuses on gentle cleaning methods that are safe and effective.  We'll show you how to avoid harsh chemicals and abrasive tools that can harm the fabric.  Protect your investment with our gentle approach! Click to learn the safe cleaning methods.,"Gentle cleaning, Tumi nylon, delicate fabric, safe cleaning"
Tumi Cleaning: Avoid These Mistakes!,https://res.cloudinary.com/dbcpfy04c/image/upload/v1747923575/pin_1_12_qpvzo7.webp,bag-care-tips,,https://www.beacleaner.com/how-to-clean-tumi-nylon-bag?utm_source=pinterest&utm_campaign=tumi-cleaning-avoid-,2025-05-22,"Don't ruin your Tumi bag with common cleaning errors! This post highlights the mistakes to avoid when cleaning nylon, ensuring you protect your investment. Learn what *not* to do to keep your bag in pristine condition. Click to avoid costly mistakes!","Tumi mistakes, nylon cleaning, bag damage, cleaning errors"
Deep Clean Your Tumi: The Pro Guide,https://res.cloudinary.com/dbcpfy04c/image/upload/v1747923582/pin_1_13_jfjsia.webp,bag-cleaning-tips,,https://www.beacleaner.com/how-to-clean-tumi-nylon-bag?utm_source=pinterest&utm_campaign=deep-clean-your-tumi,2025-05-22,"Take your Tumi cleaning to the next level! This guide provides a deep cleaning process for tackling stubborn dirt and grime.  Learn how to thoroughly clean every part of your bag, inside and out.  Achieve professional results at home! Click for the pro cleaning guide.","Deep cleaning, Tumi nylon, professional results, thorough cleaning"
Tumi Nylon: Cleaning FAQs Answered,https://res.cloudinary.com/dbcpfy04c/image/upload/v1747923590/pin_1_14_ersq9s.webp,bag-care-tips,,https://www.beacleaner.com/how-to-clean-tumi-nylon-bag?utm_source=pinterest&utm_campaign=tumi-nylon-cleaning-,2025-05-22,"Got questions about cleaning your Tumi nylon bag? We've got answers! This post addresses frequently asked questions, providing clear and concise guidance.  From stain removal to fabric care, we cover it all. Click to find the answers you need!","Tumi FAQs, nylon cleaning, bag questions, cleaning answers"
Keep Your Tumi Fresh: Preventative Care,https://res.cloudinary.com/dbcpfy04c/image/upload/v1747923597/pin_1_15_mweduv.webp,bag-care-tips,,https://www.beacleaner.com/how-to-clean-tumi-nylon-bag?utm_source=pinterest&utm_campaign=keep-your-tumi-fresh,2025-05-22,"Don't wait for dirt to build up! This post focuses on preventative care tips to keep your Tumi nylon bag looking its best.  Learn how to protect it from spills, dirt, and wear and tear.  A little prevention goes a long way! Click for preventative care tips.","Preventative care, Tumi nylon, bag protection, maintenance tips"
Tumi Bag Cleaning: Product Recommendations,https://res.cloudinary.com/dbcpfy04c/image/upload/v1747923603/pin_1_16_kfvz9e.webp,bag-care-tips,,https://www.beacleaner.com/how-to-clean-tumi-nylon-bag?utm_source=pinterest&utm_campaign=tumi-bag-cleaning-pr,2025-05-22,"Not sure what cleaning products to use? We've got you covered! This post recommends the best products for cleaning Tumi nylon, ensuring safe and effective results.  From gentle soaps to stain removers, we'll guide you. Click for product recommendations!","Cleaning products, Tumi nylon, recommended tools, bag supplies"
Tumi Cleaning for Travel Lovers,https://res.cloudinary.com/dbcpfy04c/image/upload/v1747923610/pin_1_17_ywjs1x.webp,travel-cleaning-tips,,https://www.beacleaner.com/how-to-clean-tumi-nylon-bag?utm_source=pinterest&utm_campaign=tumi-cleaning-for-tr,2025-05-22,Keep your travel companion looking its best! This guide is specifically for Tumi bag owners who travel frequently.  Learn how to clean your bag after trips and maintain its appearance on the go.  Travel in style with a spotless Tumi! Click for travel cleaning tips.,"Travel cleaning, Tumi nylon, bag maintenance, on the go"
Restore Your Tumi's Original Shine,https://res.cloudinary.com/dbcpfy04c/image/upload/v1747923617/pin_1_18_zrkfux.webp,bag-care-tips,,https://www.beacleaner.com/how-to-clean-tumi-nylon-bag?utm_source=pinterest&utm_campaign=restore-your-tumis-o,2025-05-22,Bring back the brilliance! This post focuses on restoring the original shine of your Tumi nylon bag.  Learn how to remove dullness and revive the fabric's luster.  Make your Tumi look brand new again! Click to restore the shine.,"Shine restoration, Tumi nylon, luster revival, bag brightening"
Tumi Cleaning: The Ultimate Resource,https://res.cloudinary.com/dbcpfy04c/image/upload/v1747923623/pin_1_19_eizq4d.webp,bag-care-tips,,https://www.beacleaner.com/how-to-clean-tumi-nylon-bag?utm_source=pinterest&utm_campaign=tumi-cleaning-the-ul,2025-05-22,"Everything you need to know about cleaning your Tumi nylon bag is right here! This comprehensive guide covers all aspects of bag care, from stain removal to preventative maintenance.  Your go-to resource for a spotless Tumi! Click for the ultimate guide.","Ultimate guide, Tumi nylon, comprehensive care, bag resource"
Tumi Bag Cleaning: Don't Risk It!,https://res.cloudinary.com/dbcpfy04c/image/upload/v1747923629/pin_1_20_zmrjoi.webp,bag-care-tips,,https://www.beacleaner.com/how-to-clean-tumi-nylon-bag?utm_source=pinterest&utm_campaign=tumi-bag-cleaning-do,2025-05-22,Don't trust your expensive Tumi to just anyone! This guide provides expert advice on cleaning your bag safely and effectively.  Avoid damaging your investment with our proven techniques. Click to protect your Tumi!,"Expert cleaning, Tumi nylon, safe methods, bag protection"
Tumi Nylon: Cleaning for Longevity,https://res.cloudinary.com/dbcpfy04c/image/upload/v1747923634/pin_1_21_xcorir.webp,bag-care-tips,,https://www.beacleaner.com/how-to-clean-tumi-nylon-bag?utm_source=pinterest&utm_campaign=tumi-nylon-cleaning-,2025-05-22,Want your Tumi bag to last a lifetime? This post focuses on cleaning methods that promote longevity and protect the fabric.  Extend the life of your investment with our expert tips. Click for long-lasting care.,"Longevity, Tumi nylon, fabric protection, extended life"
Tumi Cleaning: Quick Tips & Tricks,https://res.cloudinary.com/dbcpfy04c/image/upload/v1747923640/pin_1_22_aldr8d.webp,bag-care-tips,,https://www.beacleaner.com/how-to-clean-tumi-nylon-bag?utm_source=pinterest&utm_campaign=tumi-cleaning-quick-,2025-05-22,Need a quick cleaning fix? This post shares handy tips and tricks for keeping your Tumi nylon bag looking its best.  Learn shortcuts and time-saving techniques. Click for quick cleaning hacks!,"Quick tips, Tumi nylon, cleaning hacks, time saving"
Love Your Tumi: Cleaning & Care,https://res.cloudinary.com/dbcpfy04c/image/upload/v1747923646/pin_1_23_jjxatf.webp,bag-care-tips,,https://www.beacleaner.com/how-to-clean-tumi-nylon-bag?utm_source=pinterest&utm_campaign=love-your-tumi-clean,2025-05-22,Show your Tumi some love! This post emphasizes the importance of regular cleaning and care to maintain your bag's beauty and functionality.  Treat your investment with the respect it deserves. Click to show your Tumi some love!,"Bag love, Tumi nylon, care routine, maintenance"
Tumi Cleaning: From Dull to Dazzling,https://res.cloudinary.com/dbcpfy04c/image/upload/v1747923651/pin_1_24_gugfjr.webp,bag-care-tips,,https://www.beacleaner.com/how-to-clean-tumi-nylon-bag?utm_source=pinterest&utm_campaign=tumi-cleaning-from-d,2025-05-22,Transform your tired Tumi bag into a dazzling accessory! This post showcases the power of proper cleaning and restoration.  See the incredible difference a little effort can make. Click to see the dazzling results!,"Dazzling results, Tumi nylon, bag transformation, visual impact"
Tumi Nylon Cleaning: A Beginner's Guide,https://res.cloudinary.com/dbcpfy04c/image/upload/v1747923657/pin_1_25_wodqlu.webp,bag-care-tips,,https://www.beacleaner.com/how-to-clean-tumi-nylon-bag?utm_source=pinterest&utm_campaign=tumi-nylon-cleaning-,2025-05-22,"New to Tumi bag care? This guide is perfect for beginners! We'll walk you through the cleaning process step-by-step, making it easy and stress-free. Click for the beginner's guide!","Beginner's guide, Tumi nylon, easy cleaning, step by step"
Keep Your Tumi Looking New!,https://res.cloudinary.com/dbcpfy04c/image/upload/v1747923662/pin_1_26_ajukoa.webp,bag-care-tips,,https://www.beacleaner.com/how-to-clean-tumi-nylon-bag?utm_source=pinterest&utm_campaign=keep-your-tumi-looki,2025-05-22,Don't let your Tumi bag age prematurely! This post provides essential cleaning tips to keep it looking fresh and new for years to come. Protect your investment and enjoy a stylish bag. Click to keep it looking new!,"New look, Tumi nylon, bag preservation, timeless style"
Title,https://res.cloudinary.com/dbcpfy04c/image/upload/v1747923703/pin_2_1_uzcgmm.webp,please-provide-the-title-and-keywords-i-need-that-information-to-suggest-a-board-name-once,,https://www.beacleaner.com/how-to-clean-up-diatomaceous-earth?utm_source=pinterest&utm_campaign=title,2025-05-22,Description,Keywords
Diatomaceous Earth Mess? Clean It Up!,https://res.cloudinary.com/dbcpfy04c/image/upload/v1747923709/pin_2_2_seu6er.webp,cleaning-tips,,https://www.beacleaner.com/how-to-clean-up-diatomaceous-earth?utm_source=pinterest&utm_campaign=diatomaceous-earth-m,2025-05-22,Spilled DE got you stressed? Don't panic! This guide breaks down exactly how to safely and effectively clean up diatomaceous earth,protecting your family & pets. Learn the best vacuuming techniques
Diatomaceous Earth Cleanup Guide,https://res.cloudinary.com/dbcpfy04c/image/upload/v1747923714/pin_2_3_qmk3ql.webp,cleaning-tips,,https://www.beacleaner.com/how-to-clean-up-diatomaceous-earth?utm_source=pinterest&utm_campaign=diatomaceous-earth-c,2025-05-22,Worried about the fine dust of diatomaceous earth? This post is your lifeline! We'll show you how to clean up DE spills without making a bigger mess.  Protect your lungs and your home with our simple,step-by-step instructions.  From wet cleaning to vacuuming
DE Cleanup: Protect Your Family!,https://res.cloudinary.com/dbcpfy04c/image/upload/v1747923720/pin_2_4_wrvm0p.webp,home-cleaning-tips,,https://www.beacleaner.com/how-to-clean-up-diatomaceous-earth?utm_source=pinterest&utm_campaign=de-cleanup-protect-y,2025-05-22,Diatomaceous earth is amazing for pest control,but cleanup can be tricky.  This guide prioritizes your family's health! Learn how to safely remove DE
Vacuuming Diatomaceous Earth: How To,https://res.cloudinary.com/dbcpfy04c/image/upload/v1747923728/pin_2_5_rqlacv.webp,cleaning-tips,,https://www.beacleaner.com/how-to-clean-up-diatomaceous-earth?utm_source=pinterest&utm_campaign=vacuuming-diatomaceo,2025-05-22,Is vacuuming DE a disaster waiting to happen? Not with our guide! We reveal the secrets to vacuuming diatomaceous earth *safely* and effectively.  Learn which vacuums work best,how to prevent clogging
DE Spill on Carpet? Here's What To Do!,https://res.cloudinary.com/dbcpfy04c/image/upload/v1747923734/pin_2_6_uux8it.webp,carpet-cleaning-tips,,https://www.beacleaner.com/how-to-clean-up-diatomaceous-earth?utm_source=pinterest&utm_campaign=de-spill-on-carpet-h,2025-05-22,Oh no! Diatomaceous earth on the carpet? Don't despair! This guide provides a detailed plan for removing DE from carpets,restoring them to their former glory.  We'll cover everything from vacuuming to spot cleaning.  Protect your investment and keep your carpets looking beautiful. Click to learn how to tackle this common problem! #CarpetCleaning #DEcleanup #StainRemoval #HomeCare
Diatomaceous Earth Dust Control,https://res.cloudinary.com/dbcpfy04c/image/upload/v1747923741/pin_2_7_zazklj.webp,cleaning-tips,,https://www.beacleaner.com/how-to-clean-up-diatomaceous-earth?utm_source=pinterest&utm_campaign=diatomaceous-earth-d,2025-05-22,Diatomaceous earth dust can be a nuisance. This guide focuses on controlling the dust during and after cleanup.  Learn how to minimize airborne particles and protect your respiratory system.  We'll share tips for ventilation,masking
DE Cleanup: Tools You'll Need,https://res.cloudinary.com/dbcpfy04c/image/upload/v1747923747/pin_2_8_ljhdbv.webp,cleaning-tips,,https://www.beacleaner.com/how-to-clean-up-diatomaceous-earth?utm_source=pinterest&utm_campaign=de-cleanup-tools-you,2025-05-22,Don't start cleaning up diatomaceous earth without the right tools! This guide lists everything you'll need for a successful cleanup,from vacuums to cloths.  We'll also recommend safety gear to protect yourself.  Be prepared and make the job easier. Click to see our essential tool list! #CleaningTools #DEcleanup #HomeEssentials #Preparation
Diatomaceous Earth & Your Vacuum: Tips,https://res.cloudinary.com/dbcpfy04c/image/upload/v1747923753/pin_2_9_g518rg.webp,cleaning-tips,,https://www.beacleaner.com/how-to-clean-up-diatomaceous-earth?utm_source=pinterest&utm_campaign=diatomaceous-earth-y,2025-05-22,Protect your vacuum *and* clean up DE effectively! This guide provides essential tips for vacuuming diatomaceous earth without causing damage.  Learn about filter types,vacuum settings
DE Cleanup: A Room-by-Room Guide,https://res.cloudinary.com/dbcpfy04c/image/upload/v1747923759/pin_2_10_zz7dkh.webp,home-cleaning-tips,,https://www.beacleaner.com/how-to-clean-up-diatomaceous-earth?utm_source=pinterest&utm_campaign=de-cleanup-a-room-by,2025-05-22,From the kitchen to the bedroom,this guide covers DE cleanup in every room of your house.  We'll provide tailored instructions for different surfaces and situations.  A comprehensive cleanup plan for a spotless home. Click to get started! #RoomByRoom #DEcleanup #HomeCleaning #CleaningGuide
DE Cleanup: Dealing with Large Spills,https://res.cloudinary.com/dbcpfy04c/image/upload/v1747923765/pin_2_11_lwejxw.webp,cleaning-tips,,https://www.beacleaner.com/how-to-clean-up-diatomaceous-earth?utm_source=pinterest&utm_campaign=de-cleanup-dealing-w,2025-05-22,Overwhelmed by a large DE spill? Don't worry! This guide provides a step-by-step plan for tackling even the biggest messes.  We'll cover containment,cleanup
DE Cleanup: Avoiding Dust Inhalation,https://res.cloudinary.com/dbcpfy04c/image/upload/v1747923771/pin_2_12_ljenzn.webp,home-cleaning-tips,,https://www.beacleaner.com/how-to-clean-up-diatomaceous-earth?utm_source=pinterest&utm_campaign=de-cleanup-avoiding-,2025-05-22,Protect your lungs! This guide emphasizes the importance of avoiding dust inhalation during DE cleanup.  We'll share tips for masking,ventilation
DE Cleanup: The Ultimate Checklist,https://res.cloudinary.com/dbcpfy04c/image/upload/v1747923778/pin_2_13_t9dyva.webp,cleaning-tips,,https://www.beacleaner.com/how-to-clean-up-diatomaceous-earth?utm_source=pinterest&utm_campaign=de-cleanup-the-ultim,2025-05-22,Don't forget a thing! This ultimate DE cleanup checklist ensures a thorough and efficient clean.  From gathering supplies to final disposal,we've got you covered.  Stay organized and achieve a spotless result. Click to download the checklist! #Checklist #DEcleanup #CleaningOrganization #HomeCleaning
DE Cleanup: Common Mistakes to Avoid,https://res.cloudinary.com/dbcpfy04c/image/upload/v1747923784/pin_2_14_jsg0ys.webp,cleaning-tips,,https://www.beacleaner.com/how-to-clean-up-diatomaceous-earth?utm_source=pinterest&utm_campaign=de-cleanup-common-mi,2025-05-22,Don't make these common DE cleanup mistakes! This guide highlights pitfalls to avoid,ensuring a safe and effective clean.  Learn from others' errors and save yourself time and frustration. Click to learn what *not* to do! #CleaningMistakes #DEcleanup #AvoidThese #HomeCleaningTips
DE Cleanup: Before & After Photos,https://res.cloudinary.com/dbcpfy04c/image/upload/v1747923790/pin_2_15_iolgsa.webp,cleaning-inspiration,,https://www.beacleaner.com/how-to-clean-up-diatomaceous-earth?utm_source=pinterest&utm_campaign=de-cleanup-before-af,2025-05-22,See the difference! This post showcases before & after photos of DE cleanup projects,inspiring you to tackle your own mess. Visual proof that a thorough clean is possible. Click for motivation and results! #BeforeAndAfter #DEcleanup #CleaningInspiration #HomeTransformation
Title,https://res.cloudinary.com/dbcpfy04c/image/upload/v1747923834/pin_3_1_lhllev.webp,please-provide-the-title-and-keywords-i-need-that-information-to-suggest-a-board-name-once,,https://www.beacleaner.com/how-to-clean-winix-air-purifier?utm_source=pinterest&utm_campaign=title,2025-05-22,Description,Keywords
Winix Air Purifier Cleaning Guide,https://res.cloudinary.com/dbcpfy04c/image/upload/v1747923840/pin_3_2_lsuyfc.webp,air-purifier-tips,,https://www.beacleaner.com/how-to-clean-winix-air-purifier?utm_source=pinterest&utm_campaign=winix-air-purifier-c,2025-05-22,Is your Winix air purifier struggling to keep up? Don't replace it,revive it! This step-by-step guide shows you how to deep clean your Winix
Winix Filter Cleaning: Breathe Easy!,https://res.cloudinary.com/dbcpfy04c/image/upload/v1747923848/pin_3_3_eycou6.webp,air-purifier-tips,,https://www.beacleaner.com/how-to-clean-winix-air-purifier?utm_source=pinterest&utm_campaign=winix-filter-cleanin,2025-05-22,Don't let a dirty filter compromise your health! This pin highlights the importance of regularly cleaning your Winix air purifier's filters. We break down the process into simple steps,so even beginners can tackle it. Imagine a home filled with fresh
Deep Clean Your Winix: Step-by-Step,https://res.cloudinary.com/dbcpfy04c/image/upload/v1747923854/pin_3_4_o3favq.webp,bag-cleaning-tips,,https://www.beacleaner.com/how-to-clean-winix-air-purifier?utm_source=pinterest&utm_campaign=deep-clean-your-wini,2025-05-22,Feeling stuffy? A dirty Winix air purifier could be the culprit! This pin focuses on a complete deep clean,covering every part of your unit.  We'll show you how to disassemble
Winix Pre-Filter Cleaning: Quick Guide,https://res.cloudinary.com/dbcpfy04c/image/upload/v1747923862/pin_3_5_oaqpdi.webp,air-quality-tips,,https://www.beacleaner.com/how-to-clean-winix-air-purifier?utm_source=pinterest&utm_campaign=winix-pre-filter-cle,2025-05-22,Don't underestimate the power of the pre-filter! This pin focuses specifically on cleaning the pre-filter,a simple task that makes a huge difference.  We provide a quick and easy guide to keep this essential component functioning optimally.  Prevent dust and allergens from clogging your system. Click to learn how in minutes! #WinixPreFilter #EasyCleaning #DustAllergies #AirQuality
Winix HEPA Filter: Cleaning Secrets,https://res.cloudinary.com/dbcpfy04c/image/upload/v1747923868/pin_3_6_ldciiw.webp,air-purifier-tips,,https://www.beacleaner.com/how-to-clean-winix-air-purifier?utm_source=pinterest&utm_campaign=winix-hepa-filter-cl,2025-05-22,Unlock the secrets to cleaning your Winix HEPA filter! This pin dives into the specifics of HEPA filter maintenance,ensuring it effectively captures microscopic particles.  Protect your family from pollutants and breathe with confidence.  Learn the do's and don'ts of HEPA filter cleaning. Click for the full guide! #WinixHEPAFilter #HEPAFilterCleaning #PollutionControl #HealthyLiving
