Title,Media URL,Pinterest board,Thumbnail,Link,Publish date,Description,Keywords
Title,https://res.cloudinary.com/dbcpfy04c/image/upload/v1747693061/pin_1_1_luabem.webp,please-provide-the-title-and-keywords-i-need-that-information-to-suggest-a-board-name-once,,https://www.beacleaner.com/how-to-clean-burnt-smell-from-microwave?utm_source=pinterest&utm_campaign=title,2025-05-19,Description,Keywords
Bye Bye Burnt Smell!,https://res.cloudinary.com/dbcpfy04c/image/upload/v1747693068/pin_1_2_ub1clu.webp,kitchen-cleaning-tips,,https://www.beacleaner.com/how-to-clean-burnt-smell-from-microwave?utm_source=pinterest&utm_campaign=bye-bye-burnt-smell,2025-05-19,"Ugh, that burnt popcorn smell… we've all been there! Don't let a kitchen mishap linger. This guide reveals simple, effective ways to banish that awful odor from your microwave FAST. From lemon steam to baking soda magic, we've got you covered. Reclaim your kitchen & enjoy fresh, delicious meals again! Click to learn how to neutralize the smell and prevent it from happening again. Don't suffer through another meal with a lingering burnt aroma!","Microwave cleaning,burnt smell,kitchen hacks,odor removal #MicrowaveHacks #CleanKitchen #BurntSmell #HomeCleaning"
Microwave Smell Gone in 5 Minutes!,https://res.cloudinary.com/dbcpfy04c/image/upload/v1747693075/pin_1_3_kzofgt.webp,cleaning-tips,,https://www.beacleaner.com/how-to-clean-burnt-smell-from-microwave?utm_source=pinterest&utm_campaign=microwave-smell-gone,2025-05-19,"Is your microwave haunted by the ghost of burnt food? 👻 Don't replace it – revive it! This quick & easy tutorial shows you how to eliminate stubborn burnt smells in just 5 minutes. We're sharing the best DIY solutions using ingredients you probably already have. Say goodbye to embarrassing kitchen odors and hello to a fresh, clean microwave! Click to learn more and breathe easy.","Quick cleaning,microwave odor,DIY cleaning,home remedies #MicrowaveCleaning #KitchenTips #SmellRemoval #EasyCleaning"
Lemon Steam: Microwave Deodorizer,https://res.cloudinary.com/dbcpfy04c/image/upload/v1747693082/pin_1_4_nhkiuv.webp,kitchen-cleaning-tips,,https://www.beacleaner.com/how-to-clean-burnt-smell-from-microwave?utm_source=pinterest&utm_campaign=lemon-steam-microwav,2025-05-19,"Brighten your kitchen AND your microwave! 🍋 This pin shows how a simple lemon steam can work wonders on burnt smells. It's a natural, effective, and wonderfully fragrant way to freshen up your appliance.  Learn the step-by-step process for a sparkling clean and odor-free microwave.  Don't let a burnt smell ruin your day – click to learn this amazing trick!","Lemon cleaning,microwave steam,natural cleaning,odor neutralizer #LemonClean #MicrowaveTips #NaturalCleaning #KitchenHacks"
Baking Soda to the Rescue!,https://res.cloudinary.com/dbcpfy04c/image/upload/v1747693089/pin_1_5_mx32sc.webp,cleaning-tips,,https://www.beacleaner.com/how-to-clean-burnt-smell-from-microwave?utm_source=pinterest&utm_campaign=baking-soda-to-the-r,2025-05-19,Don't throw away that baking soda! 📦 It's a powerhouse for eliminating burnt smells in your microwave. This pin details how to use baking soda to absorb odors and leave your microwave smelling fresh.  It's a budget-friendly and eco-friendly solution you'll love. Click to discover the secret to a truly clean microwave!  Stop living with that awful smell!,"Baking soda cleaning,microwave deodorizing,eco-friendly cleaning,odor absorber #BakingSodaClean #MicrowaveHacks #EcoCleaning #KitchenCleaning"
Vinegar Power: Burnt Smell Be Gone!,https://res.cloudinary.com/dbcpfy04c/image/upload/v1747693101/pin_1_6_cugstz.webp,cleaning-tips,,https://www.beacleaner.com/how-to-clean-burnt-smell-from-microwave?utm_source=pinterest&utm_campaign=vinegar-power-burnt-,2025-05-19,"Vinegar isn't just for salads! 🥗 Discover how this kitchen staple can cut through burnt smells in your microwave. This pin provides a simple, effective method for neutralizing odors and leaving your microwave sparkling clean.  It's a surprisingly powerful solution! Click to learn how to use vinegar to restore freshness to your kitchen.","Vinegar cleaning,microwave cleaning,odor removal,kitchen cleaning tips #VinegarClean #MicrowaveTips #KitchenHacks #SmellRemoval"
Prevent Burnt Smells: Microwave Tips,https://res.cloudinary.com/dbcpfy04c/image/upload/v1747693107/pin_1_7_xaii7d.webp,kitchen-tips,,https://www.beacleaner.com/how-to-clean-burnt-smell-from-microwave?utm_source=pinterest&utm_campaign=prevent-burnt-smells,2025-05-19,"Don't just *clean* the smell, prevent it! This pin highlights tips to avoid burning food in the microwave in the first place. Learn about proper covering techniques, cooking times, and more.  A little prevention goes a long way! Click to read the full article and enjoy stress-free microwave cooking.","Microwave safety,prevent burnt food,cooking tips,kitchen prevention #MicrowaveSafety #CookingTips #KitchenHacks #PreventativeCleaning"
Deep Clean Your Microwave (Smell Included!),https://res.cloudinary.com/dbcpfy04c/image/upload/v1747693114/pin_1_8_md138j.webp,kitchen-cleaning-tips,,https://www.beacleaner.com/how-to-clean-burnt-smell-from-microwave?utm_source=pinterest&utm_campaign=deep-clean-your-micr,2025-05-19,"It's time for a microwave makeover! ✨ This pin showcases a complete cleaning routine, including tackling burnt smells. We'll guide you through every step, from wiping down the interior to eliminating lingering odors.  A clean microwave is a happy microwave! Click to learn how to achieve a sparkling, fresh appliance.","Deep cleaning,microwave cleaning,kitchen appliance,odor elimination #DeepClean #MicrowaveCleaning #KitchenAppliance #HomeCleaning"
DIY Microwave Cleaning Solution,https://res.cloudinary.com/dbcpfy04c/image/upload/v1747693121/pin_1_9_doquiy.webp,cleaning-tips,,https://www.beacleaner.com/how-to-clean-burnt-smell-from-microwave?utm_source=pinterest&utm_campaign=diy-microwave-cleani,2025-05-19,"Skip the harsh chemicals! 🚫 This pin features a simple DIY cleaning solution for your microwave that effectively removes burnt smells and grime. It's safe, natural, and budget-friendly. Click to learn the recipe and enjoy a sparkling clean microwave without the worry.","DIY cleaner,microwave solution,natural cleaning,safe cleaning #DIYCleaning #NaturalCleaner #MicrowaveTips #SafeCleaning"
The Ultimate Microwave Smell Guide,https://res.cloudinary.com/dbcpfy04c/image/upload/v1747693129/pin_1_10_o29zef.webp,cleaning-tips-ideas,,https://www.beacleaner.com/how-to-clean-burnt-smell-from-microwave?utm_source=pinterest&utm_campaign=the-ultimate-microwa,2025-05-19,"Struggling with a stubborn burnt smell? 😫 This pin is your ultimate resource! We cover all the best methods for eliminating odors, from lemon steam to baking soda and vinegar.  Find the solution that works best for you! Click to read the full guide and reclaim your kitchen.","Microwave guide,burnt smell,cleaning methods,odor removal tips #MicrowaveGuide #BurntSmell #CleaningTips #OdorRemoval"
Microwave Cleaning: Before & After,https://res.cloudinary.com/dbcpfy04c/image/upload/v1747693135/pin_1_11_xqbhmi.webp,cleaning-tips,,https://www.beacleaner.com/how-to-clean-burnt-smell-from-microwave?utm_source=pinterest&utm_campaign=microwave-cleaning-b,2025-05-19,See the amazing results! 🤩 This pin features a stunning before & after transformation of a burnt-smelling microwave. It's proof that our methods work! Click to read the full article and learn how to achieve the same sparkling clean results in your own kitchen.,"Before and after,microwave cleaning,transformation,cleaning results #BeforeAndAfter #MicrowaveCleaning #KitchenTransformation #CleaningMotivation"
Quick Tip: Eliminate Microwave Odors,https://res.cloudinary.com/dbcpfy04c/image/upload/v1747693146/pin_1_12_pehb7q.webp,cleaning-tips,,https://www.beacleaner.com/how-to-clean-burnt-smell-from-microwave?utm_source=pinterest&utm_campaign=quick-tip-eliminate-,2025-05-19,Need a fast fix? 💨 This pin shares a super quick tip for eliminating microwave odors. It's perfect for busy schedules! Click to learn the simple trick and enjoy a fresh-smelling kitchen in minutes.,"Quick tip,microwave odor,fast cleaning,kitchen hack #QuickTip #MicrowaveOdor #FastCleaning #KitchenHack"
Is Your Microwave Making You Sick?,https://res.cloudinary.com/dbcpfy04c/image/upload/v1747693152/pin_1_13_v2lijb.webp,kitchen-health-tips,,https://www.beacleaner.com/how-to-clean-burnt-smell-from-microwave?utm_source=pinterest&utm_campaign=is-your-microwave-ma,2025-05-19,Lingering smells can affect your health! 🤢 This pin explains how burnt smells in your microwave can be harmful and why it's important to eliminate them.  Protect your family and enjoy a healthy kitchen! Click to learn more and take action.,"Health and cleaning,microwave safety,odor effects,kitchen health #HealthAndCleaning #MicrowaveSafety #OdorEffects #KitchenHealth"
Microwave Cleaning Checklist,https://res.cloudinary.com/dbcpfy04c/image/upload/v1747693158/pin_1_14_bqcs14.webp,cleaning-tips,,https://www.beacleaner.com/how-to-clean-burnt-smell-from-microwave?utm_source=pinterest&utm_campaign=microwave-cleaning-c,2025-05-19,Stay on top of your cleaning! ✅ This pin provides a handy checklist for keeping your microwave clean and odor-free.  It's a simple way to maintain a fresh kitchen. Click to download the checklist and make microwave cleaning a breeze.,"Cleaning checklist,microwave maintenance,kitchen organization,cleaning schedule #CleaningChecklist #MicrowaveMaintenance #KitchenOrganization #CleaningSchedule"
Don't Live With That Smell!,https://res.cloudinary.com/dbcpfy04c/image/upload/v1747693163/pin_1_15_yp0tfv.webp,kitchen-cleaning-tips,,https://www.beacleaner.com/how-to-clean-burnt-smell-from-microwave?utm_source=pinterest&utm_campaign=dont-live-with-that-,2025-05-19,You deserve a fresh-smelling kitchen! 🌸 This pin is a motivational reminder to tackle that burnt smell in your microwave.  It's easier than you think! Click to read the full article and enjoy a more pleasant cooking experience.,"Motivation,kitchen cleaning,fresh kitchen,odor removal #Motivation #KitchenCleaning #FreshKitchen #OdorRemoval"
The Science Behind Burnt Smells,https://res.cloudinary.com/dbcpfy04c/image/upload/v1747693171/pin_1_16_enoxwn.webp,cleaning-tips,,https://www.beacleaner.com/how-to-clean-burnt-smell-from-microwave?utm_source=pinterest&utm_campaign=the-science-behind-b,2025-05-19,Ever wonder *why* burnt food smells so bad? 🤔 This pin delves into the science behind those unpleasant odors and explains how our cleaning methods work to neutralize them.  Learn something new while you clean! Click to read the full article.,"Science of cleaning,burnt smell,odor neutralization,kitchen science #ScienceOfCleaning #BurntSmell #OdorNeutralization #KitchenScience"
Microwave Cleaning for Beginners,https://res.cloudinary.com/dbcpfy04c/image/upload/v1747693179/pin_1_17_ovwdaa.webp,cleaning-tips,,https://www.beacleaner.com/how-to-clean-burnt-smell-from-microwave?utm_source=pinterest&utm_campaign=microwave-cleaning-f,2025-05-19,"New to cleaning? No problem! 🧑‍🍳 This pin provides a step-by-step guide to cleaning a burnt-smelling microwave, perfect for beginners.  We'll walk you through every step. Click to learn how to achieve a sparkling clean appliance with ease.","Beginner cleaning,microwave cleaning,step-by-step guide,easy cleaning #BeginnerCleaning #MicrowaveCleaning #StepByStep #EasyCleaning"
Coffee to the Rescue! (Microwave Hack),https://res.cloudinary.com/dbcpfy04c/image/upload/v1747693185/pin_1_18_w8rojm.webp,kitchen-tips,,https://www.beacleaner.com/how-to-clean-burnt-smell-from-microwave?utm_source=pinterest&utm_campaign=coffee-to-the-rescue,2025-05-19,Love coffee? ☕️ You'll love this microwave hack! Learn how coffee grounds can help absorb burnt smells and leave your microwave smelling amazing. Click to discover this surprising cleaning trick.,"Coffee cleaning,microwave hack,odor absorber,kitchen trick #CoffeeCleaning #MicrowaveHack #OdorAbsorber #KitchenTrick"
Microwave Cleaning: Common Mistakes,https://res.cloudinary.com/dbcpfy04c/image/upload/v1747693192/pin_1_19_flqbhy.webp,cleaning-tips,,https://www.beacleaner.com/how-to-clean-burnt-smell-from-microwave?utm_source=pinterest&utm_campaign=microwave-cleaning-c,2025-05-19,Avoid these pitfalls! ⚠️ This pin highlights common mistakes people make when cleaning their microwave and how to avoid them.  Learn from our expertise and achieve the best results. Click to read the full article.,"Microwave mistakes,cleaning errors,kitchen tips,avoiding errors #MicrowaveMistakes #CleaningErrors #KitchenTips #AvoidingErrors"
"Sparkling Microwave, Happy Life!",https://res.cloudinary.com/dbcpfy04c/image/upload/v1747693199/pin_1_20_s1w3ii.webp,kitchen-cleaning-tips,,https://www.beacleaner.com/how-to-clean-burnt-smell-from-microwave?utm_source=pinterest&utm_campaign=sparkling-microwave-,2025-05-19,A clean kitchen = a happy life! ✨ This pin emphasizes the positive impact of a clean microwave on your overall well-being.  It's more than just cleaning – it's self-care! Click to read the full article and create a more enjoyable cooking space.,"Happy kitchen,clean microwave,self-care,kitchen well-being #HappyKitchen #CleanMicrowave #SelfCare #KitchenWellbeing"
Microwave Cleaning: Time-Lapse Video,https://res.cloudinary.com/dbcpfy04c/image/upload/v1747693205/pin_1_21_hc5kbc.webp,cleaning-tips,,https://www.beacleaner.com/how-to-clean-burnt-smell-from-microwave?utm_source=pinterest&utm_campaign=microwave-cleaning-t,2025-05-19,Watch the magic happen! ⏱️ This pin features a time-lapse video of a burnt-smelling microwave being transformed into a sparkling clean appliance.  It's visually satisfying and inspiring! Click to watch the video and learn how to achieve the same results.,"Time-lapse,microwave cleaning,video tutorial,cleaning inspiration #TimeLapse #MicrowaveCleaning #VideoTutorial #CleaningInspiration"
The Easiest Way to Clean Your Microwave,https://res.cloudinary.com/dbcpfy04c/image/upload/v1747693213/pin_1_22_u2kmup.webp,cleaning-tips,,https://www.beacleaner.com/how-to-clean-burnt-smell-from-microwave?utm_source=pinterest&utm_campaign=the-easiest-way-to-c,2025-05-19,"Seriously, it's SO easy! 🙌 This pin highlights the simplest and most effective method for cleaning a burnt-smelling microwave.  No scrubbing required! Click to learn the secret and enjoy a hassle-free cleaning experience.","Easy cleaning,microwave cleaning,simple method,hassle-free cleaning #EasyCleaning #MicrowaveCleaning #SimpleMethod #HassleFreeCleaning"
Microwave Cleaning: FAQ,https://res.cloudinary.com/dbcpfy04c/image/upload/v1747693222/pin_1_23_qekhep.webp,cleaning-tips,,https://www.beacleaner.com/how-to-clean-burnt-smell-from-microwave?utm_source=pinterest&utm_campaign=microwave-cleaning-f,2025-05-19,Got questions? We've got answers! ❓ This pin addresses frequently asked questions about cleaning a burnt-smelling microwave.  Get all your concerns addressed in one place. Click to read the FAQ and become a microwave cleaning expert.,"FAQ,microwave cleaning,questions and answers,cleaning guide #FAQ #MicrowaveCleaning #QuestionsAndAnswers #CleaningGuide"
"Don't Replace It, Restore It!",https://res.cloudinary.com/dbcpfy04c/image/upload/v1747693228/pin_1_24_iebikf.webp,appliance-tips,,https://www.beacleaner.com/how-to-clean-burnt-smell-from-microwave?utm_source=pinterest&utm_campaign=dont-replace-it-rest,2025-05-19,Before you buy a new microwave… 💰 This pin encourages readers to try our cleaning methods before replacing their appliance.  Save money and extend the life of your microwave! Click to learn how to restore your appliance to its former glory.,"Restore microwave,save money,appliance repair,cleaning solutions #RestoreMicrowave #SaveMoney #ApplianceRepair #CleaningSolutions"
Microwave Cleaning: Share Your Results!,https://res.cloudinary.com/dbcpfy04c/image/upload/v1747693234/pin_1_25_db3jji.webp,cleaning-tips,,https://www.beacleaner.com/how-to-clean-burnt-smell-from-microwave?utm_source=pinterest&utm_campaign=microwave-cleaning-s,2025-05-19,Show us your sparkling microwaves! 📸 This pin encourages readers to share their before & after photos of their cleaned microwaves.  Join the cleaning community and inspire others! Click to read the article and share your success.,"Share results,cleaning community,microwave cleaning,before and after #ShareResults #CleaningCommunity #MicrowaveCleaning #BeforeAndAfter"
Title,https://res.cloudinary.com/dbcpfy04c/image/upload/v1747693275/pin_2_1_n5sue9.webp,please-provide-the-title-and-keywords-i-need-that-information-to-suggest-a-board-name-once,,https://www.beacleaner.com/how-to-clean-a-creek?utm_source=pinterest&utm_campaign=title,2025-05-19,Description,Keywords
Clean Creek,https://res.cloudinary.com/dbcpfy04c/image/upload/v1747693283/pin_2_2_da93tb.webp,outdoor-cleanup-ideas,,https://www.beacleaner.com/how-to-clean-a-creek?utm_source=pinterest&utm_campaign=clean-creek,2025-05-19,Happy Heart!,Want to give back to nature & enjoy pristine waterways? Our guide shows you exactly how to clean a creek safely & effectively! From organizing a cleanup to proper waste disposal
Creek Cleanup 101,https://res.cloudinary.com/dbcpfy04c/image/upload/v1747693292/pin_2_3_kpbebq.webp,outdoor-tips,,https://www.beacleaner.com/how-to-clean-a-creek?utm_source=pinterest&utm_campaign=creek-cleanup-101,2025-05-19,Is your local creek looking a little worse for wear? Don't despair! This guide breaks down creek cleaning into manageable steps. We'll help you assess the situation,gather the right supplies (think gloves
Safety First: Creek Cleaning,https://res.cloudinary.com/dbcpfy04c/image/upload/v1747693299/pin_2_4_qga4g0.webp,outdoor-safety-tips,,https://www.beacleaner.com/how-to-clean-a-creek?utm_source=pinterest&utm_campaign=safety-first-creek-c,2025-05-19,Creek cleaning is rewarding,but safety is paramount! This pin highlights essential safety precautions – from avoiding slippery rocks to identifying potential hazards. We cover what to wear
Organize a Creek Cleanup!,https://res.cloudinary.com/dbcpfy04c/image/upload/v1747693304/pin_2_5_onbobk.webp,volunteer-ideas,,https://www.beacleaner.com/how-to-clean-a-creek?utm_source=pinterest&utm_campaign=organize-a-creek-cle,2025-05-19,Ready to rally your community? This pin focuses on organizing a successful creek cleanup event. We share tips on permits,volunteer recruitment
What to Wear Creek Cleaning,https://res.cloudinary.com/dbcpfy04c/image/upload/v1747693311/pin_2_6_ci3hmq.webp,outdoor-tips,,https://www.beacleaner.com/how-to-clean-a-creek?utm_source=pinterest&utm_campaign=what-to-wear-creek-c,2025-05-19,Don't head to the creek unprepared! This pin details the best clothing & gear for a comfortable & safe cleanup. Think waterproof boots,durable gloves
Proper Waste Disposal Guide,https://res.cloudinary.com/dbcpfy04c/image/upload/v1747693321/pin_2_7_p7sj0v.webp,home-safety-tips,,https://www.beacleaner.com/how-to-clean-a-creek?utm_source=pinterest&utm_campaign=proper-waste-disposa,2025-05-19,Cleaning a creek generates waste. This pin explains how to properly dispose of the trash you collect. We cover sorting recyclables,handling hazardous materials
Creek Cleanup Supplies Checklist,https://res.cloudinary.com/dbcpfy04c/image/upload/v1747693327/pin_2_8_zwz5bs.webp,outdoor-cleanup-ideas,,https://www.beacleaner.com/how-to-clean-a-creek?utm_source=pinterest&utm_campaign=creek-cleanup-suppli,2025-05-19,Don't start your creek cleanup without the essentials! This pin provides a comprehensive checklist of supplies you'll need,including trash bags
Before & After: Creek Transformation,https://res.cloudinary.com/dbcpfy04c/image/upload/v1747693337/pin_2_9_van3so.webp,environmental-inspiration,,https://www.beacleaner.com/how-to-clean-a-creek?utm_source=pinterest&utm_campaign=before-after-creek-t,2025-05-19,Witness the incredible impact of a creek cleanup! This pin showcases stunning before & after photos,demonstrating the transformative power of community action. Seeing the difference you can make is incredibly motivating. Inspire others to get involved & restore the beauty of our waterways. #CreekTransformation #BeforeAndAfter #CleanupResults #EnvironmentalImpact
Creek Cleanup for Beginners,https://res.cloudinary.com/dbcpfy04c/image/upload/v1747693345/pin_2_10_ylqcag.webp,conservation-ideas,,https://www.beacleaner.com/how-to-clean-a-creek?utm_source=pinterest&utm_campaign=creek-cleanup-for-be,2025-05-19,New to creek cleaning? No problem! This pin is a perfect starting point for beginners. We break down the process into simple,easy-to-follow steps. You don't need to be an expert to make a difference. Join the movement & help us create cleaner
Dealing with Large Debris,https://res.cloudinary.com/dbcpfy04c/image/upload/v1747693351/pin_2_11_mdkbdx.webp,home-cleanup-tips,,https://www.beacleaner.com/how-to-clean-a-creek?utm_source=pinterest&utm_campaign=dealing-with-large-d,2025-05-19,Found a big item in the creek? This pin provides guidance on safely removing large debris like tires,appliances
Identifying Creek Pollution Sources,https://res.cloudinary.com/dbcpfy04c/image/upload/v1747693358/pin_2_12_o7lfhq.webp,water-quality-tips,,https://www.beacleaner.com/how-to-clean-a-creek?utm_source=pinterest&utm_campaign=identifying-creek-po,2025-05-19,Want to prevent future pollution? This pin helps you identify common sources of creek pollution,such as runoff
Creek Cleanup & Erosion Control,https://res.cloudinary.com/dbcpfy04c/image/upload/v1747693366/pin_2_13_vxpuxe.webp,watershed-ideas,,https://www.beacleaner.com/how-to-clean-a-creek?utm_source=pinterest&utm_campaign=creek-cleanup-erosio,2025-05-19,Cleaning a creek can sometimes reveal erosion issues. This pin discusses how to identify & address erosion problems,helping to stabilize creek banks & prevent further damage. Protecting the creek bed is crucial for long-term health. #ErosionControl #CreekBankStabilization #WatershedHealth #LandManagement
The Benefits of a Clean Creek,https://res.cloudinary.com/dbcpfy04c/image/upload/v1747693374/pin_2_14_qvlfol.webp,outdoor-inspiration,,https://www.beacleaner.com/how-to-clean-a-creek?utm_source=pinterest&utm_campaign=the-benefits-of-a-cl,2025-05-19,A clean creek isn't just aesthetically pleasing; it offers numerous benefits! This pin highlights the ecological,recreational
Creek Cleanup & Water Quality,https://res.cloudinary.com/dbcpfy04c/image/upload/v1747693381/pin_2_15_bufogz.webp,watershed-ideas,,https://www.beacleaner.com/how-to-clean-a-creek?utm_source=pinterest&utm_campaign=creek-cleanup-water-,2025-05-19,Learn how creek cleanups directly improve water quality! This pin explains the link between trash removal & healthier aquatic ecosystems. Removing pollutants helps protect fish,plants
Creek Cleanup: Before You Start,https://res.cloudinary.com/dbcpfy04c/image/upload/v1747693391/pin_2_16_l9hpu5.webp,outdoor-tips,,https://www.beacleaner.com/how-to-clean-a-creek?utm_source=pinterest&utm_campaign=creek-cleanup-before,2025-05-19,Don't jump in without a plan! This pin outlines essential pre-cleanup steps,including scouting the area
Creek Cleanup: Post-Cleanup Steps,https://res.cloudinary.com/dbcpfy04c/image/upload/v1747693399/pin_2_17_d2zmhk.webp,outdoor-tips,,https://www.beacleaner.com/how-to-clean-a-creek?utm_source=pinterest&utm_campaign=creek-cleanup-post-c,2025-05-19,The cleanup doesn't end with trash removal! This pin covers important post-cleanup tasks,such as reporting your findings
Creek Cleanup: Dealing with Hazardous Waste,https://res.cloudinary.com/dbcpfy04c/image/upload/v1747693407/pin_2_18_gjpdst.webp,outdoor-tips,,https://www.beacleaner.com/how-to-clean-a-creek?utm_source=pinterest&utm_campaign=creek-cleanup-dealin,2025-05-19,What do you do if you find hazardous waste in the creek? This pin provides guidance on safely handling & disposing of materials like chemicals,batteries
Creek Cleanup: Long-Term Solutions,https://res.cloudinary.com/dbcpfy04c/image/upload/v1747693414/pin_2_19_ekufjy.webp,outdoor-tips,,https://www.beacleaner.com/how-to-clean-a-creek?utm_source=pinterest&utm_campaign=creek-cleanup-long-t,2025-05-19,Cleaning a creek is a great start,but what about long-term solutions? This pin explores strategies for preventing future pollution & protecting our waterways for generations to come. Let's address the root causes of the problem. #LongTermSolutions #PollutionPrevention #SustainablePractices #WatershedManagement
Creek Cleanup: Tools You Didn't Know You Needed,https://res.cloudinary.com/dbcpfy04c/image/upload/v1747693422/pin_2_20_rvjtbj.webp,outdoor-tips,,https://www.beacleaner.com/how-to-clean-a-creek?utm_source=pinterest&utm_campaign=creek-cleanup-tools-,2025-05-19,Beyond the basics,these tools can make your creek cleanup more efficient and effective! This pin showcases specialized equipment like grabbers
Title,https://res.cloudinary.com/dbcpfy04c/image/upload/v1747693466/pin_3_1_p6lla8.webp,please-provide-the-title-and-keywords-i-need-that-information-to-suggest-a-board-name-once,,https://www.beacleaner.com/how-to-clean-an-ibc-tote?utm_source=pinterest&utm_campaign=title,2025-05-19,Description,Keywords
