Title,Media URL,Pinterest board,Thumbnail,Link,Publish date,Description,Keywords
Say Goodbye to Water Spots on Glass Tile,https://res.cloudinary.com/dbcpfy04c/image/upload/v1748017747/pin_3_17_r4o7u7.webp,bathroom-cleaning-tips,,https://www.beacleaner.com/how-to-clean-glass-tile-shower?utm_source=pinterest&utm_campaign=say-goodbye-to-water,2025-05-23,Water spots ruining your glass tile shower? This post provides a simple solution for removing water spots and restoring your shower's clarity.  Enjoy a streak-free,sparkling clean shower every time. #WaterSpotRemoval #GlassTileCleaning #ShowerClarity #CleaningSolutions
Title,https://res.cloudinary.com/dbcpfy04c/image/upload/v1748017796/pin_4_1_lwcnlf.webp,please-provide-the-title-and-keywords-i-need-that-information-to-suggest-a-board-name-once,,https://www.beacleaner.com/how-to-clean-green-machine-head?utm_source=pinterest&utm_campaign=title,2025-05-23,Description,Keywords
Sparkling Green Machine Head: Easy Guide,https://res.cloudinary.com/dbcpfy04c/image/upload/v1748017802/pin_4_2_dygmuy.webp,cleaning-tips,,https://www.beacleaner.com/how-to-clean-green-machine-head?utm_source=pinterest&utm_campaign=sparkling-green-mach,2025-05-23,"Is your Green Machine head looking dull and dirty? Don't let grime ruin your cleaning power! This step-by-step guide shows you how to deep clean your Bissell Green Machine head using eco-friendly methods. Restore its suction, eliminate odors, and extend its lifespan. We'll cover everything from removing hair and debris to tackling stubborn stains. A clean head means a cleaner home, and a healthier family! Click to learn how to breathe new life into your favorite cleaning tool. You deserve a spotless clean without harsh chemicals!","Green Machine,Bissell,Cleaning,Head Cleaning"
Bissell Green Machine Head: Deep Clean Secrets,https://res.cloudinary.com/dbcpfy04c/image/upload/v1748017811/pin_4_3_vxtvpr.webp,deep-cleaning-tips,,https://www.beacleaner.com/how-to-clean-green-machine-head?utm_source=pinterest&utm_campaign=bissell-green-machin,2025-05-23,"Feeling frustrated with a lackluster clean? The secret might be your Green Machine head! This guide reveals the hidden grime buildup and how to effortlessly remove it. We'll show you how to disassemble, clean, and reassemble your head for optimal performance. Say goodbye to dirty water streaks and hello to a truly fresh clean. Don't replace it, revive it! Learn how to save money and keep your home sparkling. Click now for a step-by-step tutorial!","Deep Cleaning,Bissell Green Machine,Cleaning Hacks,DIY Cleaning"
Green Machine Head Cleaning: Eco-Friendly Tips,https://res.cloudinary.com/dbcpfy04c/image/upload/v1748017817/pin_4_4_cccy7n.webp,green-cleaning-tips,,https://www.beacleaner.com/how-to-clean-green-machine-head?utm_source=pinterest&utm_campaign=green-machine-head-c,2025-05-23,"Want a powerful clean without harming the planet? This guide focuses on using natural, eco-friendly solutions to clean your Bissell Green Machine head. We'll share recipes for homemade cleaning solutions that are safe for your family and the environment.  Discover how to effectively remove dirt, grime, and odors without harsh chemicals.  A clean home *and* a clear conscience? Yes, please! Click to learn more and make a sustainable choice.","Eco Friendly Cleaning,Natural Cleaning,Green Cleaning,Bissell"
Revive Your Green Machine: Head Cleaning 101,https://res.cloudinary.com/dbcpfy04c/image/upload/v1748017825/pin_4_5_hkjdph.webp,cleaning-tips,,https://www.beacleaner.com/how-to-clean-green-machine-head?utm_source=pinterest&utm_campaign=revive-your-green-ma,2025-05-23,"Don't let a dirty Green Machine head compromise your cleaning results! This beginner-friendly guide walks you through the entire cleaning process, from start to finish. We'll break down each step with clear instructions and helpful photos.  You'll be amazed at how much dirt and debris can accumulate!  Restore your machine's suction and enjoy a truly deep clean. Click to learn how to keep your Green Machine performing at its best.","Cleaning Guide,Bissell,Green Machine Head,DIY"
Green Machine Head: Hair & Debris Removal,https://res.cloudinary.com/dbcpfy04c/image/upload/v1748017831/pin_4_6_t8umyx.webp,green-cleaning-tips,,https://www.beacleaner.com/how-to-clean-green-machine-head?utm_source=pinterest&utm_campaign=green-machine-head-h,2025-05-23,"Tired of constantly picking hair and debris off your Green Machine head? This pin focuses specifically on tackling those pesky build-ups. We'll show you the best tools and techniques for removing tangled hair, pet fur, and other debris.  A clean head means better suction and a more hygienic clean.  Don't let hair ruin your cleaning experience! Click to learn our simple, effective methods.","Hair Removal,Bissell,Green Machine,Cleaning Tips"
Bissell Green Machine Head: Before & After!,https://res.cloudinary.com/dbcpfy04c/image/upload/v1748017836/pin_4_7_uhtx5v.webp,deep-cleaning-tips,,https://www.beacleaner.com/how-to-clean-green-machine-head?utm_source=pinterest&utm_campaign=bissell-green-machin,2025-05-23,Witness the incredible transformation! This pin showcases stunning before-and-after photos of a dirty Green Machine head being restored to its former glory.  See the dramatic difference a good cleaning can make.  Inspired?  Click to learn how you can achieve these results yourself!  A clean head is a happy head (and a happy home!).,"Before and After,Cleaning Motivation,Bissell,Green Machine"
Extend Your Green Machine's Life: Head Care,https://res.cloudinary.com/dbcpfy04c/image/upload/v1748017842/pin_4_8_wvhppi.webp,cleaning-tips,,https://www.beacleaner.com/how-to-clean-green-machine-head?utm_source=pinterest&utm_campaign=extend-your-green-ma,2025-05-23,"Want to keep your Bissell Green Machine running smoothly for years to come? This guide focuses on preventative maintenance and proper head care.  We'll share tips on how to avoid build-up, prevent damage, and extend the lifespan of your machine.  A little care goes a long way! Click to learn how to protect your investment and enjoy a consistently clean home.","Maintenance,Bissell,Green Machine,Cleaning Tools"
Green Machine Head: Stubborn Stain Removal,https://res.cloudinary.com/dbcpfy04c/image/upload/v1748017846/pin_4_9_fbgdmj.webp,green-cleaning-tips,,https://www.beacleaner.com/how-to-clean-green-machine-head?utm_source=pinterest&utm_campaign=green-machine-head-s,2025-05-23,"Got stubborn stains on your Green Machine head? Don't worry, we've got you covered! This pin focuses on tackling tough stains with effective, yet gentle, cleaning solutions.  We'll share our secret weapon for removing dirt, grime, and discoloration.  Say goodbye to unsightly stains and hello to a sparkling clean head! Click to learn our stain-busting techniques.","Stain Removal,Bissell,Green Machine,Cleaning Solutions"
DIY Green Machine Head Cleaning Solution,https://res.cloudinary.com/dbcpfy04c/image/upload/v1748017852/pin_4_10_nre1qx.webp,cleaning-tips,,https://www.beacleaner.com/how-to-clean-green-machine-head?utm_source=pinterest&utm_campaign=diy-green-machine-he,2025-05-23,"Skip the harsh chemicals! This pin provides a simple recipe for a homemade cleaning solution specifically designed for your Bissell Green Machine head.  It's effective, eco-friendly, and budget-friendly.  You'll be amazed at how well it works! Click to learn how to make your own cleaning solution and enjoy a healthier clean.","DIY Cleaning Solution,Homemade Cleaner,Bissell,Green Machine"
Is Your Green Machine Head Dirty? Find Out!,https://res.cloudinary.com/dbcpfy04c/image/upload/v1748017858/pin_4_11_ztsfa3.webp,cleaning-tips,,https://www.beacleaner.com/how-to-clean-green-machine-head?utm_source=pinterest&utm_campaign=is-your-green-machin,2025-05-23,"Not sure if your Green Machine head needs cleaning? This pin highlights the common signs of a dirty head, such as reduced suction, unpleasant odors, and dirty water streaks.  Don't ignore these warning signs!  A dirty head can compromise your cleaning results and even damage your machine. Click to learn how to diagnose the problem and get it fixed.","Troubleshooting,Bissell,Green Machine,Cleaning Problems"
Green Machine Head: Disassembly & Reassembly,https://res.cloudinary.com/dbcpfy04c/image/upload/v1748017863/pin_4_12_ex1wwx.webp,green-cleaning-tips,,https://www.beacleaner.com/how-to-clean-green-machine-head?utm_source=pinterest&utm_campaign=green-machine-head-d,2025-05-23,"Feeling intimidated by the thought of cleaning your Green Machine head? This pin provides a clear, step-by-step guide to disassembling and reassembling the head.  We'll show you exactly what to do, with helpful photos and instructions.  Don't worry, it's easier than you think! Click to learn how to confidently tackle this cleaning task.","Disassembly,Bissell,Green Machine,Cleaning Tutorial"
Bissell Green Machine Head: Quick Cleaning Tips,https://res.cloudinary.com/dbcpfy04c/image/upload/v1748017871/pin_4_13_xusxcn.webp,deep-cleaning-tips,,https://www.beacleaner.com/how-to-clean-green-machine-head?utm_source=pinterest&utm_campaign=bissell-green-machin,2025-05-23,Short on time? This pin offers quick and easy cleaning tips for maintaining your Green Machine head.  We'll share simple habits you can incorporate into your cleaning routine to prevent build-up and keep your head looking its best.  A little effort can make a big difference! Click to learn our time-saving tips.,"Quick Cleaning,Bissell,Green Machine,Cleaning Hacks"
Green Machine Head: Odor Elimination Guide,https://res.cloudinary.com/dbcpfy04c/image/upload/v1748017877/pin_4_14_hzpt13.webp,green-cleaning-tips,,https://www.beacleaner.com/how-to-clean-green-machine-head?utm_source=pinterest&utm_campaign=green-machine-head-o,2025-05-23,Is your Green Machine head emitting an unpleasant odor? This pin focuses on eliminating odors with natural and effective methods.  We'll share tips on how to neutralize smells and leave your head smelling fresh and clean.  Say goodbye to lingering odors and hello to a more pleasant cleaning experience! Click to learn our odor-busting secrets.,"Odor Removal,Bissell,Green Machine,Cleaning Tips"
The Ultimate Green Machine Head Cleaning Checklist,https://res.cloudinary.com/dbcpfy04c/image/upload/v1748017883/pin_4_15_gmzifi.webp,cleaning-tips,,https://www.beacleaner.com/how-to-clean-green-machine-head?utm_source=pinterest&utm_campaign=the-ultimate-green-m,2025-05-23,Stay organized with our comprehensive cleaning checklist! This pin provides a printable checklist to help you keep track of each step in the cleaning process.  It's the perfect tool for ensuring a thorough and effective clean.  Download your checklist today and enjoy a sparkling clean Green Machine head!,"Checklist,Bissell,Green Machine,Cleaning Organization"
Green Machine Head: Preventative Maintenance,https://res.cloudinary.com/dbcpfy04c/image/upload/v1748017889/pin_4_16_gbvfnw.webp,green-cleaning-tips,,https://www.beacleaner.com/how-to-clean-green-machine-head?utm_source=pinterest&utm_campaign=green-machine-head-p,2025-05-23,Don't wait until your Green Machine head is filthy! This pin focuses on preventative maintenance tips to keep it clean and functioning optimally.  We'll share simple habits you can adopt to avoid build-up and extend the lifespan of your machine.  A little prevention is worth a pound of cure! Click to learn our preventative maintenance strategies.,"Preventative Maintenance,Bissell,Green Machine,Cleaning Routine"
Bissell Green Machine Head: Deep Clean Results,https://res.cloudinary.com/dbcpfy04c/image/upload/v1748017895/pin_4_17_vfha6r.webp,deep-cleaning-tips,,https://www.beacleaner.com/how-to-clean-green-machine-head?utm_source=pinterest&utm_campaign=bissell-green-machin,2025-05-23,See the power of a deep clean! This pin showcases dramatic before-and-after photos of a Green Machine head that has been thoroughly cleaned.  The difference is incredible!  Inspired?  Click to learn how you can achieve these results yourself and enjoy a truly deep clean.,"Deep Clean,Bissell,Green Machine,Cleaning Results"
Green Machine Head: Cleaning for Pet Owners,https://res.cloudinary.com/dbcpfy04c/image/upload/v1748017901/pin_4_18_ui85ic.webp,green-cleaning-tips,,https://www.beacleaner.com/how-to-clean-green-machine-head?utm_source=pinterest&utm_campaign=green-machine-head-c,2025-05-23,"Pet hair everywhere? This pin provides specific cleaning tips for Green Machine heads used in homes with pets.  We'll share techniques for removing pet hair, dander, and odors.  Keep your home clean and fresh, even with furry friends! Click to learn our pet-friendly cleaning solutions.","Pet Cleaning,Bissell,Green Machine,Pet Hair Removal"
Bissell Green Machine Head: Save Money & Clean!,https://res.cloudinary.com/dbcpfy04c/image/upload/v1748017909/pin_4_19_vcyxkq.webp,deep-cleaning-tips,,https://www.beacleaner.com/how-to-clean-green-machine-head?utm_source=pinterest&utm_campaign=bissell-green-machin,2025-05-23,"Don't replace your Green Machine head, revive it! This pin highlights the cost savings of cleaning your head instead of buying a new one.  We'll show you how to save money and enjoy a consistently clean home.  A smart and sustainable choice! Click to learn how to extend the life of your machine.","Save Money,Bissell,Green Machine,Cleaning Budget"
Green Machine Head: The Secret to a Spotless Home,https://res.cloudinary.com/dbcpfy04c/image/upload/v1748017914/pin_4_20_gfz39a.webp,green-cleaning-tips,,https://www.beacleaner.com/how-to-clean-green-machine-head?utm_source=pinterest&utm_campaign=green-machine-head-t,2025-05-23,Unlock the secret to a truly spotless home! This pin emphasizes the importance of a clean Green Machine head for achieving optimal cleaning results.  A dirty head can spread dirt and grime instead of removing it.  Don't compromise your cleaning efforts! Click to learn how to keep your head clean and enjoy a sparkling home.,"Spotless Home,Bissell,Green Machine,Cleaning Secrets"
Bissell Green Machine Head: Easy Step-by-Step,https://res.cloudinary.com/dbcpfy04c/image/upload/v1748017923/pin_4_21_gojto4.webp,deep-cleaning-tips,,https://www.beacleaner.com/how-to-clean-green-machine-head?utm_source=pinterest&utm_campaign=bissell-green-machin,2025-05-23,"Confused about how to clean your Green Machine head? This pin provides a simplified, step-by-step guide with clear instructions and helpful visuals.  We'll break down the process into manageable steps, making it easy for anyone to follow.  Click to learn how to clean your head with confidence.","Step by Step,Bissell,Green Machine,Cleaning Guide"
Green Machine Head: Natural Cleaning Power,https://res.cloudinary.com/dbcpfy04c/image/upload/v1748017928/pin_4_22_zsuxdd.webp,green-cleaning-tips,,https://www.beacleaner.com/how-to-clean-green-machine-head?utm_source=pinterest&utm_campaign=green-machine-head-n,2025-05-23,"Harness the power of nature! This pin focuses on using natural cleaning ingredients to clean your Bissell Green Machine head.  We'll share recipes for homemade solutions that are safe, effective, and eco-friendly.  Enjoy a clean home without harsh chemicals! Click to learn our natural cleaning methods.","Natural Power,Bissell,Green Machine,Eco Friendly"
Bissell Green Machine Head: Cleaning Mistakes to Avoid,https://res.cloudinary.com/dbcpfy04c/image/upload/v1748017933/pin_4_23_ibm10y.webp,deep-cleaning-tips,,https://www.beacleaner.com/how-to-clean-green-machine-head?utm_source=pinterest&utm_campaign=bissell-green-machin,2025-05-23,Don't make these common cleaning mistakes! This pin highlights the errors people often make when cleaning their Green Machine head and how to avoid them.  Learn from our mistakes and ensure a thorough and effective clean.  Click to learn how to clean your head the right way.,"Cleaning Mistakes,Bissell,Green Machine,Cleaning Tips"
Green Machine Head: Restore Suction Power!,https://res.cloudinary.com/dbcpfy04c/image/upload/v1748017939/pin_4_24_srbaly.webp,green-cleaning-tips,,https://www.beacleaner.com/how-to-clean-green-machine-head?utm_source=pinterest&utm_campaign=green-machine-head-r,2025-05-23,Is your Green Machine losing suction? A dirty head could be the culprit! This pin focuses on restoring suction power by thoroughly cleaning your head.  We'll show you how to remove blockages and ensure optimal performance.  Click to learn how to get your machine working like new again.,"Suction Power,Bissell,Green Machine,Cleaning Performance"
Bissell Green Machine Head: Cleaning Schedule,https://res.cloudinary.com/dbcpfy04c/image/upload/v1748017947/pin_4_25_kuna19.webp,deep-cleaning-tips,,https://www.beacleaner.com/how-to-clean-green-machine-head?utm_source=pinterest&utm_campaign=bissell-green-machin,2025-05-23,"Stay on top of your cleaning with our recommended schedule! This pin provides a simple schedule for cleaning your Green Machine head, ensuring it stays in top condition.  A little maintenance goes a long way! Click to download your cleaning schedule and enjoy a consistently clean home.","Cleaning Schedule,Bissell,Green Machine,Cleaning Routine"
Title,https://res.cloudinary.com/dbcpfy04c/image/upload/v1748017999/pin_5_1_xvxxem.webp,please-provide-the-title-and-keywords-i-need-that-information-to-suggest-a-board-name-once,,https://www.beacleaner.com/how-to-clean-grill-briquettes?utm_source=pinterest&utm_campaign=title,2025-05-23,Description,Keywords
Grill Briquettes: Clean 'Em Up!,https://res.cloudinary.com/dbcpfy04c/image/upload/v1748018008/pin_5_2_zthfqe.webp,grilling-tips,,https://www.beacleaner.com/how-to-clean-grill-briquettes?utm_source=pinterest&utm_campaign=grill-briquettes-cle,2025-05-23,Is your grill looking sad and smoky? Don't toss those briquettes! This guide reveals how to clean grill briquettes for better flavor & longer life. Learn simple methods to remove ash & grease,ensuring your next BBQ is a success.  A clean grill means tastier food & more enjoyable cookouts.  Don't let a dirty grill ruin your summer! Click to learn how to revive your briquettes and impress your guests.  We'll show you how to avoid harsh chemicals and keep your grilling safe.  Get grilling again
Dirty Briquettes? No Problem!,https://res.cloudinary.com/dbcpfy04c/image/upload/v1748018016/pin_5_3_u0f1hg.webp,grill-tips,,https://www.beacleaner.com/how-to-clean-grill-briquettes?utm_source=pinterest&utm_campaign=dirty-briquettes-no-,2025-05-23,Ever wonder if you can *really* clean grill briquettes? You can! This post breaks down the process step-by-step,from initial assessment to final rinse.  We'll cover everything you need to know to restore your briquettes to their former glory.  Imagine perfectly seared steaks and juicy burgers
Revive Your Grill: Briquette Guide,https://res.cloudinary.com/dbcpfy04c/image/upload/v1748018022/pin_5_4_fqkguj.webp,grilling-tips,,https://www.beacleaner.com/how-to-clean-grill-briquettes?utm_source=pinterest&utm_campaign=revive-your-grill-br,2025-05-23,Don't let a dirty grill hold you back from summer fun! This guide shows you how to clean grill briquettes effectively,saving you money and improving your BBQ game.  We'll share pro tips for removing stubborn residue and preventing future buildup.  A clean grill isn't just about looks; it's about food safety and flavor.  Click to learn how to extend the life of your briquettes and enjoy delicious meals all season long.  Your tastebuds will thank you!
Clean Grill = Better BBQ Flavor,https://res.cloudinary.com/dbcpfy04c/image/upload/v1748018037/pin_5_5_tarwsl.webp,grilling-tips,,https://www.beacleaner.com/how-to-clean-grill-briquettes?utm_source=pinterest&utm_campaign=clean-grill-better-b,2025-05-23,Did you know dirty grill briquettes can affect the taste of your food?  This post reveals how to clean them properly,removing unwanted flavors and ensuring a delicious BBQ experience.  We'll show you easy
Briquette Cleaning: Step-by-Step,https://res.cloudinary.com/dbcpfy04c/image/upload/v1748018043/pin_5_6_nlj4fl.webp,cleaning-tips,,https://www.beacleaner.com/how-to-clean-grill-briquettes?utm_source=pinterest&utm_campaign=briquette-cleaning-s,2025-05-23,Confused about how to clean grill briquettes?  This post provides a clear,step-by-step guide with photos
"Save Money: Clean, Don't Replace!",https://res.cloudinary.com/dbcpfy04c/image/upload/v1748018059/pin_5_7_zw9fmk.webp,grill-tips,,https://www.beacleaner.com/how-to-clean-grill-briquettes?utm_source=pinterest&utm_campaign=save-money-clean-don,2025-05-23,Tired of constantly replacing grill briquettes?  This post shows you how to clean them effectively,saving you money and reducing waste.  We'll share tips for extending their lifespan and keeping your grill in top condition.  A little effort goes a long way!  Click to learn how to clean your briquettes and enjoy more BBQ for your buck.  It's a win-win!
Grill Briquettes: Deep Cleaning,https://res.cloudinary.com/dbcpfy04c/image/upload/v1748018065/pin_5_8_rekc1t.webp,grilling-tips,,https://www.beacleaner.com/how-to-clean-grill-briquettes?utm_source=pinterest&utm_campaign=grill-briquettes-dee,2025-05-23,Give your grill briquettes the deep clean they deserve! This post reveals advanced cleaning techniques for removing stubborn grease and buildup.  We'll cover everything you need to know to restore your briquettes to like-new condition.  Imagine the satisfaction of a sparkling clean grill!  Click to learn how to deep clean your briquettes and enjoy a truly exceptional BBQ experience.  You'll be amazed by the results!,Deep Cleaning
Quick & Easy Briquette Cleaning,https://res.cloudinary.com/dbcpfy04c/image/upload/v1748018071/pin_5_9_ohzimq.webp,grilling-tips,,https://www.beacleaner.com/how-to-clean-grill-briquettes?utm_source=pinterest&utm_campaign=quick-easy-briquette,2025-05-23,Short on time? This post offers quick and easy methods for cleaning grill briquettes,so you can get back to grilling faster.  We'll share simple techniques that require minimal effort.  Don't let a dirty grill ruin your weekend!  Click to learn how to clean your briquettes in minutes and enjoy a delicious BBQ.  It's the perfect solution for busy grill masters.
Grill Briquettes: Before & After,https://res.cloudinary.com/dbcpfy04c/image/upload/v1748018076/pin_5_10_eopko1.webp,grilling-tips,,https://www.beacleaner.com/how-to-clean-grill-briquettes?utm_source=pinterest&utm_campaign=grill-briquettes-bef,2025-05-23,See the amazing transformation! This post features before-and-after photos of cleaned grill briquettes,demonstrating the effectiveness of our methods.  We'll show you how to restore your briquettes to their former glory.  Don't believe us?  See for yourself!  Click to learn how to clean your briquettes and achieve stunning results.  You won't be disappointed!
Briquette Cleaning: Avoid Mistakes,https://res.cloudinary.com/dbcpfy04c/image/upload/v1748018083/pin_5_11_mbskhm.webp,cleaning-tips,,https://www.beacleaner.com/how-to-clean-grill-briquettes?utm_source=pinterest&utm_campaign=briquette-cleaning-a,2025-05-23,Don't make these common mistakes when cleaning grill briquettes! This post highlights pitfalls to avoid,ensuring a safe and effective cleaning process.  We'll share expert tips for protecting your grill and your health.  Learn from our mistakes!  Click to learn how to clean your briquettes the right way and avoid costly errors.  Grill smarter
Grill Briquettes: Natural Cleaning,https://res.cloudinary.com/dbcpfy04c/image/upload/v1748018091/pin_5_12_oncv2z.webp,grilling-tips,,https://www.beacleaner.com/how-to-clean-grill-briquettes?utm_source=pinterest&utm_campaign=grill-briquettes-nat,2025-05-23,Want to clean your grill briquettes without harsh chemicals? This post reveals natural cleaning solutions that are safe for you and the environment.  We'll share eco-friendly methods that deliver amazing results.  Protect your family and the planet!  Click to learn how to clean your briquettes naturally and enjoy a guilt-free BBQ.  It's the responsible choice.,Natural Cleaning
Extend Briquette Life: Pro Tips,https://res.cloudinary.com/dbcpfy04c/image/upload/v1748018097/pin_5_13_hqboth.webp,grilling-tips,,https://www.beacleaner.com/how-to-clean-grill-briquettes?utm_source=pinterest&utm_campaign=extend-briquette-lif,2025-05-23,Want your grill briquettes to last longer? This post shares pro tips for extending their lifespan,saving you money and reducing waste.  We'll cover everything from cleaning to storage.  Get the most out of your briquettes!  Click to learn how to care for your briquettes and enjoy a long-lasting grilling experience.  It's a smart investment.
Grill Briquettes: Cleaning Tools,https://res.cloudinary.com/dbcpfy04c/image/upload/v1748018104/pin_5_14_kywrmf.webp,grilling-tips,,https://www.beacleaner.com/how-to-clean-grill-briquettes?utm_source=pinterest&utm_campaign=grill-briquettes-cle,2025-05-23,What tools do you need to clean grill briquettes effectively? This post provides a comprehensive list of essential cleaning supplies,making the process easier and more efficient.  We'll recommend our favorite tools and share helpful tips.  Be prepared!  Click to learn what you need to clean your briquettes like a pro.  Get grilling!
Grill Briquettes: Cleaning Frequency,https://res.cloudinary.com/dbcpfy04c/image/upload/v1748018109/pin_5_15_qflnlt.webp,grilling-tips,,https://www.beacleaner.com/how-to-clean-grill-briquettes?utm_source=pinterest&utm_campaign=grill-briquettes-cle,2025-05-23,How often should you clean your grill briquettes? This post answers that question,providing a recommended cleaning schedule based on your grilling habits.  We'll help you maintain a clean and healthy grill.  Stay on top of it!  Click to learn how often to clean your briquettes and enjoy consistently delicious BBQ.  It's all about consistency.
