Title,Media URL,Pinterest board,Thumbnail,Description,Link,Publish date,Keywords,Source URL
Title,https://res.cloudinary.com/dbcpfy04c/image/upload/v1745930285/pin_1_1_saycso.webp,please-provide-the-title-and-keywords-i-need-that-information-to-suggest-a-board-name-once,,Description,https://lawntrend.com/195-hp-briggs-and-stratton-engine-problems/?utm_source=pinterest&utm_campaign=title,2025-04-29,Keywords,https://lawntrend.com/195-hp-briggs-and-stratton-engine-problems/
195 HP Briggs & Stratton: Is It Dying?,https://res.cloudinary.com/dbcpfy04c/image/upload/v1745930291/pin_1_2_lkb1gd.webp,engine-repair-ideas,,"Is your trusty 195 HP Briggs & Stratton engine sputtering, losing power, or refusing to start? Don't let a frustrating breakdown ruin your weekend! This guide dives deep into common problems – from carburetor issues to low oil shutdown – and provides clear, step-by-step troubleshooting tips.  We'll help you diagnose the issue and get back to mowing, snowblowing",https://lawntrend.com/195-hp-briggs-and-stratton-engine-problems/?utm_source=pinterest&utm_campaign=195-hp-briggs-stratt,2025-04-29,or whatever your engine powers.  Save money on repairs and keep your equipment running smoothly! Click to learn more and breathe new life into your Briggs & Stratton! #BriggsAndStratton #EngineRepair #SmallEngine #DIYRepair,https://lawntrend.com/195-hp-briggs-and-stratton-engine-problems/
Briggs 195 HP Engine: Fix It Yourself!,https://res.cloudinary.com/dbcpfy04c/image/upload/v1745930297/pin_1_3_ulqdrq.webp,engine-repair-ideas,,"Feeling overwhelmed by engine trouble? You *can* tackle common 195 HP Briggs & Stratton problems! This post breaks down complex issues into manageable steps, even for beginners. Learn to identify symptoms, perform basic maintenance",https://lawntrend.com/195-hp-briggs-and-stratton-engine-problems/?utm_source=pinterest&utm_campaign=briggs-195-hp-engine,2025-04-29,and potentially avoid costly mechanic visits.  Don't give up on your equipment – empower yourself with knowledge!  Click to read the full guide and get your engine roaring again! #EngineTroubleshooting #BriggsStrattonEngine #DIY #HomeRepair,https://lawntrend.com/195-hp-briggs-and-stratton-engine-problems/
Low Oil Shutdown? Briggs 195 HP Help,https://res.cloudinary.com/dbcpfy04c/image/upload/v1745930303/pin_1_4_hndmta.webp,engine-repair-ideas,,"Is your 195 HP Briggs & Stratton engine shutting down unexpectedly? It could be the low oil sensor! This guide explains how the system works, how to diagnose a faulty sensor",https://lawntrend.com/195-hp-briggs-and-stratton-engine-problems/?utm_source=pinterest&utm_campaign=low-oil-shutdown-bri,2025-04-29,and how to safely bypass it (temporarily!) for testing.  We also cover proper oil levels and maintenance to prevent future shutdowns.  Don't get stranded mid-job – learn how to fix this common issue! #LowOilShutdown #BriggsAndStratton #EngineProblems #SensorRepair,https://lawntrend.com/195-hp-briggs-and-stratton-engine-problems/
Carburetor Issues on Your Briggs 195 HP,https://res.cloudinary.com/dbcpfy04c/image/upload/v1745930309/pin_1_5_yylnjb.webp,engine-repair-ideas,,A dirty or clogged carburetor is a frequent culprit behind a struggling 195 HP Briggs & Stratton engine.  This post provides a detailed walkthrough of carburetor cleaning and repair,https://lawntrend.com/195-hp-briggs-and-stratton-engine-problems/?utm_source=pinterest&utm_campaign=carburetor-issues-on,2025-04-29,including parts diagrams and troubleshooting tips.  Don't let a simple fix turn into a major expense!  Click to learn how to restore optimal fuel delivery and performance. #CarburetorRepair #BriggsAndStratton #EngineMaintenance #FuelSystem,https://lawntrend.com/195-hp-briggs-and-stratton-engine-problems/
Spark Plug Secrets for Briggs 195 HP,https://res.cloudinary.com/dbcpfy04c/image/upload/v1745930316/pin_1_6_wx0rcm.webp,engine-repair-ideas,,"A worn or fouled spark plug can significantly impact the performance of your 195 HP Briggs & Stratton engine.  This guide explains how to inspect, clean, and replace spark plugs",https://lawntrend.com/195-hp-briggs-and-stratton-engine-problems/?utm_source=pinterest&utm_campaign=spark-plug-secrets-f,2025-04-29,ensuring optimal ignition and power.  A small change can make a big difference!  Click to learn the secrets to a strong spark. #SparkPlug #BriggsAndStratton #EnginePerformance #Ignition,https://lawntrend.com/195-hp-briggs-and-stratton-engine-problems/
Briggs 195 HP: Fuel Line Problems?,https://res.cloudinary.com/dbcpfy04c/image/upload/v1745930322/pin_1_7_sy3ody.webp,engine-repair-ideas,,"Leaking or cracked fuel lines can cause fuel starvation and engine problems. This post details how to inspect, repair",https://lawntrend.com/195-hp-briggs-and-stratton-engine-problems/?utm_source=pinterest&utm_campaign=briggs-195-hp-fuel-l,2025-04-29,and replace fuel lines on your 195 HP Briggs & Stratton engine.  Don't risk a fire hazard – ensure your fuel system is safe and reliable! #FuelLines #BriggsAndStratton #EngineSafety #FuelSystemRepair,https://lawntrend.com/195-hp-briggs-and-stratton-engine-problems/
195 HP Briggs & Stratton: Governor Issues,https://res.cloudinary.com/dbcpfy04c/image/upload/v1745930327/pin_1_8_h2wxag.webp,engine-repair-ideas,,Is your engine surging or not maintaining a consistent speed? The governor might be the culprit! This post explains how the governor works and how to diagnose and fix common problems.  Enjoy smooth,https://lawntrend.com/195-hp-briggs-and-stratton-engine-problems/?utm_source=pinterest&utm_campaign=195-hp-briggs-stratt,2025-04-29,reliable power again! #GovernorRepair #BriggsAndStratton #EngineSpeed #EngineControl,https://lawntrend.com/195-hp-briggs-and-stratton-engine-problems/
Air Filter Replacement: Briggs 195 HP,https://res.cloudinary.com/dbcpfy04c/image/upload/v1745930333/pin_1_9_ajuxu6.webp,engine-repair-ideas,,"A clean air filter is essential for optimal engine performance. This post shows you how to easily replace the air filter on your 195 HP Briggs & Stratton engine, ensuring clean air intake and preventing damage.  Simple maintenance",https://lawntrend.com/195-hp-briggs-and-stratton-engine-problems/?utm_source=pinterest&utm_campaign=air-filter-replaceme,2025-04-29,big results! #AirFilter #BriggsAndStratton #EngineMaintenance #AirIntake,https://lawntrend.com/195-hp-briggs-and-stratton-engine-problems/
Briggs 195 HP: Cleaning the Fuel Tank,https://res.cloudinary.com/dbcpfy04c/image/upload/v1745930339/pin_1_10_polhbd.webp,engine-repair-ideas,,Sediment and debris in the fuel tank can clog the fuel system. This post explains how to safely clean the fuel tank on your 195 HP Briggs & Stratton engine,https://lawntrend.com/195-hp-briggs-and-stratton-engine-problems/?utm_source=pinterest&utm_campaign=briggs-195-hp-cleani,2025-04-29,ensuring clean fuel flow.  Prevent fuel-related problems! #FuelTank #BriggsAndStratton #FuelSystem #EngineMaintenance,https://lawntrend.com/195-hp-briggs-and-stratton-engine-problems/
195 HP Briggs & Stratton: Muffler Repair,https://res.cloudinary.com/dbcpfy04c/image/upload/v1745930344/pin_1_11_cba6eq.webp,engine-repair-ideas,,"A damaged muffler can cause excessive noise and reduce engine performance. This post details how to inspect, repair",https://lawntrend.com/195-hp-briggs-and-stratton-engine-problems/?utm_source=pinterest&utm_campaign=195-hp-briggs-stratt,2025-04-29,and replace the muffler on your 195 HP Briggs & Stratton engine.  Keep your engine quiet and efficient! #MufflerRepair #BriggsAndStratton #EngineNoise #EnginePerformance,https://lawntrend.com/195-hp-briggs-and-stratton-engine-problems/
Briggs 195 HP: Winterizing Your Engine,https://res.cloudinary.com/dbcpfy04c/image/upload/v1745930349/pin_1_12_wmdpts.webp,engine-repair-ideas,,Protect your 195 HP Briggs & Stratton engine during the off-season with proper winterization. This post provides a step-by-step guide to preparing your engine for storage,https://lawntrend.com/195-hp-briggs-and-stratton-engine-problems/?utm_source=pinterest&utm_campaign=briggs-195-hp-winter,2025-04-29,ensuring it's ready to go when you need it.  Extend the life of your engine! #Winterizing #BriggsAndStratton #EngineStorage #SeasonalMaintenance,https://lawntrend.com/195-hp-briggs-and-stratton-engine-problems/
Briggs & Stratton 195 HP: Parts Guide,https://res.cloudinary.com/dbcpfy04c/image/upload/v1745930355/pin_1_13_tp3agm.webp,engine-repair-ideas,,"Need replacement parts for your 195 HP Briggs & Stratton engine? This post provides a helpful guide to finding the right parts, including diagrams and resources.  Get the parts you need",https://lawntrend.com/195-hp-briggs-and-stratton-engine-problems/?utm_source=pinterest&utm_campaign=briggs-stratton-195-,2025-04-29,"fast! #BriggsAndStrattonParts #EngineParts #ReplacementParts #EngineRepair""",https://lawntrend.com/195-hp-briggs-and-stratton-engine-problems/
