Title,Media URL,Pinterest board,Thumbnail,Link,Publish date,Description,Keywords,
Title,https://res.cloudinary.com/dbcpfy04c/image/upload/v1747451198/pin_1_1_s9jorn.webp,please-provide-the-title-and-keywords-i-need-that-information-to-suggest-a-board-name-once,,https://lawntrend.com/lawn-mower-ignition-switch-problems/?utm_source=pinterest&utm_campaign=title,2025-05-17,Description,Keywords,Keywords
Lawn Mower Won't Start? Ignition Switch Fix!,https://res.cloudinary.com/dbcpfy04c/image/upload/v1618237451/placeholder.jpg,home-inspiration,,https://lawntrend.com/lawn-mower-ignition-switch-problems/?utm_source=pinterest&utm_campaign=lawn-mower-wont-star,2025-05-17,"Is your lawn mower refusing to start? Don't sweat it! This guide dives deep into common ignition switch problems, from faulty wiring to a worn-out switch. We'll walk you through troubleshooting steps, show you how to test the switch",and even explain when it's time to call a pro. Save money & get back to enjoying your perfectly manicured lawn! Click to learn how to diagnose & fix it yourself. Don't let a small issue ruin your weekend! #LawnMowerRepair #IgnitionSwitch #DIYRepair #LawnCare,and even explain when it's time to call a pro. Save money & get back to enjoying your perfectly manicured lawn! Click to learn how to diagnose & fix it yourself. Don't let a small issue ruin your weekend! #LawnMowerRepair #IgnitionSwitch #DIYRepair #LawnCare
Ignition Switch Troubleshooting Guide,https://res.cloudinary.com/dbcpfy04c/image/upload/v1618237451/placeholder.jpg,home-inspiration,,https://lawntrend.com/lawn-mower-ignition-switch-problems/?utm_source=pinterest&utm_campaign=ignition-switch-trou,2025-05-17,"Frustrated with a mower that won't fire up? A failing ignition switch is a common culprit. This pin leads to a comprehensive guide detailing how to identify if your ignition switch is the problem. Learn about safety precautions, essential tools, and step-by-step instructions.  Avoid costly repairs and get your mower running smoothly again!  Don't delay",reclaim your yard work! #LawnMowerProblems #IgnitionSwitchRepair #SmallEngineRepair #YardWork,reclaim your yard work! #LawnMowerProblems #IgnitionSwitchRepair #SmallEngineRepair #YardWork
Testing Your Ignition Switch (Easy!),https://res.cloudinary.com/dbcpfy04c/image/upload/v1618237451/placeholder.jpg,home-inspiration,,https://lawntrend.com/lawn-mower-ignition-switch-problems/?utm_source=pinterest&utm_campaign=testing-your-ignitio,2025-05-17,Is your lawn mower ignition switch suspect? Learn how to test it quickly and easily with a multimeter! This pin directs you to a simple,step-by-step guide with clear instructions and visuals.  Confirm the problem before you buy parts and avoid unnecessary expenses.  Get back to mowing with confidence! #LawnMowerTesting #IgnitionSwitchTest #Multimeter #DIY,step-by-step guide with clear instructions and visuals.  Confirm the problem before you buy parts and avoid unnecessary expenses.  Get back to mowing with confidence! #LawnMowerTesting #IgnitionSwitchTest #Multimeter #DIY
Lawn Mower Ignition Switch Symptoms,https://res.cloudinary.com/dbcpfy04c/image/upload/v1618237451/placeholder.jpg,home-inspiration,,https://lawntrend.com/lawn-mower-ignition-switch-problems/?utm_source=pinterest&utm_campaign=lawn-mower-ignition-,2025-05-17,"Recognize the signs of a failing ignition switch! This pin highlights the common symptoms, like no crank, intermittent starting",or a clicking sound. Early detection can prevent further damage.  Click to read our blog post and learn how to diagnose the issue before it escalates.  Protect your investment! #LawnMowerSymptoms #IgnitionSwitchIssues #LawnCareTips #Troubleshooting,or a clicking sound. Early detection can prevent further damage.  Click to read our blog post and learn how to diagnose the issue before it escalates.  Protect your investment! #LawnMowerSymptoms #IgnitionSwitchIssues #LawnCareTips #Troubleshooting
Safety First: Ignition Switch Repair,https://res.cloudinary.com/dbcpfy04c/image/upload/v1618237451/placeholder.jpg,home-inspiration,,https://lawntrend.com/lawn-mower-ignition-switch-problems/?utm_source=pinterest&utm_campaign=safety-first-ignitio,2025-05-17,"Working with electrical components can be dangerous. This pin emphasizes the importance of safety precautions when repairing your lawn mower's ignition switch.  Learn how to disconnect the battery, avoid electrical shock",and work safely. Your safety is our priority! Click for essential safety tips. #LawnMowerSafety #ElectricalSafety #DIYSafety #RepairTips,and work safely. Your safety is our priority! Click for essential safety tips. #LawnMowerSafety #ElectricalSafety #DIYSafety #RepairTips
Cost of Replacing an Ignition Switch,https://res.cloudinary.com/dbcpfy04c/image/upload/v1618237451/placeholder.jpg,home-inspiration,,https://lawntrend.com/lawn-mower-ignition-switch-problems/?utm_source=pinterest&utm_campaign=cost-of-replacing-an,2025-05-17,Wondering how much it will cost to replace your lawn mower's ignition switch? This pin provides a breakdown of parts and labor costs,helping you decide whether to DIY or hire a professional.  Save money and make an informed decision! Click to see the cost comparison. #LawnMowerCost #IgnitionSwitchPrice #RepairEstimate #DIYvsPro,helping you decide whether to DIY or hire a professional.  Save money and make an informed decision! Click to see the cost comparison. #LawnMowerCost #IgnitionSwitchPrice #RepairEstimate #DIYvsPro
Common Ignition Switch Mistakes,https://res.cloudinary.com/dbcpfy04c/image/upload/v1618237451/placeholder.jpg,home-inspiration,,https://lawntrend.com/lawn-mower-ignition-switch-problems/?utm_source=pinterest&utm_campaign=common-ignition-swit,2025-05-17,Avoid these common mistakes when repairing your lawn mower's ignition switch! This pin highlights pitfalls to avoid,ensuring a successful repair.  Learn from others' experiences and save yourself frustration. Click to read about common errors. #LawnMowerMistakes #RepairErrors #DIYTips #TroubleshootingGuide,ensuring a successful repair.  Learn from others' experiences and save yourself frustration. Click to read about common errors. #LawnMowerMistakes #RepairErrors #DIYTips #TroubleshootingGuide
Ignition Switch Replacement Tools,https://res.cloudinary.com/dbcpfy04c/image/upload/v1618237451/placeholder.jpg,home-inspiration,,https://lawntrend.com/lawn-mower-ignition-switch-problems/?utm_source=pinterest&utm_campaign=ignition-switch-repl,2025-05-17,What tools do you need to replace your lawn mower's ignition switch? This pin provides a list of essential tools,ensuring you're prepared for the job.  Get organized and make the repair process smoother. Click to see the tool list. #LawnMowerTools #RepairTools #DIYEssentials #IgnitionSwitchRepair,ensuring you're prepared for the job.  Get organized and make the repair process smoother. Click to see the tool list. #LawnMowerTools #RepairTools #DIYEssentials #IgnitionSwitchRepair
Lawn Mower Ignition Switch: Visual Guide,https://res.cloudinary.com/dbcpfy04c/image/upload/v1618237451/placeholder.jpg,home-inspiration,,https://lawntrend.com/lawn-mower-ignition-switch-problems/?utm_source=pinterest&utm_campaign=lawn-mower-ignition-,2025-05-17,Need a visual aid for your ignition switch repair? This pin links to a blog post with detailed photos and diagrams.  See exactly what to do,step-by-step. Click for a visual walkthrough. #LawnMowerDiagram #VisualGuide #RepairInstructions #DIYVisuals,step-by-step. Click for a visual walkthrough. #LawnMowerDiagram #VisualGuide #RepairInstructions #DIYVisuals
When to Call a Pro (Ignition Switch),https://res.cloudinary.com/dbcpfy04c/image/upload/v1618237451/placeholder.jpg,home-inspiration,,https://lawntrend.com/lawn-mower-ignition-switch-problems/?utm_source=pinterest&utm_campaign=when-to-call-a-pro-i,2025-05-17,Sometimes,a repair is best left to the professionals. This pin helps you determine when to call a mechanic for ignition switch problems.  Avoid further damage and ensure a safe repair. Click to learn when to seek help. #LawnMowerRepair #ProfessionalHelp #DIYLimits #WhenToCall,a repair is best left to the professionals. This pin helps you determine when to call a mechanic for ignition switch problems.  Avoid further damage and ensure a safe repair. Click to learn when to seek help. #LawnMowerRepair #ProfessionalHelp #DIYLimits #WhenToCall
Lawn Mower Ignition Switch FAQs,https://res.cloudinary.com/dbcpfy04c/image/upload/v1618237451/placeholder.jpg,home-inspiration,,https://lawntrend.com/lawn-mower-ignition-switch-problems/?utm_source=pinterest&utm_campaign=lawn-mower-ignition-,2025-05-17,Got questions about lawn mower ignition switches? This pin directs you to a frequently asked questions section,providing answers to common queries.  Get the information you need to tackle the repair. Click for FAQs. #LawnMowerFAQ #IgnitionSwitchQuestions #RepairHelp #LawnCareAnswers,providing answers to common queries.  Get the information you need to tackle the repair. Click for FAQs. #LawnMowerFAQ #IgnitionSwitchQuestions #RepairHelp #LawnCareAnswers
Lawn Mower Ignition Switch: Before You Buy,https://res.cloudinary.com/dbcpfy04c/image/upload/v1618237451/placeholder.jpg,home-inspiration,,https://lawntrend.com/lawn-mower-ignition-switch-problems/?utm_source=pinterest&utm_campaign=lawn-mower-ignition-,2025-05-17,Before you purchase a replacement ignition switch,read this! This pin highlights important considerations to ensure you get the right part and avoid compatibility issues. Click for pre-purchase advice. #LawnMowerParts #IgnitionSwitchSelection #BuyerGuide #DIYPreparation,read this! This pin highlights important considerations to ensure you get the right part and avoid compatibility issues. Click for pre-purchase advice. #LawnMowerParts #IgnitionSwitchSelection #BuyerGuide #DIYPreparation
Lawn Mower Ignition Switch: Step-by-Step,https://res.cloudinary.com/dbcpfy04c/image/upload/v1618237451/placeholder.jpg,home-inspiration,,https://lawntrend.com/lawn-mower-ignition-switch-problems/?utm_source=pinterest&utm_campaign=lawn-mower-ignition-,2025-05-17,"A clear, concise, step-by-step guide to replacing your lawn mower's ignition switch. This pin promises a straightforward repair process",even for beginners. Click for easy-to-follow instructions. #StepByStepRepair #LawnMowerDIY #IgnitionSwitchGuide #EasyRepair,even for beginners. Click for easy-to-follow instructions. #StepByStepRepair #LawnMowerDIY #IgnitionSwitchGuide #EasyRepair
Title,https://res.cloudinary.com/dbcpfy04c/image/upload/v1618237451/placeholder.jpg,home-inspiration,,https://lawntrend.com/briggs-and-stratton-v-twin-oil-leak/?utm_source=pinterest&utm_campaign=title,2025-05-17,Description,Keywords,Keywords
Briggs & Stratton Leak? Don't Panic!,https://res.cloudinary.com/dbcpfy04c/image/upload/v1618237451/placeholder.jpg,home-inspiration,,https://lawntrend.com/briggs-and-stratton-v-twin-oil-leak/?utm_source=pinterest&utm_campaign=briggs-stratton-leak,2025-05-17,"Is your Briggs & Stratton V-Twin leaking oil? Don't let a simple fix turn into a costly repair! This guide walks you through common leak sources, from valve cover gaskets to oil filters. We'll help you diagnose the problem, understand the severity, and confidently tackle the repair yourself. Save money and keep your lawn looking pristine! Learn how to identify the leak type, the tools you'll need",and step-by-step instructions. Don't ignore that drip – it could lead to engine failure! Click to learn more and get back to mowing. #BriggsAndStratton #OilLeak #LawnMowerRepair #DIY,and step-by-step instructions. Don't ignore that drip – it could lead to engine failure! Click to learn more and get back to mowing. #BriggsAndStratton #OilLeak #LawnMowerRepair #DIY
V-Twin Oil Leak: Easy Fixes,https://res.cloudinary.com/dbcpfy04c/image/upload/v1618237451/placeholder.jpg,home-inspiration,,https://lawntrend.com/briggs-and-stratton-v-twin-oil-leak/?utm_source=pinterest&utm_campaign=v-twin-oil-leak-easy,2025-05-17,"Discover the surprisingly simple solutions to common Briggs & Stratton V-Twin oil leaks. This post breaks down the most frequent culprits, offering clear, concise instructions for DIY repairs.  Worried about engine damage? We explain how to prevent further issues and protect your investment.  From tightening bolts to replacing gaskets",we've got you covered.  Don't let a small leak ruin your summer – get your mower back in top shape! Click to read the full guide. #VTwinEngine #OilLeakRepair #LawnCare #EngineMaintenance,we've got you covered.  Don't let a small leak ruin your summer – get your mower back in top shape! Click to read the full guide. #VTwinEngine #OilLeakRepair #LawnCare #EngineMaintenance
Stop the Drip! B&S Oil Leak Guide,https://res.cloudinary.com/dbcpfy04c/image/upload/v1618237451/placeholder.jpg,home-inspiration,,https://lawntrend.com/briggs-and-stratton-v-twin-oil-leak/?utm_source=pinterest&utm_campaign=stop-the-drip-bs-oil,2025-05-17,"Is oil pooling under your lawnmower?  A Briggs & Stratton V-Twin oil leak can be frustrating, but it doesn't have to be expensive.  This comprehensive guide provides a detailed breakdown of potential leak locations and how to address them.  We cover everything from the crankshaft seal to the oil pan gasket.  Protect your engine and your wallet!  Click now for a step-by-step solution.  Don't delay",a small leak can become a big problem! #BriggsStrattonRepair #OilLeakDiagnosis #LawnMower #EngineRepair,a small leak can become a big problem! #BriggsStrattonRepair #OilLeakDiagnosis #LawnMower #EngineRepair
Briggs V-Twin: Oil Leak Causes,https://res.cloudinary.com/dbcpfy04c/image/upload/v1618237451/placeholder.jpg,home-inspiration,,https://lawntrend.com/briggs-and-stratton-v-twin-oil-leak/?utm_source=pinterest&utm_campaign=briggs-v-twin-oil-le,2025-05-17,"Understanding *why* your Briggs & Stratton V-Twin is leaking oil is the first step to fixing it. This article dives deep into the common causes, including wear and tear, improper maintenance",and faulty parts.  We'll help you pinpoint the source of the leak and choose the right repair strategy.  Avoid costly mechanic bills and keep your mower running smoothly. Click to learn the root causes! #VTwinOilLeak #EngineTroubleshooting #LawnEquipment #DIYRepair,and faulty parts.  We'll help you pinpoint the source of the leak and choose the right repair strategy.  Avoid costly mechanic bills and keep your mower running smoothly. Click to learn the root causes! #VTwinOilLeak #EngineTroubleshooting #LawnEquipment #DIYRepair
DIY Briggs & Stratton Oil Change,https://res.cloudinary.com/dbcpfy04c/image/upload/v1618237451/placeholder.jpg,home-inspiration,,https://lawntrend.com/briggs-and-stratton-v-twin-oil-leak/?utm_source=pinterest&utm_campaign=diy-briggs-stratton-,2025-05-17,Prevent oil leaks and maintain optimal engine performance with a regular oil change! This guide shows you how to easily change the oil in your Briggs & Stratton V-Twin engine.  We provide a step-by-step tutorial,including the tools you'll need and the correct oil type.  A little preventative maintenance can save you a lot of headaches (and money!). Click to learn how! #OilChange #BriggsAndStrattonMaintenance #LawnMowerTips #EngineCare,including the tools you'll need and the correct oil type.  A little preventative maintenance can save you a lot of headaches (and money!). Click to learn how! #OilChange #BriggsAndStrattonMaintenance #LawnMowerTips #EngineCare
Oil Leak? Save Your Briggs Engine!,https://res.cloudinary.com/dbcpfy04c/image/upload/v1618237451/placeholder.jpg,home-inspiration,,https://lawntrend.com/briggs-and-stratton-v-twin-oil-leak/?utm_source=pinterest&utm_campaign=oil-leak-save-your-b,2025-05-17,Don't let an oil leak sideline your lawnmower! This post is your lifeline to getting your Briggs & Stratton V-Twin back in action. We cover everything from identifying the leak to performing the repair yourself.  We understand the frustration of a broken mower,so we've made this guide as clear and concise as possible. Click to save your engine! #EngineRescue #OilLeakFix #LawnMowerLife #DIYProjects,so we've made this guide as clear and concise as possible. Click to save your engine! #EngineRescue #OilLeakFix #LawnMowerLife #DIYProjects
Crankshaft Seal Leak: B&S Guide,https://res.cloudinary.com/dbcpfy04c/image/upload/v1618237451/placeholder.jpg,home-inspiration,,https://lawntrend.com/briggs-and-stratton-v-twin-oil-leak/?utm_source=pinterest&utm_campaign=crankshaft-seal-leak,2025-05-17,Dealing with a crankshaft seal leak on your Briggs & Stratton V-Twin? This post provides a detailed guide to diagnosing and replacing the seal. It's a more involved repair,but we break it down into manageable steps.  Protect your engine from serious damage! Click to learn how. #CrankshaftSeal #BriggsAndStrattonEngine #OilLeakRepair #EngineSeals,but we break it down into manageable steps.  Protect your engine from serious damage! Click to learn how. #CrankshaftSeal #BriggsAndStrattonEngine #OilLeakRepair #EngineSeals
Briggs V-Twin: Oil Leak Prevention,https://res.cloudinary.com/dbcpfy04c/image/upload/v1618237451/placeholder.jpg,home-inspiration,,https://lawntrend.com/briggs-and-stratton-v-twin-oil-leak/?utm_source=pinterest&utm_campaign=briggs-v-twin-oil-le,2025-05-17,"Don't wait for a leak to happen! This article focuses on preventative maintenance to help you avoid oil leaks on your Briggs & Stratton V-Twin engine.  We cover regular inspections, proper oil changes",and other essential tips.  Keep your mower running like new! Click for preventative tips. #PreventativeMaintenance #BriggsAndStrattonTips #LawnMowerCare #EngineHealth,and other essential tips.  Keep your mower running like new! Click for preventative tips. #PreventativeMaintenance #BriggsAndStrattonTips #LawnMowerCare #EngineHealth
Diagnose Your B&S Oil Leak FAST,https://res.cloudinary.com/dbcpfy04c/image/upload/v1618237451/placeholder.jpg,home-inspiration,,https://lawntrend.com/briggs-and-stratton-v-twin-oil-leak/?utm_source=pinterest&utm_campaign=diagnose-your-bs-oil,2025-05-17,Struggling to find the source of your Briggs & Stratton V-Twin oil leak? This guide provides a systematic approach to diagnosis,helping you pinpoint the problem quickly and efficiently.  We cover common leak locations and how to identify them.  Stop guessing and start fixing! Click to diagnose. #OilLeakDiagnosis #BriggsAndStrattonTroubleshooting #LawnMowerProblems #EngineDiagnosis,helping you pinpoint the problem quickly and efficiently.  We cover common leak locations and how to identify them.  Stop guessing and start fixing! Click to diagnose. #OilLeakDiagnosis #BriggsAndStrattonTroubleshooting #LawnMowerProblems #EngineDiagnosis
Briggs & Stratton Oil Leak Tools,https://res.cloudinary.com/dbcpfy04c/image/upload/v1618237451/placeholder.jpg,home-inspiration,,https://lawntrend.com/briggs-and-stratton-v-twin-oil-leak/?utm_source=pinterest&utm_campaign=briggs-stratton-oil-,2025-05-17,What tools do you need to fix an oil leak on your Briggs & Stratton V-Twin engine? This post provides a comprehensive list of the essential tools,ensuring you're prepared for the job.  Don't get caught short in the middle of a repair! Click to see the tool list. #LawnMowerTools #BriggsAndStrattonTools #OilLeakTools #EngineTools,ensuring you're prepared for the job.  Don't get caught short in the middle of a repair! Click to see the tool list. #LawnMowerTools #BriggsAndStrattonTools #OilLeakTools #EngineTools
V-Twin Oil Leak: Cost of Repair,https://res.cloudinary.com/dbcpfy04c/image/upload/v1618237451/placeholder.jpg,home-inspiration,,https://lawntrend.com/briggs-and-stratton-v-twin-oil-leak/?utm_source=pinterest&utm_campaign=v-twin-oil-leak-cost,2025-05-17,Wondering how much it will cost to fix an oil leak on your Briggs & Stratton V-Twin? This article breaks down the potential costs,including parts and labor.  We'll help you decide whether to DIY or hire a professional.  Save money and make informed decisions! Click to estimate costs. #OilLeakCost #BriggsAndStrattonRepairCost #LawnMowerRepairPrice #EngineRepairCost,including parts and labor.  We'll help you decide whether to DIY or hire a professional.  Save money and make informed decisions! Click to estimate costs. #OilLeakCost #BriggsAndStrattonRepairCost #LawnMowerRepairPrice #EngineRepairCost
Briggs & Stratton: Oil Leak Symptoms,https://res.cloudinary.com/dbcpfy04c/image/upload/v1618237451/placeholder.jpg,home-inspiration,,https://lawntrend.com/briggs-and-stratton-v-twin-oil-leak/?utm_source=pinterest&utm_campaign=briggs-stratton-oil-,2025-05-17,"Recognizing the signs of an oil leak is crucial for preventing engine damage. This post outlines the common symptoms, including oil spots, burning smells",and reduced oil levels.  Don't ignore these warning signs! Click to learn the symptoms. #OilLeakSymptoms #BriggsAndStrattonSigns #LawnMowerWarningSigns #EngineSymptoms,and reduced oil levels.  Don't ignore these warning signs! Click to learn the symptoms. #OilLeakSymptoms #BriggsAndStrattonSigns #LawnMowerWarningSigns #EngineSymptoms
Briggs & Stratton: Oil Leak FAQ,https://res.cloudinary.com/dbcpfy04c/image/upload/v1618237451/placeholder.jpg,home-inspiration,,https://lawntrend.com/briggs-and-stratton-v-twin-oil-leak/?utm_source=pinterest&utm_campaign=briggs-stratton-oil-,2025-05-17,Got questions about Briggs & Stratton V-Twin oil leaks? This post answers frequently asked questions,providing clear and concise information.  Get the answers you need to tackle the repair with confidence! Click for FAQs. #OilLeakFAQ #BriggsAndStrattonQuestions #LawnMowerAnswers #EngineFAQ,providing clear and concise information.  Get the answers you need to tackle the repair with confidence! Click for FAQs. #OilLeakFAQ #BriggsAndStrattonQuestions #LawnMowerAnswers #EngineFAQ
Oil Leak Repair: Beginner's Guide,https://res.cloudinary.com/dbcpfy04c/image/upload/v1618237451/placeholder.jpg,home-inspiration,,https://lawntrend.com/briggs-and-stratton-v-twin-oil-leak/?utm_source=pinterest&utm_campaign=oil-leak-repair-begi,2025-05-17,New to DIY lawnmower repair? This post is a beginner-friendly guide to fixing oil leaks on your Briggs & Stratton V-Twin engine.  We break down the process into simple steps,making it accessible to everyone. Click to start learning! #BeginnerRepair #OilLeakForBeginners #LawnMowerDIY #EasyEngineRepair,making it accessible to everyone. Click to start learning! #BeginnerRepair #OilLeakForBeginners #LawnMowerDIY #EasyEngineRepair
V-Twin Oil Leak: When to Call a Pro,https://res.cloudinary.com/dbcpfy04c/image/upload/v1618237451/placeholder.jpg,home-inspiration,,https://lawntrend.com/briggs-and-stratton-v-twin-oil-leak/?utm_source=pinterest&utm_campaign=v-twin-oil-leak-when,2025-05-17,Sometimes,an oil leak is beyond DIY repair. This article helps you determine when it's time to call a professional mechanic.  Don't risk causing further damage! Click to know when to seek help. #CallAPro #BriggsAndStrattonMechanic #OilLeakHelp #EngineRepairService,an oil leak is beyond DIY repair. This article helps you determine when it's time to call a professional mechanic.  Don't risk causing further damage! Click to know when to seek help. #CallAPro #BriggsAndStrattonMechanic #OilLeakHelp #EngineRepairService
Briggs & Stratton: Oil Leak Resources,https://res.cloudinary.com/dbcpfy04c/image/upload/v1618237451/placeholder.jpg,home-inspiration,,https://lawntrend.com/briggs-and-stratton-v-twin-oil-leak/?utm_source=pinterest&utm_campaign=briggs-stratton-oil-,2025-05-17,"Need more help with your Briggs & Stratton V-Twin oil leak? This post provides a list of helpful resources, including manuals, diagrams",and online forums.  Get the support you need! Click for resources. #OilLeakResources #BriggsAndStrattonHelp #LawnMowerForum #EngineResources,and online forums.  Get the support you need! Click for resources. #OilLeakResources #BriggsAndStrattonHelp #LawnMowerForum #EngineResources
