Title,Media URL,Pinterest board,Thumbnail,Link,Publish date,Description,Keywords
Title,https://res.cloudinary.com/dsxuwwnsc/image/upload/v1748920678/pin_1_1_uj7msu.webp,please-provide-the-title-and-keywords-i-need-that-information-to-suggest-a-board-name-once,,https://www.beacleaner.com/how-to-get-rid-of-mold-under-laminate-flooring?utm_source=pinterest&utm_campaign=title,2025-06-03,Description,Keywords
Mold Under Laminate? Don't Panic!,https://res.cloudinary.com/dsxuwwnsc/image/upload/v1748920685/pin_1_2_y94elk.webp,home-repair-tips,,https://www.beacleaner.com/how-to-get-rid-of-mold-under-laminate-flooring?utm_source=pinterest&utm_campaign=mold-under-laminate-,2025-06-03,Discover how to tackle hidden mold under your laminate flooring! This guide breaks down the causes,prevention
Laminate Flooring & Mold: A Guide,https://res.cloudinary.com/dsxuwwnsc/image/upload/v1748920691/pin_1_3_yzkiif.webp,flooring-tips,,https://www.beacleaner.com/how-to-get-rid-of-mold-under-laminate-flooring?utm_source=pinterest&utm_campaign=laminate-flooring-mo,2025-06-03,Worried about mold lurking beneath your laminate floors? You're not alone! This post reveals everything you need to know about identifying,preventing
Stop Mold Before It Starts!,https://res.cloudinary.com/dsxuwwnsc/image/upload/v1748920698/pin_1_4_tzn95u.webp,mold-prevention-tips,,https://www.beacleaner.com/how-to-get-rid-of-mold-under-laminate-flooring?utm_source=pinterest&utm_campaign=stop-mold-before-it-,2025-06-03,Preventative measures are key! Learn how to protect your laminate flooring from mold growth with simple,effective strategies. This guide focuses on controlling moisture
DIY Mold Removal: Laminate Floors,https://res.cloudinary.com/dsxuwwnsc/image/upload/v1748920706/pin_1_5_jfdyg0.webp,floor-cleaning-tips,,https://www.beacleaner.com/how-to-get-rid-of-mold-under-laminate-flooring?utm_source=pinterest&utm_campaign=diy-mold-removal-lam,2025-06-03,Can you remove mold under laminate flooring yourself? This post details a DIY approach,outlining the tools
Hidden Mold: A Silent Threat,https://res.cloudinary.com/dsxuwwnsc/image/upload/v1748920713/pin_1_6_cog5qw.webp,home-safety-tips,,https://www.beacleaner.com/how-to-get-rid-of-mold-under-laminate-flooring?utm_source=pinterest&utm_campaign=hidden-mold-a-silent,2025-06-03,Mold can grow unseen,causing health problems and damaging your home. This post focuses on the dangers of hidden mold under laminate flooring and how to identify the subtle signs. Protect your family and your investment – knowledge is power! Click to learn more and take action. #HiddenMold #MoldHealth #HomeSafety #LaminateProblems
Laminate & Moisture: The Enemy,https://res.cloudinary.com/dsxuwwnsc/image/upload/v1748920720/pin_1_7_khbzi3.webp,home-repair-tips,,https://www.beacleaner.com/how-to-get-rid-of-mold-under-laminate-flooring?utm_source=pinterest&utm_campaign=laminate-moisture-th,2025-06-03,Moisture is the primary cause of mold growth under laminate flooring. This post explains how moisture gets trapped,the types of leaks to watch out for
Mold Removal Checklist: Laminate,https://res.cloudinary.com/dsxuwwnsc/image/upload/v1748920728/pin_1_8_gjzw5i.webp,cleaning-tips,,https://www.beacleaner.com/how-to-get-rid-of-mold-under-laminate-flooring?utm_source=pinterest&utm_campaign=mold-removal-checkli,2025-06-03,Follow this comprehensive checklist to effectively remove mold under your laminate flooring. From preparation to cleanup,we've got you covered. Ensure a thorough and safe mold removal process. Download the checklist now! #MoldChecklist #CleaningGuide #LaminateCleaning #HomeOrganization
Protect Your Family From Mold,https://res.cloudinary.com/dsxuwwnsc/image/upload/v1748920734/pin_1_9_amrtum.webp,healthy-home-tips,,https://www.beacleaner.com/how-to-get-rid-of-mold-under-laminate-flooring?utm_source=pinterest&utm_campaign=protect-your-family-,2025-06-03,Mold exposure can cause a range of health issues,especially for children and those with allergies. This post emphasizes the importance of mold removal and prevention to protect your loved ones. Create a healthier home for your family – learn how! #FamilyHealth #MoldAwareness #HealthyLivingTips #HomeWellness
Quick Guide: Mold Under Floors,https://res.cloudinary.com/dsxuwwnsc/image/upload/v1748920740/pin_1_10_zsgsd0.webp,home-repair-tips,,https://www.beacleaner.com/how-to-get-rid-of-mold-under-laminate-flooring?utm_source=pinterest&utm_campaign=quick-guide-mold-und,2025-06-03,Need a quick overview of mold under laminate flooring? This post provides a concise guide to identification,prevention
Laminate Flooring & Humidity,https://res.cloudinary.com/dsxuwwnsc/image/upload/v1748920745/pin_1_11_x0iemv.webp,flooring-tips,,https://www.beacleaner.com/how-to-get-rid-of-mold-under-laminate-flooring?utm_source=pinterest&utm_campaign=laminate-flooring-hu,2025-06-03,Humidity plays a significant role in mold growth. This post explains how to control humidity levels in your home to prevent mold under laminate flooring. Create a drier,healthier environment – learn how! #HumidityControl #Dehumidifiers #HomeClimate #MoldControl
Long-Term Mold Prevention,https://res.cloudinary.com/dsxuwwnsc/image/upload/v1748920751/pin_1_12_qnwz0p.webp,mold-prevention-tips,,https://www.beacleaner.com/how-to-get-rid-of-mold-under-laminate-flooring?utm_source=pinterest&utm_campaign=long-term-mold-preve,2025-06-03,Don't just remove the mold – prevent it from coming back! This post provides long-term prevention strategies to keep your laminate flooring mold-free. Enjoy a healthy,mold-free home for years to come – learn how! #LongTermPrevention #MoldFreeHome #SustainableLiving #HomeCare
Title,https://res.cloudinary.com/dsxuwwnsc/image/upload/v1748920788/pin_2_1_d3rghj.webp,please-provide-the-title-and-keywords-i-need-that-information-to-suggest-a-board-name-once,,https://www.beacleaner.com/how-to-clean-grime-off-wood-furniture?utm_source=pinterest&utm_campaign=title,2025-06-03,Description,Keywords
Goodbye Grime! Wood Furniture Rescue,https://res.cloudinary.com/dsxuwwnsc/image/upload/v1748920795/pin_2_2_w80zol.webp,wood-cleaning-tips,,https://www.beacleaner.com/how-to-clean-grime-off-wood-furniture?utm_source=pinterest&utm_campaign=goodbye-grime-wood-f,2025-06-03,"Is your beautiful wood furniture looking dull and dirty? Don't replace it, REVIVE it! This guide reveals the *best* methods to tackle stubborn grime, from gentle daily cleaning to deep-cleaning solutions for years of buildup. Learn how to identify your wood finish & choose the right cleaner to avoid damage. We'll show you how to restore the natural beauty of your pieces and keep them sparkling for years to come. Click to learn the secrets to a grime-free home!","Wood cleaning,Furniture care,Grime removal,Wood restoration"
Wood Furniture Cleaning: The Ultimate Guide,https://res.cloudinary.com/dsxuwwnsc/image/upload/v1748920801/pin_2_3_lljn5c.webp,wood-care-tips,,https://www.beacleaner.com/how-to-clean-grime-off-wood-furniture?utm_source=pinterest&utm_campaign=wood-furniture-clean,2025-06-03,"Feeling overwhelmed by grimy wood furniture? You're not alone! This comprehensive guide breaks down the cleaning process into easy-to-follow steps. Discover DIY solutions using ingredients you likely already have, plus when to call in the pros. Protect your investment and enjoy your furniture again! Don't let grime win – reclaim your beautiful home today!","Furniture polish,Wood care tips,DIY cleaning,Grime buildup"
Restore Wood Furniture's Shine (Easy!),https://res.cloudinary.com/dsxuwwnsc/image/upload/v1748920811/pin_2_4_qnnl0d.webp,wood-restoration-tips,,https://www.beacleaner.com/how-to-clean-grime-off-wood-furniture?utm_source=pinterest&utm_campaign=restore-wood-furnitu,2025-06-03,"Bring back the luster to your wood furniture with these simple, effective cleaning techniques! We'll show you how to remove grime without harsh chemicals, preserving the finish and beauty of your pieces. Learn the difference between cleaning, polishing, and waxing for a truly stunning result. Click to learn how to make your wood furniture look brand new!","Wood polish,Furniture restoration,Cleaning hacks,Wood shine"
Grime Got You Down? Wood Furniture Help!,https://res.cloudinary.com/dsxuwwnsc/image/upload/v1748920818/pin_2_5_zonwiq.webp,wood-cleaning-tips,,https://www.beacleaner.com/how-to-clean-grime-off-wood-furniture?utm_source=pinterest&utm_campaign=grime-got-you-down-w,2025-06-03,"Don't despair over dirty wood furniture! This post is your lifeline. We'll walk you through identifying the type of grime, choosing the right cleaning method, and preventing future buildup.  Imagine enjoying your beautifully clean furniture again – it's easier than you think! Click to learn how to banish grime for good.","Wood furniture,Cleaning tips,Grime removal,Home cleaning"
DIY Wood Furniture Cleaner Recipes,https://res.cloudinary.com/dsxuwwnsc/image/upload/v1748920824/pin_2_6_jibqk8.webp,wood-care-tips,,https://www.beacleaner.com/how-to-clean-grime-off-wood-furniture?utm_source=pinterest&utm_campaign=diy-wood-furniture-c,2025-06-03,"Skip the expensive store-bought cleaners! This blog post shares amazing DIY recipes using natural ingredients to clean and restore your wood furniture. Safe for your family, your pets, and the environment.  Learn how to create a sparkling clean home without harsh chemicals. Click to discover the power of DIY!","DIY cleaner,Natural cleaning,Wood care,Homemade polish"
Protect Your Wood Furniture: Cleaning Tips,https://res.cloudinary.com/dsxuwwnsc/image/upload/v1748920833/pin_2_7_jsadud.webp,furniture-care-tips,,https://www.beacleaner.com/how-to-clean-grime-off-wood-furniture?utm_source=pinterest&utm_campaign=protect-your-wood-fu,2025-06-03,"Investing in wood furniture is a big decision. Protect your investment with these essential cleaning and maintenance tips! Learn how to prevent grime buildup, avoid common mistakes, and keep your pieces looking their best for years to come.  Don't let time and grime diminish their beauty – click to learn more!","Furniture protection,Wood maintenance,Cleaning schedule,Preventative care"
Deep Cleaning Wood Furniture: Step-by-Step,https://res.cloudinary.com/dsxuwwnsc/image/upload/v1748920839/pin_2_8_qmaylz.webp,wood-cleaning-tips,,https://www.beacleaner.com/how-to-clean-grime-off-wood-furniture?utm_source=pinterest&utm_campaign=deep-cleaning-wood-f,2025-06-03,"Ready for a serious clean? This step-by-step guide will show you how to deep clean your wood furniture and remove even the most stubborn grime. From prepping the surface to applying the final polish, we've got you covered.  Enjoy the satisfaction of a truly sparkling clean home!","Deep cleaning,Wood furniture,Cleaning guide,Step-by-step"
Wood Furniture Grime: Identify & Conquer,https://res.cloudinary.com/dsxuwwnsc/image/upload/v1748920844/pin_2_9_zbswh5.webp,wood-care-tips,,https://www.beacleaner.com/how-to-clean-grime-off-wood-furniture?utm_source=pinterest&utm_campaign=wood-furniture-grime,2025-06-03,What *is* that grime on your wood furniture? Knowing the type of grime is the first step to effective cleaning. This post helps you identify common culprits and choose the right cleaning method.  Don't guess – get the right solution and restore your furniture's beauty!,"Grime identification,Wood cleaning,Furniture care,Cleaning solutions"
Wood Finish Guide: Cleaning Safely,https://res.cloudinary.com/dsxuwwnsc/image/upload/v1748920851/pin_2_10_jzpyck.webp,wood-care-tips,,https://www.beacleaner.com/how-to-clean-grime-off-wood-furniture?utm_source=pinterest&utm_campaign=wood-finish-guide-cl,2025-06-03,"Different wood finishes require different cleaning methods. This guide helps you identify your wood finish and choose the safest, most effective cleaning products.  Avoid damage and preserve the beauty of your furniture – click to learn more!","Wood finish,Cleaning guide,Furniture care,Wood types"
Revive Old Wood Furniture: Cleaning Secrets,https://res.cloudinary.com/dsxuwwnsc/image/upload/v1748920858/pin_2_11_ofx3y4.webp,furniture-restoration-tips,,https://www.beacleaner.com/how-to-clean-grime-off-wood-furniture?utm_source=pinterest&utm_campaign=revive-old-wood-furn,2025-06-03,"Is your antique wood furniture looking tired and worn?  Don't give up on it! This post reveals the secrets to reviving old wood furniture and restoring its original beauty. Learn how to gently clean, polish, and protect your treasured pieces.","Antique furniture,Wood restoration,Cleaning tips,Vintage furniture"
Quick Wood Furniture Cleaning Routine,https://res.cloudinary.com/dsxuwwnsc/image/upload/v1748920864/pin_2_12_hsyu2d.webp,home-cleaning-tips,,https://www.beacleaner.com/how-to-clean-grime-off-wood-furniture?utm_source=pinterest&utm_campaign=quick-wood-furniture,2025-06-03,Busy schedule? No problem! This post shares a quick and easy wood furniture cleaning routine that will keep your pieces looking their best with minimal effort.  A little maintenance goes a long way – click to learn how!,"Quick cleaning,Wood furniture,Cleaning routine,Easy cleaning"
The Best Tools for Cleaning Wood Furniture,https://res.cloudinary.com/dsxuwwnsc/image/upload/v1748920870/pin_2_13_vevpz6.webp,wood-care-tips,,https://www.beacleaner.com/how-to-clean-grime-off-wood-furniture?utm_source=pinterest&utm_campaign=the-best-tools-for-c,2025-06-03,"Having the right tools makes all the difference! This post highlights the essential tools you need to clean and maintain your wood furniture effectively.  From microfiber cloths to specialized brushes, we've got you covered.","Cleaning tools,Wood care,Furniture polish,Cleaning supplies"
Wood Furniture Cleaning Mistakes to Avoid,https://res.cloudinary.com/dsxuwwnsc/image/upload/v1748920875/pin_2_14_fidn0f.webp,wood-care-tips,,https://www.beacleaner.com/how-to-clean-grime-off-wood-furniture?utm_source=pinterest&utm_campaign=wood-furniture-clean,2025-06-03,"Don't make these common wood furniture cleaning mistakes! This post reveals the pitfalls to avoid, protecting your investment and ensuring a beautiful, lasting finish.  Learn from our mistakes and keep your furniture looking its best!","Cleaning mistakes,Wood care,Furniture protection,Avoid damage"
Grime-Free Wood Furniture: Before & After,https://res.cloudinary.com/dsxuwwnsc/image/upload/v1748920882/pin_2_15_erqhib.webp,wood-cleaning-tips,,https://www.beacleaner.com/how-to-clean-grime-off-wood-furniture?utm_source=pinterest&utm_campaign=grime-free-wood-furn,2025-06-03,See the amazing transformation! This post features stunning before & after photos of wood furniture cleaned using the techniques outlined in the blog post.  Get inspired and see the results for yourself!,"Before and after,Wood cleaning,Furniture restoration,Grime removal"
Wood Furniture Cleaning for Every Room,https://res.cloudinary.com/dsxuwwnsc/image/upload/v1748920887/pin_2_16_nnj3mw.webp,wood-care-tips,,https://www.beacleaner.com/how-to-clean-grime-off-wood-furniture?utm_source=pinterest&utm_campaign=wood-furniture-clean,2025-06-03,"From the living room to the bedroom, this post provides tailored wood furniture cleaning tips for every room in your home.  Keep your entire house looking sparkling clean and inviting!","Room-specific cleaning,Wood furniture,Cleaning tips,Home cleaning"
Protecting Wood Furniture from Water Damage,https://res.cloudinary.com/dsxuwwnsc/image/upload/v1748920894/pin_2_17_c9y9fa.webp,furniture-care-tips,,https://www.beacleaner.com/how-to-clean-grime-off-wood-furniture?utm_source=pinterest&utm_campaign=protecting-wood-furn,2025-06-03,Water damage is a wood furniture's worst enemy! This post shares tips on preventing water damage and cleaning up spills quickly and effectively.  Protect your investment and keep your furniture looking its best.,"Water damage,Wood protection,Cleaning spills,Furniture care"
Wood Furniture Cleaning: A Seasonal Guide,https://res.cloudinary.com/dsxuwwnsc/image/upload/v1748920904/pin_2_18_nqbovb.webp,wood-care-tips,,https://www.beacleaner.com/how-to-clean-grime-off-wood-furniture?utm_source=pinterest&utm_campaign=wood-furniture-clean,2025-06-03,Keep your wood furniture looking its best year-round with this seasonal cleaning guide!  Learn how to adjust your cleaning routine based on the weather and your lifestyle.,"Seasonal cleaning,Wood furniture,Cleaning schedule,Home maintenance"
The Science of Wood Cleaning: What Works?,https://res.cloudinary.com/dsxuwwnsc/image/upload/v1748920911/pin_2_19_ti5jwl.webp,wood-cleaning-tips,,https://www.beacleaner.com/how-to-clean-grime-off-wood-furniture?utm_source=pinterest&utm_campaign=the-science-of-wood-,2025-06-03,"Ever wondered *why* certain cleaning methods work better than others? This post dives into the science of wood cleaning, explaining the chemical reactions and best practices.","Wood science,Cleaning methods,Furniture care,Effective cleaning"
Wood Furniture Cleaning: Pet-Friendly Options,https://res.cloudinary.com/dsxuwwnsc/image/upload/v1748920916/pin_2_20_byjdd7.webp,wood-care-tips,,https://www.beacleaner.com/how-to-clean-grime-off-wood-furniture?utm_source=pinterest&utm_campaign=wood-furniture-clean,2025-06-03,Love your pets but hate the paw prints and fur on your wood furniture? This post shares pet-friendly cleaning options that are safe for your furry friends.,"Pet-friendly cleaning,Wood furniture,Safe cleaning,Animal lovers"
Wood Furniture Cleaning: Kid-Friendly Options,https://res.cloudinary.com/dsxuwwnsc/image/upload/v1748920923/pin_2_21_yfbiqa.webp,wood-care-tips,,https://www.beacleaner.com/how-to-clean-grime-off-wood-furniture?utm_source=pinterest&utm_campaign=wood-furniture-clean,2025-06-03,Keep your wood furniture clean and safe for your little ones with these kid-friendly cleaning options.  No harsh chemicals or dangerous fumes!,"Kid-friendly cleaning,Wood furniture,Safe cleaning,Family home"
Wood Furniture Cleaning: Budget-Friendly Tips,https://res.cloudinary.com/dsxuwwnsc/image/upload/v1748920931/pin_2_22_wizgoe.webp,wood-care-tips,,https://www.beacleaner.com/how-to-clean-grime-off-wood-furniture?utm_source=pinterest&utm_campaign=wood-furniture-clean,2025-06-03,You don't need to spend a fortune to keep your wood furniture looking its best! This post shares budget-friendly cleaning tips and DIY solutions.,"Budget cleaning,Wood furniture,DIY cleaning,Save money"
Wood Furniture Cleaning: Expert Advice,https://res.cloudinary.com/dsxuwwnsc/image/upload/v1748920939/pin_2_23_fbo1p5.webp,wood-care-tips,,https://www.beacleaner.com/how-to-clean-grime-off-wood-furniture?utm_source=pinterest&utm_campaign=wood-furniture-clean,2025-06-03,Get expert advice on cleaning and maintaining your wood furniture from the pros at BeaCleaner!  Learn the secrets to a sparkling clean home.,"Expert advice,Wood furniture,Cleaning tips,Professional cleaning"
Wood Furniture Cleaning Checklist: Stay Organized,https://res.cloudinary.com/dsxuwwnsc/image/upload/v1748920945/pin_2_24_dgnbm3.webp,wood-care-tips,,https://www.beacleaner.com/how-to-clean-grime-off-wood-furniture?utm_source=pinterest&utm_campaign=wood-furniture-clean,2025-06-03,Stay on top of your wood furniture cleaning with this handy checklist!  Print it out and use it to create a regular cleaning schedule.,"Cleaning checklist,Wood furniture,Organization,Cleaning schedule"
Wood Furniture Cleaning: The Power of Polish,https://res.cloudinary.com/dsxuwwnsc/image/upload/v1748920951/pin_2_25_zlacpo.webp,wood-care-tips,,https://www.beacleaner.com/how-to-clean-grime-off-wood-furniture?utm_source=pinterest&utm_campaign=wood-furniture-clean,2025-06-03,Unlock the power of polish! This post explains how to choose the right polish for your wood furniture and apply it for a stunning shine.,"Wood polish,Furniture shine,Cleaning tips,Wood care"
Title,https://res.cloudinary.com/dsxuwwnsc/image/upload/v1748920994/pin_3_1_ownllt.webp,please-provide-the-title-and-keywords-i-need-that-information-to-suggest-a-board-name-once,,https://www.beacleaner.com/how-to-get-printer-ink-out-of-carpet?utm_source=pinterest&utm_campaign=title,2025-06-03,Description,Keywords
Printer Ink on Carpet?! Don't Panic!,https://res.cloudinary.com/dsxuwwnsc/image/upload/v1748921002/pin_3_2_vfwmqm.webp,stain-removal-tips,,https://www.beacleaner.com/how-to-get-printer-ink-out-of-carpet?utm_source=pinterest&utm_campaign=printer-ink-on-carpe,2025-06-03,Spilled printer ink on your carpet? 😱 Don't replace it! This guide reveals simple,effective methods to lift that stain & save your floors. From rubbing alcohol to hairspray
Ink Stain SOS: Carpet Rescue!,https://res.cloudinary.com/dsxuwwnsc/image/upload/v1748921009/pin_3_3_hxzfmx.webp,cleaning-tips,,https://www.beacleaner.com/how-to-get-printer-ink-out-of-carpet?utm_source=pinterest&utm_campaign=ink-stain-sos-carpet,2025-06-03,Uh oh! Printer ink disaster? 😩 Before you call a professional,try these DIY carpet cleaning hacks! We'll show you how to tackle fresh *and* dried ink stains with common household items. Save money
Rubbing Alcohol: Ink's Worst Enemy,https://res.cloudinary.com/dsxuwwnsc/image/upload/v1748921015/pin_3_4_j5uaac.webp,cleaning-tips-ideas,,https://www.beacleaner.com/how-to-get-printer-ink-out-of-carpet?utm_source=pinterest&utm_campaign=rubbing-alcohol-inks,2025-06-03,Did you know rubbing alcohol is a secret weapon against printer ink? 💥 This pin details how to use it effectively (and safely!) on your carpet. We break down the process step-by-step,ensuring a thorough clean without damaging your fibers. Click to learn the best technique for a spotless result! #RubbingAlcohol #InkRemoval #CarpetCare #CleaningTips
Hairspray to the Rescue! (Really!),https://res.cloudinary.com/dsxuwwnsc/image/upload/v1748921022/pin_3_5_efaaz2.webp,cleaning-tips,,https://www.beacleaner.com/how-to-get-printer-ink-out-of-carpet?utm_source=pinterest&utm_campaign=hairspray-to-the-res,2025-06-03,Believe it or not,hairspray can help lift printer ink from carpet! 🤯 This pin explains how to use this surprising solution
Fresh Ink vs. Dried Ink: What to Do,https://res.cloudinary.com/dsxuwwnsc/image/upload/v1748921028/pin_3_6_tom1lc.webp,carpet-cleaning-tips,,https://www.beacleaner.com/how-to-get-printer-ink-out-of-carpet?utm_source=pinterest&utm_campaign=fresh-ink-vs-dried-i,2025-06-03,Knowing the difference between a fresh and dried ink stain is crucial for successful removal. 🤔 This pin highlights the specific approaches for each scenario,maximizing your chances of a clean carpet. Don't waste time with the wrong method! Click to learn the best strategy for *your* ink stain. #FreshInk #DriedInk #CarpetStainGuide #CleaningSolutions
DIY Ink Stain Remover Recipe,https://res.cloudinary.com/dsxuwwnsc/image/upload/v1748921034/pin_3_7_pqhszz.webp,cleaning-tips,,https://www.beacleaner.com/how-to-get-printer-ink-out-of-carpet?utm_source=pinterest&utm_campaign=diy-ink-stain-remove,2025-06-03,Skip the expensive cleaners! 💰 This pin shares a simple,effective DIY ink stain remover recipe you can make with ingredients you probably already have. Save money and get a professional-level clean. Click to get the recipe and banish that ink stain for good! #DIYRemover #InkStainRecipe #HomemadeCleaner #CarpetCleaning
Blot,https://res.cloudinary.com/dsxuwwnsc/image/upload/v1748921040/pin_3_8_opxour.webp,cleaning-tips,,https://www.beacleaner.com/how-to-get-printer-ink-out-of-carpet?utm_source=pinterest&utm_campaign=blot,2025-06-03,Don't Rub! The Golden Rule,Rubbing an ink stain only spreads the mess! ❌ This pin emphasizes the importance of blotting and provides a clear demonstration of the correct technique. Learn how to lift the ink effectively without making the problem worse. Click for a stain-free carpet! #BlotNotRub #InkStainTips #CarpetCleaning101 #CleaningTechniques
The Ultimate Ink Stain Checklist,https://res.cloudinary.com/dsxuwwnsc/image/upload/v1748921048/pin_3_9_y6snod.webp,cleaning-tips,,https://www.beacleaner.com/how-to-get-printer-ink-out-of-carpet?utm_source=pinterest&utm_campaign=the-ultimate-ink-sta,2025-06-03,Feeling overwhelmed? 😫 This pin provides a handy checklist to guide you through the ink removal process,ensuring you don't miss a step. From gathering supplies to final inspection
Is Professional Cleaning Needed?,https://res.cloudinary.com/dsxuwwnsc/image/upload/v1748921054/pin_3_10_yzqchw.webp,carpet-cleaning-tips,,https://www.beacleaner.com/how-to-get-printer-ink-out-of-carpet?utm_source=pinterest&utm_campaign=is-professional-clea,2025-06-03,Sometimes,a DIY approach isn't enough. 🤔 This pin helps you determine when it's time to call a professional carpet cleaner. Don't risk damaging your carpet – know when to seek expert help. Click to learn the signs! #ProfessionalCleaning #CarpetCleaner #InkStainHelp #WhenToCallAPro
Dealing with Large Ink Spills,https://res.cloudinary.com/dsxuwwnsc/image/upload/v1748921062/pin_3_11_jv9hfq.webp,carpet-cleaning-tips,,https://www.beacleaner.com/how-to-get-printer-ink-out-of-carpet?utm_source=pinterest&utm_campaign=dealing-with-large-i,2025-06-03,A large ink spill can feel daunting. 😱 This pin provides specific strategies for tackling extensive stains,including sectioning off the area and working in stages. Don't give up – you can still save your carpet! Click for a step-by-step guide. #LargeInkSpill #CarpetStainSolution #CleaningBigMesses #StainRemovalTips
The Best Tools for Ink Removal,https://res.cloudinary.com/dsxuwwnsc/image/upload/v1748921067/pin_3_12_vrv8ut.webp,wood-care-tips,,https://www.beacleaner.com/how-to-get-printer-ink-out-of-carpet?utm_source=pinterest&utm_campaign=the-best-tools-for-i,2025-06-03,Having the right tools makes all the difference! 🧽 This pin showcases the essential tools for effective ink removal,from clean cloths to spray bottles. Get prepared and tackle that stain with confidence. Click to see the list! #CleaningTools #InkRemovalKit #CarpetCleaningSupplies #EssentialCleaning
