Title,Media URL,Pinterest board,Thumbnail,Link,Publish date,Description,Keywords
Title,https://res.cloudinary.com/dbcpfy04c/image/upload/v1748067800/pin_1_1_q0oabx.webp,please-provide-the-title-and-keywords-i-need-that-information-to-suggest-a-board-name-once,,https://www.beacleaner.com/how-to-clean-magnetic-eyelashes?utm_source=pinterest&utm_campaign=title,2025-05-24,Description,Keywords
Magnetic Lashes: Keep 'Em Flawless!,https://res.cloudinary.com/dbcpfy04c/image/upload/v1748067808/pin_1_2_agmcaa.webp,lash-tips-ideas,,https://www.beacleaner.com/how-to-clean-magnetic-eyelashes?utm_source=pinterest&utm_campaign=magnetic-lashes-keep,2025-05-24,Tired of gunk ruining your gorgeous magnetic lashes? This guide reveals the *easy* steps to clean & sanitize them,extending their life & preventing eye infections! Learn the best tools
Extend Your Lash Life! (Cleaning Tips),https://res.cloudinary.com/dbcpfy04c/image/upload/v1748067813/pin_1_3_kvo2uc.webp,lash-care-tips,,https://www.beacleaner.com/how-to-clean-magnetic-eyelashes?utm_source=pinterest&utm_campaign=extend-your-lash-lif,2025-05-24,Don't let makeup buildup shorten the lifespan of your favorite magnetic lashes! This pin highlights the importance of regular cleaning for both lash health *and* your wallet. Discover the simple steps to remove mascara,liner
The *Right* Way to Clean Magnetic Lashes,https://res.cloudinary.com/dbcpfy04c/image/upload/v1748067819/pin_1_4_aeoy6t.webp,lash-care-tips,,https://www.beacleaner.com/how-to-clean-magnetic-eyelashes?utm_source=pinterest&utm_campaign=the-right-way-to-cle,2025-05-24,Are you cleaning your magnetic lashes correctly? Many people make mistakes that can damage the magnets or leave behind residue. This pin reveals the common cleaning errors to avoid and the best practices for a thorough,gentle clean.  Protect your eyes and get the most out of your lashes! Click to read the full guide and become a magnetic lash cleaning expert. #MagneticLashCleaning #LashCareTips #BeautyGuide #EyeHealth
Magnetic Lash Cleaning: Step-by-Step,https://res.cloudinary.com/dbcpfy04c/image/upload/v1748067825/pin_1_5_lvyphr.webp,lash-care-tips,,https://www.beacleaner.com/how-to-clean-magnetic-eyelashes?utm_source=pinterest&utm_campaign=magnetic-lash-cleani,2025-05-24,Visual learners rejoice! This pin provides a clear,step-by-step guide to cleaning your magnetic lashes. From soaking to drying
Protect Your Eyes: Lash Hygiene,https://res.cloudinary.com/dbcpfy04c/image/upload/v1748067831/pin_1_6_sssoxz.webp,lash-care-tips,,https://www.beacleaner.com/how-to-clean-magnetic-eyelashes?utm_source=pinterest&utm_campaign=protect-your-eyes-la,2025-05-24,Your eye health is paramount! This pin emphasizes the link between clean lashes and healthy eyes. Learn how to prevent irritation,infections
Magnetic Lashes: Cleaning Tools You Need,https://res.cloudinary.com/dbcpfy04c/image/upload/v1748067837/pin_1_7_lpp7cs.webp,lash-tips-ideas,,https://www.beacleaner.com/how-to-clean-magnetic-eyelashes?utm_source=pinterest&utm_campaign=magnetic-lashes-clea,2025-05-24,Wondering what tools you need to clean your magnetic lashes effectively? This pin showcases the essential supplies,from gentle cleansers to soft brushes.  We'll help you build a lash cleaning kit that will keep your lashes in top condition. Click to read the full guide and shop our recommendations! #LashTools #CleaningSupplies #MagneticLashKit #BeautyEssentials
The Ultimate Magnetic Lash Guide,https://res.cloudinary.com/dbcpfy04c/image/upload/v1748067843/pin_1_8_gb8ajd.webp,lash-tips-ideas,,https://www.beacleaner.com/how-to-clean-magnetic-eyelashes?utm_source=pinterest&utm_campaign=the-ultimate-magneti,2025-05-24,From application to removal to cleaning,this pin is your one-stop shop for all things magnetic lashes! We cover everything you need to know to achieve a flawless look and keep your lashes in perfect condition.  Click to read the full guide and become a magnetic lash pro! #MagneticLashGuide #LashTips #BeautyBlog #LashTutorial
Don't Make These Lash Cleaning Mistakes!,https://res.cloudinary.com/dbcpfy04c/image/upload/v1748067850/pin_1_9_u7bja4.webp,lash-care-tips,,https://www.beacleaner.com/how-to-clean-magnetic-eyelashes?utm_source=pinterest&utm_campaign=dont-make-these-lash,2025-05-24,Avoid these common pitfalls that can ruin your magnetic lashes! This pin highlights the biggest cleaning mistakes to avoid,ensuring you keep your lashes looking their best.  Learn from our mistakes and protect your investment! Click to read the full article. #LashMistakes #CleaningErrors #MagneticLashCare #BeautyTips
Magnetic Lashes: Cleaning for Beginners,https://res.cloudinary.com/dbcpfy04c/image/upload/v1748067855/pin_1_10_hvkwzd.webp,lash-tips-ideas,,https://www.beacleaner.com/how-to-clean-magnetic-eyelashes?utm_source=pinterest&utm_campaign=magnetic-lashes-clea,2025-05-24,Just starting out with magnetic lashes? This pin is perfect for beginners! We'll walk you through the cleaning process step-by-step,making it easy and stress-free.  Get ready to rock those lashes with confidence! Click to read the full guide. #BeginnerLashTips #MagneticLashTutorial #EasyLashCare #LashNewbie
Clean Lashes = Confident You!,https://res.cloudinary.com/dbcpfy04c/image/upload/v1748067860/pin_1_11_xtjjfy.webp,beauty-tips,,https://www.beacleaner.com/how-to-clean-magnetic-eyelashes?utm_source=pinterest&utm_campaign=clean-lashes-confide,2025-05-24,Feeling good about your appearance starts with hygiene. This pin connects clean lashes to self-confidence,emphasizing the importance of taking care of yourself.  Invest in your beauty and feel amazing! Click to read the full article. #SelfCare #BeautyConfidence #LashHygiene #FeelGoodBeauty
Magnetic Lash Cleaning: Before & After,https://res.cloudinary.com/dbcpfy04c/image/upload/v1748067866/pin_1_12_hyn2zj.webp,lash-care-tips,,https://www.beacleaner.com/how-to-clean-magnetic-eyelashes?utm_source=pinterest&utm_campaign=magnetic-lash-cleani,2025-05-24,See the dramatic difference a good cleaning can make! This pin showcases a before-and-after comparison,highlighting the removal of makeup and debris.  Proof that cleaning is essential! Click to read the full guide and see the results for yourself. #BeforeAndAfter #LashTransformation #MagneticLashCleaning #VisibleResults
Magnetic Lash Cleaning: Q&A,https://res.cloudinary.com/dbcpfy04c/image/upload/v1748067871/pin_1_13_klnm4c.webp,lash-care-tips,,https://www.beacleaner.com/how-to-clean-magnetic-eyelashes?utm_source=pinterest&utm_campaign=magnetic-lash-cleani,2025-05-24,Got questions about cleaning magnetic lashes? This pin answers frequently asked questions,addressing common concerns and providing expert advice.  Get all your questions answered in one place! Click to read the full article. #LashFAQ #MagneticLashQuestions #BeautyAdvice #LashHelp
Magnetic Lash Cleaning: Pro Tips,https://res.cloudinary.com/dbcpfy04c/image/upload/v1748067876/pin_1_14_icdo6w.webp,lash-care-tips,,https://www.beacleaner.com/how-to-clean-magnetic-eyelashes?utm_source=pinterest&utm_campaign=magnetic-lash-cleani,2025-05-24,Want to take your lash cleaning game to the next level? This pin shares pro tips from lash experts,helping you achieve a salon-quality clean at home.  Impress your friends with your flawless lashes! Click to read the full guide. #ProLashTips #LashExpertAdvice #MagneticLashCare #BeautySecrets
Title,https://res.cloudinary.com/dbcpfy04c/image/upload/v1748067928/pin_2_1_gtsnmr.webp,please-provide-the-title-and-keywords-i-need-that-information-to-suggest-a-board-name-once,,https://www.beacleaner.com/how-to-clean-margaritaville-machine-dm1000?utm_source=pinterest&utm_campaign=title,2025-05-24,Description,Keywords
Margaritaville DM1000: Sparkling Clean!,https://res.cloudinary.com/dbcpfy04c/image/upload/v1748067934/pin_2_2_xolx83.webp,summer-drinks-ideas,,https://www.beacleaner.com/how-to-clean-margaritaville-machine-dm1000?utm_source=pinterest&utm_campaign=margaritaville-dm100,2025-05-24,"Dreaming of endless summer cocktails? Don't let a dirty Margaritaville DM1000 ruin your fun! This easy guide walks you through a deep clean, from the ice reservoir to the blending jar. We'll show you how to banish sticky residue and prevent mold, ensuring your machine lasts for years of delicious margaritas.  Say goodbye to cleaning stress and hello to more happy hours! Click to learn the simple steps and keep your Margaritaville looking (and performing!) its best. Don't wait, get back to blending!","Margaritaville,Cleaning,Cocktail Machine,Summer"
Easy Margaritaville Cleaning Guide 🍹,https://res.cloudinary.com/dbcpfy04c/image/upload/v1748067940/pin_2_3_kh7igw.webp,cleaning-tips,,https://www.beacleaner.com/how-to-clean-margaritaville-machine-dm1000?utm_source=pinterest&utm_campaign=easy-margaritaville-,2025-05-24,“Is your Margaritaville DM1000 looking a little worse for wear? Don't replace it,revive it! This step-by-step guide makes cleaning a breeze. We cover everything from daily quick rinses to a thorough deep clean
Margaritaville DM1000: Deep Clean Secrets,https://res.cloudinary.com/dbcpfy04c/image/upload/v1748067946/pin_2_4_jrv0a9.webp,summer-drinks-ideas,,https://www.beacleaner.com/how-to-clean-margaritaville-machine-dm1000?utm_source=pinterest&utm_campaign=margaritaville-dm100,2025-05-24,“Don't let a dirty Margaritaville DM1000 be a party foul! This guide reveals the hidden spots that collect grime and how to tackle them effectively. We'll show you how to disassemble and clean each part,"preventing buildup and ensuring your machine stays hygienic.  Enjoy peace of mind knowing your drinks are made in a sparkling clean environment. Click to learn the pro tips and keep the good times flowing!  It's easier than you think!"""
Keep Your Margaritaville Fresh! ✨,https://res.cloudinary.com/dbcpfy04c/image/upload/v1748067952/pin_2_5_c1yz8m.webp,summer-cleaning-tips,,https://www.beacleaner.com/how-to-clean-margaritaville-machine-dm1000?utm_source=pinterest&utm_campaign=keep-your-margaritav,2025-05-24,“Love your Margaritaville DM1000? Show it some love with regular cleaning! This guide provides a simple maintenance schedule to keep your machine in top condition.  We'll help you avoid costly repairs and extend its lifespan.  Imagine always having a ready-to-go margarita maker for spontaneous celebrations. Click to learn how to prevent buildup and enjoy years of delicious drinks!  Don't let a little grime stand between you and paradise.,"Margaritaville Maintenance,Cleaning Schedule,Cocktail,Summer Drinks"
Margaritaville DM1000: No More Mold!,https://res.cloudinary.com/dbcpfy04c/image/upload/v1748067957/pin_2_6_j64kqs.webp,summer-drinks-ideas,,https://www.beacleaner.com/how-to-clean-margaritaville-machine-dm1000?utm_source=pinterest&utm_campaign=margaritaville-dm100,2025-05-24,“Worried about mold in your Margaritaville DM1000?  You're not alone! This guide tackles mold prevention and removal,ensuring your machine stays safe and sanitary. We'll show you how to properly dry each part and prevent future growth.  Enjoy your margaritas with confidence
Quick Margaritaville Clean: 5 Minutes!,https://res.cloudinary.com/dbcpfy04c/image/upload/v1748067963/pin_2_7_xq643s.webp,kitchen-tips,,https://www.beacleaner.com/how-to-clean-margaritaville-machine-dm1000?utm_source=pinterest&utm_campaign=quick-margaritaville,2025-05-24,“Short on time? No problem! This guide shows you how to give your Margaritaville DM1000 a quick clean in just 5 minutes. Perfect for after a busy party or a spontaneous margarita craving.  We'll focus on the essential parts to keep your machine fresh and ready to go. Click to learn the fast and easy steps and enjoy more margaritas,"less cleaning!  Life's too short for a dirty margarita machine!"""
Margaritaville DM1000: Blending Jar Bliss,https://res.cloudinary.com/dbcpfy04c/image/upload/v1748067971/pin_2_8_o2bpxg.webp,summer-drinks-ideas,,https://www.beacleaner.com/how-to-clean-margaritaville-machine-dm1000?utm_source=pinterest&utm_campaign=margaritaville-dm100,2025-05-24,“Is your Margaritaville DM1000's blending jar looking cloudy or stained? This guide focuses specifically on cleaning the blending jar,"removing stubborn residue and restoring its sparkle. We'll share our favorite cleaning solutions and techniques.  Enjoy crystal-clear margaritas every time! Click to learn the secrets to a spotless blending jar and elevate your cocktail game!  It's the heart of your margarita magic!"""
Ice Reservoir Cleaning: Margaritaville,https://res.cloudinary.com/dbcpfy04c/image/upload/v1748067977/pin_2_9_v5n0wb.webp,drink-station-tips,,https://www.beacleaner.com/how-to-clean-margaritaville-machine-dm1000?utm_source=pinterest&utm_campaign=ice-reservoir-cleani,2025-05-24,“Don't forget the ice reservoir! This guide shows you how to properly clean and sanitize your Margaritaville DM1000's ice reservoir,preventing bacteria growth and ensuring fresh
DIY Margaritaville Cleaning Solution 🍋,https://res.cloudinary.com/dbcpfy04c/image/upload/v1748067983/pin_2_10_ocexcf.webp,cleaning-tips,,https://www.beacleaner.com/how-to-clean-margaritaville-machine-dm1000?utm_source=pinterest&utm_campaign=diy-margaritaville-c,2025-05-24,“Skip the harsh chemicals! This guide shares a DIY cleaning solution for your Margaritaville DM1000,using natural ingredients you probably already have at home.  It's effective
Margaritaville DM1000: Prevent Sticky Messes,https://res.cloudinary.com/dbcpfy04c/image/upload/v1748067987/pin_2_11_phprig.webp,summer-drinks-ideas,,https://www.beacleaner.com/how-to-clean-margaritaville-machine-dm1000?utm_source=pinterest&utm_campaign=margaritaville-dm100,2025-05-24,“Tired of sticky messes after every margarita session? This guide provides tips for preventing buildup and making cleaning easier.  We'll share strategies for containing spills and rinsing immediately.  Enjoy more time sipping and less time scrubbing! Click to learn the preventative measures and keep your Margaritaville sparkling clean!  A little prevention goes a long way!,"Preventative Cleaning,Margaritaville,Cleaning Tips,Cocktail"
Restore Your Margaritaville: Before & After,https://res.cloudinary.com/dbcpfy04c/image/upload/v1748067995/pin_2_12_jfjn9a.webp,outdoor-revival-ideas,,https://www.beacleaner.com/how-to-clean-margaritaville-machine-dm1000?utm_source=pinterest&utm_campaign=restore-your-margari,2025-05-24,“See the amazing transformation! This pin features a stunning before & after of a deep-cleaned Margaritaville DM1000.  It's proof that even the dirtiest machines can be restored to their former glory.  Get inspired and click to learn how to achieve similar results!  Don't give up on your machine,"we can help!"""
Margaritaville DM1000: Disassembly Guide,https://res.cloudinary.com/dbcpfy04c/image/upload/v1748068001/pin_2_13_ttfkrv.webp,summer-drinks-ideas,,https://www.beacleaner.com/how-to-clean-margaritaville-machine-dm1000?utm_source=pinterest&utm_campaign=margaritaville-dm100,2025-05-24,“Feeling intimidated by disassembly? Don't be! This guide provides a clear,"step-by-step visual guide to disassembling your Margaritaville DM1000 for a thorough cleaning.  We'll show you exactly which parts to remove and how to put them back together. Click to learn the process and conquer your cleaning fears!  It's easier than it looks!"""
Margaritaville Cleaning Checklist 📝,https://res.cloudinary.com/dbcpfy04c/image/upload/v1748068006/pin_2_14_zh2frw.webp,summer-drinks-ideas,,https://www.beacleaner.com/how-to-clean-margaritaville-machine-dm1000?utm_source=pinterest&utm_campaign=margaritaville-clean,2025-05-24,“Stay on top of your cleaning routine with this handy Margaritaville DM1000 cleaning checklist!  It outlines everything you need to do,"from daily rinses to monthly deep cleans.  Print it out and keep it handy for a sparkling clean machine. Click to download the checklist and simplify your cleaning!  Organization is key!"""
Margaritaville DM1000: The Ultimate Guide,https://res.cloudinary.com/dbcpfy04c/image/upload/v1748068011/pin_2_15_tmhp0q.webp,summer-drinks-ideas,,https://www.beacleaner.com/how-to-clean-margaritaville-machine-dm1000?utm_source=pinterest&utm_campaign=margaritaville-dm100,2025-05-24,“Everything you need to know about cleaning your Margaritaville DM1000 is right here! This pin links to the ultimate guide,covering every aspect of cleaning and maintenance.  From quick rinses to deep cleans
Margaritaville: Extend Its Lifespan!,https://res.cloudinary.com/dbcpfy04c/image/upload/v1748068018/pin_2_16_rn82fi.webp,outdoor-living-ideas,,https://www.beacleaner.com/how-to-clean-margaritaville-machine-dm1000?utm_source=pinterest&utm_campaign=margaritaville-exten,2025-05-24,“Want your Margaritaville DM1000 to last for years to come? Regular cleaning is the key! This guide shows you how to protect your investment and enjoy countless margaritas.  We'll share tips for preventing damage and extending its lifespan. Click to learn the secrets to a long-lasting machine!  Invest in your happiness!,"Lifespan,Margaritaville,Maintenance,Investment"
Margaritaville DM1000: Cleaning Hacks!,https://res.cloudinary.com/dbcpfy04c/image/upload/v1748068025/pin_2_17_jluybs.webp,summer-drinks-ideas,,https://www.beacleaner.com/how-to-clean-margaritaville-machine-dm1000?utm_source=pinterest&utm_campaign=margaritaville-dm100,2025-05-24,“Discover clever cleaning hacks for your Margaritaville DM1000! This pin highlights our favorite tips and tricks for tackling stubborn stains and making cleaning easier.  We'll share unexpected solutions that will save you time and effort. Click to learn the hacks and become a cleaning pro!  Work smarter,"not harder!"""
Say Goodbye to Margarita Residue! 👋,https://res.cloudinary.com/dbcpfy04c/image/upload/v1748068031/pin_2_18_dykrcn.webp,cocktail-tips,,https://www.beacleaner.com/how-to-clean-margaritaville-machine-dm1000?utm_source=pinterest&utm_campaign=say-goodbye-to-marga,2025-05-24,“Don't let sticky margarita residue ruin your fun! This guide shows you how to effectively remove all traces of sugar and fruit,leaving your Margaritaville DM1000 sparkling clean.  Enjoy fresh
Margaritaville DM1000: Cleaning Mistakes,https://res.cloudinary.com/dbcpfy04c/image/upload/v1748068037/pin_2_19_whsgy1.webp,summer-drinks-ideas,,https://www.beacleaner.com/how-to-clean-margaritaville-machine-dm1000?utm_source=pinterest&utm_campaign=margaritaville-dm100,2025-05-24,“Avoid these common cleaning mistakes with your Margaritaville DM1000! This guide highlights the errors people often make and how to avoid them.  Protect your machine and ensure a thorough clean. Click to learn the mistakes and clean like a pro!  Learn from our experience!,"Cleaning Mistakes,Margaritaville,Tips,Avoid Errors"
Margaritaville: Sparkling Summer Cocktails,https://res.cloudinary.com/dbcpfy04c/image/upload/v1748068042/pin_2_20_rbpfih.webp,outdoor-living-ideas,,https://www.beacleaner.com/how-to-clean-margaritaville-machine-dm1000?utm_source=pinterest&utm_campaign=margaritaville-spark,2025-05-24,“Picture this: a sparkling clean Margaritaville DM1000 and a refreshing summer cocktail in hand! This pin combines cleaning tips with inspiration for delicious margaritas.  Get your machine ready for summer fun! Click to learn how to clean and create the perfect margarita!  Summer vibes only!,"Summer Cocktails,Margaritaville,Cleaning,Recipes"
Margaritaville DM1000: Cleaning Tools You Need,https://res.cloudinary.com/dbcpfy04c/image/upload/v1748068047/pin_2_21_gfyz9r.webp,summer-drinks-ideas,,https://www.beacleaner.com/how-to-clean-margaritaville-machine-dm1000?utm_source=pinterest&utm_campaign=margaritaville-dm100,2025-05-24,“Make cleaning your Margaritaville DM1000 a breeze with the right tools! This pin lists the essential cleaning supplies you'll need for a thorough clean.  From brushes to sponges,"we've got you covered. Click to see the list and get prepared!  Be prepared for cleaning success!"""
Margaritaville: Deep Clean Motivation!,https://res.cloudinary.com/dbcpfy04c/image/upload/v1748068052/pin_2_22_r72mae.webp,outdoor-living-ideas,,https://www.beacleaner.com/how-to-clean-margaritaville-machine-dm1000?utm_source=pinterest&utm_campaign=margaritaville-deep-,2025-05-24,“Need a little motivation to clean your Margaritaville DM1000? This pin features a visually appealing image of a sparkling clean machine and a refreshing margarita.  Get inspired and click to learn how to achieve similar results!  You deserve a clean machine and a delicious drink!,"Cleaning Motivation,Margaritaville,Inspiration,Sparkling Clean"
Margaritaville DM1000: Cleaning FAQs,https://res.cloudinary.com/dbcpfy04c/image/upload/v1748068059/pin_2_23_qduvjg.webp,summer-drinks-ideas,,https://www.beacleaner.com/how-to-clean-margaritaville-machine-dm1000?utm_source=pinterest&utm_campaign=margaritaville-dm100,2025-05-24,“Got questions about cleaning your Margaritaville DM1000? This pin links to a comprehensive FAQ section that answers all your burning questions.  From cleaning solutions to disassembly,"we've got the answers. Click to find the answers and clean with confidence!  We've got you covered!"""
Margaritaville: The Secret to Perfect Margaritas,https://res.cloudinary.com/dbcpfy04c/image/upload/v1748068064/pin_2_24_wztiw3.webp,outdoor-living-ideas,,https://www.beacleaner.com/how-to-clean-margaritaville-machine-dm1000?utm_source=pinterest&utm_campaign=margaritaville-the-s,2025-05-24,“The secret to perfect margaritas? A clean Margaritaville DM1000! This pin emphasizes the importance of cleaning for optimal flavor and performance.  Enjoy the best margaritas possible. Click to learn how to clean and elevate your cocktail game!  Taste the difference!,"Perfect Margaritas,Margaritaville,Cleaning,Flavor"
Margaritaville DM1000: Cleaning Time-Lapse,https://res.cloudinary.com/dbcpfy04c/image/upload/v1748068071/pin_2_25_g5ttuk.webp,summer-drinks-ideas,,https://www.beacleaner.com/how-to-clean-margaritaville-machine-dm1000?utm_source=pinterest&utm_campaign=margaritaville-dm100,2025-05-24,“Watch your dirty Margaritaville DM1000 transform into a sparkling clean machine in this mesmerizing time-lapse video!  Get inspired and click to learn the cleaning steps.  It's satisfying to watch!,"Time Lapse,Margaritaville,Cleaning,Video"
Title,https://res.cloudinary.com/dbcpfy04c/image/upload/v1748068112/pin_3_1_nvcnd4.webp,please-provide-the-title-and-keywords-i-need-that-information-to-suggest-a-board-name-once,,https://www.beacleaner.com/how-to-clean-marley-floor?utm_source=pinterest&utm_campaign=title,2025-05-24,Description,Keywords
Marley Floor Cleaning: The Ultimate Guide,https://res.cloudinary.com/dbcpfy04c/image/upload/v1748068119/pin_3_2_kycd1t.webp,floor-cleaning-tips,,https://www.beacleaner.com/how-to-clean-marley-floor?utm_source=pinterest&utm_campaign=marley-floor-cleanin,2025-05-24,Is your Marley floor looking dull and lifeless? Don't replace it! This guide reveals the secrets to restoring its shine and keeping it looking fantastic for years to come. Learn the best cleaning methods,products to avoid
DIY Marley Floor Cleaner - Save Money!,https://res.cloudinary.com/dbcpfy04c/image/upload/v1748068128/pin_3_3_btswll.webp,cleaning-tips,,https://www.beacleaner.com/how-to-clean-marley-floor?utm_source=pinterest&utm_campaign=diy-marley-floor-cle,2025-05-24,Tired of expensive Marley floor cleaners? Discover a simple,effective DIY solution using ingredients you likely already have at home! This pin shows you how to create a powerful cleaner that's gentle on your floor and your wallet.  We'll walk you through the steps to a sparkling clean finish
Marley Floor: Prevent Scratches & Damage,https://res.cloudinary.com/dbcpfy04c/image/upload/v1748068134/pin_3_4_y3lxrz.webp,floor-care-tips,,https://www.beacleaner.com/how-to-clean-marley-floor?utm_source=pinterest&utm_campaign=marley-floor-prevent,2025-05-24,Protect your valuable Marley floor from scratches,scuffs
The BEST Cleaner for Marley Floors (Tested!),https://res.cloudinary.com/dbcpfy04c/image/upload/v1748068140/pin_3_5_tdmpjl.webp,floor-cleaning-tips,,https://www.beacleaner.com/how-to-clean-marley-floor?utm_source=pinterest&utm_campaign=the-best-cleaner-for,2025-05-24,Stop guessing what cleaner to use! We've tested the top Marley floor cleaners and reveal our top pick. This pin details what to look for in a cleaner,what ingredients to avoid
Marley Floor Cleaning: Step-by-Step Guide,https://res.cloudinary.com/dbcpfy04c/image/upload/v1748068145/pin_3_6_g6nsoj.webp,floor-cleaning-tips,,https://www.beacleaner.com/how-to-clean-marley-floor?utm_source=pinterest&utm_campaign=marley-floor-cleanin,2025-05-24,Confused about how to clean your Marley floor? This pin provides a clear,step-by-step guide with photos! From sweeping to mopping
Marley Floor: What *Not* To Do!,https://res.cloudinary.com/dbcpfy04c/image/upload/v1748068151/pin_3_7_c3tjm4.webp,flooring-tips,,https://www.beacleaner.com/how-to-clean-marley-floor?utm_source=pinterest&utm_campaign=marley-floor-what-no,2025-05-24,Avoid these common Marley floor cleaning mistakes! This pin reveals the biggest pitfalls that can damage your floor and shorten its lifespan. Learn what products to avoid,what techniques to skip
Restore Dull Marley Floors: Before & After,https://res.cloudinary.com/dbcpfy04c/image/upload/v1748068157/pin_3_8_pota0j.webp,floor-cleaning-tips,,https://www.beacleaner.com/how-to-clean-marley-floor?utm_source=pinterest&utm_campaign=restore-dull-marley-,2025-05-24,Witness the amazing transformation! This pin showcases a stunning before & after of a dull,dirty Marley floor restored to its former glory.  See the power of proper cleaning and learn how you can achieve similar results.  Don't live with a lackluster floor – bring back the shine! #MarleyFloorRestoration #BeforeAndAfter #FloorTransformation #CleaningResults
