Title,Media URL,Pinterest board,Thumbnail,Link,Publish date,Description,Keywords,
Briggs V-Twin: Parts Replacement Guide,https://res.cloudinary.com/dbcpfy04c/image/upload/v1618237451/placeholder.jpg,home-inspiration,,https://lawntrend.com/briggs-and-stratton-v-twin-running-on-one-cylinder/?utm_source=pinterest&utm_campaign=briggs-v-twin-parts-,2025-05-15,"Need to replace a part on your Briggs & Stratton V-Twin? We provide a guide to finding and installing the correct replacement parts.  Get the right parts for a successful repair!  Don't waste time and money on incorrect parts.  Click to learn more about parts replacement."",""Parts Replacement,V-Twin,Engine Repair","DIY""","DIY"""
V-Twin Mower: Winter Storage Tips,https://res.cloudinary.com/dbcpfy04c/image/upload/v1618237451/placeholder.jpg,home-inspiration,,https://lawntrend.com/briggs-and-stratton-v-twin-running-on-one-cylinder/?utm_source=pinterest&utm_campaign=v-twin-mower-winter-,2025-05-15,"Proper winter storage is crucial for maintaining your Briggs & Stratton V-Twin. Learn how to prepare your mower for the off-season.  Protect your investment during the winter months!  Ensure a smooth start-up next spring.  Click to learn more about winter storage."",""Winter Storage,V-Twin,Mower Maintenance","Off-Season""","Off-Season"""
Briggs & Stratton: Fuel Stabilizer,https://res.cloudinary.com/dbcpfy04c/image/upload/v1618237451/placeholder.jpg,home-inspiration,,https://lawntrend.com/briggs-and-stratton-v-twin-running-on-one-cylinder/?utm_source=pinterest&utm_campaign=briggs-stratton-fuel,2025-05-15,"Using fuel stabilizer can prevent fuel-related problems and keep your Briggs & Stratton V-Twin running smoothly.  Protect your fuel system from corrosion and degradation!  Ensure optimal engine performance.  Click to learn more about fuel stabilizer."",""Fuel Stabilizer,V-Twin,Engine Maintenance","Fuel System""","Fuel System"""
V-Twin Mower: Cleaning Your Engine,https://res.cloudinary.com/dbcpfy04c/image/upload/v1618237451/placeholder.jpg,home-inspiration,,https://lawntrend.com/briggs-and-stratton-v-twin-running-on-one-cylinder/?utm_source=pinterest&utm_campaign=v-twin-mower-cleanin,2025-05-15,"A clean engine runs cooler and more efficiently. Learn how to safely clean your Briggs & Stratton V-Twin.  Remove dirt and debris for optimal performance!  Improve engine cooling and prevent overheating.  Click to learn more about engine cleaning."",""Engine Cleaning,V-Twin,Mower Maintenance","DIY""","DIY"""
Briggs V-Twin: Understanding Your Manual,https://res.cloudinary.com/dbcpfy04c/image/upload/v1618237451/placeholder.jpg,home-inspiration,,https://lawntrend.com/briggs-and-stratton-v-twin-running-on-one-cylinder/?utm_source=pinterest&utm_campaign=briggs-v-twin-unders,2025-05-15,"Your owner's manual is a valuable resource. Learn how to use it to diagnose and repair your Briggs & Stratton V-Twin.  Unlock the secrets of your owner's manual!  Find valuable information about your engine.  Click to learn more about using your manual."",""Owner's Manual,V-Twin,Engine Repair","DIY""","DIY"""
Title,https://res.cloudinary.com/dbcpfy04c/image/upload/v1618237451/placeholder.jpg,home-inspiration,,https://lawntrend.com/25-hp-kohler-command-pro-engine-problems/?utm_source=pinterest&utm_campaign=title,2025-05-15,Description,Keywords,Keywords
Kohler Command Pro: Is Yours Failing?,https://res.cloudinary.com/dbcpfy04c/image/upload/v1618237451/placeholder.jpg,home-inspiration,,https://lawntrend.com/25-hp-kohler-command-pro-engine-problems/?utm_source=pinterest&utm_campaign=kohler-command-pro-i,2025-05-15,"Don't let a Kohler Command Pro engine ruin your weekend! This pin highlights common issues with the 25HP model, from starting problems to overheating. We break down the causes and, more importantly, how to fix them yourself. Save money and get back to enjoying your lawn! Learn to diagnose and repair issues like carburetor problems, low oil shutdown",and more. Click to read our comprehensive guide and keep your mower running smoothly. Ignoring these signs can lead to costly repairs – don't wait! #KohlerEngine #LawnMowerRepair #EngineTroubleshooting #CommandPro,and more. Click to read our comprehensive guide and keep your mower running smoothly. Ignoring these signs can lead to costly repairs – don't wait! #KohlerEngine #LawnMowerRepair #EngineTroubleshooting #CommandPro
25HP Kohler Problems: Quick Fixes,https://res.cloudinary.com/dbcpfy04c/image/upload/v1618237451/placeholder.jpg,home-inspiration,,https://lawntrend.com/25-hp-kohler-command-pro-engine-problems/?utm_source=pinterest&utm_campaign=25hp-kohler-problems,2025-05-15,Is your 25HP Kohler Command Pro engine giving you grief? This pin focuses on quick,DIY fixes for common problems. We cover everything from spark plug issues to fuel line clogs.  Don't feel helpless!  We provide step-by-step instructions and clear visuals to help you tackle these repairs with confidence.  A little maintenance can save you a lot of money and frustration.  Click to learn how to keep your engine purring like new!  Avoid expensive mechanic bills! #KohlerCommandPro #DIYRepair #SmallEngine #LawnCare,DIY fixes for common problems. We cover everything from spark plug issues to fuel line clogs.  Don't feel helpless!  We provide step-by-step instructions and clear visuals to help you tackle these repairs with confidence.  A little maintenance can save you a lot of money and frustration.  Click to learn how to keep your engine purring like new!  Avoid expensive mechanic bills! #KohlerCommandPro #DIYRepair #SmallEngine #LawnCare
Kohler Command Pro: Starting Issues?,https://res.cloudinary.com/dbcpfy04c/image/upload/v1618237451/placeholder.jpg,home-inspiration,,https://lawntrend.com/25-hp-kohler-command-pro-engine-problems/?utm_source=pinterest&utm_campaign=kohler-command-pro-s,2025-05-15,"Struggling to start your 25HP Kohler Command Pro? You're not alone! This pin dives deep into the most frequent starting problems, including carburetor issues, fuel delivery problems",and faulty safety switches.  We'll help you pinpoint the cause and get your engine roaring back to life.  Don't waste another sunny day pulling on the starter cord!  Click to read our guide and get back to mowing.  Frustrated with a non-starting mower? We have the answers! #KohlerStartingProblems #EngineRepair #LawnMower #DIY,and faulty safety switches.  We'll help you pinpoint the cause and get your engine roaring back to life.  Don't waste another sunny day pulling on the starter cord!  Click to read our guide and get back to mowing.  Frustrated with a non-starting mower? We have the answers! #KohlerStartingProblems #EngineRepair #LawnMower #DIY
Kohler Command Pro: Low Oil Shutdown,https://res.cloudinary.com/dbcpfy04c/image/upload/v1618237451/placeholder.jpg,home-inspiration,,https://lawntrend.com/25-hp-kohler-command-pro-engine-problems/?utm_source=pinterest&utm_campaign=kohler-command-pro-l,2025-05-15,"Is your 25HP Kohler Command Pro engine shutting down unexpectedly? It could be the low oil sensor! This pin explains how the system works, how to diagnose a faulty sensor",and how to safely bypass it (temporarily!).  We emphasize the importance of maintaining proper oil levels.  Don't get stranded mid-mow!  Click to learn how to troubleshoot this common issue.  Safety first! #KohlerLowOil #EngineSensor #LawnMowerProblems #DIYFix,and how to safely bypass it (temporarily!).  We emphasize the importance of maintaining proper oil levels.  Don't get stranded mid-mow!  Click to learn how to troubleshoot this common issue.  Safety first! #KohlerLowOil #EngineSensor #LawnMowerProblems #DIYFix
Kohler Command Pro: Fuel Issues?,https://res.cloudinary.com/dbcpfy04c/image/upload/v1618237451/placeholder.jpg,home-inspiration,,https://lawntrend.com/25-hp-kohler-command-pro-engine-problems/?utm_source=pinterest&utm_campaign=kohler-command-pro-f,2025-05-15,Experiencing fuel delivery problems with your 25HP Kohler Command Pro? This pin covers everything from fuel line clogs to a faulty fuel pump.  We'll help you diagnose the issue and get your engine running smoothly again.  Don't let a fuel problem slow you down!  Click to read our guide and get back to mowing.  Fuel problems are common,but fixable! #KohlerFuelSystem #FuelPump #LawnMowerRepair #EngineTroubleshooting,but fixable! #KohlerFuelSystem #FuelPump #LawnMowerRepair #EngineTroubleshooting
Kohler Command Pro: Valve Problems?,https://res.cloudinary.com/dbcpfy04c/image/upload/v1618237451/placeholder.jpg,home-inspiration,,https://lawntrend.com/25-hp-kohler-command-pro-engine-problems/?utm_source=pinterest&utm_campaign=kohler-command-pro-v,2025-05-15,Valve issues can lead to reduced power and efficiency in your 25HP Kohler Command Pro engine. This pin explains how to diagnose and address valve problems.  A more advanced repair,but still DIY-able!  We provide detailed instructions and helpful visuals.  Don't ignore valve problems – they can lead to serious damage. Click to learn more! #KohlerValves #ValveAdjustment #EngineRepair #LawnMower,but still DIY-able!  We provide detailed instructions and helpful visuals.  Don't ignore valve problems – they can lead to serious damage. Click to learn more! #KohlerValves #ValveAdjustment #EngineRepair #LawnMower
Kohler 25HP: Air Filter Maintenance,https://res.cloudinary.com/dbcpfy04c/image/upload/v1618237451/placeholder.jpg,home-inspiration,,https://lawntrend.com/25-hp-kohler-command-pro-engine-problems/?utm_source=pinterest&utm_campaign=kohler-25hp-air-filt,2025-05-15,"A clean air filter is crucial for optimal engine performance. This pin shows you how to easily inspect, clean",and replace the air filter on your 25HP Kohler Command Pro engine.  Simple maintenance for a big impact!  Protect your engine from dust and debris.  Click to learn how! #KohlerAirFilter #AirFilterReplacement #LawnMowerMaintenance #SmallEngine,and replace the air filter on your 25HP Kohler Command Pro engine.  Simple maintenance for a big impact!  Protect your engine from dust and debris.  Click to learn how! #KohlerAirFilter #AirFilterReplacement #LawnMowerMaintenance #SmallEngine
Kohler 25HP: Battery & Electrical Issues,https://res.cloudinary.com/dbcpfy04c/image/upload/v1618237451/placeholder.jpg,home-inspiration,,https://lawntrend.com/25-hp-kohler-command-pro-engine-problems/?utm_source=pinterest&utm_campaign=kohler-25hp-battery-,2025-05-15,"Troubleshooting battery and electrical problems on your 25HP Kohler Command Pro engine. This pin covers common issues like a dead battery, faulty solenoid",and wiring problems.  Get your engine powered up!  We provide a step-by-step guide to diagnosis and repair.  Click to learn more! #KohlerBattery #ElectricalRepair #LawnMowerProblems #DIY,and wiring problems.  Get your engine powered up!  We provide a step-by-step guide to diagnosis and repair.  Click to learn more! #KohlerBattery #ElectricalRepair #LawnMowerProblems #DIY
