Title,Media URL,Pinterest board,Thumbnail,Link,Publish date,Description,Keywords
Beard Roller Cleaning: Don't Make These Mistakes!,https://res.cloudinary.com/dbcpfy04c/image/upload/v1747931765/pin_5_10_ky0z8x.webp,beard-care-tips,,https://www.beacleaner.com/how-to-clean-beard-roller?utm_source=pinterest&utm_campaign=beard-roller-cleanin,2025-05-22,Avoid these common mistakes when cleaning your beard roller! This post highlights the errors that can damage your roller or leave it improperly disinfected.  Learn the do's and don'ts of beard roller cleaning.  Protect your investment and ensure a hygienic grooming experience.  We'll show you how to clean your roller correctly and avoid costly mistakes.,"Beard roller mistakes, cleaning tips, skincare, men's grooming #BeardRollerMistakes #CleaningTips"
The Best Disinfectant for Your Beard Roller,https://res.cloudinary.com/dbcpfy04c/image/upload/v1747931772/pin_5_11_jhzmnv.webp,beard-care-tips,,https://www.beacleaner.com/how-to-clean-beard-roller?utm_source=pinterest&utm_campaign=the-best-disinfectan,2025-05-22,"Choosing the right disinfectant is key to effectively cleaning your beard roller. This post compares different disinfectants and recommends the best options for safety and effectiveness.  We'll cover alcohol-based solutions, sterilizing sprays, and more.  Ensure a hygienic grooming experience every time.  Don't guess – learn which disinfectant is right for your roller!","Disinfectant, beard roller, skincare, hygiene #BestDisinfectant #BeardRollerHygiene"
Beard Roller Cleaning: Before & After,https://res.cloudinary.com/dbcpfy04c/image/upload/v1747931777/pin_5_12_xxmkwq.webp,beard-care-tips,,https://www.beacleaner.com/how-to-clean-beard-roller?utm_source=pinterest&utm_campaign=beard-roller-cleanin,2025-05-22,See the difference! This post showcases before-and-after photos of a dirty beard roller and a freshly cleaned one.  The visual proof will motivate you to prioritize cleaning.  Protect your skin from bacteria and irritation.  We'll show you how to achieve these results with our easy-to-follow cleaning routine.  Don't wait – clean your beard roller today!,"Before and after, beard roller, skincare, cleaning #BeardRollerBeforeAfter #CleanSkin"
DIY Beard Roller Cleaning Solution,https://res.cloudinary.com/dbcpfy04c/image/upload/v1747931783/pin_5_13_tgtc2u.webp,beard-care-tips,,https://www.beacleaner.com/how-to-clean-beard-roller?utm_source=pinterest&utm_campaign=diy-beard-roller-cle,2025-05-22,Save money and create your own effective beard roller cleaning solution! This post provides a simple DIY recipe using readily available ingredients.  Ensure a hygienic grooming experience without breaking the bank.  We'll show you how to mix the solution and use it safely.  Don't spend a fortune on cleaning products – make your own!,"DIY cleaning, beard roller, skincare, homemade #DIYBeardRollerClean #HomemadeSkincare"
How Often Should You Clean Your Roller?,https://res.cloudinary.com/dbcpfy04c/image/upload/v1747931789/pin_5_14_tlsqrc.webp,skincare-tips,,https://www.beacleaner.com/how-to-clean-beard-roller?utm_source=pinterest&utm_campaign=how-often-should-you,2025-05-22,Wondering how often to clean your beard roller? This post provides a clear answer based on usage and skin type.  Maintain a hygienic grooming routine and prevent bacteria buildup.  We'll help you establish a cleaning schedule that works for you.  Don't risk infection – learn the optimal cleaning frequency!,"Cleaning frequency, beard roller, skincare, hygiene #BeardRollerFrequency #SkincareSchedule"
Beard Roller Cleaning: Drying Tips,https://res.cloudinary.com/dbcpfy04c/image/upload/v1747931794/pin_5_15_xnkfm7.webp,beard-care-tips,,https://www.beacleaner.com/how-to-clean-beard-roller?utm_source=pinterest&utm_campaign=beard-roller-cleanin,2025-05-22,Proper drying is just as important as disinfecting! This post provides tips for drying your beard roller effectively and preventing rust.  Ensure a long-lasting and hygienic grooming tool.  We'll show you the best drying methods and storage solutions.  Don't overlook this crucial step – learn to dry your roller correctly!,"Drying tips, beard roller, skincare, maintenance #BeardRollerDrying #RollerMaintenance"
Protect Your Investment: Clean Your Roller!,https://res.cloudinary.com/dbcpfy04c/image/upload/v1747931803/pin_5_16_mvat36.webp,skincare-tips,,https://www.beacleaner.com/how-to-clean-beard-roller?utm_source=pinterest&utm_campaign=protect-your-investm,2025-05-22,Your beard roller is an investment in your grooming routine. Protect it by cleaning it regularly! This post emphasizes the importance of maintenance and provides a comprehensive cleaning guide.  Extend the lifespan of your roller and enjoy optimal results.  Don't let neglect ruin your investment – learn to clean your roller today!,"Investment, beard roller, skincare, grooming #ProtectYourRoller #GroomingInvestment"
Beard Roller Cleaning for Sensitive Skin,https://res.cloudinary.com/dbcpfy04c/image/upload/v1747931808/pin_5_17_yzstzv.webp,beard-care-tips,,https://www.beacleaner.com/how-to-clean-beard-roller?utm_source=pinterest&utm_campaign=beard-roller-cleanin,2025-05-22,Have sensitive skin? This post provides a gentle beard roller cleaning routine that won't cause irritation.  We'll recommend mild disinfectants and avoid harsh chemicals.  Protect your skin and enjoy a comfortable grooming experience.  Don't risk irritation – learn to clean your roller safely!,"Sensitive skin, beard roller, skincare, gentle cleaning #SensitiveSkinCare #GentleCleaning"
Beard Roller Cleaning: A Visual Guide,https://res.cloudinary.com/dbcpfy04c/image/upload/v1747931814/pin_5_18_y27bxk.webp,beard-care-tips,,https://www.beacleaner.com/how-to-clean-beard-roller?utm_source=pinterest&utm_campaign=beard-roller-cleanin,2025-05-22,"Sometimes, seeing is believing! This post features a visual guide with step-by-step photos of the beard roller cleaning process.  Make it easy to follow along and ensure a thorough cleaning.  Protect your skin from bacteria and irritation.  Don't struggle with confusing instructions – learn with our visual guide!","Visual guide, beard roller, skincare, tutorial #BeardRollerTutorial #VisualSkincare"
Don't Share Your Beard Roller! (And Clean It!),https://res.cloudinary.com/dbcpfy04c/image/upload/v1747931822/pin_5_19_pka2vt.webp,beard-care-tips,,https://www.beacleaner.com/how-to-clean-beard-roller?utm_source=pinterest&utm_campaign=dont-share-your-bear,2025-05-22,Sharing is caring…except when it comes to beard rollers! This post explains why sharing a beard roller is a hygiene risk and emphasizes the importance of cleaning after each use.  Protect yourself from infection and maintain a healthy grooming routine.  Don't compromise on cleanliness – clean your roller today!,"Sharing, beard roller, hygiene, skincare #DontShareYourRoller #BeardRollerHygiene"
Beard Roller Cleaning: Storage Solutions,https://res.cloudinary.com/dbcpfy04c/image/upload/v1747931828/pin_5_20_nitluv.webp,beard-care-tips,,https://www.beacleaner.com/how-to-clean-beard-roller?utm_source=pinterest&utm_campaign=beard-roller-cleanin,2025-05-22,Proper storage is essential for keeping your beard roller clean and hygienic. This post provides storage solutions to protect your roller from dust and bacteria.  Extend its lifespan and ensure a safe grooming experience.  We'll show you the best storage options and tips for maintaining cleanliness.,"Storage solutions, beard roller, skincare, organization #BeardRollerStorage #SkincareOrganization"
The Science Behind Beard Roller Cleaning,https://res.cloudinary.com/dbcpfy04c/image/upload/v1747931834/pin_5_21_fwzoo7.webp,beard-care-tips,,https://www.beacleaner.com/how-to-clean-beard-roller?utm_source=pinterest&utm_campaign=the-science-behind-b,2025-05-22,"Understand why cleaning your beard roller is so important! This post delves into the science of bacteria and infection, explaining how a dirty roller can harm your skin.  Protect yourself from potential health risks.  We'll provide a comprehensive cleaning guide based on scientific principles.","Science, beard roller, skincare, bacteria #BeardRollerScience #SkincareScience"
Beard Roller Cleaning: FAQs Answered,https://res.cloudinary.com/dbcpfy04c/image/upload/v1747931840/pin_5_22_erlq3u.webp,beard-care-tips,,https://www.beacleaner.com/how-to-clean-beard-roller?utm_source=pinterest&utm_campaign=beard-roller-cleanin,2025-05-22,"Got questions about cleaning your beard roller? This post answers frequently asked questions, providing clear and concise information.  Address your concerns and ensure a hygienic grooming routine.  We'll cover everything from disinfectants to drying techniques.","FAQ, beard roller, skincare, questions #BeardRollerFAQ #SkincareQuestions"
Upgrade Your Grooming Routine: Clean Your Roller!,https://res.cloudinary.com/dbcpfy04c/image/upload/v1747931848/pin_5_23_qwcoq9.webp,mens-grooming-tips,,https://www.beacleaner.com/how-to-clean-beard-roller?utm_source=pinterest&utm_campaign=upgrade-your-groomin,2025-05-22,A clean beard roller is a key component of a sophisticated grooming routine. This post emphasizes the importance of hygiene and provides a comprehensive cleaning guide.  Elevate your grooming game and protect your skin.  Don't settle for less – learn to clean your roller today!,"Grooming routine, beard roller, skincare, upgrade #GroomingUpgrade #BeardRollerRoutine"
Beard Roller Cleaning: A Quick Checklist,https://res.cloudinary.com/dbcpfy04c/image/upload/v1747931855/pin_5_24_ezc702.webp,beard-care-tips,,https://www.beacleaner.com/how-to-clean-beard-roller?utm_source=pinterest&utm_campaign=beard-roller-cleanin,2025-05-22,Need a quick reminder? This post provides a handy checklist for cleaning your beard roller.  Ensure you don't miss any steps and maintain a hygienic grooming routine.  Protect your skin from bacteria and irritation.,"Checklist, beard roller, skincare, reminder #BeardRollerChecklist #SkincareReminder"
From Grime to Shine: Beard Roller Cleaning,https://res.cloudinary.com/dbcpfy04c/image/upload/v1747931860/pin_5_25_u0fihw.webp,home-cleaning-tips,,https://www.beacleaner.com/how-to-clean-beard-roller?utm_source=pinterest&utm_campaign=from-grime-to-shine-,2025-05-22,Transform your dirty beard roller into a sparkling clean grooming tool! This post showcases the dramatic results of a thorough cleaning.  Protect your skin and enjoy a healthier beard.  We'll show you how to achieve these results with our easy-to-follow cleaning routine.,"Grime to shine, beard roller, skincare, transformation #BeardRollerTransformation #CleanGrooming"
