Title,Media URL,Pinterest board,Thumbnail,Link,Publish date,Description,Keywords
Title,https://res.cloudinary.com/dbcpfy04c/image/upload/v1748679979/pin_1_1_glhrpa.webp,please-provide-the-title-and-keywords-i-need-that-information-to-suggest-a-board-name-once,,https://www.beacleaner.com/how-to-remove-debris-from-microfiber-towels?utm_source=pinterest&utm_campaign=title,2025-05-31,Description,Keywords
Microfiber Towels: Debris-Free!,https://res.cloudinary.com/dbcpfy04c/image/upload/v1748679987/pin_1_2_qacaab.webp,cleaning-tips,,https://www.beacleaner.com/how-to-remove-debris-from-microfiber-towels?utm_source=pinterest&utm_campaign=microfiber-towels-de,2025-05-31,“Are your microfiber towels losing their magic? Don't toss them! This guide reveals simple,effective ways to remove stubborn debris like hair
Revive Your Microfiber: Easy Steps,https://res.cloudinary.com/dbcpfy04c/image/upload/v1748679993/pin_1_3_jhipg8.webp,cleaning-tips,,https://www.beacleaner.com/how-to-remove-debris-from-microfiber-towels?utm_source=pinterest&utm_campaign=revive-your-microfib,2025-05-31,“Don't let a little debris ruin your favorite microfiber towels! This post shows you how to easily remove everything from pet hair to polishing compound. We'll cover washing machine tricks,vinegar rinses
Microfiber Rescue: Get Rid of Grime,https://res.cloudinary.com/dbcpfy04c/image/upload/v1748680000/pin_1_4_y3jdqo.webp,cleaning-tips-ideas,,https://www.beacleaner.com/how-to-remove-debris-from-microfiber-towels?utm_source=pinterest&utm_campaign=microfiber-rescue-ge,2025-05-31,“Is your microfiber covered in a mysterious film? It's likely debris buildup! This guide breaks down exactly what causes it and how to eliminate it. We'll show you how to avoid common mistakes that worsen the problem.  Don't spend money on replacements – restore what you have! Click to discover the secrets to truly clean microfiber and enjoy a spotless home. You deserve it!,"Microfiber,Grime removal,Cleaning solutions,Laundry guide #MicrofiberMagic #CleaningTips #HomeHacks #CleanLiving"
Stop Replacing Microfiber! (Save $),https://res.cloudinary.com/dbcpfy04c/image/upload/v1748680006/pin_1_5_w5slxj.webp,cleaning-tips,,https://www.beacleaner.com/how-to-remove-debris-from-microfiber-towels?utm_source=pinterest&utm_campaign=stop-replacing-micro,2025-05-31,“Tired of constantly buying new microfiber towels? You don't have to! This post reveals the secrets to removing debris and extending their lifespan. Learn how to properly wash,dry
Hair-Free Microfiber: It's Possible!,https://res.cloudinary.com/dbcpfy04c/image/upload/v1748680016/pin_1_6_h7xa69.webp,cleaning-tips,,https://www.beacleaner.com/how-to-remove-debris-from-microfiber-towels?utm_source=pinterest&utm_campaign=hair-free-microfiber,2025-05-31,“Pet hair and human hair…microfiber towels attract it all! But don't despair! This guide provides proven methods for removing even the most stubborn hair. From lint rollers to washing machine settings,"we've got you covered.  Enjoy a clean home and happy pets! Click to learn how to banish hair from your microfiber for good."""
Microfiber: Washing Machine Secrets,https://res.cloudinary.com/dbcpfy04c/image/upload/v1748680022/pin_1_7_suj71u.webp,laundry-tips,,https://www.beacleaner.com/how-to-remove-debris-from-microfiber-towels?utm_source=pinterest&utm_campaign=microfiber-washing-m,2025-05-31,“Are you washing your microfiber towels correctly? You might be making mistakes that trap debris! This post reveals the best washing machine settings,detergents
Vinegar Rinse: Microfiber Miracle,https://res.cloudinary.com/dbcpfy04c/image/upload/v1748680030/pin_1_8_br2yip.webp,cleaning-tips,,https://www.beacleaner.com/how-to-remove-debris-from-microfiber-towels?utm_source=pinterest&utm_campaign=vinegar-rinse-microf,2025-05-31,“Did you know vinegar can revolutionize your microfiber cleaning? This post explains how a simple vinegar rinse can remove stubborn debris and restore softness. It's a natural,affordable
Lint Roller Rescue: Quick Microfiber Fix,https://res.cloudinary.com/dbcpfy04c/image/upload/v1748680039/pin_1_9_cywuu7.webp,cleaning-tips,,https://www.beacleaner.com/how-to-remove-debris-from-microfiber-towels?utm_source=pinterest&utm_campaign=lint-roller-rescue-q,2025-05-31,“No time for a full wash? A lint roller can be your quick fix for microfiber debris! This post shows you how to effectively use a lint roller to remove surface-level dirt and hair. It's a lifesaver for busy schedules! Click to learn this simple trick and keep your microfiber ready for action.,"Lint roller,Microfiber,Quick clean,Cleaning hacks #MicrofiberHacks #QuickCleaning #CleaningTips #HomeHacks"
Polishing Compound Removal: Microfiber,https://res.cloudinary.com/dbcpfy04c/image/upload/v1748680047/pin_1_10_ad7kqk.webp,auto-detailing-tips,,https://www.beacleaner.com/how-to-remove-debris-from-microfiber-towels?utm_source=pinterest&utm_campaign=polishing-compound-r,2025-05-31,“Using microfiber for polishing? This post tackles the tricky task of removing polishing compound residue. We'll show you the best washing techniques and detergents to restore your towels. Don't let residue ruin your microfiber! Click to learn how to keep them performing at their best.,"Polishing compound,Microfiber,Cleaning,Auto detailing #MicrofiberCare #AutoCleaning #DetailingTips #CleaningHacks"
Microfiber: Dryer Sheet Dilemma,https://res.cloudinary.com/dbcpfy04c/image/upload/v1748680053/pin_1_11_spojve.webp,laundry-tips,,https://www.beacleaner.com/how-to-remove-debris-from-microfiber-towels?utm_source=pinterest&utm_campaign=microfiber-dryer-she,2025-05-31,“Are dryer sheets ruining your microfiber? This post explains why they're a no-no and offers alternative drying methods. Protect your investment and maintain optimal cleaning performance!  Learn how to dry your microfiber properly for long-lasting results. Click to read now!,"Microfiber,Dryer sheets,Laundry,Cleaning tips #MicrofiberCare #LaundryTips #CleaningSecrets #HomeCleaning"
Extend Microfiber Life: Pro Tips,https://res.cloudinary.com/dbcpfy04c/image/upload/v1748680059/pin_1_12_nxharx.webp,cleaning-tips,,https://www.beacleaner.com/how-to-remove-debris-from-microfiber-towels?utm_source=pinterest&utm_campaign=extend-microfiber-li,2025-05-31,“Want your microfiber towels to last for years? This post shares professional tips for preventing debris buildup and maintaining their cleaning power. Learn the do's and don'ts of microfiber care.  Invest in quality and keep your towels working like new! Click to discover the secrets.,"Microfiber lifespan,Cleaning,Laundry,Pro tips #MicrofiberLove #CleaningHacks #LaundryTips #LongLasting"
Microfiber: Avoid These Mistakes!,https://res.cloudinary.com/dbcpfy04c/image/upload/v1748680067/pin_1_13_ivgcrb.webp,cleaning-tips,,https://www.beacleaner.com/how-to-remove-debris-from-microfiber-towels?utm_source=pinterest&utm_campaign=microfiber-avoid-the,2025-05-31,“Are you unknowingly damaging your microfiber towels? This post reveals common mistakes that trap debris and reduce their effectiveness. Learn what *not* to do and keep your towels in top condition.  Protect your investment and enjoy a cleaner home! Click to read now.,"Microfiber mistakes,Cleaning,Laundry,Avoid these #MicrofiberCare #CleaningTips #LaundryHacks #HomeCleaning"
DIY Microfiber Debris Remover,https://res.cloudinary.com/dbcpfy04c/image/upload/v1748680073/pin_1_14_bfvork.webp,cleaning-tips,,https://www.beacleaner.com/how-to-remove-debris-from-microfiber-towels?utm_source=pinterest&utm_campaign=diy-microfiber-debri,2025-05-31,“Don't have fancy cleaning products? This post shares a simple DIY solution for removing debris from your microfiber towels. It's affordable,effective
Microfiber: Before & After Results,https://res.cloudinary.com/dbcpfy04c/image/upload/v1748680080/pin_1_15_n3aj7v.webp,cleaning-tips,,https://www.beacleaner.com/how-to-remove-debris-from-microfiber-towels?utm_source=pinterest&utm_campaign=microfiber-before-af,2025-05-31,“See the amazing difference! This post showcases before-and-after photos of microfiber towels cleaned using the techniques described in the article.  Witness the power of proper debris removal and get inspired to restore your own towels. Click to see the transformation!,"Microfiber,Before and after,Cleaning results,Visual guide #MicrofiberCleaning #CleaningMotivation #HomeCleaning #Transformation"
Microfiber: The Ultimate Guide,https://res.cloudinary.com/dbcpfy04c/image/upload/v1748680087/pin_1_16_iemtf2.webp,cleaning-tips,,https://www.beacleaner.com/how-to-remove-debris-from-microfiber-towels?utm_source=pinterest&utm_campaign=microfiber-the-ultim,2025-05-31,“Everything you need to know about removing debris from microfiber towels is right here! This post is a comprehensive guide,"covering all the methods and tips you need for a pristine clean.  Become a microfiber expert and enjoy a spotless home. Click to read the ultimate guide!"""
Microfiber: Is It Still Clean?,https://res.cloudinary.com/dbcpfy04c/image/upload/v1748680094/pin_1_17_zxu0sn.webp,cleaning-tips,,https://www.beacleaner.com/how-to-remove-debris-from-microfiber-towels?utm_source=pinterest&utm_campaign=microfiber-is-it-sti,2025-05-31,“Think your microfiber is clean? It might be harboring hidden debris! This post helps you identify when your towels need a deep clean and provides the steps to achieve it.  Don't spread dirt around – ensure your microfiber is truly clean. Click to learn how!,"Microfiber,Cleanliness,Debris,Cleaning tips #MicrofiberCleaning #CleaningHacks #HomeCleaning #CleanLiving"
Microfiber: The Secret to Streak-Free,https://res.cloudinary.com/dbcpfy04c/image/upload/v1748680101/pin_1_18_qffo7n.webp,cleaning-tips,,https://www.beacleaner.com/how-to-remove-debris-from-microfiber-towels?utm_source=pinterest&utm_campaign=microfiber-the-secre,2025-05-31,“Want streak-free surfaces? It all starts with clean microfiber! This post explains how removing debris is crucial for achieving a flawless finish.  Enjoy sparkling windows,mirrors
Microfiber: Washing Frequency Guide,https://res.cloudinary.com/dbcpfy04c/image/upload/v1748680107/pin_1_19_dkvgkv.webp,laundry-tips,,https://www.beacleaner.com/how-to-remove-debris-from-microfiber-towels?utm_source=pinterest&utm_campaign=microfiber-washing-f,2025-05-31,“How often should you wash your microfiber towels? This post provides a guide based on usage and debris levels.  Keep your towels fresh and effective with the right washing schedule. Click to learn the optimal frequency!,"Microfiber,Washing frequency,Laundry,Cleaning schedule #MicrofiberCare #LaundryTips #CleaningHacks #HomeCleaning"
Microfiber: Softness Restored!,https://res.cloudinary.com/dbcpfy04c/image/upload/v1748680115/pin_1_20_aik9nb.webp,cleaning-tips,,https://www.beacleaner.com/how-to-remove-debris-from-microfiber-towels?utm_source=pinterest&utm_campaign=microfiber-softness-,2025-05-31,“Is your microfiber feeling rough and scratchy? Debris buildup can be the culprit! This post shows you how to restore softness and bring back the luxurious feel of your towels.  Enjoy a gentle touch and effective cleaning. Click to learn how!,"Microfiber,Softness,Cleaning,Restoration #MicrofiberLove #CleaningTips #HomeHacks #SoftTowels"
Microfiber: Prevent Debris Buildup,https://res.cloudinary.com/dbcpfy04c/image/upload/v1748680125/pin_1_21_heulwx.webp,cleaning-tips,,https://www.beacleaner.com/how-to-remove-debris-from-microfiber-towels?utm_source=pinterest&utm_campaign=microfiber-prevent-d,2025-05-31,“Stop debris before it starts! This post offers preventative measures to minimize buildup and keep your microfiber towels cleaner for longer.  Proactive care is the key to long-lasting performance. Click to learn how to prevent the problem!,"Microfiber,Prevention,Cleaning,Maintenance #MicrofiberCare #CleaningHacks #LaundryTips #HomeCleaning"
Microfiber: The Best Detergent?,https://res.cloudinary.com/dbcpfy04c/image/upload/v1748680130/pin_1_22_bd9lpz.webp,cleaning-tips,,https://www.beacleaner.com/how-to-remove-debris-from-microfiber-towels?utm_source=pinterest&utm_campaign=microfiber-the-best-,2025-05-31,“Choosing the right detergent is crucial for microfiber care. This post recommends the best detergents for removing debris and maintaining softness.  Avoid harsh chemicals that can damage your towels. Click to learn the best options!,"Microfiber,Detergent,Cleaning,Laundry #MicrofiberCare #LaundryTips #CleaningSecrets #HomeCleaning"
Microfiber: Quick Debris Check,https://res.cloudinary.com/dbcpfy04c/image/upload/v1748680138/pin_1_23_julpvz.webp,cleaning-tips,,https://www.beacleaner.com/how-to-remove-debris-from-microfiber-towels?utm_source=pinterest&utm_campaign=microfiber-quick-deb,2025-05-31,“Do a quick debris check after every use! This post shows you how to quickly assess your microfiber towels for visible dirt and hair.  A little maintenance goes a long way. Click to learn the simple check!,"Microfiber,Quick check,Cleaning,Maintenance #MicrofiberHacks #QuickCleaning #CleaningTips #HomeHacks"
Microfiber: From Dirty to Dazzling,https://res.cloudinary.com/dbcpfy04c/image/upload/v1748680145/pin_1_24_eyw2ju.webp,cleaning-tips,,https://www.beacleaner.com/how-to-remove-debris-from-microfiber-towels?utm_source=pinterest&utm_campaign=microfiber-from-dirt,2025-05-31,“Transform your dirty microfiber towels into dazzling cleaning machines! This post provides a step-by-step guide to debris removal and restoration.  Witness the power of a thorough clean. Click to learn how to revitalize your microfiber!,"Microfiber,Transformation,Cleaning,Restoration #MicrofiberCleaning #CleaningMotivation #HomeCleaning #DazzlingClean"
Microfiber: Don't Give Up On Them!,https://res.cloudinary.com/dbcpfy04c/image/upload/v1748680151/pin_1_25_jburqi.webp,cleaning-tips,,https://www.beacleaner.com/how-to-remove-debris-from-microfiber-towels?utm_source=pinterest&utm_campaign=microfiber-dont-give,2025-05-31,“Don't throw away your dirty microfiber towels! This post offers hope and practical solutions for restoring their cleaning power.  Give them a second chance and save money. Click to learn how to revive your microfiber!,"Microfiber,Revive,Cleaning,Save money #MicrofiberLove #CleaningHacks #LaundryTips #SustainableCleaning"
Microfiber: The Ultimate Cleaning Tool,https://res.cloudinary.com/dbcpfy04c/image/upload/v1748680158/pin_1_26_btszts.webp,cleaning-tips,,https://www.beacleaner.com/how-to-remove-debris-from-microfiber-towels?utm_source=pinterest&utm_campaign=microfiber-the-ultim,2025-05-31,“Microfiber is a cleaning powerhouse,"but only when it's clean! This post emphasizes the importance of debris removal for optimal performance.  Unlock the full potential of your microfiber and enjoy a spotless home. Click to learn more!"""
Title,https://res.cloudinary.com/dbcpfy04c/image/upload/v1748680207/pin_2_1_ribrzb.webp,please-provide-the-title-and-keywords-i-need-that-information-to-suggest-a-board-name-once,,https://www.beacleaner.com/how-to-remove-gravy-stains-from-carpet?utm_source=pinterest&utm_campaign=title,2025-05-31,Description,Keywords
Goodbye Gravy Stains! (Easy!),https://res.cloudinary.com/dbcpfy04c/image/upload/v1748680215/pin_2_2_khzzn0.webp,cleaning-tips,,https://www.beacleaner.com/how-to-remove-gravy-stains-from-carpet?utm_source=pinterest&utm_campaign=goodbye-gravy-stains,2025-05-31,Don't let a Thanksgiving disaster ruin your carpet! This pin shows you the *fastest* way to remove gravy stains,even if they're dried. We'll walk you through simple steps using common household items
Carpet Savior: Gravy Stain SOS,https://res.cloudinary.com/dbcpfy04c/image/upload/v1748680223/pin_2_3_ebonan.webp,cleaning-tips,,https://www.beacleaner.com/how-to-remove-gravy-stains-from-carpet?utm_source=pinterest&utm_campaign=carpet-savior-gravy-,2025-05-31,Spilled gravy during dinner? Don't panic! This pin highlights a quick and effective method to tackle gravy stains *before* they set. We'll show you how to lift the stain without damaging your carpet fibers.  A clean carpet means a happier home,and we're here to help you achieve that.  Learn the best blotting techniques and DIY cleaning solutions.  Click now to save your carpet and your sanity!  This is a must-read for every homeowner. #CarpetStains #GravySpill #CleaningHacks #HomeCleaning
Dried Gravy? No Problem!,https://res.cloudinary.com/dbcpfy04c/image/upload/v1748680231/pin_2_4_f7mkpi.webp,stain-removal-tips,,https://www.beacleaner.com/how-to-remove-gravy-stains-from-carpet?utm_source=pinterest&utm_campaign=dried-gravy-no-probl,2025-05-31,Is a dried gravy stain haunting your carpet? This pin reveals the secrets to reviving your carpet,even after the stain has set. We'll guide you through a step-by-step process
Fast Acting Gravy Stain Removal,https://res.cloudinary.com/dbcpfy04c/image/upload/v1748680238/pin_2_5_ablr1g.webp,cleaning-tips,,https://www.beacleaner.com/how-to-remove-gravy-stains-from-carpet?utm_source=pinterest&utm_campaign=fast-acting-gravy-st,2025-05-31,Time is of the essence when it comes to gravy stains! This pin emphasizes the importance of *immediate* action. We'll show you how to quickly blot and treat the stain before it becomes a permanent problem.  Protect your investment and keep your carpet looking fresh. Click to learn the fastest way to tackle gravy spills and enjoy a worry-free home.  Don't delay,act now! #QuickCleaning #SpillCleanup #CarpetProtection #StainFighting
DIY Gravy Stain Cleaner Recipe,https://res.cloudinary.com/dbcpfy04c/image/upload/v1748680244/pin_2_6_oxfobc.webp,cleaning-tips,,https://www.beacleaner.com/how-to-remove-gravy-stains-from-carpet?utm_source=pinterest&utm_campaign=diy-gravy-stain-clea,2025-05-31,Skip the harsh chemicals! This pin features a simple,effective DIY gravy stain cleaner recipe using ingredients you probably already have.  Save money and protect your family with this natural cleaning solution.  A clean home doesn't have to be expensive. Click to learn the recipe and say goodbye to gravy stains for good!  It's eco-friendly and powerful. #DIYCleaner #NaturalCleaning #GravyRemover #EcoFriendlyCleaning
Before & After: Gravy Stain Magic,https://res.cloudinary.com/dbcpfy04c/image/upload/v1748680252/pin_2_7_qpn7cr.webp,cleaning-tips,,https://www.beacleaner.com/how-to-remove-gravy-stains-from-carpet?utm_source=pinterest&utm_campaign=before-after-gravy-s,2025-05-31,See the amazing results! This pin showcases a dramatic before-and-after photo of a gravy stain removal.  Proof that our methods *work*!  Don't give up on your carpet – we can help you restore it to its former glory. Click to learn the secrets to stain removal success and enjoy a beautiful,clean home.  You'll be amazed by the transformation. #BeforeAndAfter #StainRemovalResults #CarpetTransformation #CleaningMotivation
Gravy Stain Removal: Step-by-Step,https://res.cloudinary.com/dbcpfy04c/image/upload/v1748680259/pin_2_8_ng10h0.webp,cleaning-tips,,https://www.beacleaner.com/how-to-remove-gravy-stains-from-carpet?utm_source=pinterest&utm_campaign=gravy-stain-removal-,2025-05-31,Need a clear,concise guide? This pin provides a simple
The Secret to Stain-Free Carpets,https://res.cloudinary.com/dbcpfy04c/image/upload/v1748680268/pin_2_9_xynos9.webp,cleaning-tips-ideas,,https://www.beacleaner.com/how-to-remove-gravy-stains-from-carpet?utm_source=pinterest&utm_campaign=the-secret-to-stain-,2025-05-31,Unlock the secrets to a stain-free home! This pin highlights the importance of proper blotting techniques and the right cleaning solutions for gravy stains.  We'll share insider tips that will keep your carpet looking its best. Click to learn the pro secrets and enjoy a beautiful,clean home.  Don't let stains win! #StainFreeLiving #CarpetSecrets #CleaningTipsAndTricks #HomeHacks
Deep Cleaning Gravy Stains: Pro Tips,https://res.cloudinary.com/dbcpfy04c/image/upload/v1748680276/pin_2_10_ofr8mb.webp,carpet-cleaning-tips,,https://www.beacleaner.com/how-to-remove-gravy-stains-from-carpet?utm_source=pinterest&utm_campaign=deep-cleaning-gravy-,2025-05-31,Take your cleaning to the next level! This pin focuses on deep cleaning techniques for stubborn,set-in gravy stains.  We'll show you how to lift the stain from deep within the carpet fibers. Click to learn the pro tips and achieve a truly clean carpet.  Don't settle for surface cleaning. #DeepCleaning #CarpetDetailing #ProCleaningTips #StainExpert
Gravy Stain Removal for All Carpet Types,https://res.cloudinary.com/dbcpfy04c/image/upload/v1748680282/pin_2_11_jbtoi5.webp,cleaning-tips,,https://www.beacleaner.com/how-to-remove-gravy-stains-from-carpet?utm_source=pinterest&utm_campaign=gravy-stain-removal-,2025-05-31,Worried about damaging your carpet? This pin provides tailored advice for different carpet fibers,ensuring a safe and effective cleaning process.  We'll help you choose the right solution for your specific carpet type. Click to learn the best methods for your carpet and enjoy a beautiful
The Best Tools for Gravy Stain Removal,https://res.cloudinary.com/dbcpfy04c/image/upload/v1748680288/pin_2_12_e5rjza.webp,cleaning-tips,,https://www.beacleaner.com/how-to-remove-gravy-stains-from-carpet?utm_source=pinterest&utm_campaign=the-best-tools-for-g,2025-05-31,Equip yourself for success! This pin showcases the essential tools you'll need to remove gravy stains from carpet.  From blotting cloths to cleaning solutions,we've got you covered. Click to learn the must-have tools and make stain removal a breeze.  Be prepared and efficient. #CleaningTools #CarpetCleaningSupplies #StainRemovalKit #HomeEssentials
Gentle Gravy Stain Removal: Safe for Kids & Pets,https://res.cloudinary.com/dbcpfy04c/image/upload/v1748680296/pin_2_13_yoqiuc.webp,cleaning-tips,,https://www.beacleaner.com/how-to-remove-gravy-stains-from-carpet?utm_source=pinterest&utm_campaign=gentle-gravy-stain-r,2025-05-31,Protect your loved ones! This pin focuses on using gentle,non-toxic cleaning solutions for gravy stains
Revive Your Carpet: Gravy Stain Rescue,https://res.cloudinary.com/dbcpfy04c/image/upload/v1748680302/pin_2_14_ohsaco.webp,carpet-cleaning-tips,,https://www.beacleaner.com/how-to-remove-gravy-stains-from-carpet?utm_source=pinterest&utm_campaign=revive-your-carpet-g,2025-05-31,Give your carpet a new lease on life! This pin inspires hope and shows how to restore a gravy-stained carpet to its former glory.  Don't give up on your floors – we can help you revive them. Click to learn the rescue mission and enjoy a beautiful,clean home.  It's possible to restore your carpet! #CarpetRevival #StainRescue #HomeRestoration #CleaningInspiration
Long-Term Carpet Stain Prevention,https://res.cloudinary.com/dbcpfy04c/image/upload/v1748680309/pin_2_15_ti1v7c.webp,carpet-care-tips,,https://www.beacleaner.com/how-to-remove-gravy-stains-from-carpet?utm_source=pinterest&utm_campaign=long-term-carpet-sta,2025-05-31,Don't just clean up spills – prevent them! This pin offers tips for long-term carpet stain prevention,including protective sprays and regular cleaning routines.  Keep your carpet looking its best for years to come. Click to learn the preventative measures and enjoy a worry-free home. #StainPreventionTips #CarpetMaintenance #LongTermCare #HomeProtection
Don't Replace,https://res.cloudinary.com/dbcpfy04c/image/upload/v1748680318/pin_2_16_pfkgiz.webp,carpet-cleaning-tips,,https://www.beacleaner.com/how-to-remove-gravy-stains-from-carpet?utm_source=pinterest&utm_campaign=dont-replace,2025-05-31,Restore! Gravy Stain Fix,Save your carpet and your money! This pin emphasizes the importance of restoring a gravy-stained carpet instead of replacing it.  A cost-effective and environmentally friendly solution. Click to learn how to restore your carpet and avoid unnecessary expenses. #CarpetRestoration #SaveMoney #EcoFriendly #SustainableCleaning
The Ultimate Guide to Carpet Stain Removal (Gravy Focus),https://res.cloudinary.com/dbcpfy04c/image/upload/v1748680325/pin_2_17_urx7ti.webp,cleaning-tips,,https://www.beacleaner.com/how-to-remove-gravy-stains-from-carpet?utm_source=pinterest&utm_campaign=the-ultimate-guide-t,2025-05-31,This pin is a comprehensive guide to all things carpet stain removal,with a special focus on gravy. Learn everything you need to know to keep your carpets looking their best. Click to read the full guide and become a carpet cleaning pro! #CarpetStainGuide #UltimateGuide #CleaningExpert #HomeTips
Title,https://res.cloudinary.com/dbcpfy04c/image/upload/v1748680366/pin_3_1_bubjqw.webp,please-provide-the-title-and-keywords-i-need-that-information-to-suggest-a-board-name-once,,https://www.beacleaner.com/how-to-clean-vinyl-plank-flooring?utm_source=pinterest&utm_campaign=title,2025-05-31,Description,Keywords
Vinyl Plank Floors: Cleaning Guide,https://res.cloudinary.com/dbcpfy04c/image/upload/v1748680372/pin_3_2_g06uc5.webp,floor-cleaning-tips,,https://www.beacleaner.com/how-to-clean-vinyl-plank-flooring?utm_source=pinterest&utm_campaign=vinyl-plank-floors-c,2025-05-31,"Dreaming of sparkling, like-new vinyl plank floors? ✨ This guide reveals the *easiest* way to clean & protect your investment! From daily sweeps to tackling stubborn stains, we cover it all. Learn the best (and worst!) cleaning products to avoid damage & keep your floors looking gorgeous for years. Don't let dirt & grime ruin your beautiful home – click to learn how! Plus, discover pro tips for preventing scratches & maintaining that fresh-installed look. Your floors will thank you!","vinyl plank flooring, cleaning tips, floor care, home maintenance"
