Title,Media URL,Pinterest board,Thumbnail,Link,Publish date,Description,Keywords,
Title,https://res.cloudinary.com/dbcpfy04c/image/upload/v1747369350/pin_1_1_ua8ljq.webp,please-provide-the-title-and-keywords-i-need-that-information-to-suggest-a-board-name-once,,https://lawntrend.com/how-to-disengage-hydrostatic-transmission-cub-cadet-unlock-the-power-of-smooth-operation/?utm_source=pinterest&utm_campaign=title,2025-05-16,Description,Keywords,Keywords
Cub Cadet Hydrostatic Fix!,https://res.cloudinary.com/dbcpfy04c/image/upload/v1618237451/placeholder.jpg,home-inspiration,,https://lawntrend.com/how-to-disengage-hydrostatic-transmission-cub-cadet-unlock-the-power-of-smooth-operation/?utm_source=pinterest&utm_campaign=cub-cadet-hydrostati,2025-05-16,"Is your Cub Cadet riding mower stuck in gear? Don't let a faulty hydrostatic transmission ruin your weekend! This guide walks you through disengaging it safely & effectively. Learn to diagnose the issue, unlock smooth operation",and get back to enjoying your lawn. Save money on repairs & DIY with confidence! Click to learn how! #CubCadet #HydrostaticTransmission #LawnMowerRepair #DIYRepair,and get back to enjoying your lawn. Save money on repairs & DIY with confidence! Click to learn how! #CubCadet #HydrostaticTransmission #LawnMowerRepair #DIYRepair
Cub Cadet: Free the Drive!,https://res.cloudinary.com/dbcpfy04c/image/upload/v1618237451/placeholder.jpg,home-inspiration,,https://lawntrend.com/how-to-disengage-hydrostatic-transmission-cub-cadet-unlock-the-power-of-smooth-operation/?utm_source=pinterest&utm_campaign=cub-cadet-free-the-d,2025-05-16,"Frustrated with a Cub Cadet that won't move? A disengaged hydrostatic transmission could be the culprit. This step-by-step tutorial empowers you to tackle this repair yourself, saving you time and money.  We break down the process",making it easy even for beginners. Reclaim your lawn care freedom! #CubCadetRepair #Hydrostatic #RidingMower #FixItYourself,making it easy even for beginners. Reclaim your lawn care freedom! #CubCadetRepair #Hydrostatic #RidingMower #FixItYourself
Hydrostatic Transmission Help,https://res.cloudinary.com/dbcpfy04c/image/upload/v1618237451/placeholder.jpg,home-inspiration,,https://lawntrend.com/how-to-disengage-hydrostatic-transmission-cub-cadet-unlock-the-power-of-smooth-operation/?utm_source=pinterest&utm_campaign=hydrostatic-transmis,2025-05-16,"Don't be intimidated by hydrostatic transmissions! This guide simplifies the process of disengaging your Cub Cadet's system.  We cover essential safety precautions, detailed instructions",and troubleshooting tips.  Get your mower running smoothly again and enjoy a perfectly manicured lawn. Click for the full guide! #CubCadetHydrostatic #TransmissionRepair #LawnCare #MowerMaintenance,and troubleshooting tips.  Get your mower running smoothly again and enjoy a perfectly manicured lawn. Click for the full guide! #CubCadetHydrostatic #TransmissionRepair #LawnCare #MowerMaintenance
Unlock Cub Cadet Power!,https://res.cloudinary.com/dbcpfy04c/image/upload/v1618237451/placeholder.jpg,home-inspiration,,https://lawntrend.com/how-to-disengage-hydrostatic-transmission-cub-cadet-unlock-the-power-of-smooth-operation/?utm_source=pinterest&utm_campaign=unlock-cub-cadet-pow,2025-05-16,"Is your Cub Cadet losing power or acting strangely? A disengaged hydrostatic transmission might be the reason.  This blog post provides a clear, concise guide to diagnosing and fixing the issue.  Stop struggling and start enjoying a powerful",efficient mowing experience. Learn more now! #CubCadetProblems #HydrostaticFix #RidingMowerLife #LawnMowing,efficient mowing experience. Learn more now! #CubCadetProblems #HydrostaticFix #RidingMowerLife #LawnMowing
DIY Cub Cadet Repair Guide,https://res.cloudinary.com/dbcpfy04c/image/upload/v1618237451/placeholder.jpg,home-inspiration,,https://lawntrend.com/how-to-disengage-hydrostatic-transmission-cub-cadet-unlock-the-power-of-smooth-operation/?utm_source=pinterest&utm_campaign=diy-cub-cadet-repair,2025-05-16,Save hundreds on repair costs! This guide shows you how to disengage the hydrostatic transmission on your Cub Cadet riding mower.  We provide clear photos and easy-to-follow instructions,even if you've never worked on a mower before.  Take control of your lawn care! #CubCadetDIY #HydrostaticRepair #MowerFix #SaveMoney,even if you've never worked on a mower before.  Take control of your lawn care! #CubCadetDIY #HydrostaticRepair #MowerFix #SaveMoney
Cub Cadet Stuck in Gear?,https://res.cloudinary.com/dbcpfy04c/image/upload/v1618237451/placeholder.jpg,home-inspiration,,https://lawntrend.com/how-to-disengage-hydrostatic-transmission-cub-cadet-unlock-the-power-of-smooth-operation/?utm_source=pinterest&utm_campaign=cub-cadet-stuck-in-g,2025-05-16,"Don't let a stuck gear ruin your summer! This guide provides a solution for disengaging the hydrostatic transmission on your Cub Cadet.  We'll help you identify the problem, understand the process",and get your mower back in action.  Click to read and get mowing! #CubCadetIssues #HydrostaticProblems #RidingMowerHelp #LawnCareTips,and get your mower back in action.  Click to read and get mowing! #CubCadetIssues #HydrostaticProblems #RidingMowerHelp #LawnCareTips
Hydrostatic Transmission 101,https://res.cloudinary.com/dbcpfy04c/image/upload/v1618237451/placeholder.jpg,home-inspiration,,https://lawntrend.com/how-to-disengage-hydrostatic-transmission-cub-cadet-unlock-the-power-of-smooth-operation/?utm_source=pinterest&utm_campaign=hydrostatic-transmis,2025-05-16,"Demystifying hydrostatic transmissions! This guide explains how they work and how to disengage yours on a Cub Cadet mower.  Learn the basics, understand the repair process",and gain confidence in your DIY abilities.  Get the knowledge you need! #HydrostaticExplained #CubCadetKnowledge #MowerEducation #DIYLawnCare,and gain confidence in your DIY abilities.  Get the knowledge you need! #HydrostaticExplained #CubCadetKnowledge #MowerEducation #DIYLawnCare
Easy Cub Cadet Fixes,https://res.cloudinary.com/dbcpfy04c/image/upload/v1618237451/placeholder.jpg,home-inspiration,,https://lawntrend.com/how-to-disengage-hydrostatic-transmission-cub-cadet-unlock-the-power-of-smooth-operation/?utm_source=pinterest&utm_campaign=easy-cub-cadet-fixes,2025-05-16,Quickly fix your Cub Cadet! This guide focuses on disengaging the hydrostatic transmission – a common issue.  We provide a streamlined process,making it easy to understand and execute.  Get back to enjoying your lawn without the frustration. Read now! #CubCadetQuickFix #HydrostaticSolution #RidingMowerTips #EasyRepair,making it easy to understand and execute.  Get back to enjoying your lawn without the frustration. Read now! #CubCadetQuickFix #HydrostaticSolution #RidingMowerTips #EasyRepair
Cub Cadet Maintenance Guide,https://res.cloudinary.com/dbcpfy04c/image/upload/v1618237451/placeholder.jpg,home-inspiration,,https://lawntrend.com/how-to-disengage-hydrostatic-transmission-cub-cadet-unlock-the-power-of-smooth-operation/?utm_source=pinterest&utm_campaign=cub-cadet-maintenanc,2025-05-16,Keep your Cub Cadet running like new! This guide includes instructions on disengaging the hydrostatic transmission,a crucial maintenance step.  Prevent costly repairs and extend the life of your mower.  Learn how to maintain your investment! #CubCadetMaintenance #MowerCare #HydrostaticService #LawnEquipment,a crucial maintenance step.  Prevent costly repairs and extend the life of your mower.  Learn how to maintain your investment! #CubCadetMaintenance #MowerCare #HydrostaticService #LawnEquipment
Troubleshooting Cub Cadet,https://res.cloudinary.com/dbcpfy04c/image/upload/v1618237451/placeholder.jpg,home-inspiration,,https://lawntrend.com/how-to-disengage-hydrostatic-transmission-cub-cadet-unlock-the-power-of-smooth-operation/?utm_source=pinterest&utm_campaign=troubleshooting-cub-,2025-05-16,Is your Cub Cadet acting up? This guide helps you troubleshoot common issues,including a disengaged hydrostatic transmission.  We provide a step-by-step approach to diagnosis and repair.  Don't give up on your mower – fix it! #CubCadetTroubleshooting #MowerDiagnosis #HydrostaticIssues #RepairGuide,including a disengaged hydrostatic transmission.  We provide a step-by-step approach to diagnosis and repair.  Don't give up on your mower – fix it! #CubCadetTroubleshooting #MowerDiagnosis #HydrostaticIssues #RepairGuide
Hydrostatic Disengagement Steps,https://res.cloudinary.com/dbcpfy04c/image/upload/v1618237451/placeholder.jpg,home-inspiration,,https://lawntrend.com/how-to-disengage-hydrostatic-transmission-cub-cadet-unlock-the-power-of-smooth-operation/?utm_source=pinterest&utm_campaign=hydrostatic-disengag,2025-05-16,"Clear, concise steps to disengage your Cub Cadet's hydrostatic transmission. This guide breaks down the process into manageable steps",with helpful visuals.  Get your mower running smoothly again with ease. Click to learn! #HydrostaticSteps #CubCadetInstructions #MowerRepairGuide #DIYProject,with helpful visuals.  Get your mower running smoothly again with ease. Click to learn! #HydrostaticSteps #CubCadetInstructions #MowerRepairGuide #DIYProject
Cub Cadet Riding Mower Help,https://res.cloudinary.com/dbcpfy04c/image/upload/v1618237451/placeholder.jpg,home-inspiration,,https://lawntrend.com/how-to-disengage-hydrostatic-transmission-cub-cadet-unlock-the-power-of-smooth-operation/?utm_source=pinterest&utm_campaign=cub-cadet-riding-mow,2025-05-16,Need help with your Cub Cadet riding mower? This guide focuses on a common problem: the hydrostatic transmission.  We provide a detailed solution to disengaging it,saving you time and money.  Get the help you need! #CubCadetHelp #RidingMowerRepair #HydrostaticFixes #LawnMowerSolutions,saving you time and money.  Get the help you need! #CubCadetHelp #RidingMowerRepair #HydrostaticFixes #LawnMowerSolutions
Save Money on Mower Repair,https://res.cloudinary.com/dbcpfy04c/image/upload/v1618237451/placeholder.jpg,home-inspiration,,https://lawntrend.com/how-to-disengage-hydrostatic-transmission-cub-cadet-unlock-the-power-of-smooth-operation/?utm_source=pinterest&utm_campaign=save-money-on-mower-,2025-05-16,Stop paying expensive repair bills! This guide shows you how to disengage the hydrostatic transmission on your Cub Cadet,saving you money.  Learn to diagnose and fix common issues yourself.  Take control of your expenses! #MowerRepairSavings #CubCadetCostSavings #HydrostaticBudget #DIYMoneySaver,saving you money.  Learn to diagnose and fix common issues yourself.  Take control of your expenses! #MowerRepairSavings #CubCadetCostSavings #HydrostaticBudget #DIYMoneySaver
Cub Cadet Hydrostatic Secrets,https://res.cloudinary.com/dbcpfy04c/image/upload/v1618237451/placeholder.jpg,home-inspiration,,https://lawntrend.com/how-to-disengage-hydrostatic-transmission-cub-cadet-unlock-the-power-of-smooth-operation/?utm_source=pinterest&utm_campaign=cub-cadet-hydrostati,2025-05-16,Unlock the secrets to a smooth-running Cub Cadet! This guide reveals how to disengage the hydrostatic transmission,a key to optimal performance.  Learn the hidden tricks and keep your mower in top condition. #CubCadetSecrets #HydrostaticPerformance #MowerTips #LawnCareHacks,a key to optimal performance.  Learn the hidden tricks and keep your mower in top condition. #CubCadetSecrets #HydrostaticPerformance #MowerTips #LawnCareHacks
Cub Cadet: Back to Mowing!,https://res.cloudinary.com/dbcpfy04c/image/upload/v1618237451/placeholder.jpg,home-inspiration,,https://lawntrend.com/how-to-disengage-hydrostatic-transmission-cub-cadet-unlock-the-power-of-smooth-operation/?utm_source=pinterest&utm_campaign=cub-cadet-back-to-mo,2025-05-16,Get back to mowing quickly with this guide to disengaging your Cub Cadet's hydrostatic transmission.  We provide a fast,effective solution to a common problem.  Don't let a faulty transmission slow you down! #CubCadetFastFix #HydrostaticSpeed #RidingMowerQuickFix #LawnCareEfficiency,effective solution to a common problem.  Don't let a faulty transmission slow you down! #CubCadetFastFix #HydrostaticSpeed #RidingMowerQuickFix #LawnCareEfficiency
Fix Your Cub Cadet Today!,https://res.cloudinary.com/dbcpfy04c/image/upload/v1618237451/placeholder.jpg,home-inspiration,,https://lawntrend.com/how-to-disengage-hydrostatic-transmission-cub-cadet-unlock-the-power-of-smooth-operation/?utm_source=pinterest&utm_campaign=fix-your-cub-cadet-t,2025-05-16,Don't wait – fix your Cub Cadet today! This guide provides a step-by-step solution for disengaging the hydrostatic transmission.  We make it easy to understand and execute,even for beginners.  Get started now! #CubCadetToday #HydrostaticNow #MowerRepairNow #LawnCareUrgent,even for beginners.  Get started now! #CubCadetToday #HydrostaticNow #MowerRepairNow #LawnCareUrgent
Cub Cadet: Smooth Operation!,https://res.cloudinary.com/dbcpfy04c/image/upload/v1618237451/placeholder.jpg,home-inspiration,,https://lawntrend.com/how-to-disengage-hydrostatic-transmission-cub-cadet-unlock-the-power-of-smooth-operation/?utm_source=pinterest&utm_campaign=cub-cadet-smooth-ope,2025-05-16,Achieve smooth operation with your Cub Cadet! This guide shows you how to disengage the hydrostatic transmission,ensuring optimal performance.  Enjoy a comfortable and efficient mowing experience. #CubCadetSmooth #HydrostaticEfficiency #RidingMowerComfort #LawnCareJoy,ensuring optimal performance.  Enjoy a comfortable and efficient mowing experience. #CubCadetSmooth #HydrostaticEfficiency #RidingMowerComfort #LawnCareJoy
Cub Cadet: Extend Mower Life,https://res.cloudinary.com/dbcpfy04c/image/upload/v1618237451/placeholder.jpg,home-inspiration,,https://lawntrend.com/how-to-disengage-hydrostatic-transmission-cub-cadet-unlock-the-power-of-smooth-operation/?utm_source=pinterest&utm_campaign=cub-cadet-extend-mow,2025-05-16,Extend the life of your Cub Cadet! This guide includes instructions on disengaging the hydrostatic transmission,a crucial maintenance step.  Prevent costly repairs and keep your mower running smoothly for years to come. #CubCadetLongevity #HydrostaticMaintenance #MowerLifeExtension #LawnCareInvestment,a crucial maintenance step.  Prevent costly repairs and keep your mower running smoothly for years to come. #CubCadetLongevity #HydrostaticMaintenance #MowerLifeExtension #LawnCareInvestment
Hydrostatic Transmission Guide,https://res.cloudinary.com/dbcpfy04c/image/upload/v1618237451/placeholder.jpg,home-inspiration,,https://lawntrend.com/how-to-disengage-hydrostatic-transmission-cub-cadet-unlock-the-power-of-smooth-operation/?utm_source=pinterest&utm_campaign=hydrostatic-transmis,2025-05-16,Your ultimate guide to understanding and disengaging the hydrostatic transmission on your Cub Cadet.  We cover everything you need to know,from diagnosis to repair.  Become a mower expert! #HydrostaticGuide #CubCadetExpert #MowerMaster #LawnCarePro,from diagnosis to repair.  Become a mower expert! #HydrostaticGuide #CubCadetExpert #MowerMaster #LawnCarePro
Title,https://res.cloudinary.com/dbcpfy04c/image/upload/v1747369433/pin_2_1_f9bfjh.webp,please-provide-the-title-and-keywords-i-need-that-information-to-suggest-a-board-name-once,,https://lawntrend.com/briggs-and-stratton-leaking-oil-from-valve-cover/?utm_source=pinterest&utm_campaign=title,2025-05-16,Description,Keywords,Keywords
Fix That Leaky Briggs & Stratton!,https://res.cloudinary.com/dbcpfy04c/image/upload/v1618237451/placeholder.jpg,home-inspiration,,https://lawntrend.com/briggs-and-stratton-leaking-oil-from-valve-cover/?utm_source=pinterest&utm_campaign=fix-that-leaky-brigg,2025-05-16,"Is your Briggs & Stratton engine weeping oil from the valve cover? Don't let a small leak turn into a major headache! This guide walks you through diagnosing the issue, understanding why it happens (worn gaskets, overfilling, etc.)",and provides a step-by-step repair process. Save money and keep your lawnmower running smoothly with our easy-to-follow instructions.  Frustrated with engine problems? We've got you covered! Click to learn how to tackle this common repair yourself and get back to enjoying your yard. #BriggsAndStratton #OilLeak #LawnMowerRepair #DIYRepair,and provides a step-by-step repair process. Save money and keep your lawnmower running smoothly with our easy-to-follow instructions.  Frustrated with engine problems? We've got you covered! Click to learn how to tackle this common repair yourself and get back to enjoying your yard. #BriggsAndStratton #OilLeak #LawnMowerRepair #DIYRepair
Briggs & Stratton Oil Leak SOS,https://res.cloudinary.com/dbcpfy04c/image/upload/v1618237451/placeholder.jpg,home-inspiration,,https://lawntrend.com/briggs-and-stratton-leaking-oil-from-valve-cover/?utm_source=pinterest&utm_campaign=briggs-stratton-oil-,2025-05-16,Seeing oil around your valve cover? It's a common problem! This pin highlights the most frequent causes of oil leaks in Briggs & Stratton engines. We break down the repair into manageable steps,even for beginners.  Don't risk damaging your engine further – a little preventative maintenance can save you big bucks.  Learn how to identify the source of the leak and get your mower back in top shape. Click to read the full guide! #ValveCoverGasket #EngineRepair #SmallEngine #LawnCare,even for beginners.  Don't risk damaging your engine further – a little preventative maintenance can save you big bucks.  Learn how to identify the source of the leak and get your mower back in top shape. Click to read the full guide! #ValveCoverGasket #EngineRepair #SmallEngine #LawnCare
Stop the Oil! Briggs & Stratton Fix,https://res.cloudinary.com/dbcpfy04c/image/upload/v1618237451/placeholder.jpg,home-inspiration,,https://lawntrend.com/briggs-and-stratton-leaking-oil-from-valve-cover/?utm_source=pinterest&utm_campaign=stop-the-oil-briggs-,2025-05-16,Don't let an oil leak ruin your lawn mowing experience! This pin focuses on the tools you'll need to fix a Briggs & Stratton valve cover oil leak.  We've compiled a comprehensive list,so you're prepared before you start.  A little preparation goes a long way!  We'll show you how to safely and effectively replace that gasket. Click to learn more and get mowing! #BriggsStrattonRepair #ToolList #DIYLawnCare #EngineMaintenance,so you're prepared before you start.  A little preparation goes a long way!  We'll show you how to safely and effectively replace that gasket. Click to learn more and get mowing! #BriggsStrattonRepair #ToolList #DIYLawnCare #EngineMaintenance
Valve Cover Gasket Replacement Guide,https://res.cloudinary.com/dbcpfy04c/image/upload/v1618237451/placeholder.jpg,home-inspiration,,https://lawntrend.com/briggs-and-stratton-leaking-oil-from-valve-cover/?utm_source=pinterest&utm_campaign=valve-cover-gasket-r,2025-05-16,Worried about tackling a Briggs & Stratton oil leak yourself?  This pin showcases the step-by-step process of replacing the valve cover gasket.  We include clear photos and detailed instructions,making it easy to follow along.  Gain confidence and save money by doing it yourself!  Don't let a simple repair cost you a fortune. Click to read the full guide! #GasketReplacement #EngineFix #SmallEngineRepair #LawnMower,making it easy to follow along.  Gain confidence and save money by doing it yourself!  Don't let a simple repair cost you a fortune. Click to read the full guide! #GasketReplacement #EngineFix #SmallEngineRepair #LawnMower
Save Money: DIY Briggs Repair,https://res.cloudinary.com/dbcpfy04c/image/upload/v1618237451/placeholder.jpg,home-inspiration,,https://lawntrend.com/briggs-and-stratton-leaking-oil-from-valve-cover/?utm_source=pinterest&utm_campaign=save-money-diy-brigg,2025-05-16,Tired of expensive lawnmower repairs? This pin emphasizes the cost savings of fixing a Briggs & Stratton oil leak yourself.  We break down the cost of parts versus professional repair,showing you how much you can save.  Take control of your lawn care budget!  Empower yourself with the knowledge to tackle common repairs. Click to read the full guide! #DIYRepair #SaveMoney #LawnMowerMaintenance #BriggsAndStratton,showing you how much you can save.  Take control of your lawn care budget!  Empower yourself with the knowledge to tackle common repairs. Click to read the full guide! #DIYRepair #SaveMoney #LawnMowerMaintenance #BriggsAndStratton
Easy Briggs & Stratton Oil Fix,https://res.cloudinary.com/dbcpfy04c/image/upload/v1618237451/placeholder.jpg,home-inspiration,,https://lawntrend.com/briggs-and-stratton-leaking-oil-from-valve-cover/?utm_source=pinterest&utm_campaign=easy-briggs-stratton,2025-05-16,This pin highlights how surprisingly easy it can be to fix a Briggs & Stratton valve cover oil leak.  We demystify the process and show you it's achievable for most DIYers.  Don't be intimidated!  With our guide,you'll be back to mowing in no time. Click to learn more and get started! #EasyRepair #LawnMowerFix #SmallEngineDIY #BriggsStratton,you'll be back to mowing in no time. Click to learn more and get started! #EasyRepair #LawnMowerFix #SmallEngineDIY #BriggsStratton
Preventative Maintenance: Oil Leaks,https://res.cloudinary.com/dbcpfy04c/image/upload/v1618237451/placeholder.jpg,home-inspiration,,https://lawntrend.com/briggs-and-stratton-leaking-oil-from-valve-cover/?utm_source=pinterest&utm_campaign=preventative-mainten,2025-05-16,"Don't wait for a leak to happen! This pin focuses on preventative maintenance to avoid Briggs & Stratton valve cover oil leaks.  We discuss proper oil levels, regular inspections",and other tips to keep your engine running smoothly.  A little prevention is worth a pound of cure! Click to learn more. #PreventativeMaintenance #EngineCare #LawnMowerTips #BriggsAndStratton,and other tips to keep your engine running smoothly.  A little prevention is worth a pound of cure! Click to learn more. #PreventativeMaintenance #EngineCare #LawnMowerTips #BriggsAndStratton
Briggs & Stratton Valve Cover Guide,https://res.cloudinary.com/dbcpfy04c/image/upload/v1618237451/placeholder.jpg,home-inspiration,,https://lawntrend.com/briggs-and-stratton-leaking-oil-from-valve-cover/?utm_source=pinterest&utm_campaign=briggs-stratton-valv,2025-05-16,This pin provides a visual guide to the Briggs & Stratton valve cover and its components.  Understanding the parts is crucial for a successful repair.  We break down the anatomy of the valve cover,making it easy to identify potential problem areas. Click to learn more! #ValveCover #EngineParts #BriggsAndStratton #LawnMowerEngine,making it easy to identify potential problem areas. Click to learn more! #ValveCover #EngineParts #BriggsAndStratton #LawnMowerEngine
Step-by-Step Briggs Oil Leak Fix,https://res.cloudinary.com/dbcpfy04c/image/upload/v1618237451/placeholder.jpg,home-inspiration,,https://lawntrend.com/briggs-and-stratton-leaking-oil-from-valve-cover/?utm_source=pinterest&utm_campaign=step-by-step-briggs-,2025-05-16,"Need a clear, concise guide to fixing a Briggs & Stratton oil leak? This pin offers a quick overview of the repair process",linking to the full step-by-step instructions on the blog.  Get a snapshot of the repair and then dive into the details. Click to learn more! #StepByStepRepair #LawnMowerGuide #EngineFix #BriggsAndStratton,linking to the full step-by-step instructions on the blog.  Get a snapshot of the repair and then dive into the details. Click to learn more! #StepByStepRepair #LawnMowerGuide #EngineFix #BriggsAndStratton
Briggs & Stratton: Torque Specs,https://res.cloudinary.com/dbcpfy04c/image/upload/v1618237451/placeholder.jpg,home-inspiration,,https://lawntrend.com/briggs-and-stratton-leaking-oil-from-valve-cover/?utm_source=pinterest&utm_campaign=briggs-stratton-torq,2025-05-16,Properly tightening the valve cover is crucial. This pin highlights the importance of using the correct torque specifications when reinstalling the valve cover.  Avoid over-tightening or under-tightening,which can lead to leaks. Click to learn more! #TorqueSpecs #EngineRepair #LawnMowerFix #BriggsAndStratton,which can lead to leaks. Click to learn more! #TorqueSpecs #EngineRepair #LawnMowerFix #BriggsAndStratton
Don't Let Oil Ruin Your Day!,https://res.cloudinary.com/dbcpfy04c/image/upload/v1618237451/placeholder.jpg,home-inspiration,,https://lawntrend.com/briggs-and-stratton-leaking-oil-from-valve-cover/?utm_source=pinterest&utm_campaign=dont-let-oil-ruin-yo,2025-05-16,A leaky engine can be frustrating. This pin appeals to the emotional side of lawn care,emphasizing the joy of a well-maintained lawn.  Get back to enjoying your yard without the worry of oil leaks. Click to read the full guide! #LawnCare #LawnMower #EngineRepair #BriggsAndStratton,emphasizing the joy of a well-maintained lawn.  Get back to enjoying your yard without the worry of oil leaks. Click to read the full guide! #LawnCare #LawnMower #EngineRepair #BriggsAndStratton
Briggs & Stratton: Oil Type Guide,https://res.cloudinary.com/dbcpfy04c/image/upload/v1618237451/placeholder.jpg,home-inspiration,,https://lawntrend.com/briggs-and-stratton-leaking-oil-from-valve-cover/?utm_source=pinterest&utm_campaign=briggs-stratton-oil-,2025-05-16,Using the correct oil is vital for engine health. This pin provides guidance on selecting the appropriate oil for your Briggs & Stratton engine.  Avoid using the wrong oil,which can contribute to leaks and damage. Click to learn more! #EngineOil #OilType #BriggsAndStratton #LawnMower,which can contribute to leaks and damage. Click to learn more! #EngineOil #OilType #BriggsAndStratton #LawnMower
Title,https://res.cloudinary.com/dbcpfy04c/image/upload/v1618237451/placeholder.jpg,home-inspiration,,https://lawntrend.com/husqvarna-yta24v48-transmission-problems/?utm_source=pinterest&utm_campaign=title,2025-05-16,Description,Keywords,Keywords
