Title,Media URL,Pinterest board,Thumbnail,Link,Publish date,Description,Keywords
Easy Vinyl Plank Cleaning Routine,https://res.cloudinary.com/dbcpfy04c/image/upload/v1748680378/pin_3_3_km9tmi.webp,floor-cleaning-tips,,https://www.beacleaner.com/how-to-clean-vinyl-plank-flooring?utm_source=pinterest&utm_campaign=easy-vinyl-plank-cle,2025-05-31,"Is keeping your vinyl plank floors clean a constant struggle? 😩 Stop stressing! This simple routine will save you time & effort. We break down everything from quick daily maintenance to deep cleaning, ensuring your floors stay beautiful. Discover the secret to streak-free shine & a healthier home. Click to learn how to effortlessly maintain your floors and enjoy a cleaner, happier space!","vinyl plank, cleaning routine, easy cleaning, home cleaning"
Vinyl Plank Floor Stain Removal,https://res.cloudinary.com/dbcpfy04c/image/upload/v1748680387/pin_3_4_gsy1mf.webp,floor-cleaning-tips,,https://www.beacleaner.com/how-to-clean-vinyl-plank-flooring?utm_source=pinterest&utm_campaign=vinyl-plank-floor-st,2025-05-31,"Spilled something on your vinyl plank floors? 😱 Don't panic! This guide shows you how to tackle *any* stain – coffee, wine, pet messes, and more! We'll share effective, safe solutions that won't damage your flooring. Learn the best techniques for quick cleanup and restoring your floors to their original glory. Click to save your floors (and your sanity!).","stain removal, vinyl flooring, cleaning hacks, pet stains"
Best Cleaners for Vinyl Plank,https://res.cloudinary.com/dbcpfy04c/image/upload/v1748680395/pin_3_5_nfshew.webp,floor-cleaning-tips,,https://www.beacleaner.com/how-to-clean-vinyl-plank-flooring?utm_source=pinterest&utm_campaign=best-cleaners-for-vi,2025-05-31,"Confused about which cleaners are safe for your vinyl plank floors? 🤔 We've got you covered! This post reveals the best (and worst!) products to use, ensuring you protect your investment. Avoid harsh chemicals that can dull or damage your flooring. Discover eco-friendly options for a healthy home. Click to learn what to use for a sparkling clean!","vinyl plank cleaner, floor cleaner, safe cleaning, eco-friendly"
Protect Your Vinyl Plank Floors,https://res.cloudinary.com/dbcpfy04c/image/upload/v1748680401/pin_3_6_c1rbbv.webp,floor-care-tips,,https://www.beacleaner.com/how-to-clean-vinyl-plank-flooring?utm_source=pinterest&utm_campaign=protect-your-vinyl-p,2025-05-31,"Want to keep your vinyl plank floors looking amazing for years to come? 💪 This guide shares essential tips for preventing scratches, dents, and wear & tear. Learn how to protect your investment and maintain that fresh-installed look. From furniture pads to doormats, we cover everything you need to know. Click to extend the life of your floors!","floor protection, vinyl plank care, scratch prevention, home improvement"
Deep Cleaning Vinyl Plank Floors,https://res.cloudinary.com/dbcpfy04c/image/upload/v1748680410/pin_3_7_bwwhpr.webp,floor-cleaning-tips,,https://www.beacleaner.com/how-to-clean-vinyl-plank-flooring?utm_source=pinterest&utm_campaign=deep-cleaning-vinyl-,2025-05-31,Give your vinyl plank floors the deep clean they deserve! ✨ This guide walks you through a step-by-step process for removing built-up dirt & grime. Learn how to revitalize your floors and restore their shine. Perfect for spring cleaning or preparing for guests. Click to reveal the secrets to a truly clean home!,"deep cleaning, vinyl plank, floor care, spring cleaning"
DIY Vinyl Plank Floor Cleaner,https://res.cloudinary.com/dbcpfy04c/image/upload/v1748680417/pin_3_8_xygftl.webp,floor-cleaning-tips,,https://www.beacleaner.com/how-to-clean-vinyl-plank-flooring?utm_source=pinterest&utm_campaign=diy-vinyl-plank-floo,2025-05-31,"Save money & create a powerful cleaner with ingredients you already have! 🍋 This DIY recipe is safe, effective, and eco-friendly. Perfect for vinyl plank floors, it will leave your home smelling fresh & clean. Click to learn how to make your own cleaning solution!","DIY cleaner, vinyl plank, natural cleaning, homemade cleaner"
Vinyl Plank vs. Laminate: Cleaning,https://res.cloudinary.com/dbcpfy04c/image/upload/v1748680424/pin_3_9_diu3ip.webp,flooring-tips,,https://www.beacleaner.com/how-to-clean-vinyl-plank-flooring?utm_source=pinterest&utm_campaign=vinyl-plank-vs-lamin,2025-05-31,"Not sure how your flooring differs? 🤔 This post compares cleaning vinyl plank vs. laminate, highlighting the best methods for each. Avoid damaging your floors with the wrong products! Learn the key differences and keep your home looking its best. Click to learn more!","vinyl plank, laminate, floor cleaning, flooring comparison"
Quick Daily Vinyl Plank Cleaning,https://res.cloudinary.com/dbcpfy04c/image/upload/v1748680431/pin_3_10_lw2i5m.webp,floor-cleaning-tips,,https://www.beacleaner.com/how-to-clean-vinyl-plank-flooring?utm_source=pinterest&utm_campaign=quick-daily-vinyl-pl,2025-05-31,Busy schedule? ⏰ This quick daily cleaning routine will keep your vinyl plank floors looking great with minimal effort. Learn simple habits that prevent dirt buildup and maintain a sparkling clean home. Click to simplify your cleaning routine!,"daily cleaning, vinyl plank, quick clean, home maintenance"
Vinyl Plank Floor Scratch Repair,https://res.cloudinary.com/dbcpfy04c/image/upload/v1748680439/pin_3_11_if9t4f.webp,floor-cleaning-tips,,https://www.beacleaner.com/how-to-clean-vinyl-plank-flooring?utm_source=pinterest&utm_campaign=vinyl-plank-floor-sc,2025-05-31,Scratches on your vinyl plank floors? 😩 Don't replace them! This guide shows you how to repair minor scratches and restore your floors to their former glory. Learn simple DIY techniques that save you money & time. Click to fix those unsightly scratches!,"scratch repair, vinyl plank, DIY repair, floor restoration"
The Ultimate Vinyl Plank Guide,https://res.cloudinary.com/dbcpfy04c/image/upload/v1748680446/pin_3_12_vrkozx.webp,flooring-ideas,,https://www.beacleaner.com/how-to-clean-vinyl-plank-flooring?utm_source=pinterest&utm_campaign=the-ultimate-vinyl-p,2025-05-31,"Everything you need to know about cleaning & caring for your vinyl plank floors! 📚 From choosing the right cleaner to preventing damage, this guide covers it all. Learn how to protect your investment and enjoy beautiful floors for years to come. Click to become a vinyl plank pro!","vinyl plank, floor guide, cleaning tips, home care"
Vinyl Plank Floor Cleaning Mistakes,https://res.cloudinary.com/dbcpfy04c/image/upload/v1748680455/pin_3_13_tl10ya.webp,floor-cleaning-tips,,https://www.beacleaner.com/how-to-clean-vinyl-plank-flooring?utm_source=pinterest&utm_campaign=vinyl-plank-floor-cl,2025-05-31,Are you making these common vinyl plank cleaning mistakes? 😬 Avoid damaging your floors with these simple fixes! Learn what *not* to do and keep your investment protected. Click to learn how to clean your floors the right way!,"cleaning mistakes, vinyl plank, floor care, avoid damage"
Pet-Friendly Vinyl Plank Cleaning,https://res.cloudinary.com/dbcpfy04c/image/upload/v1748680462/pin_3_14_i8pkwr.webp,floor-cleaning-tips,,https://www.beacleaner.com/how-to-clean-vinyl-plank-flooring?utm_source=pinterest&utm_campaign=pet-friendly-vinyl-p,2025-05-31,"Love your pets but hate the messes? 🐾 This guide shares the best ways to clean vinyl plank floors with pets in mind. Safe, effective solutions for pet stains, odors, and muddy paw prints. Click to keep your home clean & pet-friendly!","pet friendly, vinyl plank, cleaning, pet stains"
Vinyl Plank Floor Shine Booster,https://res.cloudinary.com/dbcpfy04c/image/upload/v1748680469/pin_3_15_n0z8i3.webp,floor-cleaning-tips,,https://www.beacleaner.com/how-to-clean-vinyl-plank-flooring?utm_source=pinterest&utm_campaign=vinyl-plank-floor-sh,2025-05-31,Want to give your vinyl plank floors a brilliant shine? ✨ This guide reveals the secrets to a sparkling clean finish. Learn how to restore luster and make your floors look like new. Click to unlock the shine!,"shine booster, vinyl plank, floor polish, cleaning hacks"
Vinyl Plank Floor Cleaning Checklist,https://res.cloudinary.com/dbcpfy04c/image/upload/v1748680477/pin_3_16_u4jozc.webp,floor-cleaning-tips,,https://www.beacleaner.com/how-to-clean-vinyl-plank-flooring?utm_source=pinterest&utm_campaign=vinyl-plank-floor-cl,2025-05-31,"Stay organized with this handy vinyl plank floor cleaning checklist! ✅ A simple, printable guide to keep your floors looking their best. Perfect for busy homeowners. Click to download your free checklist!","cleaning checklist, vinyl plank, organization, home cleaning"
Vinyl Plank Floor & Furniture Care,https://res.cloudinary.com/dbcpfy04c/image/upload/v1748680482/pin_3_17_gcba3t.webp,floor-cleaning-tips,,https://www.beacleaner.com/how-to-clean-vinyl-plank-flooring?utm_source=pinterest&utm_campaign=vinyl-plank-floor-fu,2025-05-31,Protect both your floors *and* your furniture! 🛋️ This guide shares tips for preventing scratches and damage. Learn how to choose the right furniture pads and maintain a beautiful home. Click to learn more!,"furniture care, vinyl plank, floor protection, home decor"
Vinyl Plank Floor: Before & After,https://res.cloudinary.com/dbcpfy04c/image/upload/v1748680489/pin_3_18_keynwp.webp,floor-cleaning-tips,,https://www.beacleaner.com/how-to-clean-vinyl-plank-flooring?utm_source=pinterest&utm_campaign=vinyl-plank-floor-be,2025-05-31,See the amazing transformation! 🤩 This before & after shows the power of proper vinyl plank floor cleaning. Learn how to revitalize your floors and restore their beauty. Click to see the results!,"before and after, vinyl plank, cleaning results, floor transformation"
Vinyl Plank Floor Cleaning Schedule,https://res.cloudinary.com/dbcpfy04c/image/upload/v1748680496/pin_3_19_thxpdy.webp,floor-cleaning-tips,,https://www.beacleaner.com/how-to-clean-vinyl-plank-flooring?utm_source=pinterest&utm_campaign=vinyl-plank-floor-cl,2025-05-31,"Struggling to find time to clean? 🗓️ This cleaning schedule will help you stay on top of your vinyl plank floor maintenance. Simple, effective, and easy to follow. Click to simplify your life!","cleaning schedule, vinyl plank, home maintenance, organization"
Vinyl Plank Floor: Do's & Don'ts,https://res.cloudinary.com/dbcpfy04c/image/upload/v1748680503/pin_3_20_fftu5u.webp,floor-cleaning-tips,,https://www.beacleaner.com/how-to-clean-vinyl-plank-flooring?utm_source=pinterest&utm_campaign=vinyl-plank-floor-do,2025-05-31,Confused about what to do (and not do) when cleaning your vinyl plank floors? 🤔 This guide provides a clear list of do's and don'ts to keep your investment protected. Click to learn the rules!,"do's and don'ts, vinyl plank, floor care, cleaning guide"
Eco-Friendly Vinyl Plank Cleaning,https://res.cloudinary.com/dbcpfy04c/image/upload/v1748680512/pin_3_21_ml2qtx.webp,floor-cleaning-tips,,https://www.beacleaner.com/how-to-clean-vinyl-plank-flooring?utm_source=pinterest&utm_campaign=eco-friendly-vinyl-p,2025-05-31,"Go green with your floor cleaning! 🌿 This guide shares eco-friendly solutions for vinyl plank floors. Safe for your family, pets, and the environment. Click to learn more!","eco-friendly, vinyl plank, natural cleaning, green cleaning"
Vinyl Plank Floor: Preventing Water Damage,https://res.cloudinary.com/dbcpfy04c/image/upload/v1748680520/pin_3_22_qkqfiy.webp,floor-cleaning-tips,,https://www.beacleaner.com/how-to-clean-vinyl-plank-flooring?utm_source=pinterest&utm_campaign=vinyl-plank-floor-pr,2025-05-31,Worried about water damage? 💧 This guide shares tips for preventing moisture from ruining your vinyl plank floors. Learn how to protect your investment and keep your home safe. Click to learn more!,"water damage, vinyl plank, floor protection, home maintenance"
Vinyl Plank Floor: Cleaning with Vinegar,https://res.cloudinary.com/dbcpfy04c/image/upload/v1748680528/pin_3_23_d0zxln.webp,floor-cleaning-tips,,https://www.beacleaner.com/how-to-clean-vinyl-plank-flooring?utm_source=pinterest&utm_campaign=vinyl-plank-floor-cl,2025-05-31,Can you use vinegar on vinyl plank floors? 🤔 This guide answers your questions and shares the best way to use vinegar for a sparkling clean. Click to learn more!,"vinegar cleaning, vinyl plank, natural cleaning, DIY cleaner"
Vinyl Plank Floor: Cleaning for Allergies,https://res.cloudinary.com/dbcpfy04c/image/upload/v1748680534/pin_3_24_guv9q8.webp,floor-cleaning-tips,,https://www.beacleaner.com/how-to-clean-vinyl-plank-flooring?utm_source=pinterest&utm_campaign=vinyl-plank-floor-cl,2025-05-31,Suffering from allergies? 🤧 This guide shares tips for cleaning vinyl plank floors to reduce allergens and create a healthier home. Click to breathe easier!,"allergies, vinyl plank, cleaning, healthy home"
Vinyl Plank Floor: Cleaning Under Furniture,https://res.cloudinary.com/dbcpfy04c/image/upload/v1748680540/pin_3_25_swz2qm.webp,floor-cleaning-tips,,https://www.beacleaner.com/how-to-clean-vinyl-plank-flooring?utm_source=pinterest&utm_campaign=vinyl-plank-floor-cl,2025-05-31,Don't forget to clean *under* your furniture! 🛋️ This guide shares tips for reaching those hard-to-clean areas and keeping your vinyl plank floors spotless. Click to learn more!,"under furniture, vinyl plank, cleaning, hard to reach areas"
Vinyl Plank Floor: The Ultimate FAQ,https://res.cloudinary.com/dbcpfy04c/image/upload/v1748680546/pin_3_26_vjjzhr.webp,floor-cleaning-tips,,https://www.beacleaner.com/how-to-clean-vinyl-plank-flooring?utm_source=pinterest&utm_campaign=vinyl-plank-floor-th,2025-05-31,"Got questions about cleaning vinyl plank floors? 🤔 This FAQ answers all your burning questions! From stain removal to maintenance, we've got you covered. Click to find your answers!","FAQ, vinyl plank, cleaning, floor care"
Title,https://res.cloudinary.com/dbcpfy04c/image/upload/v1748680584/pin_4_1_h7i8fm.webp,please-provide-the-title-and-keywords-i-need-that-information-to-suggest-a-board-name-once,,https://www.beacleaner.com/how-to-clean-yellow-spot-on-bathroom-ceiling?utm_source=pinterest&utm_campaign=title,2025-05-31,Description,Keywords
Bye Bye Yellow Spots!,https://res.cloudinary.com/dbcpfy04c/image/upload/v1748680590/pin_4_2_utnsx3.webp,cleaning-tips,,https://www.beacleaner.com/how-to-clean-yellow-spot-on-bathroom-ceiling?utm_source=pinterest&utm_campaign=bye-bye-yellow-spots,2025-05-31,Is your bathroom ceiling looking…less than fresh? Those yellow spots are a common problem,but don't despair! This guide reveals the *easy* way to banish them for good. We'll show you exactly what causes these stains (it's not what you think!) and the simple cleaning solution you probably already have. Reclaim a bright
Bathroom Ceiling Rescue,https://res.cloudinary.com/dbcpfy04c/image/upload/v1748680596/pin_4_3_rkifyj.webp,bathroom-cleaning-tips,,https://www.beacleaner.com/how-to-clean-yellow-spot-on-bathroom-ceiling?utm_source=pinterest&utm_campaign=bathroom-ceiling-res,2025-05-31,Ugh,that yellow ceiling stain is SO frustrating! Don't let it ruin your bathroom's vibe. This post breaks down the science behind those pesky spots and provides a step-by-step solution that *actually* works. No harsh chemicals needed! Get a sparkling clean ceiling without breaking a sweat. Your bathroom deserves it! Learn how now! #CeilingStains #BathroomMakeover #CleanHome #DIYCleaning
Stop Yellow Stains Now!,https://res.cloudinary.com/dbcpfy04c/image/upload/v1748680602/pin_4_4_ljdkwi.webp,cleaning-tips,,https://www.beacleaner.com/how-to-clean-yellow-spot-on-bathroom-ceiling?utm_source=pinterest&utm_campaign=stop-yellow-stains-n,2025-05-31,Tired of staring at a dingy bathroom ceiling? You're not alone! This guide tackles the mystery of yellow stains head-on,explaining why they appear and how to eliminate them. We'll walk you through the process with clear instructions and helpful tips. Say goodbye to embarrassment and hello to a fresh
The Truth About Ceiling Stains,https://res.cloudinary.com/dbcpfy04c/image/upload/v1748680608/pin_4_5_yn6atq.webp,cleaning-tips,,https://www.beacleaner.com/how-to-clean-yellow-spot-on-bathroom-ceiling?utm_source=pinterest&utm_campaign=the-truth-about-ceil,2025-05-31,Ever wonder *why* your bathroom ceiling turns yellow? It's not mold (usually!). This post reveals the surprising culprit and provides a simple,effective cleaning method. We'll show you how to prevent future stains too! Don't let this common problem bother you any longer. Get the answers you need and a spotless ceiling! #BathroomClean #CeilingCleaning #HomeHacks #CleaningTips
Easy Bathroom Ceiling Clean,https://res.cloudinary.com/dbcpfy04c/image/upload/v1748680614/pin_4_6_h40eqy.webp,cleaning-tips,,https://www.beacleaner.com/how-to-clean-yellow-spot-on-bathroom-ceiling?utm_source=pinterest&utm_campaign=easy-bathroom-ceilin,2025-05-31,Don't spend hours scrubbing! This guide offers a quick and easy solution for removing yellow stains from your bathroom ceiling. We'll show you how to do it safely and effectively,with minimal effort. Imagine a bright
No More Yellow! (Bathroom),https://res.cloudinary.com/dbcpfy04c/image/upload/v1748680620/pin_4_7_a8qpuw.webp,bathroom-cleaning-tips,,https://www.beacleaner.com/how-to-clean-yellow-spot-on-bathroom-ceiling?utm_source=pinterest&utm_campaign=no-more-yellow-bathr,2025-05-31,Is a yellowed bathroom ceiling making you cringe? It doesn't have to! This post provides a simple,step-by-step guide to removing those unsightly stains. We'll explain the process clearly and offer helpful tips for preventing them from returning. Get a bathroom you'll love again! #BathroomGoals #CleanBathroom #HomeCare #StainRemover
The Ultimate Ceiling Stain Guide,https://res.cloudinary.com/dbcpfy04c/image/upload/v1748680627/pin_4_8_jjt91n.webp,home-repair-tips,,https://www.beacleaner.com/how-to-clean-yellow-spot-on-bathroom-ceiling?utm_source=pinterest&utm_campaign=the-ultimate-ceiling,2025-05-31,Everything you need to know about yellow stains on your bathroom ceiling is right here! This comprehensive guide covers the causes,prevention
Bathroom Ceiling: Before & After,https://res.cloudinary.com/dbcpfy04c/image/upload/v1748680634/pin_4_9_zbfhft.webp,bathroom-cleaning-tips,,https://www.beacleaner.com/how-to-clean-yellow-spot-on-bathroom-ceiling?utm_source=pinterest&utm_campaign=bathroom-ceiling-bef,2025-05-31,See the amazing transformation! This post shows you how to go from a dingy,yellow-stained bathroom ceiling to a bright
Quick Fix for Yellow Ceilings,https://res.cloudinary.com/dbcpfy04c/image/upload/v1748680641/pin_4_10_yd1fxz.webp,bathroom-tips,,https://www.beacleaner.com/how-to-clean-yellow-spot-on-bathroom-ceiling?utm_source=pinterest&utm_campaign=quick-fix-for-yellow,2025-05-31,Short on time? No problem! This post offers a quick and easy solution for removing yellow stains from your bathroom ceiling. We'll show you how to get results fast,without sacrificing quality. Get a clean bathroom in minutes! #FastCleaning #BathroomHacks #HomeMaintenance #QuickFix
Prevent Bathroom Ceiling Stains,https://res.cloudinary.com/dbcpfy04c/image/upload/v1748680647/pin_4_11_mczfkg.webp,bathroom-tips,,https://www.beacleaner.com/how-to-clean-yellow-spot-on-bathroom-ceiling?utm_source=pinterest&utm_campaign=prevent-bathroom-cei,2025-05-31,Don't just clean the stains,prevent them! This post explains how to prevent yellow stains from forming on your bathroom ceiling in the first place. We'll share simple tips and tricks to keep your bathroom looking its best. #Prevention #BathroomCare #HomeTips #CleanLiving
Easy Cleaning for Busy People,https://res.cloudinary.com/dbcpfy04c/image/upload/v1748680652/pin_4_12_nqq3nv.webp,cleaning-tips,,https://www.beacleaner.com/how-to-clean-yellow-spot-on-bathroom-ceiling?utm_source=pinterest&utm_campaign=easy-cleaning-for-bu,2025-05-31,Life is busy enough! This post offers a simple and effective solution for removing yellow stains from your bathroom ceiling,even if you're short on time. We'll show you how to get results fast
Restore Your Bathroom's Shine,https://res.cloudinary.com/dbcpfy04c/image/upload/v1748680659/pin_4_13_a5fw5d.webp,bathroom-cleaning-tips,,https://www.beacleaner.com/how-to-clean-yellow-spot-on-bathroom-ceiling?utm_source=pinterest&utm_campaign=restore-your-bathroo,2025-05-31,Bring back the shine to your bathroom! This post shows you how to remove yellow stains from the ceiling and create a bright,inviting space. We'll provide a simple and effective solution. #BathroomShine #HomeRevival #CleaningPower #BrightSpace
Simple Solution for Yellow Spots,https://res.cloudinary.com/dbcpfy04c/image/upload/v1748680666/pin_4_14_xh4bot.webp,cleaning-tips,,https://www.beacleaner.com/how-to-clean-yellow-spot-on-bathroom-ceiling?utm_source=pinterest&utm_campaign=simple-solution-for-,2025-05-31,Struggling with yellow spots on your bathroom ceiling? This post offers a simple,yet powerful solution. We'll walk you through the process step-by-step. Get a cleaner bathroom today! #SimpleSolution #BathroomCleaning #HomeHacks #EasyClean
Affordable Bathroom Refresh,https://res.cloudinary.com/dbcpfy04c/image/upload/v1748680672/pin_4_15_ceper7.webp,bathroom-inspiration,,https://www.beacleaner.com/how-to-clean-yellow-spot-on-bathroom-ceiling?utm_source=pinterest&utm_campaign=affordable-bathroom-,2025-05-31,Give your bathroom a refresh without breaking the bank! This post shows you how to remove yellow ceiling stains with affordable,everyday cleaning supplies. #AffordableRefresh #BathroomBudget #HomeCleaning #SaveMoney
Title,https://res.cloudinary.com/dbcpfy04c/image/upload/v1748680717/pin_5_1_qlgaip.webp,please-provide-the-title-and-keywords-i-need-that-information-to-suggest-a-board-name-once,,https://www.beacleaner.com/how-to-remove-baking-soda-residue-from-tile?utm_source=pinterest&utm_campaign=title,2025-05-31,Description,Keywords
Baking Soda Residue? Gone! ✨,https://res.cloudinary.com/dbcpfy04c/image/upload/v1748680722/pin_5_2_ida31a.webp,cleaning-tips,,https://www.beacleaner.com/how-to-remove-baking-soda-residue-from-tile?utm_source=pinterest&utm_campaign=baking-soda-residue-,2025-05-31,Ugh,baking soda is amazing for cleaning…until it leaves that frustrating white film! Don't scrub endlessly! This guide reveals the *easiest* ways to remove baking soda residue from your tile floors & surfaces. Learn the best tools
Sparkling Tile: No Residue!,https://res.cloudinary.com/dbcpfy04c/image/upload/v1748680729/pin_5_3_awjhhs.webp,floor-cleaning-tips,,https://www.beacleaner.com/how-to-remove-baking-soda-residue-from-tile?utm_source=pinterest&utm_campaign=sparkling-tile-no-re,2025-05-31,Is baking soda leaving a cloudy mess on your beautiful tile? You're not alone! This post breaks down exactly *why* residue happens and how to fix it quickly. We cover everything from gentle wiping techniques to tackling stubborn buildup.  Imagine stepping onto floors that truly shine – it's easier than you think!  Don't let residue ruin your hard work. Get the secrets to a spotless finish now!,tile floors
Bye-Bye Baking Soda Film!,https://res.cloudinary.com/dbcpfy04c/image/upload/v1748680736/pin_5_4_j1uu2h.webp,cleaning-tips,,https://www.beacleaner.com/how-to-remove-baking-soda-residue-from-tile?utm_source=pinterest&utm_campaign=bye-bye-baking-soda-,2025-05-31,Don't let a white film ruin your tile's beauty! This guide is your ultimate resource for removing baking soda residue. We'll show you how to avoid harsh chemicals and use simple,effective methods.  We'll even share tips to prevent residue from happening in the first place!  A clean home equals a happy home – let's make yours shine! Click to learn more and reclaim your sparkling floors!
Tile Cleaning SOS: Residue Help!,https://res.cloudinary.com/dbcpfy04c/image/upload/v1748680744/pin_5_5_mvgxlg.webp,tile-cleaning-tips,,https://www.beacleaner.com/how-to-remove-baking-soda-residue-from-tile?utm_source=pinterest&utm_campaign=tile-cleaning-sos-re,2025-05-31,Struggling with baking soda residue on your tile?  You're not the only one! This post offers a step-by-step guide to effortlessly remove that frustrating white film.  We'll cover different tile types and the best cleaning solutions for each.  Stop stressing and start enjoying a beautifully clean home!  Click to read now and get your sparkle back!,tile cleaning
The Secret to Spotless Tile ✨,https://res.cloudinary.com/dbcpfy04c/image/upload/v1748680752/pin_5_6_e8axuk.webp,cleaning-tips-ideas,,https://www.beacleaner.com/how-to-remove-baking-soda-residue-from-tile?utm_source=pinterest&utm_campaign=the-secret-to-spotle,2025-05-31,Want to know the secret to perfectly clean tile? It's not just *using* baking soda,it's knowing how to remove the residue! This post reveals the simple tricks professional cleaners use to achieve a streak-free shine.  Don't waste time and energy scrubbing – learn the smart way to clean!  Click to discover the secrets and enjoy a sparkling home!
Vinegar & Baking Soda: Residue Fix!,https://res.cloudinary.com/dbcpfy04c/image/upload/v1748680760/pin_5_7_thfyoi.webp,cleaning-tips,,https://www.beacleaner.com/how-to-remove-baking-soda-residue-from-tile?utm_source=pinterest&utm_campaign=vinegar-baking-soda-,2025-05-31,Baking soda + vinegar is a cleaning dream team…until the residue appears! This post shows you how to use vinegar to *effectively* dissolve baking soda residue from your tile.  We'll cover the right ratios and techniques for a flawless finish.  Get ready to be amazed by the power of these two simple ingredients! Click to learn more!,vinegar
