Title,Media URL,Pinterest board,Thumbnail,Link,Publish date,Description,Keywords,
Title,https://res.cloudinary.com/dbcpfy04c/image/upload/v1747340425/pin_1_1_z2pih5.webp,please-provide-the-title-and-keywords-i-need-that-information-to-suggest-a-board-name-once,,https://lawntrend.com/husqvarna-570bts-problems/?utm_source=pinterest&utm_campaign=title,2025-05-15,Description,Keywords,Keywords
Husqvarna 570BTS: Common Issues,https://res.cloudinary.com/dbcpfy04c/image/upload/v1747340433/pin_1_2_mcoeiy.webp,yard-repair-ideas,,https://lawntrend.com/husqvarna-570bts-problems/?utm_source=pinterest&utm_campaign=husqvarna-570bts-com,2025-05-15,Is your Husqvarna 570BTS blower giving you trouble? Don't let a frustrating breakdown ruin your fall cleanup! This guide dives deep into the most common problems – from starting issues and fuel delivery to clogged nozzles and overheating. We'll help you diagnose the problem quickly and provide clear,step-by-step solutions to get you back to blowing leaves in no time. Save money on repairs and keep your yard looking pristine. Click to learn how to fix it yourself! #Husqvarna570BTS #LeafBlowerRepair #BackyardMaintenance #DIYRepair,step-by-step solutions to get you back to blowing leaves in no time. Save money on repairs and keep your yard looking pristine. Click to learn how to fix it yourself! #Husqvarna570BTS #LeafBlowerRepair #BackyardMaintenance #DIYRepair
Husqvarna 570BTS Fuel Issues Solved,https://res.cloudinary.com/dbcpfy04c/image/upload/v1747340441/pin_1_3_mxonmg.webp,yard-repair-ideas,,https://lawntrend.com/husqvarna-570bts-problems/?utm_source=pinterest&utm_campaign=husqvarna-570bts-fue,2025-05-15,"Is your Husqvarna 570BTS running rough or stalling? It could be a fuel problem! This pin highlights common fuel-related issues like clogged filters, bad gas, and carburetor problems. We provide easy-to-follow instructions for cleaning, adjusting",and replacing fuel system components. Don't let a fuel issue slow you down – get back to work with a perfectly tuned engine! Click to learn more. #FuelSystem #CarburetorRepair #HusqvarnaProblems #OutdoorPowerEquipment,and replacing fuel system components. Don't let a fuel issue slow you down – get back to work with a perfectly tuned engine! Click to learn more. #FuelSystem #CarburetorRepair #HusqvarnaProblems #OutdoorPowerEquipment
Overheating 570BTS? Here's Why!,https://res.cloudinary.com/dbcpfy04c/image/upload/v1747340455/pin_1_4_fszgqk.webp,outdoor-power-ideas,,https://lawntrend.com/husqvarna-570bts-problems/?utm_source=pinterest&utm_campaign=overheating-570bts-h,2025-05-15,"Don't let your Husqvarna 570BTS overheat and potentially damage your engine! This pin addresses the causes of overheating, including blocked cooling fins, incorrect fuel mixtures",and excessive use. Learn how to prevent overheating and keep your blower running cool and efficiently. Protect your investment and enjoy reliable performance. Click for the full troubleshooting guide! #Overheating #EngineRepair #HusqvarnaMaintenance #LeafBlowerTips,and excessive use. Learn how to prevent overheating and keep your blower running cool and efficiently. Protect your investment and enjoy reliable performance. Click for the full troubleshooting guide! #Overheating #EngineRepair #HusqvarnaMaintenance #LeafBlowerTips
Husqvarna 570BTS: Carburetor Guide,https://res.cloudinary.com/dbcpfy04c/image/upload/v1747340460/pin_1_5_hui0xn.webp,yard-repair-ideas,,https://lawntrend.com/husqvarna-570bts-problems/?utm_source=pinterest&utm_campaign=husqvarna-570bts-car,2025-05-15,"The carburetor is the heart of your Husqvarna 570BTS. This pin focuses specifically on carburetor issues – cleaning, adjusting",and rebuilding. We provide detailed instructions and helpful diagrams to guide you through the process. Don't be intimidated by carburetor repair! Click to learn how to keep your engine running smoothly. #Carburetor #HusqvarnaRepair #SmallEngine #DIY,and rebuilding. We provide detailed instructions and helpful diagrams to guide you through the process. Don't be intimidated by carburetor repair! Click to learn how to keep your engine running smoothly. #Carburetor #HusqvarnaRepair #SmallEngine #DIY
Easy Fixes for a Weak 570BTS Blower,https://res.cloudinary.com/dbcpfy04c/image/upload/v1747340467/pin_1_6_thw5jg.webp,yard-repair-ideas,,https://lawntrend.com/husqvarna-570bts-problems/?utm_source=pinterest&utm_campaign=easy-fixes-for-a-wea,2025-05-15,"Is your Husqvarna 570BTS lacking power? This pin covers simple fixes that can restore your blower's performance. We discuss clogged air filters, worn spark plugs",and fuel issues. Don't replace your blower – try these easy solutions first! Click to read the full article and get your blower blowing strong again. #LowPower #HusqvarnaFix #BlowerRepair #YardCleanup,and fuel issues. Don't replace your blower – try these easy solutions first! Click to read the full article and get your blower blowing strong again. #LowPower #HusqvarnaFix #BlowerRepair #YardCleanup
Extend the Life of Your 570BTS!,https://res.cloudinary.com/dbcpfy04c/image/upload/v1618237451/placeholder.jpg,home-inspiration,,https://lawntrend.com/husqvarna-570bts-problems/?utm_source=pinterest&utm_campaign=extend-the-life-of-y,2025-05-15,Want to keep your Husqvarna 570BTS running for years to come? This pin highlights essential maintenance tips to extend the life of your blower. From proper storage to regular cleaning,we'll help you protect your investment. Don't replace it – maintain it! Click to learn more. #HusqvarnaMaintenance #LeafBlowerLife #OutdoorEquipment #PreventativeMaintenance,we'll help you protect your investment. Don't replace it – maintain it! Click to learn more. #HusqvarnaMaintenance #LeafBlowerLife #OutdoorEquipment #PreventativeMaintenance
570BTS Vibrating Too Much? Find Out Why,https://res.cloudinary.com/dbcpfy04c/image/upload/v1618237451/placeholder.jpg,home-inspiration,,https://lawntrend.com/husqvarna-570bts-problems/?utm_source=pinterest&utm_campaign=570bts-vibrating-too,2025-05-15,Excessive vibration can be a sign of a serious problem. This pin addresses the causes of vibration in your Husqvarna 570BTS,including loose parts and engine imbalances. Don't ignore excessive vibration – it could lead to further damage. Click to learn how to diagnose and fix it. #Vibration #HusqvarnaProblems #EngineRepair #SafetyFirst,including loose parts and engine imbalances. Don't ignore excessive vibration – it could lead to further damage. Click to learn how to diagnose and fix it. #Vibration #HusqvarnaProblems #EngineRepair #SafetyFirst
Husqvarna 570BTS: Winter Storage Tips,https://res.cloudinary.com/dbcpfy04c/image/upload/v1618237451/placeholder.jpg,home-inspiration,,https://lawntrend.com/husqvarna-570bts-problems/?utm_source=pinterest&utm_campaign=husqvarna-570bts-win,2025-05-15,"Proper winter storage is crucial for protecting your Husqvarna 570BTS. This pin provides a comprehensive guide to preparing your blower for long-term storage. We cover fuel stabilization, cleaning",and storage location. Ensure a smooth start next spring! Click to learn more. #WinterStorage #HusqvarnaCare #LeafBlowerPrep #OffSeasonMaintenance,and storage location. Ensure a smooth start next spring! Click to learn more. #WinterStorage #HusqvarnaCare #LeafBlowerPrep #OffSeasonMaintenance
Quick Check: 570BTS Pre-Start Inspection,https://res.cloudinary.com/dbcpfy04c/image/upload/v1747340480/pin_1_10_smrop4.webp,yard-maintenance-ideas,,https://lawntrend.com/husqvarna-570bts-problems/?utm_source=pinterest&utm_campaign=quick-check-570bts-p,2025-05-15,Before each use,perform this quick pre-start inspection on your Husqvarna 570BTS. This pin outlines essential checks to ensure safe and reliable operation. Prevent problems before they start! Click to learn more. #PreStartCheck #HusqvarnaSafety #MaintenanceTips #YardWorkPrep,perform this quick pre-start inspection on your Husqvarna 570BTS. This pin outlines essential checks to ensure safe and reliable operation. Prevent problems before they start! Click to learn more. #PreStartCheck #HusqvarnaSafety #MaintenanceTips #YardWorkPrep
Title,https://res.cloudinary.com/dbcpfy04c/image/upload/v1618237451/placeholder.jpg,home-inspiration,,https://lawntrend.com/craftsman-w-20hp-briggs-stratton-wont-start/?utm_source=pinterest&utm_campaign=title,2025-05-15,Description,Keywords,Keywords
Craftsman Won't Start? Fix It!,https://res.cloudinary.com/dbcpfy04c/image/upload/v1618237451/placeholder.jpg,home-inspiration,,https://lawntrend.com/craftsman-w-20hp-briggs-stratton-wont-start/?utm_source=pinterest&utm_campaign=craftsman-wont-start,2025-05-15,"Is your Craftsman lawn mower with a 20HP Briggs & Stratton engine refusing to start? Don't despair! This guide walks you through common issues like a clogged carburetor, bad spark plug, or fuel problems. Save money & the frustration of a dead lawn! We'll show you step-by-step how to diagnose and fix it yourself. Get back to enjoying your weekend instead of wrestling with your mower. Click to learn more and get your lawn back in shape! ,lawn mower repair,Briggs & Stratton,Craftsman",no start,no start
Briggs 20HP: Starting Troubles?,https://res.cloudinary.com/dbcpfy04c/image/upload/v1618237451/placeholder.jpg,home-inspiration,,https://lawntrend.com/craftsman-w-20hp-briggs-stratton-wont-start/?utm_source=pinterest&utm_campaign=briggs-20hp-starting,2025-05-15,"Facing a frustrating no-start with your Briggs & Stratton 20HP engine on your Craftsman mower? This post is your lifeline! We cover everything from checking the fuel shut-off valve to diagnosing ignition issues. Don't let a simple fix ruin your summer.  We'll help you pinpoint the problem and get your mower roaring again.  Learn how to avoid costly repairs and keep your lawn looking its best. Click now for a detailed guide! ,Briggs & Stratton 20HP,lawn mower,starting problems",DIY repair,DIY repair
Craftsman Mower: Easy Start Guide,https://res.cloudinary.com/dbcpfy04c/image/upload/v1618237451/placeholder.jpg,home-inspiration,,https://lawntrend.com/craftsman-w-20hp-briggs-stratton-wont-start/?utm_source=pinterest&utm_campaign=craftsman-mower-easy,2025-05-15,"Is your Craftsman mower refusing to cooperate? This guide focuses on the 20HP Briggs & Stratton engine and provides a clear, concise troubleshooting process.  We'll help you identify the culprit – whether it's old gas, a dirty air filter, or something more complex.  Don't feel helpless!  Empower yourself with the knowledge to fix it. Click to read and get mowing! ,Craftsman mower,Briggs & Stratton,troubleshooting",lawn care,lawn care
Fix a No-Start Craftsman (20HP),https://res.cloudinary.com/dbcpfy04c/image/upload/v1618237451/placeholder.jpg,home-inspiration,,https://lawntrend.com/craftsman-w-20hp-briggs-stratton-wont-start/?utm_source=pinterest&utm_campaign=fix-a-no-start-craft,2025-05-15,"Don't let a stubborn Craftsman mower ruin your weekend! This guide specifically addresses the 20HP Briggs & Stratton engine and its common starting issues. We'll walk you through checking the safety switches, fuel system, and ignition system.  Imagine the satisfaction of fixing it yourself and saving money! Click to learn how to get your mower running smoothly again. ,lawn mower,Briggs & Stratton,Craftsman",DIY,DIY
Carburetor Issues? Craftsman Fix,https://res.cloudinary.com/dbcpfy04c/image/upload/v1618237451/placeholder.jpg,home-inspiration,,https://lawntrend.com/craftsman-w-20hp-briggs-stratton-wont-start/?utm_source=pinterest&utm_campaign=carburetor-issues-cr,2025-05-15,"Is a clogged carburetor preventing your Craftsman mower (20HP Briggs & Stratton) from starting? This guide provides a detailed walkthrough on cleaning and potentially rebuilding your carburetor.  Don't replace it – restore it!  We'll show you how to save money and get your mower running like new. Click to learn the process! ,carburetor,lawn mower repair,Briggs & Stratton",Craftsman,Craftsman
Spark Plug Secrets: Craftsman Mower,https://res.cloudinary.com/dbcpfy04c/image/upload/v1618237451/placeholder.jpg,home-inspiration,,https://lawntrend.com/craftsman-w-20hp-briggs-stratton-wont-start/?utm_source=pinterest&utm_campaign=spark-plug-secrets-c,2025-05-15,"A faulty spark plug can be the reason your Craftsman mower won't start. This guide, focused on the 20HP Briggs & Stratton engine, explains how to test and replace your spark plug.  It's a quick, easy, and affordable fix!  Don't let a small part cause big problems. Click to learn more and get back to mowing. ,spark plug,lawn mower,Briggs & Stratton",DIY repair,DIY repair
Fuel Problems & Craftsman Mowers,https://res.cloudinary.com/dbcpfy04c/image/upload/v1618237451/placeholder.jpg,home-inspiration,,https://lawntrend.com/craftsman-w-20hp-briggs-stratton-wont-start/?utm_source=pinterest&utm_campaign=fuel-problems-crafts,2025-05-15,"Is old or contaminated fuel causing your Craftsman mower (20HP Briggs & Stratton) to fail to start? This guide covers fuel system troubleshooting, including fuel filters and fuel lines.  Avoid the headache of stale gas!  We'll help you ensure a clean fuel supply for reliable starting. Click to read now! ,fuel system,lawn mower,Briggs & Stratton",Craftsman,Craftsman
Craftsman Mower: Safety First!,https://res.cloudinary.com/dbcpfy04c/image/upload/v1618237451/placeholder.jpg,home-inspiration,,https://lawntrend.com/craftsman-w-20hp-briggs-stratton-wont-start/?utm_source=pinterest&utm_campaign=craftsman-mower-safe,2025-05-15,"Before you start troubleshooting your Craftsman mower (20HP Briggs & Stratton), safety is paramount! This guide highlights essential safety precautions to take while working on your mower.  Protect yourself and prevent accidents.  We'll help you work confidently and safely. Click to learn more! ,lawn mower safety,Briggs & Stratton,Craftsman",DIY,DIY
Briggs & Stratton: Easy Diagnosis,https://res.cloudinary.com/dbcpfy04c/image/upload/v1618237451/placeholder.jpg,home-inspiration,,https://lawntrend.com/craftsman-w-20hp-briggs-stratton-wont-start/?utm_source=pinterest&utm_campaign=briggs-stratton-easy,2025-05-15,"Struggling to diagnose why your Briggs & Stratton 20HP engine won't start on your Craftsman mower? This guide provides a systematic approach to identifying the problem.  We'll help you narrow down the possibilities and find the solution.  Don't waste time guessing! Click to learn the process. ,Briggs & Stratton,lawn mower,diagnosis",Craftsman,Craftsman
Craftsman Mower: Air Filter Check,https://res.cloudinary.com/dbcpfy04c/image/upload/v1618237451/placeholder.jpg,home-inspiration,,https://lawntrend.com/craftsman-w-20hp-briggs-stratton-wont-start/?utm_source=pinterest&utm_campaign=craftsman-mower-air-,2025-05-15,"A dirty air filter can restrict airflow and prevent your Craftsman mower (20HP Briggs & Stratton) from starting. This guide shows you how to inspect and replace your air filter.  It's a simple maintenance task that can make a big difference! Click to learn more. ,air filter,lawn mower,Briggs & Stratton",Craftsman,Craftsman
No Spark? Craftsman Mower Help,https://res.cloudinary.com/dbcpfy04c/image/upload/v1618237451/placeholder.jpg,home-inspiration,,https://lawntrend.com/craftsman-w-20hp-briggs-stratton-wont-start/?utm_source=pinterest&utm_campaign=no-spark-craftsman-m,2025-05-15,"No spark means no start! This guide focuses on diagnosing and fixing ignition problems on your Craftsman mower with a 20HP Briggs & Stratton engine.  We'll cover the ignition coil, magneto, and other components.  Don't be intimidated – we'll guide you through it! Click to learn more. ,ignition system,lawn mower,Briggs & Stratton",Craftsman,Craftsman
Craftsman Mower: Fuel Shut-Off Valve,https://res.cloudinary.com/dbcpfy04c/image/upload/v1618237451/placeholder.jpg,home-inspiration,,https://lawntrend.com/craftsman-w-20hp-briggs-stratton-wont-start/?utm_source=pinterest&utm_campaign=craftsman-mower-fuel,2025-05-15,"Don't overlook the simple things! This guide reminds you to check the fuel shut-off valve on your Craftsman mower (20HP Briggs & Stratton).  It's a common cause of no-start issues.  A quick check could save you a lot of time and effort. Click to learn more! ,fuel shut off valve,lawn mower,Briggs & Stratton",Craftsman,Craftsman
Briggs 20HP: Winter Storage Tips,https://res.cloudinary.com/dbcpfy04c/image/upload/v1618237451/placeholder.jpg,home-inspiration,,https://lawntrend.com/craftsman-w-20hp-briggs-stratton-wont-start/?utm_source=pinterest&utm_campaign=briggs-20hp-winter-s,2025-05-15,"Did you store your Craftsman mower improperly? This guide covers troubleshooting starting issues after winter storage, specifically for the 20HP Briggs & Stratton engine.  Revive your mower and get ready for spring! Click to learn more. ,winter storage,lawn mower,Briggs & Stratton",Craftsman,Craftsman
Craftsman Mower: Choke Problems?,https://res.cloudinary.com/dbcpfy04c/image/upload/v1618237451/placeholder.jpg,home-inspiration,,https://lawntrend.com/craftsman-w-20hp-briggs-stratton-wont-start/?utm_source=pinterest&utm_campaign=craftsman-mower-chok,2025-05-15,"Is the choke malfunctioning on your Craftsman mower (20HP Briggs & Stratton)? This guide explains how the choke works and how to troubleshoot common issues.  Get the right fuel mixture for easy starting. Click to learn more! ,choke,lawn mower,Briggs & Stratton",Craftsman,Craftsman
DIY Craftsman Mower Repair Guide,https://res.cloudinary.com/dbcpfy04c/image/upload/v1618237451/placeholder.jpg,home-inspiration,,https://lawntrend.com/craftsman-w-20hp-briggs-stratton-wont-start/?utm_source=pinterest&utm_campaign=diy-craftsman-mower-,2025-05-15,"Empower yourself! This guide provides a comprehensive DIY approach to fixing a no-start Craftsman mower with a 20HP Briggs & Stratton engine.  Save money and gain valuable skills.  You can do it! Click to learn more. ,DIY,lawn mower repair,Briggs & Stratton",Craftsman,Craftsman
Briggs & Stratton: Compression Test,https://res.cloudinary.com/dbcpfy04c/image/upload/v1618237451/placeholder.jpg,home-inspiration,,https://lawntrend.com/craftsman-w-20hp-briggs-stratton-wont-start/?utm_source=pinterest&utm_campaign=briggs-stratton-comp,2025-05-15,"Learn how to perform a compression test on your Briggs & Stratton 20HP engine to diagnose internal engine problems. This guide, tailored for Craftsman mower owners, will help you assess the health of your engine. Click to learn more! ,compression test,Briggs & Stratton,lawn mower",engine repair,engine repair
Craftsman Mower: Recoil Starter Fix,https://res.cloudinary.com/dbcpfy04c/image/upload/v1618237451/placeholder.jpg,home-inspiration,,https://lawntrend.com/craftsman-w-20hp-briggs-stratton-wont-start/?utm_source=pinterest&utm_campaign=craftsman-mower-reco,2025-05-15,"Is your recoil starter broken or slipping on your Craftsman mower (20HP Briggs & Stratton)? This guide shows you how to inspect and repair or replace the recoil starter.  Get your mower starting with a pull! Click to learn more. ,recoil starter,lawn mower,Briggs & Stratton",Craftsman,Craftsman
Fuel Line Inspection: Craftsman Mower,https://res.cloudinary.com/dbcpfy04c/image/upload/v1618237451/placeholder.jpg,home-inspiration,,https://lawntrend.com/craftsman-w-20hp-briggs-stratton-wont-start/?utm_source=pinterest&utm_campaign=fuel-line-inspection,2025-05-15,"Cracked or clogged fuel lines can prevent your Craftsman mower (20HP Briggs & Stratton) from starting. This guide shows you how to inspect and replace your fuel lines.  Ensure a smooth fuel flow for reliable operation. Click to learn more! ,fuel lines,lawn mower,Briggs & Stratton",Craftsman,Craftsman
Craftsman Mower: Governor Issues?,https://res.cloudinary.com/dbcpfy04c/image/upload/v1618237451/placeholder.jpg,home-inspiration,,https://lawntrend.com/craftsman-w-20hp-briggs-stratton-wont-start/?utm_source=pinterest&utm_campaign=craftsman-mower-gove,2025-05-15,"A malfunctioning governor can cause starting problems on your Craftsman mower (20HP Briggs & Stratton). This guide explains how the governor works and how to troubleshoot common issues. Click to learn more! ,governor,lawn mower,Briggs & Stratton",Craftsman,Craftsman
Briggs & Stratton: Oil Level Check,https://res.cloudinary.com/dbcpfy04c/image/upload/v1618237451/placeholder.jpg,home-inspiration,,https://lawntrend.com/craftsman-w-20hp-briggs-stratton-wont-start/?utm_source=pinterest&utm_campaign=briggs-stratton-oil-,2025-05-15,"Low oil can prevent your Briggs & Stratton 20HP engine from starting. This guide reminds you to check the oil level before troubleshooting.  Protect your engine! Click to learn more. ,oil level,lawn mower,Briggs & Stratton",Craftsman,Craftsman
Craftsman Mower: Battery Check (If Applicable),https://res.cloudinary.com/dbcpfy04c/image/upload/v1618237451/placeholder.jpg,home-inspiration,,https://lawntrend.com/craftsman-w-20hp-briggs-stratton-wont-start/?utm_source=pinterest&utm_campaign=craftsman-mower-batt,2025-05-15,"If your Craftsman mower has an electric start, check the battery! This guide explains how to test and charge your battery.  Don't overlook this simple step. Click to learn more! ,battery,lawn mower,Briggs & Stratton",Craftsman,Craftsman
Troubleshooting a Flooded Engine,https://res.cloudinary.com/dbcpfy04c/image/upload/v1618237451/placeholder.jpg,home-inspiration,,https://lawntrend.com/craftsman-w-20hp-briggs-stratton-wont-start/?utm_source=pinterest&utm_campaign=troubleshooting-a-fl,2025-05-15,"Did you flood the engine on your Craftsman mower (20HP Briggs & Stratton)? This guide provides steps to clear a flooded engine and get it started again.  Don't give up! Click to learn more. ,flooded engine,lawn mower,Briggs & Stratton",Craftsman,Craftsman
Craftsman Mower: Exhaust Check,https://res.cloudinary.com/dbcpfy04c/image/upload/v1618237451/placeholder.jpg,home-inspiration,,https://lawntrend.com/craftsman-w-20hp-briggs-stratton-wont-start/?utm_source=pinterest&utm_campaign=craftsman-mower-exha,2025-05-15,"A blocked exhaust can prevent your Craftsman mower (20HP Briggs & Stratton) from starting. This guide shows you how to inspect the exhaust system for obstructions.  Ensure proper exhaust flow. Click to learn more! ,exhaust,lawn mower,Briggs & Stratton",Craftsman,Craftsman
Briggs & Stratton: Parts Diagram Guide,https://res.cloudinary.com/dbcpfy04c/image/upload/v1618237451/placeholder.jpg,home-inspiration,,https://lawntrend.com/craftsman-w-20hp-briggs-stratton-wont-start/?utm_source=pinterest&utm_campaign=briggs-stratton-part,2025-05-15,"Need to find replacement parts for your Briggs & Stratton 20HP engine on your Craftsman mower? This guide links to helpful parts diagrams.  Get the right parts for a successful repair! Click to learn more. ,parts diagram,Briggs & Stratton,lawn mower",Craftsman,Craftsman
Title,https://res.cloudinary.com/dbcpfy04c/image/upload/v1618237451/placeholder.jpg,home-inspiration,,https://lawntrend.com/20-hp-briggs-and-stratton-engine-problems/?utm_source=pinterest&utm_campaign=title,2025-05-15,Description,Keywords,Keywords
20HP Briggs & Stratton: Is it Dying?,https://res.cloudinary.com/dbcpfy04c/image/upload/v1618237451/placeholder.jpg,home-inspiration,,https://lawntrend.com/20-hp-briggs-and-stratton-engine-problems/?utm_source=pinterest&utm_campaign=20hp-briggs-stratton,2025-05-15,"Is your trusty 20HP Briggs & Stratton engine sputtering, losing power, or refusing to start? Don't let a frustrating breakdown ruin your weekend! This guide dives deep into the most common problems – from carburetor issues to low oil shutdowns – and provides clear",step-by-step solutions you can tackle yourself. Save money on expensive repairs and get back to enjoying your lawn. We'll help you diagnose the issue and get your engine roaring again. Click to learn how to revive your Briggs & Stratton! #BriggsAndStratton #EngineRepair #LawnMower #DIY,step-by-step solutions you can tackle yourself. Save money on expensive repairs and get back to enjoying your lawn. We'll help you diagnose the issue and get your engine roaring again. Click to learn how to revive your Briggs & Stratton! #BriggsAndStratton #EngineRepair #LawnMower #DIY
Briggs 20HP: Carburetor Fixes,https://res.cloudinary.com/dbcpfy04c/image/upload/v1618237451/placeholder.jpg,home-inspiration,,https://lawntrend.com/20-hp-briggs-and-stratton-engine-problems/?utm_source=pinterest&utm_campaign=briggs-20hp-carburet,2025-05-15,A dirty or clogged carburetor is a frequent culprit behind a struggling 20HP Briggs & Stratton engine. This pin highlights how to diagnose carburetor problems and provides a detailed walkthrough of cleaning and rebuilding it. Don't let a simple fix turn into a costly replacement! Learn to restore optimal fuel delivery and performance.  We'll show you exactly what to do,even if you've never touched an engine before. Click to learn more! #CarburetorRepair #BriggsStratton #SmallEngine #DIYRepair,even if you've never touched an engine before. Click to learn more! #CarburetorRepair #BriggsStratton #SmallEngine #DIYRepair
