Title,Media URL,Pinterest board,Thumbnail,Link,Publish date,Description,Keywords
Restore Shoe Traction: Easy Guide,https://res.cloudinary.com/dbcpfy04c/image/upload/v1748241506/pin_3_4_kcb9qv.webp,shoe-repair-tips,,https://www.beacleaner.com/how-to-clean-the-bottom-of-slip-shoes?utm_source=pinterest&utm_campaign=restore-shoe-tractio,2025-05-26,Worried about slipping in your favorite slip-ons? You're not alone! This guide provides a quick and easy solution to clean the bottoms of your shoes and regain lost traction.  We break down the process into simple steps,using readily available supplies.  Walk with confidence and avoid embarrassing (and painful!) falls. Click to learn how! #ShoeRepair #SlipPrevention #CleaningHacks #ShoeTips
Dirty Shoe Soles? Clean Them Now!,https://res.cloudinary.com/dbcpfy04c/image/upload/v1748241513/pin_3_5_d3fwqo.webp,shoe-cleaning-tips,,https://www.beacleaner.com/how-to-clean-the-bottom-of-slip-shoes?utm_source=pinterest&utm_campaign=dirty-shoe-soles-cle,2025-05-26,Don't let dirty shoe soles compromise your safety! This blog post details how to effectively clean the bottom of your slip-on shoes,removing build-up and restoring grip.  We'll show you what to avoid and what works best for different materials.  Protect yourself and your shoes – read the full guide today! #ShoeCleaningTips #SlipOnShoes #SoleCleaning #SafetyFirst
Extend Shoe Life: Clean the Soles!,https://res.cloudinary.com/dbcpfy04c/image/upload/v1748241520/pin_3_6_wxlfy1.webp,shoe-care-tips,,https://www.beacleaner.com/how-to-clean-the-bottom-of-slip-shoes?utm_source=pinterest&utm_campaign=extend-shoe-life-cle,2025-05-26,Don't replace your slip-on shoes – restore them! This post teaches you how to clean the bottom of your shoes,removing dirt and grime that cause slippage.  Regular cleaning extends the life of your shoes and keeps them looking their best.  Save money and stay safe – read the guide today! #ShoeLongevity #ShoeCareTips #SoleMaintenance #ShoeCleaningRoutine
DIY Shoe Sole Cleaner: Simple Steps,https://res.cloudinary.com/dbcpfy04c/image/upload/v1748241526/pin_3_7_kvnpnq.webp,cleaning-tips,,https://www.beacleaner.com/how-to-clean-the-bottom-of-slip-shoes?utm_source=pinterest&utm_campaign=diy-shoe-sole-cleane,2025-05-26,Want to clean your slip-on shoe soles without expensive products? This post shows you how to create a DIY cleaner using readily available ingredients.  It's effective,affordable
Shoe Sole Deep Clean: Step-by-Step,https://res.cloudinary.com/dbcpfy04c/image/upload/v1748241534/pin_3_8_ldir2b.webp,shoe-cleaning-tips,,https://www.beacleaner.com/how-to-clean-the-bottom-of-slip-shoes?utm_source=pinterest&utm_campaign=shoe-sole-deep-clean,2025-05-26,Get a deep clean for your slip-on shoe soles! This post provides a detailed,step-by-step guide to removing dirt
Don't Replace,https://res.cloudinary.com/dbcpfy04c/image/upload/v1748241540/pin_3_9_fqciji.webp,shoe-repair-tips,,https://www.beacleaner.com/how-to-clean-the-bottom-of-slip-shoes?utm_source=pinterest&utm_campaign=dont-replace,2025-05-26,Restore! Shoe Cleaning,Before you toss those slippery slip-ons
Title,https://res.cloudinary.com/dbcpfy04c/image/upload/v1748241583/pin_4_1_cxtepo.webp,please-provide-the-title-and-keywords-i-need-that-information-to-suggest-a-board-name-once,,https://www.beacleaner.com/how-to-clean-the-brine-tank-on-a-water-softener?utm_source=pinterest&utm_campaign=title,2025-05-26,Description,Keywords
Brine Tank Cleaning: A Must-Do!,https://res.cloudinary.com/dbcpfy04c/image/upload/v1748241589/pin_4_2_fuesr6.webp,water-softener-tips,,https://www.beacleaner.com/how-to-clean-the-brine-tank-on-a-water-softener?utm_source=pinterest&utm_campaign=brine-tank-cleaning-,2025-05-26,Don't let a neglected brine tank ruin your water softener! This pin shows you how to easily clean it,saving you money on repairs & ensuring your family enjoys consistently soft
DIY Brine Tank Clean: Save Money!,https://res.cloudinary.com/dbcpfy04c/image/upload/v1748241596/pin_4_3_bvqcbd.webp,home-repair-tips,,https://www.beacleaner.com/how-to-clean-the-brine-tank-on-a-water-softener?utm_source=pinterest&utm_campaign=diy-brine-tank-clean,2025-05-26,Stop throwing money away on expensive water softener repairs! This pin demonstrates how to clean your brine tank yourself with simple tools and readily available supplies.  We break down the process into easy-to-follow steps,even for beginners.  Enjoy the satisfaction of a job well done and the savings in your pocket.  Click to learn how to take control of your home's water quality! #DIYHomeRepair #WaterTreatment #BrineTankFlush #SaveMoney
Brine Tank Cleaning: Step-by-Step,https://res.cloudinary.com/dbcpfy04c/image/upload/v1748241602/pin_4_4_jbbw21.webp,water-softener-tips,,https://www.beacleaner.com/how-to-clean-the-brine-tank-on-a-water-softener?utm_source=pinterest&utm_campaign=brine-tank-cleaning-,2025-05-26,Feeling overwhelmed by water softener maintenance? This pin offers a clear,step-by-step visual guide to cleaning your brine tank.  From removing old salt to rinsing and refilling
Water Softener Issues? Check This!,https://res.cloudinary.com/dbcpfy04c/image/upload/v1748241609/pin_4_5_kccmbd.webp,water-softener-tips,,https://www.beacleaner.com/how-to-clean-the-brine-tank-on-a-water-softener?utm_source=pinterest&utm_campaign=water-softener-issue,2025-05-26,Is your water softener struggling? Before calling a professional,check your brine tank! This pin emphasizes the common problems caused by a dirty brine tank and how to easily fix them.  We'll help you diagnose the issue and get your system back to optimal performance.  Don't suffer with hard water any longer – click to learn more! #WaterSoftenerProblems #BrineTankIssues #HardWater #WaterQualitySolutions
Brine Tank Cleaning: Before & After,https://res.cloudinary.com/dbcpfy04c/image/upload/v1748241614/pin_4_6_dqm8he.webp,water-softener-tips,,https://www.beacleaner.com/how-to-clean-the-brine-tank-on-a-water-softener?utm_source=pinterest&utm_campaign=brine-tank-cleaning-,2025-05-26,See the dramatic difference a clean brine tank can make! This pin showcases a compelling before-and-after image,illustrating the buildup of salt and sediment.  A clean brine tank means better water quality
Brine Tank Cleaning: Quick Guide,https://res.cloudinary.com/dbcpfy04c/image/upload/v1748241620/pin_4_7_nnyric.webp,water-softener-tips,,https://www.beacleaner.com/how-to-clean-the-brine-tank-on-a-water-softener?utm_source=pinterest&utm_campaign=brine-tank-cleaning-,2025-05-26,Short on time? This pin provides a quick and easy guide to cleaning your brine tank.  We've condensed the essential steps into a concise format,making maintenance a breeze.  Don't let a busy schedule prevent you from enjoying the benefits of soft water. Click to learn more! #QuickCleaningGuide #BrineTankFast #EasyHomeMaintenance #WaterSoftenerHelp
Water Softener Maintenance Checklist,https://res.cloudinary.com/dbcpfy04c/image/upload/v1748241626/pin_4_8_jrzlyb.webp,water-softener-tips,,https://www.beacleaner.com/how-to-clean-the-brine-tank-on-a-water-softener?utm_source=pinterest&utm_campaign=water-softener-maint,2025-05-26,Stay on top of your water softener maintenance with our handy checklist! This pin features a visual checklist,including brine tank cleaning
Brine Tank Cleaning: Tools You Need,https://res.cloudinary.com/dbcpfy04c/image/upload/v1748241632/pin_4_9_md9vba.webp,water-softener-tips,,https://www.beacleaner.com/how-to-clean-the-brine-tank-on-a-water-softener?utm_source=pinterest&utm_campaign=brine-tank-cleaning-,2025-05-26,Wondering what tools you need to clean your brine tank? This pin provides a handy list of essential supplies,making the process even easier.  Be prepared and get the job done right the first time. Click to see the full list! #BrineTankTools #WaterSoftenerSupplies #HomeMaintenanceEssentials #CleaningSupplies
Brine Tank Cleaning: DIY vs. Pro,https://res.cloudinary.com/dbcpfy04c/image/upload/v1748241637/pin_4_10_mu5rfc.webp,water-softener-tips,,https://www.beacleaner.com/how-to-clean-the-brine-tank-on-a-water-softener?utm_source=pinterest&utm_campaign=brine-tank-cleaning-,2025-05-26,Should you clean your brine tank yourself or hire a professional? This pin weighs the pros and cons of each option,helping you make the best decision for your needs.  Save money and gain confidence with our expert advice. Click to read our comparison! #DIYvsPro #WaterSoftenerService #BrineTankCleaningCost #HomeRepair
Water Softener: Brine Tank & Hard Water,https://res.cloudinary.com/dbcpfy04c/image/upload/v1748241643/pin_4_11_zf7tal.webp,water-softener-tips,,https://www.beacleaner.com/how-to-clean-the-brine-tank-on-a-water-softener?utm_source=pinterest&utm_campaign=water-softener-brine,2025-05-26,Hard water wreaking havoc on your home? This pin connects the dots between hard water,a dirty brine tank
Brine Tank Cleaning: Visual Tutorial,https://res.cloudinary.com/dbcpfy04c/image/upload/v1748241649/pin_4_12_snx7eh.webp,water-softener-tips,,https://www.beacleaner.com/how-to-clean-the-brine-tank-on-a-water-softener?utm_source=pinterest&utm_campaign=brine-tank-cleaning-,2025-05-26,Need a visual guide to cleaning your brine tank? This pin features a series of clear and concise images,demonstrating each step of the process.  Follow along and achieve professional results. Click to see the full tutorial! #BrineTankVisual #WaterSoftenerTutorial #StepByStepGuide #HomeDIY
Brine Tank Cleaning: Troubleshooting,https://res.cloudinary.com/dbcpfy04c/image/upload/v1748241654/pin_4_13_od9ikc.webp,water-softener-tips,,https://www.beacleaner.com/how-to-clean-the-brine-tank-on-a-water-softener?utm_source=pinterest&utm_campaign=brine-tank-cleaning-,2025-05-26,Facing challenges while cleaning your brine tank? This pin offers troubleshooting tips for common issues,helping you overcome obstacles and achieve a successful cleaning.  Don't give up – we've got you covered! #BrineTankTroubleshooting #WaterSoftenerHelp #DIYRepair #HomeMaintenance
Brine Tank Cleaning: Family Health,https://res.cloudinary.com/dbcpfy04c/image/upload/v1748241660/pin_4_14_zdvuzp.webp,water-softener-tips,,https://www.beacleaner.com/how-to-clean-the-brine-tank-on-a-water-softener?utm_source=pinterest&utm_campaign=brine-tank-cleaning-,2025-05-26,Protect your family's health with clean,soft water! This pin emphasizes the connection between water quality
Title,https://res.cloudinary.com/dbcpfy04c/image/upload/v1748241706/pin_5_1_zur2dn.webp,please-provide-the-title-and-keywords-i-need-that-information-to-suggest-a-board-name-once,,https://www.beacleaner.com/how-to-clean-the-cosori-air-fryer?utm_source=pinterest&utm_campaign=title,2025-05-26,Description,Keywords
Crispy & Clean: Cosori Air Fryer Guide,https://res.cloudinary.com/dbcpfy04c/image/upload/v1748241713/pin_5_2_ow3rb8.webp,air-fryer-tips,,https://www.beacleaner.com/how-to-clean-the-cosori-air-fryer?utm_source=pinterest&utm_campaign=crispy-clean-cosori-,2025-05-26,"Is your Cosori air fryer looking a little…crispy? Don't let grime ruin your favorite meals! This easy guide breaks down cleaning every part, from the basket to the heating element. We'll show you how to get it sparkling clean with simple household items, saving you time & effort.  Enjoy healthier, tastier food without the worry of buildup.  Click to learn the secrets to a spotless Cosori!  Don't replace it, restore it!  A clean air fryer is a happy air fryer!","Cosori Air Fryer,Air Fryer Cleaning,Kitchen Cleaning,Deep Cleaning"
Air Fryer Cleaning Hacks You NEED!,https://res.cloudinary.com/dbcpfy04c/image/upload/v1748241719/pin_5_3_ra6jq0.webp,kitchen-cleaning-tips,,https://www.beacleaner.com/how-to-clean-the-cosori-air-fryer?utm_source=pinterest&utm_campaign=air-fryer-cleaning-h,2025-05-26,"Stop dreading air fryer cleanup! This post reveals the fastest, most effective ways to clean your Cosori, even if it's *really* dirty.  We cover everything from quick daily wipes to tackling stubborn grease.  Imagine spending less time scrubbing and more time enjoying delicious, guilt-free fried food.  Get back to cooking with confidence!  Click to read now and reclaim your kitchen!","Air Fryer Hacks,Cleaning Tips,Cosori,Kitchen Appliances"
Cosori Air Fryer: Deep Clean Secrets,https://res.cloudinary.com/dbcpfy04c/image/upload/v1748241727/pin_5_4_bi4goh.webp,kitchen-cleaning-tips,,https://www.beacleaner.com/how-to-clean-the-cosori-air-fryer?utm_source=pinterest&utm_campaign=cosori-air-fryer-dee,2025-05-26,Don't let hidden grease and food particles affect the taste of your food! This guide provides a step-by-step deep clean for your Cosori air fryer.  We'll show you how to safely clean the heating element and remove even the most baked-on messes.  Protect your investment and ensure your air fryer lasts for years to come.  Click to learn how to keep your Cosori performing at its best!,"Deep Cleaning,Cosori Air Fryer,Kitchen Hygiene,Appliance Care"
Sparkling Cosori: Easy Cleaning Routine,https://res.cloudinary.com/dbcpfy04c/image/upload/v1748241733/pin_5_5_o9a80m.webp,kitchen-tips,,https://www.beacleaner.com/how-to-clean-the-cosori-air-fryer?utm_source=pinterest&utm_campaign=sparkling-cosori-eas,2025-05-26,"A clean air fryer means healthier meals!  This post outlines a simple cleaning routine for your Cosori that will keep it in top condition.  We'll show you how to prevent buildup and maintain a hygienic cooking environment.  Say goodbye to lingering odors and hello to fresh, flavorful food.  Click to discover the secret to a consistently clean Cosori!","Air Fryer Routine,Cleaning Schedule,Cosori,Healthy Cooking"
Cosori Air Fryer Basket Cleaning SOS!,https://res.cloudinary.com/dbcpfy04c/image/upload/v1748241738/pin_5_6_gzz1uy.webp,kitchen-cleaning-tips,,https://www.beacleaner.com/how-to-clean-the-cosori-air-fryer?utm_source=pinterest&utm_campaign=cosori-air-fryer-bas,2025-05-26,"Is your Cosori basket covered in stubborn food residue?  Don't scrub for hours! This guide provides quick and effective methods for cleaning your air fryer basket, using ingredients you probably already have.  We'll show you how to remove even the toughest messes without damaging the non-stick coating.  Click to rescue your basket and get back to frying!","Air Fryer Basket,Cleaning,Cosori,Non-Stick"
The Ultimate Cosori Cleaning Checklist,https://res.cloudinary.com/dbcpfy04c/image/upload/v1748241745/pin_5_7_uwidah.webp,kitchen-cleaning-tips,,https://www.beacleaner.com/how-to-clean-the-cosori-air-fryer?utm_source=pinterest&utm_campaign=the-ultimate-cosori-,2025-05-26,"Never forget a step! This comprehensive checklist ensures you clean every part of your Cosori air fryer thoroughly.  From the basket and pan to the heating element and exterior, we've got you covered.  Keep your air fryer in pristine condition and enjoy delicious, healthy meals for years to come.  Click to download the checklist and simplify your cleaning routine!","Cleaning Checklist,Cosori Air Fryer,Kitchen Organization,Appliance Maintenance"
Cosori Air Fryer: Before & After Cleaning!,https://res.cloudinary.com/dbcpfy04c/image/upload/v1748241750/pin_5_8_mcgfpz.webp,kitchen-cleaning-tips,,https://www.beacleaner.com/how-to-clean-the-cosori-air-fryer?utm_source=pinterest&utm_campaign=cosori-air-fryer-bef,2025-05-26,"See the amazing transformation! This post features stunning before & after photos of a deep-cleaned Cosori air fryer.  We'll show you exactly how we achieved these results, with step-by-step instructions and helpful tips.  Get inspired to tackle your own air fryer cleaning project!  Click to see the incredible difference!","Before and After,Cosori,Air Fryer,Cleaning Motivation"
Say Goodbye to Air Fryer Grease!,https://res.cloudinary.com/dbcpfy04c/image/upload/v1748241758/pin_5_9_gwlltf.webp,kitchen-cleaning-tips,,https://www.beacleaner.com/how-to-clean-the-cosori-air-fryer?utm_source=pinterest&utm_campaign=say-goodbye-to-air-f,2025-05-26,"Tired of greasy messes? This guide provides proven methods for removing grease from your Cosori air fryer quickly and easily.  We'll show you how to prevent grease buildup and maintain a clean, hygienic cooking environment.  Enjoy healthier, tastier food without the worry of grease contamination.  Click to learn our grease-fighting secrets!","Grease Removal,Cosori Air Fryer,Kitchen Cleaning,Healthy Cooking"
Cosori Air Fryer: Cleaning with Vinegar!,https://res.cloudinary.com/dbcpfy04c/image/upload/v1748241763/pin_5_10_sf9w82.webp,kitchen-cleaning-tips,,https://www.beacleaner.com/how-to-clean-the-cosori-air-fryer?utm_source=pinterest&utm_campaign=cosori-air-fryer-cle,2025-05-26,"Unlock the power of vinegar! This post reveals how to use vinegar to effectively clean your Cosori air fryer, removing grease, odors, and food residue.  It's a natural, eco-friendly cleaning solution that works wonders.  Click to learn how to harness the cleaning power of vinegar!","Vinegar Cleaning,Cosori,Natural Cleaning,Eco-Friendly"
Cosori Air Fryer: Cleaning the Heating Element,https://res.cloudinary.com/dbcpfy04c/image/upload/v1748241769/pin_5_11_em3l0w.webp,kitchen-cleaning-tips,,https://www.beacleaner.com/how-to-clean-the-cosori-air-fryer?utm_source=pinterest&utm_campaign=cosori-air-fryer-cle,2025-05-26,Don't neglect the heating element! This guide provides safe and effective methods for cleaning the heating element of your Cosori air fryer.  Removing buildup from the heating element ensures optimal performance and prevents potential hazards.  Click to learn how to keep your Cosori running smoothly!,"Heating Element,Cosori Air Fryer,Appliance Safety,Cleaning Guide"
Air Fryer Cleaning: Common Mistakes to Avoid,https://res.cloudinary.com/dbcpfy04c/image/upload/v1748241775/pin_5_12_lkbwqk.webp,kitchen-cleaning-tips,,https://www.beacleaner.com/how-to-clean-the-cosori-air-fryer?utm_source=pinterest&utm_campaign=air-fryer-cleaning-c,2025-05-26,Are you making these cleaning mistakes? This post highlights common errors people make when cleaning their Cosori air fryers and how to avoid them.  Protect your investment and ensure your air fryer lasts for years to come.  Click to learn from our mistakes and clean your Cosori like a pro!,"Cleaning Mistakes,Cosori,Air Fryer,Appliance Care"
Cosori Air Fryer: Quick Daily Clean,https://res.cloudinary.com/dbcpfy04c/image/upload/v1748241780/pin_5_13_xvmemz.webp,kitchen-cleaning-tips,,https://www.beacleaner.com/how-to-clean-the-cosori-air-fryer?utm_source=pinterest&utm_campaign=cosori-air-fryer-qui,2025-05-26,Keep it sparkling with a quick daily clean! This post shows you how to maintain a clean Cosori air fryer with minimal effort.  A few simple steps each day will prevent buildup and ensure your air fryer is always ready to use.  Click to learn our easy daily cleaning routine!,"Daily Cleaning,Cosori Air Fryer,Quick Clean,Kitchen Habits"
Cosori Air Fryer: Cleaning for Beginners,https://res.cloudinary.com/dbcpfy04c/image/upload/v1748241785/pin_5_14_drimuh.webp,kitchen-cleaning-tips,,https://www.beacleaner.com/how-to-clean-the-cosori-air-fryer?utm_source=pinterest&utm_campaign=cosori-air-fryer-cle,2025-05-26,"New to air frying? This guide provides a simple, step-by-step cleaning process for your Cosori air fryer, perfect for beginners.  We'll walk you through every step, ensuring you feel confident and comfortable cleaning your appliance.  Click to get started!","Beginner Cleaning,Cosori,Air Fryer,Easy Guide"
Extend Your Cosori's Life: Cleaning Tips,https://res.cloudinary.com/dbcpfy04c/image/upload/v1748241790/pin_5_15_gt1pxl.webp,kitchen-tips,,https://www.beacleaner.com/how-to-clean-the-cosori-air-fryer?utm_source=pinterest&utm_campaign=extend-your-cosoris-,2025-05-26,Want your Cosori to last? This post shares essential cleaning tips to extend the life of your air fryer.  Proper cleaning and maintenance will prevent damage and ensure optimal performance for years to come.  Click to learn how to protect your investment!,"Air Fryer Maintenance,Cosori,Appliance Longevity,Cleaning Tips"
Cosori Air Fryer: Cleaning Without Chemicals,https://res.cloudinary.com/dbcpfy04c/image/upload/v1748241796/pin_5_16_wioqyv.webp,kitchen-cleaning-tips,,https://www.beacleaner.com/how-to-clean-the-cosori-air-fryer?utm_source=pinterest&utm_campaign=cosori-air-fryer-cle,2025-05-26,"Prefer a chemical-free clean? This post provides natural cleaning solutions for your Cosori air fryer, using ingredients like vinegar, baking soda, and lemon juice.  Enjoy a clean, hygienic cooking environment without harsh chemicals.  Click to learn our natural cleaning methods!","Natural Cleaning,Cosori,Chemical-Free,Eco-Friendly Cleaning"
Cosori Air Fryer: Cleaning the Exterior,https://res.cloudinary.com/dbcpfy04c/image/upload/v1748241802/pin_5_17_f3djeh.webp,kitchen-cleaning-tips,,https://www.beacleaner.com/how-to-clean-the-cosori-air-fryer?utm_source=pinterest&utm_campaign=cosori-air-fryer-cle,2025-05-26,"Don't forget the outside! This post shows you how to effectively clean the exterior of your Cosori air fryer, removing fingerprints, splatters, and grime.  Keep your kitchen looking sparkling clean with a polished air fryer.  Click to learn our exterior cleaning tips!","Exterior Cleaning,Cosori,Kitchen Appearance,Cleaning Hacks"
Air Fryer Cleaning: Baking Soda Power!,https://res.cloudinary.com/dbcpfy04c/image/upload/v1748241807/pin_5_18_elv4mt.webp,kitchen-cleaning-tips,,https://www.beacleaner.com/how-to-clean-the-cosori-air-fryer?utm_source=pinterest&utm_campaign=air-fryer-cleaning-b,2025-05-26,"Harness the cleaning power of baking soda! This post reveals how to use baking soda to effectively clean your Cosori air fryer, removing stubborn stains and odors.  It's a safe, natural, and affordable cleaning solution.  Click to learn how to use baking soda to your advantage!","Baking Soda Cleaning,Cosori,Natural Cleaning,Kitchen Hacks"
Cosori Air Fryer: Preventative Cleaning,https://res.cloudinary.com/dbcpfy04c/image/upload/v1748241812/pin_5_19_w7df2j.webp,kitchen-cleaning-tips,,https://www.beacleaner.com/how-to-clean-the-cosori-air-fryer?utm_source=pinterest&utm_campaign=cosori-air-fryer-pre,2025-05-26,Stop grime before it starts! This post focuses on preventative cleaning measures to keep your Cosori air fryer clean and hygienic.  Simple habits can prevent buildup and make cleaning much easier.  Click to learn our preventative cleaning strategies!,"Preventative Cleaning,Cosori,Air Fryer,Cleaning Habits"
Cosori Air Fryer: Cleaning FAQs Answered,https://res.cloudinary.com/dbcpfy04c/image/upload/v1748241821/pin_5_20_v0i3uf.webp,kitchen-cleaning-tips,,https://www.beacleaner.com/how-to-clean-the-cosori-air-fryer?utm_source=pinterest&utm_campaign=cosori-air-fryer-cle,2025-05-26,"Got questions about cleaning your Cosori? This post answers frequently asked questions about air fryer cleaning, providing clear and concise answers.  Get all your cleaning concerns addressed in one place.  Click to find the answers you need!","Air Fryer FAQs,Cosori,Cleaning Questions,Helpful Guide"
Cosori Air Fryer: Cleaning Time-Lapse!,https://res.cloudinary.com/dbcpfy04c/image/upload/v1748241829/pin_5_21_kfsuci.webp,kitchen-cleaning-tips,,https://www.beacleaner.com/how-to-clean-the-cosori-air-fryer?utm_source=pinterest&utm_campaign=cosori-air-fryer-cle,2025-05-26,"Watch the magic happen! This post features a time-lapse video of a Cosori air fryer being deep-cleaned, showcasing the process from start to finish.  Get inspired and see how easy it can be to transform a dirty air fryer into a sparkling clean one.  Click to watch the video!","Time-Lapse,Cosori,Air Fryer,Cleaning Video"
Cosori Air Fryer: Cleaning & Odor Removal,https://res.cloudinary.com/dbcpfy04c/image/upload/v1748241835/pin_5_22_w6s6fv.webp,kitchen-cleaning-tips,,https://www.beacleaner.com/how-to-clean-the-cosori-air-fryer?utm_source=pinterest&utm_campaign=cosori-air-fryer-cle,2025-05-26,"Struggling with lingering odors? This post provides effective methods for removing odors from your Cosori air fryer, leaving it smelling fresh and clean.  Enjoy delicious, odor-free meals every time.  Click to learn our odor-removing secrets!","Odor Removal,Cosori,Air Fryer,Fresh Kitchen"
Cosori Air Fryer: Cleaning with Lemon!,https://res.cloudinary.com/dbcpfy04c/image/upload/v1748241840/pin_5_23_ewj3qu.webp,kitchen-cleaning-tips,,https://www.beacleaner.com/how-to-clean-the-cosori-air-fryer?utm_source=pinterest&utm_campaign=cosori-air-fryer-cle,2025-05-26,"Brighten & clean with lemon! This post shows you how to use lemon juice to naturally clean and deodorize your Cosori air fryer.  A fresh, citrusy scent and a sparkling clean appliance – what's not to love?  Click to learn how!","Lemon Cleaning,Cosori,Natural Cleaning,Citrus Fresh"
Cosori Air Fryer: Cleaning for a Healthy Kitchen,https://res.cloudinary.com/dbcpfy04c/image/upload/v1748241845/pin_5_24_a2z00k.webp,kitchen-cleaning-tips,,https://www.beacleaner.com/how-to-clean-the-cosori-air-fryer?utm_source=pinterest&utm_campaign=cosori-air-fryer-cle,2025-05-26,"A clean air fryer = a healthy kitchen! This post emphasizes the importance of cleaning your Cosori air fryer for maintaining a hygienic cooking environment.  Protect your health and enjoy delicious, worry-free meals.  Click to learn more!","Healthy Kitchen,Cosori,Air Fryer,Kitchen Hygiene"
Cosori Air Fryer: The Ultimate Cleaning Guide,https://res.cloudinary.com/dbcpfy04c/image/upload/v1748241851/pin_5_25_xitesy.webp,kitchen-cleaning-tips,,https://www.beacleaner.com/how-to-clean-the-cosori-air-fryer?utm_source=pinterest&utm_campaign=cosori-air-fryer-the,2025-05-26,"Everything you need to know! This is the ultimate guide to cleaning your Cosori air fryer, covering every aspect from daily maintenance to deep cleaning.  We've got you covered with tips, tricks, and step-by-step instructions.  Click to become a Cosori cleaning expert!","Ultimate Guide,Cosori Air Fryer,Cleaning,Comprehensive Guide"
