Title,Media URL,Pinterest board,Thumbnail,Link,Publish date,Description,Keywords,
Low Oil Shutdown: Briggs 20HP,https://res.cloudinary.com/dbcpfy04c/image/upload/v1618237451/placeholder.jpg,home-inspiration,,https://lawntrend.com/20-hp-briggs-and-stratton-engine-problems/?utm_source=pinterest&utm_campaign=low-oil-shutdown-bri,2025-05-15,"Is your 20HP Briggs & Stratton engine shutting off unexpectedly? It could be the low oil sensor! This pin explains how the low oil shutdown system works, how to troubleshoot it",and how to prevent future issues. Protect your engine from damage and keep it running smoothly.  We'll help you understand the importance of oil levels and how to maintain them. Click to learn how to avoid this common problem! #LowOilShutdown #BriggsAndStratton #EngineProtection #LawnCare,and how to prevent future issues. Protect your engine from damage and keep it running smoothly.  We'll help you understand the importance of oil levels and how to maintain them. Click to learn how to avoid this common problem! #LowOilShutdown #BriggsAndStratton #EngineProtection #LawnCare
Briggs 20HP: Spark Plug Secrets,https://res.cloudinary.com/dbcpfy04c/image/upload/v1618237451/placeholder.jpg,home-inspiration,,https://lawntrend.com/20-hp-briggs-and-stratton-engine-problems/?utm_source=pinterest&utm_campaign=briggs-20hp-spark-pl,2025-05-15,"A faulty spark plug can cause a world of trouble for your 20HP Briggs & Stratton engine. This pin reveals how to identify a bad spark plug, how to replace it correctly",and the best spark plugs for optimal performance.  Don't ignore a weak spark!  A simple spark plug change can make a huge difference. Click to learn how to keep your engine firing on all cylinders! #SparkPlug #BriggsAndStratton #EngineMaintenance #SmallEngineRepair,and the best spark plugs for optimal performance.  Don't ignore a weak spark!  A simple spark plug change can make a huge difference. Click to learn how to keep your engine firing on all cylinders! #SparkPlug #BriggsAndStratton #EngineMaintenance #SmallEngineRepair
20HP Briggs: Starting Problems Solved,https://res.cloudinary.com/dbcpfy04c/image/upload/v1618237451/placeholder.jpg,home-inspiration,,https://lawntrend.com/20-hp-briggs-and-stratton-engine-problems/?utm_source=pinterest&utm_campaign=20hp-briggs-starting,2025-05-15,Struggling to start your 20HP Briggs & Stratton engine? This pin tackles common starting issues,from fuel problems to compression loss. We provide a comprehensive checklist to help you pinpoint the cause and get your engine running reliably.  Don't waste another hour pulling the cord!  Click to discover the secrets to a smooth start. #StartingProblems #BriggsAndStratton #EngineTroubleshooting #LawnMowerRepair,from fuel problems to compression loss. We provide a comprehensive checklist to help you pinpoint the cause and get your engine running reliably.  Don't waste another hour pulling the cord!  Click to discover the secrets to a smooth start. #StartingProblems #BriggsAndStratton #EngineTroubleshooting #LawnMowerRepair
Briggs 20HP: Fuel System Guide,https://res.cloudinary.com/dbcpfy04c/image/upload/v1618237451/placeholder.jpg,home-inspiration,,https://lawntrend.com/20-hp-briggs-and-stratton-engine-problems/?utm_source=pinterest&utm_campaign=briggs-20hp-fuel-sys,2025-05-15,"Is your 20HP Briggs & Stratton engine experiencing fuel delivery issues? This pin provides a detailed overview of the fuel system, including the fuel tank, fuel lines",and fuel filter. Learn how to diagnose and fix common fuel-related problems.  Keep your engine fueled for success! Click to learn more. #FuelSystem #BriggsAndStratton #EngineRepair #SmallEngine,and fuel filter. Learn how to diagnose and fix common fuel-related problems.  Keep your engine fueled for success! Click to learn more. #FuelSystem #BriggsAndStratton #EngineRepair #SmallEngine
20HP Briggs: Oil Change Guide,https://res.cloudinary.com/dbcpfy04c/image/upload/v1618237451/placeholder.jpg,home-inspiration,,https://lawntrend.com/20-hp-briggs-and-stratton-engine-problems/?utm_source=pinterest&utm_campaign=20hp-briggs-oil-chan,2025-05-15,Regular oil changes are crucial for the longevity of your 20HP Briggs & Stratton engine. This pin provides a step-by-step guide to changing your engine oil,ensuring optimal lubrication and performance.  Protect your investment! Click to learn how. #OilChange #BriggsAndStratton #EngineMaintenance #LawnCareTips,ensuring optimal lubrication and performance.  Protect your investment! Click to learn how. #OilChange #BriggsAndStratton #EngineMaintenance #LawnCareTips
20HP Briggs: Valve Adjustment,https://res.cloudinary.com/dbcpfy04c/image/upload/v1618237451/placeholder.jpg,home-inspiration,,https://lawntrend.com/20-hp-briggs-and-stratton-engine-problems/?utm_source=pinterest&utm_campaign=20hp-briggs-valve-ad,2025-05-15,Proper valve adjustment is essential for optimal performance of your 20HP Briggs & Stratton engine. This pin details how to check and adjust the valves,ensuring efficient combustion and power.  Maximize your engine's potential! Click to learn how. #ValveAdjustment #BriggsAndStratton #EngineTuning #DIYEngineRepair,ensuring efficient combustion and power.  Maximize your engine's potential! Click to learn how. #ValveAdjustment #BriggsAndStratton #EngineTuning #DIYEngineRepair
Briggs 20HP: Cooling System Check,https://res.cloudinary.com/dbcpfy04c/image/upload/v1618237451/placeholder.jpg,home-inspiration,,https://lawntrend.com/20-hp-briggs-and-stratton-engine-problems/?utm_source=pinterest&utm_campaign=briggs-20hp-cooling-,2025-05-15,Overheating can cause serious damage to your 20HP Briggs & Stratton engine. This pin explains how to inspect and maintain the cooling system,preventing overheating and ensuring reliable operation.  Keep your engine cool under pressure! Click to learn more. #CoolingSystem #BriggsAndStratton #EngineOverheating #LawnMowerMaintenance,preventing overheating and ensuring reliable operation.  Keep your engine cool under pressure! Click to learn more. #CoolingSystem #BriggsAndStratton #EngineOverheating #LawnMowerMaintenance
20HP Briggs: Recoil Starter Repair,https://res.cloudinary.com/dbcpfy04c/image/upload/v1618237451/placeholder.jpg,home-inspiration,,https://lawntrend.com/20-hp-briggs-and-stratton-engine-problems/?utm_source=pinterest&utm_campaign=20hp-briggs-recoil-s,2025-05-15,A broken recoil starter can make starting your 20HP Briggs & Stratton engine a real chore. This pin provides a guide to repairing or replacing the recoil starter,getting you back to quick and easy starts.  Don't struggle with a faulty starter! Click to learn how. #RecoilStarter #BriggsAndStratton #EngineRepair #StartingIssues,getting you back to quick and easy starts.  Don't struggle with a faulty starter! Click to learn how. #RecoilStarter #BriggsAndStratton #EngineRepair #StartingIssues
Briggs 20HP: Troubleshooting Guide,https://res.cloudinary.com/dbcpfy04c/image/upload/v1618237451/placeholder.jpg,home-inspiration,,https://lawntrend.com/20-hp-briggs-and-stratton-engine-problems/?utm_source=pinterest&utm_campaign=briggs-20hp-troubles,2025-05-15,Feeling overwhelmed by your 20HP Briggs & Stratton engine problems? This pin offers a comprehensive troubleshooting guide,helping you systematically diagnose and resolve common issues.  Take the guesswork out of engine repair! Click to learn more. #Troubleshooting #BriggsAndStratton #EngineDiagnosis #DIY,helping you systematically diagnose and resolve common issues.  Take the guesswork out of engine repair! Click to learn more. #Troubleshooting #BriggsAndStratton #EngineDiagnosis #DIY
20HP Briggs: Common Mistakes to Avoid,https://res.cloudinary.com/dbcpfy04c/image/upload/v1618237451/placeholder.jpg,home-inspiration,,https://lawntrend.com/20-hp-briggs-and-stratton-engine-problems/?utm_source=pinterest&utm_campaign=20hp-briggs-common-m,2025-05-15,Don't make these common mistakes when working on your 20HP Briggs & Stratton engine! This pin highlights pitfalls to avoid,ensuring a safe and successful repair.  Learn from the pros and save yourself time and frustration! Click to learn more. #EngineRepairTips #BriggsAndStratton #DIYMistakes #LawnCare,ensuring a safe and successful repair.  Learn from the pros and save yourself time and frustration! Click to learn more. #EngineRepairTips #BriggsAndStratton #DIYMistakes #LawnCare
20HP Briggs: Winterizing Your Engine,https://res.cloudinary.com/dbcpfy04c/image/upload/v1618237451/placeholder.jpg,home-inspiration,,https://lawntrend.com/20-hp-briggs-and-stratton-engine-problems/?utm_source=pinterest&utm_campaign=20hp-briggs-winteriz,2025-05-15,Protect your 20HP Briggs & Stratton engine during the off-season with these winterizing tips. This pin explains how to prepare your engine for storage,preventing damage and ensuring a smooth start in the spring.  Extend the life of your engine! Click to learn more. #Winterizing #BriggsAndStratton #EngineStorage #LawnCare,preventing damage and ensuring a smooth start in the spring.  Extend the life of your engine! Click to learn more. #Winterizing #BriggsAndStratton #EngineStorage #LawnCare
Briggs 20HP: Is a Rebuild Worth It?,https://res.cloudinary.com/dbcpfy04c/image/upload/v1618237451/placeholder.jpg,home-inspiration,,https://lawntrend.com/20-hp-briggs-and-stratton-engine-problems/?utm_source=pinterest&utm_campaign=briggs-20hp-is-a-reb,2025-05-15,Considering a full rebuild of your 20HP Briggs & Stratton engine? This pin helps you weigh the pros and cons,determining if a rebuild is the right solution for your needs.  Make an informed decision! Click to learn more. #EngineRebuild #BriggsAndStratton #EngineRepair #CostAnalysis,determining if a rebuild is the right solution for your needs.  Make an informed decision! Click to learn more. #EngineRebuild #BriggsAndStratton #EngineRepair #CostAnalysis
Briggs 20HP: Fuel Filter Replacement,https://res.cloudinary.com/dbcpfy04c/image/upload/v1618237451/placeholder.jpg,home-inspiration,,https://lawntrend.com/20-hp-briggs-and-stratton-engine-problems/?utm_source=pinterest&utm_campaign=briggs-20hp-fuel-fil,2025-05-15,A clogged fuel filter can starve your 20HP Briggs & Stratton engine. This pin shows you how to easily replace the fuel filter,restoring optimal fuel flow.  Keep your engine running clean! Click to learn more. #FuelFilter #BriggsAndStratton #EngineMaintenance #SmallEngine,restoring optimal fuel flow.  Keep your engine running clean! Click to learn more. #FuelFilter #BriggsAndStratton #EngineMaintenance #SmallEngine
20HP Briggs: Air Filter Cleaning/Replace,https://res.cloudinary.com/dbcpfy04c/image/upload/v1618237451/placeholder.jpg,home-inspiration,,https://lawntrend.com/20-hp-briggs-and-stratton-engine-problems/?utm_source=pinterest&utm_campaign=20hp-briggs-air-filt,2025-05-15,Don't let a dirty air filter choke your 20HP Briggs & Stratton engine! This pin demonstrates how to clean or replace the air filter,ensuring proper airflow and performance.  Breathe new life into your engine! Click to learn more. #AirFilter #BriggsAndStratton #EngineMaintenance #LawnCare,ensuring proper airflow and performance.  Breathe new life into your engine! Click to learn more. #AirFilter #BriggsAndStratton #EngineMaintenance #LawnCare
Briggs 20HP: Preventative Maintenance,https://res.cloudinary.com/dbcpfy04c/image/upload/v1618237451/placeholder.jpg,home-inspiration,,https://lawntrend.com/20-hp-briggs-and-stratton-engine-problems/?utm_source=pinterest&utm_campaign=briggs-20hp-preventa,2025-05-15,Don't wait for problems to arise! This pin outlines a preventative maintenance schedule for your 20HP Briggs & Stratton engine,keeping it running smoothly for years to come.  Proactive care saves money and headaches! Click to learn more. #PreventativeMaintenance #BriggsAndStratton #EngineCare #LawnCareSchedule,keeping it running smoothly for years to come.  Proactive care saves money and headaches! Click to learn more. #PreventativeMaintenance #BriggsAndStratton #EngineCare #LawnCareSchedule
Title,https://res.cloudinary.com/dbcpfy04c/image/upload/v1618237451/placeholder.jpg,home-inspiration,,https://lawntrend.com/briggs-and-stratton-v-twin-running-on-one-cylinder/?utm_source=pinterest&utm_campaign=title,2025-05-15,Description,Keywords,Keywords
Briggs & Stratton V-Twin: 1 Cylinder?,https://res.cloudinary.com/dbcpfy04c/image/upload/v1618237451/placeholder.jpg,home-inspiration,,https://lawntrend.com/briggs-and-stratton-v-twin-running-on-one-cylinder/?utm_source=pinterest&utm_campaign=briggs-stratton-v-tw,2025-05-15,"Is your Briggs & Stratton V-Twin mower sputtering and lacking power? Don't let a frustrating one-cylinder run ruin your weekend! This guide dives deep into diagnosing and fixing this common issue. We cover everything from spark plugs to carburetors, helping you get back to a smooth, even cut.  Avoid costly repairs – learn to troubleshoot yourself!  Click to restore your lawn's health and your peace of mind.  We'll walk you through step-by-step instructions, even if you're a beginner.  Don't give up on your mower, give it a second chance!"",""V-Twin Engine,Mower Repair,Small Engine","Troubleshooting""","Troubleshooting"""
V-Twin Mower Running Rough? Fix It!,https://res.cloudinary.com/dbcpfy04c/image/upload/v1618237451/placeholder.jpg,home-inspiration,,https://lawntrend.com/briggs-and-stratton-v-twin-running-on-one-cylinder/?utm_source=pinterest&utm_campaign=v-twin-mower-running,2025-05-15,"That uneven rumble isn't just annoying, it's a sign something's wrong with your Briggs & Stratton V-Twin.  This post is your lifeline! We pinpoint the most likely causes of a one-cylinder run, from fuel delivery problems to ignition issues.  Imagine the satisfaction of a perfectly manicured lawn, achieved with your own two hands.  Stop wasting time and money on mechanics – empower yourself with the knowledge to fix it right.  Get the detailed guide now!"",""Briggs & Stratton,Lawn Mower,Engine Repair","DIY""","DIY"""
One Cylinder? V-Twin Diagnosis Guide,https://res.cloudinary.com/dbcpfy04c/image/upload/v1618237451/placeholder.jpg,home-inspiration,,https://lawntrend.com/briggs-and-stratton-v-twin-running-on-one-cylinder/?utm_source=pinterest&utm_campaign=one-cylinder-v-twin-,2025-05-15,"Don't panic if your Briggs & Stratton V-Twin is only firing on one cylinder! This comprehensive guide breaks down the diagnostic process into manageable steps. We'll help you identify the culprit, whether it's a faulty spark plug, a clogged carburetor, or something more serious.  A healthy engine means a beautiful lawn, and a beautiful lawn means a happy you!  Click to learn how to save money and keep your mower running strong.  We've got the answers you need."",""Engine Diagnostics,V-Twin,Lawn Care","Spark Plug""","Spark Plug"""
Briggs V-Twin: Carburetor Issues?,https://res.cloudinary.com/dbcpfy04c/image/upload/v1618237451/placeholder.jpg,home-inspiration,,https://lawntrend.com/briggs-and-stratton-v-twin-running-on-one-cylinder/?utm_source=pinterest&utm_campaign=briggs-v-twin-carbur,2025-05-15,"Is a dirty or clogged carburetor causing your Briggs & Stratton V-Twin to run on one cylinder?  It's a common problem!  We show you how to clean and adjust your carburetor for optimal performance.  Don't let a simple fix turn into a major expense.  Restore your mower's power and enjoy a perfectly cut lawn again.  This guide is packed with helpful tips and clear instructions.  Click to learn more and get back to mowing!"",""Carburetor,Briggs & Stratton,Engine Performance","Fuel System""","Fuel System"""
Spark Plug Secrets for V-Twin Engines,https://res.cloudinary.com/dbcpfy04c/image/upload/v1618237451/placeholder.jpg,home-inspiration,,https://lawntrend.com/briggs-and-stratton-v-twin-running-on-one-cylinder/?utm_source=pinterest&utm_campaign=spark-plug-secrets-f,2025-05-15,"A faulty spark plug can easily cause a Briggs & Stratton V-Twin to run on a single cylinder.  Learn how to test, replace, and properly gap your spark plugs for peak engine performance.  Don't underestimate the power of a small part!  A simple spark plug change can make a huge difference.  We'll guide you through the process, step-by-step.  Click to keep your mower firing on all cylinders!"",""Spark Plug,V-Twin Engine,Ignition System","Mower Maintenance""","Mower Maintenance"""
V-Twin Mower: Fuel Delivery Problems,https://res.cloudinary.com/dbcpfy04c/image/upload/v1618237451/placeholder.jpg,home-inspiration,,https://lawntrend.com/briggs-and-stratton-v-twin-running-on-one-cylinder/?utm_source=pinterest&utm_campaign=v-twin-mower-fuel-de,2025-05-15,"Is your Briggs & Stratton V-Twin starving for fuel?  A restricted fuel line or a faulty fuel pump can lead to a one-cylinder run.  We'll show you how to diagnose and fix fuel delivery issues, ensuring your engine gets the fuel it needs to run smoothly.  Imagine the relief of a mower that starts on the first pull!  Click to learn how to keep your fuel system in top shape."",""Fuel Pump,Fuel Line,V-Twin","Engine Fuel""","Engine Fuel"""
Briggs & Stratton: Compression Test,https://res.cloudinary.com/dbcpfy04c/image/upload/v1618237451/placeholder.jpg,home-inspiration,,https://lawntrend.com/briggs-and-stratton-v-twin-running-on-one-cylinder/?utm_source=pinterest&utm_campaign=briggs-stratton-comp,2025-05-15,"Low compression in one cylinder can be a major cause of a V-Twin running rough.  Learn how to perform a simple compression test to identify potential engine problems.  Don't guess, test!  Knowing your engine's compression is crucial for accurate diagnosis.  We'll walk you through the process, even if you've never done it before.  Click to learn more and get your mower running like new."",""Compression Test,V-Twin Engine,Engine Repair","Diagnosis""","Diagnosis"""
V-Twin Mower: Valve Problems?,https://res.cloudinary.com/dbcpfy04c/image/upload/v1618237451/placeholder.jpg,home-inspiration,,https://lawntrend.com/briggs-and-stratton-v-twin-running-on-one-cylinder/?utm_source=pinterest&utm_campaign=v-twin-mower-valve-p,2025-05-15,"Sticking or burnt valves can cause a Briggs & Stratton V-Twin to run on one cylinder.  We discuss how to identify valve issues and potential repair options.  Don't ignore valve problems – they can lead to serious engine damage.  Protect your investment and keep your mower running smoothly.  Click to learn more about valve maintenance and repair."",""Valves,V-Twin,Engine Repair","Engine Maintenance""","Engine Maintenance"""
DIY Briggs V-Twin Tune-Up Guide,https://res.cloudinary.com/dbcpfy04c/image/upload/v1618237451/placeholder.jpg,home-inspiration,,https://lawntrend.com/briggs-and-stratton-v-twin-running-on-one-cylinder/?utm_source=pinterest&utm_campaign=diy-briggs-v-twin-tu,2025-05-15,"Give your Briggs & Stratton V-Twin the TLC it deserves with our comprehensive tune-up guide!  We cover everything from spark plugs to air filters, helping you optimize engine performance and prevent future problems.  A well-maintained mower is a happy mower!  Save money and enjoy a perfectly cut lawn.  Click to learn how to tune up your V-Twin engine."",""Tune-Up,V-Twin Engine,Mower Maintenance","DIY Repair""","DIY Repair"""
Briggs & Stratton: Air Filter Check,https://res.cloudinary.com/dbcpfy04c/image/upload/v1618237451/placeholder.jpg,home-inspiration,,https://lawntrend.com/briggs-and-stratton-v-twin-running-on-one-cylinder/?utm_source=pinterest&utm_campaign=briggs-stratton-air-,2025-05-15,"A clogged air filter can restrict airflow and cause a Briggs & Stratton V-Twin to run poorly, even on one cylinder.  Learn how to inspect, clean, and replace your air filter for optimal engine performance.  Don't let a dirty air filter ruin your mowing experience!  A clean air filter means a healthier engine.  Click to learn more about air filter maintenance."",""Air Filter,V-Twin,Engine Maintenance","Lawn Mower""","Lawn Mower"""
V-Twin Mower: Exhaust Issues?,https://res.cloudinary.com/dbcpfy04c/image/upload/v1618237451/placeholder.jpg,home-inspiration,,https://lawntrend.com/briggs-and-stratton-v-twin-running-on-one-cylinder/?utm_source=pinterest&utm_campaign=v-twin-mower-exhaust,2025-05-15,"A blocked exhaust can create backpressure and cause a Briggs & Stratton V-Twin to run on one cylinder.  We'll show you how to inspect your exhaust system for obstructions.  Don't overlook the exhaust system – it's a vital part of your engine.  Ensure proper exhaust flow for optimal performance.  Click to learn more about exhaust maintenance."",""Exhaust System,V-Twin,Engine Repair","Mower Maintenance""","Mower Maintenance"""
Briggs V-Twin: Governor Problems?,https://res.cloudinary.com/dbcpfy04c/image/upload/v1618237451/placeholder.jpg,home-inspiration,,https://lawntrend.com/briggs-and-stratton-v-twin-running-on-one-cylinder/?utm_source=pinterest&utm_campaign=briggs-v-twin-govern,2025-05-15,"Is your V-Twin surging or running erratically? A faulty governor could be the culprit. Learn how to diagnose and potentially fix governor issues.  A smooth-running engine is a sign of a healthy governor.  Don't let a faulty governor ruin your mowing experience.  Click to learn more about governor maintenance."",""Governor,V-Twin,Engine Repair","Engine Control""","Engine Control"""
V-Twin Mower: Oil Level Check,https://res.cloudinary.com/dbcpfy04c/image/upload/v1618237451/placeholder.jpg,home-inspiration,,https://lawntrend.com/briggs-and-stratton-v-twin-running-on-one-cylinder/?utm_source=pinterest&utm_campaign=v-twin-mower-oil-lev,2025-05-15,"Low oil can cause serious engine damage, potentially leading to a one-cylinder run.  Always check your oil level before starting your Briggs & Stratton V-Twin.  Protect your investment with regular oil checks!  Proper lubrication is essential for engine longevity.  Click to learn more about oil maintenance."",""Oil Level,V-Twin,Engine Maintenance","Lawn Mower""","Lawn Mower"""
Briggs & Stratton: Flywheel Key Shear,https://res.cloudinary.com/dbcpfy04c/image/upload/v1618237451/placeholder.jpg,home-inspiration,,https://lawntrend.com/briggs-and-stratton-v-twin-running-on-one-cylinder/?utm_source=pinterest&utm_campaign=briggs-stratton-flyw,2025-05-15,"A sheared flywheel key can cause timing issues and a V-Twin to run on one cylinder. Learn how to inspect and replace the flywheel key.  Don't ignore timing issues – they can lead to serious engine damage.  Ensure proper engine timing for optimal performance.  Click to learn more about flywheel key replacement."",""Flywheel Key,V-Twin,Engine Repair","Timing""","Timing"""
V-Twin Mower: Wiring Issues?,https://res.cloudinary.com/dbcpfy04c/image/upload/v1618237451/placeholder.jpg,home-inspiration,,https://lawntrend.com/briggs-and-stratton-v-twin-running-on-one-cylinder/?utm_source=pinterest&utm_campaign=v-twin-mower-wiring-,2025-05-15,"Loose or corroded wiring can disrupt the ignition system and cause a Briggs & Stratton V-Twin to run on one cylinder.  Learn how to inspect and repair wiring connections.  Don't underestimate the importance of good wiring!  Proper electrical connections are crucial for engine operation.  Click to learn more about wiring maintenance."",""Wiring,V-Twin,Engine Repair","Electrical System""","Electrical System"""
Briggs V-Twin: Troubleshooting Flowchart,https://res.cloudinary.com/dbcpfy04c/image/upload/v1618237451/placeholder.jpg,home-inspiration,,https://lawntrend.com/briggs-and-stratton-v-twin-running-on-one-cylinder/?utm_source=pinterest&utm_campaign=briggs-v-twin-troubl,2025-05-15,"Confused about where to start? Use our handy troubleshooting flowchart to diagnose a Briggs & Stratton V-Twin running on one cylinder.  Simplify the diagnostic process with our visual guide!  Don't waste time guessing – follow the flowchart to pinpoint the problem.  Click to access the flowchart and get your mower running smoothly."",""Troubleshooting,V-Twin,Engine Repair","Flowchart""","Flowchart"""
V-Twin Mower: Preventative Maintenance,https://res.cloudinary.com/dbcpfy04c/image/upload/v1618237451/placeholder.jpg,home-inspiration,,https://lawntrend.com/briggs-and-stratton-v-twin-running-on-one-cylinder/?utm_source=pinterest&utm_campaign=v-twin-mower-prevent,2025-05-15,"Don't wait for problems to arise! Learn how to perform preventative maintenance on your Briggs & Stratton V-Twin to keep it running smoothly for years to come.  A little maintenance goes a long way!  Protect your investment and avoid costly repairs.  Click to learn more about preventative maintenance."",""Preventative Maintenance,V-Twin,Engine Maintenance","Lawn Mower""","Lawn Mower"""
Briggs & Stratton: Common Mistakes,https://res.cloudinary.com/dbcpfy04c/image/upload/v1618237451/placeholder.jpg,home-inspiration,,https://lawntrend.com/briggs-and-stratton-v-twin-running-on-one-cylinder/?utm_source=pinterest&utm_campaign=briggs-stratton-comm,2025-05-15,"Avoid these common mistakes when diagnosing a Briggs & Stratton V-Twin running on one cylinder.  Learn from the experiences of others and save yourself time and frustration!  Don't fall into these common traps – follow our advice for accurate diagnosis.  Click to learn more about common mistakes."",""Common Mistakes,V-Twin,Engine Repair","Troubleshooting""","Troubleshooting"""
V-Twin Mower: When to Call a Pro,https://res.cloudinary.com/dbcpfy04c/image/upload/v1618237451/placeholder.jpg,home-inspiration,,https://lawntrend.com/briggs-and-stratton-v-twin-running-on-one-cylinder/?utm_source=pinterest&utm_campaign=v-twin-mower-when-to,2025-05-15,"Sometimes, a repair is best left to the professionals. Learn when it's time to call a qualified mechanic for your Briggs & Stratton V-Twin.  Don't risk causing further damage – know your limits!  Protect your investment and ensure a proper repair.  Click to learn more about when to call a pro."",""Professional Repair,V-Twin,Engine Repair","Mechanic""","Mechanic"""
