Title,Media URL,Pinterest board,Thumbnail,Link,Publish date,Description,Keywords,
Title,https://res.cloudinary.com/dbcpfy04c/image/upload/v1747253852/pin_1_1_lefw2i.webp,please-provide-the-title-and-keywords-i-need-that-information-to-suggest-a-board-name-once,,https://lawntrend.com/cub-cadet-xt3-gsx-problems/?utm_source=pinterest&utm_campaign=title,2025-05-14,Description,Keywords,Keywords
Cub Cadet XT3 GSX: Common Issues,https://res.cloudinary.com/dbcpfy04c/image/upload/v1747253859/pin_1_2_scrp7z.webp,lawn-repair-ideas,,https://lawntrend.com/cub-cadet-xt3-gsx-problems/?utm_source=pinterest&utm_campaign=cub-cadet-xt3-gsx-co,2025-05-14,"Don't let a broken mower ruin your summer! This pin highlights the most frequent problems owners face with the Cub Cadet XT3 GSX. From engine troubles to blade issues, we break down the causes and, more importantly, how to fix them.  Save time and money by tackling repairs yourself!  Learn to diagnose and resolve issues like stalling, poor cutting quality, and transmission problems.  Click to read our comprehensive guide and get back to enjoying a perfectly manicured lawn.  Is your XT3 GSX giving you headaches? We've got the answers! ,Cub Cadet,XT3 GSX,Lawn Mower",Repair,Repair
XT3 GSX Troubleshooting Guide,https://res.cloudinary.com/dbcpfy04c/image/upload/v1747253865/pin_1_3_plnt3i.webp,lawn-care-ideas,,https://lawntrend.com/cub-cadet-xt3-gsx-problems/?utm_source=pinterest&utm_campaign=xt3-gsx-troubleshoot,2025-05-14,"Is your Cub Cadet XT3 GSX refusing to start?  Frustrated with a sputtering engine?  This pin leads to a detailed guide covering everything from simple fixes like checking the fuel line to more complex repairs.  We understand the annoyance of lawn equipment failure, and we're here to help you get back on track.  Don't waste another weekend wrestling with your mower – empower yourself with the knowledge to fix it!  Learn preventative maintenance tips too! Click to learn more and reclaim your weekends. ,Troubleshooting,Cub Cadet,XT3 GSX",Lawn Care,Lawn Care
Cub Cadet XT3 GSX: Blade Problems?,https://res.cloudinary.com/dbcpfy04c/image/upload/v1747253870/pin_1_4_vnzh1s.webp,lawn-repair-ideas,,https://lawntrend.com/cub-cadet-xt3-gsx-problems/?utm_source=pinterest&utm_campaign=cub-cadet-xt3-gsx-bl,2025-05-14,"Dull blades ruining your lawn's appearance? This pin focuses on diagnosing and fixing blade-related issues on your Cub Cadet XT3 GSX.  We cover everything from bent blades to spindle problems and how to safely replace them.  A sharp blade means a healthy lawn!  Don't settle for a ragged cut – learn how to achieve a professional finish.  Click to read our guide and restore your lawn to its former glory.  A beautiful lawn is within reach! ,Blade Replacement,XT3 GSX,Lawn Mower",Lawn Care,Lawn Care
XT3 GSX Engine Won't Start? FIX IT!,https://res.cloudinary.com/dbcpfy04c/image/upload/v1747253877/pin_1_5_mph9x3.webp,motorcycle-repair-ideas,,https://lawntrend.com/cub-cadet-xt3-gsx-problems/?utm_source=pinterest&utm_campaign=xt3-gsx-engine-wont-,2025-05-14,"Nothing's more frustrating than a mower that won't start! This pin addresses common engine problems with the Cub Cadet XT3 GSX.  We'll walk you through checking the spark plug, fuel filter, and carburetor.  Don't let a dead engine derail your lawn care plans.  Our guide provides clear, step-by-step instructions to get you back up and running.  Click to learn how to diagnose and fix your engine issues quickly and easily!  Get mowing today! ,Engine Repair,XT3 GSX,Cub Cadet",Starting Problems,Starting Problems
Cub Cadet XT3 GSX: Transmission Issues,https://res.cloudinary.com/dbcpfy04c/image/upload/v1747253884/pin_1_6_lg4zle.webp,lawn-repair-ideas,,https://lawntrend.com/cub-cadet-xt3-gsx-problems/?utm_source=pinterest&utm_campaign=cub-cadet-xt3-gsx-tr,2025-05-14,"Experiencing jerky movements or a loss of power? This pin dives into transmission problems with the Cub Cadet XT3 GSX.  We cover common causes like low fluid levels and worn belts.  A faulty transmission can be expensive to repair, so early diagnosis is key.  Learn how to identify the symptoms and perform basic maintenance to keep your transmission running smoothly.  Click to read our guide and avoid costly repairs!  Protect your investment! ,Transmission,XT3 GSX,Cub Cadet",Lawn Mower,Lawn Mower
XT3 GSX: Fuel System Problems Solved,https://res.cloudinary.com/dbcpfy04c/image/upload/v1747253890/pin_1_7_nzfyos.webp,motorcycle-repair-ideas,,https://lawntrend.com/cub-cadet-xt3-gsx-problems/?utm_source=pinterest&utm_campaign=xt3-gsx-fuel-system-,2025-05-14,"Is your Cub Cadet XT3 GSX struggling with fuel delivery? This pin highlights common fuel system issues, including clogged fuel filters and carburetor problems.  We provide a step-by-step guide to cleaning and repairing your fuel system.  Don't let a fuel issue keep you from enjoying a perfectly cut lawn.  Click to learn how to restore optimal fuel flow and performance.  Breathe new life into your mower! ,Fuel System,XT3 GSX,Carburetor",Repair,Repair
Cub Cadet XT3 GSX: Stalling Issues?,https://res.cloudinary.com/dbcpfy04c/image/upload/v1747253896/pin_1_8_uhifqe.webp,lawn-repair-ideas,,https://lawntrend.com/cub-cadet-xt3-gsx-problems/?utm_source=pinterest&utm_campaign=cub-cadet-xt3-gsx-st,2025-05-14,"Constant stalling driving you crazy? This pin tackles the frustrating problem of stalling with the Cub Cadet XT3 GSX.  We explore potential causes, from dirty air filters to fuel line obstructions.  Don't waste time and energy on a mower that won't cooperate.  Click to read our guide and learn how to diagnose and fix the stalling issue.  Get back to mowing with confidence! ,Stalling,XT3 GSX,Cub Cadet",Engine Problems,Engine Problems
XT3 GSX: Belt Replacement Guide,https://res.cloudinary.com/dbcpfy04c/image/upload/v1747253904/pin_1_9_g1vojx.webp,motorcycle-maintenance-ideas,,https://lawntrend.com/cub-cadet-xt3-gsx-problems/?utm_source=pinterest&utm_campaign=xt3-gsx-belt-replace,2025-05-14,"A broken belt can bring your mowing to a halt. This pin provides a detailed guide to replacing the belts on your Cub Cadet XT3 GSX.  We cover the tools you'll need and step-by-step instructions to ensure a proper installation.  Don't let a broken belt ruin your weekend.  Click to learn how to replace your belts quickly and easily.  Keep your mower running smoothly! ,Belt Replacement,XT3 GSX,Cub Cadet",Maintenance,Maintenance
Cub Cadet XT3 GSX: Electrical Problems,https://res.cloudinary.com/dbcpfy04c/image/upload/v1747253910/pin_1_10_szqcjc.webp,lawn-repair-ideas,,https://lawntrend.com/cub-cadet-xt3-gsx-problems/?utm_source=pinterest&utm_campaign=cub-cadet-xt3-gsx-el,2025-05-14,"Dealing with electrical issues on your XT3 GSX? This pin addresses common electrical problems, such as faulty wiring and blown fuses.  We provide a guide to diagnosing and repairing these issues safely.  Don't risk electrical shock – follow our expert advice.  Click to learn how to restore power to your mower.  Get back to mowing with peace of mind! ,Electrical Repair,XT3 GSX,Cub Cadet",Wiring,Wiring
XT3 GSX: Preventative Maintenance Tips,https://res.cloudinary.com/dbcpfy04c/image/upload/v1747253916/pin_1_11_xq5v06.webp,lawn-care-ideas,,https://lawntrend.com/cub-cadet-xt3-gsx-problems/?utm_source=pinterest&utm_campaign=xt3-gsx-preventative,2025-05-14,"Don't wait for problems to arise! This pin shares essential preventative maintenance tips for your Cub Cadet XT3 GSX.  Regular maintenance can extend the life of your mower and save you money on repairs.  Learn how to keep your mower running smoothly for years to come.  Click to read our guide and protect your investment.  A little maintenance goes a long way! ,Maintenance,XT3 GSX,Cub Cadet",Lawn Care,Lawn Care
Cub Cadet XT3 GSX: Spindle Problems?,https://res.cloudinary.com/dbcpfy04c/image/upload/v1747253922/pin_1_12_ijiw2f.webp,lawn-repair-ideas,,https://lawntrend.com/cub-cadet-xt3-gsx-problems/?utm_source=pinterest&utm_campaign=cub-cadet-xt3-gsx-sp,2025-05-14,"A noisy or vibrating spindle? This pin focuses on diagnosing and fixing spindle problems on your Cub Cadet XT3 GSX.  We cover everything from worn bearings to damaged spindles.  Don't ignore these issues – they can lead to more serious damage.  Click to read our guide and restore smooth operation.  Keep your blades spinning true! ,Spindle Repair,XT3 GSX,Cub Cadet",Lawn Mower,Lawn Mower
XT3 GSX: Low Power Issues Explained,https://res.cloudinary.com/dbcpfy04c/image/upload/v1747253928/pin_1_13_tyjbl0.webp,engine-repair-ideas,,https://lawntrend.com/cub-cadet-xt3-gsx-problems/?utm_source=pinterest&utm_campaign=xt3-gsx-low-power-is,2025-05-14,"Is your Cub Cadet XT3 GSX lacking power? This pin explores the common causes of low power, such as a clogged air filter or a dirty carburetor.  We provide a step-by-step guide to restoring optimal performance.  Don't struggle with a weak mower – get the power back!  Click to learn how to diagnose and fix the issue.  Enjoy a powerful cut! ,Low Power,XT3 GSX,Cub Cadet",Engine Performance,Engine Performance
Cub Cadet XT3 GSX: Steering Problems?,https://res.cloudinary.com/dbcpfy04c/image/upload/v1747253935/pin_1_14_bciymh.webp,lawn-repair-ideas,,https://lawntrend.com/cub-cadet-xt3-gsx-problems/?utm_source=pinterest&utm_campaign=cub-cadet-xt3-gsx-st,2025-05-14,"Experiencing difficulty steering your XT3 GSX? This pin addresses common steering issues, from loose connections to worn components.  We provide a guide to diagnosing and repairing these problems.  Don't struggle with a difficult-to-control mower.  Click to learn how to restore smooth steering.  Mow with ease! ,Steering Repair,XT3 GSX,Cub Cadet",Lawn Mower,Lawn Mower
XT3 GSX: Diagnostic Tools You Need,https://res.cloudinary.com/dbcpfy04c/image/upload/v1747253942/pin_1_15_hbvuxb.webp,auto-repair-ideas,,https://lawntrend.com/cub-cadet-xt3-gsx-problems/?utm_source=pinterest&utm_campaign=xt3-gsx-diagnostic-t,2025-05-14,"Don't attempt repairs without the right tools! This pin highlights the essential diagnostic tools you'll need to troubleshoot your Cub Cadet XT3 GSX.  From multimeters to compression testers, we'll help you equip yourself for success.  Click to see our recommended tools and get started on your repairs.  Be prepared! ,Diagnostic Tools,XT3 GSX,Cub Cadet",Repair Tools,Repair Tools
Cub Cadet XT3 GSX: Winter Storage Guide,https://res.cloudinary.com/dbcpfy04c/image/upload/v1747253948/pin_1_16_wi03k8.webp,lawn-repair-ideas,,https://lawntrend.com/cub-cadet-xt3-gsx-problems/?utm_source=pinterest&utm_campaign=cub-cadet-xt3-gsx-wi,2025-05-14,"Preparing your XT3 GSX for winter? This pin provides a comprehensive guide to winterizing your mower, ensuring it's ready to go when spring arrives.  Learn how to protect your engine and components from the elements.  Don't let winter damage ruin your mower.  Click to read our guide and ensure a smooth start next season.  Protect your investment! ,Winterizing,XT3 GSX,Cub Cadet",Lawn Mower Storage,Lawn Mower Storage
XT3 GSX: Common Error Codes Explained,https://res.cloudinary.com/dbcpfy04c/image/upload/v1747253954/pin_1_17_uj0hfc.webp,motorcycle-repair-ideas,,https://lawntrend.com/cub-cadet-xt3-gsx-problems/?utm_source=pinterest&utm_campaign=xt3-gsx-common-error,2025-05-14,"Confused by error codes on your XT3 GSX? This pin decodes common error codes, helping you quickly identify the problem.  We provide a guide to understanding what the codes mean and how to fix the issue.  Don't waste time guessing – get straight to the solution!  Click to learn more. ,Error Codes,XT3 GSX,Cub Cadet",Diagnostics,Diagnostics
Cub Cadet XT3 GSX: Tire Pressure Guide,https://res.cloudinary.com/dbcpfy04c/image/upload/v1747253960/pin_1_18_l3vgbz.webp,lawn-repair-ideas,,https://lawntrend.com/cub-cadet-xt3-gsx-problems/?utm_source=pinterest&utm_campaign=cub-cadet-xt3-gsx-ti,2025-05-14,"Proper tire pressure is crucial for optimal performance. This pin provides a guide to checking and adjusting the tire pressure on your Cub Cadet XT3 GSX.  Learn how to ensure a smooth ride and efficient cutting.  Click to read our guide and improve your mowing experience.  Get the best cut possible! ,Tire Pressure,XT3 GSX,Cub Cadet",Maintenance,Maintenance
XT3 GSX: Cleaning Your Mower Properly,https://res.cloudinary.com/dbcpfy04c/image/upload/v1747253966/pin_1_19_xufjft.webp,lawn-care-ideas,,https://lawntrend.com/cub-cadet-xt3-gsx-problems/?utm_source=pinterest&utm_campaign=xt3-gsx-cleaning-you,2025-05-14,"A clean mower runs better! This pin provides a guide to cleaning your Cub Cadet XT3 GSX, removing debris and preventing corrosion.  Learn how to keep your mower looking and performing its best.  Click to read our guide and extend its lifespan.  A little cleaning goes a long way! ,Cleaning,XT3 GSX,Cub Cadet",Lawn Mower Care,Lawn Mower Care
Cub Cadet XT3 GSX: Safety First!,https://res.cloudinary.com/dbcpfy04c/image/upload/v1747253972/pin_1_20_sekh4m.webp,lawn-repair-ideas,,https://lawntrend.com/cub-cadet-xt3-gsx-problems/?utm_source=pinterest&utm_campaign=cub-cadet-xt3-gsx-sa,2025-05-14,"Safety is paramount when working on your mower. This pin highlights essential safety precautions to take when performing repairs on your Cub Cadet XT3 GSX.  Don't risk injury – follow our expert advice.  Click to read our safety guide and protect yourself.  Mow safely! ,Safety,XT3 GSX,Cub Cadet",Repair Safety,Repair Safety
XT3 GSX: Where to Find Parts?,https://res.cloudinary.com/dbcpfy04c/image/upload/v1747253979/pin_1_21_ib5wpf.webp,motorcycle-parts-ideas,,https://lawntrend.com/cub-cadet-xt3-gsx-problems/?utm_source=pinterest&utm_campaign=xt3-gsx-where-to-fin,2025-05-14,"Need replacement parts for your XT3 GSX? This pin provides a guide to finding genuine Cub Cadet parts online and at local dealers.  Don't settle for inferior parts – get the quality you deserve.  Click to learn where to find the parts you need.  Get your mower back in action! ,Parts,XT3 GSX,Cub Cadet",Replacement Parts,Replacement Parts
XT3 GSX: Oil Change Guide,https://res.cloudinary.com/dbcpfy04c/image/upload/v1747253987/pin_1_22_e92dej.webp,motorcycle-maintenance-ideas,,https://lawntrend.com/cub-cadet-xt3-gsx-problems/?utm_source=pinterest&utm_campaign=xt3-gsx-oil-change-g,2025-05-14,"Regular oil changes are essential for engine health. This pin provides a step-by-step guide to changing the oil on your Cub Cadet XT3 GSX.  Learn how to keep your engine running smoothly for years to come.  Click to read our guide and protect your investment.  Keep your engine happy! ,Oil Change,XT3 GSX,Cub Cadet",Maintenance,Maintenance
Cub Cadet XT3 GSX: Battery Care Tips,https://res.cloudinary.com/dbcpfy04c/image/upload/v1747253992/pin_1_23_utsgmo.webp,lawn-repair-ideas,,https://lawntrend.com/cub-cadet-xt3-gsx-problems/?utm_source=pinterest&utm_campaign=cub-cadet-xt3-gsx-ba,2025-05-14,"Is your battery losing its charge? This pin shares essential battery care tips for your Cub Cadet XT3 GSX.  Learn how to properly charge and store your battery to maximize its lifespan.  Click to read our guide and avoid being stranded with a dead battery.  Stay powered up! ,Battery Care,XT3 GSX,Cub Cadet",Lawn Mower Battery,Lawn Mower Battery
XT3 GSX: Dealing with Vibration,https://res.cloudinary.com/dbcpfy04c/image/upload/v1747253999/pin_1_24_lp01dj.webp,lawn-repair-ideas,,https://lawntrend.com/cub-cadet-xt3-gsx-problems/?utm_source=pinterest&utm_campaign=xt3-gsx-dealing-with,2025-05-14,"Excessive vibration can indicate a problem. This pin explores the causes of vibration on your Cub Cadet XT3 GSX and how to fix them.  From loose bolts to unbalanced blades, we'll help you diagnose the issue.  Click to read our guide and restore smooth operation.  Enjoy a comfortable ride! ,Vibration,XT3 GSX,Cub Cadet",Lawn Mower Repair,Lawn Mower Repair
Cub Cadet XT3 GSX: Is DIY Worth It?,https://res.cloudinary.com/dbcpfy04c/image/upload/v1747254005/pin_1_25_pygnmm.webp,lawn-repair-ideas,,https://lawntrend.com/cub-cadet-xt3-gsx-problems/?utm_source=pinterest&utm_campaign=cub-cadet-xt3-gsx-is,2025-05-14,"Considering DIY repairs on your XT3 GSX? This pin helps you weigh the pros and cons of DIY versus professional repair.  Learn when to tackle repairs yourself and when to call in the experts.  Click to read our guide and make the right decision.  Save money or ensure quality? ,DIY Repair,XT3 GSX,Cub Cadet",Lawn Mower Repair,Lawn Mower Repair
Title,https://res.cloudinary.com/dbcpfy04c/image/upload/v1747254055/pin_2_1_hzdkbd.webp,please-provide-the-title-and-keywords-i-need-that-information-to-suggest-a-board-name-once,,https://lawntrend.com/john-deere-2025r-problems/?utm_source=pinterest&utm_campaign=title,2025-05-14,Description,Keywords,Keywords
John Deere 2025R: Common Issues,https://res.cloudinary.com/dbcpfy04c/image/upload/v1747254062/pin_2_2_d4tvvg.webp,tractor-repair-ideas,,https://lawntrend.com/john-deere-2025r-problems/?utm_source=pinterest&utm_campaign=john-deere-2025r-com,2025-05-14,"Is your John Deere 2025R giving you headaches? Don't let frustrating problems ruin your property dreams! This guide dives deep into the most common issues owners face – from hydraulic woes to engine hiccups. We break down symptoms, potential causes, and DIY fixes (where possible!).  Learn how to troubleshoot and keep your compact tractor running smoothly",saving you time and money on costly repairs.  Don't ignore warning signs – proactive maintenance is key! Click to read the full article and reclaim your weekend. #JohnDeere2025R #CompactTractor #TractorProblems #DIYRepair,saving you time and money on costly repairs.  Don't ignore warning signs – proactive maintenance is key! Click to read the full article and reclaim your weekend. #JohnDeere2025R #CompactTractor #TractorProblems #DIYRepair
2025R Hydraulic Problems: Solved!,https://res.cloudinary.com/dbcpfy04c/image/upload/v1747254069/pin_2_3_zzjus8.webp,tractor-repair-ideas,,https://lawntrend.com/john-deere-2025r-problems/?utm_source=pinterest&utm_campaign=2025r-hydraulic-prob,2025-05-14,"Struggling with hydraulic issues on your John Deere 2025R?  Low power, jerky movements, or complete failure can be incredibly frustrating. This pin highlights the most frequent hydraulic problems, offering clear explanations and potential solutions.  We cover everything from fluid levels to pump issues",helping you diagnose the root cause.  Don't let hydraulic problems stop you from tackling your to-do list!  Read our guide for a step-by-step approach to getting your tractor back in action. #JohnDeereHydraulics #2025RProblems #TractorRepair #HydraulicPump,helping you diagnose the root cause.  Don't let hydraulic problems stop you from tackling your to-do list!  Read our guide for a step-by-step approach to getting your tractor back in action. #JohnDeereHydraulics #2025RProblems #TractorRepair #HydraulicPump
John Deere 2025R Engine Troubles?,https://res.cloudinary.com/dbcpfy04c/image/upload/v1747254075/pin_2_4_eah0sk.webp,tractor-repair-ideas,,https://lawntrend.com/john-deere-2025r-problems/?utm_source=pinterest&utm_campaign=john-deere-2025r-eng,2025-05-14,"Is your 2025R engine sputtering, overheating, or refusing to start?  Engine problems are a major concern for any tractor owner.  This pin focuses on common engine issues, including fuel delivery problems, cooling system failures",and sensor malfunctions.  We provide a detailed breakdown of symptoms and troubleshooting steps.  Protect your investment and keep your engine running strong – click to learn more!  Don't wait until a small issue becomes a major breakdown. #JohnDeereEngine #2025RTroubleshooting #TractorEngine #EngineRepair,and sensor malfunctions.  We provide a detailed breakdown of symptoms and troubleshooting steps.  Protect your investment and keep your engine running strong – click to learn more!  Don't wait until a small issue becomes a major breakdown. #JohnDeereEngine #2025RTroubleshooting #TractorEngine #EngineRepair
2025R: Preventative Maintenance Tips,https://res.cloudinary.com/dbcpfy04c/image/upload/v1747254081/pin_2_5_cargny.webp,tractor-care-ideas,,https://lawntrend.com/john-deere-2025r-problems/?utm_source=pinterest&utm_campaign=2025r-preventative-m,2025-05-14,"Don't wait for problems to arise!  This pin emphasizes the importance of preventative maintenance for your John Deere 2025R.  We outline a simple maintenance schedule, covering oil changes, filter replacements, and lubrication points.  Regular maintenance extends the life of your tractor, reduces repair costs",and ensures optimal performance.  Invest a little time now to save a lot of hassle later!  Click to download our free maintenance checklist. #JohnDeereMaintenance #2025RService #TractorCare #PreventativeMaintenance,and ensures optimal performance.  Invest a little time now to save a lot of hassle later!  Click to download our free maintenance checklist. #JohnDeereMaintenance #2025RService #TractorCare #PreventativeMaintenance
John Deere 2025R: PTO Issues?,https://res.cloudinary.com/dbcpfy04c/image/upload/v1747254086/pin_2_6_co8wwi.webp,tractor-repair-ideas,,https://lawntrend.com/john-deere-2025r-problems/?utm_source=pinterest&utm_campaign=john-deere-2025r-pto,2025-05-14,"Having trouble with your 2025R's PTO?  A malfunctioning PTO can halt your work and cause frustration.  This pin addresses common PTO problems, including engagement issues, slipping",and noise.  We explain the potential causes and offer troubleshooting tips.  Get your implements working smoothly again – click to read our comprehensive guide!  Don't let PTO problems slow you down. #JohnDeerePTO #2025RPTO #TractorPTO #PTOProblems,and noise.  We explain the potential causes and offer troubleshooting tips.  Get your implements working smoothly again – click to read our comprehensive guide!  Don't let PTO problems slow you down. #JohnDeerePTO #2025RPTO #TractorPTO #PTOProblems
2025R: Electrical System Problems,https://res.cloudinary.com/dbcpfy04c/image/upload/v1747254093/pin_2_7_nlpyze.webp,tractor-repair-ideas,,https://lawntrend.com/john-deere-2025r-problems/?utm_source=pinterest&utm_campaign=2025r-electrical-sys,2025-05-14,"Electrical issues can be tricky to diagnose. This pin focuses on common electrical problems with the John Deere 2025R, including battery issues, wiring faults",and sensor failures. We provide a guide to troubleshooting and offer advice on safe electrical repairs. Don't risk a shock – learn how to handle electrical problems correctly! Click to read the full article. #JohnDeereElectrical #2025RElectrical #TractorWiring #ElectricalRepair,and sensor failures. We provide a guide to troubleshooting and offer advice on safe electrical repairs. Don't risk a shock – learn how to handle electrical problems correctly! Click to read the full article. #JohnDeereElectrical #2025RElectrical #TractorWiring #ElectricalRepair
Is Your 2025R Overheating?,https://res.cloudinary.com/dbcpfy04c/image/upload/v1747254100/pin_2_8_ar9bxd.webp,tractor-repair-ideas,,https://lawntrend.com/john-deere-2025r-problems/?utm_source=pinterest&utm_campaign=is-your-2025r-overhe,2025-05-14,"Overheating is a serious issue that can cause significant engine damage. This pin highlights the causes of overheating in the John Deere 2025R, including coolant leaks, radiator blockages",and thermostat failures. We provide a step-by-step guide to diagnosing and resolving overheating problems. Protect your engine – click to learn more! #JohnDeereOverheating #2025ROverheat #TractorCooling #EngineCooling,and thermostat failures. We provide a step-by-step guide to diagnosing and resolving overheating problems. Protect your engine – click to learn more! #JohnDeereOverheating #2025ROverheat #TractorCooling #EngineCooling
2025R: Fuel System Problems,https://res.cloudinary.com/dbcpfy04c/image/upload/v1747254105/pin_2_9_qvcpjy.webp,tractor-repair-ideas,,https://lawntrend.com/john-deere-2025r-problems/?utm_source=pinterest&utm_campaign=2025r-fuel-system-pr,2025-05-14,"Fuel delivery issues can lead to poor performance and engine failure. This pin addresses common fuel system problems in the John Deere 2025R, including clogged fuel filters, faulty fuel pumps",and injector issues. We offer troubleshooting tips and advice on fuel system maintenance. Keep your engine running smoothly – click to read the full article! #JohnDeereFuelSystem #2025RFuel #TractorFuel #FuelProblems,and injector issues. We offer troubleshooting tips and advice on fuel system maintenance. Keep your engine running smoothly – click to read the full article! #JohnDeereFuelSystem #2025RFuel #TractorFuel #FuelProblems
John Deere 2025R: Warning Lights,https://res.cloudinary.com/dbcpfy04c/image/upload/v1747254112/pin_2_10_d8gxni.webp,tractor-repair-ideas,,https://lawntrend.com/john-deere-2025r-problems/?utm_source=pinterest&utm_campaign=john-deere-2025r-war,2025-05-14,Decoding those mysterious warning lights on your 2025R! This pin explains the meaning of common warning lights,helping you quickly identify potential problems. Don't ignore those lights – they're your tractor's way of telling you something's wrong! Click to learn what each light means and how to respond. #JohnDeereWarningLights #2025RWarnings #TractorLights #WarningSigns,helping you quickly identify potential problems. Don't ignore those lights – they're your tractor's way of telling you something's wrong! Click to learn what each light means and how to respond. #JohnDeereWarningLights #2025RWarnings #TractorLights #WarningSigns
