Title,Media URL,Pinterest board,Thumbnail,Link,Publish date,Description,Keywords
Title,https://res.cloudinary.com/dbcpfy04c/image/upload/v1747930992/pin_1_1_ffd1fq.webp,please-provide-the-title-and-keywords-i-need-that-information-to-suggest-a-board-name-once,,https://www.beacleaner.com/is-bissell-carpet-cleaner-toxic?utm_source=pinterest&utm_campaign=title,2025-05-22,Description,Keywords
Is Your Bissell Carpet Cleaner Safe?,https://res.cloudinary.com/dbcpfy04c/image/upload/v1747930998/pin_1_2_pvnzyt.webp,cleaning-tips,,https://www.beacleaner.com/is-bissell-carpet-cleaner-toxic?utm_source=pinterest&utm_campaign=is-your-bissell-carp,2025-05-22,Worried about harsh chemicals in your Bissell carpet cleaner? This post dives deep into the ingredients,potential toxins
Bissell Carpet Cleaner: The Truth,https://res.cloudinary.com/dbcpfy04c/image/upload/v1747931004/pin_1_3_kvppoy.webp,cleaning-tips,,https://www.beacleaner.com/is-bissell-carpet-cleaner-toxic?utm_source=pinterest&utm_campaign=bissell-carpet-clean,2025-05-22,Uncover the hidden dangers lurking in your Bissell carpet cleaner! We break down the ingredients,discuss potential health risks for kids & pets
Protect Your Pets! Bissell & Toxins,https://res.cloudinary.com/dbcpfy04c/image/upload/v1747931011/pin_1_4_m17lzs.webp,pet-safety-tips,,https://www.beacleaner.com/is-bissell-carpet-cleaner-toxic?utm_source=pinterest&utm_campaign=protect-your-pets-bi,2025-05-22,Is your furry friend safe around your Bissell carpet cleaner? This post explores the potential toxicity of common Bissell formulas for pets. Learn how to minimize risks,recognize symptoms of exposure
Bissell Deep Clean: Is It Worth It?,https://res.cloudinary.com/dbcpfy04c/image/upload/v1747931017/pin_1_5_tzi46j.webp,cleaning-tips,,https://www.beacleaner.com/is-bissell-carpet-cleaner-toxic?utm_source=pinterest&utm_campaign=bissell-deep-clean-i,2025-05-22,Bissell deep cleaning can seem amazing,but at what cost? We investigate the chemicals used and their potential impact on your health. Discover if the deep clean is truly worth the risk
DIY Carpet Cleaner vs. Bissell,https://res.cloudinary.com/dbcpfy04c/image/upload/v1747931025/pin_1_6_atfgd3.webp,cleaning-tips,,https://www.beacleaner.com/is-bissell-carpet-cleaner-toxic?utm_source=pinterest&utm_campaign=diy-carpet-cleaner-v,2025-05-22,Ditch the harsh chemicals! This post compares DIY carpet cleaning solutions to popular Bissell formulas. Learn how to create effective,non-toxic cleaners using simple ingredients you probably already have. Save money
Bissell Ingredients: What's Hidden?,https://res.cloudinary.com/dbcpfy04c/image/upload/v1747931033/pin_1_7_kkextf.webp,healthy-home-tips,,https://www.beacleaner.com/is-bissell-carpet-cleaner-toxic?utm_source=pinterest&utm_campaign=bissell-ingredients-,2025-05-22,Ever wondered what's *really* in your Bissell carpet cleaner? We decode the ingredient list,explaining potentially harmful chemicals and their effects. Empower yourself with knowledge and make informed choices about the products you use in your home. Your health is worth it! Read the full post now. #BissellIngredients #ChemicalAnalysis #Toxicology #HomeCleaning
Bissell & Allergies: A Connection?,https://res.cloudinary.com/dbcpfy04c/image/upload/v1747931039/pin_1_8_yjmrfc.webp,allergy-tips,,https://www.beacleaner.com/is-bissell-carpet-cleaner-toxic?utm_source=pinterest&utm_campaign=bissell-allergies-a-,2025-05-22,Do you suspect your Bissell carpet cleaner is triggering your allergies? This post explores the link between carpet cleaning chemicals and allergic reactions. Learn how to minimize allergens,choose hypoallergenic options
Bissell ProHeat 2X: Is It Safe?,https://res.cloudinary.com/dbcpfy04c/image/upload/v1747931046/pin_1_9_fcwjgy.webp,cleaning-tips,,https://www.beacleaner.com/is-bissell-carpet-cleaner-toxic?utm_source=pinterest&utm_campaign=bissell-proheat-2x-i,2025-05-22,Specifically looking at the Bissell ProHeat 2X? We analyze its ingredients and potential health risks. Discover if this popular model is a safe choice for your home,or if you should consider alternatives. Don't compromise on safety – read our in-depth review! #BissellProHeat2X #CarpetCleanerReview #SafeCleaning #ProHeat
The Environmental Impact of Bissell,https://res.cloudinary.com/dbcpfy04c/image/upload/v1747931052/pin_1_10_op2o0m.webp,eco-cleaning-tips,,https://www.beacleaner.com/is-bissell-carpet-cleaner-toxic?utm_source=pinterest&utm_campaign=the-environmental-im,2025-05-22,Beyond your health,what's the environmental impact of your Bissell carpet cleaner? This post explores the sustainability of Bissell products and offers eco-friendly alternatives. Make a conscious choice for a healthier planet! Read now to learn more. #EcoFriendlyCleaning #SustainableLiving #BissellSustainability #GreenCleaning
Symptoms of Chemical Exposure (Bissell),https://res.cloudinary.com/dbcpfy04c/image/upload/v1747931058/pin_1_11_mmrlgk.webp,health-tips,,https://www.beacleaner.com/is-bissell-carpet-cleaner-toxic?utm_source=pinterest&utm_campaign=symptoms-of-chemical,2025-05-22,Are you experiencing headaches,dizziness
Bissell Cleaning Solution Alternatives,https://res.cloudinary.com/dbcpfy04c/image/upload/v1747931065/pin_1_12_ylwrxu.webp,cleaning-tips,,https://www.beacleaner.com/is-bissell-carpet-cleaner-toxic?utm_source=pinterest&utm_campaign=bissell-cleaning-sol,2025-05-22,Looking for safer alternatives to Bissell cleaning solutions? We share our top picks for non-toxic,effective carpet cleaners. Protect your family and your pets without sacrificing a sparkling clean home. Click to discover our recommendations! #CarpetCleanerAlternatives #NonToxicSolutions #SafeForPets #HealthyCleaning
The Future of Carpet Cleaning: Non-Toxic,https://res.cloudinary.com/dbcpfy04c/image/upload/v1747931071/pin_1_13_rezkim.webp,eco-cleaning-ideas,,https://www.beacleaner.com/is-bissell-carpet-cleaner-toxic?utm_source=pinterest&utm_campaign=the-future-of-carpet,2025-05-22,What does the future of carpet cleaning look like? We explore the growing demand for non-toxic,sustainable cleaning solutions. Discover innovative technologies and eco-friendly alternatives that are changing the industry. #FutureOfCleaning #NonToxicTechnology #SustainableInnovation #EcoFriendlyFuture
Bissell Deep Cleaning: Risks & Rewards,https://res.cloudinary.com/dbcpfy04c/image/upload/v1747931076/pin_1_14_qpk0wv.webp,cleaning-tips,,https://www.beacleaner.com/is-bissell-carpet-cleaner-toxic?utm_source=pinterest&utm_campaign=bissell-deep-cleanin,2025-05-22,Weighing the pros and cons of Bissell deep cleaning. This post details the potential risks associated with the chemicals used,alongside the benefits of a deep clean. Make an informed decision for your home and family. #DeepCleanRisks #BissellBenefits #CleaningDebate #HomeHealth
Title,https://res.cloudinary.com/dbcpfy04c/image/upload/v1747931114/pin_2_1_a1bk2l.webp,please-provide-the-title-and-keywords-i-need-that-information-to-suggest-a-board-name-once,,https://www.beacleaner.com/how-to-clean-a-kohler-cast-iron-tub?utm_source=pinterest&utm_campaign=title,2025-05-22,Description,Keywords
Restore Your Kohler Tub's Shine ✨,https://res.cloudinary.com/dbcpfy04c/image/upload/v1747931120/pin_2_2_rhkvv7.webp,bathroom-cleaning-tips,,https://www.beacleaner.com/how-to-clean-a-kohler-cast-iron-tub?utm_source=pinterest&utm_campaign=restore-your-kohler-,2025-05-22,Is your Kohler cast iron tub looking dull & dingy? Don't replace it,REVIVE it! This guide reveals the *secret* to a sparkling clean tub
Kohler Cast Iron Tub: Deep Clean Guide,https://res.cloudinary.com/dbcpfy04c/image/upload/v1747931128/pin_2_3_z6lbrm.webp,bathroom-cleaning-tips,,https://www.beacleaner.com/how-to-clean-a-kohler-cast-iron-tub?utm_source=pinterest&utm_campaign=kohler-cast-iron-tub,2025-05-22,Dreaming of a spa-like bathroom? It starts with a pristine tub! This post breaks down exactly how to deep clean your Kohler cast iron tub,tackling even the toughest grime. We cover everything from choosing the right cleaners to preventing future stains. Don't let a dirty tub ruin your self-care routine – reclaim your relaxation space! Get the ultimate guide now. #CastIronCare #KohlerCleaning #BathroomMakeover #DeepCleaning
Soap Scum SOS: Kohler Tub Edition,https://res.cloudinary.com/dbcpfy04c/image/upload/v1747931135/pin_2_4_weoqoq.webp,bathroom-cleaning-tips,,https://www.beacleaner.com/how-to-clean-a-kohler-cast-iron-tub?utm_source=pinterest&utm_campaign=soap-scum-sos-kohler,2025-05-22,Is soap scum taking over your Kohler tub?  This post is your rescue mission! We reveal the best ways to dissolve and remove stubborn soap scum,leaving your tub sparkling clean and inviting.  Enjoy a truly relaxing bath again – it's easier than you think! Click for the full guide. #SoapScumRemoval #KohlerTub #BathroomHacks #CleaningMotivation
Hard Water Stains? Kohler Tub Fix!,https://res.cloudinary.com/dbcpfy04c/image/upload/v1747931143/pin_2_5_vvpkkf.webp,bathroom-cleaning-tips,,https://www.beacleaner.com/how-to-clean-a-kohler-cast-iron-tub?utm_source=pinterest&utm_campaign=hard-water-stains-ko,2025-05-22,Hard water stains ruining your Kohler tub's finish?  Don't despair! This guide provides simple,effective solutions to tackle those unsightly marks.  We'll show you how to restore your tub's shine and prevent future buildup.  Enjoy a beautiful
Kohler Tub Cleaning: Step-by-Step,https://res.cloudinary.com/dbcpfy04c/image/upload/v1747931150/pin_2_6_bf83ww.webp,bathroom-cleaning-tips,,https://www.beacleaner.com/how-to-clean-a-kohler-cast-iron-tub?utm_source=pinterest&utm_campaign=kohler-tub-cleaning-,2025-05-22,Need a clear,concise guide to cleaning your Kohler cast iron tub? Look no further! This post provides a step-by-step process
Protect Your Kohler Tub's Finish,https://res.cloudinary.com/dbcpfy04c/image/upload/v1747931157/pin_2_7_u8qaxt.webp,bathroom-tips,,https://www.beacleaner.com/how-to-clean-a-kohler-cast-iron-tub?utm_source=pinterest&utm_campaign=protect-your-kohler-,2025-05-22,Want to keep your Kohler cast iron tub looking its best for years to come? This guide focuses on preventative care,teaching you how to protect the enamel finish and avoid common damage.  A little maintenance goes a long way! Learn how to extend the life of your tub. #TubMaintenance #KohlerCare #CastIronProtection #BathroomPreservation
The Ultimate Kohler Tub Cleaning Checklist,https://res.cloudinary.com/dbcpfy04c/image/upload/v1747931163/pin_2_8_rtyyb5.webp,bathroom-cleaning-tips,,https://www.beacleaner.com/how-to-clean-a-kohler-cast-iron-tub?utm_source=pinterest&utm_campaign=the-ultimate-kohler-,2025-05-22,Don't miss a spot! This comprehensive checklist ensures you clean your Kohler cast iron tub thoroughly and efficiently.  From the faucet to the drain,we've got everything covered.  Get organized and get cleaning! #CleaningChecklist #KohlerTub #BathroomOrganization #DeepClean
Kohler Tub Cleaning: Before & After,https://res.cloudinary.com/dbcpfy04c/image/upload/v1747931169/pin_2_9_jgvklw.webp,bathroom-cleaning-tips,,https://www.beacleaner.com/how-to-clean-a-kohler-cast-iron-tub?utm_source=pinterest&utm_campaign=kohler-tub-cleaning-,2025-05-22,See the amazing transformation! This post features stunning before & after photos of a Kohler cast iron tub cleaning,showcasing the incredible results you can achieve.  Get inspired and start cleaning! #BeforeAndAfter #KohlerTub #TubTransformation #CleaningResults
Kohler Tub: Avoiding Common Mistakes,https://res.cloudinary.com/dbcpfy04c/image/upload/v1747931175/pin_2_10_nkb9mm.webp,bathroom-cleaning-tips,,https://www.beacleaner.com/how-to-clean-a-kohler-cast-iron-tub?utm_source=pinterest&utm_campaign=kohler-tub-avoiding-,2025-05-22,Don't make these common Kohler cast iron tub cleaning mistakes! This post highlights pitfalls to avoid,ensuring you protect your tub's finish and achieve the best possible results.  Learn from our mistakes and clean like a pro! #CleaningMistakes #KohlerTub #CastIronCare #BathroomAdvice
Kohler Tub Cleaning: Product Guide,https://res.cloudinary.com/dbcpfy04c/image/upload/v1747931180/pin_2_11_hwa3ho.webp,bathroom-cleaning-tips,,https://www.beacleaner.com/how-to-clean-a-kohler-cast-iron-tub?utm_source=pinterest&utm_campaign=kohler-tub-cleaning-,2025-05-22,Overwhelmed by cleaning product choices? This post provides a curated guide to the best cleaners for your Kohler cast iron tub,including recommendations for different types of stains and grime.  Shop smart and clean effectively! #CleaningProducts #KohlerTub #TubCleaner #BathroomEssentials
Kohler Tub: Restore Vintage Charm,https://res.cloudinary.com/dbcpfy04c/image/upload/v1747931187/pin_2_12_jgbg19.webp,vintage-bathroom-ideas,,https://www.beacleaner.com/how-to-clean-a-kohler-cast-iron-tub?utm_source=pinterest&utm_campaign=kohler-tub-restore-v,2025-05-22,Do you have a vintage Kohler cast iron tub? This guide focuses on restoring its original charm and beauty,preserving its history while ensuring a sparkling clean finish.  Love your vintage tub! #VintageTub #KohlerTub #CastIronRestoration #BathroomHistory
Kohler Tub Cleaning: The Power of Baking Soda,https://res.cloudinary.com/dbcpfy04c/image/upload/v1747931194/pin_2_13_jxhxpy.webp,bathroom-cleaning-tips,,https://www.beacleaner.com/how-to-clean-a-kohler-cast-iron-tub?utm_source=pinterest&utm_campaign=kohler-tub-cleaning-,2025-05-22,Unlock the cleaning power of baking soda! This post demonstrates how to use baking soda to effectively clean your Kohler cast iron tub,removing stains and odors naturally. #BakingSodaCleaning #KohlerTub #NaturalCleaning #DIYCleaning
Kohler Tub: Preventing Future Stains,https://res.cloudinary.com/dbcpfy04c/image/upload/v1747931201/pin_2_14_aopukq.webp,bathroom-tips,,https://www.beacleaner.com/how-to-clean-a-kohler-cast-iron-tub?utm_source=pinterest&utm_campaign=kohler-tub-preventin,2025-05-22,Stop stains before they start! This guide focuses on preventative measures to keep your Kohler cast iron tub looking its best,minimizing the need for harsh cleaning. #StainPrevention #KohlerTub #CastIronCare #BathroomTips
Kohler Tub Cleaning: A Luxurious Routine,https://res.cloudinary.com/dbcpfy04c/image/upload/v1747931206/pin_2_15_teh2sf.webp,bathroom-cleaning-tips,,https://www.beacleaner.com/how-to-clean-a-kohler-cast-iron-tub?utm_source=pinterest&utm_campaign=kohler-tub-cleaning-,2025-05-22,Transform your bathroom into a spa! This post outlines a luxurious Kohler cast iron tub cleaning routine,incorporating aromatherapy and self-care practices. #LuxuriousCleaning #KohlerTub #SpaBathroom #SelfCare
Kohler Tub: The Best Scrubbing Tools,https://res.cloudinary.com/dbcpfy04c/image/upload/v1747931215/pin_2_16_vgioe9.webp,cleaning-tips,,https://www.beacleaner.com/how-to-clean-a-kohler-cast-iron-tub?utm_source=pinterest&utm_campaign=kohler-tub-the-best-,2025-05-22,Choosing the right scrubbing tools is crucial! This post recommends the best brushes,sponges
Kohler Tub Cleaning: FAQs Answered,https://res.cloudinary.com/dbcpfy04c/image/upload/v1747931221/pin_2_17_c4fzit.webp,bathroom-cleaning-tips,,https://www.beacleaner.com/how-to-clean-a-kohler-cast-iron-tub?utm_source=pinterest&utm_campaign=kohler-tub-cleaning-,2025-05-22,Got questions about cleaning your Kohler cast iron tub? This post answers frequently asked questions,providing expert advice and troubleshooting tips. #FAQ #KohlerTub #CastIronCleaning #BathroomHelp
Kohler Tub: The Secret to a Long-Lasting Shine,https://res.cloudinary.com/dbcpfy04c/image/upload/v1747931227/pin_2_18_guqx8k.webp,cleaning-tips,,https://www.beacleaner.com/how-to-clean-a-kohler-cast-iron-tub?utm_source=pinterest&utm_campaign=kohler-tub-the-secre,2025-05-22,Want a Kohler tub that shines for years? This post reveals the secrets to maintaining a long-lasting shine,protecting your investment and enjoying a beautiful bathroom. #TubShine #KohlerTub #CastIronCare #BathroomLongevity
Kohler Tub Cleaning: Don't Forget the Drain!,https://res.cloudinary.com/dbcpfy04c/image/upload/v1747931233/pin_2_19_l3nvho.webp,bathroom-cleaning-tips,,https://www.beacleaner.com/how-to-clean-a-kohler-cast-iron-tub?utm_source=pinterest&utm_campaign=kohler-tub-cleaning-,2025-05-22,Often overlooked,the drain needs love too! This post shows you how to clean and deodorize your Kohler tub's drain
Title,https://res.cloudinary.com/dbcpfy04c/image/upload/v1747931279/pin_3_1_iqwf4w.webp,please-provide-the-title-and-keywords-i-need-that-information-to-suggest-a-board-name-once,,https://www.beacleaner.com/how-to-clean-a-peanut-butter-jar?utm_source=pinterest&utm_campaign=title,2025-05-22,Description,Keywords
Bye Bye Sticky! PB Jar Hack,https://res.cloudinary.com/dbcpfy04c/image/upload/v1747931285/pin_3_2_ptwhd9.webp,kitchen-tips-ideas,,https://www.beacleaner.com/how-to-clean-a-peanut-butter-jar?utm_source=pinterest&utm_campaign=bye-bye-sticky-pb-ja,2025-05-22,"Ugh, that last bit of peanut butter is SO good, but the jar? A sticky nightmare! Don't throw it away! This simple trick will have your peanut butter jar sparkling clean in minutes. No more struggling with stubborn residue or wasting perfectly good glass. Learn the magic of oil, hot water, and a little elbow grease. Save money, reduce waste, and enjoy a spotless kitchen! Click to learn how! You deserve a clean kitchen, and this is the easiest way to get it.","Peanut Butter,Cleaning Hacks,Jar Cleaning,Kitchen Tips"
Peanut Butter Jar Rescue! ✨,https://res.cloudinary.com/dbcpfy04c/image/upload/v1747931293/pin_3_3_eee6hh.webp,cleaning-tips,,https://www.beacleaner.com/how-to-clean-a-peanut-butter-jar?utm_source=pinterest&utm_campaign=peanut-butter-jar-re,2025-05-22,"Is your peanut butter jar a sticky mess? Don't despair! This guide shows you how to effortlessly clean even the most stubborn peanut butter residue. We're talking sparkling clean, ready for reuse! Imagine all the things you can repurpose that jar for – storage, crafts, even a cute vase! Stop dreading dishwashing and start enjoying a cleaner, more organized kitchen. Click to learn the secret!","Sticky Jars,Cleaning Tips,Repurpose Jars,Kitchen Organization"
Clean Peanut Butter Jars: The EASY Way!,https://res.cloudinary.com/dbcpfy04c/image/upload/v1747931301/pin_3_4_wokwp7.webp,cleaning-tips,,https://www.beacleaner.com/how-to-clean-a-peanut-butter-jar?utm_source=pinterest&utm_campaign=clean-peanut-butter-,2025-05-22,"Seriously, cleaning peanut butter jars doesn't have to be a chore! This method is quick, effective, and uses things you probably already have in your kitchen. We'll walk you through each step, with photos, so you can say goodbye to sticky frustration.  Plus, reusing jars is a fantastic way to be eco-friendly!  Don't let a little peanut butter stand between you and a sparkling clean kitchen. Click to learn more!","Easy Cleaning,Peanut Butter,Jar Hack,Eco Friendly"
From Sticky to Sparkling: PB Jar Clean,https://res.cloudinary.com/dbcpfy04c/image/upload/v1747931309/pin_3_5_xhk223.webp,cleaning-tips,,https://www.beacleaner.com/how-to-clean-a-peanut-butter-jar?utm_source=pinterest&utm_campaign=from-sticky-to-spark,2025-05-22,"Don't let a sticky peanut butter jar ruin your day! This guide provides a foolproof method for getting your jars perfectly clean, every time.  We'll show you how to loosen the peanut butter, scrub away the residue, and achieve a spotless finish.  Imagine the satisfaction of a perfectly clean kitchen!  Click to discover the secret to effortless jar cleaning. You'll wonder why you didn't try this sooner!","Jar Cleaning,Cleaning Motivation,Kitchen Hacks,Peanut Butter Residue"
Repurpose Your PB Jars! (Clean First!),https://res.cloudinary.com/dbcpfy04c/image/upload/v1747931315/pin_3_6_xik1g8.webp,jar-repurposing-ideas,,https://www.beacleaner.com/how-to-clean-a-peanut-butter-jar?utm_source=pinterest&utm_campaign=repurpose-your-pb-ja,2025-05-22,"Love peanut butter? Love saving money? Then you NEED to know how to properly clean your jars! This guide shows you how to get them sparkling clean so you can reuse them for storage, crafts, or anything else your heart desires.  Reduce waste, get organized, and feel good about doing your part for the environment. Click to learn the simple steps!","Jar Repurposing,Cleaning,DIY Storage,Peanut Butter"
The Ultimate PB Jar Cleaning Guide,https://res.cloudinary.com/dbcpfy04c/image/upload/v1747931322/pin_3_7_fwo3pc.webp,kitchen-cleaning-tips,,https://www.beacleaner.com/how-to-clean-a-peanut-butter-jar?utm_source=pinterest&utm_campaign=the-ultimate-pb-jar-,2025-05-22,Tired of struggling with sticky peanut butter jars? This is the ONLY guide you'll ever need! We cover everything from the best tools to use to the most effective cleaning methods.  Say goodbye to frustration and hello to a sparkling clean kitchen.  Don't waste another minute scrubbing! Click to learn the secrets to effortless jar cleaning.,"Cleaning Guide,Peanut Butter,Jar Cleaning,Kitchen Cleaning"
5-Minute PB Jar Clean: Seriously!,https://res.cloudinary.com/dbcpfy04c/image/upload/v1747931329/pin_3_8_qjwlpr.webp,cleaning-tips,,https://www.beacleaner.com/how-to-clean-a-peanut-butter-jar?utm_source=pinterest&utm_campaign=5-minute-pb-jar-clea,2025-05-22,Short on time? No problem! This method will have your peanut butter jar clean and sparkling in just 5 minutes.  We'll show you a quick and easy trick that works every time.  Don't let a little peanut butter stand between you and a clean kitchen. Click to learn the secret! You'll be amazed at how easy it is.,"Quick Cleaning,Peanut Butter,Jar Hack,Time Saving"
No More Sticky Fingers! PB Jar Clean,https://res.cloudinary.com/dbcpfy04c/image/upload/v1747931335/pin_3_9_mu6yvw.webp,kitchen-cleaning-tips,,https://www.beacleaner.com/how-to-clean-a-peanut-butter-jar?utm_source=pinterest&utm_campaign=no-more-sticky-finge,2025-05-22,"Is peanut butter the bane of your existence when it comes to cleaning? It doesn't have to be! This guide provides a simple, effective method for cleaning peanut butter jars without the sticky mess.  Enjoy your peanut butter guilt-free, knowing that cleanup will be a breeze. Click to learn more!","Sticky Mess,Cleaning,Peanut Butter,Kitchen Tips"
Sparkling Clean PB Jars: Step-by-Step,https://res.cloudinary.com/dbcpfy04c/image/upload/v1747931342/pin_3_10_dcttae.webp,cleaning-tips,,https://www.beacleaner.com/how-to-clean-a-peanut-butter-jar?utm_source=pinterest&utm_campaign=sparkling-clean-pb-j,2025-05-22,"Follow along with our easy-to-follow, step-by-step guide to cleaning peanut butter jars.  We'll show you exactly what to do, from start to finish, to achieve a perfectly clean result.  No more guesswork, no more frustration. Click to learn the secret to a spotless kitchen!","Step By Step,Cleaning,Peanut Butter,Jar Cleaning"
Peanut Butter Jar Cleaning SOS!,https://res.cloudinary.com/dbcpfy04c/image/upload/v1747931349/pin_3_11_ebg8oe.webp,cleaning-tips,,https://www.beacleaner.com/how-to-clean-a-peanut-butter-jar?utm_source=pinterest&utm_campaign=peanut-butter-jar-cl,2025-05-22,Help! My peanut butter jar is a disaster! Sound familiar? This guide is your rescue mission. We'll show you how to tackle even the most stubborn peanut butter residue with ease.  Don't let a sticky jar ruin your day. Click to learn the simple solution!,"Cleaning SOS,Peanut Butter,Jar Cleaning,Kitchen Rescue"
Oil is Your Friend: PB Jar Cleaning,https://res.cloudinary.com/dbcpfy04c/image/upload/v1747931357/pin_3_12_wjmwfi.webp,kitchen-tips,,https://www.beacleaner.com/how-to-clean-a-peanut-butter-jar?utm_source=pinterest&utm_campaign=oil-is-your-friend-p,2025-05-22,"Did you know oil is the secret weapon for cleaning peanut butter jars? This guide reveals how to use oil to loosen the peanut butter and make cleanup a breeze.  It's a simple, effective, and surprisingly satisfying method. Click to learn more!","Oil Cleaning,Peanut Butter,Jar Hack,Kitchen Tip"
Don't Throw It Away! Clean PB Jars,https://res.cloudinary.com/dbcpfy04c/image/upload/v1747931362/pin_3_13_jpba4j.webp,jar-repurpose-ideas,,https://www.beacleaner.com/how-to-clean-a-peanut-butter-jar?utm_source=pinterest&utm_campaign=dont-throw-it-away-c,2025-05-22,"Before you toss that peanut butter jar, read this! This guide shows you how to easily clean it and repurpose it for storage, crafts, or anything else you can imagine.  Reduce waste, save money, and get organized. Click to learn the simple steps!","Repurpose,Cleaning,Peanut Butter,Zero Waste"
The Secret to Spotless PB Jars,https://res.cloudinary.com/dbcpfy04c/image/upload/v1747931370/pin_3_14_tvv8mc.webp,kitchen-cleaning-tips,,https://www.beacleaner.com/how-to-clean-a-peanut-butter-jar?utm_source=pinterest&utm_campaign=the-secret-to-spotle,2025-05-22,"Want to know the secret to perfectly clean peanut butter jars? It's simpler than you think! This guide reveals the trick that will have your jars sparkling in no time.  Say goodbye to sticky residue and hello to a clean, organized kitchen. Click to learn more!","Cleaning Secret,Peanut Butter,Jar Cleaning,Kitchen Organization"
Peanut Butter Jar Cleaning: Pro Tips,https://res.cloudinary.com/dbcpfy04c/image/upload/v1747931377/pin_3_15_rn01ms.webp,cleaning-tips,,https://www.beacleaner.com/how-to-clean-a-peanut-butter-jar?utm_source=pinterest&utm_campaign=peanut-butter-jar-cl,2025-05-22,Take your peanut butter jar cleaning game to the next level with these pro tips! We'll share our best advice for tackling stubborn residue and achieving a spotless finish.  Don't settle for less than perfect. Click to learn more!,"Pro Tips,Cleaning,Peanut Butter,Jar Cleaning"
