Title,Media URL,Pinterest board,Thumbnail,Link,Publish date,Description,Keywords
Pet & Kid-Friendly Cleaning Solutions,https://res.cloudinary.com/dsxuwwnsc/image/upload/v1748921074/pin_3_13_go79n5.webp,safe-cleaning-tips,,https://www.beacleaner.com/how-to-get-printer-ink-out-of-carpet?utm_source=pinterest&utm_campaign=pet-kid-friendly-cle,2025-06-03,Concerned about harsh chemicals? 🐾 This pin highlights pet- and kid-friendly cleaning solutions for ink removal,ensuring a safe environment for your loved ones. Clean with peace of mind! Click to learn more. #PetFriendlyCleaning #KidSafeCleaning #NonToxicCleaning #SafeCleaning
Dealing with Stubborn Ink Stains,https://res.cloudinary.com/dsxuwwnsc/image/upload/v1748921081/pin_3_14_unklnq.webp,cleaning-tips,,https://www.beacleaner.com/how-to-get-printer-ink-out-of-carpet?utm_source=pinterest&utm_campaign=dealing-with-stubbor,2025-06-03,Some ink stains are more stubborn than others. 😩 This pin offers advanced techniques for tackling particularly difficult stains,including repeat applications and specialized solutions. Don't give up – we've got you covered! #StubbornStains #InkStainHelp #AdvancedCleaning #ToughStains
The Cost of Professional vs. DIY,https://res.cloudinary.com/dsxuwwnsc/image/upload/v1748921087/pin_3_15_wbirdw.webp,home-cleaning-tips,,https://www.beacleaner.com/how-to-get-printer-ink-out-of-carpet?utm_source=pinterest&utm_campaign=the-cost-of-professi,2025-06-03,Wondering if DIY is worth it? 💰 This pin compares the cost of professional carpet cleaning versus DIY ink removal,helping you make an informed decision. Save money and get the results you want! Click to see the breakdown. #DIYvsPro #CarpetCleaningCost #SaveMoney #CleaningBudget
Long-Term Carpet Care Tips,https://res.cloudinary.com/dsxuwwnsc/image/upload/v1748921095/pin_3_16_g6p1c8.webp,carpet-care-tips,,https://www.beacleaner.com/how-to-get-printer-ink-out-of-carpet?utm_source=pinterest&utm_campaign=long-term-carpet-car,2025-06-03,Keep your carpet looking its best! ✨ This pin offers long-term carpet care tips to prevent future stains and maintain a clean,healthy home. Invest in your carpet and enjoy years of beauty. Click to learn more! #CarpetCareTips #LongTermCleaning #HealthyHome #CarpetMaintenance
Emergency Ink Stain Kit,https://res.cloudinary.com/dsxuwwnsc/image/upload/v1748921103/pin_3_17_u5z8la.webp,cleaning-tips,,https://www.beacleaner.com/how-to-get-printer-ink-out-of-carpet?utm_source=pinterest&utm_campaign=emergency-ink-stain-,2025-06-03,Be prepared for anything! 🚨 This pin suggests creating an emergency ink stain kit with essential cleaning supplies,so you're always ready to tackle a spill. Click to see what to include! #EmergencyKit #CleaningSupplies #BePrepared #InkStainReady
Title,https://res.cloudinary.com/dsxuwwnsc/image/upload/v1748921145/pin_4_1_hmqseu.webp,please-provide-the-title-and-keywords-i-need-that-information-to-suggest-a-board-name-once,,https://www.beacleaner.com/how-to-clean-and-sanitize-a-used-couch?utm_source=pinterest&utm_campaign=title,2025-06-03,Description,Keywords
Used Couch? Don't Panic! ✨,https://res.cloudinary.com/dsxuwwnsc/image/upload/v1748921151/pin_4_2_meatfn.webp,couch-cleaning-tips,,https://www.beacleaner.com/how-to-clean-and-sanitize-a-used-couch?utm_source=pinterest&utm_campaign=used-couch-dont-pani,2025-06-03,Found the perfect used couch but worried about germs? 🦠 Don't let that stop you! This guide walks you through a deep clean & sanitize,making it feel brand new. Learn how to tackle stains
Couch Cleaning Checklist 📝,https://res.cloudinary.com/dsxuwwnsc/image/upload/v1748921157/pin_4_3_els5fu.webp,cleaning-tips,,https://www.beacleaner.com/how-to-clean-and-sanitize-a-used-couch?utm_source=pinterest&utm_campaign=couch-cleaning-check,2025-06-03,Bringing home a used couch is exciting! But first,a thorough cleaning is essential. This checklist breaks down every step
Bye Bye Couch Stains 👋,https://res.cloudinary.com/dsxuwwnsc/image/upload/v1748921163/pin_4_4_nuolwk.webp,cleaning-tips,,https://www.beacleaner.com/how-to-clean-and-sanitize-a-used-couch?utm_source=pinterest&utm_campaign=bye-bye-couch-stains,2025-06-03,Stains on a used couch got you down? 😩 Don't give up! This guide reveals the best stain removal techniques for every type of mess – from coffee spills to pet accidents.  Learn how to lift stains without damaging the fabric.  Restore your couch to its former glory and enjoy a beautiful,"stain-free seating area. Click to discover the stain-busting secrets! ✨"""
Sanitize Your Couch: Protect Your Family!,https://res.cloudinary.com/dsxuwwnsc/image/upload/v1748921169/pin_4_5_ypybfk.webp,cleaning-tips,,https://www.beacleaner.com/how-to-clean-and-sanitize-a-used-couch?utm_source=pinterest&utm_campaign=sanitize-your-couch-,2025-06-03,Worried about germs lurking on your used couch? 🦠 You should be! This post details how to effectively sanitize your sofa,eliminating bacteria and viruses.  Protect your loved ones
Deep Clean a Used Couch: Step-by-Step,https://res.cloudinary.com/dsxuwwnsc/image/upload/v1748921175/pin_4_6_y8objv.webp,cleaning-tips,,https://www.beacleaner.com/how-to-clean-and-sanitize-a-used-couch?utm_source=pinterest&utm_campaign=deep-clean-a-used-co,2025-06-03,Overwhelmed by the thought of cleaning a used couch? 🤯 Don't be! This step-by-step guide makes the process simple and manageable.  We'll walk you through each stage,"from prepping the couch to the final touches.  Get a professional-level clean without the professional price tag!  Click to learn how! 🧼"""
Odor Removal: Fresh Couch Smell!,https://res.cloudinary.com/dsxuwwnsc/image/upload/v1748921181/pin_4_7_snjtuk.webp,cleaning-tips,,https://www.beacleaner.com/how-to-clean-and-sanitize-a-used-couch?utm_source=pinterest&utm_campaign=odor-removal-fresh-c,2025-06-03,Is your used couch carrying unwanted odors? 👃 This guide reveals how to eliminate smells – from musty odors to pet smells – leaving your couch smelling fresh and inviting.  Learn about natural deodorizers and effective cleaning solutions.  Enjoy a cozy and pleasant seating area! Click to learn more! 🌸,"Odor Removal,Couch,Fresh Smell,Cleaning Hacks"
Vacuuming Your Couch Like a Pro 💨,https://res.cloudinary.com/dsxuwwnsc/image/upload/v1748921187/pin_4_8_ygvnql.webp,cleaning-tips,,https://www.beacleaner.com/how-to-clean-and-sanitize-a-used-couch?utm_source=pinterest&utm_campaign=vacuuming-your-couch,2025-06-03,Don't underestimate the power of vacuuming! This post shows you how to vacuum your used couch effectively,removing dust
Fabric-Specific Couch Cleaning 🛋️,https://res.cloudinary.com/dsxuwwnsc/image/upload/v1748921195/pin_4_9_x1k3rb.webp,couch-cleaning-tips,,https://www.beacleaner.com/how-to-clean-and-sanitize-a-used-couch?utm_source=pinterest&utm_campaign=fabric-specific-couc,2025-06-03,Different fabrics require different cleaning methods. This guide provides tailored cleaning instructions for various couch materials – from microfiber to leather.  Avoid damaging your couch with the wrong products or techniques.  Learn how to clean your couch safely and effectively! Click to find your fabric type! ✨,"Fabric Cleaning,Couch,Microfiber,Leather"
DIY Couch Cleaning Solutions 🍋,https://res.cloudinary.com/dsxuwwnsc/image/upload/v1748921202/pin_4_10_k5aawk.webp,cleaning-tips,,https://www.beacleaner.com/how-to-clean-and-sanitize-a-used-couch?utm_source=pinterest&utm_campaign=diy-couch-cleaning-s,2025-06-03,Skip the expensive cleaning products! This post shares DIY couch cleaning solutions using common household ingredients.  Save money and reduce your exposure to harsh chemicals.  Learn how to create effective cleaners that are safe for your family and the environment. Click to learn! 🌿,"DIY Cleaning,Couch,Natural Cleaning,Homemade"
Leather Couch Cleaning & Care ✨,https://res.cloudinary.com/dsxuwwnsc/image/upload/v1748921207/pin_4_11_mzzpfm.webp,home-cleaning-tips,,https://www.beacleaner.com/how-to-clean-and-sanitize-a-used-couch?utm_source=pinterest&utm_campaign=leather-couch-cleani,2025-06-03,Love your leather couch? Keep it looking its best with this guide to cleaning and conditioning. Learn how to remove dirt,stains
Microfiber Couch Cleaning Guide ☁️,https://res.cloudinary.com/dsxuwwnsc/image/upload/v1748921213/pin_4_12_q0dyrj.webp,cleaning-tips,,https://www.beacleaner.com/how-to-clean-and-sanitize-a-used-couch?utm_source=pinterest&utm_campaign=microfiber-couch-cle,2025-06-03,Microfiber couches are comfy but can be tricky to clean. This guide provides expert tips for cleaning and restoring your microfiber sofa.  Learn how to remove stains,revive the texture
Couch Cleaning for Pet Owners 🐾,https://res.cloudinary.com/dsxuwwnsc/image/upload/v1748921219/pin_4_13_malwjh.webp,cleaning-tips,,https://www.beacleaner.com/how-to-clean-and-sanitize-a-used-couch?utm_source=pinterest&utm_campaign=couch-cleaning-for-p,2025-06-03,Got pets? 🐶🐱 This guide tackles pet hair,odors
Is Steam Cleaning Right for Your Couch?,https://res.cloudinary.com/dsxuwwnsc/image/upload/v1748921229/pin_4_14_wnje0v.webp,home-cleaning-tips,,https://www.beacleaner.com/how-to-clean-and-sanitize-a-used-couch?utm_source=pinterest&utm_campaign=is-steam-cleaning-ri,2025-06-03,Considering steam cleaning your used couch? 🤔 This post explores the pros and cons of steam cleaning and helps you determine if it's the right choice for your fabric type.  Learn about potential risks and alternative cleaning methods. Click to learn! 💨,"Steam Cleaning,Couch,Fabric Care,Cleaning Methods"
Couch Sanitizing: Disinfecting 101 🦠,https://res.cloudinary.com/dsxuwwnsc/image/upload/v1748921235/pin_4_15_tpbiwm.webp,cleaning-tips,,https://www.beacleaner.com/how-to-clean-and-sanitize-a-used-couch?utm_source=pinterest&utm_campaign=couch-sanitizing-dis,2025-06-03,Beyond cleaning,"sanitizing is crucial for eliminating germs. This post explains the difference between cleaning and sanitizing and provides a guide to effectively disinfecting your used couch.  Protect your family from harmful bacteria and viruses! Click to learn! 🛡️"""
Quick Couch Refresh: 15-Minute Clean!,https://res.cloudinary.com/dsxuwwnsc/image/upload/v1748921241/pin_4_16_he5bms.webp,quick-cleaning-tips,,https://www.beacleaner.com/how-to-clean-and-sanitize-a-used-couch?utm_source=pinterest&utm_campaign=quick-couch-refresh-,2025-06-03,Short on time? ⏰ This guide offers a quick and easy couch refresh that you can complete in just 15 minutes.  Perfect for a quick tidy-up or a last-minute guest arrival.  Enjoy a cleaner couch with minimal effort! Click to learn! ⚡,"Quick Clean,Couch,Refresh,Cleaning Hacks"
Couch Cleaning Mistakes to Avoid ❌,https://res.cloudinary.com/dsxuwwnsc/image/upload/v1748921247/pin_4_17_pfswfg.webp,cleaning-tips,,https://www.beacleaner.com/how-to-clean-and-sanitize-a-used-couch?utm_source=pinterest&utm_campaign=couch-cleaning-mista,2025-06-03,Don't make these common couch cleaning mistakes! This post highlights errors that can damage your sofa and provides tips for avoiding them.  Protect your investment and ensure a long-lasting clean. Click to learn! ⚠️,"Couch Cleaning,Mistakes,Fabric Care,Cleaning Tips"
The Ultimate Couch Cleaning Toolkit 🧰,https://res.cloudinary.com/dsxuwwnsc/image/upload/v1748921253/pin_4_18_mdz2c0.webp,home-cleaning-tips,,https://www.beacleaner.com/how-to-clean-and-sanitize-a-used-couch?utm_source=pinterest&utm_campaign=the-ultimate-couch-c,2025-06-03,Wondering what cleaning supplies you need? This post lists the essential tools and products for cleaning and sanitizing your used couch.  Be prepared for any mess! Click to learn! 🧼,"Cleaning Toolkit,Couch,Supplies,Cleaning Products"
Revive a Sagging Couch Cushion 🪞,https://res.cloudinary.com/dsxuwwnsc/image/upload/v1748921262/pin_4_19_xobryx.webp,furniture-repair-tips,,https://www.beacleaner.com/how-to-clean-and-sanitize-a-used-couch?utm_source=pinterest&utm_campaign=revive-a-sagging-cou,2025-06-03,Are your couch cushions looking flat and lifeless? 😩 This guide shares tips for reviving sagging cushions and restoring their shape.  Enjoy a more comfortable and inviting seating area! Click to learn! 🌟,"Couch Cushions,Revive,Comfort,Furniture Repair"
Protect Your Couch: Fabric Guards 🛡️,https://res.cloudinary.com/dsxuwwnsc/image/upload/v1748921269/pin_4_20_krw5ef.webp,furniture-care-tips,,https://www.beacleaner.com/how-to-clean-and-sanitize-a-used-couch?utm_source=pinterest&utm_campaign=protect-your-couch-f,2025-06-03,Want to prevent future stains and damage? This post explores the benefits of fabric guards and provides recommendations for protecting your used couch.  Extend the life of your sofa and keep it looking its best! Click to learn! ✨,"Fabric Guard,Couch Protection,Stain Prevention,Furniture Care"
Couch Cleaning for Allergy Sufferers 🤧,https://res.cloudinary.com/dsxuwwnsc/image/upload/v1748921275/pin_4_21_ofw7aa.webp,cleaning-tips,,https://www.beacleaner.com/how-to-clean-and-sanitize-a-used-couch?utm_source=pinterest&utm_campaign=couch-cleaning-for-a,2025-06-03,Allergies acting up? 🤧 This guide focuses on cleaning your used couch to remove allergens and create a healthier living space.  Breathe easier and enjoy a comfortable home! Click to learn! 🌸,"Allergy Sufferers,Couch Cleaning,Allergens,Dust Mites"
Before & After: Couch Cleaning Transformation!,https://res.cloudinary.com/dsxuwwnsc/image/upload/v1748921281/pin_4_22_jc8syi.webp,cleaning-tips,,https://www.beacleaner.com/how-to-clean-and-sanitize-a-used-couch?utm_source=pinterest&utm_campaign=before-after-couch-c,2025-06-03,See the amazing results of a thorough couch cleaning! This post features before-and-after photos showcasing the transformative power of a deep clean.  Get inspired and tackle your own couch cleaning project! Click to see the transformation! 🤩,"Before & After,Couch Cleaning,Transformation,Cleaning Results"
Couch Cleaning: When to Call a Pro 🧑‍🔧,https://res.cloudinary.com/dsxuwwnsc/image/upload/v1748921288/pin_4_23_acr0qb.webp,home-cleaning-tips,,https://www.beacleaner.com/how-to-clean-and-sanitize-a-used-couch?utm_source=pinterest&utm_campaign=couch-cleaning-when-,2025-06-03,Sometimes,"a professional cleaning is the best option. This post helps you determine when it's time to call in the experts for your used couch.  Learn about the benefits of professional cleaning and how to find a reputable service. Click to learn! 💼"""
Extend Your Couch's Life: Care Tips ⏳,https://res.cloudinary.com/dsxuwwnsc/image/upload/v1748921294/pin_4_24_vkzpk5.webp,furniture-tips,,https://www.beacleaner.com/how-to-clean-and-sanitize-a-used-couch?utm_source=pinterest&utm_campaign=extend-your-couchs-l,2025-06-03,Want your couch to last for years to come? This post shares essential care tips for maintaining a clean and healthy sofa.  Protect your investment and enjoy a comfortable seating area for a long time! Click to learn! 💖,"Couch Care,Maintenance,Furniture,Long Lasting"
The Secret to a Spotless Couch ✨,https://res.cloudinary.com/dsxuwwnsc/image/upload/v1748921299/pin_4_25_yzzsh0.webp,cleaning-tips,,https://www.beacleaner.com/how-to-clean-and-sanitize-a-used-couch?utm_source=pinterest&utm_campaign=the-secret-to-a-spot,2025-06-03,Unlock the secrets to a truly spotless couch! This guide combines all the best cleaning and sanitizing techniques for a pristine seating area.  Impress your guests and enjoy a beautiful home! Click to learn! 🌟,"Spotless Couch,Cleaning Secrets,Sanitizing,Home Decor"
Title,https://res.cloudinary.com/dsxuwwnsc/image/upload/v1748921342/pin_5_1_ncmriv.webp,please-provide-the-title-and-keywords-i-need-that-information-to-suggest-a-board-name-once,,https://www.beacleaner.com/how-to-remove-mold-from-silicone-rubber?utm_source=pinterest&utm_campaign=title,2025-06-03,Description,Keywords
Bye Bye Mold! Silicone Rescue,https://res.cloudinary.com/dsxuwwnsc/image/upload/v1748921348/pin_5_2_v3dbin.webp,phone-cases-ideas,,https://www.beacleaner.com/how-to-remove-mold-from-silicone-rubber?utm_source=pinterest&utm_campaign=bye-bye-mold-silicon,2025-06-03,Is mold taking over your silicone baking mats,phone cases
Silicone Mold? Don't Panic!,https://res.cloudinary.com/dsxuwwnsc/image/upload/v1748921354/pin_5_3_tc1lie.webp,cleaning-tips,,https://www.beacleaner.com/how-to-remove-mold-from-silicone-rubber?utm_source=pinterest&utm_campaign=silicone-mold-dont-p,2025-06-03,Discover the surprisingly easy ways to remove mold from silicone! This post breaks down the process,offering solutions for everything from light surface mold to more stubborn growth. We cover safe cleaning methods
Silicone Cleaning: The Ultimate Guide,https://res.cloudinary.com/dsxuwwnsc/image/upload/v1748921360/pin_5_4_w5tevy.webp,cleaning-tips,,https://www.beacleaner.com/how-to-remove-mold-from-silicone-rubber?utm_source=pinterest&utm_campaign=silicone-cleaning-th,2025-06-03,Beyond just mold removal,this post is your complete resource for keeping silicone clean and hygienic.  We cover daily cleaning routines
Vinegar & Silicone: A Mold-Fighting Duo,https://res.cloudinary.com/dsxuwwnsc/image/upload/v1748921368/pin_5_5_uxb92w.webp,cleaning-tips,,https://www.beacleaner.com/how-to-remove-mold-from-silicone-rubber?utm_source=pinterest&utm_campaign=vinegar-silicone-a-m,2025-06-03,Harness the power of vinegar to eliminate mold on silicone! This post details how to use vinegar effectively and safely,along with other natural cleaning solutions.  Discover the benefits of this eco-friendly approach and enjoy a mold-free home.  Click to learn the simple steps and breathe easier! #VinegarCleaning #NaturalCleaning #MoldSolution #SiliconeTips
Baking Soda & Silicone: Mold's Worst Nightmare,https://res.cloudinary.com/dsxuwwnsc/image/upload/v1748921375/pin_5_6_cvfzoe.webp,cleaning-tips,,https://www.beacleaner.com/how-to-remove-mold-from-silicone-rubber?utm_source=pinterest&utm_campaign=baking-soda-silicone,2025-06-03,Baking soda isn't just for baking! Learn how this versatile ingredient can help you remove mold from silicone rubber. This guide provides a step-by-step process for a deep clean,leaving your silicone fresh and sanitized.  Click to discover this powerful cleaning combo! #BakingSodaCleaning #SiliconeSanitizer #MoldFree #CleaningTips
Silicone Mold Removal: Step-by-Step,https://res.cloudinary.com/dsxuwwnsc/image/upload/v1748921383/pin_5_7_g39xz4.webp,crafting-tips,,https://www.beacleaner.com/how-to-remove-mold-from-silicone-rubber?utm_source=pinterest&utm_campaign=silicone-mold-remova,2025-06-03,Confused about how to remove mold from silicone? This post offers a clear,concise
Prevent Mold on Silicone: Pro Tips,https://res.cloudinary.com/dsxuwwnsc/image/upload/v1748921393/pin_5_8_vwsuda.webp,cleaning-tips,,https://www.beacleaner.com/how-to-remove-mold-from-silicone-rubber?utm_source=pinterest&utm_campaign=prevent-mold-on-sili,2025-06-03,Don't just *remove* mold,prevent it from growing in the first place! This post shares expert tips for keeping your silicone items clean
Deep Cleaning Silicone: Get Rid of Mold!,https://res.cloudinary.com/dsxuwwnsc/image/upload/v1748921402/pin_5_9_dpkdxt.webp,cleaning-tips,,https://www.beacleaner.com/how-to-remove-mold-from-silicone-rubber?utm_source=pinterest&utm_campaign=deep-cleaning-silico,2025-06-03,Give your silicone a thorough cleaning with this comprehensive guide. We cover everything from surface mold to deep-seated growth,offering solutions for all levels of contamination.  Restore your silicone to its original condition and enjoy peace of mind. Click to learn more! #DeepCleaning #SiliconeRubber #MoldRemovalTips #HomeCare
Silicone Phone Case Mold? Here's How!,https://res.cloudinary.com/dsxuwwnsc/image/upload/v1748921409/pin_5_10_tecmbp.webp,tech-cleaning-tips,,https://www.beacleaner.com/how-to-remove-mold-from-silicone-rubber?utm_source=pinterest&utm_campaign=silicone-phone-case-,2025-06-03,Is your phone case looking a little green? Don't replace it! This post specifically addresses mold on silicone phone cases,offering safe and effective cleaning methods.  Protect your phone and your health – click to learn how! #PhoneCaseCleaning #SiliconeCase #MoldOnPhone #TechCleaning
Silicone Baking Mat Mold: Safe Cleaning,https://res.cloudinary.com/dsxuwwnsc/image/upload/v1748921416/pin_5_11_cehcam.webp,baking-tips,,https://www.beacleaner.com/how-to-remove-mold-from-silicone-rubber?utm_source=pinterest&utm_campaign=silicone-baking-mat-,2025-06-03,Keep your baking a joy,not a health hazard! This post focuses on removing mold from silicone baking mats
Dish Soap & Silicone: A Simple Solution,https://res.cloudinary.com/dsxuwwnsc/image/upload/v1748921423/pin_5_12_yk1pjs.webp,cleaning-tips,,https://www.beacleaner.com/how-to-remove-mold-from-silicone-rubber?utm_source=pinterest&utm_campaign=dish-soap-silicone-a,2025-06-03,Sometimes,the simplest solutions are the best! This post explores how dish soap can effectively remove mold from silicone rubber.  Learn the proper technique and enjoy a quick and easy cleaning process. Click to read now! #DishSoapCleaning #SiliconeCleaning #SimpleCleaning #HomeMaintenance
Mold on Silicone Utensils? Don't Worry!,https://res.cloudinary.com/dsxuwwnsc/image/upload/v1748921430/pin_5_13_p9nvqv.webp,kitchen-tips,,https://www.beacleaner.com/how-to-remove-mold-from-silicone-rubber?utm_source=pinterest&utm_campaign=mold-on-silicone-ute,2025-06-03,Your kitchen utensils deserve a good cleaning! This post provides guidance on removing mold from silicone spatulas,whisks
Silicone Baby Products & Mold: Safety First!,https://res.cloudinary.com/dsxuwwnsc/image/upload/v1748921438/pin_5_14_rfgns4.webp,baby-safety-tips,,https://www.beacleaner.com/how-to-remove-mold-from-silicone-rubber?utm_source=pinterest&utm_campaign=silicone-baby-produc,2025-06-03,Protect your little one! This post addresses the important topic of mold on silicone baby products,offering safe and effective cleaning methods.  Ensure your baby's items are hygienic and free from harmful mold. Click to learn more! #BabyProducts #SiliconeBaby #MoldSafety #ParentingTips
Silicone Sealant Mold: How to Clean It,https://res.cloudinary.com/dsxuwwnsc/image/upload/v1748921446/pin_5_15_nnmjaw.webp,home-repair-tips,,https://www.beacleaner.com/how-to-remove-mold-from-silicone-rubber?utm_source=pinterest&utm_campaign=silicone-sealant-mol,2025-06-03,Mold growing on your silicone sealant? This post provides specific instructions for cleaning and restoring it. Learn how to prevent further growth and maintain a clean,watertight seal. Click to learn more! #SiliconeSealant #MoldOnSealant #BathroomCleaning #HomeRepair
Silicone vs. Other Materials: Mold Resistance,https://res.cloudinary.com/dsxuwwnsc/image/upload/v1748921452/pin_5_16_m7essk.webp,mold-resistance-tips,,https://www.beacleaner.com/how-to-remove-mold-from-silicone-rubber?utm_source=pinterest&utm_campaign=silicone-vs-other-ma,2025-06-03,How does silicone stack up against other materials when it comes to mold resistance? This post compares silicone to plastic,rubber
Silicone Mold: What NOT to Do!,https://res.cloudinary.com/dsxuwwnsc/image/upload/v1748921459/pin_5_17_jrzq2k.webp,cleaning-tips,,https://www.beacleaner.com/how-to-remove-mold-from-silicone-rubber?utm_source=pinterest&utm_campaign=silicone-mold-what-n,2025-06-03,Avoid common mistakes that can worsen mold growth or damage your silicone. This post outlines what *not* to do when cleaning mold from silicone,ensuring a safe and effective process. Click to learn the don'ts! #CleaningMistakes #SiliconeCare #MoldPrevention #HomeTips
Silicone Mold: A Comprehensive FAQ,https://res.cloudinary.com/dsxuwwnsc/image/upload/v1748921464/pin_5_18_d55h7v.webp,cleaning-tips,,https://www.beacleaner.com/how-to-remove-mold-from-silicone-rubber?utm_source=pinterest&utm_campaign=silicone-mold-a-comp,2025-06-03,Got questions about mold on silicone? This post answers frequently asked questions,providing clear and concise information.  Get all your concerns addressed in one place. Click to find the answers! #SiliconeFAQ #MoldQuestions #CleaningAnswers #HomeHelp
