Title,Media URL,Pinterest board,Thumbnail,Link,Publish date,Description,Keywords
Roomba Side Brush: Easy DIY Fix,https://res.cloudinary.com/dbcpfy04c/image/upload/v1748759767/pin_3_17_tnhpij.webp,robot-repair-tips,,https://www.beacleaner.com/irobot-roomba-side-brush-not-spinning?utm_source=pinterest&utm_campaign=roomba-side-brush-ea,2025-06-01,Fix your Roomba side brush yourself! This pin links to a guide on a simple DIY repair.  No special tools required!  Save money and time with our easy-to-follow instructions.  Empower yourself to tackle common Roomba issues.,Roomba
Roomba Side Brush: Don't Give Up!,https://res.cloudinary.com/dbcpfy04c/image/upload/v1748759772/pin_3_18_ycgr0m.webp,robot-repair-tips,,https://www.beacleaner.com/irobot-roomba-side-brush-not-spinning?utm_source=pinterest&utm_campaign=roomba-side-brush-do,2025-06-01,Don't give up on your Roomba! This pin links to a guide on fixing a non-spinning side brush.  We'll help you revive your robot vacuum.  A little effort can save you a lot of money and hassle.  Get back to enjoying a clean home with our expert advice.,Roomba
Roomba Side Brush: Quick Check List,https://res.cloudinary.com/dbcpfy04c/image/upload/v1748759780/pin_3_19_gans3x.webp,robot-repair-tips,,https://www.beacleaner.com/irobot-roomba-side-brush-not-spinning?utm_source=pinterest&utm_campaign=roomba-side-brush-qu,2025-06-01,Quickly diagnose your Roomba's side brush issue! This pin links to a checklist of things to check before you start repairs.  Save time and frustration!  Identify the problem quickly and get your Roomba back to work.,Roomba
Roomba Side Brush: The Ultimate Guide,https://res.cloudinary.com/dbcpfy04c/image/upload/v1748759789/pin_3_20_jmgmn6.webp,robot-repair-tips,,https://www.beacleaner.com/irobot-roomba-side-brush-not-spinning?utm_source=pinterest&utm_campaign=roomba-side-brush-th,2025-06-01,The ultimate guide to fixing your Roomba's side brush! This pin links to a comprehensive resource covering all aspects of troubleshooting and repair.  Everything you need to know in one place!  Become a Roomba repair expert with our detailed guide.,Roomba
Roomba Side Brush: Stop the Frustration,https://res.cloudinary.com/dbcpfy04c/image/upload/v1748759795/pin_3_21_eo507t.webp,robot-repair-tips,,https://www.beacleaner.com/irobot-roomba-side-brush-not-spinning?utm_source=pinterest&utm_campaign=roomba-side-brush-st,2025-06-01,Stop the frustration of a non-spinning Roomba side brush! This pin links to a guide that will help you fix the issue quickly and easily.  Get back to enjoying a clean home without the stress.  We'll walk you through the process,step-by-step.
Roomba Side Brush: Extend its Life,https://res.cloudinary.com/dbcpfy04c/image/upload/v1748759801/pin_3_22_kz1rhw.webp,robot-repair-tips,,https://www.beacleaner.com/irobot-roomba-side-brush-not-spinning?utm_source=pinterest&utm_campaign=roomba-side-brush-ex,2025-06-01,Want to extend the life of your Roomba's side brush? This pin links to a guide on proper maintenance and care.  Preventative measures are key!  Keep your Roomba running smoothly for years to come with our expert tips.,Roomba
Roomba Side Brush: Save Time Cleaning,https://res.cloudinary.com/dbcpfy04c/image/upload/v1748759806/pin_3_23_csuqqn.webp,robot-repair-tips,,https://www.beacleaner.com/irobot-roomba-side-brush-not-spinning?utm_source=pinterest&utm_campaign=roomba-side-brush-sa,2025-06-01,A spinning side brush saves you time! This pin links to a guide on fixing a non-spinning brush so you can get back to enjoying a clean home.  Don't let a simple issue slow you down.  Get your Roomba back to peak performance today!,Roomba
Roomba Side Brush: Expert Advice,https://res.cloudinary.com/dbcpfy04c/image/upload/v1748759812/pin_3_24_llomuk.webp,robot-repair-tips,,https://www.beacleaner.com/irobot-roomba-side-brush-not-spinning?utm_source=pinterest&utm_campaign=roomba-side-brush-ex,2025-06-01,Get expert advice on fixing your Roomba's side brush! This pin links to a guide written by cleaning professionals.  Trustworthy information you can rely on.  Don't waste time with unreliable sources – get the facts from the experts.,Roomba
Roomba Side Brush: Is it Worth Fixing?,https://res.cloudinary.com/dbcpfy04c/image/upload/v1748759819/pin_3_25_ukv1lh.webp,robot-repair-tips,,https://www.beacleaner.com/irobot-roomba-side-brush-not-spinning?utm_source=pinterest&utm_campaign=roomba-side-brush-is,2025-06-01,Is it worth fixing your Roomba's side brush? This pin links to a guide that helps you determine if a repair is cost-effective.  Make an informed decision!  We'll help you weigh your options and choose the best course of action.,Roomba
Title,https://res.cloudinary.com/dbcpfy04c/image/upload/v1748759863/pin_4_1_avprvg.webp,please-provide-the-title-and-keywords-i-need-that-information-to-suggest-a-board-name-once,,https://www.beacleaner.com/why-is-my-vacuum-so-hard-to-push?utm_source=pinterest&utm_campaign=title,2025-06-01,Description,Keywords
Vacuum Hard to Push? Fix It!,https://res.cloudinary.com/dbcpfy04c/image/upload/v1748759869/pin_4_2_kriz0e.webp,cleaning-tips,,https://www.beacleaner.com/why-is-my-vacuum-so-hard-to-push?utm_source=pinterest&utm_campaign=vacuum-hard-to-push-,2025-06-01,Is your vacuum feeling like a workout? Don't struggle! This guide reveals the sneaky reasons why your vacuum is so hard to push – from a full bag to a clogged hose. We'll walk you through simple troubleshooting steps to restore its glide and save your back!  Learn how to easily identify and fix common issues,extending the life of your vacuum and making cleaning a breeze.  Stop dreading vacuuming and start enjoying a cleaner home! Click to learn more and reclaim your cleaning sanity. #VacuumRepair #CleaningHacks #HomeMaintenance #VacuumTips
Vacuuming Shouldn't Be This Hard!,https://res.cloudinary.com/dbcpfy04c/image/upload/v1748759875/pin_4_3_m2rdvb.webp,cleaning-tips-ideas,,https://www.beacleaner.com/why-is-my-vacuum-so-hard-to-push?utm_source=pinterest&utm_campaign=vacuuming-shouldnt-b,2025-06-01,Tired of wrestling with your vacuum? You deserve a cleaning experience that *doesn't* leave you exhausted! This post dives deep into why your vacuum might be resisting your efforts. We cover everything from brushroll tangles to filter blockages,and even potential motor issues.  Don't replace your vacuum just yet – we'll help you diagnose the problem and get it moving smoothly again.  A little effort can save you money and a lot of strain! Read now! #DifficultVacuum #VacuumProblems #CleaningTips #HomeCleaning
Full Bag = Heavy Push! (Fix It!),https://res.cloudinary.com/dbcpfy04c/image/upload/v1748759883/pin_4_4_g9vnjo.webp,baby-feeding-tips,,https://www.beacleaner.com/why-is-my-vacuum-so-hard-to-push?utm_source=pinterest&utm_campaign=full-bag-heavy-push-,2025-06-01,Did you know a full vacuum bag or canister can drastically increase push resistance? It's a common culprit! This pin highlights the importance of regular emptying. We explain how to check your bag/canister,the signs of fullness
Brushroll Troubles? We Can Help!,https://res.cloudinary.com/dbcpfy04c/image/upload/v1748759891/pin_4_5_wwcyom.webp,cleaning-tips,,https://www.beacleaner.com/why-is-my-vacuum-so-hard-to-push?utm_source=pinterest&utm_campaign=brushroll-troubles-w,2025-06-01,Is your vacuum's brushroll tangled with hair and debris? That's a major reason for increased push resistance! This pin shows you how to safely and effectively clean your brushroll,restoring its spinning power and making vacuuming effortless.  Say goodbye to frustrating tangles and hello to a spotless floor!  Click to learn the best brushroll cleaning techniques. #BrushrollCleaning #VacuumMaintenance #HairRemoval #CleaningGuide
Filter Fix: Breathe Easy & Vacuum!,https://res.cloudinary.com/dbcpfy04c/image/upload/v1748759899/pin_4_6_udyj4y.webp,cleaning-tips,,https://www.beacleaner.com/why-is-my-vacuum-so-hard-to-push?utm_source=pinterest&utm_campaign=filter-fix-breathe-e,2025-06-01,A dirty vacuum filter restricts airflow,making your vacuum work harder and harder to push. This pin emphasizes the importance of regular filter cleaning or replacement. We explain different filter types and how to maintain them for optimal performance.  Improve your air quality *and* your vacuum's efficiency!  Read the post for a step-by-step guide. #VacuumFilter #AirQuality #CleaningForHealth #HomeImprovement
Vacuum Too Heavy? Consider This!,https://res.cloudinary.com/dbcpfy04c/image/upload/v1748759905/pin_4_7_znlbzl.webp,cleaning-tips,,https://www.beacleaner.com/why-is-my-vacuum-so-hard-to-push?utm_source=pinterest&utm_campaign=vacuum-too-heavy-con,2025-06-01,Is your vacuum just plain heavy? This pin explores the weight factor and offers solutions,from choosing a lighter model to optimizing your cleaning technique.  Don't let a bulky vacuum strain your back!  We'll help you find a comfortable and efficient cleaning solution.  Click to read more about vacuum weight and ergonomics. #LightweightVacuum #VacuumWeight #ErgonomicCleaning #CleaningComfort
Motor Issues: When to Call a Pro,https://res.cloudinary.com/dbcpfy04c/image/upload/v1748759911/pin_4_8_laoghg.webp,vacuum-tips,,https://www.beacleaner.com/why-is-my-vacuum-so-hard-to-push?utm_source=pinterest&utm_campaign=motor-issues-when-to,2025-06-01,Sometimes,a vacuum that's hard to push signals a more serious motor problem. This pin helps you identify potential motor issues and determine when it's time to call a professional.  Don't risk damaging your vacuum further!  We'll help you assess the situation and make the right decision.  Read the full article for expert advice. #VacuumMotor #VacuumRepairService #HomeApplianceRepair #VacuumHelp
Vacuum Belt Problems: A Common Cause,https://res.cloudinary.com/dbcpfy04c/image/upload/v1748759918/pin_4_9_qqodwz.webp,cleaning-tips,,https://www.beacleaner.com/why-is-my-vacuum-so-hard-to-push?utm_source=pinterest&utm_campaign=vacuum-belt-problems,2025-06-01,A worn or broken vacuum belt can significantly increase push resistance. This pin explains how to check and replace your vacuum belt,restoring its suction power and making vacuuming easier.  A simple fix can make a huge difference!  Click to learn how to keep your vacuum belt in top condition. #VacuumBelt #VacuumParts #DIYRepair #CleaningMaintenance
Pet Hair & Vacuum Resistance,https://res.cloudinary.com/dbcpfy04c/image/upload/v1748759923/pin_4_10_xsl1xk.webp,cleaning-tips,,https://www.beacleaner.com/why-is-my-vacuum-so-hard-to-push?utm_source=pinterest&utm_campaign=pet-hair-vacuum-resi,2025-06-01,Pet owners,this one's for you! Pet hair is a notorious culprit for clogging vacuums and increasing push resistance. This pin offers specific tips for dealing with pet hair
Vacuum Wheels: Are They Stuck?,https://res.cloudinary.com/dbcpfy04c/image/upload/v1748759929/pin_4_11_bduwqr.webp,cleaning-tips-ideas,,https://www.beacleaner.com/why-is-my-vacuum-so-hard-to-push?utm_source=pinterest&utm_campaign=vacuum-wheels-are-th,2025-06-01,Don't overlook the wheels! Stuck or clogged vacuum wheels can make your vacuum incredibly difficult to push. This pin shows you how to inspect and clean your vacuum wheels,ensuring smooth gliding action.  A small detail can make a big difference!  Click to learn how to keep your vacuum rolling. #VacuumWheels #VacuumCleaning #HomeCleaningTips #EasyVacuuming
Deep Dive: Vacuum Airflow Explained,https://res.cloudinary.com/dbcpfy04c/image/upload/v1748759935/pin_4_12_xzb5kr.webp,cleaning-tips,,https://www.beacleaner.com/why-is-my-vacuum-so-hard-to-push?utm_source=pinterest&utm_campaign=deep-dive-vacuum-air,2025-06-01,Understanding airflow is key to diagnosing vacuum problems. This pin explains how airflow works in a vacuum and how blockages can disrupt it,leading to increased push resistance.  Learn the science behind your vacuum!  Read the full article for a comprehensive explanation. #VacuumAirflow #VacuumScience #CleaningTechnology #HomeTech
Is Your Vacuum Old? Time for an Upgrade?,https://res.cloudinary.com/dbcpfy04c/image/upload/v1748759944/pin_4_13_ducfwu.webp,cleaning-tips,,https://www.beacleaner.com/why-is-my-vacuum-so-hard-to-push?utm_source=pinterest&utm_campaign=is-your-vacuum-old-t,2025-06-01,Sometimes,an old vacuum simply can't keep up. This pin explores the signs that it's time to replace your vacuum
Vacuum Maintenance Checklist (Free!),https://res.cloudinary.com/dbcpfy04c/image/upload/v1748759952/pin_4_14_mlpbab.webp,cleaning-tips,,https://www.beacleaner.com/why-is-my-vacuum-so-hard-to-push?utm_source=pinterest&utm_campaign=vacuum-maintenance-c,2025-06-01,Keep your vacuum in top shape with our free maintenance checklist! This pin promotes a downloadable checklist that covers all the essential steps for preventing vacuum problems,including push resistance.  Proactive maintenance saves time and money!  Download your free checklist now. #VacuumChecklist #CleaningSchedule #HomeMaintenanceTips #FreeDownload
Stop Struggling,https://res.cloudinary.com/dbcpfy04c/image/upload/v1748759958/pin_4_15_tkgktm.webp,cleaning-tips,,https://www.beacleaner.com/why-is-my-vacuum-so-hard-to-push?utm_source=pinterest&utm_campaign=stop-struggling,2025-06-01,Start Cleaning!,Feeling frustrated with your vacuum? You're not alone! This pin offers a quick overview of the most common reasons why a vacuum is hard to push
Beyond the Bag: Hidden Vacuum Issues,https://res.cloudinary.com/dbcpfy04c/image/upload/v1748759963/pin_4_16_qt34k1.webp,cleaning-tips,,https://www.beacleaner.com/why-is-my-vacuum-so-hard-to-push?utm_source=pinterest&utm_campaign=beyond-the-bag-hidde,2025-06-01,This pin goes beyond the obvious culprits (bag,hose) and explores less common reasons why a vacuum might be hard to push
Don't Ignore These Vacuum Warning Signs!,https://res.cloudinary.com/dbcpfy04c/image/upload/v1748759969/pin_4_17_j9n8ij.webp,cleaning-tips,,https://www.beacleaner.com/why-is-my-vacuum-so-hard-to-push?utm_source=pinterest&utm_campaign=dont-ignore-these-va,2025-06-01,This pin highlights the early warning signs that your vacuum is struggling,before it becomes incredibly difficult to push.  Catch problems early!  Click to learn what to look for and prevent major issues. #VacuumWarningSigns #PreventativeMaintenance #HomeCleaning #EarlyDetection
Is Your Vacuum Suction Weak? It's Connected!,https://res.cloudinary.com/dbcpfy04c/image/upload/v1748759975/pin_4_18_zlzdzq.webp,cleaning-tips,,https://www.beacleaner.com/why-is-my-vacuum-so-hard-to-push?utm_source=pinterest&utm_campaign=is-your-vacuum-sucti,2025-06-01,Weak suction often goes hand-in-hand with increased push resistance. This pin explains the connection and offers solutions for restoring suction power.  Improve suction,reduce effort!  Read the full article for a comprehensive guide. #VacuumSuction #CleaningPower #HomeCleaning #VacuumRepair
Vacuuming Made Easy: Your Guide Starts Here!,https://res.cloudinary.com/dbcpfy04c/image/upload/v1748759981/pin_4_19_x8lpnj.webp,cleaning-tips-ideas,,https://www.beacleaner.com/why-is-my-vacuum-so-hard-to-push?utm_source=pinterest&utm_campaign=vacuuming-made-easy-,2025-06-01,This pin serves as a gateway to the blog post,promising a comprehensive guide to fixing a vacuum that's hard to push.  Stop struggling and start enjoying a cleaner home!  Click to read the full article and reclaim your cleaning sanity. #VacuumGuide #CleaningHelp #HomeCleaningTips #EasyCleaning
Title,https://res.cloudinary.com/dbcpfy04c/image/upload/v1748760027/pin_5_1_pqvafy.webp,please-provide-the-title-and-keywords-i-need-that-information-to-suggest-a-board-name-once,,https://www.beacleaner.com/vacuum-not-working-while-on-carpet?utm_source=pinterest&utm_campaign=title,2025-06-01,Description,Keywords
Vacuum on Carpet Fail? Fix It!,https://res.cloudinary.com/dbcpfy04c/image/upload/v1748760037/pin_5_2_bhmew9.webp,cleaning-tips,,https://www.beacleaner.com/vacuum-not-working-while-on-carpet?utm_source=pinterest&utm_campaign=vacuum-on-carpet-fai,2025-06-01,Is your vacuum losing suction on carpets? Don't replace it yet! This guide walks you through common issues like clogged hoses,full bags
Vacuum Not Picking Up? 5 Quick Fixes,https://res.cloudinary.com/dbcpfy04c/image/upload/v1748760043/pin_5_3_pho38n.webp,cleaning-tips,,https://www.beacleaner.com/vacuum-not-working-while-on-carpet?utm_source=pinterest&utm_campaign=vacuum-not-picking-u,2025-06-01,Don't let a struggling vacuum ruin your cleaning routine! Discover 5 fast fixes for when your vacuum loses suction on carpets. From simple clogs to brushroll issues,we'll show you how to diagnose & resolve the problem quickly. Imagine the satisfaction of a perfectly clean carpet again! Click to read the full guide and reclaim your cleaning power. Stop stressing
Brushroll Not Spinning? Here's Why!,https://res.cloudinary.com/dbcpfy04c/image/upload/v1748760052/pin_5_4_me6kng.webp,cleaning-tips,,https://www.beacleaner.com/vacuum-not-working-while-on-carpet?utm_source=pinterest&utm_campaign=brushroll-not-spinni,2025-06-01,A non-spinning brushroll is a common culprit for poor carpet cleaning. This pin details how to identify if your brushroll is the issue & provides step-by-step instructions for fixing it. Don't let tangled hair & debris defeat you! Learn how to clear obstructions & restore your vacuum's deep-cleaning ability. Click for a cleaner,fresher home!
Vacuum Losing Suction on Carpet?,https://res.cloudinary.com/dbcpfy04c/image/upload/v1748760059/pin_5_5_ryvpwl.webp,cleaning-tips,,https://www.beacleaner.com/vacuum-not-working-while-on-carpet?utm_source=pinterest&utm_campaign=vacuum-losing-suctio,2025-06-01,Is your vacuum struggling to lift dirt from your carpets? It's incredibly frustrating! This pin highlights the most common causes of suction loss & offers practical solutions. We'll help you pinpoint the problem & get your vacuum working like new. Click to read the full article & enjoy a cleaner,healthier home. Don't give up on your vacuum!
Clogged Vacuum Hose? Easy Fix!,https://res.cloudinary.com/dbcpfy04c/image/upload/v1748760066/pin_5_6_bxforq.webp,cleaning-tips,,https://www.beacleaner.com/vacuum-not-working-while-on-carpet?utm_source=pinterest&utm_campaign=clogged-vacuum-hose-,2025-06-01,A clogged hose is a sneaky cause of vacuum failure. This pin shows you how to easily identify & clear a blocked hose,restoring your vacuum's suction power. Don't waste time with a weak vacuum! Click to learn the simple steps to unclog your hose & enjoy a powerful clean. A clear hose = a happy home!
Full Vacuum Bag/Bin? Empty It Now!,https://res.cloudinary.com/dbcpfy04c/image/upload/v1748760072/pin_5_7_djt19s.webp,cleaning-tips,,https://www.beacleaner.com/vacuum-not-working-while-on-carpet?utm_source=pinterest&utm_campaign=full-vacuum-bagbin-e,2025-06-01,It seems obvious,but a full bag or bin drastically reduces suction. This pin reminds you to regularly empty your vacuum & explains how it impacts performance. Don't let a full container ruin your cleaning efforts! Click to learn how to maintain optimal suction & keep your carpets spotless. Simple maintenance
Vacuum Filter Dirty? Replace It!,https://res.cloudinary.com/dbcpfy04c/image/upload/v1748760079/pin_5_8_invjrg.webp,cleaning-tips,,https://www.beacleaner.com/vacuum-not-working-while-on-carpet?utm_source=pinterest&utm_campaign=vacuum-filter-dirty-,2025-06-01,A dirty filter restricts airflow & reduces suction. This pin explains the importance of regular filter replacement & how to choose the right filter for your vacuum. Breathe easier with a clean filter! Click to learn how to improve your vacuum's performance & air quality. Your lungs will thank you!,vacuum filter
Vacuum Belt Broken? Quick Replacement!,https://res.cloudinary.com/dbcpfy04c/image/upload/v1748760085/pin_5_9_vsvebz.webp,cleaning-tips,,https://www.beacleaner.com/vacuum-not-working-while-on-carpet?utm_source=pinterest&utm_campaign=vacuum-belt-broken-q,2025-06-01,A broken vacuum belt can stop the brushroll from spinning. This pin shows you how to easily replace a broken belt & get your vacuum back to deep cleaning. Don't let a broken belt ruin your carpet cleaning! Click for a step-by-step guide & enjoy a spotless home.,vacuum belt
Vacuum Smells Bad? Deodorize It!,https://res.cloudinary.com/dbcpfy04c/image/upload/v1748760092/pin_5_10_fjoxgo.webp,cleaning-tips,,https://www.beacleaner.com/vacuum-not-working-while-on-carpet?utm_source=pinterest&utm_campaign=vacuum-smells-bad-de,2025-06-01,Is your vacuum emitting an unpleasant odor? This pin offers simple tips for deodorizing your vacuum & eliminating unwanted smells. Enjoy a fresh-smelling home with a clean vacuum! Click to learn how to banish odors & keep your vacuum smelling its best.,vacuum odor
Vacuum Won't Turn On? Troubleshooting!,https://res.cloudinary.com/dbcpfy04c/image/upload/v1748760099/pin_5_11_kfja7x.webp,cleaning-tips,,https://www.beacleaner.com/vacuum-not-working-while-on-carpet?utm_source=pinterest&utm_campaign=vacuum-wont-turn-on-,2025-06-01,A vacuum that won't turn on is a major inconvenience. This pin provides a troubleshooting guide to help you diagnose the problem & potentially fix it yourself. Don't panic! Click to learn how to get your vacuum back up & running.,vacuum won't turn on
Carpet Type & Vacuum Settings: Match!,https://res.cloudinary.com/dbcpfy04c/image/upload/v1748760107/pin_5_12_pru6ei.webp,cleaning-tips,,https://www.beacleaner.com/vacuum-not-working-while-on-carpet?utm_source=pinterest&utm_campaign=carpet-type-vacuum-s,2025-06-01,Using the wrong vacuum settings for your carpet type can reduce cleaning effectiveness. This pin explains how to adjust your vacuum settings for optimal performance. Get the most out of your vacuum! Click to learn how to clean your carpets like a pro.,carpet type
Pet Hair on Carpet? Vacuum Solutions!,https://res.cloudinary.com/dbcpfy04c/image/upload/v1748760112/pin_5_13_ouoknh.webp,cleaning-tips,,https://www.beacleaner.com/vacuum-not-working-while-on-carpet?utm_source=pinterest&utm_campaign=pet-hair-on-carpet-v,2025-06-01,Dealing with pet hair on carpets? This pin offers specific vacuuming tips & techniques for effectively removing pet hair. Say goodbye to stubborn pet hair! Click to learn how to keep your carpets fur-free & your home looking its best.,pet hair
Vacuum Head Clogged? Clear It Out!,https://res.cloudinary.com/dbcpfy04c/image/upload/v1748760120/pin_5_14_fcls4v.webp,cleaning-tips,,https://www.beacleaner.com/vacuum-not-working-while-on-carpet?utm_source=pinterest&utm_campaign=vacuum-head-clogged-,2025-06-01,A clogged vacuum head restricts airflow & reduces suction. This pin shows you how to easily clear a clogged vacuum head & restore your vacuum's performance. Don't let a clogged head slow you down! Click to learn the simple steps to unclog it.,vacuum head
Vacuum Power Cord Issues? Safety First!,https://res.cloudinary.com/dbcpfy04c/image/upload/v1748760127/pin_5_15_dqeh7b.webp,home-repair-tips,,https://www.beacleaner.com/vacuum-not-working-while-on-carpet?utm_source=pinterest&utm_campaign=vacuum-power-cord-is,2025-06-01,Dealing with a damaged vacuum power cord? This pin emphasizes safety precautions & provides guidance on whether to repair or replace the cord. Your safety is paramount! Click to learn how to handle power cord issues responsibly.,vacuum cord
Vacuum Brushroll Tangled with Hair?,https://res.cloudinary.com/dbcpfy04c/image/upload/v1748760133/pin_5_16_pueecq.webp,cleaning-tips,,https://www.beacleaner.com/vacuum-not-working-while-on-carpet?utm_source=pinterest&utm_campaign=vacuum-brushroll-tan,2025-06-01,Tangled hair on the brushroll is a common problem. This pin demonstrates how to easily remove tangled hair & debris from your vacuum's brushroll. Free your brushroll & restore your vacuum's cleaning power! Click to learn the simple steps.,brushroll
Vacuum Suction Test: Is It Strong Enough?,https://res.cloudinary.com/dbcpfy04c/image/upload/v1748760140/pin_5_17_caglgy.webp,cleaning-tips,,https://www.beacleaner.com/vacuum-not-working-while-on-carpet?utm_source=pinterest&utm_campaign=vacuum-suction-test-,2025-06-01,Learn how to perform a simple suction test to determine if your vacuum is working effectively. This pin helps you assess your vacuum's performance & identify potential problems. Don't guess,test! Click to learn how to check your vacuum's suction power.
Vacuum vs. Carpet Pile Height: A Guide,https://res.cloudinary.com/dbcpfy04c/image/upload/v1748760146/pin_5_18_xf4xqv.webp,carpet-tips,,https://www.beacleaner.com/vacuum-not-working-while-on-carpet?utm_source=pinterest&utm_campaign=vacuum-vs-carpet-pil,2025-06-01,Understanding the relationship between vacuum & carpet pile height is crucial for effective cleaning. This pin explains how to choose the right vacuum settings for different carpet pile heights. Maximize your cleaning results! Click to learn more.,carpet pile
Vacuuming Technique: Back & Forth?,https://res.cloudinary.com/dbcpfy04c/image/upload/v1748760152/pin_5_19_aftobs.webp,cleaning-tips,,https://www.beacleaner.com/vacuum-not-working-while-on-carpet?utm_source=pinterest&utm_campaign=vacuuming-technique-,2025-06-01,Master the art of vacuuming with this pin! Learn the most effective vacuuming technique for carpets – back and forth overlapping strokes. Achieve a deeper clean with every pass! Click to learn the secrets to a spotless carpet.,vacuuming technique
Vacuum Maintenance Checklist: Stay Ahead!,https://res.cloudinary.com/dbcpfy04c/image/upload/v1748760157/pin_5_20_oiwlo1.webp,cleaning-tips,,https://www.beacleaner.com/vacuum-not-working-while-on-carpet?utm_source=pinterest&utm_campaign=vacuum-maintenance-c,2025-06-01,Prevent vacuum problems with a regular maintenance checklist. This pin outlines essential tasks like emptying the bag,cleaning filters
