Title,Media URL,Pinterest board,Thumbnail,Link,Publish date,Description,Keywords
Title,https://res.cloudinary.com/dsxuwwnsc/image/upload/v1748896368/pin_5_1_mpdvgi.webp,please-provide-the-title-and-keywords-i-need-that-information-to-suggest-a-board-name-once,,https://www.beacleaner.com/how-to-clean-nozzle-on-shark-steam-mop?utm_source=pinterest&utm_campaign=title,2025-06-02,Description,Keywords
Shark Steam Mop Nozzle Clogged? Fix It!,https://res.cloudinary.com/dsxuwwnsc/image/upload/v1748896376/pin_5_2_qk0xze.webp,cleaning-tips,,https://www.beacleaner.com/how-to-clean-nozzle-on-shark-steam-mop?utm_source=pinterest&utm_campaign=shark-steam-mop-nozz,2025-06-02,Is your Shark steam mop losing steam? A clogged nozzle is often the culprit! This pin shows you how to quickly and easily clean your Shark steam mop nozzle,restoring its powerful cleaning ability. Don't replace it - revive it! We'll guide you through simple steps
Shark Nozzle Cleaning: Step-by-Step,https://res.cloudinary.com/dsxuwwnsc/image/upload/v1748896383/pin_5_3_sthq4a.webp,cleaning-tips,,https://www.beacleaner.com/how-to-clean-nozzle-on-shark-steam-mop?utm_source=pinterest&utm_campaign=shark-nozzle-cleanin,2025-06-02,Don't let a dirty Shark steam mop nozzle ruin your cleaning routine! This pin offers a clear,step-by-step guide to deep cleaning your nozzle. We'll show you exactly what tools you need and how to use them safely and effectively. Imagine effortlessly gliding across your floors
Easy Shark Nozzle Cleaning Hacks,https://res.cloudinary.com/dsxuwwnsc/image/upload/v1748896390/pin_5_4_nslbtx.webp,cleaning-tips,,https://www.beacleaner.com/how-to-clean-nozzle-on-shark-steam-mop?utm_source=pinterest&utm_campaign=easy-shark-nozzle-cl,2025-06-02,Discover quick and easy hacks to clean your Shark steam mop nozzle! This pin showcases time-saving tips for maintaining your steam mop's performance.  We understand you're busy,so we've streamlined the cleaning process.  Get back to enjoying a clean home without spending hours scrubbing. Click to read the full article! #SharkHacks #SteamMopHacks #QuickCleaning #HomeMaintenance
Deep Clean Your Shark Nozzle Today!,https://res.cloudinary.com/dsxuwwnsc/image/upload/v1748896395/pin_5_5_vu3etj.webp,cleaning-tips,,https://www.beacleaner.com/how-to-clean-nozzle-on-shark-steam-mop?utm_source=pinterest&utm_campaign=deep-clean-your-shar,2025-06-02,Don't delay – give your Shark steam mop nozzle the deep clean it deserves! This pin encourages immediate action with a focus on achieving a truly sanitized clean.  We'll provide a detailed guide to removing all traces of grime and buildup.  Enjoy a healthier,cleaner home! Click to learn how. #DeepClean #SharkSteamMop #Sanitize #HomeHealth
Nozzle Cleaning: Shark Steam Mop Guide,https://res.cloudinary.com/dsxuwwnsc/image/upload/v1748896402/pin_5_6_iwu5y3.webp,cleaning-tips,,https://www.beacleaner.com/how-to-clean-nozzle-on-shark-steam-mop?utm_source=pinterest&utm_campaign=nozzle-cleaning-shar,2025-06-02,Need a clear and concise guide to cleaning your Shark steam mop nozzle? This pin provides a straightforward,easy-to-follow tutorial.  We'll break down the process into simple steps
Shark Nozzle Clogged? We Can Help!,https://res.cloudinary.com/dsxuwwnsc/image/upload/v1748896408/pin_5_7_do7g43.webp,cleaning-tips,,https://www.beacleaner.com/how-to-clean-nozzle-on-shark-steam-mop?utm_source=pinterest&utm_campaign=shark-nozzle-clogged,2025-06-02,Don't panic! If your Shark steam mop nozzle is clogged,we have the solution. This pin offers a reassuring message and a quick link to our comprehensive guide.  We'll walk you through the process step-by-step
Shark Steam Mop: Nozzle Cleaning Checklist,https://res.cloudinary.com/dsxuwwnsc/image/upload/v1748896416/pin_5_8_lw8kjd.webp,cleaning-tips,,https://www.beacleaner.com/how-to-clean-nozzle-on-shark-steam-mop?utm_source=pinterest&utm_campaign=shark-steam-mop-nozz,2025-06-02,Stay on top of your steam mop maintenance with our handy nozzle cleaning checklist! This pin provides a visual reminder to regularly clean your nozzle.  Preventative maintenance is key to a long-lasting,high-performing steam mop. Click to download the checklist. #CleaningChecklist #SharkMaintenance #SteamMopCare #PreventativeCleaning
Shark Steam Mop: Nozzle Cleaning Tools,https://res.cloudinary.com/dsxuwwnsc/image/upload/v1748896424/pin_5_9_kmbhdy.webp,cleaning-tips,,https://www.beacleaner.com/how-to-clean-nozzle-on-shark-steam-mop?utm_source=pinterest&utm_campaign=shark-steam-mop-nozz,2025-06-02,Wondering what tools you need to clean your Shark steam mop nozzle? This pin showcases the simple,readily available items required for the process.  No special equipment needed! Click to read the full article. #CleaningTools #SharkEssentials #SteamMopSupplies #HomeCleaningKit
Shark Nozzle Cleaning: Save Time & Money,https://res.cloudinary.com/dsxuwwnsc/image/upload/v1748896433/pin_5_10_f4zsaf.webp,cleaning-tips,,https://www.beacleaner.com/how-to-clean-nozzle-on-shark-steam-mop?utm_source=pinterest&utm_campaign=shark-nozzle-cleanin,2025-06-02,Cleaning your Shark steam mop nozzle saves you both time and money! This pin highlights the dual benefits of regular maintenance.  Avoid costly repairs and enjoy a faster,more efficient clean. Click to read the full article. #SaveTime #SaveMoney #SharkMop #CleaningEfficiency
Shark Nozzle Cleaning: For Sparkling Floors,https://res.cloudinary.com/dsxuwwnsc/image/upload/v1748896438/pin_5_11_xfdudw.webp,cleaning-tips,,https://www.beacleaner.com/how-to-clean-nozzle-on-shark-steam-mop?utm_source=pinterest&utm_campaign=shark-nozzle-cleanin,2025-06-02,Dreaming of sparkling clean floors? A clean Shark steam mop nozzle is the first step! This pin appeals to the desire for a beautiful,spotless home.  We'll show you how to achieve the floors of your dreams. Click to read the full article. #SparklingFloors #SharkClean #SteamMopMagic #HomeGoals
