Title,Media URL,Pinterest board,Thumbnail,Link,Publish date,Description,Keywords
Residue-Free Tile: Easy Steps!,https://res.cloudinary.com/dbcpfy04c/image/upload/v1748680766/pin_5_8_sti8rk.webp,tile-cleaning-tips,,https://www.beacleaner.com/how-to-remove-baking-soda-residue-from-tile?utm_source=pinterest&utm_campaign=residue-free-tile-ea,2025-05-31,Tired of seeing a white haze on your tile after cleaning with baking soda? This post provides a simple,step-by-step guide to removing residue and restoring your tile's shine.  We'll show you how to avoid common mistakes and achieve professional-level results.  A clean home is a happy home – let's get started!
Save Your Tile: Residue Removal!,https://res.cloudinary.com/dbcpfy04c/image/upload/v1748680773/pin_5_9_bhahlr.webp,cleaning-tips,,https://www.beacleaner.com/how-to-remove-baking-soda-residue-from-tile?utm_source=pinterest&utm_campaign=save-your-tile-resid,2025-05-31,Don't let baking soda residue damage your tile! This post explains how to safely and effectively remove the film without scratching or dulling the surface.  We'll cover different tile materials and the best cleaning methods for each.  Protect your investment and enjoy beautiful,sparkling floors! Click to learn how!
Baking Soda Residue? No Problem!,https://res.cloudinary.com/dbcpfy04c/image/upload/v1748680779/pin_5_10_mrldaj.webp,cleaning-tips,,https://www.beacleaner.com/how-to-remove-baking-soda-residue-from-tile?utm_source=pinterest&utm_campaign=baking-soda-residue-,2025-05-31,Is baking soda residue ruining your tile cleaning efforts? This post offers a quick and easy solution! We'll show you how to remove the film with minimal effort and achieve a sparkling clean finish.  Don't let residue stress you out – we've got you covered! Click to read now and reclaim your time!,quick cleaning
The Ultimate Tile Residue Guide!,https://res.cloudinary.com/dbcpfy04c/image/upload/v1748680786/pin_5_11_chcinv.webp,cleaning-tips,,https://www.beacleaner.com/how-to-remove-baking-soda-residue-from-tile?utm_source=pinterest&utm_campaign=the-ultimate-tile-re,2025-05-31,This is your go-to guide for removing baking soda residue from *any* type of tile! We cover everything from ceramic to porcelain to natural stone.  Learn the best tools,techniques
DIY Tile Cleaning: Residue Free!,https://res.cloudinary.com/dbcpfy04c/image/upload/v1748680795/pin_5_12_qp1bju.webp,cleaning-tips,,https://www.beacleaner.com/how-to-remove-baking-soda-residue-from-tile?utm_source=pinterest&utm_campaign=diy-tile-cleaning-re,2025-05-31,Want a sparkling clean tile without harsh chemicals? This post shows you how to remove baking soda residue using simple,DIY solutions.  We'll cover vinegar
Prevent Baking Soda Residue!,https://res.cloudinary.com/dbcpfy04c/image/upload/v1748680803/pin_5_13_buh65a.webp,cleaning-tips,,https://www.beacleaner.com/how-to-remove-baking-soda-residue-from-tile?utm_source=pinterest&utm_campaign=prevent-baking-soda-,2025-05-31,Stop residue before it starts! This post not only shows you how to remove baking soda residue,but also how to *prevent* it from happening in the first place.  Learn the right techniques and ratios for a sparkling clean finish every time.  A little prevention goes a long way! Click to read now!
Residue Removal: Tile Edition!,https://res.cloudinary.com/dbcpfy04c/image/upload/v1748680810/pin_5_14_qdacjg.webp,tile-cleaning-tips,,https://www.beacleaner.com/how-to-remove-baking-soda-residue-from-tile?utm_source=pinterest&utm_campaign=residue-removal-tile,2025-05-31,Don't let baking soda residue dim the shine of your beautiful tile! This post provides a comprehensive guide to removing the film and restoring your tile's luster.  We'll cover different methods and tools to suit your needs.  Get ready to be amazed by the results! Click to learn more!,tile restoration
Sparkling Floors in Minutes!,https://res.cloudinary.com/dbcpfy04c/image/upload/v1748680817/pin_5_15_llfras.webp,cleaning-tips,,https://www.beacleaner.com/how-to-remove-baking-soda-residue-from-tile?utm_source=pinterest&utm_campaign=sparkling-floors-in-,2025-05-31,Short on time? This post shows you how to remove baking soda residue from your tile floors in minutes! We'll share quick and easy techniques that deliver amazing results.  Don't spend hours scrubbing – get a sparkling clean floor fast! Click to learn more and reclaim your time!,quick cleaning
The Best Way to Remove Residue!,https://res.cloudinary.com/dbcpfy04c/image/upload/v1748680824/pin_5_16_xaylvm.webp,cleaning-tips,,https://www.beacleaner.com/how-to-remove-baking-soda-residue-from-tile?utm_source=pinterest&utm_campaign=the-best-way-to-remo,2025-05-31,There are many ways to remove baking soda residue,but this post reveals the *best* method! We'll show you a simple
Protect Your Tile: Residue Tips!,https://res.cloudinary.com/dbcpfy04c/image/upload/v1748680831/pin_5_17_vpzmwx.webp,tile-cleaning-tips,,https://www.beacleaner.com/how-to-remove-baking-soda-residue-from-tile?utm_source=pinterest&utm_campaign=protect-your-tile-re,2025-05-31,Your tile is an investment – protect it! This post provides valuable tips for removing baking soda residue and preventing future buildup.  We'll cover different tile types and the best cleaning solutions for each.  Keep your tile looking its best for years to come! Click to learn more!,tile protection
Easy Baking Soda Residue Fix!,https://res.cloudinary.com/dbcpfy04c/image/upload/v1748680838/pin_5_18_kpbug6.webp,cleaning-tips,,https://www.beacleaner.com/how-to-remove-baking-soda-residue-from-tile?utm_source=pinterest&utm_campaign=easy-baking-soda-res,2025-05-31,Frustrated with baking soda residue? This post offers a simple,easy-to-follow solution! We'll show you how to remove the film with minimal effort and achieve a sparkling clean finish.  Don't let residue stress you out – we've got you covered! Click to read now!
Don't Scrub! Remove Residue Now!,https://res.cloudinary.com/dbcpfy04c/image/upload/v1748680844/pin_5_19_n1yjgw.webp,cleaning-tips,,https://www.beacleaner.com/how-to-remove-baking-soda-residue-from-tile?utm_source=pinterest&utm_campaign=dont-scrub-remove-re,2025-05-31,Stop scrubbing endlessly! This post reveals the secret to effortlessly removing baking soda residue from your tile.  We'll show you how to use simple tools and solutions to achieve a sparkling clean finish.  Save your back and your time – click to learn more!,no scrubbing
Residue-Free Tile: Dream Come True!,https://res.cloudinary.com/dbcpfy04c/image/upload/v1748680850/pin_5_20_chxr0b.webp,tile-cleaning-tips,,https://www.beacleaner.com/how-to-remove-baking-soda-residue-from-tile?utm_source=pinterest&utm_campaign=residue-free-tile-dr,2025-05-31,Imagine stepping onto sparkling clean tile with no residue in sight! This post makes that dream a reality. We'll show you how to remove baking soda film and keep your tile looking its best.  A clean home is a happy home – let's get started! Click to learn more!,dream home
Tile Shine Restored: Residue Gone!,https://res.cloudinary.com/dbcpfy04c/image/upload/v1748680857/pin_5_21_mvbghu.webp,tile-cleaning-tips,,https://www.beacleaner.com/how-to-remove-baking-soda-residue-from-tile?utm_source=pinterest&utm_campaign=tile-shine-restored-,2025-05-31,Is your tile looking dull and lifeless? Baking soda residue could be the culprit! This post shows you how to restore your tile's shine by removing the film and revealing its natural beauty.  Get ready to fall in love with your floors again! Click to learn more!,tile shine
The Ultimate Residue Remover!,https://res.cloudinary.com/dbcpfy04c/image/upload/v1748680864/pin_5_22_lc9v1m.webp,cleaning-tips,,https://www.beacleaner.com/how-to-remove-baking-soda-residue-from-tile?utm_source=pinterest&utm_campaign=the-ultimate-residue,2025-05-31,Looking for the ultimate solution to baking soda residue? Look no further! This post provides a comprehensive guide to removing the film from any type of tile.  We'll cover everything you need to know to achieve a sparkling clean finish. Click to learn more!,residue remover
Say Goodbye to White Film!,https://res.cloudinary.com/dbcpfy04c/image/upload/v1748680870/pin_5_23_nfbsow.webp,cleaning-tips,,https://www.beacleaner.com/how-to-remove-baking-soda-residue-from-tile?utm_source=pinterest&utm_campaign=say-goodbye-to-white,2025-05-31,Tired of seeing a white film on your tile? This post shows you how to say goodbye to baking soda residue for good! We'll cover simple,effective techniques that deliver amazing results.  Don't let residue ruin your hard work – click to learn more!
Effortless Tile Cleaning: Residue!,https://res.cloudinary.com/dbcpfy04c/image/upload/v1748680876/pin_5_24_kcfomx.webp,cleaning-tips,,https://www.beacleaner.com/how-to-remove-baking-soda-residue-from-tile?utm_source=pinterest&utm_campaign=effortless-tile-clea,2025-05-31,Make tile cleaning effortless! This post reveals the secrets to removing baking soda residue quickly and easily.  We'll show you how to use simple tools and solutions to achieve a sparkling clean finish.  Save time and energy – click to learn more!,effortless cleaning
Sparkling Tile: Step-by-Step Guide!,https://res.cloudinary.com/dbcpfy04c/image/upload/v1748680882/pin_5_25_fkxbjf.webp,floor-cleaning-tips,,https://www.beacleaner.com/how-to-remove-baking-soda-residue-from-tile?utm_source=pinterest&utm_campaign=sparkling-tile-step-,2025-05-31,Need a step-by-step guide to removing baking soda residue from your tile? This post has you covered! We'll walk you through the process,from start to finish
