Title,Media URL,Pinterest board,Thumbnail,Description,Link,Publish date,Keywords,Source URL
Title,https://res.cloudinary.com/dbcpfy04c/image/upload/v1745857308/pin_1_1_ivvqa2.webp,please-provide-the-title-and-keywords-i-need-that-information-to-suggest-a-board-name-once,,Description,https://lawntrend.com/4-common-cub-cadet-pro-z500-problems-solutions/?utm_source=pinterest&utm_campaign=title,2025-04-28,Keywords,https://lawntrend.com/4-common-cub-cadet-pro-z500-problems-solutions/
Cub Cadet Pro Z500: 4 Fixes!,https://res.cloudinary.com/dbcpfy04c/image/upload/v1745857314/pin_1_2_w8jdcd.webp,mower-repair-ideas,,"Is your Cub Cadet Pro Z500 giving you trouble? Don't let mower problems ruin your weekend! This post dives into 4 common issues – from engine struggles to deck problems – and provides clear, step-by-step solutions you can tackle yourself. Save time & money by diagnosing & fixing it!  Get back to enjoying a perfectly manicured lawn. Click to learn more & keep your Pro Z500 running smoothly! #CubCadet #ProZ500 #LawnMowerRepair #DIYRepair,Cub Cadet,Pro Z500,Lawn Mower",https://lawntrend.com/4-common-cub-cadet-pro-z500-problems-solutions/?utm_source=pinterest&utm_campaign=cub-cadet-pro-z500-4,2025-04-28,Repair,https://lawntrend.com/4-common-cub-cadet-pro-z500-problems-solutions/
Pro Z500 Engine Not Starting?,https://res.cloudinary.com/dbcpfy04c/image/upload/v1745857320/pin_1_3_fob5by.webp,engine-repair-ideas,,"Frustrated with a Cub Cadet Pro Z500 that won't start? It's a common headache! We break down the most likely culprits – fuel issues, spark plugs, and more – and show you how to troubleshoot them. Don't waste another sunny day!  This guide will empower you to get your mower roaring again. Click to read the full article and reclaim your lawn care freedom! #CubCadetProZ500 #EngineRepair #LawnCare #FixItYourself,Engine,Starting Issues,Pro Z500",https://lawntrend.com/4-common-cub-cadet-pro-z500-problems-solutions/?utm_source=pinterest&utm_campaign=pro-z500-engine-not-,2025-04-28,Troubleshooting,https://lawntrend.com/4-common-cub-cadet-pro-z500-problems-solutions/
Deck Problems? Pro Z500 Help!,https://res.cloudinary.com/dbcpfy04c/image/upload/v1745857327/pin_1_4_iig3ou.webp,deck-repair-ideas,,"Is your Cub Cadet Pro Z500 deck uneven or leaving streaks? A faulty deck can ruin your lawn's appearance.  We cover common deck issues like bent blades, spindle problems, and belt tension.  Learn how to inspect, adjust, and repair your deck for a professional-quality cut. Click to get a flawless finish! #CubCadet #ProZ500Deck #LawnMower #DeckRepair,Deck,Blades,Spindle",https://lawntrend.com/4-common-cub-cadet-pro-z500-problems-solutions/?utm_source=pinterest&utm_campaign=deck-problems-pro-z5,2025-04-28,Repair,https://lawntrend.com/4-common-cub-cadet-pro-z500-problems-solutions/
Pro Z500: Fuel System Fixes,https://res.cloudinary.com/dbcpfy04c/image/upload/v1745857333/pin_1_5_amowwx.webp,small-engine-ideas,,"Fuel problems plaguing your Cub Cadet Pro Z500? Dirty fuel filters, clogged injectors, or stale gas can all cause issues.  This guide provides a detailed look at the fuel system and how to diagnose and resolve common problems.  Don't let a dirty fuel system slow you down! Click to learn how to keep your mower fueled for success. #FuelSystem #CubCadetProZ500 #LawnMowerMaintenance #DIY,Fuel Filter,Fuel Pump,Carburetor",https://lawntrend.com/4-common-cub-cadet-pro-z500-problems-solutions/?utm_source=pinterest&utm_campaign=pro-z500-fuel-system,2025-04-28,Maintenance,https://lawntrend.com/4-common-cub-cadet-pro-z500-problems-solutions/
Save Money: Pro Z500 Repair,https://res.cloudinary.com/dbcpfy04c/image/upload/v1745857339/pin_1_6_ssj9ru.webp,home-repair-ideas,,"Don't pay expensive shop fees!  Our guide to common Cub Cadet Pro Z500 problems and solutions can save you hundreds.  We empower you to tackle repairs yourself with clear instructions and helpful tips.  Get the most out of your investment and keep your lawn looking its best. Click to learn how! #CubCadetRepair #ProZ500 #SaveMoney #DIYLawnCare,DIY Repair,Cost Savings,Pro Z500",https://lawntrend.com/4-common-cub-cadet-pro-z500-problems-solutions/?utm_source=pinterest&utm_campaign=save-money-pro-z500-,2025-04-28,Maintenance,https://lawntrend.com/4-common-cub-cadet-pro-z500-problems-solutions/
Pro Z500: Belt Replacement Guide,https://res.cloudinary.com/dbcpfy04c/image/upload/v1618237451/placeholder.jpg,home-inspiration,,"A broken or worn belt on your Cub Cadet Pro Z500 can bring your mowing to a halt.  We provide a step-by-step guide to replacing your mower deck belt, ensuring a smooth and efficient cut.  Don't get stuck with a broken mower! Click to learn how to replace the belt and get back to work. #CubCadet #ProZ500Belt #LawnMowerBelt #Replacement,Belt,Deck Belt,Replacement",https://lawntrend.com/4-common-cub-cadet-pro-z500-problems-solutions/?utm_source=pinterest&utm_campaign=pro-z500-belt-replac,2025-04-28,Pro Z500,https://lawntrend.com/4-common-cub-cadet-pro-z500-problems-solutions/
Troubleshooting Pro Z500 Issues,https://res.cloudinary.com/dbcpfy04c/image/upload/v1618237451/placeholder.jpg,home-inspiration,,"Feeling overwhelmed by your Cub Cadet Pro Z500?  This post simplifies troubleshooting with a clear breakdown of 4 common problems and their solutions.  We'll help you pinpoint the issue and get your mower back in action quickly.  Don't let mower problems stress you out! Click to read now. #CubCadetProZ500 #Troubleshooting #LawnMowerProblems #DIY,Troubleshooting,Problems,Solutions",https://lawntrend.com/4-common-cub-cadet-pro-z500-problems-solutions/?utm_source=pinterest&utm_campaign=troubleshooting-pro-,2025-04-28,Pro Z500,https://lawntrend.com/4-common-cub-cadet-pro-z500-problems-solutions/
Pro Z500: Spindle Repair Tips,https://res.cloudinary.com/dbcpfy04c/image/upload/v1618237451/placeholder.jpg,home-inspiration,,"A failing spindle on your Cub Cadet Pro Z500 can cause vibration and uneven cutting.  Learn how to diagnose spindle problems and perform repairs to restore a smooth, professional finish.  Protect your investment and keep your lawn looking pristine. Click for expert advice! #CubCadet #ProZ500Spindle #LawnMowerRepair #SpindleRepair,Spindle,Repair,Pro Z500",https://lawntrend.com/4-common-cub-cadet-pro-z500-problems-solutions/?utm_source=pinterest&utm_campaign=pro-z500-spindle-rep,2025-04-28,Vibration,https://lawntrend.com/4-common-cub-cadet-pro-z500-problems-solutions/
Keep Your Pro Z500 Running!,https://res.cloudinary.com/dbcpfy04c/image/upload/v1618237451/placeholder.jpg,home-inspiration,,"Regular maintenance is key to a long-lasting Cub Cadet Pro Z500.  This post highlights 4 common problems you can prevent with proactive care.  Don't wait for a breakdown!  Learn how to keep your mower running smoothly for years to come. Click to read the full guide. #CubCadetProZ500 #LawnMowerMaintenance #PreventativeMaintenance #LawnCare,Maintenance,Preventative,Pro Z500",https://lawntrend.com/4-common-cub-cadet-pro-z500-problems-solutions/?utm_source=pinterest&utm_campaign=keep-your-pro-z500-r,2025-04-28,Longevity,https://lawntrend.com/4-common-cub-cadet-pro-z500-problems-solutions/
Pro Z500: Electrical Problems?,https://res.cloudinary.com/dbcpfy04c/image/upload/v1618237451/placeholder.jpg,home-inspiration,,"Experiencing electrical issues with your Cub Cadet Pro Z500?  From faulty wiring to blown fuses, we cover common electrical problems and how to diagnose and fix them.  Don't risk a shock! Click to learn how to safely troubleshoot your mower. #CubCadet #ProZ500Electrical #LawnMowerRepair #Electrical,Electrical,Wiring,Fuses",https://lawntrend.com/4-common-cub-cadet-pro-z500-problems-solutions/?utm_source=pinterest&utm_campaign=pro-z500-electrical-,2025-04-28,Pro Z500,https://lawntrend.com/4-common-cub-cadet-pro-z500-problems-solutions/
Pro Z500: Blade Sharpening Guide,https://res.cloudinary.com/dbcpfy04c/image/upload/v1618237451/placeholder.jpg,home-inspiration,,"Dull blades = a ragged lawn. Learn how to properly sharpen your Cub Cadet Pro Z500 blades for a clean, professional cut. We'll show you the tools and techniques you need to achieve a perfectly manicured lawn. Click to sharpen your skills! #CubCadetProZ500 #BladeSharpening #LawnCareTips #SharpBlades,Blade Sharpening,Pro Z500,Lawn Care",https://lawntrend.com/4-common-cub-cadet-pro-z500-problems-solutions/?utm_source=pinterest&utm_campaign=pro-z500-blade-sharp,2025-04-28,Cutting,https://lawntrend.com/4-common-cub-cadet-pro-z500-problems-solutions/
Fix Pro Z500: Easy Solutions,https://res.cloudinary.com/dbcpfy04c/image/upload/v1618237451/placeholder.jpg,home-inspiration,,"Don't let common Cub Cadet Pro Z500 problems sideline you. This post offers easy-to-follow solutions for 4 frequent issues.  Get back to mowing quickly and efficiently.  Your dream lawn is within reach! Click to learn more. #CubCadet #ProZ500 #EasyFixes #LawnMower,Easy Fixes,Solutions,Pro Z500",https://lawntrend.com/4-common-cub-cadet-pro-z500-problems-solutions/?utm_source=pinterest&utm_campaign=fix-pro-z500-easy-so,2025-04-28,Quick Repair,https://lawntrend.com/4-common-cub-cadet-pro-z500-problems-solutions/
Pro Z500: Preventative Care Tips,https://res.cloudinary.com/dbcpfy04c/image/upload/v1618237451/placeholder.jpg,home-inspiration,,"Avoid costly repairs with these preventative care tips for your Cub Cadet Pro Z500.  We'll show you how to inspect, clean, and maintain your mower to keep it running like new.  A little effort goes a long way! Click to learn more. #CubCadetProZ500 #PreventativeCare #LawnMowerTips #Maintenance,Preventative Care,Maintenance,Pro Z500",https://lawntrend.com/4-common-cub-cadet-pro-z500-problems-solutions/?utm_source=pinterest&utm_campaign=pro-z500-preventativ,2025-04-28,Tips,https://lawntrend.com/4-common-cub-cadet-pro-z500-problems-solutions/
Pro Z500: Is it the Carburetor?,https://res.cloudinary.com/dbcpfy04c/image/upload/v1618237451/placeholder.jpg,home-inspiration,,"Is your Cub Cadet Pro Z500 running rough? It could be a carburetor issue. We explain how to diagnose carburetor problems and offer solutions to get your mower running smoothly again. Don't let a dirty carb ruin your day! Click to learn more. #CubCadet #ProZ500Carburetor #LawnMowerRepair #Carburetor,Carburetor,Repair,Pro Z500",https://lawntrend.com/4-common-cub-cadet-pro-z500-problems-solutions/?utm_source=pinterest&utm_campaign=pro-z500-is-it-the-c,2025-04-28,Engine,https://lawntrend.com/4-common-cub-cadet-pro-z500-problems-solutions/
Pro Z500: Mower Won't Cut Evenly?,https://res.cloudinary.com/dbcpfy04c/image/upload/v1618237451/placeholder.jpg,home-inspiration,,"Uneven cut with your Cub Cadet Pro Z500? We explore the reasons why – from blade issues to deck leveling – and provide solutions to achieve a perfectly manicured lawn.  Get the professional look you deserve! Click to learn how. #CubCadetProZ500 #UnevenCut #LawnMowerProblems #DeckLeveling,Deck Leveling,Blades,Pro Z500",https://lawntrend.com/4-common-cub-cadet-pro-z500-problems-solutions/?utm_source=pinterest&utm_campaign=pro-z500-mower-wont-,2025-04-28,Cutting,https://lawntrend.com/4-common-cub-cadet-pro-z500-problems-solutions/
Pro Z500: Spark Plug Secrets,https://res.cloudinary.com/dbcpfy04c/image/upload/v1618237451/placeholder.jpg,home-inspiration,,"Learn how to diagnose and replace the spark plugs on your Cub Cadet Pro Z500.  A faulty spark plug can cause starting problems and reduced performance.  Keep your engine firing on all cylinders! Click to learn more. #CubCadet #ProZ500SparkPlug #LawnMowerRepair #SparkPlug,Spark Plug,Replacement,Pro Z500",https://lawntrend.com/4-common-cub-cadet-pro-z500-problems-solutions/?utm_source=pinterest&utm_campaign=pro-z500-spark-plug-,2025-04-28,Engine,https://lawntrend.com/4-common-cub-cadet-pro-z500-problems-solutions/
Pro Z500: Diagnose the Vibration!,https://res.cloudinary.com/dbcpfy04c/image/upload/v1745857368/pin_1_18_rwhzmd.webp,repair-ideas,,"Is your Cub Cadet Pro Z500 vibrating excessively?  We break down the common causes – from loose parts to spindle problems – and show you how to diagnose and fix the issue.  Enjoy a smooth, comfortable mowing experience! Click to learn more. #CubCadetProZ500 #Vibration #LawnMowerRepair #Troubleshooting,Vibration,Spindle,Pro Z500",https://lawntrend.com/4-common-cub-cadet-pro-z500-problems-solutions/?utm_source=pinterest&utm_campaign=pro-z500-diagnose-th,2025-04-28,Diagnosis,https://lawntrend.com/4-common-cub-cadet-pro-z500-problems-solutions/
Pro Z500: Winterizing Guide,https://res.cloudinary.com/dbcpfy04c/image/upload/v1745857375/pin_1_19_pwd9yy.webp,winter-prep-ideas,,"Prepare your Cub Cadet Pro Z500 for winter storage with our comprehensive guide.  Protect your investment and ensure a smooth start next spring.  Don't let winter damage ruin your mower! Click to learn how. #CubCadetProZ500 #Winterizing #LawnMowerStorage #WinterPrep,Winterizing,Storage,Pro Z500",https://lawntrend.com/4-common-cub-cadet-pro-z500-problems-solutions/?utm_source=pinterest&utm_campaign=pro-z500-winterizing,2025-04-28,Preparation,https://lawntrend.com/4-common-cub-cadet-pro-z500-problems-solutions/
Pro Z500: Fuel Filter Replacement,https://res.cloudinary.com/dbcpfy04c/image/upload/v1745857380/pin_1_20_wflvhd.webp,small-engine-ideas,,"A clogged fuel filter can cause performance issues. Learn how to easily replace the fuel filter on your Cub Cadet Pro Z500 and keep your mower running smoothly.  Simple maintenance for big results! Click to learn more. #CubCadet #ProZ500FuelFilter #LawnMowerMaintenance #FuelFilter,Fuel Filter,Replacement,Pro Z500",https://lawntrend.com/4-common-cub-cadet-pro-z500-problems-solutions/?utm_source=pinterest&utm_campaign=pro-z500-fuel-filter,2025-04-28,Maintenance,https://lawntrend.com/4-common-cub-cadet-pro-z500-problems-solutions/
Pro Z500: Mower Smells Like Gas?,https://res.cloudinary.com/dbcpfy04c/image/upload/v1745857386/pin_1_21_z7exbv.webp,lawn-mower-ideas,,"Is your Cub Cadet Pro Z500 smelling like gas? This could indicate a fuel leak or other fuel system issue. We'll help you diagnose the problem and find a solution. Safety first! Click to learn more. #CubCadetProZ500 #FuelLeak #LawnMowerRepair #GasSmell,Fuel Leak,Gas Smell,Pro Z500",https://lawntrend.com/4-common-cub-cadet-pro-z500-problems-solutions/?utm_source=pinterest&utm_campaign=pro-z500-mower-smell,2025-04-28,Safety,https://lawntrend.com/4-common-cub-cadet-pro-z500-problems-solutions/
Pro Z500: Belt Slippage Fixes,https://res.cloudinary.com/dbcpfy04c/image/upload/v1745857393/pin_1_22_aw9gbi.webp,tool-repair-ideas,,"Experiencing belt slippage on your Cub Cadet Pro Z500? We cover the causes and solutions, from tension adjustments to belt replacement.  Keep your mower running efficiently! Click to learn more. #CubCadet #ProZ500Belt #BeltSlippage #LawnMowerRepair,Belt Slippage,Belt,Pro Z500",https://lawntrend.com/4-common-cub-cadet-pro-z500-problems-solutions/?utm_source=pinterest&utm_campaign=pro-z500-belt-slippa,2025-04-28,Repair,https://lawntrend.com/4-common-cub-cadet-pro-z500-problems-solutions/
Pro Z500: Mower Cutting Too High?,https://res.cloudinary.com/dbcpfy04c/image/upload/v1618237451/placeholder.jpg,home-inspiration,,"Your Cub Cadet Pro Z500 cutting too high? We'll help you adjust the deck height and troubleshoot any issues preventing a low, even cut. Get the lawn you've always wanted! Click to learn more. #CubCadetProZ500 #DeckHeight #LawnMower #CuttingHeight,Deck Height,Adjustment,Pro Z500",https://lawntrend.com/4-common-cub-cadet-pro-z500-problems-solutions/?utm_source=pinterest&utm_campaign=pro-z500-mower-cutti,2025-04-28,Cutting,https://lawntrend.com/4-common-cub-cadet-pro-z500-problems-solutions/
Pro Z500: Common Mistakes to Avoid,https://res.cloudinary.com/dbcpfy04c/image/upload/v1618237451/placeholder.jpg,home-inspiration,,"Avoid these common mistakes when maintaining your Cub Cadet Pro Z500.  Protect your investment and keep your mower running smoothly for years to come.  Learn from our expert tips! Click to read now. #CubCadetProZ500 #LawnMowerTips #MaintenanceMistakes #ProTips,Maintenance,Mistakes,Pro Z500",https://lawntrend.com/4-common-cub-cadet-pro-z500-problems-solutions/?utm_source=pinterest&utm_campaign=pro-z500-common-mist,2025-04-28,Tips,https://lawntrend.com/4-common-cub-cadet-pro-z500-problems-solutions/
Pro Z500: Get a Pro Cut at Home!,https://res.cloudinary.com/dbcpfy04c/image/upload/v1618237451/placeholder.jpg,home-inspiration,,"Want a professional-quality cut without the professional price tag?  Our guide to fixing common Cub Cadet Pro Z500 problems will help you achieve a perfectly manicured lawn. Click to learn more! #CubCadetProZ500 #ProCut #LawnCare #DIYLawnCare,Pro Cut,Lawn Care,Pro Z500",https://lawntrend.com/4-common-cub-cadet-pro-z500-problems-solutions/?utm_source=pinterest&utm_campaign=pro-z500-get-a-pro-c,2025-04-28,DIY,https://lawntrend.com/4-common-cub-cadet-pro-z500-problems-solutions/
