Title,Media URL,Pinterest board,Thumbnail,Link,Publish date,Description,Keywords
Newspaper Window Cleaning: Easy & Effective!,https://res.cloudinary.com/dbcpfy04c/image/upload/v1748449974/pin_2_23_wt7vdp.webp,cleaning-tips,,https://www.beacleaner.com/how-to-clean-windows-with-newspaper?utm_source=pinterest&utm_campaign=newspaper-window-cle,2025-05-28,Looking for an easy and effective way to clean your windows? This post shows you how to use newspaper to achieve a sparkling clean without any hassle. It's a simple,affordable
Newspaper: A Cleaning Hack You Need!,https://res.cloudinary.com/dbcpfy04c/image/upload/v1748449981/pin_2_24_pnrlgm.webp,cleaning-tips,,https://www.beacleaner.com/how-to-clean-windows-with-newspaper?utm_source=pinterest&utm_campaign=newspaper-a-cleaning,2025-05-28,Don't miss out on this cleaning hack you need to know! This post reveals how newspaper can transform your window cleaning routine,delivering a sparkling clean and streak-free shine. Click to learn more and try it today! #CleaningHack #WindowCleaning #MustTry #HomeCleaning
Title,https://res.cloudinary.com/dbcpfy04c/image/upload/v1748450024/pin_3_1_rgha4c.webp,please-provide-the-title-and-keywords-i-need-that-information-to-suggest-a-board-name-once,,https://www.beacleaner.com/how-to-clean-windows-with-norwex?utm_source=pinterest&utm_campaign=title,2025-05-28,Description,Keywords
Sparkling Windows,https://res.cloudinary.com/dbcpfy04c/image/upload/v1748450032/pin_3_2_wqkxoz.webp,home-maintenance-tips,,https://www.beacleaner.com/how-to-clean-windows-with-norwex?utm_source=pinterest&utm_campaign=sparkling-windows,2025-05-28,Norwex Way!,Tired of streaks and endless scrubbing? Discover the *easy* way to achieve crystal-clear windows with just water and your Norwex Cloth! This guide breaks down the simple steps
Norwex Window Cleaning Secrets,https://res.cloudinary.com/dbcpfy04c/image/upload/v1748450039/pin_3_3_w1rw9y.webp,window-cleaning-tips,,https://www.beacleaner.com/how-to-clean-windows-with-norwex?utm_source=pinterest&utm_campaign=norwex-window-cleani,2025-05-28,Unlock the secret to sparkling clean windows without harsh chemicals! This post reveals how Norwex microfiber effortlessly lifts dirt and grime,leaving your windows brilliantly clear.  We'll show you the best techniques for inside & outside cleaning
Skip the Chemicals! Norwex Windows,https://res.cloudinary.com/dbcpfy04c/image/upload/v1748450045/pin_3_4_piqrbr.webp,cleaning-tips,,https://www.beacleaner.com/how-to-clean-windows-with-norwex?utm_source=pinterest&utm_campaign=skip-the-chemicals-n,2025-05-28,Ditch the chemical sprays and embrace a healthier way to clean your windows! This guide demonstrates how Norwex microfiber cloths deliver a professional-quality clean using *only water*.  Perfect for families with kids and pets,and for anyone wanting a more eco-friendly home.  See the amazing before & after results and learn how to get yours!  Click to read now! #NorwexMicrofiber #ChemicalFreeCleaning #HealthyHome #WindowCleaningHacks
Norwex: Window Cleaning Made Easy,https://res.cloudinary.com/dbcpfy04c/image/upload/v1748450052/pin_3_5_gq3gac.webp,window-cleaning-tips,,https://www.beacleaner.com/how-to-clean-windows-with-norwex?utm_source=pinterest&utm_campaign=norwex-window-cleani,2025-05-28,Is window cleaning a chore you dread? It doesn't have to be! This post simplifies the process with Norwex,showing you how to achieve streak-free results in minutes.  We cover everything from prepping your windows to the final polish.  Imagine the satisfaction of sparkling clean windows with minimal effort!  Learn the Norwex difference today. #EasyWindowCleaning #NorwexResults #CleaningMotivation #SparklingClean
Streak-Free Windows,https://res.cloudinary.com/dbcpfy04c/image/upload/v1748450059/pin_3_6_ch8chd.webp,home-cleaning-tips,,https://www.beacleaner.com/how-to-clean-windows-with-norwex?utm_source=pinterest&utm_campaign=streak-free-windows,2025-05-28,Guaranteed!,Say goodbye to frustrating streaks! This guide shows you exactly how to use your Norwex cloths to achieve a flawless
Norwex Window Cleaning Demo,https://res.cloudinary.com/dbcpfy04c/image/upload/v1748450064/pin_3_7_odrbil.webp,window-cleaning-tips,,https://www.beacleaner.com/how-to-clean-windows-with-norwex?utm_source=pinterest&utm_campaign=norwex-window-cleani,2025-05-28,See Norwex in action! This post features a step-by-step demonstration of how to clean windows with Norwex microfiber cloths.  Watch how easily dirt and grime disappear,leaving behind a sparkling clean surface.  It's proof that you can achieve professional results without harsh chemicals or endless scrubbing.  Watch the demo now! #NorwexDemo #WindowCleaningVideo #CleaningHacks #EasyCleaning
The Ultimate Norwex Window Guide,https://res.cloudinary.com/dbcpfy04c/image/upload/v1748450071/pin_3_8_yruujd.webp,cleaning-tips,,https://www.beacleaner.com/how-to-clean-windows-with-norwex?utm_source=pinterest&utm_campaign=the-ultimate-norwex-,2025-05-28,Everything you need to know about cleaning windows with Norwex is right here! This comprehensive guide covers all the techniques,tips
Norwex vs. Traditional Cleaning,https://res.cloudinary.com/dbcpfy04c/image/upload/v1748450077/pin_3_9_i2qant.webp,cleaning-tips,,https://www.beacleaner.com/how-to-clean-windows-with-norwex?utm_source=pinterest&utm_campaign=norwex-vs-traditiona,2025-05-28,Wondering if Norwex is worth the hype? This post compares Norwex window cleaning to traditional methods,highlighting the benefits of microfiber technology.  See how Norwex saves you time
Brilliant Windows,https://res.cloudinary.com/dbcpfy04c/image/upload/v1748450086/pin_3_10_urgie9.webp,cleaning-tips,,https://www.beacleaner.com/how-to-clean-windows-with-norwex?utm_source=pinterest&utm_campaign=brilliant-windows,2025-05-28,Less Effort!,Dreaming of sparkling windows without the backache? This post shows you how to achieve professional-quality results with minimal effort using Norwex.  We'll share our favorite techniques for a quick and easy clean.  Reclaim your weekend and enjoy a brighter
Norwex Window Cleaning Checklist,https://res.cloudinary.com/dbcpfy04c/image/upload/v1748450091/pin_3_11_cybpfb.webp,window-cleaning-tips,,https://www.beacleaner.com/how-to-clean-windows-with-norwex?utm_source=pinterest&utm_campaign=norwex-window-cleani,2025-05-28,Stay organized and efficient with our Norwex window cleaning checklist! This post provides a step-by-step guide to ensure you don't miss a spot.  From gathering your supplies to the final polish,we've got you covered.  Download the checklist and make window cleaning a breeze! #CleaningChecklist #NorwexOrganization #WindowCleaningRoutine #HomeOrganization
Norwex for Sparkling Clean Results,https://res.cloudinary.com/dbcpfy04c/image/upload/v1748450098/pin_3_12_gxuxuc.webp,cleaning-tips,,https://www.beacleaner.com/how-to-clean-windows-with-norwex?utm_source=pinterest&utm_campaign=norwex-for-sparkling,2025-05-28,Experience the power of Norwex! This post showcases the incredible cleaning power of Norwex microfiber cloths,specifically for windows.  See how easily they lift dirt
DIY Window Cleaning with Norwex,https://res.cloudinary.com/dbcpfy04c/image/upload/v1748450105/pin_3_13_s5hfzc.webp,cleaning-tips,,https://www.beacleaner.com/how-to-clean-windows-with-norwex?utm_source=pinterest&utm_campaign=diy-window-cleaning-,2025-05-28,Create your own effective window cleaning solution with Norwex! This post provides a simple DIY recipe using water and your Norwex cloths.  Skip the harsh chemicals and enjoy a natural,eco-friendly clean.  It's a win-win for your home and the environment! #DIYCleaning #NorwexDIY #NaturalCleaning #EcoFriendlyHome
Norwex: Cleaning Windows Inside & Out,https://res.cloudinary.com/dbcpfy04c/image/upload/v1748450111/pin_3_14_qmcnh9.webp,window-cleaning-tips,,https://www.beacleaner.com/how-to-clean-windows-with-norwex?utm_source=pinterest&utm_campaign=norwex-cleaning-wind,2025-05-28,Master the art of window cleaning,inside and out! This post provides specific techniques for cleaning both the interior and exterior of your windows with Norwex.  We'll cover different surfaces and challenges to ensure a flawless clean.  Enjoy a panoramic view of a sparkling clean world! #InsideAndOut #WindowCleaningTechniques #NorwexTips #CleanView
Norwex: Cleaning Screens with Ease,https://res.cloudinary.com/dbcpfy04c/image/upload/v1748450118/pin_3_15_q7prcn.webp,window-cleaning-tips,,https://www.beacleaner.com/how-to-clean-windows-with-norwex?utm_source=pinterest&utm_campaign=norwex-cleaning-scre,2025-05-28,Don't forget the screens! This post shows you how to easily clean your window screens with Norwex microfiber cloths.  Remove dirt,dust
Norwex: Pet-Friendly Window Cleaning,https://res.cloudinary.com/dbcpfy04c/image/upload/v1748450126/pin_3_16_s6mvug.webp,pet-cleaning-tips,,https://www.beacleaner.com/how-to-clean-windows-with-norwex?utm_source=pinterest&utm_campaign=norwex-pet-friendly-,2025-05-28,Keep your furry friends safe with Norwex! This post highlights the benefits of chemical-free window cleaning for homes with pets.  Norwex microfiber cloths clean effectively with just water,eliminating the risk of harmful residue.  A clean home and happy pets – it's a perfect combination! #PetFriendlyCleaning #NorwexForPets #SafeCleaning #HealthyHome
Norwex: Cleaning After Construction,https://res.cloudinary.com/dbcpfy04c/image/upload/v1748450134/pin_3_17_d9tuau.webp,window-cleaning-tips,,https://www.beacleaner.com/how-to-clean-windows-with-norwex?utm_source=pinterest&utm_campaign=norwex-cleaning-afte,2025-05-28,Post-construction mess on your windows? No problem! This post demonstrates how Norwex microfiber cloths can effectively remove dust,grime
Norwex: Cleaning Smudged Windows,https://res.cloudinary.com/dbcpfy04c/image/upload/v1748450140/pin_3_18_tosnqu.webp,window-cleaning-tips,,https://www.beacleaner.com/how-to-clean-windows-with-norwex?utm_source=pinterest&utm_campaign=norwex-cleaning-smud,2025-05-28,Kids and smudged windows go hand-in-hand! This post shows you how to quickly and easily remove fingerprints and smudges from your windows with Norwex.  Keep your windows looking their best,even with little hands around. #SmudgedWindows #KidFriendlyCleaning #NorwexQuickClean #EasyCleanup
Norwex: Window Cleaning for a Brighter Home,https://res.cloudinary.com/dbcpfy04c/image/upload/v1748450145/pin_3_19_qedy96.webp,window-cleaning-tips,,https://www.beacleaner.com/how-to-clean-windows-with-norwex?utm_source=pinterest&utm_campaign=norwex-window-cleani,2025-05-28,Let the sunshine in! This post highlights how clean windows can brighten up your home and improve your mood.  Norwex makes it easy to achieve a sparkling clean that transforms your living space.  Enjoy a brighter,more inviting home today! #BrighterHome #WindowCleaningMoodBoost #NorwexHappiness #HomeDecor
Title,https://res.cloudinary.com/dbcpfy04c/image/upload/v1748450189/pin_4_1_yuzfa7.webp,please-provide-the-title-and-keywords-i-need-that-information-to-suggest-a-board-name-once,,https://www.beacleaner.com/how-to-clean-windows-with-pressure-washer?utm_source=pinterest&utm_campaign=title,2025-05-28,Description,Keywords
Sparkling Windows: Pressure Washing Guide,https://res.cloudinary.com/dbcpfy04c/image/upload/v1748450194/pin_4_2_e3znge.webp,home-maintenance-tips,,https://www.beacleaner.com/how-to-clean-windows-with-pressure-washer?utm_source=pinterest&utm_campaign=sparkling-windows-pr,2025-05-28,"Dreaming of crystal-clear windows without the endless scrubbing? This guide reveals how to safely and effectively clean your windows with a pressure washer! Learn the right nozzles, techniques, and safety precautions to achieve a streak-free shine. Say goodbye to grime and hello to breathtaking views! Don't let dirty windows dim your day – reclaim your sunshine! Click to learn more and enjoy a brighter home. We'll cover everything from prepping your windows to avoiding damage.","Pressure Washing,Window Cleaning,Home Maintenance,DIY"
Pressure Wash Windows Like a Pro!,https://res.cloudinary.com/dbcpfy04c/image/upload/v1748450201/pin_4_3_wvv636.webp,home-cleaning-tips,,https://www.beacleaner.com/how-to-clean-windows-with-pressure-washer?utm_source=pinterest&utm_campaign=pressure-wash-window,2025-05-28,"Tired of struggling with window cleaning? Discover the secret weapon: your pressure washer! This post breaks down the process step-by-step, ensuring a professional-quality clean without the professional price tag.  We'll show you how to avoid common mistakes and achieve a spotless finish. Imagine the satisfaction of sparkling clean windows – it's easier than you think!  Get the ultimate guide now and enjoy a clearer view of the world.","Window Washing,Pressure Washer Tips,Cleaning Hacks,Home Improvement"
Streak-Free Windows: Pressure Washer Secrets,https://res.cloudinary.com/dbcpfy04c/image/upload/v1748450209/pin_4_4_stic2z.webp,home-cleaning-tips,,https://www.beacleaner.com/how-to-clean-windows-with-pressure-washer?utm_source=pinterest&utm_campaign=streak-free-windows-,2025-05-28,"Is streaking ruining your window views?  This guide unlocks the secrets to achieving perfectly streak-free windows using your pressure washer.  We cover the best cleaning solutions, nozzle choices, and techniques for a flawless finish.  Don't settle for hazy windows – experience the joy of crystal clarity!  Click to learn how to make your windows shine like new.  Plus, we'll help you protect your investment.","Clean Windows,Pressure Washing Guide,Streak-Free,DIY Cleaning"
Save Time & Effort: Pressure Wash Your Windows,https://res.cloudinary.com/dbcpfy04c/image/upload/v1748450216/pin_4_5_hku3qj.webp,home-cleaning-tips,,https://www.beacleaner.com/how-to-clean-windows-with-pressure-washer?utm_source=pinterest&utm_campaign=save-time-effort-pre,2025-05-28,Stop wasting your weekends scrubbing windows!  This post shows you how to dramatically reduce your cleaning time with a pressure washer.  Learn the fastest and most efficient methods for sparkling clean windows.  Imagine having more free time to enjoy the things you love!  Click to discover the power of pressure washing for window cleaning. It's a game-changer for busy homeowners.,"Time Saving,Window Cleaning Tips,Pressure Washer,Home Cleaning"
Pressure Washing Windows: Safety First!,https://res.cloudinary.com/dbcpfy04c/image/upload/v1748450222/pin_4_6_bjn7x7.webp,home-safety-tips,,https://www.beacleaner.com/how-to-clean-windows-with-pressure-washer?utm_source=pinterest&utm_campaign=pressure-washing-win,2025-05-28,"Safety is paramount! This guide prioritizes safe pressure washing techniques for your windows. Learn how to protect yourself, your property, and your windows from damage.  We'll cover essential precautions and best practices.  Don't risk injury or costly repairs – clean with confidence! Click to learn how to pressure wash windows safely and effectively.","Window Safety,Pressure Washer Safety,Cleaning Precautions,Home Safety"
DIY Window Cleaning: Pressure Washer Method,https://res.cloudinary.com/dbcpfy04c/image/upload/v1748450230/pin_4_7_bazzw8.webp,cleaning-tips,,https://www.beacleaner.com/how-to-clean-windows-with-pressure-washer?utm_source=pinterest&utm_campaign=diy-window-cleaning-,2025-05-28,"Take control of your home's cleanliness with this DIY guide to pressure washing windows!  We provide a comprehensive, step-by-step tutorial that anyone can follow.  Save money and enjoy the satisfaction of a job well done.  Imagine the pride of a sparkling clean home, achieved by your own hands! Click to learn more and start cleaning today.","DIY Cleaning,Pressure Washing,Window Cleaning,Home Projects"
Before & After: Pressure Washed Windows!,https://res.cloudinary.com/dbcpfy04c/image/upload/v1748450236/pin_4_8_gfktaf.webp,home-exterior-ideas,,https://www.beacleaner.com/how-to-clean-windows-with-pressure-washer?utm_source=pinterest&utm_campaign=before-after-pressur,2025-05-28,Witness the incredible transformation! This post showcases stunning before-and-after photos of windows cleaned with a pressure washer.  See the dramatic difference for yourself and get inspired to tackle your own window cleaning project.  Imagine the impact clean windows can have on your home's curb appeal! Click to see the results and learn how to achieve them.,"Before and After,Window Transformation,Pressure Washing Results,Home Exterior"
The Best Nozzles for Pressure Washing Windows,https://res.cloudinary.com/dbcpfy04c/image/upload/v1748450243/pin_4_9_k6h9qp.webp,cleaning-tips,,https://www.beacleaner.com/how-to-clean-windows-with-pressure-washer?utm_source=pinterest&utm_campaign=the-best-nozzles-for,2025-05-28,Choosing the right nozzle is crucial for successful window cleaning. This post details the best nozzles for different window types and levels of grime.  Avoid damage and achieve optimal cleaning power.  Don't guess – get the right tools for the job! Click to learn which nozzles will give you the best results.,"Pressure Washer Nozzles,Window Cleaning Tools,Cleaning Equipment,DIY Tips"
Pressure Washing: Window Cleaning Mistakes to Avoid,https://res.cloudinary.com/dbcpfy04c/image/upload/v1748450251/pin_4_10_xlrzdb.webp,home-safety-tips,,https://www.beacleaner.com/how-to-clean-windows-with-pressure-washer?utm_source=pinterest&utm_campaign=pressure-washing-win,2025-05-28,"Don't make these common mistakes! This post highlights the pitfalls to avoid when pressure washing windows, ensuring a safe and effective clean.  Learn from our experience and protect your investment.  Avoid costly repairs and achieve a flawless finish. Click to learn how to avoid these common errors.","Cleaning Mistakes,Pressure Washing Errors,Window Care,Home Maintenance"
Pressure Wash Windows: Cleaning Solutions Guide,https://res.cloudinary.com/dbcpfy04c/image/upload/v1748450256/pin_4_11_rucsm9.webp,home-cleaning-tips,,https://www.beacleaner.com/how-to-clean-windows-with-pressure-washer?utm_source=pinterest&utm_campaign=pressure-wash-window,2025-05-28,"What's the best cleaning solution for pressure washing windows? This post explores various options, from simple soap and water to specialized window cleaning detergents.  Find the perfect solution for your needs and achieve a sparkling clean.  Don't settle for less – get the best results! Click to learn more.","Cleaning Solutions,Pressure Washing Detergent,Window Cleaner,DIY Recipes"
Revive Your View: Pressure Wash Dirty Windows,https://res.cloudinary.com/dbcpfy04c/image/upload/v1748450263/pin_4_12_h7d4bu.webp,home-cleaning-tips,,https://www.beacleaner.com/how-to-clean-windows-with-pressure-washer?utm_source=pinterest&utm_campaign=revive-your-view-pre,2025-05-28,"Is grime obscuring your beautiful view?  This post shows you how to revive your windows with the power of a pressure washer.  Restore clarity and enjoy the scenery once again.  Imagine the joy of looking out clean, sparkling windows! Click to learn how to reclaim your view.","Dirty Windows,Window Revival,Pressure Washing,Home Improvement"
Pressure Washing Windows: A Step-by-Step Guide,https://res.cloudinary.com/dbcpfy04c/image/upload/v1748450269/pin_4_13_uaoao6.webp,home-safety-tips,,https://www.beacleaner.com/how-to-clean-windows-with-pressure-washer?utm_source=pinterest&utm_campaign=pressure-washing-win,2025-05-28,"Need a clear, concise guide to pressure washing windows? This post provides a detailed, step-by-step tutorial that's easy to follow.  From preparation to finishing touches, we've got you covered.  Don't get overwhelmed – we make it simple! Click to learn the process.","Step-by-Step Guide,Pressure Washing,Window Cleaning,DIY Tutorial"
Protect Your Windows: Pressure Washing Tips,https://res.cloudinary.com/dbcpfy04c/image/upload/v1748450276/pin_4_14_e42yur.webp,home-maintenance-tips,,https://www.beacleaner.com/how-to-clean-windows-with-pressure-washer?utm_source=pinterest&utm_campaign=protect-your-windows,2025-05-28,"Worried about damaging your windows? This post offers valuable tips on protecting your windows during pressure washing.  Learn how to adjust the pressure, choose the right nozzle, and avoid common mistakes.  Peace of mind is priceless! Click to learn how to protect your investment.","Window Protection,Pressure Washing Tips,Home Care,Safety First"
Pressure Wash Windows: Curb Appeal Booster!,https://res.cloudinary.com/dbcpfy04c/image/upload/v1748450283/pin_4_15_w6rwak.webp,home-cleaning-tips,,https://www.beacleaner.com/how-to-clean-windows-with-pressure-washer?utm_source=pinterest&utm_campaign=pressure-wash-window,2025-05-28,Boost your home's curb appeal with sparkling clean windows! This post demonstrates how pressure washing can dramatically improve your home's exterior appearance.  Make a great first impression and increase your property value.  Imagine the pride of a beautifully maintained home! Click to learn more.,"Curb Appeal,Home Exterior,Pressure Washing,Window Cleaning"
Easy Window Cleaning: Pressure Washer Hack,https://res.cloudinary.com/dbcpfy04c/image/upload/v1748450289/pin_4_16_jwxxus.webp,cleaning-tips,,https://www.beacleaner.com/how-to-clean-windows-with-pressure-washer?utm_source=pinterest&utm_campaign=easy-window-cleaning,2025-05-28,Discover a simple hack for easy window cleaning with your pressure washer! This post reveals a quick and effective method for achieving sparkling results.  Save time and effort without sacrificing quality.  Imagine how much easier window cleaning can be! Click to learn the hack.,"Cleaning Hack,Pressure Washer,Easy Cleaning,Window Washing"
Pressure Washing Windows: For Every Home Type,https://res.cloudinary.com/dbcpfy04c/image/upload/v1748450296/pin_4_17_u4mvin.webp,home-safety-tips,,https://www.beacleaner.com/how-to-clean-windows-with-pressure-washer?utm_source=pinterest&utm_campaign=pressure-washing-win,2025-05-28,"Whether you have single-pane or double-pane windows, this guide has you covered! Learn how to adapt your pressure washing technique to different window types.  Get tailored advice for optimal results.  Don't risk damage – clean with confidence! Click to learn more.","Window Types,Pressure Washing,Home Maintenance,Cleaning Guide"
From Grimy to Gleaming: Pressure Wash Windows,https://res.cloudinary.com/dbcpfy04c/image/upload/v1748450302/pin_4_18_an4pbk.webp,home-cleaning-tips,,https://www.beacleaner.com/how-to-clean-windows-with-pressure-washer?utm_source=pinterest&utm_campaign=from-grimy-to-gleami,2025-05-28,See the dramatic transformation from grimy to gleaming! This post showcases the power of pressure washing to restore windows to their former glory.  Get inspired and tackle your own window cleaning project.  Imagine the satisfaction of a sparkling clean home! Click to see the transformation.,"Grimy to Gleaming,Window Transformation,Pressure Washing,Home Cleaning"
Pressure Wash Windows: The Ultimate Checklist,https://res.cloudinary.com/dbcpfy04c/image/upload/v1748450308/pin_4_19_gkqegq.webp,home-cleaning-tips,,https://www.beacleaner.com/how-to-clean-windows-with-pressure-washer?utm_source=pinterest&utm_campaign=pressure-wash-window,2025-05-28,"Don't forget a thing! This post provides a comprehensive checklist to ensure a successful pressure washing experience.  From tools to safety precautions, we've got everything covered.  Stay organized and achieve professional results. Click to get the checklist.","Checklist,Pressure Washing,Window Cleaning,Home Maintenance"
Pressure Washing Windows: Cost vs. Professional,https://res.cloudinary.com/dbcpfy04c/image/upload/v1748450313/pin_4_20_hvmsud.webp,home-safety-tips,,https://www.beacleaner.com/how-to-clean-windows-with-pressure-washer?utm_source=pinterest&utm_campaign=pressure-washing-win,2025-05-28,Should you DIY or hire a pro? This post compares the cost of pressure washing windows yourself versus hiring a professional cleaning service.  Make an informed decision and save money.  Weigh the pros and cons and choose the best option for you. Click to learn more.,"Cost Comparison,DIY vs Pro,Pressure Washing,Window Cleaning"
Extend Window Life: Pressure Washing Done Right,https://res.cloudinary.com/dbcpfy04c/image/upload/v1748450320/pin_4_21_gfg4l7.webp,home-maintenance-tips,,https://www.beacleaner.com/how-to-clean-windows-with-pressure-washer?utm_source=pinterest&utm_campaign=extend-window-life-p,2025-05-28,Protect your window investment! This post explains how to pressure wash windows correctly to extend their lifespan.  Avoid damage and maintain their clarity for years to come.  Don't risk costly repairs – clean with care! Click to learn how.,"Window Care,Pressure Washing,Home Maintenance,Longevity"
Pressure Wash Windows: Eco-Friendly Cleaning,https://res.cloudinary.com/dbcpfy04c/image/upload/v1748450326/pin_4_22_am7to1.webp,home-cleaning-tips,,https://www.beacleaner.com/how-to-clean-windows-with-pressure-washer?utm_source=pinterest&utm_campaign=pressure-wash-window,2025-05-28,Clean your windows without harming the environment! This post explores eco-friendly cleaning solutions for pressure washing.  Reduce your carbon footprint and enjoy a sparkling clean home.  Do your part for the planet! Click to learn more.,"Eco-Friendly Cleaning,Pressure Washing,Green Cleaning,Sustainable Living"
Pressure Washing Windows: Quick & Easy Tips,https://res.cloudinary.com/dbcpfy04c/image/upload/v1748450335/pin_4_23_agz9mh.webp,home-safety-tips,,https://www.beacleaner.com/how-to-clean-windows-with-pressure-washer?utm_source=pinterest&utm_campaign=pressure-washing-win,2025-05-28,Short on time? This post provides quick and easy tips for pressure washing windows efficiently.  Get sparkling results without spending hours scrubbing.  Maximize your time and enjoy a cleaner home. Click for quick tips.,"Quick Tips,Pressure Washing,Window Cleaning,Time Saving"
