Title,Media URL,Pinterest board,Thumbnail,Link,Publish date,Description,Keywords
Softest Chamois Ever: Conditioning Secrets,https://res.cloudinary.com/dbcpfy04c/image/upload/v1748371010/pin_4_7_wur0le.webp,car-detailing-tips,,https://www.beacleaner.com/how-to-clean-chamois?utm_source=pinterest&utm_campaign=softest-chamois-ever,2025-05-27,"Want a chamois that feels like butter?  Discover the secrets to conditioning your chamois for ultimate softness and absorbency.  This guide explains how to use conditioners to restore the natural oils in the leather, preventing cracking and extending its life.  A well-conditioned chamois is a joy to use and delivers a superior cleaning experience.  Click to learn the best conditioning methods!","Chamois conditioning,Leather softener,Car care products,Detailing supplies"
Chamois vs. Microfiber: Which is Best?,https://res.cloudinary.com/dbcpfy04c/image/upload/v1748371015/pin_4_8_mtumnx.webp,car-detailing-tips,,https://www.beacleaner.com/how-to-clean-chamois?utm_source=pinterest&utm_campaign=chamois-vs-microfibe,2025-05-27,"Confused about which to use – a chamois or microfiber?  This article breaks down the pros and cons of each, helping you choose the right tool for your car cleaning needs.  We discuss absorbency, scratch potential, durability, and cost.  Make an informed decision and achieve a flawless finish.  Learn which one reigns supreme for your detailing tasks!","Chamois vs microfiber,Car cleaning tools,Detailing comparison,Auto accessories"
Extend Your Chamois Life: Storage Tips,https://res.cloudinary.com/dbcpfy04c/image/upload/v1748371021/pin_4_9_an7g8e.webp,car-care-tips,,https://www.beacleaner.com/how-to-clean-chamois?utm_source=pinterest&utm_campaign=extend-your-chamois-,2025-05-27,"Proper storage is key to a long-lasting chamois!  Learn how to store your chamois correctly to prevent mold, mildew, and cracking.  This guide provides practical tips for keeping your chamois fresh and ready to use.  A little care goes a long way – protect your investment and enjoy years of reliable performance.  Click to discover the best storage solutions!","Chamois storage,Car care,Detailing,Leather preservation"
Chamois Cleaning for Showroom Shine,https://res.cloudinary.com/dbcpfy04c/image/upload/v1748371026/pin_4_10_mgqj6y.webp,car-detailing-tips,,https://www.beacleaner.com/how-to-clean-chamois?utm_source=pinterest&utm_campaign=chamois-cleaning-for,2025-05-27,"Dreaming of a showroom-worthy finish?  A clean chamois is essential!  This guide shows you how to clean your chamois to perfection, ensuring a streak-free, scratch-free shine.  We cover everything from rinsing to drying to conditioning, leaving no detail untouched.  Achieve professional results without the professional price tag.  Click to learn the secrets!","Showroom shine,Car detailing,Chamois cleaning,Auto polish"
Quick Chamois Clean: 5-Minute Guide,https://res.cloudinary.com/dbcpfy04c/image/upload/v1748371033/pin_4_11_uuw5a7.webp,car-detailing-tips,,https://www.beacleaner.com/how-to-clean-chamois?utm_source=pinterest&utm_campaign=quick-chamois-clean-,2025-05-27,Short on time?  You can still give your chamois a quick clean!  This pin links to a 5-minute guide that shows you how to remove surface dirt and grime in a flash.  Perfect for busy car enthusiasts who want to maintain a clean chamois without spending hours detailing.  Keep your car looking its best with minimal effort.  Click to learn the quick clean method!,"Quick clean,Chamois,Car wash,Detailing hacks"
Chamois Cleaning: Natural Solutions,https://res.cloudinary.com/dbcpfy04c/image/upload/v1748371041/pin_4_12_ybq9xp.webp,car-detailing-tips,,https://www.beacleaner.com/how-to-clean-chamois?utm_source=pinterest&utm_campaign=chamois-cleaning-nat,2025-05-27,Prefer natural cleaning methods?  This guide reveals how to clean your chamois using eco-friendly solutions.  We explore the use of gentle soaps and conditioners that are safe for your chamois and the environment.  Enjoy a clean car and a clear conscience.  Click to discover the natural cleaning secrets!,"Natural cleaning,Chamois,Eco-friendly,Car care"
Is Your Chamois Ruining Your Paint?,https://res.cloudinary.com/dbcpfy04c/image/upload/v1748371050/pin_4_13_rhqzbc.webp,car-detailing-tips,,https://www.beacleaner.com/how-to-clean-chamois?utm_source=pinterest&utm_campaign=is-your-chamois-ruin,2025-05-27,Don't let a dirty chamois damage your car's finish!  Learn how to identify a dirty chamois and the potential risks it poses.  This guide emphasizes the importance of regular cleaning and maintenance to prevent scratches and swirls.  Protect your investment and keep your car looking its best.  Click to learn how to avoid paint damage!,"Paint protection,Chamois,Car scratches,Detailing safety"
Chamois Cleaning: Before & After Results,https://res.cloudinary.com/dbcpfy04c/image/upload/v1748371056/pin_4_14_jeldgq.webp,car-detailing-tips,,https://www.beacleaner.com/how-to-clean-chamois?utm_source=pinterest&utm_campaign=chamois-cleaning-bef,2025-05-27,"See the amazing transformation! This pin showcases before-and-after photos of a dirty chamois being restored to its former glory.  Visual proof that cleaning your chamois is worth the effort.  Inspire yourself to tackle the task and enjoy a cleaner, more absorbent chamois.  Click to see the incredible results!","Before and after,Chamois cleaning,Car detailing,Visual guide"
Chamois Care: A Beginner's Guide,https://res.cloudinary.com/dbcpfy04c/image/upload/v1748371063/pin_4_15_lnlkdy.webp,car-detailing-tips,,https://www.beacleaner.com/how-to-clean-chamois?utm_source=pinterest&utm_campaign=chamois-care-a-begin,2025-05-27,"New to car detailing?  This beginner-friendly guide walks you through everything you need to know about chamois care.  We cover the basics of cleaning, conditioning, and storage, ensuring you get the most out of your chamois.  Start your detailing journey with confidence.  Click to learn the fundamentals!","Beginner's guide,Chamois,Car detailing,Auto care"
Chamois Cleaning: Troubleshooting Common Issues,https://res.cloudinary.com/dbcpfy04c/image/upload/v1748371069/pin_4_16_hnvkos.webp,car-detailing-tips,,https://www.beacleaner.com/how-to-clean-chamois?utm_source=pinterest&utm_campaign=chamois-cleaning-tro,2025-05-27,Struggling with stubborn stains or odors?  This guide provides troubleshooting tips for common chamois cleaning issues.  We address everything from oil stains to mildew to help you restore your chamois to its optimal condition.  Don't give up – we've got you covered!,"Chamois troubleshooting,Cleaning tips,Car care,Detailing solutions"
The Secret to a Streak-Free Finish: Chamois!,https://res.cloudinary.com/dbcpfy04c/image/upload/v1748371080/pin_4_17_poiutr.webp,car-detailing-tips,,https://www.beacleaner.com/how-to-clean-chamois?utm_source=pinterest&utm_campaign=the-secret-to-a-stre,2025-05-27,"Want a truly streak-free finish on your car?  A clean chamois is the key!  This guide explains how to use a chamois to achieve a flawless, polished look.  We cover proper technique and cleaning methods to ensure a perfect result every time.  Impress your friends with your detailing skills.","Streak-free finish,Chamois,Car detailing,Auto polish"
Chamois Cleaning: The Pro's Method,https://res.cloudinary.com/dbcpfy04c/image/upload/v1748371086/pin_4_18_y0qgya.webp,car-detailing-tips,,https://www.beacleaner.com/how-to-clean-chamois?utm_source=pinterest&utm_campaign=chamois-cleaning-the,2025-05-27,Learn the techniques used by professional detailers!  This guide reveals the secrets to cleaning and maintaining a chamois like a pro.  We cover advanced cleaning methods and conditioning techniques to ensure optimal performance.  Elevate your detailing game.,"Pro detailing,Chamois cleaning,Car care,Detailing secrets"
Chamois: Natural vs. Synthetic - What's the Difference?,https://res.cloudinary.com/dbcpfy04c/image/upload/v1748371093/pin_4_19_tvmy4m.webp,car-detailing-tips,,https://www.beacleaner.com/how-to-clean-chamois?utm_source=pinterest&utm_campaign=chamois-natural-vs-s,2025-05-27,"Not all chamois are created equal! This pin leads to an article explaining the differences between natural and synthetic chamois, helping you choose the best option for your needs. We discuss absorbency, durability, and cost.","Natural chamois,Synthetic chamois,Car cleaning,Detailing comparison"
Chamois Cleaning: Preventative Maintenance,https://res.cloudinary.com/dbcpfy04c/image/upload/v1748371099/pin_4_20_twdxcz.webp,car-detailing-tips,,https://www.beacleaner.com/how-to-clean-chamois?utm_source=pinterest&utm_campaign=chamois-cleaning-pre,2025-05-27,"Don't wait until your chamois is filthy! This guide focuses on preventative maintenance, showing you how to keep your chamois clean and in good condition with regular, simple steps. A little prevention saves a lot of restoration.","Preventative maintenance,Chamois,Car care,Detailing tips"
Chamois Cleaning: The Best Soaps to Use,https://res.cloudinary.com/dbcpfy04c/image/upload/v1748371104/pin_4_21_jcm3ds.webp,car-detailing-tips,,https://www.beacleaner.com/how-to-clean-chamois?utm_source=pinterest&utm_campaign=chamois-cleaning-the,2025-05-27,"Choosing the right soap is crucial! This pin links to a guide detailing the best soaps for cleaning your chamois, ensuring you don't damage the leather or reduce its absorbency. Protect your investment with the right products.","Chamois soap,Leather cleaner,Car detailing,Cleaning products"
Chamois Care: A Visual Step-by-Step Guide,https://res.cloudinary.com/dbcpfy04c/image/upload/v1748371110/pin_4_22_yahhmt.webp,car-detailing-tips,,https://www.beacleaner.com/how-to-clean-chamois?utm_source=pinterest&utm_campaign=chamois-care-a-visua,2025-05-27,"Sometimes, you just need to *see* it! This pin features a visual, step-by-step guide to cleaning your chamois, making it easy to follow along and achieve professional results.","Visual guide,Chamois cleaning,Car detailing,Step-by-step"
Chamois Cleaning: Revive Old & Stiff Chamois,https://res.cloudinary.com/dbcpfy04c/image/upload/v1748371116/pin_4_23_hnimzv.webp,car-detailing-tips,,https://www.beacleaner.com/how-to-clean-chamois?utm_source=pinterest&utm_campaign=chamois-cleaning-rev,2025-05-27,"Is your chamois old and stiff? Don't despair! This guide shows you how to revive even the most neglected chamois, restoring its softness and absorbency. Give your chamois a second life!","Revive chamois,Old chamois,Car detailing,Leather restoration"
Chamois Cleaning: The Ultimate FAQ,https://res.cloudinary.com/dbcpfy04c/image/upload/v1748371122/pin_4_24_c5dplu.webp,car-detailing-tips,,https://www.beacleaner.com/how-to-clean-chamois?utm_source=pinterest&utm_campaign=chamois-cleaning-the,2025-05-27,"Got questions about chamois cleaning? This pin leads to a comprehensive FAQ that answers all your burning questions, from cleaning methods to storage tips.","Chamois FAQ,Car detailing,Cleaning questions,Auto care"
Chamois Cleaning: Save Money & the Environment!,https://res.cloudinary.com/dbcpfy04c/image/upload/v1748371127/pin_4_25_fg9b6d.webp,car-detailing-tips,,https://www.beacleaner.com/how-to-clean-chamois?utm_source=pinterest&utm_campaign=chamois-cleaning-sav,2025-05-27,Reduce waste and save money by cleaning your chamois instead of replacing it! This pin highlights the environmental and financial benefits of proper chamois care.,"Eco-friendly cleaning,Chamois,Save money,Sustainable car care"
Title,https://res.cloudinary.com/dbcpfy04c/image/upload/v1748371168/pin_5_1_esku5s.webp,please-provide-the-title-and-keywords-i-need-that-information-to-suggest-a-board-name-once,,https://www.beacleaner.com/how-to-clean-cloudy-skylights?utm_source=pinterest&utm_campaign=title,2025-05-27,Description,Keywords
Cloudy Skylights? Fix It!,https://res.cloudinary.com/dbcpfy04c/image/upload/v1748371174/pin_5_2_vp2k0x.webp,cleaning-tips,,https://www.beacleaner.com/how-to-clean-cloudy-skylights?utm_source=pinterest&utm_campaign=cloudy-skylights-fix,2025-05-27,Is your beautiful skylight looking dull and cloudy? Don't replace it! Our guide reveals simple,effective steps to restore crystal-clear views and brighten your home. Learn how to safely clean away grime
Skylight Cleaning Secrets,https://res.cloudinary.com/dbcpfy04c/image/upload/v1748371181/pin_5_3_qyr8kj.webp,home-cleaning-tips,,https://www.beacleaner.com/how-to-clean-cloudy-skylights?utm_source=pinterest&utm_campaign=skylight-cleaning-se,2025-05-27,Don't let a dirty skylight steal your sunshine! This post breaks down the best cleaning methods,from gentle daily care to tackling tough stains. We cover everything you need – tools
Skylight Cleaning: Before & After,https://res.cloudinary.com/dbcpfy04c/image/upload/v1748371187/pin_5_4_e59hid.webp,home-cleaning-tips,,https://www.beacleaner.com/how-to-clean-cloudy-skylights?utm_source=pinterest&utm_campaign=skylight-cleaning-be,2025-05-27,Witness the amazing transformation! See stunning before-and-after photos of cloudy skylights restored to their former glory.  This post will inspire you to tackle this easy project and enjoy a brighter,more cheerful home.  Don't wait
The Best Skylight Cleaner,https://res.cloudinary.com/dbcpfy04c/image/upload/v1748371193/pin_5_5_etiukg.webp,home-cleaning-tips,,https://www.beacleaner.com/how-to-clean-cloudy-skylights?utm_source=pinterest&utm_campaign=the-best-skylight-cl,2025-05-27,Wondering what cleaning solution to use? We reveal the best cleaners for skylights,including DIY options and commercial products.  Learn which solutions are safe for your skylight material and will deliver a streak-free shine.  Get the right tools for the job! #SkylightCleaner #CleaningProducts #HomeTips #CleaningSolutions
The Ultimate Skylight Guide,https://res.cloudinary.com/dbcpfy04c/image/upload/v1748371200/pin_5_6_zpk7hu.webp,home-cleaning-tips,,https://www.beacleaner.com/how-to-clean-cloudy-skylights?utm_source=pinterest&utm_campaign=the-ultimate-skyligh,2025-05-27,Everything you need to know about cleaning and maintaining your skylights is right here! From identifying your skylight type to choosing the right cleaning method,we've got you covered.  Become a skylight cleaning pro! #SkylightGuide #HomeExpert #CleaningKnowledge #SkylightCare
Skylight Cleaning: Tools You Need,https://res.cloudinary.com/dbcpfy04c/image/upload/v1748371206/pin_5_7_jeu4jh.webp,home-cleaning-tips,,https://www.beacleaner.com/how-to-clean-cloudy-skylights?utm_source=pinterest&utm_campaign=skylight-cleaning-to,2025-05-27,Gather your supplies! This post lists all the essential tools you'll need for a successful skylight cleaning.  From buckets and sponges to specialized cleaners,we've got you covered. #CleaningTools #SkylightSupplies #HomeEssentials #CleaningGear
Skylight Cleaning: Step-by-Step,https://res.cloudinary.com/dbcpfy04c/image/upload/v1748371212/pin_5_8_lddms3.webp,home-cleaning-tips,,https://www.beacleaner.com/how-to-clean-cloudy-skylights?utm_source=pinterest&utm_campaign=skylight-cleaning-st,2025-05-27,Follow our easy-to-follow,step-by-step guide to cleaning your skylight.  We break down the process into manageable steps
Restore Your View Today!,https://res.cloudinary.com/dbcpfy04c/image/upload/v1748371218/pin_5_9_u8vcu1.webp,home-improvement-ideas,,https://www.beacleaner.com/how-to-clean-cloudy-skylights?utm_source=pinterest&utm_campaign=restore-your-view-to,2025-05-27,Don't live with a cloudy skylight any longer!  This post empowers you to take action and restore your view.  Enjoy a brighter,more inviting home with a sparkling clean skylight. #RestoreYourView #HomeImprovement #CleaningMotivation #BrightenYourLife
Skylight Cleaning,https://res.cloudinary.com/dbcpfy04c/image/upload/v1748371224/pin_5_10_cbwayg.webp,home-cleaning-tips,,https://www.beacleaner.com/how-to-clean-cloudy-skylights?utm_source=pinterest&utm_campaign=skylight-cleaning,2025-05-27,Skylight Cleaning,Skylight Cleaning
