Title,Media URL,Pinterest board,Thumbnail,Link,Publish date,Description,Keywords
Title,https://res.cloudinary.com/dbcpfy04c/image/upload/v1748449602/pin_1_1_gjjeuz.webp,please-provide-the-title-and-keywords-i-need-that-information-to-suggest-a-board-name-once,,https://www.beacleaner.com/how-to-clean-windows-after-power-washing?utm_source=pinterest&utm_campaign=title,2025-05-28,Description,Keywords
Sparkling Windows After Power Washing!,https://res.cloudinary.com/dbcpfy04c/image/upload/v1748449611/pin_1_2_xhokwq.webp,home-maintenance-tips,,https://www.beacleaner.com/how-to-clean-windows-after-power-washing?utm_source=pinterest&utm_campaign=sparkling-windows-af,2025-05-28,“Just power washed your house? Don't let streaks ruin the curb appeal! This guide reveals the *essential* steps to achieve crystal-clear windows after power washing. We cover everything from rinsing techniques to the best cleaning solutions for a spotless finish.  Avoid common mistakes that lead to water spots and residue.  Imagine enjoying the view through perfectly clean windows – it's easier than you think! Click to learn how to protect your investment and make your home shine.  Don't let all that hard work go to waste!,"Power Washing, Window Cleaning, Home Maintenance, Curb Appeal"
Power Wash Then What? Window Cleaning!,https://res.cloudinary.com/dbcpfy04c/image/upload/v1748449617/pin_1_3_j7p4cy.webp,cleaning-tips,,https://www.beacleaner.com/how-to-clean-windows-after-power-washing?utm_source=pinterest&utm_campaign=power-wash-then-what,2025-05-28,“You’ve power washed – now what?  This post is your ultimate guide to cleaning windows *after* power washing.  We break down the process into simple,manageable steps
Streak-Free Windows: Power Wash Guide,https://res.cloudinary.com/dbcpfy04c/image/upload/v1748449627/pin_1_4_iociyw.webp,home-cleaning-tips,,https://www.beacleaner.com/how-to-clean-windows-after-power-washing?utm_source=pinterest&utm_campaign=streak-free-windows-,2025-05-28,“Tired of streaks after power washing?  This guide reveals the secrets to achieving truly streak-free windows! We'll show you how to properly rinse away cleaning solutions and prevent water spots.  Discover the right techniques for different window types and materials.  Imagine the satisfaction of looking out spotless windows!  Protect your investment and boost your home's value.  Click to learn the pro tips you need for a flawless finish.,"Streak Free, Window Washing, Power Washing Tips, Home Value"
Don't Ruin Your Windows! (Power Wash),https://res.cloudinary.com/dbcpfy04c/image/upload/v1748449633/pin_1_5_wk8hrk.webp,home-cleaning-tips,,https://www.beacleaner.com/how-to-clean-windows-after-power-washing?utm_source=pinterest&utm_campaign=dont-ruin-your-windo,2025-05-28,“Power washing can be amazing,but it can also damage your windows if you're not careful!  This post details how to avoid common mistakes and protect your glass.  Learn about the right pressure settings
Best Window Cleaner After Power Washing,https://res.cloudinary.com/dbcpfy04c/image/upload/v1748449639/pin_1_6_nnqapl.webp,cleaning-tips,,https://www.beacleaner.com/how-to-clean-windows-after-power-washing?utm_source=pinterest&utm_campaign=best-window-cleaner-,2025-05-28,“Wondering what the best window cleaner is *after* power washing? We've got you covered! This post reviews top-rated cleaners and DIY solutions for a sparkling finish.  Learn which products effectively remove residue and leave your windows crystal clear.  Stop wasting money on ineffective cleaners!  Get the perfect shine with our expert recommendations.  Click to discover the best options for your needs.,"Window Cleaner, Cleaning Products, DIY Cleaning, Residue Removal"
DIY Window Cleaning After Power Wash,https://res.cloudinary.com/dbcpfy04c/image/upload/v1748449646/pin_1_7_yfrqxb.webp,cleaning-tips,,https://www.beacleaner.com/how-to-clean-windows-after-power-washing?utm_source=pinterest&utm_campaign=diy-window-cleaning-,2025-05-28,“Save money and get amazing results with our DIY window cleaning guide!  This post provides simple,"effective recipes using ingredients you probably already have at home.  Learn how to create a streak-free solution that's gentle on your windows and the environment.  Feel good about cleaning with natural ingredients!  Click to learn how to make your own powerful window cleaner."""
Power Washing Windows: Step-by-Step,https://res.cloudinary.com/dbcpfy04c/image/upload/v1748449653/pin_1_8_qdhbck.webp,home-cleaning-tips,,https://www.beacleaner.com/how-to-clean-windows-after-power-washing?utm_source=pinterest&utm_campaign=power-washing-window,2025-05-28,“Confused about cleaning windows after power washing?  This post provides a clear,step-by-step guide to help you achieve a professional-level clean.  From rinsing to drying
Water Spots After Power Wash? Fix It!,https://res.cloudinary.com/dbcpfy04c/image/upload/v1748449659/pin_1_9_rh7enu.webp,window-cleaning-tips,,https://www.beacleaner.com/how-to-clean-windows-after-power-washing?utm_source=pinterest&utm_campaign=water-spots-after-po,2025-05-28,“Ugh,"water spots!  Don't let them ruin your freshly power washed windows.  This post explains how to remove existing water spots and prevent new ones from forming.  Learn about the causes of water spots and the best solutions for tackling them.  Restore your windows to their original shine!  Click to learn how to banish those pesky spots."""
The Right Tools for Post-Wash Windows,https://res.cloudinary.com/dbcpfy04c/image/upload/v1748449665/pin_1_10_zdbcr7.webp,cleaning-tips,,https://www.beacleaner.com/how-to-clean-windows-after-power-washing?utm_source=pinterest&utm_campaign=the-right-tools-for-,2025-05-28,“Having the right tools makes all the difference!  This post highlights the essential tools you need to clean windows effectively after power washing.  From squeegees to microfiber cloths,"we'll help you equip yourself for success.  Invest in quality tools for long-lasting results!  Click to discover the must-have items for a sparkling clean."""
Protect Your Window Screens (Power Wash),https://res.cloudinary.com/dbcpfy04c/image/upload/v1748449673/pin_1_11_aavm0m.webp,home-maintenance-tips,,https://www.beacleaner.com/how-to-clean-windows-after-power-washing?utm_source=pinterest&utm_campaign=protect-your-window-,2025-05-28,“Don't forget your window screens!  This post explains how to protect them during and after power washing.  Learn how to clean screens effectively without damaging them.  Extend the life of your screens and keep your home looking its best.  Click to learn the simple steps to screen care.,"Window Screens, Screen Cleaning, Power Wash Prep, Home Protection"
Power Washing & Hard Water: Window Tips,https://res.cloudinary.com/dbcpfy04c/image/upload/v1748449680/pin_1_12_ouepts.webp,window-cleaning-tips,,https://www.beacleaner.com/how-to-clean-windows-after-power-washing?utm_source=pinterest&utm_campaign=power-washing-hard-w,2025-05-28,“Dealing with hard water?  This post offers specific tips for cleaning windows after power washing when you have hard water.  Learn how to prevent mineral deposits and achieve a streak-free shine.  Don't let hard water ruin your results!  Click to learn the solutions for your water type.,"Hard Water, Mineral Deposits, Water Treatment, Window Shine"
Professional Window Cleaning Secrets,https://res.cloudinary.com/dbcpfy04c/image/upload/v1748449686/pin_1_13_rslzun.webp,cleaning-tips,,https://www.beacleaner.com/how-to-clean-windows-after-power-washing?utm_source=pinterest&utm_campaign=professional-window-,2025-05-28,“Want windows that look professionally cleaned?  This post reveals the secrets used by the pros!  Learn about their techniques,tools
Quick Window Clean After Power Washing,https://res.cloudinary.com/dbcpfy04c/image/upload/v1748449692/pin_1_14_y6ug0d.webp,cleaning-tips,,https://www.beacleaner.com/how-to-clean-windows-after-power-washing?utm_source=pinterest&utm_campaign=quick-window-clean-a,2025-05-28,“Short on time?  This post provides a quick and easy method for cleaning windows after power washing.  Get a sparkling clean in minutes!  Perfect for busy homeowners.  Don't sacrifice cleanliness for convenience.  Click to learn the fast track to spotless windows.,"Quick Clean, Fast Cleaning, Time Saving, Efficient Cleaning"
Power Wash Window Cleaning Checklist,https://res.cloudinary.com/dbcpfy04c/image/upload/v1748449699/pin_1_15_j92n9n.webp,cleaning-tips,,https://www.beacleaner.com/how-to-clean-windows-after-power-washing?utm_source=pinterest&utm_campaign=power-wash-window-cl,2025-05-28,“Stay organized with our handy checklist!  This post provides a comprehensive checklist to ensure you don't miss a step when cleaning windows after power washing.  From prep to finish,"we've got you covered.  Simplify the process and achieve perfect results.  Click to download the free checklist!"""
Avoid These Mistakes! (Power Wash Windows),https://res.cloudinary.com/dbcpfy04c/image/upload/v1748449706/pin_1_16_rl98sb.webp,window-cleaning-tips,,https://www.beacleaner.com/how-to-clean-windows-after-power-washing?utm_source=pinterest&utm_campaign=avoid-these-mistakes,2025-05-28,“Don't make these common mistakes!  This post highlights the errors people often make when cleaning windows after power washing.  Learn what *not* to do to avoid streaks,damage
Best Time to Clean Windows After Wash,https://res.cloudinary.com/dbcpfy04c/image/upload/v1748449713/pin_1_17_m1jc69.webp,cleaning-tips,,https://www.beacleaner.com/how-to-clean-windows-after-power-washing?utm_source=pinterest&utm_campaign=best-time-to-clean-w,2025-05-28,“Timing is everything!  This post explains the best time of day to clean windows after power washing for optimal results.  Avoid direct sunlight and achieve a streak-free shine.  Maximize your cleaning efforts with our expert advice.  Click to learn the ideal timing for a perfect clean.,"Best Time to Clean, Timing Tips, Sunlight, Cleaning Schedule"
Power Washing & Tinted Windows: Care,https://res.cloudinary.com/dbcpfy04c/image/upload/v1748449718/pin_1_18_pslzrj.webp,window-cleaning-tips,,https://www.beacleaner.com/how-to-clean-windows-after-power-washing?utm_source=pinterest&utm_campaign=power-washing-tinted,2025-05-28,“Have tinted windows?  This post provides specific care instructions for cleaning them after power washing.  Protect your tint and maintain its effectiveness.  Learn about the right solutions and techniques to use.  Click to learn how to care for your tinted windows.,"Tinted Windows, Window Tint, Car Care, Window Protection"
Power Wash Window Cleaning on a Budget,https://res.cloudinary.com/dbcpfy04c/image/upload/v1748449724/pin_1_19_ijk2lh.webp,cleaning-tips,,https://www.beacleaner.com/how-to-clean-windows-after-power-washing?utm_source=pinterest&utm_campaign=power-wash-window-cl,2025-05-28,“Clean windows don't have to break the bank!  This post offers budget-friendly tips for cleaning windows after power washing.  Save money with DIY solutions and affordable tools.  Get a sparkling clean without spending a fortune.  Click to learn how to clean on a budget.,"Budget Cleaning, Affordable Cleaning, DIY Solutions, Money Saving"
How to Rinse Windows After Power Wash,https://res.cloudinary.com/dbcpfy04c/image/upload/v1748449731/pin_1_20_yrledb.webp,window-cleaning-tips,,https://www.beacleaner.com/how-to-clean-windows-after-power-washing?utm_source=pinterest&utm_campaign=how-to-rinse-windows,2025-05-28,“The rinse is crucial! This post details the best techniques for rinsing windows after power washing to prevent streaks and residue. Learn about different nozzle types and water pressure settings.  Achieve a crystal-clear finish with our expert guidance. Click to learn the rinsing secrets!,"Rinsing Techniques, Water Pressure, Nozzle Types, Streak Prevention"
Power Washing & Window Frames: Cleaning,https://res.cloudinary.com/dbcpfy04c/image/upload/v1748449737/pin_1_21_pittcn.webp,window-cleaning-tips,,https://www.beacleaner.com/how-to-clean-windows-after-power-washing?utm_source=pinterest&utm_campaign=power-washing-window,2025-05-28,“Don't forget the frames! This post explains how to clean window frames after power washing,removing dirt
Long-Term Window Care After Power Wash,https://res.cloudinary.com/dbcpfy04c/image/upload/v1748449744/pin_1_22_crhkea.webp,window-care-tips,,https://www.beacleaner.com/how-to-clean-windows-after-power-washing?utm_source=pinterest&utm_campaign=long-term-window-car,2025-05-28,“Keep your windows sparkling for longer! This post provides tips for long-term window care after power washing,"including regular cleaning and maintenance. Protect your investment and enjoy a beautiful view. Click to learn how to maintain your clean windows."""
Troubleshooting: Streaks After Power Wash,https://res.cloudinary.com/dbcpfy04c/image/upload/v1748449752/pin_1_23_vw9lbu.webp,cleaning-tips,,https://www.beacleaner.com/how-to-clean-windows-after-power-washing?utm_source=pinterest&utm_campaign=troubleshooting-stre,2025-05-28,“Still seeing streaks? This post offers troubleshooting tips for resolving streak issues after power washing your windows. Identify the cause and find the solution.  Don't give up on a streak-free shine! Click to learn how to fix those streaks.,"Streak Troubleshooting, Problem Solving, Cleaning Solutions, Window Issues"
Power Wash Window Cleaning: Before & After,https://res.cloudinary.com/dbcpfy04c/image/upload/v1748449758/pin_1_24_bmzhpw.webp,cleaning-tips,,https://www.beacleaner.com/how-to-clean-windows-after-power-washing?utm_source=pinterest&utm_campaign=power-wash-window-cl,2025-05-28,“See the amazing results! This post showcases before-and-after photos of windows cleaned after power washing.  Get inspired and see the difference a proper cleaning can make.  Visualize your own sparkling windows! Click to see the transformation.,"Before and After, Cleaning Results, Visual Inspiration, Home Transformation"
Is Power Washing Bad for Windows?,https://res.cloudinary.com/dbcpfy04c/image/upload/v1748449765/pin_1_25_vii64p.webp,home-maintenance-tips,,https://www.beacleaner.com/how-to-clean-windows-after-power-washing?utm_source=pinterest&utm_campaign=is-power-washing-bad,2025-05-28,“Worried about damage? This post addresses the question of whether power washing is bad for windows and provides tips for minimizing risk. Learn how to protect your glass and avoid costly repairs.  Clean with confidence! Click to learn about window safety.,"Window Safety, Power Wash Risks, Damage Prevention, Home Protection"
Title,https://res.cloudinary.com/dbcpfy04c/image/upload/v1748449808/pin_2_1_utvqid.webp,please-provide-the-title-and-keywords-i-need-that-information-to-suggest-a-board-name-once,,https://www.beacleaner.com/how-to-clean-windows-with-newspaper?utm_source=pinterest&utm_campaign=title,2025-05-28,Description,Keywords
Sparkling Windows: Newspaper Cleaning!,https://res.cloudinary.com/dbcpfy04c/image/upload/v1748449814/pin_2_2_f4iaql.webp,home-maintenance-tips,,https://www.beacleaner.com/how-to-clean-windows-with-newspaper?utm_source=pinterest&utm_campaign=sparkling-windows-ne,2025-05-28,Tired of streaks and smudges ruining your view? Discover the surprisingly effective (and eco-friendly!) method of cleaning windows with newspaper! This guide breaks down the simple steps,from mixing your cleaning solution to achieving a flawless
Newspaper Window Cleaning: The Secret!,https://res.cloudinary.com/dbcpfy04c/image/upload/v1748449822/pin_2_3_t0pwed.webp,cleaning-tips,,https://www.beacleaner.com/how-to-clean-windows-with-newspaper?utm_source=pinterest&utm_campaign=newspaper-window-cle,2025-05-28,Unlock the secret to sparkling windows without harsh chemicals! This post reveals how newspaper can deliver a professional-quality clean,leaving your windows spotless and your wallet happy. We'll show you exactly what kind of newspaper to use
Newspaper & Windows: A Cleaning Duo!,https://res.cloudinary.com/dbcpfy04c/image/upload/v1748449830/pin_2_4_nau5lr.webp,cleaning-tips,,https://www.beacleaner.com/how-to-clean-windows-with-newspaper?utm_source=pinterest&utm_campaign=newspaper-windows-a-,2025-05-28,Did you know newspaper is a fantastic window cleaning tool? This post explains the science behind why it works so well,offering a natural and effective alternative to commercial cleaners. We'll guide you through the process
Budget-Friendly Window Cleaning!,https://res.cloudinary.com/dbcpfy04c/image/upload/v1748449847/pin_2_5_b7t4iv.webp,cleaning-tips,,https://www.beacleaner.com/how-to-clean-windows-with-newspaper?utm_source=pinterest&utm_campaign=budget-friendly-wind,2025-05-28,Save money and get sparkling windows with this clever newspaper cleaning hack! This post provides a detailed guide on how to use newspaper to achieve a professional-quality clean without breaking the bank. It's a simple,eco-friendly solution that anyone can do. Click to learn more and start saving! #CheapCleaning #WindowCleaning #HomeHacks #BudgetFriendly
Newspaper: Your Window's Best Friend!,https://res.cloudinary.com/dbcpfy04c/image/upload/v1748449853/pin_2_6_db1omy.webp,window-treatments-ideas,,https://www.beacleaner.com/how-to-clean-windows-with-newspaper?utm_source=pinterest&utm_campaign=newspaper-your-windo,2025-05-28,Give your windows the love they deserve with this surprisingly effective cleaning method! This post reveals how newspaper can cut through grime and leave your windows sparkling clean. We'll share tips for avoiding streaks,choosing the right newspaper
Goodbye Streaks! Hello Newspaper!,https://res.cloudinary.com/dbcpfy04c/image/upload/v1748449862/pin_2_7_svqzlq.webp,cleaning-tips,,https://www.beacleaner.com/how-to-clean-windows-with-newspaper?utm_source=pinterest&utm_campaign=goodbye-streaks-hell,2025-05-28,Frustrated with streaky windows? This post offers a simple,yet powerful solution: newspaper! Learn how to use this everyday item to achieve a crystal-clear shine without harsh chemicals. We'll walk you through the process
Eco-Friendly Window Cleaning Guide,https://res.cloudinary.com/dbcpfy04c/image/upload/v1748449868/pin_2_8_vjbnj7.webp,green-cleaning-tips,,https://www.beacleaner.com/how-to-clean-windows-with-newspaper?utm_source=pinterest&utm_campaign=eco-friendly-window-,2025-05-28,Go green with your cleaning routine! This post demonstrates how to clean windows effectively using newspaper,a sustainable and eco-friendly alternative to traditional cleaners. Reduce your environmental impact while enjoying sparkling clean windows. Click to learn more and make a difference! #EcoCleaning #SustainableLiving #WindowCleaning #GreenCleaning
Newspaper Window Cleaning: Step-by-Step,https://res.cloudinary.com/dbcpfy04c/image/upload/v1748449874/pin_2_9_elmpqm.webp,cleaning-tips,,https://www.beacleaner.com/how-to-clean-windows-with-newspaper?utm_source=pinterest&utm_campaign=newspaper-window-cle,2025-05-28,Confused about how to clean windows with newspaper? This post provides a clear,step-by-step guide
The Magic of Newspaper & Windows!,https://res.cloudinary.com/dbcpfy04c/image/upload/v1748449885/pin_2_10_btcguv.webp,cleaning-tips,,https://www.beacleaner.com/how-to-clean-windows-with-newspaper?utm_source=pinterest&utm_campaign=the-magic-of-newspap,2025-05-28,Discover the magic of newspaper when it comes to window cleaning! This post explains why this simple method works so well,offering a natural and effective solution for sparkling clean windows. Learn the secrets to a streak-free shine and enjoy a brighter home. Click to learn more! #CleaningMagic #WindowCleaning #HomeHacks #SparklingWindows
Newspaper: A Window Cleaning Game Changer!,https://res.cloudinary.com/dbcpfy04c/image/upload/v1748449891/pin_2_11_ova46e.webp,cleaning-tips,,https://www.beacleaner.com/how-to-clean-windows-with-newspaper?utm_source=pinterest&utm_campaign=newspaper-a-window-c,2025-05-28,Transform your window cleaning routine with this game-changing hack! This post reveals how newspaper can deliver a professional-quality clean,leaving your windows spotless and your view unobstructed. It's a simple
Clean Windows,https://res.cloudinary.com/dbcpfy04c/image/upload/v1748449897/pin_2_12_s2gsrm.webp,cleaning-tips,,https://www.beacleaner.com/how-to-clean-windows-with-newspaper?utm_source=pinterest&utm_campaign=clean-windows,2025-05-28,Happy Home!,A clean home is a happy home
Newspaper Cleaning: Beyond the News!,https://res.cloudinary.com/dbcpfy04c/image/upload/v1748449904/pin_2_13_uja90f.webp,cleaning-tips,,https://www.beacleaner.com/how-to-clean-windows-with-newspaper?utm_source=pinterest&utm_campaign=newspaper-cleaning-b,2025-05-28,Give your newspaper a second life as a powerful cleaning tool! This post demonstrates how to use newspaper to clean windows,leaving them sparkling and streak-free. It's a sustainable and affordable solution that anyone can do. Click to learn more! #Repurpose #WindowCleaning #EcoFriendly #CleaningHacks
Newspaper: The Ultimate Window Cleaner?,https://res.cloudinary.com/dbcpfy04c/image/upload/v1748449911/pin_2_14_sbvhed.webp,cleaning-tips,,https://www.beacleaner.com/how-to-clean-windows-with-newspaper?utm_source=pinterest&utm_campaign=newspaper-the-ultima,2025-05-28,Is newspaper the ultimate window cleaner? This post explores the benefits of using newspaper for window cleaning,comparing it to traditional methods and highlighting its effectiveness. Discover why this simple hack is a favorite among cleaning enthusiasts. Click to learn more! #WindowCleaner #CleaningComparison #NewspaperHack #HomeCleaning
Newspaper Window Cleaning: Pro Tips!,https://res.cloudinary.com/dbcpfy04c/image/upload/v1748449918/pin_2_15_dozoiu.webp,cleaning-tips,,https://www.beacleaner.com/how-to-clean-windows-with-newspaper?utm_source=pinterest&utm_campaign=newspaper-window-cle,2025-05-28,Take your window cleaning skills to the next level with these pro tips! This post shares insider secrets for achieving a flawless,streak-free shine using newspaper. Learn how to avoid common mistakes and get the most out of this effective cleaning method. Click to learn more! #ProTips #WindowCleaning #CleaningSecrets #HomeMaintenance
Newspaper & Vinegar: Window Cleaning Power!,https://res.cloudinary.com/dbcpfy04c/image/upload/v1748449925/pin_2_16_efialu.webp,cleaning-tips,,https://www.beacleaner.com/how-to-clean-windows-with-newspaper?utm_source=pinterest&utm_campaign=newspaper-vinegar-wi,2025-05-28,Combine the power of newspaper and vinegar for a truly effective window cleaning solution! This post provides a recipe for a natural and powerful cleaning solution,along with step-by-step instructions for achieving a sparkling clean. Click to learn more! #VinegarCleaning #WindowCleaning #NaturalCleaner #DIYCleaning
Newspaper: A Streak-Free Solution!,https://res.cloudinary.com/dbcpfy04c/image/upload/v1748449931/pin_2_17_ohofdy.webp,cleaning-tips,,https://www.beacleaner.com/how-to-clean-windows-with-newspaper?utm_source=pinterest&utm_campaign=newspaper-a-streak-f,2025-05-28,Say goodbye to streaks and hello to sparkling windows! This post reveals how newspaper can deliver a streak-free shine,leaving your windows looking their best. It's a simple
Newspaper Cleaning: Save Time & Money!,https://res.cloudinary.com/dbcpfy04c/image/upload/v1748449937/pin_2_18_nu3pin.webp,cleaning-tips,,https://www.beacleaner.com/how-to-clean-windows-with-newspaper?utm_source=pinterest&utm_campaign=newspaper-cleaning-s,2025-05-28,Save time and money with this clever window cleaning hack! This post demonstrates how to use newspaper to achieve a professional-quality clean without spending a fortune. It's a simple,effective
Newspaper: The Unexpected Cleaner!,https://res.cloudinary.com/dbcpfy04c/image/upload/v1748449943/pin_2_19_ycsmwy.webp,cleaning-tips,,https://www.beacleaner.com/how-to-clean-windows-with-newspaper?utm_source=pinterest&utm_campaign=newspaper-the-unexpe,2025-05-28,Discover the unexpected cleaning power of newspaper! This post reveals how this everyday item can be used to clean windows,leaving them sparkling and streak-free. It's a surprising and effective solution that anyone can try. Click to learn more! #UnexpectedCleaner #WindowCleaning #CleaningHacks #DIYHome
Newspaper Window Cleaning: Before & After!,https://res.cloudinary.com/dbcpfy04c/image/upload/v1748449952/pin_2_20_abvghf.webp,cleaning-tips,,https://www.beacleaner.com/how-to-clean-windows-with-newspaper?utm_source=pinterest&utm_campaign=newspaper-window-cle,2025-05-28,See the amazing results of newspaper window cleaning! This post features before-and-after photos,showcasing the dramatic difference this simple method can make. Get inspired and learn how to achieve a sparkling clean for yourself. Click to learn more! #BeforeAndAfter #WindowCleaning #CleaningResults #HomeImprovement
Newspaper: A Natural Cleaning Alternative!,https://res.cloudinary.com/dbcpfy04c/image/upload/v1748449962/pin_2_21_j8kjkh.webp,eco-cleaning-tips,,https://www.beacleaner.com/how-to-clean-windows-with-newspaper?utm_source=pinterest&utm_campaign=newspaper-a-natural-,2025-05-28,Looking for a natural cleaning alternative? This post demonstrates how to clean windows effectively using newspaper,a sustainable and eco-friendly option. Reduce your exposure to harsh chemicals and enjoy a cleaner
Newspaper: The Secret to Clear Views!,https://res.cloudinary.com/dbcpfy04c/image/upload/v1748449968/pin_2_22_tgdqk7.webp,cleaning-tips,,https://www.beacleaner.com/how-to-clean-windows-with-newspaper?utm_source=pinterest&utm_campaign=newspaper-the-secret,2025-05-28,Unlock the secret to clear,unobstructed views with this newspaper window cleaning hack! This post provides a detailed guide on how to use newspaper to achieve a sparkling clean
