Title,Media URL,Pinterest board,Thumbnail,Link,Publish date,Description,Keywords
Vacuum Not Working? Don't Give Up Yet!,https://res.cloudinary.com/dbcpfy04c/image/upload/v1748760164/pin_5_21_x4ulhw.webp,home-repair-tips,,https://www.beacleaner.com/vacuum-not-working-while-on-carpet?utm_source=pinterest&utm_campaign=vacuum-not-working-d,2025-06-01,Feeling defeated by a broken vacuum? This pin offers encouragement & reminds you that many vacuum problems are fixable with a little effort. Don't replace it,repair it! Click to read the full guide & reclaim your cleaning power.
Best Vacuum for High Pile Carpet?,https://res.cloudinary.com/dbcpfy04c/image/upload/v1748760171/pin_5_22_eqaihe.webp,cleaning-tips,,https://www.beacleaner.com/vacuum-not-working-while-on-carpet?utm_source=pinterest&utm_campaign=best-vacuum-for-high,2025-06-01,Choosing the right vacuum for high-pile carpet is essential. This pin highlights features to look for & recommends vacuum types that excel on thick carpets. Get the perfect clean for your plush carpets! Click to learn more.,high pile carpet
Vacuuming Under Furniture: Tips & Tricks,https://res.cloudinary.com/dbcpfy04c/image/upload/v1748760177/pin_5_23_lwzdd7.webp,cleaning-tips,,https://www.beacleaner.com/vacuum-not-working-while-on-carpet?utm_source=pinterest&utm_campaign=vacuuming-under-furn,2025-06-01,Reaching under furniture can be a challenge. This pin shares clever tips & tricks for effectively vacuuming under beds,sofas
Extend Your Vacuum's Life: Simple Steps,https://res.cloudinary.com/dbcpfy04c/image/upload/v1748760185/pin_5_24_atr07a.webp,cleaning-tips,,https://www.beacleaner.com/vacuum-not-working-while-on-carpet?utm_source=pinterest&utm_campaign=extend-your-vacuums-,2025-06-01,Want to keep your vacuum running smoothly for years to come? This pin provides simple steps to extend your vacuum's lifespan & avoid costly repairs. Invest in your vacuum's longevity! Click to learn how.,vacuum lifespan
Deep Clean Your Carpet: Vacuum First!,https://res.cloudinary.com/dbcpfy04c/image/upload/v1748760191/pin_5_25_ljwtmk.webp,cleaning-tips,,https://www.beacleaner.com/vacuum-not-working-while-on-carpet?utm_source=pinterest&utm_campaign=deep-clean-your-carp,2025-06-01,Before deep cleaning your carpet,a thorough vacuuming is essential. This pin explains why vacuuming is a crucial first step & how it improves deep cleaning results. Set yourself up for success! Click to learn more.
