Title,Media URL,Pinterest board,Thumbnail,Link,Publish date,Description,Keywords
Air Purifier: What Affects Cleaning Time?,https://res.cloudinary.com/dbcpfy04c/image/upload/v1747736763/pin_2_22_gj2m2j.webp,clean-air-tips,,https://www.beacleaner.com/how-long-for-air-purifier-to-clean-room?utm_source=pinterest&utm_campaign=air-purifier-what-af,2025-05-20,So many factors influence how quickly an air purifier cleans a room! This post breaks down all the variables,from room size and pollutant levels to purifier specs and filter condition. Understand the full picture – click to learn!
Air Purifier: Is It Working? Signs to Look For,https://res.cloudinary.com/dbcpfy04c/image/upload/v1747736769/pin_2_23_vtpyzh.webp,air-quality-tips,,https://www.beacleaner.com/how-long-for-air-purifier-to-clean-room?utm_source=pinterest&utm_campaign=air-purifier-is-it-w,2025-05-20,How do you know if your air purifier is actually working? This article outlines the signs of effective air purification,so you can be confident you're breathing cleaner air. Don't guess – know! Click to learn.
Air Purifier: Long-Term Air Quality Benefits,https://res.cloudinary.com/dbcpfy04c/image/upload/v1747736776/pin_2_24_ft9nzp.webp,healthy-home-ideas,,https://www.beacleaner.com/how-long-for-air-purifier-to-clean-room?utm_source=pinterest&utm_campaign=air-purifier-long-te,2025-05-20,Investing in an air purifier is an investment in your health. This post explores the long-term benefits of clean air,from reduced allergy symptoms to improved sleep and overall well-being. Breathe healthier for years to come – click to learn!
Air Purifier: Don't Make These Mistakes!,https://res.cloudinary.com/dbcpfy04c/image/upload/v1747736782/pin_2_25_mdk4ry.webp,clean-air-tips,,https://www.beacleaner.com/how-long-for-air-purifier-to-clean-room?utm_source=pinterest&utm_campaign=air-purifier-dont-ma,2025-05-20,Avoid common air purifier mistakes that can hinder performance and waste your money. This post highlights the pitfalls to avoid,ensuring you get the most out of your investment. Click to learn and breathe easier!
Title,https://res.cloudinary.com/dbcpfy04c/image/upload/v1747736817/pin_3_1_l4kfbx.webp,please-provide-the-title-and-keywords-i-need-that-information-to-suggest-a-board-name-once,,https://www.beacleaner.com/how-to-clean-a-hotel-room-checklist?utm_source=pinterest&utm_campaign=title,2025-05-20,Description,Keywords
Hotel Room Cleaning Checklist: Stay Safe!,https://res.cloudinary.com/dbcpfy04c/image/upload/v1747736824/pin_3_2_dtabng.webp,travel-tips-ideas,,https://www.beacleaner.com/how-to-clean-a-hotel-room-checklist?utm_source=pinterest&utm_campaign=hotel-room-cleaning-,2025-05-20,Worried about germs when traveling? Our ultimate hotel room cleaning checklist helps you sanitize like a pro! From disinfecting surfaces to checking bedding,we cover it all. Travel with peace of mind knowing you've created a clean & healthy space. Don't let hidden dirt ruin your trip – get the checklist now! Click to learn how to protect yourself and your family.  It's easier than you think! #HotelCleaning #TravelTips #GermFreeTravel #CleanHotel
Hotel Cleaning Hacks You NEED to Know,https://res.cloudinary.com/dbcpfy04c/image/upload/v1747736831/pin_3_3_mddim6.webp,travel-tips-ideas,,https://www.beacleaner.com/how-to-clean-a-hotel-room-checklist?utm_source=pinterest&utm_campaign=hotel-cleaning-hacks,2025-05-20,Traveling soon? Discover simple,effective hotel room cleaning hacks that will transform your stay! We reveal the often-overlooked areas harboring germs and provide a step-by-step guide to a sparkling clean room.  Feel confident and comfortable wherever you go.  Stop stressing about cleanliness and start enjoying your vacation! Read the full checklist for a worry-free trip. #HotelHacks #TravelClean #Sanitize #TravelSafety
The Ultimate Hotel Bathroom Clean,https://res.cloudinary.com/dbcpfy04c/image/upload/v1747736837/pin_3_4_cxupui.webp,travel-hygiene-tips,,https://www.beacleaner.com/how-to-clean-a-hotel-room-checklist?utm_source=pinterest&utm_campaign=the-ultimate-hotel-b,2025-05-20,Hotel bathrooms can be…questionable.  Our checklist provides a targeted approach to cleaning and disinfecting your hotel bathroom,from the toilet to the shower.  Enjoy a fresh and hygienic bathroom experience during your travels.  Don't settle for less – get the checklist now! #HotelBathroom #BathroomCleaning #TravelHygiene #CleanBathroom
Don't Forget These Hotel Room Spots!,https://res.cloudinary.com/dbcpfy04c/image/upload/v1747736843/pin_3_5_pfsfap.webp,travel-health-tips,,https://www.beacleaner.com/how-to-clean-a-hotel-room-checklist?utm_source=pinterest&utm_campaign=dont-forget-these-ho,2025-05-20,Hidden dirt lurks everywhere! Our checklist highlights the often-forgotten areas in hotel rooms that need extra attention.  From light switches to remote controls,we've got you covered.  Ensure a truly clean and healthy stay. Click to read the full guide! #HiddenGerms #HotelCleaningTips #TravelHealth #DeepClean
Hotel Room Cleaning: Family Travel,https://res.cloudinary.com/dbcpfy04c/image/upload/v1747736849/pin_3_6_u8xzxy.webp,travel-tips-ideas,,https://www.beacleaner.com/how-to-clean-a-hotel-room-checklist?utm_source=pinterest&utm_campaign=hotel-room-cleaning-,2025-05-20,Traveling with kids?  Keeping a hotel room clean with little ones requires extra effort.  Our checklist offers specific tips for families,ensuring a safe and hygienic environment for everyone.  Enjoy a stress-free family vacation!  Download the checklist today. #FamilyTravel #HotelCleaningForKids #TravelWithChildren #CleanFamilyTravel
Hotel Room Cleaning: Allergy Sufferers,https://res.cloudinary.com/dbcpfy04c/image/upload/v1747736855/pin_3_7_isxuvb.webp,travel-tips-ideas,,https://www.beacleaner.com/how-to-clean-a-hotel-room-checklist?utm_source=pinterest&utm_campaign=hotel-room-cleaning-,2025-05-20,Allergy sufferers,rejoice! Our checklist includes tips for minimizing allergens in your hotel room.  From dusting surfaces to checking air filters
Hotel Room Cleaning: The Floors!,https://res.cloudinary.com/dbcpfy04c/image/upload/v1747736860/pin_3_8_iwnjf7.webp,travel-tips-ideas,,https://www.beacleaner.com/how-to-clean-a-hotel-room-checklist?utm_source=pinterest&utm_campaign=hotel-room-cleaning-,2025-05-20,Floors are often overlooked! Our checklist details how to quickly assess and clean hotel room floors,minimizing the risk of tracking germs. Protect your feet and enjoy a cleaner space. Learn more on our blog! #HotelFloors #FloorCleaning #TravelHygiene #CleanFloors
Hotel Room Cleaning: Your Ultimate Guide,https://res.cloudinary.com/dbcpfy04c/image/upload/v1747736869/pin_3_9_vzlkwa.webp,travel-tips-ideas,,https://www.beacleaner.com/how-to-clean-a-hotel-room-checklist?utm_source=pinterest&utm_campaign=hotel-room-cleaning-,2025-05-20,Need a comprehensive guide to hotel room cleaning? Our checklist is your go-to resource for a safe,healthy
Title,https://res.cloudinary.com/dbcpfy04c/image/upload/v1747736909/pin_4_1_rwyker.webp,please-provide-the-title-and-keywords-i-need-that-information-to-suggest-a-board-name-once,,https://www.beacleaner.com/how-to-clean-hot-tub-filter-home-remedy?utm_source=pinterest&utm_campaign=title,2025-05-20,Description,Keywords
Hot Tub Filter Cleaning: DIY Guide,https://res.cloudinary.com/dbcpfy04c/image/upload/v1747736916/pin_4_2_up9v55.webp,hot-tub-tips,,https://www.beacleaner.com/how-to-clean-hot-tub-filter-home-remedy?utm_source=pinterest&utm_campaign=hot-tub-filter-clean,2025-05-20,Is your hot tub water cloudy or your jets weak? A dirty filter is often the culprit! This easy DIY guide shows you how to clean your hot tub filter at home using simple household remedies – saving you money and extending the life of your filter. Don't let a dirty filter ruin your relaxation time! Learn the step-by-step process,including soaking solutions and rinsing techniques
Save Money: Clean Your Hot Tub Filter!,https://res.cloudinary.com/dbcpfy04c/image/upload/v1747736925/pin_4_3_kodjto.webp,hot-tub-tips,,https://www.beacleaner.com/how-to-clean-hot-tub-filter-home-remedy?utm_source=pinterest&utm_campaign=save-money-clean-you,2025-05-20,Tired of expensive hot tub maintenance costs? This blog post reveals a budget-friendly way to clean your hot tub filter right at home! We'll show you how to use common household items to remove grime,oils
Cloudy Hot Tub Water? Filter Fix!,https://res.cloudinary.com/dbcpfy04c/image/upload/v1747736932/pin_4_4_qfsrgm.webp,hot-tub-tips,,https://www.beacleaner.com/how-to-clean-hot-tub-filter-home-remedy?utm_source=pinterest&utm_campaign=cloudy-hot-tub-water,2025-05-20,Don't suffer through cloudy,unpleasant hot tub water! A clogged filter is a common cause. This guide provides a simple
Extend Your Filter's Life: DIY Cleaning,https://res.cloudinary.com/dbcpfy04c/image/upload/v1747736939/pin_4_5_vq4ad2.webp,hot-tub-tips,,https://www.beacleaner.com/how-to-clean-hot-tub-filter-home-remedy?utm_source=pinterest&utm_campaign=extend-your-filters-,2025-05-20,Want to get the most out of your hot tub filter? Learn how to properly clean it with our easy-to-follow home remedy guide! Regular cleaning prevents buildup and prolongs the filter's lifespan,saving you money on replacements. Don't wait until your water is murky – proactive cleaning is key! Click to discover the secrets. #HotTubFilterLife #FilterCare #HotTubOwnership #DIYHotTub
Hot Tub Filter Cleaning: Step-by-Step,https://res.cloudinary.com/dbcpfy04c/image/upload/v1747736945/pin_4_6_w674ek.webp,hot-tub-tips,,https://www.beacleaner.com/how-to-clean-hot-tub-filter-home-remedy?utm_source=pinterest&utm_campaign=hot-tub-filter-clean,2025-05-20,Confused about how to clean your hot tub filter? This post breaks down the process into simple,manageable steps. From soaking to rinsing
Dirty Hot Tub Filter? Don't Replace It!,https://res.cloudinary.com/dbcpfy04c/image/upload/v1747736951/pin_4_7_mwha8h.webp,hot-tub-tips,,https://www.beacleaner.com/how-to-clean-hot-tub-filter-home-remedy?utm_source=pinterest&utm_campaign=dirty-hot-tub-filter,2025-05-20,Before you spend money on a new hot tub filter,try this! Our home remedy cleaning guide can restore your filter's performance and save you a significant amount of money. Don't let a little grime ruin your relaxation. Click to learn how to revive your filter! #FilterRevival #HotTubSavings #DIYRepair #HotTubBudget
Protect Your Hot Tub Investment,https://res.cloudinary.com/dbcpfy04c/image/upload/v1747736958/pin_4_8_gvbrnm.webp,hot-tub-tips,,https://www.beacleaner.com/how-to-clean-hot-tub-filter-home-remedy?utm_source=pinterest&utm_campaign=protect-your-hot-tub,2025-05-20,Your hot tub is an investment – protect it! Regular filter cleaning is essential for maintaining water quality and preventing damage to your hot tub components. This guide shows you how to do it yourself,saving you money and headaches. Click to learn more! #HotTubInvestment #PreventativeMaintenance #HotTubProtection #WaterCare
Is Your Hot Tub Filter Clogged?,https://res.cloudinary.com/dbcpfy04c/image/upload/v1747736964/pin_4_9_inorbt.webp,hot-tub-tips,,https://www.beacleaner.com/how-to-clean-hot-tub-filter-home-remedy?utm_source=pinterest&utm_campaign=is-your-hot-tub-filt,2025-05-20,Signs of a clogged hot tub filter include cloudy water,weak jets
Hot Tub Filter Cleaning: The Benefits,https://res.cloudinary.com/dbcpfy04c/image/upload/v1747736970/pin_4_10_dtpcnd.webp,hot-tub-tips,,https://www.beacleaner.com/how-to-clean-hot-tub-filter-home-remedy?utm_source=pinterest&utm_campaign=hot-tub-filter-clean,2025-05-20,Beyond clear water,cleaning your hot tub filter offers numerous benefits
Hot Tub Filter Cleaning: Common Mistakes,https://res.cloudinary.com/dbcpfy04c/image/upload/v1747736976/pin_4_11_cl3qzl.webp,hot-tub-tips,,https://www.beacleaner.com/how-to-clean-hot-tub-filter-home-remedy?utm_source=pinterest&utm_campaign=hot-tub-filter-clean,2025-05-20,Avoid these common mistakes when cleaning your hot tub filter! This post highlights the pitfalls to avoid,ensuring you get the best results and don't damage your filter. Learn from our expertise and keep your hot tub in top condition. Click to read now! #CleaningMistakes #HotTubErrors #FilterTips #HotTubAdvice
Hot Tub Filter Cleaning: Frequency Guide,https://res.cloudinary.com/dbcpfy04c/image/upload/v1747736982/pin_4_12_tvvb2e.webp,hot-tub-tips,,https://www.beacleaner.com/how-to-clean-hot-tub-filter-home-remedy?utm_source=pinterest&utm_campaign=hot-tub-filter-clean,2025-05-20,How often should you clean your hot tub filter? This post provides a comprehensive guide to filter cleaning frequency,based on usage and water conditions. Stay ahead of the grime and enjoy consistently clean water. Click to learn the recommended schedule! #CleaningSchedule #HotTubFrequency #FilterTiming #WaterMaintenance
Hot Tub Filter Cleaning: Rinse Like a Pro,https://res.cloudinary.com/dbcpfy04c/image/upload/v1747736988/pin_4_13_lk2qvj.webp,hot-tub-tips,,https://www.beacleaner.com/how-to-clean-hot-tub-filter-home-remedy?utm_source=pinterest&utm_campaign=hot-tub-filter-clean,2025-05-20,Rinsing is a crucial step in hot tub filter cleaning. This post provides expert tips on how to rinse your filter effectively,removing all traces of cleaning solution and debris. Get a thorough clean every time! Click to learn the technique. #RinsingTips #HotTubTechnique #FilterRinse #CleaningProcess
Hot Tub Filter Cleaning: Water Savings,https://res.cloudinary.com/dbcpfy04c/image/upload/v1747736995/pin_4_14_a5uu5z.webp,hot-tub-tips,,https://www.beacleaner.com/how-to-clean-hot-tub-filter-home-remedy?utm_source=pinterest&utm_campaign=hot-tub-filter-clean,2025-05-20,Cleaning your hot tub filter can actually help you save water! By maintaining optimal filter performance,you reduce the need for frequent water changes. This post explains how. Click to learn more about water conservation! #WaterSavings #HotTubConservation #EcoFriendlyHotTub #SustainableLiving
Hot Tub Filter Cleaning: Jet Power!,https://res.cloudinary.com/dbcpfy04c/image/upload/v1747737000/pin_4_15_dnsrc3.webp,hot-tub-tips,,https://www.beacleaner.com/how-to-clean-hot-tub-filter-home-remedy?utm_source=pinterest&utm_campaign=hot-tub-filter-clean,2025-05-20,Weak jets? A clogged filter could be the culprit! This post shows you how cleaning your filter can restore jet power and enhance your hot tub experience. Enjoy a powerful,invigorating soak. Click to learn how! #JetPower #HotTubMassage #FilterPerformance #WaterPressure
Hot Tub Filter Cleaning: Peace of Mind,https://res.cloudinary.com/dbcpfy04c/image/upload/v1747737006/pin_4_16_xmixp4.webp,hot-tub-tips,,https://www.beacleaner.com/how-to-clean-hot-tub-filter-home-remedy?utm_source=pinterest&utm_campaign=hot-tub-filter-clean,2025-05-20,Enjoy peace of mind knowing your hot tub water is clean and healthy! This post provides a simple,effective way to clean your filter and maintain a relaxing
Hot Tub Filter Cleaning: Long-Term Care,https://res.cloudinary.com/dbcpfy04c/image/upload/v1747737012/pin_4_17_uaep2i.webp,hot-tub-tips,,https://www.beacleaner.com/how-to-clean-hot-tub-filter-home-remedy?utm_source=pinterest&utm_campaign=hot-tub-filter-clean,2025-05-20,Don't just clean your filter when it's dirty – practice long-term care! This post offers tips on maintaining your filter and preventing buildup,ensuring years of trouble-free hot tub enjoyment. Click to learn the secrets! #LongTermCare #FilterPrevention #HotTubLongevity #MaintenanceTips
Title,https://res.cloudinary.com/dbcpfy04c/image/upload/v1747737054/pin_5_1_rbwmmw.webp,please-provide-the-title-and-keywords-i-need-that-information-to-suggest-a-board-name-once,,https://www.beacleaner.com/how-do-you-clean-granite-floors?utm_source=pinterest&utm_campaign=title,2025-05-20,Description,Keywords
Sparkling Granite Floors: Your Guide,https://res.cloudinary.com/dbcpfy04c/image/upload/v1747737062/pin_5_2_ov6epp.webp,floor-cleaning-tips,,https://www.beacleaner.com/how-do-you-clean-granite-floors?utm_source=pinterest&utm_campaign=sparkling-granite-fl,2025-05-20,"Dreaming of granite floors that gleam? ✨ This guide reveals the secrets to cleaning & restoring your granite's natural beauty! From daily sweeps to tackling stubborn stains, we cover it all. Don't let dirt & grime dull your investment – learn the *right* way to clean granite floors and keep them looking stunning for years to come. Click to discover our expert tips & avoid costly mistakes! Protect your beautiful floors today!","Granite cleaning,Floor care,Home maintenance,Cleaning tips"
Granite Floor Cleaning: Don't Make These Mistakes!,https://res.cloudinary.com/dbcpfy04c/image/upload/v1747737069/pin_5_3_v1bp86.webp,floor-cleaning-tips,,https://www.beacleaner.com/how-do-you-clean-granite-floors?utm_source=pinterest&utm_campaign=granite-floor-cleani,2025-05-20,"Are you accidentally damaging your granite floors? 😱 Many common cleaning products can etch or dull the surface! This post reveals the biggest granite cleaning mistakes & how to avoid them. Learn what *not* to use and discover the gentle, effective methods that will keep your floors pristine.  We'll show you how to maintain that luxurious shine without the worry. Click to learn more and save your floors!","Granite floors,Cleaning mistakes,Floor protection,Home cleaning"
DIY Granite Floor Cleaner (Easy & Effective!),https://res.cloudinary.com/dbcpfy04c/image/upload/v1747737075/pin_5_4_xhtz7p.webp,cleaning-tips,,https://www.beacleaner.com/how-do-you-clean-granite-floors?utm_source=pinterest&utm_campaign=diy-granite-floor-cl,2025-05-20,"Skip the expensive cleaners! 🍋 This DIY granite floor cleaner is budget-friendly, eco-friendly, and incredibly effective. We'll share a simple recipe using ingredients you likely already have at home.  Enjoy a sparkling clean without harsh chemicals!  Plus, learn how to use it for optimal results.  Give your floors some love – and your wallet a break! Click for the recipe!","DIY cleaner,Granite cleaner,Natural cleaning,Floor cleaning"
Granite Floor Stain Removal: A Complete Guide,https://res.cloudinary.com/dbcpfy04c/image/upload/v1747737082/pin_5_5_baskjs.webp,cleaning-tips,,https://www.beacleaner.com/how-do-you-clean-granite-floors?utm_source=pinterest&utm_campaign=granite-floor-stain-,2025-05-20,Spilled wine? Coffee mishap? 🍷 Don't panic! This guide provides a step-by-step approach to removing even the toughest stains from your granite floors. We cover everything from oil-based stains to water spots.  Restore your floors to their original glory and enjoy a spotless home. Click to learn the secrets to stain-free granite!,"Stain removal,Granite stains,Floor stains,Cleaning guide"
The Ultimate Granite Floor Care Routine,https://res.cloudinary.com/dbcpfy04c/image/upload/v1747737088/pin_5_6_bgmizu.webp,floor-cleaning-tips,,https://www.beacleaner.com/how-do-you-clean-granite-floors?utm_source=pinterest&utm_campaign=the-ultimate-granite,2025-05-20,"Want granite floors that always look their best? ✨ This routine will help you maintain a sparkling clean with minimal effort. We'll cover daily, weekly, and monthly cleaning tasks, plus tips for preventing damage.  Invest a little time and keep your floors looking luxurious for years to come. Click to create your perfect routine!","Granite care,Floor routine,Cleaning schedule,Home upkeep"
Protect Your Granite Floors: Sealing Explained,https://res.cloudinary.com/dbcpfy04c/image/upload/v1747737097/pin_5_7_ztfldq.webp,floor-care-tips,,https://www.beacleaner.com/how-do-you-clean-granite-floors?utm_source=pinterest&utm_campaign=protect-your-granite,2025-05-20,"Is your granite sealed? 🤔 Sealing is crucial for protecting your floors from stains and damage. This post explains everything you need to know about granite sealing, including when to seal, what type of sealer to use, and how to apply it.  Don't skip this important step! Click to learn how to safeguard your investment.","Granite sealing,Floor sealer,Granite protection,Home improvement"
Granite vs. Quartz Floors: Which is Right for You?,https://res.cloudinary.com/dbcpfy04c/image/upload/v1747737105/pin_5_8_gbxawf.webp,flooring-ideas,,https://www.beacleaner.com/how-do-you-clean-granite-floors?utm_source=pinterest&utm_campaign=granite-vs-quartz-fl,2025-05-20,"Considering new floors? 🤔  We break down the pros and cons of granite vs. quartz, covering durability, maintenance, cost, and aesthetics.  Make an informed decision and choose the flooring that best suits your lifestyle and budget.  Click to read our comprehensive comparison!","Granite floors,Quartz floors,Flooring options,Home renovation"
Granite Floor Cleaning Tools You Need,https://res.cloudinary.com/dbcpfy04c/image/upload/v1747737111/pin_5_9_wksssk.webp,floor-cleaning-tips,,https://www.beacleaner.com/how-do-you-clean-granite-floors?utm_source=pinterest&utm_campaign=granite-floor-cleani,2025-05-20,"Don't waste time with the wrong tools! 🧽 This post lists the essential tools for cleaning granite floors effectively and efficiently. From microfiber mops to gentle scrub brushes, we've got you covered.  Make cleaning a breeze with the right equipment. Click to see our must-have list!","Cleaning tools,Granite cleaning,Floor care,Home essentials"
Daily Granite Floor Cleaning: 5-Minute Routine,https://res.cloudinary.com/dbcpfy04c/image/upload/v1747737117/pin_5_10_nuoghs.webp,floor-cleaning-tips,,https://www.beacleaner.com/how-do-you-clean-granite-floors?utm_source=pinterest&utm_campaign=daily-granite-floor-,2025-05-20,Busy schedule? ⏰ This 5-minute daily routine will keep your granite floors looking fresh and clean.  Simple steps that make a big difference!  Maintain a sparkling home without sacrificing your precious time. Click to learn the quick & easy routine!,"Daily cleaning,Granite floors,Quick cleaning,Home maintenance"
Deep Cleaning Granite Floors: Step-by-Step,https://res.cloudinary.com/dbcpfy04c/image/upload/v1747737126/pin_5_11_ctz3yp.webp,floor-cleaning-tips,,https://www.beacleaner.com/how-do-you-clean-granite-floors?utm_source=pinterest&utm_campaign=deep-cleaning-granit,2025-05-20,"Give your granite floors the deep clean they deserve! ✨ This step-by-step guide walks you through the process, from prepping the area to rinsing and drying.  Restore your floors to their original brilliance. Click for a truly sparkling clean!","Deep cleaning,Granite floors,Floor cleaning,Home cleaning"
Granite Floor Shine: Restore the Luster!,https://res.cloudinary.com/dbcpfy04c/image/upload/v1747737132/pin_5_12_p4eihk.webp,cleaning-tips,,https://www.beacleaner.com/how-do-you-clean-granite-floors?utm_source=pinterest&utm_campaign=granite-floor-shine-,2025-05-20,"Is your granite looking dull? 😔  Bring back the shine with these simple tips! We'll show you how to polish your granite floors and restore their natural luster.  Enjoy a beautiful, radiant home. Click to learn the secrets to a sparkling finish!","Granite polish,Floor shine,Granite restoration,Home improvement"
Gentle Cleaning for Granite Floors: Safe Methods,https://res.cloudinary.com/dbcpfy04c/image/upload/v1747737139/pin_5_13_daksi5.webp,floor-cleaning-tips,,https://www.beacleaner.com/how-do-you-clean-granite-floors?utm_source=pinterest&utm_campaign=gentle-cleaning-for-,2025-05-20,Worried about damaging your granite? 😟  These gentle cleaning methods are safe and effective for all types of granite floors.  Protect your investment and enjoy a worry-free clean. Click to learn the safest ways to clean your floors!,"Gentle cleaning,Granite floors,Safe cleaning,Home care"
Granite Floor Cleaning: Before & After Results,https://res.cloudinary.com/dbcpfy04c/image/upload/v1747737145/pin_5_14_bgjosm.webp,floor-cleaning-tips,,https://www.beacleaner.com/how-do-you-clean-granite-floors?utm_source=pinterest&utm_campaign=granite-floor-cleani,2025-05-20,See the amazing transformation! 👀  Check out these before & after photos of granite floors cleaned using our expert tips.  Proof that a little effort can make a huge difference!  Get inspired and start cleaning your floors today. Click to see the results!,"Before and after,Granite cleaning,Floor transformation,Cleaning inspiration"
Granite Floor Maintenance: Preventative Tips,https://res.cloudinary.com/dbcpfy04c/image/upload/v1747737151/pin_5_15_x9dkjw.webp,floor-care-tips,,https://www.beacleaner.com/how-do-you-clean-granite-floors?utm_source=pinterest&utm_campaign=granite-floor-mainte,2025-05-20,Stop stains before they start! 🛡️ These preventative tips will help you maintain your granite floors and avoid costly repairs.  Protect your investment and enjoy a beautiful home for years to come. Click to learn how to prevent damage!,"Granite maintenance,Floor protection,Preventative care,Home upkeep"
The Best Mop for Granite Floors (Reviewed!),https://res.cloudinary.com/dbcpfy04c/image/upload/v1747737157/pin_5_16_scc5xn.webp,floor-cleaning-tips,,https://www.beacleaner.com/how-do-you-clean-granite-floors?utm_source=pinterest&utm_campaign=the-best-mop-for-gra,2025-05-20,"Choosing the right mop is crucial! 🧽 We review the best mops for granite floors, considering factors like material, absorbency, and ease of use.  Find the perfect mop for your needs and make cleaning a breeze. Click to read our reviews!","Granite mop,Floor mop,Cleaning tools,Product review"
Granite Floor Cleaning: Common Myths Debunked,https://res.cloudinary.com/dbcpfy04c/image/upload/v1747737163/pin_5_17_zsvd4z.webp,floor-cleaning-tips,,https://www.beacleaner.com/how-do-you-clean-granite-floors?utm_source=pinterest&utm_campaign=granite-floor-cleani,2025-05-20,Don't fall for these cleaning myths! 🚫 We debunk common misconceptions about granite floor cleaning and reveal the truth.  Learn what *really* works and avoid damaging your floors. Click to get the facts!,"Cleaning myths,Granite floors,Floor care,Cleaning tips"
