Title,Media URL,Pinterest board,Thumbnail,Link,Publish date,Description,Keywords
Pressure Wash Windows: Avoid These Mistakes!,https://res.cloudinary.com/dbcpfy04c/image/upload/v1748450341/pin_4_24_zewm8l.webp,home-cleaning-tips,,https://www.beacleaner.com/how-to-clean-windows-with-pressure-washer?utm_source=pinterest&utm_campaign=pressure-wash-window,2025-05-28,Learn from our mistakes! This post details common errors to avoid when pressure washing windows.  Protect your windows and achieve a professional-quality clean.  Don't repeat these costly mistakes! Click to learn more.,"Common Mistakes,Pressure Washing,Window Cleaning,Avoid Errors"
Pressure Wash Windows: Get a Professional Shine,https://res.cloudinary.com/dbcpfy04c/image/upload/v1748450350/pin_4_25_rtcyqn.webp,home-cleaning-tips,,https://www.beacleaner.com/how-to-clean-windows-with-pressure-washer?utm_source=pinterest&utm_campaign=pressure-wash-window,2025-05-28,Want windows that look professionally cleaned? This post reveals the secrets to achieving a showroom-worthy shine with your pressure washer.  Impress your neighbors and enjoy a brighter home. Click to learn the secrets.,"Professional Shine,Pressure Washing,Window Cleaning,Home Improvement"
Title,https://res.cloudinary.com/dbcpfy04c/image/upload/v1748450387/pin_5_1_byqzbo.webp,please-provide-the-title-and-keywords-i-need-that-information-to-suggest-a-board-name-once,,https://www.beacleaner.com/how-to-clean-with-steel-wool?utm_source=pinterest&utm_campaign=title,2025-05-28,Description,Keywords
Steel Wool Cleaning Hacks,https://res.cloudinary.com/dbcpfy04c/image/upload/v1748450395/pin_5_2_m7fcxv.webp,cleaning-tips,,https://www.beacleaner.com/how-to-clean-with-steel-wool?utm_source=pinterest&utm_campaign=steel-wool-cleaning-,2025-05-28,Discover the surprising power of steel wool! This guide reveals how to safely & effectively clean everything from burnt pots to glass stovetops. Don't let grime win – reclaim your sparkle! Learn the right grades to use,safety tips
Restore Cast Iron Like New,https://res.cloudinary.com/dbcpfy04c/image/upload/v1748450402/pin_5_3_jstjek.webp,cast-iron-tips,,https://www.beacleaner.com/how-to-clean-with-steel-wool?utm_source=pinterest&utm_campaign=restore-cast-iron-li,2025-05-28,Is your cast iron looking sad & rusty? Steel wool is your secret weapon! This pin shows you how to gently remove rust and restore your beloved cookware to its former glory. Imagine perfectly seasoned cast iron again! We'll guide you through the process step-by-step,ensuring a beautiful
Burnt Pot Rescue Mission,https://res.cloudinary.com/dbcpfy04c/image/upload/v1748450409/pin_5_4_sn4huy.webp,cleaning-tips,,https://www.beacleaner.com/how-to-clean-with-steel-wool?utm_source=pinterest&utm_campaign=burnt-pot-rescue-mis,2025-05-28,Don't throw away that burnt pot! Steel wool can often save the day. This pin demonstrates how to tackle even the most stubborn burnt-on food residue. Feel the relief of rescuing your favorite cookware! We'll show you the best techniques and safety precautions. Save money and reduce waste – learn how to clean burnt pots with steel wool today! Click for the full guide.,Burnt pots
Glass Stovetop Shine Guide,https://res.cloudinary.com/dbcpfy04c/image/upload/v1748450416/pin_5_5_mwntzl.webp,cleaning-tips,,https://www.beacleaner.com/how-to-clean-with-steel-wool?utm_source=pinterest&utm_campaign=glass-stovetop-shine,2025-05-28,Achieve a sparkling clean glass stovetop with steel wool! This pin reveals the secret to removing tough stains and restoring that like-new shine. Say goodbye to frustrating scrubbing! We'll show you the proper technique to avoid scratches and keep your stovetop looking its best. Click to learn how to make your kitchen gleam!,Glass stovetop
Steel Wool: Grades Explained,https://res.cloudinary.com/dbcpfy04c/image/upload/v1748450423/pin_5_6_rsoqln.webp,cleaning-tips,,https://www.beacleaner.com/how-to-clean-with-steel-wool?utm_source=pinterest&utm_campaign=steel-wool-grades-ex,2025-05-28,Confused about steel wool grades? This pin breaks down everything you need to know! From coarse to super fine,we'll help you choose the right grade for every cleaning task. Avoid damage and get the best results. Knowledge is power – learn to use steel wool like a pro! Click to read the full guide.
DIY Oven Cleaning with Steel,https://res.cloudinary.com/dbcpfy04c/image/upload/v1748450431/pin_5_7_pwyxgn.webp,cleaning-tips,,https://www.beacleaner.com/how-to-clean-with-steel-wool?utm_source=pinterest&utm_campaign=diy-oven-cleaning-wi,2025-05-28,Skip harsh chemicals! This pin shows you how to clean your oven with steel wool and a little elbow grease. Breathe easier knowing you're using a more natural cleaning method. We'll guide you through the process,making oven cleaning less daunting. Click to learn how to get a sparkling clean oven!
Remove Rust From Tools Easily,https://res.cloudinary.com/dbcpfy04c/image/upload/v1748450438/pin_5_8_m7hrvb.webp,tool-tips,,https://www.beacleaner.com/how-to-clean-with-steel-wool?utm_source=pinterest&utm_campaign=remove-rust-from-too,2025-05-28,Bring your rusty tools back to life with steel wool! This pin demonstrates a simple and effective method for removing rust and restoring their functionality. Don't let rust ruin your favorite tools – give them a makeover! Click to learn how to protect your investment and get back to work.,Rust removal
Stainless Steel Polishing Tips,https://res.cloudinary.com/dbcpfy04c/image/upload/v1748450445/pin_5_9_yklw0g.webp,cleaning-tips,,https://www.beacleaner.com/how-to-clean-with-steel-wool?utm_source=pinterest&utm_campaign=stainless-steel-poli,2025-05-28,Want a gleaming stainless steel finish? Steel wool is the answer! This pin reveals the secret to polishing stainless steel appliances and surfaces. Say goodbye to fingerprints and water spots! We'll show you the proper technique to achieve a professional-looking shine. Click to learn more!,Stainless steel
Grill Grate Cleaning Made Easy,https://res.cloudinary.com/dbcpfy04c/image/upload/v1748450451/pin_5_10_rgecpv.webp,grill-tips,,https://www.beacleaner.com/how-to-clean-with-steel-wool?utm_source=pinterest&utm_campaign=grill-grate-cleaning,2025-05-28,Is your grill grate covered in burnt-on food? Steel wool can make cleaning a breeze! This pin demonstrates how to quickly and effectively remove grime and restore your grill grate. Enjoy delicious barbecues without the hassle of cleaning. Click to learn how!,Grill cleaning
Bathroom Fixture Restoration,https://res.cloudinary.com/dbcpfy04c/image/upload/v1748450458/pin_5_11_dsbpav.webp,bathroom-restoration-ideas,,https://www.beacleaner.com/how-to-clean-with-steel-wool?utm_source=pinterest&utm_campaign=bathroom-fixture-res,2025-05-28,Revive dull bathroom fixtures with steel wool! This pin shows you how to remove water stains,rust
Cleaning Porcelain Sinks with Steel,https://res.cloudinary.com/dbcpfy04c/image/upload/v1748450465/pin_5_12_y3icxf.webp,cleaning-tips,,https://www.beacleaner.com/how-to-clean-with-steel-wool?utm_source=pinterest&utm_campaign=cleaning-porcelain-s,2025-05-28,Porcelain sinks looking dingy? Steel wool can help! This pin demonstrates how to gently clean and restore your porcelain sink to its original brilliance. Say goodbye to stains and hello to a sparkling clean bathroom. Click to learn the best techniques!,Porcelain sink
Removing Stickers & Adhesive,https://res.cloudinary.com/dbcpfy04c/image/upload/v1748450471/pin_5_13_bqhu7r.webp,cleaning-tips,,https://www.beacleaner.com/how-to-clean-with-steel-wool?utm_source=pinterest&utm_campaign=removing-stickers-ad,2025-05-28,Struggling with sticky residue? Steel wool can be a lifesaver! This pin shows you how to easily remove stickers,labels
Cleaning BBQ Bricks with Steel Wool,https://res.cloudinary.com/dbcpfy04c/image/upload/v1748450478/pin_5_14_zt4u2l.webp,bbq-tips,,https://www.beacleaner.com/how-to-clean-with-steel-wool?utm_source=pinterest&utm_campaign=cleaning-bbq-bricks-,2025-05-28,Don't let your BBQ bricks get covered in grime! This pin shows you how to use steel wool to clean them effectively. Enjoy a cleaner,more efficient BBQ experience. Click to learn how to maintain your outdoor cooking space!
Steel Wool for Tile & Grout,https://res.cloudinary.com/dbcpfy04c/image/upload/v1748450484/pin_5_15_smzffl.webp,cleaning-tips,,https://www.beacleaner.com/how-to-clean-with-steel-wool?utm_source=pinterest&utm_campaign=steel-wool-for-tile-,2025-05-28,Revitalize your tile and grout with steel wool! This pin demonstrates how to remove stubborn stains and grime,leaving your floors and walls looking fresh and clean. A little effort can make a big difference. Click to learn more!
Protecting Wood with Steel Wool,https://res.cloudinary.com/dbcpfy04c/image/upload/v1748450491/pin_5_16_ucmdsc.webp,wood-finishing-tips,,https://www.beacleaner.com/how-to-clean-with-steel-wool?utm_source=pinterest&utm_campaign=protecting-wood-with,2025-05-28,Learn how to *prepare* wood for finishing with steel wool! This pin explains the process of using steel wool to create a smooth surface for staining or painting. Achieve professional-looking results. Click to learn this essential woodworking technique!,Wood finishing
Cleaning Vintage Items with Care,https://res.cloudinary.com/dbcpfy04c/image/upload/v1748450499/pin_5_17_w05pvs.webp,vintage-cleaning-tips,,https://www.beacleaner.com/how-to-clean-with-steel-wool?utm_source=pinterest&utm_campaign=cleaning-vintage-ite,2025-05-28,Preserve your treasured vintage finds with steel wool! This pin offers gentle cleaning techniques for delicate items. Protect your investments and restore their beauty. Click to learn how to clean vintage items safely.,Vintage cleaning
Removing Paint Splatters Easily,https://res.cloudinary.com/dbcpfy04c/image/upload/v1748450506/pin_5_18_mkmzyy.webp,cleaning-tips,,https://www.beacleaner.com/how-to-clean-with-steel-wool?utm_source=pinterest&utm_campaign=removing-paint-splat,2025-05-28,Accidental paint splatters? Steel wool to the rescue! This pin demonstrates how to safely remove paint splatters from various surfaces. Save time and effort with this simple cleaning hack. Click to learn more!,Paint removal
Cleaning Garden Tools with Steel,https://res.cloudinary.com/dbcpfy04c/image/upload/v1748450514/pin_5_19_ukc0bv.webp,garden-tips,,https://www.beacleaner.com/how-to-clean-with-steel-wool?utm_source=pinterest&utm_campaign=cleaning-garden-tool,2025-05-28,Keep your garden tools in top condition with steel wool! This pin shows you how to remove rust,dirt
Polishing Brass with Steel Wool,https://res.cloudinary.com/dbcpfy04c/image/upload/v1748450520/pin_5_20_qlra5r.webp,cleaning-tips,,https://www.beacleaner.com/how-to-clean-with-steel-wool?utm_source=pinterest&utm_campaign=polishing-brass-with,2025-05-28,Restore the shine to your brass fixtures with steel wool! This pin demonstrates a simple and effective polishing technique. Bring back the beauty of your brass décor. Click to learn how!,Brass polishing
Removing Scuff Marks from Walls,https://res.cloudinary.com/dbcpfy04c/image/upload/v1748450529/pin_5_21_hcnzdu.webp,cleaning-tips,,https://www.beacleaner.com/how-to-clean-with-steel-wool?utm_source=pinterest&utm_campaign=removing-scuff-marks,2025-05-28,Say goodbye to unsightly scuff marks! This pin shows you how to use steel wool to gently remove scuff marks from walls. Restore your walls to their original condition. Click to learn this quick fix!,Scuff marks
Cleaning Fireplace Tools with Steel,https://res.cloudinary.com/dbcpfy04c/image/upload/v1748450535/pin_5_22_vqynkf.webp,home-cleaning-tips,,https://www.beacleaner.com/how-to-clean-with-steel-wool?utm_source=pinterest&utm_campaign=cleaning-fireplace-t,2025-05-28,Keep your fireplace tools looking their best with steel wool! This pin demonstrates how to remove soot,rust
Steel Wool & Soap Scum Solution,https://res.cloudinary.com/dbcpfy04c/image/upload/v1748450541/pin_5_23_jn0qkl.webp,cleaning-tips,,https://www.beacleaner.com/how-to-clean-with-steel-wool?utm_source=pinterest&utm_campaign=steel-wool-soap-scum,2025-05-28,Tired of battling soap scum? Steel wool can help! This pin shows you how to effectively remove soap scum from showers and tubs. Enjoy a sparkling clean bathroom. Click to learn more!,Soap scum
Reviving Chrome Fixtures with Steel,https://res.cloudinary.com/dbcpfy04c/image/upload/v1748450548/pin_5_24_ox2vtz.webp,chrome-cleaning-tips,,https://www.beacleaner.com/how-to-clean-with-steel-wool?utm_source=pinterest&utm_campaign=reviving-chrome-fixt,2025-05-28,Bring back the shine to your chrome fixtures with steel wool! This pin demonstrates a simple polishing technique. Enjoy a gleaming bathroom or kitchen. Click to learn how!,Chrome polishing
Safety First: Steel Wool Guide,https://res.cloudinary.com/dbcpfy04c/image/upload/v1748450555/pin_5_25_aiagcd.webp,home-safety-tips,,https://www.beacleaner.com/how-to-clean-with-steel-wool?utm_source=pinterest&utm_campaign=safety-first-steel-w,2025-05-28,Prioritize safety when using steel wool! This pin highlights important safety precautions and best practices. Protect yourself and your surfaces. Click to learn how to use steel wool responsibly!,Steel wool safety
