Title,Media URL,Pinterest board,Thumbnail,Description,Link,Publish date,Keywords,Source URL
Title,https://res.cloudinary.com/dbcpfy04c/image/upload/v1745915130/pin_1_1_yrwbtr.webp,please-provide-the-title-and-keywords-i-need-that-information-to-suggest-a-board-name-once,,Description,https://lawntrend.com/honda-gcv160-wont-start/?utm_source=pinterest&utm_campaign=title,2025-04-29,Keywords,https://lawntrend.com/honda-gcv160-wont-start/
Honda GCV160: Won't Start? Fix It!,https://res.cloudinary.com/dbcpfy04c/image/upload/v1745915140/pin_1_2_fafyl0.webp,lawn-repair-ideas,,"Is your Honda GCV160 engine refusing to start? Don't panic! This guide walks you through common issues like a clogged carburetor, bad spark plug",https://lawntrend.com/honda-gcv160-wont-start/?utm_source=pinterest&utm_campaign=honda-gcv160-wont-st,2025-04-29,or fuel problems. We'll help you diagnose the problem and get your lawnmower running smoothly again. Save money on repairs and enjoy a perfectly manicured lawn this season! Click to learn how to troubleshoot and revive your engine.  Don't let a stubborn engine ruin your weekend! #HondaGCV160 #LawnmowerRepair #SmallEngineRepair #DIYRepair,https://lawntrend.com/honda-gcv160-wont-start/
GCV160 Carburetor Issues: Solved!,https://res.cloudinary.com/dbcpfy04c/image/upload/v1745915147/pin_1_3_yrj87x.webp,small-engine-ideas,,Is a dirty carburetor the culprit behind your Honda GCV160's starting woes?  This guide provides a detailed walkthrough on how to clean and rebuild your carburetor,https://lawntrend.com/honda-gcv160-wont-start/?utm_source=pinterest&utm_campaign=gcv160-carburetor-is,2025-04-29,restoring optimal fuel flow and engine performance.  Don't replace it – repair it!  We'll show you how to save money and get your mower running like new. Click to learn more! #CarburetorCleaning #HondaGCV160 #SmallEngine #DIY,https://lawntrend.com/honda-gcv160-wont-start/
Spark Plug Secrets for GCV160,https://res.cloudinary.com/dbcpfy04c/image/upload/v1745915154/pin_1_4_zmso42.webp,engine-repair-ideas,,"A faulty spark plug can easily prevent your Honda GCV160 from starting. Learn how to quickly and easily test your spark plug, and if it's bad",https://lawntrend.com/honda-gcv160-wont-start/?utm_source=pinterest&utm_campaign=spark-plug-secrets-f,2025-04-29,how to replace it with a new one.  We'll help you understand the importance of a good spark and get your engine firing on all cylinders.  Don't get stuck with a dead mower! Click for the full guide. #SparkPlug #HondaGCV160 #EngineRepair #Lawnmower,https://lawntrend.com/honda-gcv160-wont-start/
Fuel System Fixes for Honda GCV160,https://res.cloudinary.com/dbcpfy04c/image/upload/v1745915161/pin_1_5_y8ufvk.webp,lawn-repair-ideas,,"Is your Honda GCV160 starving for fuel? This post dives deep into fuel system troubleshooting, covering fuel lines, fuel filters",https://lawntrend.com/honda-gcv160-wont-start/?utm_source=pinterest&utm_campaign=fuel-system-fixes-fo,2025-04-29,and fuel pumps.  We'll help you identify blockages and ensure a consistent fuel supply.  Don't let fuel issues ruin your lawn care routine! Click to learn how to diagnose and fix your fuel system. #FuelSystem #HondaGCV160 #LawnmowerProblems #EngineTroubleshooting,https://lawntrend.com/honda-gcv160-wont-start/
GCV160 Recoil Starter Repair Guide,https://res.cloudinary.com/dbcpfy04c/image/upload/v1745915168/pin_1_6_hwq9gs.webp,lawn-repair-ideas,,A broken recoil starter can make starting your Honda GCV160 a real pain.  This guide shows you how to diagnose and repair or replace your recoil starter,https://lawntrend.com/honda-gcv160-wont-start/?utm_source=pinterest&utm_campaign=gcv160-recoil-starte,2025-04-29,getting you back to easy starts.  We'll walk you through each step with clear instructions and helpful visuals.  Click to learn how to fix it yourself! #RecoilStarter #HondaGCV160 #LawnmowerFix #DIY,https://lawntrend.com/honda-gcv160-wont-start/
GCV160 Won't Start? Check These First!,https://res.cloudinary.com/dbcpfy04c/image/upload/v1745915175/pin_1_7_qeog5a.webp,lawn-mower-ideas,,"Before you call a repair shop, check these essential things on your Honda GCV160! We cover fuel, spark",https://lawntrend.com/honda-gcv160-wont-start/?utm_source=pinterest&utm_campaign=gcv160-wont-start-ch,2025-04-29,and compression – the three key ingredients for a running engine.  Save time and money by doing a quick self-diagnosis. Click to learn what to check! #HondaGCV160 #LawnmowerTips #EngineBasics #DIY,https://lawntrend.com/honda-gcv160-wont-start/
GCV160: Air Filter Inspection & Cleaning,https://res.cloudinary.com/dbcpfy04c/image/upload/v1745915182/pin_1_8_kjqzjg.webp,lawn-care-ideas,,"A clogged air filter can restrict airflow and prevent your Honda GCV160 from starting.  Learn how to inspect, clean",https://lawntrend.com/honda-gcv160-wont-start/?utm_source=pinterest&utm_campaign=gcv160-air-filter-in,2025-04-29,and replace your air filter for optimal engine performance.  Keep your engine breathing easy! Click for the full guide. #AirFilter #HondaGCV160 #LawnmowerCare #EngineMaintenance,https://lawntrend.com/honda-gcv160-wont-start/
GCV160: Diagnosing Fuel Delivery Issues,https://res.cloudinary.com/dbcpfy04c/image/upload/v1745915189/pin_1_9_mbkkos.webp,engine-repair-ideas,,Is fuel getting to your Honda GCV160 engine? This guide helps you diagnose fuel delivery problems,https://lawntrend.com/honda-gcv160-wont-start/?utm_source=pinterest&utm_campaign=gcv160-diagnosing-fu,2025-04-29,from clogged fuel lines to a failing fuel pump.  We'll show you how to test each component and ensure a consistent fuel supply. Click to learn more! #FuelDelivery #HondaGCV160 #EngineProblems #LawnCare,https://lawntrend.com/honda-gcv160-wont-start/
GCV160: Winter Storage & Starting,https://res.cloudinary.com/dbcpfy04c/image/upload/v1745915195/pin_1_10_lef3pi.webp,lawn-care-ideas,,Did your Honda GCV160 sit all winter?  This post covers the steps to take to get it started after storage,https://lawntrend.com/honda-gcv160-wont-start/?utm_source=pinterest&utm_campaign=gcv160-winter-storag,2025-04-29,including fuel stabilizer and carburetor cleaning.  Don't let winter storage ruin your spring mowing! Click to learn more. #WinterStorage #HondaGCV160 #LawnmowerPrep #SpringMaintenance,https://lawntrend.com/honda-gcv160-wont-start/
GCV160: When to Call a Professional,https://res.cloudinary.com/dbcpfy04c/image/upload/v1745915202/pin_1_11_qeagvj.webp,lawn-repair-ideas,,Sometimes,https://lawntrend.com/honda-gcv160-wont-start/?utm_source=pinterest&utm_campaign=gcv160-when-to-call-,2025-04-29,DIY isn't enough. Learn when it's time to call a professional to repair your Honda GCV160. Don't risk further damage! Click to learn more. #ProfessionalRepair #HondaGCV160 #LawnmowerRepair #DIYvsPro,https://lawntrend.com/honda-gcv160-wont-start/
Honda GCV160,https://res.cloudinary.com/dbcpfy04c/image/upload/v1745915209/pin_1_12_jobhr4.webp,small-engine-ideas,,"Spark Plug,Lawnmower",https://lawntrend.com/honda-gcv160-wont-start/?utm_source=pinterest&utm_campaign=honda-gcv160,2025-04-29,DIY,https://lawntrend.com/honda-gcv160-wont-start/
