Title,Media URL,Pinterest board,Thumbnail,Link,Publish date,Description,Keywords
Bottle Warmer Cleaning: FAQs Answered,https://res.cloudinary.com/dbcpfy04c/image/upload/v1747693811/pin_4_19_s3holm.webp,baby-gear-tips,,https://www.beacleaner.com/how-to-clean-bottle-warmer?utm_source=pinterest&utm_campaign=bottle-warmer-cleani,2025-05-19,Got questions? We've got answers! This pin links to a section of the blog post that addresses frequently asked questions about bottle warmer cleaning.  Get all your concerns addressed in one place. Click to find the answers you need!,"FAQs,Bottle Warmer,Cleaning Questions,Helpful Tips"
The Easiest Way to Clean a Bottle Warmer!,https://res.cloudinary.com/dbcpfy04c/image/upload/v1747693818/pin_4_20_jhoyzs.webp,cleaning-tips,,https://www.beacleaner.com/how-to-clean-bottle-warmer?utm_source=pinterest&utm_campaign=the-easiest-way-to-c,2025-05-19,"Seriously, it's easier than you think! This pin highlights the simplicity of cleaning a bottle warmer with the right techniques.  No complicated steps or harsh chemicals required. Click to learn the easiest way to keep your bottle warmer clean!","Easy Cleaning,Bottle Warmer,Simple Steps,Convenience"
Protect Your Baby: Clean Bottle Warmer Tips,https://res.cloudinary.com/dbcpfy04c/image/upload/v1747693824/pin_4_21_eelpqz.webp,baby-safety-tips,,https://www.beacleaner.com/how-to-clean-bottle-warmer?utm_source=pinterest&utm_campaign=protect-your-baby-cl,2025-05-19,Your baby's health is your top priority! This pin emphasizes the importance of a clean bottle warmer for protecting your little one from harmful bacteria and germs.  Peace of mind is priceless. Click to learn how to keep your baby safe!,"Baby Protection,Bottle Warmer,Hygiene,Safety First"
Bottle Warmer Cleaning: A Mom's Guide 💖,https://res.cloudinary.com/dbcpfy04c/image/upload/v1747693829/pin_4_22_mz0tf9.webp,baby-gear-tips,,https://www.beacleaner.com/how-to-clean-bottle-warmer?utm_source=pinterest&utm_campaign=bottle-warmer-cleani,2025-05-19,"From one mom to another, this guide has you covered! This pin offers relatable advice and practical tips for cleaning your bottle warmer.  We understand the challenges of motherhood and want to make your life easier. Click to read the mom-approved guide!","Mom's Guide,Bottle Warmer,Parenting,Relatable Advice"
Don't Forget This! Bottle Warmer Cleaning,https://res.cloudinary.com/dbcpfy04c/image/upload/v1747693840/pin_4_23_b9b7lc.webp,baby-care-tips,,https://www.beacleaner.com/how-to-clean-bottle-warmer?utm_source=pinterest&utm_campaign=dont-forget-this-bot,2025-05-19,A quick reminder to keep your bottle warmer clean! This pin serves as a gentle nudge to prioritize bottle warmer hygiene.  A clean warmer is a happy warmer (and a happy baby!). Click to refresh your cleaning routine!,"Reminder,Bottle Warmer,Cleaning Routine,Baby Care"
Bottle Warmer Cleaning: The Secret Weapon!,https://res.cloudinary.com/dbcpfy04c/image/upload/v1747693847/pin_4_24_gzwkpy.webp,baby-gear-tips,,https://www.beacleaner.com/how-to-clean-bottle-warmer?utm_source=pinterest&utm_campaign=bottle-warmer-cleani,2025-05-19,Unlock the secret to a sparkling clean bottle warmer! This pin teases the valuable information within the blog post and encourages readers to click to learn the secrets.  Don't miss out on these essential cleaning tips!,"Secret Weapon,Bottle Warmer,Cleaning Tips,Essential Guide"
Clean Bottle Warmer = Happy Baby 😊,https://res.cloudinary.com/dbcpfy04c/image/upload/v1747693855/pin_4_25_aaayci.webp,baby-feeding-ideas,,https://www.beacleaner.com/how-to-clean-bottle-warmer?utm_source=pinterest&utm_campaign=clean-bottle-warmer-,2025-05-19,"A simple equation for a happy baby! This pin visually connects a clean bottle warmer with a happy baby, appealing to parents' emotions.  Click to learn how to create a positive feeding experience!","Happy Baby,Bottle Warmer,Positive Feeding,Emotional Appeal"
Bottle Warmer Cleaning: Time to Refresh!,https://res.cloudinary.com/dbcpfy04c/image/upload/v1747693863/pin_4_26_td8tfl.webp,baby-gear-tips,,https://www.beacleaner.com/how-to-clean-bottle-warmer?utm_source=pinterest&utm_campaign=bottle-warmer-cleani,2025-05-19,Is it time for a bottle warmer refresh? This pin encourages readers to assess the cleanliness of their bottle warmer and take action.  A little cleaning can make a big difference. Click to learn how to revitalize your bottle warmer!,"Refresh,Bottle Warmer,Cleaning,Revitalize"
Title,https://res.cloudinary.com/dbcpfy04c/image/upload/v1747693907/pin_5_1_lrwlig.webp,please-provide-the-title-and-keywords-i-need-that-information-to-suggest-a-board-name-once,,https://www.beacleaner.com/can-you-use-carpet-cleaner-on-hardwood-floor?utm_source=pinterest&utm_campaign=title,2025-05-19,Description,Keywords
Don't Ruin Your Floors!,https://res.cloudinary.com/dbcpfy04c/image/upload/v1747693914/pin_5_2_ambonu.webp,floor-care-tips,,https://www.beacleaner.com/can-you-use-carpet-cleaner-on-hardwood-floor?utm_source=pinterest&utm_campaign=dont-ruin-your-floor,2025-05-19,Is carpet cleaner safe for hardwood? 🤔 Before you reach for that bottle,learn the TRUTH! This post dives deep into why using carpet cleaner on hardwood is a risky move
Hardwood & Carpet Cleaner: NO!,https://res.cloudinary.com/dbcpfy04c/image/upload/v1747693921/pin_5_3_gxuwkx.webp,cleaning-tips,,https://www.beacleaner.com/can-you-use-carpet-cleaner-on-hardwood-floor?utm_source=pinterest&utm_campaign=hardwood-carpet-clea,2025-05-19,Thinking of using carpet cleaner on your hardwood floors? STOP! 🛑 This guide explains exactly why it's a bad idea,detailing the chemical differences and the long-term consequences. We'll also share gentle
Carpet Cleaner vs. Hardwood: The Truth,https://res.cloudinary.com/dbcpfy04c/image/upload/v1747693928/pin_5_4_lejjnh.webp,cleaning-tips,,https://www.beacleaner.com/can-you-use-carpet-cleaner-on-hardwood-floor?utm_source=pinterest&utm_campaign=carpet-cleaner-vs-ha,2025-05-19,Ever wondered if carpet cleaner could be a quick fix for hardwood floors? 🧐 This post breaks down the science behind why it's a no-go. Discover the pH levels,chemical compositions
Hardwood Floor Cleaning Guide,https://res.cloudinary.com/dbcpfy04c/image/upload/v1747693935/pin_5_5_ocqbyi.webp,floor-cleaning-tips,,https://www.beacleaner.com/can-you-use-carpet-cleaner-on-hardwood-floor?utm_source=pinterest&utm_campaign=hardwood-floor-clean,2025-05-19,Is your hardwood looking dull and lifeless? ✨ This guide will show you how to revive your floors without damaging them! We debunk the myth of using carpet cleaner and provide a comprehensive list of safe,effective cleaning solutions. From daily maintenance to deep cleaning
Avoid This Cleaning Mistake!,https://res.cloudinary.com/dbcpfy04c/image/upload/v1747693943/pin_5_6_f44gz5.webp,floor-care-tips,,https://www.beacleaner.com/can-you-use-carpet-cleaner-on-hardwood-floor?utm_source=pinterest&utm_campaign=avoid-this-cleaning-,2025-05-19,Don't let a simple cleaning task turn into a costly repair! 💸 This post warns against using carpet cleaner on hardwood floors,explaining the potential for irreversible damage. Learn what to do instead to keep your floors looking their best. Click to read and protect your investment! #HardwoodFloorRepair #WoodFloorProtectionTips #CleaningErrors #FloorDamagePrevention
Gentle Hardwood Cleaning Solutions,https://res.cloudinary.com/dbcpfy04c/image/upload/v1747693951/pin_5_7_ixcdhn.webp,floor-cleaning-tips,,https://www.beacleaner.com/can-you-use-carpet-cleaner-on-hardwood-floor?utm_source=pinterest&utm_campaign=gentle-hardwood-clea,2025-05-19,Skip the harsh chemicals! 🌿 This article provides a list of gentle,natural cleaning solutions that are safe and effective for hardwood floors. We'll show you how to clean without damaging the finish or leaving behind residue. Plus
Hardwood Floor FAQs Answered,https://res.cloudinary.com/dbcpfy04c/image/upload/v1747693957/pin_5_8_mjhqw9.webp,floor-cleaning-tips,,https://www.beacleaner.com/can-you-use-carpet-cleaner-on-hardwood-floor?utm_source=pinterest&utm_campaign=hardwood-floor-faqs-,2025-05-19,Got questions about cleaning your hardwood floors? 🤔 This post answers frequently asked questions,including whether or not you can use carpet cleaner (the answer is NO!). Get expert advice and learn how to keep your floors looking their best. #HardwoodFloorFAQ #WoodFloorQuestions #CleaningAdvice #FloorCareTips
The Dangers of Carpet Cleaner,https://res.cloudinary.com/dbcpfy04c/image/upload/v1747693964/pin_5_9_dd2f2v.webp,cleaning-tips,,https://www.beacleaner.com/can-you-use-carpet-cleaner-on-hardwood-floor?utm_source=pinterest&utm_campaign=the-dangers-of-carpe,2025-05-19,Don't risk damaging your beautiful hardwood floors! ⚠️ This post details the specific dangers of using carpet cleaner on hardwood,including warping
DIY Hardwood Floor Cleaner,https://res.cloudinary.com/dbcpfy04c/image/upload/v1747693971/pin_5_10_eq6zfp.webp,cleaning-tips,,https://www.beacleaner.com/can-you-use-carpet-cleaner-on-hardwood-floor?utm_source=pinterest&utm_campaign=diy-hardwood-floor-c,2025-05-19,Save money and protect your floors! 💰 This post provides recipes for DIY hardwood floor cleaners that are safe,effective
Hardwood vs. Laminate Cleaning,https://res.cloudinary.com/dbcpfy04c/image/upload/v1747693977/pin_5_11_g0dfr1.webp,floor-cleaning-tips,,https://www.beacleaner.com/can-you-use-carpet-cleaner-on-hardwood-floor?utm_source=pinterest&utm_campaign=hardwood-vs-laminate,2025-05-19,Confused about how to clean your floors? 🤔 This post clarifies the differences between cleaning hardwood and laminate floors,and why carpet cleaner is a bad idea for both! Learn the best methods for each type of flooring. #HardwoodVsLaminate #FloorCleaningDifferences #WoodFloorCare #LaminateFloorCare
Restore Shine to Dull Floors,https://res.cloudinary.com/dbcpfy04c/image/upload/v1747693985/pin_5_12_jnrnpn.webp,floor-care-tips,,https://www.beacleaner.com/can-you-use-carpet-cleaner-on-hardwood-floor?utm_source=pinterest&utm_campaign=restore-shine-to-dul,2025-05-19,Is your hardwood looking dull and lifeless? 😔 This post provides tips and tricks for restoring shine to your floors without damaging them. Learn how to avoid harsh chemicals like carpet cleaner and achieve a beautiful,gleaming finish. #HardwoodFloorShine #WoodFloorRestoration #FloorGleam #CleaningTips
Prevent Water Damage to Floors,https://res.cloudinary.com/dbcpfy04c/image/upload/v1747693992/pin_5_13_r0de3t.webp,floor-care-tips,,https://www.beacleaner.com/can-you-use-carpet-cleaner-on-hardwood-floor?utm_source=pinterest&utm_campaign=prevent-water-damage,2025-05-19,Water and hardwood floors don't mix! 💧 This post explains how to prevent water damage to your floors,and why using carpet cleaner (which often contains a lot of water) can be risky. Learn how to clean safely and protect your investment. #WaterDamagePrevention #WoodFloorWaterDamage #FloorProtection #CleaningSafety
The Best Mops for Hardwood,https://res.cloudinary.com/dbcpfy04c/image/upload/v1747694002/pin_5_14_qgxppm.webp,floor-cleaning-tips,,https://www.beacleaner.com/can-you-use-carpet-cleaner-on-hardwood-floor?utm_source=pinterest&utm_campaign=the-best-mops-for-ha,2025-05-19,Choosing the right mop is crucial for hardwood floor care! 🪣 This post reviews the best mops for hardwood floors,and explains why using the wrong mop (with carpet cleaner!) can cause damage. Learn how to clean effectively and efficiently. #HardwoodFloorMops #WoodFloorCleaningTools #FloorMopReview #CleaningEquipment
Hardwood Floor Cleaning Schedule,https://res.cloudinary.com/dbcpfy04c/image/upload/v1747694011/pin_5_15_fypjsx.webp,floor-cleaning-tips,,https://www.beacleaner.com/can-you-use-carpet-cleaner-on-hardwood-floor?utm_source=pinterest&utm_campaign=hardwood-floor-clean,2025-05-19,Stay on top of your floor care with a simple cleaning schedule! 🗓️ This post provides a weekly,monthly
Protect Your Investment!,https://res.cloudinary.com/dbcpfy04c/image/upload/v1747694020/pin_5_16_agxofj.webp,wood-floor-tips,,https://www.beacleaner.com/can-you-use-carpet-cleaner-on-hardwood-floor?utm_source=pinterest&utm_campaign=protect-your-investm,2025-05-19,Your hardwood floors are a valuable investment! 🏡 Protect them by avoiding harsh chemicals like carpet cleaner. This post explains the risks and provides safe,effective cleaning solutions. Click to learn more! #HardwoodFloorInvestment #WoodFloorValue #FloorProtectionTips #CleaningForValue
Don't Let Stains Ruin Your Floors,https://res.cloudinary.com/dbcpfy04c/image/upload/v1747694026/pin_5_17_fr1zp9.webp,floor-cleaning-tips,,https://www.beacleaner.com/can-you-use-carpet-cleaner-on-hardwood-floor?utm_source=pinterest&utm_campaign=dont-let-stains-ruin,2025-05-19,Spilled something on your hardwood? 😱 Don't panic! This post provides tips for removing common stains from hardwood floors,and warns against using carpet cleaner. Learn how to clean safely and effectively. #HardwoodFloorStains #WoodFloorStainRemoval #CleaningSolutions #FloorRescue
The pH Level Problem,https://res.cloudinary.com/dbcpfy04c/image/upload/v1747694034/pin_5_18_bpo6tt.webp,floor-care-tips,,https://www.beacleaner.com/can-you-use-carpet-cleaner-on-hardwood-floor?utm_source=pinterest&utm_campaign=the-ph-level-problem,2025-05-19,Understanding pH levels is key to safe floor cleaning! 🧪 This post explains why the pH level of carpet cleaner is harmful to hardwood floors,and provides a list of pH-neutral cleaning solutions. #HardwoodFloorpH #WoodFloorChemistry #CleaningScience #FloorCareFacts
Residue-Free Hardwood Cleaning,https://res.cloudinary.com/dbcpfy04c/image/upload/v1747694045/pin_5_19_qpw4ss.webp,wood-floor-tips,,https://www.beacleaner.com/can-you-use-carpet-cleaner-on-hardwood-floor?utm_source=pinterest&utm_campaign=residue-free-hardwoo,2025-05-19,Avoid sticky residue buildup on your floors! 🚫 This post explains why carpet cleaner leaves behind a harmful residue,and provides tips for achieving a residue-free clean. #HardwoodFloorResidue #WoodFloorCleaningTips #ResidueFreeCleaning #FloorShine
Safe Cleaning for Pets & Kids,https://res.cloudinary.com/dbcpfy04c/image/upload/v1747694052/pin_5_20_uy20hw.webp,safe-cleaning-tips,,https://www.beacleaner.com/can-you-use-carpet-cleaner-on-hardwood-floor?utm_source=pinterest&utm_campaign=safe-cleaning-for-pe,2025-05-19,Keep your family and pets safe with non-toxic floor cleaning solutions! 🐾 This post provides a list of safe cleaning options for hardwood floors,and warns against using carpet cleaner. #PetSafeCleaning #KidSafeCleaning #NonToxicFloorCleaner #HardwoodFloorCare
Long-Term Hardwood Floor Care,https://res.cloudinary.com/dbcpfy04c/image/upload/v1747694061/pin_5_21_kj6pve.webp,wood-floor-tips,,https://www.beacleaner.com/can-you-use-carpet-cleaner-on-hardwood-floor?utm_source=pinterest&utm_campaign=long-term-hardwood-f,2025-05-19,Want your hardwood floors to last a lifetime? ⏳ This post provides tips for long-term hardwood floor care,and emphasizes the importance of avoiding damaging chemicals like carpet cleaner. #LongTermFloorCare #WoodFloorLongevity #FloorMaintenanceTips #HardwoodFloorLife
Quick & Easy Floor Cleaning,https://res.cloudinary.com/dbcpfy04c/image/upload/v1747694068/pin_5_22_uyj69a.webp,floor-cleaning-tips,,https://www.beacleaner.com/can-you-use-carpet-cleaner-on-hardwood-floor?utm_source=pinterest&utm_campaign=quick-easy-floor-cle,2025-05-19,Busy schedule? No problem! ⏱️ This post provides quick and easy hardwood floor cleaning tips,and reminds you to steer clear of carpet cleaner. #QuickFloorCleaning #EasyFloorCare #WoodFloorCleaningHacks #CleaningOnTheGo
