Title,Media URL,Pinterest board,Thumbnail,Link,Publish date,Description,Keywords
IBC Tote Cleaning Guide: Simple Steps,https://res.cloudinary.com/dbcpfy04c/image/upload/v1747693474/pin_3_2_yjdec4.webp,water-storage-tips,,https://www.beacleaner.com/how-to-clean-an-ibc-tote?utm_source=pinterest&utm_campaign=ibc-tote-cleaning-gu,2025-05-19,"Is your IBC tote looking grimy? Don't let buildup ruin your water storage or chemical mixing! This guide breaks down how to clean an IBC tote safely and effectively, even if it held something sticky or corrosive. We cover everything from rinsing to sanitizing, ensuring your tote is ready for its next use.  Protect your investment and keep your liquids pure. Click to learn the best methods and avoid common mistakes!  A clean tote means peace of mind.","IBC tote, cleaning, water storage, sanitation"
Dirty IBC? Restore It! (Easy Guide),https://res.cloudinary.com/dbcpfy04c/image/upload/v1747693482/pin_3_3_lwcmrt.webp,tote-cleaning-tips,,https://www.beacleaner.com/how-to-clean-an-ibc-tote?utm_source=pinterest&utm_campaign=dirty-ibc-restore-it,2025-05-19,"Don't replace a perfectly good IBC tote – revive it! This step-by-step guide shows you how to thoroughly clean your IBC, removing residue and preventing contamination.  We'll walk you through the process, from initial inspection to final rinse, with clear instructions and helpful tips.  Imagine the satisfaction of a sparkling clean tote, ready to use.  Save money and extend the life of your equipment! Click to learn more.","IBC cleaning, tote maintenance, DIY cleaning, chemical storage"
IBC Tote Cleaning: Before & After!,https://res.cloudinary.com/dbcpfy04c/image/upload/v1747693491/pin_3_4_c1wmax.webp,water-storage-tips,,https://www.beacleaner.com/how-to-clean-an-ibc-tote?utm_source=pinterest&utm_campaign=ibc-tote-cleaning-be,2025-05-19,"Witness the amazing transformation! This pin showcases a dramatic before-and-after of an IBC tote cleaning.  We'll show you how to tackle even the toughest grime and buildup, restoring your tote to its former glory.  Don't let a dirty tote compromise the quality of your liquids.  This guide provides a simple, effective solution.  Click to see the incredible results and learn how to do it yourself!  You'll be amazed!","IBC tote, before and after, cleaning tips, restoration"
Safe IBC Tote Cleaning: Protect Yourself!,https://res.cloudinary.com/dbcpfy04c/image/upload/v1747693499/pin_3_5_gzcelx.webp,safety-tips-ideas,,https://www.beacleaner.com/how-to-clean-an-ibc-tote?utm_source=pinterest&utm_campaign=safe-ibc-tote-cleani,2025-05-19,Cleaning an IBC tote can be tricky. This guide prioritizes safety! Learn how to protect yourself from harmful chemicals and ensure a thorough cleaning process. We cover essential safety gear and best practices for handling different types of residue.  Don't risk your health – clean your tote the right way.  Click to learn how to stay safe and get a sparkling clean result!,"IBC safety, cleaning chemicals, protective gear, safe handling"
IBC Tote Cleaning: The Ultimate Checklist,https://res.cloudinary.com/dbcpfy04c/image/upload/v1747693506/pin_3_6_halz8h.webp,water-storage-tips,,https://www.beacleaner.com/how-to-clean-an-ibc-tote?utm_source=pinterest&utm_campaign=ibc-tote-cleaning-th,2025-05-19,"Never miss a step! This pin features a handy checklist for cleaning your IBC tote. From initial inspection to final sanitization, we've got you covered.  Ensure a thorough and effective cleaning every time.  Print it out and keep it handy for future use.  A clean tote is a happy tote! Click to download the checklist and get started.","IBC checklist, cleaning guide, tote maintenance, step-by-step"
DIY IBC Tote Cleaner: Save Money!,https://res.cloudinary.com/dbcpfy04c/image/upload/v1747693513/pin_3_7_ojleau.webp,cleaning-tips,,https://www.beacleaner.com/how-to-clean-an-ibc-tote?utm_source=pinterest&utm_campaign=diy-ibc-tote-cleaner,2025-05-19,"Skip the expensive cleaning services! This guide shows you how to clean your IBC tote yourself, saving you time and money.  We'll share our favorite DIY cleaning solutions and techniques.  Get a professional-level clean without breaking the bank.  Click to learn how to become an IBC cleaning pro!  Your wallet will thank you.","DIY cleaning, IBC tote, cost-effective, homemade cleaner"
IBC Tote Cleaning for Water Storage,https://res.cloudinary.com/dbcpfy04c/image/upload/v1747693518/pin_3_8_gmhhxu.webp,water-storage-tips,,https://www.beacleaner.com/how-to-clean-an-ibc-tote?utm_source=pinterest&utm_campaign=ibc-tote-cleaning-fo,2025-05-19,"Keep your water clean and safe! This guide focuses on cleaning IBC totes specifically for water storage.  We'll cover the best methods for removing sediment, algae, and other contaminants.  Ensure your water is always fresh and potable.  Click to learn how to maintain a clean and healthy water supply.  Peace of mind for you and your family!","Water storage, IBC cleaning, potable water, tank sanitation"
How to Sanitize an IBC Tote (Step-by-Step),https://res.cloudinary.com/dbcpfy04c/image/upload/v1747693526/pin_3_9_ffyeag.webp,cleaning-tips,,https://www.beacleaner.com/how-to-clean-an-ibc-tote?utm_source=pinterest&utm_campaign=how-to-sanitize-an-i,2025-05-19,"Beyond cleaning – sanitize! This guide details how to properly sanitize your IBC tote, eliminating bacteria and ensuring a hygienic environment.  Perfect for food-grade applications or sensitive liquids.  Protect your products and maintain quality control.  Click to learn the sanitization process and keep your tote germ-free!","IBC sanitization, food grade, hygiene, disinfection"
IBC Tote Cleaning: Dealing with Sticky Residue,https://res.cloudinary.com/dbcpfy04c/image/upload/v1747693533/pin_3_10_sjo3hp.webp,water-storage-tips,,https://www.beacleaner.com/how-to-clean-an-ibc-tote?utm_source=pinterest&utm_campaign=ibc-tote-cleaning-de,2025-05-19,Got a sticky situation? This guide tackles tough residue in IBC totes.  We'll show you how to dissolve and remove even the most stubborn buildup.  Don't let sticky residue ruin your tote or contaminate your liquids.  Click to learn our expert tips and tricks!  Say goodbye to sticky messes!,"Sticky residue, IBC cleaning, tough stains, removal"
Extend Your IBC Tote's Life: Cleaning Tips,https://res.cloudinary.com/dbcpfy04c/image/upload/v1747693539/pin_3_11_hvjlw9.webp,storage-tips,,https://www.beacleaner.com/how-to-clean-an-ibc-tote?utm_source=pinterest&utm_campaign=extend-your-ibc-tote,2025-05-19,Want your IBC tote to last? Regular cleaning is key! This guide provides essential maintenance tips to extend the life of your tote and prevent damage.  Protect your investment and avoid costly replacements.  Click to learn how to keep your tote in top condition for years to come!,"IBC maintenance, tote lifespan, cleaning schedule, prevention"
IBC Tote Cleaning: What You'll Need,https://res.cloudinary.com/dbcpfy04c/image/upload/v1747693547/pin_3_12_fyhrel.webp,water-storage-tips,,https://www.beacleaner.com/how-to-clean-an-ibc-tote?utm_source=pinterest&utm_campaign=ibc-tote-cleaning-wh,2025-05-19,"Gather your supplies! This pin lists all the tools and materials you'll need to clean your IBC tote effectively.  From hoses to brushes to cleaning solutions, we've got you covered.  Be prepared and make the cleaning process a breeze.  Click to see the complete list and get started!","IBC supplies, cleaning tools, materials list, preparation"
IBC Tote Cleaning: Common Mistakes to Avoid,https://res.cloudinary.com/dbcpfy04c/image/upload/v1747693553/pin_3_13_v4imls.webp,water-storage-tips,,https://www.beacleaner.com/how-to-clean-an-ibc-tote?utm_source=pinterest&utm_campaign=ibc-tote-cleaning-co,2025-05-19,"Don't make these mistakes! This guide highlights common errors people make when cleaning IBC totes and how to avoid them.  Save time, money, and frustration by learning from our experience.  Click to learn the do's and don'ts of IBC cleaning!","IBC mistakes, cleaning errors, avoid problems, best practices"
IBC Tote Cleaning: For Chemical Storage,https://res.cloudinary.com/dbcpfy04c/image/upload/v1747693564/pin_3_14_wo4pwj.webp,water-storage-tips,,https://www.beacleaner.com/how-to-clean-an-ibc-tote?utm_source=pinterest&utm_campaign=ibc-tote-cleaning-fo,2025-05-19,Cleaning after chemicals? This guide provides specific instructions for cleaning IBC totes that have held chemicals.  Ensure proper neutralization and removal of hazardous residue.  Protect yourself and the environment.  Click to learn the safe and effective way to clean chemical-contaminated totes!,"Chemical storage, IBC cleaning, neutralization, hazardous waste"
Quick IBC Tote Rinse: A Fast Cleaning Method,https://res.cloudinary.com/dbcpfy04c/image/upload/v1747693575/pin_3_15_o1flfu.webp,cleaning-tips,,https://www.beacleaner.com/how-to-clean-an-ibc-tote?utm_source=pinterest&utm_campaign=quick-ibc-tote-rinse,2025-05-19,Short on time? This pin shows you a quick and easy method for rinsing your IBC tote.  Perfect for light cleaning or preparing the tote for a new liquid.  Get a fast refresh without a lot of effort.  Click to learn the quick rinse technique!,"IBC rinse, quick cleaning, fast method, light cleaning"
IBC Tote Cleaning: The Power of Pressure Washing,https://res.cloudinary.com/dbcpfy04c/image/upload/v1747693581/pin_3_16_xlqfbj.webp,water-storage-tips,,https://www.beacleaner.com/how-to-clean-an-ibc-tote?utm_source=pinterest&utm_campaign=ibc-tote-cleaning-th,2025-05-19,Take cleaning to the next level! This guide explores the benefits of using a pressure washer to clean your IBC tote.  Remove stubborn grime and buildup with ease.  Click to learn how to safely and effectively pressure wash your tote!,"Pressure washing, IBC cleaning, powerful cleaning, grime removal"
Is Your IBC Tote Food Grade? Cleaning Matters!,https://res.cloudinary.com/dbcpfy04c/image/upload/v1747693589/pin_3_17_tya0ig.webp,food-safety-tips,,https://www.beacleaner.com/how-to-clean-an-ibc-tote?utm_source=pinterest&utm_campaign=is-your-ibc-tote-foo,2025-05-19,Maintaining food-grade status requires meticulous cleaning. This guide details how to clean your IBC tote to ensure it remains suitable for food-grade applications. Protect your products and comply with regulations. Click to learn the essential steps!,"Food grade, IBC cleaning, sanitation, compliance"
IBC Tote Cleaning: Dealing with Algae Growth,https://res.cloudinary.com/dbcpfy04c/image/upload/v1747693594/pin_3_18_aestjd.webp,water-storage-tips,,https://www.beacleaner.com/how-to-clean-an-ibc-tote?utm_source=pinterest&utm_campaign=ibc-tote-cleaning-de,2025-05-19,Battling algae in your IBC tote? This guide provides effective solutions for removing algae and preventing its regrowth. Keep your water clean and clear. Click to learn our algae-fighting techniques!,"Algae removal, IBC cleaning, water clarity, prevention"
IBC Tote Cleaning: A Visual Guide (Photos),https://res.cloudinary.com/dbcpfy04c/image/upload/v1747693603/pin_3_19_hrfa9z.webp,water-storage-tips,,https://www.beacleaner.com/how-to-clean-an-ibc-tote?utm_source=pinterest&utm_campaign=ibc-tote-cleaning-a-,2025-05-19,See the process in action! This pin features a series of photos illustrating each step of the IBC tote cleaning process.  A visual learner's dream!  Click to see the step-by-step guide with clear images!,"IBC cleaning, visual guide, photos, step-by-step"
IBC Tote Cleaning: Troubleshooting Tips,https://res.cloudinary.com/dbcpfy04c/image/upload/v1747693611/pin_3_20_bysngs.webp,water-storage-tips,,https://www.beacleaner.com/how-to-clean-an-ibc-tote?utm_source=pinterest&utm_campaign=ibc-tote-cleaning-tr,2025-05-19,Encountering problems? This guide offers troubleshooting tips for common issues that arise during IBC tote cleaning.  Solve problems quickly and efficiently.  Click to find solutions to your cleaning challenges!,"IBC troubleshooting, cleaning problems, solutions, tips"
IBC Tote Cleaning: The Importance of Rinsing,https://res.cloudinary.com/dbcpfy04c/image/upload/v1747693616/pin_3_21_gd6jt0.webp,water-storage-tips,,https://www.beacleaner.com/how-to-clean-an-ibc-tote?utm_source=pinterest&utm_campaign=ibc-tote-cleaning-th,2025-05-19,Don't skip the rinse! This pin emphasizes the importance of thorough rinsing after cleaning your IBC tote.  Remove all traces of cleaning solutions and prevent contamination.  Click to learn why rinsing is crucial!,"IBC rinsing, cleaning solutions, contamination, thoroughness"
IBC Tote Cleaning: A Beginner's Guide,https://res.cloudinary.com/dbcpfy04c/image/upload/v1747693622/pin_3_22_sikd1m.webp,water-storage-tips,,https://www.beacleaner.com/how-to-clean-an-ibc-tote?utm_source=pinterest&utm_campaign=ibc-tote-cleaning-a-,2025-05-19,"New to IBC totes? This guide is perfect for beginners! We'll walk you through the entire cleaning process, from start to finish.  Easy-to-follow instructions and helpful tips.  Click to learn how to clean your IBC tote with confidence!","Beginner's guide, IBC cleaning, easy instructions, first time"
IBC Tote Cleaning: Preventative Measures,https://res.cloudinary.com/dbcpfy04c/image/upload/v1747693629/pin_3_23_rxjlnq.webp,water-storage-tips,,https://www.beacleaner.com/how-to-clean-an-ibc-tote?utm_source=pinterest&utm_campaign=ibc-tote-cleaning-pr,2025-05-19,Stop grime before it starts! This pin focuses on preventative measures to keep your IBC tote clean and reduce the need for frequent cleaning.  Simple habits that make a big difference.  Click to learn how to keep your tote sparkling clean!,"Preventative cleaning, IBC maintenance, grime prevention, habits"
IBC Tote Cleaning: Eco-Friendly Options,https://res.cloudinary.com/dbcpfy04c/image/upload/v1747693635/pin_3_24_gj1fyn.webp,water-storage-tips,,https://www.beacleaner.com/how-to-clean-an-ibc-tote?utm_source=pinterest&utm_campaign=ibc-tote-cleaning-ec,2025-05-19,Go green! This guide explores eco-friendly cleaning solutions for your IBC tote.  Protect the environment while keeping your tote clean.  Click to learn about sustainable cleaning options!,"Eco-friendly cleaning, IBC tote, sustainable, green cleaning"
IBC Tote Cleaning: When to Call a Professional,https://res.cloudinary.com/dbcpfy04c/image/upload/v1747693642/pin_3_25_dlhuwy.webp,water-storage-tips,,https://www.beacleaner.com/how-to-clean-an-ibc-tote?utm_source=pinterest&utm_campaign=ibc-tote-cleaning-wh,2025-05-19,"Sometimes, it's best to leave it to the pros. This guide helps you determine when to call a professional IBC tote cleaning service.  Ensure a thorough and safe cleaning for complex situations. Click to learn when to seek expert help!","Professional cleaning, IBC tote, complex cleaning, safety"
Title,https://res.cloudinary.com/dbcpfy04c/image/upload/v1747693690/pin_4_1_avq7k4.webp,please-provide-the-title-and-keywords-i-need-that-information-to-suggest-a-board-name-once,,https://www.beacleaner.com/how-to-clean-bottle-warmer?utm_source=pinterest&utm_campaign=title,2025-05-19,Description,Keywords
Bottle Warmer SOS! ✨,https://res.cloudinary.com/dbcpfy04c/image/upload/v1747693696/pin_4_2_vgqw8i.webp,baby-cleaning-tips,,https://www.beacleaner.com/how-to-clean-bottle-warmer?utm_source=pinterest&utm_campaign=bottle-warmer-sos,2025-05-19,"Is your bottle warmer looking…less than fresh? Don't worry, mama (or papa)! This guide breaks down exactly how to clean your bottle warmer, keeping it hygienic for your little one. From daily quick cleans to deep disinfecting, we cover it all. A clean bottle warmer means a happy, healthy baby! Prevent buildup, eliminate odors, and ensure every bottle is prepared with love. Click to learn the simple steps and keep those precious bottles sparkling! You deserve peace of mind.","Bottle Warmer Cleaning,Baby Hygiene,Cleaning Tips,Disinfecting"
Say Goodbye to Bottle Warmer Grime!,https://res.cloudinary.com/dbcpfy04c/image/upload/v1747693702/pin_4_3_tmhnzt.webp,baby-cleaning-tips,,https://www.beacleaner.com/how-to-clean-bottle-warmer?utm_source=pinterest&utm_campaign=say-goodbye-to-bottl,2025-05-19,"Don't let a dirty bottle warmer compromise your baby's health! This post reveals the secrets to a spotless bottle warmer, even if it's been a while since its last clean. We'll show you how to tackle mineral buildup, milk residue, and lingering smells.  It's easier than you think!  Protect your little one and enjoy the convenience of a clean, reliable bottle warmer.  Click to read now and reclaim your peace of mind!","Bottle Warmer,Cleaning Guide,Baby Essentials,Mineral Buildup"
Quick Clean: Bottle Warmer in 5 Minutes!,https://res.cloudinary.com/dbcpfy04c/image/upload/v1747693711/pin_4_4_vttgpq.webp,baby-care-tips,,https://www.beacleaner.com/how-to-clean-bottle-warmer?utm_source=pinterest&utm_campaign=quick-clean-bottle-w,2025-05-19,Short on time? No problem! This pin highlights a super-fast bottle warmer cleaning routine that fits into even the busiest schedules.  We'll show you how to do a daily wipe-down to prevent major buildup and keep things sanitary.  A little effort goes a long way in protecting your baby.  Don't let a dirty warmer stress you out – click to learn this simple trick!  Your baby's health is worth it.,"Fast Cleaning,Bottle Warmer,Baby Care,Daily Routine"
Deep Clean Your Bottle Warmer (Step-by-Step),https://res.cloudinary.com/dbcpfy04c/image/upload/v1747693717/pin_4_5_rfkmr5.webp,kitchen-cleaning-tips,,https://www.beacleaner.com/how-to-clean-bottle-warmer?utm_source=pinterest&utm_campaign=deep-clean-your-bott,2025-05-19,"Give your bottle warmer the thorough cleaning it deserves! This pin leads to a detailed, step-by-step guide to deep cleaning and disinfecting.  We cover everything from disassembly to sanitizing, ensuring every part is sparkling clean.  Protect your little one from harmful bacteria and enjoy the peace of mind that comes with a truly clean bottle warmer. Click to learn more!","Deep Cleaning,Bottle Warmer,Disinfecting,Baby Safety"
Vinegar to the Rescue! Bottle Warmer Cleaning,https://res.cloudinary.com/dbcpfy04c/image/upload/v1747693726/pin_4_6_etujqu.webp,baby-cleaning-tips,,https://www.beacleaner.com/how-to-clean-bottle-warmer?utm_source=pinterest&utm_campaign=vinegar-to-the-rescu,2025-05-19,Harness the power of vinegar for a naturally clean bottle warmer! This pin focuses on using vinegar as a safe and effective cleaning solution.  We'll show you how to use it to remove mineral buildup and eliminate odors without harsh chemicals.  A natural solution for a natural worry. Click to learn how to keep your baby's bottles safe and clean!,"Vinegar Cleaning,Bottle Warmer,Natural Cleaning,Baby Products"
Bottle Warmer Cleaning: Preventative Care,https://res.cloudinary.com/dbcpfy04c/image/upload/v1747693732/pin_4_7_wqyvof.webp,baby-gear-tips,,https://www.beacleaner.com/how-to-clean-bottle-warmer?utm_source=pinterest&utm_campaign=bottle-warmer-cleani,2025-05-19,"Don't wait for buildup – prevent it! This pin emphasizes the importance of regular bottle warmer maintenance.  We'll share tips on how to keep your warmer clean with minimal effort, saving you time and hassle in the long run.  A little prevention is worth a pound of cure! Click to learn how to keep your bottle warmer in top shape.","Preventative Cleaning,Bottle Warmer,Maintenance,Baby Gear"
Is Your Bottle Warmer a Bacteria Breeding Ground?,https://res.cloudinary.com/dbcpfy04c/image/upload/v1747693741/pin_4_8_htwqns.webp,baby-health-tips,,https://www.beacleaner.com/how-to-clean-bottle-warmer?utm_source=pinterest&utm_campaign=is-your-bottle-warme,2025-05-19,"Scary thought, right? This pin highlights the potential health risks of a dirty bottle warmer and emphasizes the importance of regular cleaning.  Protect your little one from harmful bacteria and ensure every bottle is prepared in a hygienic environment.  Click to learn how to keep your baby safe and healthy!","Bacteria,Bottle Warmer,Hygiene,Baby Health"
Bottle Warmer Cleaning Checklist 📝,https://res.cloudinary.com/dbcpfy04c/image/upload/v1747693747/pin_4_9_g31u1o.webp,baby-gear-tips,,https://www.beacleaner.com/how-to-clean-bottle-warmer?utm_source=pinterest&utm_campaign=bottle-warmer-cleani,2025-05-19,Stay organized with our handy bottle warmer cleaning checklist! This pin links to a printable checklist to help you keep track of your cleaning schedule.  Never forget to clean your bottle warmer again!  A clean warmer is a happy warmer (and a happy baby!). Click to download the checklist now!,"Cleaning Checklist,Bottle Warmer,Organization,Baby Routine"
DIY Bottle Warmer Cleaning Solution 🍋,https://res.cloudinary.com/dbcpfy04c/image/upload/v1747693756/pin_4_10_pfrre3.webp,baby-cleaning-tips,,https://www.beacleaner.com/how-to-clean-bottle-warmer?utm_source=pinterest&utm_campaign=diy-bottle-warmer-cl,2025-05-19,Skip the harsh chemicals! This pin showcases a simple DIY cleaning solution for your bottle warmer using natural ingredients.  Safe for your baby and effective at removing buildup.  Click to learn how to make your own cleaning solution and keep your bottle warmer sparkling clean!,"DIY Cleaning,Bottle Warmer,Natural Solution,Baby Safe"
Bottle Warmer Cleaning: Before & After 🤩,https://res.cloudinary.com/dbcpfy04c/image/upload/v1747693761/pin_4_11_l7plnr.webp,baby-gear-tips,,https://www.beacleaner.com/how-to-clean-bottle-warmer?utm_source=pinterest&utm_campaign=bottle-warmer-cleani,2025-05-19,See the amazing results! This pin features a before-and-after photo showcasing the dramatic difference a good cleaning can make.  Inspire others to tackle their own dirty bottle warmers and enjoy the peace of mind that comes with a sparkling clean appliance. Click to see the transformation!,"Before and After,Bottle Warmer,Cleaning Results,Visual Inspiration"
The Ultimate Bottle Warmer Cleaning Guide,https://res.cloudinary.com/dbcpfy04c/image/upload/v1747693769/pin_4_12_pljnv3.webp,baby-tips-ideas,,https://www.beacleaner.com/how-to-clean-bottle-warmer?utm_source=pinterest&utm_campaign=the-ultimate-bottle-,2025-05-19,"Everything you need to know about cleaning your bottle warmer is right here! This pin links to the comprehensive blog post, covering all aspects of bottle warmer hygiene. From daily maintenance to deep cleaning, we've got you covered. Click to become a bottle warmer cleaning pro!","Ultimate Guide,Bottle Warmer,Cleaning Tips,Comprehensive"
Bottle Warmer Smells? Get Rid of Odors!,https://res.cloudinary.com/dbcpfy04c/image/upload/v1747693774/pin_4_13_sbzbnc.webp,baby-cleaning-tips,,https://www.beacleaner.com/how-to-clean-bottle-warmer?utm_source=pinterest&utm_campaign=bottle-warmer-smells,2025-05-19,Don't let lingering odors ruin your baby's feeding experience! This pin focuses on how to eliminate unpleasant smells from your bottle warmer.  We'll share effective techniques to neutralize odors and keep your warmer smelling fresh and clean. Click to learn how to banish those smells!,"Odor Removal,Bottle Warmer,Cleaning,Freshness"
Bottle Warmer Cleaning for Busy Moms 🤱,https://res.cloudinary.com/dbcpfy04c/image/upload/v1747693779/pin_4_14_jngajd.webp,baby-gear-tips,,https://www.beacleaner.com/how-to-clean-bottle-warmer?utm_source=pinterest&utm_campaign=bottle-warmer-cleani,2025-05-19,"You're a supermom, but even superheroes need help! This pin offers quick and easy bottle warmer cleaning tips for busy moms.  We understand your time is precious, so we've streamlined the cleaning process. Click to learn how to keep your bottle warmer clean without sacrificing your sanity!","Busy Moms,Bottle Warmer,Quick Cleaning,Time Saving"
Mineral Buildup in Bottle Warmer? Fix It!,https://res.cloudinary.com/dbcpfy04c/image/upload/v1747693785/pin_4_15_iihsgs.webp,appliance-tips,,https://www.beacleaner.com/how-to-clean-bottle-warmer?utm_source=pinterest&utm_campaign=mineral-buildup-in-b,2025-05-19,Don't let mineral buildup ruin your bottle warmer! This pin specifically addresses the issue of mineral deposits and provides effective solutions for removing them.  Protect your appliance and ensure optimal performance. Click to learn how to tackle mineral buildup!,"Mineral Buildup,Bottle Warmer,Cleaning Solution,Appliance Care"
Sterilizing Your Bottle Warmer: Is It Necessary?,https://res.cloudinary.com/dbcpfy04c/image/upload/v1747693792/pin_4_16_kxj909.webp,baby-safety-tips,,https://www.beacleaner.com/how-to-clean-bottle-warmer?utm_source=pinterest&utm_campaign=sterilizing-your-bot,2025-05-19,Wondering if you need to sterilize your bottle warmer? This pin answers that question and provides guidance on when and how to sterilize for optimal hygiene.  Protect your little one from harmful germs. Click to learn more about sterilization!,"Sterilizing,Bottle Warmer,Hygiene,Baby Safety"
Bottle Warmer Cleaning: Common Mistakes to Avoid,https://res.cloudinary.com/dbcpfy04c/image/upload/v1747693798/pin_4_17_onsouv.webp,baby-gear-tips,,https://www.beacleaner.com/how-to-clean-bottle-warmer?utm_source=pinterest&utm_campaign=bottle-warmer-cleani,2025-05-19,Don't make these cleaning mistakes! This pin highlights common errors people make when cleaning their bottle warmers and provides tips on how to avoid them.  Ensure you're cleaning effectively and safely. Click to learn what *not* to do!,"Cleaning Mistakes,Bottle Warmer,Tips,Avoid Errors"
Extend the Life of Your Bottle Warmer!,https://res.cloudinary.com/dbcpfy04c/image/upload/v1747693805/pin_4_18_udcrbn.webp,baby-tips-ideas,,https://www.beacleaner.com/how-to-clean-bottle-warmer?utm_source=pinterest&utm_campaign=extend-the-life-of-y,2025-05-19,Want to keep your bottle warmer working like new for years to come? This pin emphasizes the importance of regular cleaning and maintenance for extending the lifespan of your appliance.  Save money and enjoy the convenience of a reliable bottle warmer. Click to learn how!,"Bottle Warmer,Maintenance,Longevity,Appliance Care"
