Title,Media URL,Pinterest board,Thumbnail,Link,Publish date,Description,Keywords
Marley Floor Cleaning for Dance Studios,https://res.cloudinary.com/dbcpfy04c/image/upload/v1748068162/pin_3_9_zxckyu.webp,floor-cleaning-tips,,https://www.beacleaner.com/how-to-clean-marley-floor?utm_source=pinterest&utm_campaign=marley-floor-cleanin,2025-05-24,Dance studio owners: keep your floors safe and sparkling! This pin focuses on the specific cleaning needs of dance studios,including high-traffic areas and the importance of slip resistance.  Create a safe and inviting environment for your dancers. #DanceStudioCleaning #MarleyFloor #StudioMaintenance #DanceFloorCare
Marley Floor: Deep Cleaning Secrets Revealed,https://res.cloudinary.com/dbcpfy04c/image/upload/v1748068168/pin_3_10_zfseu6.webp,floor-cleaning-tips,,https://www.beacleaner.com/how-to-clean-marley-floor?utm_source=pinterest&utm_campaign=marley-floor-deep-cl,2025-05-24,Unlock the secrets to a truly deep clean! This pin goes beyond surface cleaning to tackle embedded dirt and grime. Learn about specialized techniques and products for a thorough,long-lasting clean.  Give your Marley floor the TLC it deserves. #DeepCleaning #MarleyFloorCleaning #FloorCareTips #CleaningSecrets
Marley Floor: Quick Daily Cleaning Routine,https://res.cloudinary.com/dbcpfy04c/image/upload/v1748068174/pin_3_11_tdnsg1.webp,floor-cleaning-tips,,https://www.beacleaner.com/how-to-clean-marley-floor?utm_source=pinterest&utm_campaign=marley-floor-quick-d,2025-05-24,Busy schedule? This pin provides a quick and easy daily cleaning routine to keep your Marley floor looking its best.  Just a few minutes each day can prevent dirt buildup and maintain a beautiful,safe surface.  Make cleaning a habit
Marley Floor: Removing Scuff Marks Easily,https://res.cloudinary.com/dbcpfy04c/image/upload/v1748068182/pin_3_12_ol5775.webp,floor-cleaning-tips,,https://www.beacleaner.com/how-to-clean-marley-floor?utm_source=pinterest&utm_campaign=marley-floor-removin,2025-05-24,Ugh,scuff marks! This pin shows you how to easily remove scuff marks from your Marley floor without damaging the surface.  Learn the best techniques and products for a flawless finish.  Don't let scuffs ruin the look of your floor. #ScuffMarks #MarleyFloorCleaning #FloorRepair #CleaningTips
Marley Floor: Choosing the Right Mop,https://res.cloudinary.com/dbcpfy04c/image/upload/v1748068188/pin_3_13_nqywtv.webp,cleaning-tips,,https://www.beacleaner.com/how-to-clean-marley-floor?utm_source=pinterest&utm_campaign=marley-floor-choosin,2025-05-24,The right mop makes all the difference! This pin guides you through choosing the best mop for your Marley floor,considering factors like material
Marley Floor: Cleaning After Heavy Use,https://res.cloudinary.com/dbcpfy04c/image/upload/v1748068195/pin_3_14_qcc6ig.webp,cleaning-tips,,https://www.beacleaner.com/how-to-clean-marley-floor?utm_source=pinterest&utm_campaign=marley-floor-cleanin,2025-05-24,After a busy class or performance? This pin provides specific cleaning instructions for Marley floors that have seen heavy use.  Learn how to tackle sweat,dirt
Marley Floor: Spot Cleaning Guide,https://res.cloudinary.com/dbcpfy04c/image/upload/v1748068202/pin_3_15_z1lhrw.webp,floor-cleaning-tips,,https://www.beacleaner.com/how-to-clean-marley-floor?utm_source=pinterest&utm_campaign=marley-floor-spot-cl,2025-05-24,Spills happen! This pin offers a quick guide to spot cleaning your Marley floor,addressing common stains and messes.  Learn how to act fast to prevent permanent damage.  Keep your floor looking its best with these simple tips. #SpotCleaning #MarleyFloorCleaning #StainRemoval #QuickTips
Marley Floor: Eco-Friendly Cleaning Options,https://res.cloudinary.com/dbcpfy04c/image/upload/v1748068209/pin_3_16_bniqkd.webp,eco-cleaning-tips,,https://www.beacleaner.com/how-to-clean-marley-floor?utm_source=pinterest&utm_campaign=marley-floor-eco-fri,2025-05-24,Go green! This pin highlights eco-friendly cleaning options for your Marley floor,using natural and sustainable products.  Protect your floor and the environment with these responsible cleaning choices. #EcoFriendlyCleaning #MarleyFloor #GreenCleaning #SustainableCleaning
Marley Floor: Extending Floor Lifespan,https://res.cloudinary.com/dbcpfy04c/image/upload/v1748068215/pin_3_17_malkfr.webp,eco-cleaning-tips,,https://www.beacleaner.com/how-to-clean-marley-floor?utm_source=pinterest&utm_campaign=marley-floor-extendi,2025-05-24,Want your Marley floor to last? This pin provides expert tips on extending its lifespan through proper cleaning,maintenance
Marley Floor: Dealing with Sticky Residue,https://res.cloudinary.com/dbcpfy04c/image/upload/v1748068220/pin_3_18_gvk35y.webp,floor-cleaning-tips,,https://www.beacleaner.com/how-to-clean-marley-floor?utm_source=pinterest&utm_campaign=marley-floor-dealing,2025-05-24,Sticky situation? This pin offers solutions for removing sticky residue from your Marley floor,whether it's from tape
Marley Floor: The Ultimate Checklist,https://res.cloudinary.com/dbcpfy04c/image/upload/v1748068227/pin_3_19_cw8d4x.webp,floor-care-tips,,https://www.beacleaner.com/how-to-clean-marley-floor?utm_source=pinterest&utm_campaign=marley-floor-the-ult,2025-05-24,Don't forget a step! This pin provides a comprehensive cleaning checklist for your Marley floor,ensuring you cover all the bases.  Stay organized and achieve a consistently clean and beautiful floor. #CleaningChecklist #MarleyFloor #FloorCare #CleaningOrganization
Title,https://res.cloudinary.com/dbcpfy04c/image/upload/v1748068270/pin_4_1_iklygn.webp,please-provide-the-title-and-keywords-i-need-that-information-to-suggest-a-board-name-once,,https://www.beacleaner.com/how-to-clean-matte-gel-nails?utm_source=pinterest&utm_campaign=title,2025-05-24,Description,Keywords
Save Your Gel Mani! ✨,https://res.cloudinary.com/dbcpfy04c/image/upload/v1748068276/pin_4_2_up1gvp.webp,gel-nail-tips,,https://www.beacleaner.com/how-to-clean-matte-gel-nails?utm_source=pinterest&utm_campaign=save-your-gel-mani,2025-05-24,Don't let chipped matte gel nails ruin your vibe! This guide shows you exactly how to clean & refresh your manicure at home,saving you time & money. Learn the gentle techniques to remove dust & grime without dulling the matte finish. Keep your nails looking flawless for longer! Click to learn the secrets to a long-lasting
Matte Gel Nail Refresh: Easy Steps,https://res.cloudinary.com/dbcpfy04c/image/upload/v1748068283/pin_4_3_pc0a65.webp,gel-nail-tips,,https://www.beacleaner.com/how-to-clean-matte-gel-nails?utm_source=pinterest&utm_campaign=matte-gel-nail-refre,2025-05-24,Is your matte gel manicure looking a little…lifeless? Revive it with these simple cleaning steps! We'll walk you through everything from prepping your nails to the best products to use. Avoid common mistakes that can damage your gel polish. Get ready for compliments on your stunning,refreshed nails! Click to read the full guide. #MatteGel #NailRefresh #GelPolish #NailMaintenance
Chipped Gel Nails? Fix It!,https://res.cloudinary.com/dbcpfy04c/image/upload/v1748068289/pin_4_4_qgm2pu.webp,gel-nail-tips,,https://www.beacleaner.com/how-to-clean-matte-gel-nails?utm_source=pinterest&utm_campaign=chipped-gel-nails-fi,2025-05-24,Don't panic! Chipped matte gel nails don't mean a trip to the salon. This post reveals how to carefully clean and touch up your manicure,extending its life. Learn how to prevent future chips and keep your nails looking salon-fresh.  Say goodbye to nail emergencies and hello to confidence! Click to learn more. #GelNailRepair #NailFix #MatteManicure #DIYBeauty
The Ultimate Matte Gel Guide,https://res.cloudinary.com/dbcpfy04c/image/upload/v1748068294/pin_4_5_guybft.webp,lash-tips-ideas,,https://www.beacleaner.com/how-to-clean-matte-gel-nails?utm_source=pinterest&utm_campaign=the-ultimate-matte-g,2025-05-24,Dreaming of perfect matte gel nails? This guide covers everything you need to know – from cleaning to maintenance. Discover the best tools and techniques for a flawless,long-lasting finish.  We'll help you achieve a professional-looking manicure at home. Click to unlock the secrets! #MatteGelNails #GelNailTips #NailTutorial #HomeManicure
Gentle Gel Nail Cleaning,https://res.cloudinary.com/dbcpfy04c/image/upload/v1748068300/pin_4_6_l6xfxs.webp,nail-care-tips,,https://www.beacleaner.com/how-to-clean-matte-gel-nails?utm_source=pinterest&utm_campaign=gentle-gel-nail-clea,2025-05-24,Worried about damaging your gel polish? This guide focuses on gentle cleaning methods that won't strip the matte finish or weaken your nails. Learn how to remove dust,oils
Matte Nails: Keep Them Clean!,https://res.cloudinary.com/dbcpfy04c/image/upload/v1748068306/pin_4_7_khcje4.webp,matte-nail-tips,,https://www.beacleaner.com/how-to-clean-matte-gel-nails?utm_source=pinterest&utm_campaign=matte-nails-keep-the,2025-05-24,Maintaining matte gel nails is easier than you think! This post breaks down the process into simple,manageable steps.  Learn how to prevent buildup and keep your manicure looking fresh and vibrant.  Don't let your beautiful nails lose their luster! Click for the full tutorial. #MatteNailCare #GelNailTips #NailRoutine #CleanNails
DIY Matte Gel Nail Care,https://res.cloudinary.com/dbcpfy04c/image/upload/v1748068314/pin_4_8_ivbrao.webp,nail-care-tips,,https://www.beacleaner.com/how-to-clean-matte-gel-nails?utm_source=pinterest&utm_campaign=diy-matte-gel-nail-c,2025-05-24,Save money and time with this DIY matte gel nail care guide! We'll show you how to clean and maintain your manicure at home,using readily available products.  Enjoy salon-quality results without the salon price tag. Click to learn how! #DIYGelNails #MatteGelDIY #NailCareAtHome #BudgetBeauty
Matte Gel Nail Cleaning Hacks,https://res.cloudinary.com/dbcpfy04c/image/upload/v1748068319/pin_4_9_yatml4.webp,gel-nail-tips,,https://www.beacleaner.com/how-to-clean-matte-gel-nails?utm_source=pinterest&utm_campaign=matte-gel-nail-clean,2025-05-24,Discover clever cleaning hacks for your matte gel nails! This post shares insider tips and tricks to keep your manicure looking its best.  From quick touch-ups to deep cleaning,we've got you covered. Click to unlock the secrets! #NailHacks #GelNailCare #MatteNailHacks #BeautyTips
The Best Products for Matte Gel,https://res.cloudinary.com/dbcpfy04c/image/upload/v1748068325/pin_4_10_jiig6g.webp,gel-nail-tips,,https://www.beacleaner.com/how-to-clean-matte-gel-nails?utm_source=pinterest&utm_campaign=the-best-products-fo,2025-05-24,Wondering what products to use for cleaning your matte gel nails? This post reviews the best options,ensuring you don't damage your polish.  We'll help you choose the right tools for a perfect finish. Click to read the review! #NailProducts #GelPolish #MatteGel #NailEssentials
Don't Make These Gel Nail Mistakes!,https://res.cloudinary.com/dbcpfy04c/image/upload/v1748068330/pin_4_11_m4a1ka.webp,lash-care-tips,,https://www.beacleaner.com/how-to-clean-matte-gel-nails?utm_source=pinterest&utm_campaign=dont-make-these-gel-,2025-05-24,Avoid these common mistakes when cleaning your matte gel nails! This post highlights the pitfalls to avoid,ensuring you don't damage your polish.  Learn from our mistakes and keep your nails looking perfect. Click to read the don'ts! #NailMistakes #GelNailCare #MatteGel #NailDonts
Love Your Matte Gel Manicure!,https://res.cloudinary.com/dbcpfy04c/image/upload/v1748068336/pin_4_12_dzcymc.webp,gel-nail-inspiration,,https://www.beacleaner.com/how-to-clean-matte-gel-nails?utm_source=pinterest&utm_campaign=love-your-matte-gel-,2025-05-24,Show your matte gel nails some love! This post emphasizes the importance of proper care and maintenance for a long-lasting,beautiful manicure.  Treat yourself to the nails you deserve! Click to learn how to love your nails. #LoveYourNails #GelNailCare #MatteGel #NailSelfCare
Title,https://res.cloudinary.com/dbcpfy04c/image/upload/v1748068374/pin_5_1_gg5yyg.webp,please-provide-the-title-and-keywords-i-need-that-information-to-suggest-a-board-name-once,,https://www.beacleaner.com/how-to-clean-metal-door-handles?utm_source=pinterest&utm_campaign=title,2025-05-24,Description,Keywords
Sparkling Door Handles: Easy Guide,https://res.cloudinary.com/dbcpfy04c/image/upload/v1748068380/pin_5_2_if8jq0.webp,home-cleaning-tips,,https://www.beacleaner.com/how-to-clean-metal-door-handles?utm_source=pinterest&utm_campaign=sparkling-door-handl,2025-05-24,Tired of grimy door handles ruining your home's first impression? This simple guide reveals how to clean metal door handles like a pro! From everyday dirt to stubborn fingerprints,we cover everything. Learn the best cleaning solutions (you probably already have them!) and techniques to restore shine and prevent future buildup. Don't let dirty handles spread germs – keep your home healthy and welcoming! Click to learn more and enjoy a spotless home. #DoorHandleCleaning #MetalCleaning #HomeCleaningTips #CleanHome
Shine Like New: Metal Handle Care,https://res.cloudinary.com/dbcpfy04c/image/upload/v1748068388/pin_5_3_xrf1np.webp,metal-care-tips,,https://www.beacleaner.com/how-to-clean-metal-door-handles?utm_source=pinterest&utm_campaign=shine-like-new-metal,2025-05-24,Is the metal on your door handles looking dull and lifeless? Don't replace them – revive them! This post shows you how to clean and polish metal door handles,bringing back their original luster. We'll tackle brass
Bye Bye Fingerprints! Door Handles,https://res.cloudinary.com/dbcpfy04c/image/upload/v1748068395/pin_5_4_zah79k.webp,cleaning-tips,,https://www.beacleaner.com/how-to-clean-metal-door-handles?utm_source=pinterest&utm_campaign=bye-bye-fingerprints,2025-05-24,Ugh,fingerprints on every door handle? We feel your pain! This guide is your solution for effortlessly removing those unsightly marks and keeping your door handles looking pristine. We share quick
Stainless Steel Handles: Cleaning,https://res.cloudinary.com/dbcpfy04c/image/upload/v1748068402/pin_5_5_nykdqf.webp,cleaning-tips,,https://www.beacleaner.com/how-to-clean-metal-door-handles?utm_source=pinterest&utm_campaign=stainless-steel-hand,2025-05-24,Keep your stainless steel door handles looking sleek and modern with our expert cleaning tips! This post breaks down the best methods for removing smudges,water spots
Brass Door Handles: Restore the Luster,https://res.cloudinary.com/dbcpfy04c/image/upload/v1748068409/pin_5_6_cpwvej.webp,brass-hardware-ideas,,https://www.beacleaner.com/how-to-clean-metal-door-handles?utm_source=pinterest&utm_campaign=brass-door-handles-r,2025-05-24,Love the look of brass but hate the tarnish? This guide is for you! We'll show you how to clean and polish brass door handles to restore their warm,golden glow. From gentle cleaning to tackling stubborn tarnish
Nickel Door Handles: Gentle Cleaning,https://res.cloudinary.com/dbcpfy04c/image/upload/v1748068417/pin_5_7_jivw1d.webp,home-cleaning-tips,,https://www.beacleaner.com/how-to-clean-metal-door-handles?utm_source=pinterest&utm_campaign=nickel-door-handles-,2025-05-24,Nickel door handles add a touch of sophistication,but they require gentle care. This post provides a step-by-step guide to cleaning nickel hardware without scratching or damaging the finish. Learn the best cleaning solutions and techniques to maintain their beautiful shine. Keep your home looking its best with these simple tips! #NickelCleaning #DoorHardwareCare #GentleCleaning #HomeStyle
Quick Clean: Door Handles in Minutes,https://res.cloudinary.com/dbcpfy04c/image/upload/v1748068422/pin_5_8_k4lfp7.webp,quick-cleaning-tips,,https://www.beacleaner.com/how-to-clean-metal-door-handles?utm_source=pinterest&utm_campaign=quick-clean-door-han,2025-05-24,Short on time? No problem! This post offers quick and easy methods for cleaning metal door handles in just minutes. Perfect for busy homeowners who want a sparkling clean home without spending hours scrubbing. Learn our time-saving tips and enjoy a fresh,inviting space. Click to read now! #QuickCleaning #FastCleaning #HomeCleaning #BusyMom
Deep Clean: Metal Door Handle Guide,https://res.cloudinary.com/dbcpfy04c/image/upload/v1748068428/pin_5_9_lrj65q.webp,cleaning-tips,,https://www.beacleaner.com/how-to-clean-metal-door-handles?utm_source=pinterest&utm_campaign=deep-clean-metal-doo,2025-05-24,Give your metal door handles the deep clean they deserve! This comprehensive guide covers everything from removing stubborn grime to preventing future buildup. We'll share our best tips and tricks for achieving a professional-level clean. A deep clean means a healthier,happier home. Learn how! #DeepCleaning #HomeCleaningGuide #MetalMaintenance #CleanLiving
Protect Your Handles: Preventative Care,https://res.cloudinary.com/dbcpfy04c/image/upload/v1748068434/pin_5_10_xwmbjz.webp,home-hardware-tips,,https://www.beacleaner.com/how-to-clean-metal-door-handles?utm_source=pinterest&utm_campaign=protect-your-handles,2025-05-24,Don't wait for grime to build up – prevent it! This post focuses on preventative care for metal door handles,helping you keep them looking their best with minimal effort. Learn how to protect your hardware from scratches
DIY Metal Door Handle Cleaner,https://res.cloudinary.com/dbcpfy04c/image/upload/v1748068440/pin_5_11_ot1lva.webp,cleaning-tips,,https://www.beacleaner.com/how-to-clean-metal-door-handles?utm_source=pinterest&utm_campaign=diy-metal-door-handl,2025-05-24,Skip the harsh chemicals! This post shares a recipe for a DIY metal door handle cleaner using ingredients you probably already have at home. It's effective,eco-friendly
The Ultimate Door Handle Cleaning Checklist,https://res.cloudinary.com/dbcpfy04c/image/upload/v1748068446/pin_5_12_zq1esq.webp,cleaning-tips,,https://www.beacleaner.com/how-to-clean-metal-door-handles?utm_source=pinterest&utm_campaign=the-ultimate-door-ha,2025-05-24,Feeling overwhelmed? This checklist breaks down the entire process of cleaning metal door handles into manageable steps. From gathering supplies to polishing the finish,we've got you covered. Follow our checklist for a sparkling clean and organized home. #CleaningChecklist #HomeOrganization #CleaningRoutine #DoorCare
Brass vs. Nickel: Cleaning Differences,https://res.cloudinary.com/dbcpfy04c/image/upload/v1748068453/pin_5_13_zknb06.webp,home-cleaning-tips,,https://www.beacleaner.com/how-to-clean-metal-door-handles?utm_source=pinterest&utm_campaign=brass-vs-nickel-clea,2025-05-24,Confused about how to clean different types of metal door handles? This post clarifies the differences between cleaning brass and nickel,ensuring you use the right methods for each finish. Avoid damage and achieve optimal results with our expert advice. #BrassVsNickel #MetalCleaningTips #DoorHardware #HomeHelp
Polishing Metal Door Handles: Step-by-Step,https://res.cloudinary.com/dbcpfy04c/image/upload/v1748068460/pin_5_14_up8kfy.webp,home-improvement-tips,,https://www.beacleaner.com/how-to-clean-metal-door-handles?utm_source=pinterest&utm_campaign=polishing-metal-door,2025-05-24,Want to achieve a professional-level polish on your metal door handles? This post provides a detailed,step-by-step guide to polishing your hardware to a brilliant shine. Learn the techniques and tools you need for stunning results. #PolishingGuide #MetalShine #HomeImprovement #DIYProjects
Door Handle Cleaning for Allergy Sufferers,https://res.cloudinary.com/dbcpfy04c/image/upload/v1748068466/pin_5_15_psvitd.webp,cleaning-tips,,https://www.beacleaner.com/how-to-clean-metal-door-handles?utm_source=pinterest&utm_campaign=door-handle-cleaning,2025-05-24,If you suffer from allergies,keeping your door handles clean is crucial. This post explains how to remove allergens and dust from your hardware
Cleaning Door Handles with Vinegar,https://res.cloudinary.com/dbcpfy04c/image/upload/v1748068472/pin_5_16_wdcxvw.webp,cleaning-tips,,https://www.beacleaner.com/how-to-clean-metal-door-handles?utm_source=pinterest&utm_campaign=cleaning-door-handle,2025-05-24,Vinegar is a surprisingly effective cleaning agent! This post shows you how to use vinegar to clean metal door handles,removing grime and restoring shine. It's a natural
The Best Cloths for Metal Door Handles,https://res.cloudinary.com/dbcpfy04c/image/upload/v1748068478/pin_5_17_xef3hx.webp,home-cleaning-tips,,https://www.beacleaner.com/how-to-clean-metal-door-handles?utm_source=pinterest&utm_campaign=the-best-cloths-for-,2025-05-24,Using the right cloth is essential for cleaning metal door handles without scratching or damaging the finish. This post recommends the best cloths for different types of metal,ensuring optimal results. #CleaningCloths #MicrofiberCloths #MetalCare #HomeCleaningTools
Cleaning Around Door Handle Mechanisms,https://res.cloudinary.com/dbcpfy04c/image/upload/v1748068484/pin_5_18_obv6xj.webp,cleaning-tips,,https://www.beacleaner.com/how-to-clean-metal-door-handles?utm_source=pinterest&utm_campaign=cleaning-around-door,2025-05-24,Don't forget to clean around the door handle mechanism! This post provides tips for cleaning those hard-to-reach areas,removing dirt and grime that can build up over time. #DoorMechanismCleaning #HardToReachCleaning #DetailedCleaning #HomeCare
Choosing the Right Cleaning Solution,https://res.cloudinary.com/dbcpfy04c/image/upload/v1748068493/pin_5_19_zu5j3l.webp,cleaning-tips,,https://www.beacleaner.com/how-to-clean-metal-door-handles?utm_source=pinterest&utm_campaign=choosing-the-right-c,2025-05-24,Overwhelmed by cleaning product options? This post helps you choose the right cleaning solution for your metal door handles,based on the type of metal and the level of grime. #CleaningSolutionGuide #MetalCleaningProducts #HomeCleaning #CleaningHelp
