Title,Media URL,Pinterest board,Thumbnail,Link,Publish date,Description,Keywords,
Husqvarna Zero Turn Steering Fix,https://res.cloudinary.com/dbcpfy04c/image/upload/v1618237451/placeholder.jpg,home-inspiration,,https://lawntrend.com/husqvarna-riding-mower-steering-problems/?utm_source=pinterest&utm_campaign=husqvarna-zero-turn-,2025-05-16,"Specifically for Husqvarna zero-turn mowers! This post addresses common steering issues unique to zero-turn models. Learn how to diagnose and fix problems with the lap bars, steering linkages",and other key components. Enjoy precise control and maneuverability. #HusqvarnaZeroTurn #ZeroTurnSteering #LapBarRepair #LawnMowing,and other key components. Enjoy precise control and maneuverability. #HusqvarnaZeroTurn #ZeroTurnSteering #LapBarRepair #LawnMowing
Husqvarna Steering: Fluid Levels,https://res.cloudinary.com/dbcpfy04c/image/upload/v1618237451/placeholder.jpg,home-inspiration,,https://lawntrend.com/husqvarna-riding-mower-steering-problems/?utm_source=pinterest&utm_campaign=husqvarna-steering-f,2025-05-16,Maintaining proper fluid levels is crucial for smooth Husqvarna mower steering. This guide explains how to check and top off the hydraulic fluid,ensuring optimal performance. Don't overlook this simple but important maintenance task! #HusqvarnaFluid #HydraulicFluid #MowerMaintenance #LawnCare,ensuring optimal performance. Don't overlook this simple but important maintenance task! #HusqvarnaFluid #HydraulicFluid #MowerMaintenance #LawnCare
Husqvarna Steering: Visual Guide,https://res.cloudinary.com/dbcpfy04c/image/upload/v1618237451/placeholder.jpg,home-inspiration,,https://lawntrend.com/husqvarna-riding-mower-steering-problems/?utm_source=pinterest&utm_campaign=husqvarna-steering-v,2025-05-16,Need a visual aid for diagnosing your Husqvarna mower's steering problems? This post features detailed diagrams and photos to help you identify components and understand how the steering system works. See the problem,fix the problem! #HusqvarnaVisual #MowerDiagram #SteeringIllustration #LawnHelp,fix the problem! #HusqvarnaVisual #MowerDiagram #SteeringIllustration #LawnHelp
Husqvarna Steering: Common Mistakes,https://res.cloudinary.com/dbcpfy04c/image/upload/v1618237451/placeholder.jpg,home-inspiration,,https://lawntrend.com/husqvarna-riding-mower-steering-problems/?utm_source=pinterest&utm_campaign=husqvarna-steering-c,2025-05-16,Avoid these common mistakes when repairing your Husqvarna mower's steering! This post highlights pitfalls to avoid,ensuring a successful repair. Learn from our experience and save yourself time and frustration. #HusqvarnaMistakes #MowerRepairTips #SteeringErrors #LawnSmart,ensuring a successful repair. Learn from our experience and save yourself time and frustration. #HusqvarnaMistakes #MowerRepairTips #SteeringErrors #LawnSmart
Husqvarna Steering: Long-Term Care,https://res.cloudinary.com/dbcpfy04c/image/upload/v1618237451/placeholder.jpg,home-inspiration,,https://lawntrend.com/husqvarna-riding-mower-steering-problems/?utm_source=pinterest&utm_campaign=husqvarna-steering-l,2025-05-16,Keep your Husqvarna mower's steering system in top condition for years to come! This post provides tips for long-term care and maintenance,preventing future problems. Invest in your mower and enjoy a smooth ride for years. #HusqvarnaCare #MowerLongevity #SteeringMaintenance #LawnLife,preventing future problems. Invest in your mower and enjoy a smooth ride for years. #HusqvarnaCare #MowerLongevity #SteeringMaintenance #LawnLife
Husqvarna Steering: When to Call a Pro,https://res.cloudinary.com/dbcpfy04c/image/upload/v1618237451/placeholder.jpg,home-inspiration,,https://lawntrend.com/husqvarna-riding-mower-steering-problems/?utm_source=pinterest&utm_campaign=husqvarna-steering-w,2025-05-16,Sometimes,a DIY repair isn't enough. This post helps you determine when it's time to call a professional for Husqvarna mower steering issues. Don't risk further damage – know when to seek expert help. #HusqvarnaPro #MowerRepairService #SteeringExpert #LawnAdvice,a DIY repair isn't enough. This post helps you determine when it's time to call a professional for Husqvarna mower steering issues. Don't risk further damage – know when to seek expert help. #HusqvarnaPro #MowerRepairService #SteeringExpert #LawnAdvice
Husqvarna Steering: After the Repair,https://res.cloudinary.com/dbcpfy04c/image/upload/v1618237451/placeholder.jpg,home-inspiration,,https://lawntrend.com/husqvarna-riding-mower-steering-problems/?utm_source=pinterest&utm_campaign=husqvarna-steering-a,2025-05-16,You've fixed your Husqvarna mower's steering – now what? This post provides tips for testing and verifying the repair,ensuring everything is working properly. Enjoy the fruits of your labor! #HusqvarnaTest #MowerVerification #SteeringCheck #LawnSuccess,ensuring everything is working properly. Enjoy the fruits of your labor! #HusqvarnaTest #MowerVerification #SteeringCheck #LawnSuccess
Husqvarna,https://res.cloudinary.com/dbcpfy04c/image/upload/v1618237451/placeholder.jpg,home-inspiration,,https://lawntrend.com/husqvarna-riding-mower-steering-problems/?utm_source=pinterest&utm_campaign=husqvarna,2025-05-16,"Riding Mower,Steering",Repair,Repair
Title,https://res.cloudinary.com/dbcpfy04c/image/upload/v1618237451/placeholder.jpg,home-inspiration,,https://lawntrend.com/kohler-lawn-mower-engine-surging/?utm_source=pinterest&utm_campaign=title,2025-05-16,Description,Keywords,Keywords
Kohler Engine Surging? Fix It!,https://res.cloudinary.com/dbcpfy04c/image/upload/v1618237451/placeholder.jpg,home-inspiration,,https://lawntrend.com/kohler-lawn-mower-engine-surging/?utm_source=pinterest&utm_campaign=kohler-engine-surgin,2025-05-16,Is your Kohler lawn mower engine surging,making mowing a frustrating chore? Don't let a rough-running engine ruin your weekend! This guide dives deep into the common causes – from dirty carbs to vacuum leaks – and provides step-by-step solutions you can tackle yourself. Save money on expensive repairs and get back to enjoying a perfectly manicured lawn. Learn how to diagnose and fix surging issues quickly and easily. Click to learn more and reclaim your lawn care peace of mind! #KohlerEngine #LawnMowerRepair #EngineSurging #DIYRepair,making mowing a frustrating chore? Don't let a rough-running engine ruin your weekend! This guide dives deep into the common causes – from dirty carbs to vacuum leaks – and provides step-by-step solutions you can tackle yourself. Save money on expensive repairs and get back to enjoying a perfectly manicured lawn. Learn how to diagnose and fix surging issues quickly and easily. Click to learn more and reclaim your lawn care peace of mind! #KohlerEngine #LawnMowerRepair #EngineSurging #DIYRepair
Fix Kohler Surging - Easy Guide,https://res.cloudinary.com/dbcpfy04c/image/upload/v1618237451/placeholder.jpg,home-inspiration,,https://lawntrend.com/kohler-lawn-mower-engine-surging/?utm_source=pinterest&utm_campaign=fix-kohler-surging-e,2025-05-16,"Don't despair over a surging Kohler engine! This post breaks down the problem into manageable steps, even for beginners. We cover everything from fuel system checks to ignition troubleshooting. Imagine the satisfaction of fixing your mower yourself and avoiding costly mechanic bills.  We'll help you identify the root cause and get your mower running smoothly again.  Stop fighting your lawnmower",start enjoying your yard! Read now for a detailed walkthrough. #KohlerSurge #MowerProblems #SmallEngine #LawnCare,start enjoying your yard! Read now for a detailed walkthrough. #KohlerSurge #MowerProblems #SmallEngine #LawnCare
Kohler Engine Surging? 5 Causes,https://res.cloudinary.com/dbcpfy04c/image/upload/v1618237451/placeholder.jpg,home-inspiration,,https://lawntrend.com/kohler-lawn-mower-engine-surging/?utm_source=pinterest&utm_campaign=kohler-engine-surgin,2025-05-16,A Kohler engine surging is a common headache for homeowners. But what's *causing* it? This pin highlights 5 of the most frequent culprits,from a clogged air filter to a faulty governor. Understanding the problem is the first step to fixing it!  We provide clear explanations and practical solutions. Don't let surging ruin your summer – get the knowledge you need to restore your mower's performance. Click to discover the causes! #KohlerTroubleshooting #EngineIssues #LawnMowerTips #DIY,from a clogged air filter to a faulty governor. Understanding the problem is the first step to fixing it!  We provide clear explanations and practical solutions. Don't let surging ruin your summer – get the knowledge you need to restore your mower's performance. Click to discover the causes! #KohlerTroubleshooting #EngineIssues #LawnMowerTips #DIY
Fuel Filter Fix for Kohler Surge,https://res.cloudinary.com/dbcpfy04c/image/upload/v1618237451/placeholder.jpg,home-inspiration,,https://lawntrend.com/kohler-lawn-mower-engine-surging/?utm_source=pinterest&utm_campaign=fuel-filter-fix-for-,2025-05-16,A clogged fuel filter can starve your Kohler engine,leading to surging. This pin highlights the importance of fuel filter maintenance and provides easy replacement instructions.  A fresh fuel filter is a simple and inexpensive way to improve engine performance.  Don't let a clogged filter ruin your mowing experience! Click to learn more. #FuelFilter #KohlerMaintenance #EnginePerformance #LawnCareTips,leading to surging. This pin highlights the importance of fuel filter maintenance and provides easy replacement instructions.  A fresh fuel filter is a simple and inexpensive way to improve engine performance.  Don't let a clogged filter ruin your mowing experience! Click to learn more. #FuelFilter #KohlerMaintenance #EnginePerformance #LawnCareTips
Kohler Engine Surging: DIY Repair,https://res.cloudinary.com/dbcpfy04c/image/upload/v1618237451/placeholder.jpg,home-inspiration,,https://lawntrend.com/kohler-lawn-mower-engine-surging/?utm_source=pinterest&utm_campaign=kohler-engine-surgin,2025-05-16,Empower yourself with the knowledge to fix a surging Kohler engine! This pin promotes the DIY aspect of the blog post,encouraging readers to tackle the repair themselves.  Save money and gain valuable skills.  We provide clear instructions and helpful visuals.  Don't be intimidated – you can do it! Click to start your repair journey. #DIYLawnMower #KohlerRepair #EngineFix #HomeImprovement,encouraging readers to tackle the repair themselves.  Save money and gain valuable skills.  We provide clear instructions and helpful visuals.  Don't be intimidated – you can do it! Click to start your repair journey. #DIYLawnMower #KohlerRepair #EngineFix #HomeImprovement
Troubleshooting Kohler Engine Surge,https://res.cloudinary.com/dbcpfy04c/image/upload/v1618237451/placeholder.jpg,home-inspiration,,https://lawntrend.com/kohler-lawn-mower-engine-surging/?utm_source=pinterest&utm_campaign=troubleshooting-kohl,2025-05-16,Feeling lost when it comes to a surging Kohler engine? This pin offers a structured troubleshooting approach,guiding you through the diagnostic process.  We help you narrow down the possibilities and identify the root cause.  Don't waste time guessing – get a clear path to resolution. Click to read the full troubleshooting guide! #EngineTroubleshooting #KohlerDiagnosis #LawnMowerHelp #RepairGuide,guiding you through the diagnostic process.  We help you narrow down the possibilities and identify the root cause.  Don't waste time guessing – get a clear path to resolution. Click to read the full troubleshooting guide! #EngineTroubleshooting #KohlerDiagnosis #LawnMowerHelp #RepairGuide
Kohler Engine Surging: Fuel Pump?,https://res.cloudinary.com/dbcpfy04c/image/upload/v1618237451/placeholder.jpg,home-inspiration,,https://lawntrend.com/kohler-lawn-mower-engine-surging/?utm_source=pinterest&utm_campaign=kohler-engine-surgin,2025-05-16,Could a failing fuel pump be the culprit behind your Kohler engine surge? This pin explores the role of the fuel pump and how to test it.  A weak fuel pump can cause inconsistent fuel delivery,leading to surging.  Don't overlook this potential issue. Click to learn how to diagnose it! #KohlerFuelPump #EngineFuel #MowerProblems #RepairTips,leading to surging.  Don't overlook this potential issue. Click to learn how to diagnose it! #KohlerFuelPump #EngineFuel #MowerProblems #RepairTips
Air Filter & Kohler Engine Surge,https://res.cloudinary.com/dbcpfy04c/image/upload/v1618237451/placeholder.jpg,home-inspiration,,https://lawntrend.com/kohler-lawn-mower-engine-surging/?utm_source=pinterest&utm_campaign=air-filter-kohler-en,2025-05-16,A dirty air filter restricts airflow,potentially causing a Kohler engine to surge. This pin emphasizes the importance of regular air filter cleaning or replacement.  A clean air filter improves engine performance and fuel efficiency.  Don't let a dirty filter hold your mower back! Click to learn more. #AirFilter #KohlerMaintenance #EngineCare #LawnMower,potentially causing a Kohler engine to surge. This pin emphasizes the importance of regular air filter cleaning or replacement.  A clean air filter improves engine performance and fuel efficiency.  Don't let a dirty filter hold your mower back! Click to learn more. #AirFilter #KohlerMaintenance #EngineCare #LawnMower
Kohler Engine Surging: Fuel Line Check,https://res.cloudinary.com/dbcpfy04c/image/upload/v1618237451/placeholder.jpg,home-inspiration,,https://lawntrend.com/kohler-lawn-mower-engine-surging/?utm_source=pinterest&utm_campaign=kohler-engine-surgin,2025-05-16,"Check your Kohler engine's fuel lines for kinks, cracks",or blockages. This pin emphasizes the importance of a clear fuel flow.  Restricted fuel flow can cause surging and poor engine performance.  Click to learn how to inspect your fuel lines! #FuelLine #KohlerFuel #EngineFlow #MowerMaintenance,or blockages. This pin emphasizes the importance of a clear fuel flow.  Restricted fuel flow can cause surging and poor engine performance.  Click to learn how to inspect your fuel lines! #FuelLine #KohlerFuel #EngineFlow #MowerMaintenance
