Title,Media URL,Pinterest board,Thumbnail,Link,Publish date,Description,Keywords
Clean PB Jars = Happy Kitchen!,https://res.cloudinary.com/dbcpfy04c/image/upload/v1747931383/pin_3_16_xalhgs.webp,kitchen-cleaning-tips,,https://www.beacleaner.com/how-to-clean-a-peanut-butter-jar?utm_source=pinterest&utm_campaign=clean-pb-jars-happy-,2025-05-22,"A clean kitchen is a happy kitchen, and that starts with clean peanut butter jars! This guide shows you how to easily clean your jars and maintain a sparkling kitchen.  Don't let a little peanut butter stand in the way of your happiness. Click to learn more!","Happy Kitchen,Cleaning,Peanut Butter,Kitchen Motivation"
Easy Jar Cleaning for Peanut Butter Lovers,https://res.cloudinary.com/dbcpfy04c/image/upload/v1747931389/pin_3_17_xo3czp.webp,cleaning-tips,,https://www.beacleaner.com/how-to-clean-a-peanut-butter-jar?utm_source=pinterest&utm_campaign=easy-jar-cleaning-fo,2025-05-22,"If you love peanut butter, you NEED to know this! This guide provides a simple, effective method for cleaning peanut butter jars without the hassle.  Enjoy your peanut butter guilt-free, knowing that cleanup will be a breeze. Click to learn more!","Peanut Butter Lovers,Cleaning,Jar Cleaning,Easy Method"
Goodbye Sticky Mess! Hello Clean Jars!,https://res.cloudinary.com/dbcpfy04c/image/upload/v1747931395/pin_3_18_ef3cap.webp,kitchen-cleaning-tips,,https://www.beacleaner.com/how-to-clean-a-peanut-butter-jar?utm_source=pinterest&utm_campaign=goodbye-sticky-mess-,2025-05-22,"Finally, a solution for those dreaded sticky peanut butter jars! This guide shows you how to easily clean them and reclaim your kitchen.  Say goodbye to frustration and hello to a sparkling clean space. Click to learn more!","Sticky Mess,Cleaning,Peanut Butter,Kitchen Cleaning"
Peanut Butter Jar Cleaning: Before & After,https://res.cloudinary.com/dbcpfy04c/image/upload/v1747931401/pin_3_19_cioogx.webp,cleaning-tips,,https://www.beacleaner.com/how-to-clean-a-peanut-butter-jar?utm_source=pinterest&utm_campaign=peanut-butter-jar-cl,2025-05-22,See the amazing transformation! This guide shows you the before and after of cleaning a peanut butter jar with our simple method.  You won't believe how easy it is to achieve a sparkling clean result. Click to learn more!,"Before And After,Cleaning,Peanut Butter,Jar Transformation"
Save Time & Effort: PB Jar Cleaning,https://res.cloudinary.com/dbcpfy04c/image/upload/v1747931406/pin_3_20_r18he7.webp,cleaning-tips,,https://www.beacleaner.com/how-to-clean-a-peanut-butter-jar?utm_source=pinterest&utm_campaign=save-time-effort-pb-,2025-05-22,Don't waste your precious time scrubbing peanut butter jars! This guide provides a quick and easy method for cleaning them with minimal effort.  Get back to doing the things you love. Click to learn more!,"Time Saving,Cleaning,Peanut Butter,Easy Cleaning"
Peanut Butter Jar Cleaning: The Natural Way,https://res.cloudinary.com/dbcpfy04c/image/upload/v1747931415/pin_3_21_kpgxbs.webp,cleaning-tips,,https://www.beacleaner.com/how-to-clean-a-peanut-butter-jar?utm_source=pinterest&utm_campaign=peanut-butter-jar-cl,2025-05-22,"Looking for a natural way to clean your peanut butter jars? This guide uses simple, eco-friendly ingredients to achieve a sparkling clean result.  Protect your health and the environment. Click to learn more!","Natural Cleaning,Peanut Butter,Jar Cleaning,Eco Friendly"
Reclaim Your Jars: PB Cleaning Guide,https://res.cloudinary.com/dbcpfy04c/image/upload/v1747931422/pin_3_22_poef4v.webp,jar-cleaning-tips,,https://www.beacleaner.com/how-to-clean-a-peanut-butter-jar?utm_source=pinterest&utm_campaign=reclaim-your-jars-pb,2025-05-22,"Don't let sticky peanut butter ruin your jars! This guide shows you how to reclaim them and repurpose them for storage, crafts, or anything else you can imagine.  Get organized and reduce waste. Click to learn more!","Reclaim Jars,Cleaning,Peanut Butter,Jar Repurposing"
Peanut Butter Jar Cleaning: No Scratches!,https://res.cloudinary.com/dbcpfy04c/image/upload/v1747931427/pin_3_23_uoks5t.webp,cleaning-tips,,https://www.beacleaner.com/how-to-clean-a-peanut-butter-jar?utm_source=pinterest&utm_campaign=peanut-butter-jar-cl,2025-05-22,Worried about scratching your jars while cleaning? This guide provides a gentle yet effective method for cleaning peanut butter jars without damaging the glass.  Keep your jars looking their best. Click to learn more!,"No Scratches,Cleaning,Peanut Butter,Gentle Cleaning"
The Lazy Person's Guide to PB Jar Cleaning,https://res.cloudinary.com/dbcpfy04c/image/upload/v1747931434/pin_3_24_cwjjud.webp,cleaning-tips,,https://www.beacleaner.com/how-to-clean-a-peanut-butter-jar?utm_source=pinterest&utm_campaign=the-lazy-persons-gui,2025-05-22,"Let's be real, nobody *loves* cleaning. This guide is for all the lazy people out there who want a quick and easy way to clean their peanut butter jars.  Minimal effort, maximum results. Click to learn more!","Lazy Cleaning,Peanut Butter,Jar Cleaning,Easy Hack"
Peanut Butter Jar Cleaning: For a Sparkling Kitchen,https://res.cloudinary.com/dbcpfy04c/image/upload/v1747931442/pin_3_25_wj6olv.webp,cleaning-tips,,https://www.beacleaner.com/how-to-clean-a-peanut-butter-jar?utm_source=pinterest&utm_campaign=peanut-butter-jar-cl,2025-05-22,Dreaming of a sparkling kitchen? It all starts with clean peanut butter jars! This guide shows you how to easily clean your jars and create a more inviting space.  You deserve a clean and organized kitchen. Click to learn more!,"Sparkling Kitchen,Cleaning,Peanut Butter,Kitchen Goals"
Stop Scrubbing! Clean PB Jars Easily,https://res.cloudinary.com/dbcpfy04c/image/upload/v1747931448/pin_3_26_p7flul.webp,cleaning-tips,,https://www.beacleaner.com/how-to-clean-a-peanut-butter-jar?utm_source=pinterest&utm_campaign=stop-scrubbing-clean,2025-05-22,Are you tired of endlessly scrubbing peanut butter jars? This guide provides a simple solution that will save you time and effort.  Say goodbye to frustration and hello to a clean kitchen. Click to learn more!,"Stop Scrubbing,Cleaning,Peanut Butter,Easy Solution"
Title,https://res.cloudinary.com/dbcpfy04c/image/upload/v1747931507/pin_4_1_jpz74v.webp,please-provide-the-title-and-keywords-i-need-that-information-to-suggest-a-board-name-once,,https://www.beacleaner.com/how-to-clean-baseboards-with-fabric-softener?utm_source=pinterest&utm_campaign=title,2025-05-22,Description,Keywords
Sparkling Baseboards: Fabric Softener Hack!,https://res.cloudinary.com/dbcpfy04c/image/upload/v1747931513/pin_4_2_i8s3bv.webp,cleaning-tips,,https://www.beacleaner.com/how-to-clean-baseboards-with-fabric-softener?utm_source=pinterest&utm_campaign=sparkling-baseboards,2025-05-22,"Tired of grimy baseboards ruining your clean home? This simple trick uses fabric softener to lift dirt and grime effortlessly! No more scrubbing for hours – just a quick wipe and you'll be amazed at the results.  Imagine a home that *feels* truly clean, from floor to ceiling.  This method is gentle on paint, safe for most surfaces, and leaves a subtle, fresh scent.  Click to learn how to achieve spotless baseboards with minimal effort and maximum shine! Don't let dirty baseboards stress you out any longer.  Get your sparkle on! #BaseboardCleaning #CleaningHacks #FabricSoftener #HomeCleaning",Baseboard Cleaning
Baseboards Done FAST! (Fabric Softener),https://res.cloudinary.com/dbcpfy04c/image/upload/v1747931519/pin_4_3_ykxtka.webp,home-hacks-tips,,https://www.beacleaner.com/how-to-clean-baseboards-with-fabric-softener?utm_source=pinterest&utm_campaign=baseboards-done-fast,2025-05-22,Wish you could spend less time cleaning and more time enjoying your beautiful home? This fabric softener baseboard cleaning hack is a game-changer! It's unbelievably easy,requires minimal supplies
Dirty Baseboards? This Will Blow Your Mind!,https://res.cloudinary.com/dbcpfy04c/image/upload/v1747931526/pin_4_4_duq1gi.webp,cleaning-tips,,https://www.beacleaner.com/how-to-clean-baseboards-with-fabric-softener?utm_source=pinterest&utm_campaign=dirty-baseboards-thi,2025-05-22,Don't underestimate the power of fabric softener! This isn't just for laundry – it's a cleaning superhero for your baseboards.  This method cuts through grease,dust
The Secret to Spotless Baseboards Revealed,https://res.cloudinary.com/dbcpfy04c/image/upload/v1747931532/pin_4_5_qys7jh.webp,kitchen-cleaning-tips,,https://www.beacleaner.com/how-to-clean-baseboards-with-fabric-softener?utm_source=pinterest&utm_campaign=the-secret-to-spotle,2025-05-22,Are your baseboards a cleaning afterthought? They shouldn't be! Dirty baseboards can make your entire home look neglected.  This fabric softener method is the solution you've been waiting for. It's quick,effective
Baseboard Cleaning: No More Scrubbing!,https://res.cloudinary.com/dbcpfy04c/image/upload/v1747931538/pin_4_6_gdthuv.webp,cleaning-tips,,https://www.beacleaner.com/how-to-clean-baseboards-with-fabric-softener?utm_source=pinterest&utm_campaign=baseboard-cleaning-n,2025-05-22,Say goodbye to aching knees and endless scrubbing! This fabric softener hack makes cleaning baseboards a breeze. It's gentle yet powerful,"lifting dirt and grime without damaging your paint.  We'll show you how to create the perfect cleaning solution and achieve professional results in minutes.  Click to learn how to simplify your cleaning routine and enjoy a sparkling clean home.  You'll wonder why you didn't try this sooner! #QuickCleaning #BaseboardMagic #CleaningRoutine #HomeTips"""
Fabric Softener: Your New Cleaning BFF,https://res.cloudinary.com/dbcpfy04c/image/upload/v1747931544/pin_4_7_ppdj4r.webp,cleaning-tips,,https://www.beacleaner.com/how-to-clean-baseboards-with-fabric-softener?utm_source=pinterest&utm_campaign=fabric-softener-your,2025-05-22,Who knew fabric softener could do *this*? This amazing hack transforms your baseboards from drab to fab in minutes! It's a simple,affordable
From Grime to Shine: Baseboard Transformation,https://res.cloudinary.com/dbcpfy04c/image/upload/v1747931552/pin_4_8_wkxwcp.webp,home-cleaning-tips,,https://www.beacleaner.com/how-to-clean-baseboards-with-fabric-softener?utm_source=pinterest&utm_campaign=from-grime-to-shine-,2025-05-22,Witness the incredible transformation! This before-and-after will inspire you to tackle those neglected baseboards.  Our fabric softener method is the key to achieving a sparkling clean home without the elbow grease.  We'll guide you through each step,"ensuring a flawless finish.  Click to learn how to revive your baseboards and create a welcoming atmosphere.  You'll be amazed at the difference! #HomeMakeover #BaseboardGoals #CleaningTransformation #DIYHome"""
Baseboard Cleaning That Actually Works!,https://res.cloudinary.com/dbcpfy04c/image/upload/v1747931557/pin_4_9_zkwvjd.webp,cleaning-tips,,https://www.beacleaner.com/how-to-clean-baseboards-with-fabric-softener?utm_source=pinterest&utm_campaign=baseboard-cleaning-t,2025-05-22,Stop wasting time with ineffective cleaning methods! This fabric softener hack is a proven winner. It cuts through grime,dust
The Lazy Person's Guide to Clean Baseboards,https://res.cloudinary.com/dbcpfy04c/image/upload/v1747931563/pin_4_10_sxi30i.webp,cleaning-tips,,https://www.beacleaner.com/how-to-clean-baseboards-with-fabric-softener?utm_source=pinterest&utm_campaign=the-lazy-persons-gui,2025-05-22,Let's be honest,cleaning baseboards isn't fun. But it doesn't have to be a chore! This fabric softener hack makes it incredibly easy and quick.  You'll be amazed at how little effort it takes to achieve a sparkling clean home.  We'll show you all the steps
Baseboards: The Forgotten Cleaning Step,https://res.cloudinary.com/dbcpfy04c/image/upload/v1747931569/pin_4_11_kxo6zq.webp,cleaning-tips,,https://www.beacleaner.com/how-to-clean-baseboards-with-fabric-softener?utm_source=pinterest&utm_campaign=baseboards-the-forgo,2025-05-22,Don't overlook your baseboards! They play a crucial role in the overall cleanliness of your home. This fabric softener hack makes cleaning them a breeze. It's gentle on paint,safe for most surfaces
Fabric Softener: A Cleaning Game Changer,https://res.cloudinary.com/dbcpfy04c/image/upload/v1747931574/pin_4_12_keoewg.webp,cleaning-tips,,https://www.beacleaner.com/how-to-clean-baseboards-with-fabric-softener?utm_source=pinterest&utm_campaign=fabric-softener-a-cl,2025-05-22,Unlock the hidden cleaning power of fabric softener! This hack is perfect for baseboards,but it can also be used on other surfaces.  It's a versatile
Baseboard Cleaning: Before & After Magic!,https://res.cloudinary.com/dbcpfy04c/image/upload/v1747931580/pin_4_13_oli7tk.webp,cleaning-tips,,https://www.beacleaner.com/how-to-clean-baseboards-with-fabric-softener?utm_source=pinterest&utm_campaign=baseboard-cleaning-b,2025-05-22,See the incredible difference! This before-and-after photo will inspire you to tackle those dirty baseboards.  Our fabric softener method is the key to achieving a sparkling clean home without the backache.  We'll guide you through each step,"ensuring a flawless finish.  Click to learn how to revive your baseboards and create a welcoming atmosphere. #CleaningResults #BaseboardTransformation #HomeCleaningHacks #CleanHomeHappyHome"""
Stop Scrubbing! Fabric Softener to the Rescue,https://res.cloudinary.com/dbcpfy04c/image/upload/v1747931588/pin_4_14_gdeywd.webp,cleaning-tips,,https://www.beacleaner.com/how-to-clean-baseboards-with-fabric-softener?utm_source=pinterest&utm_campaign=stop-scrubbing-fabri,2025-05-22,Are you tired of spending hours scrubbing your baseboards? This fabric softener hack is the solution you've been waiting for! It's quick,easy
The Easiest Way to Clean Baseboards EVER!,https://res.cloudinary.com/dbcpfy04c/image/upload/v1747931594/pin_4_15_spkpp5.webp,cleaning-tips,,https://www.beacleaner.com/how-to-clean-baseboards-with-fabric-softener?utm_source=pinterest&utm_campaign=the-easiest-way-to-c,2025-05-22,Seriously,"this is the easiest way to clean baseboards you'll ever find! This fabric softener hack requires minimal effort and delivers amazing results.  We'll show you how to tackle even the toughest grime with just a few simple steps.  Click to learn how to simplify your cleaning routine and enjoy a sparkling clean home.  You'll be amazed at how easy it is! #EasyHomeCleaning #BaseboardHack #CleaningForBeginners #HomeCleaning101"""
Baseboard Cleaning: A Fresh Scent Bonus!,https://res.cloudinary.com/dbcpfy04c/image/upload/v1747931600/pin_4_16_ozwufs.webp,cleaning-tips,,https://www.beacleaner.com/how-to-clean-baseboards-with-fabric-softener?utm_source=pinterest&utm_campaign=baseboard-cleaning-a,2025-05-22,Not only does this fabric softener hack clean your baseboards,but it also leaves a lovely
Revive Your Home: Clean Baseboards Now!,https://res.cloudinary.com/dbcpfy04c/image/upload/v1747931606/pin_4_17_zvtvww.webp,cleaning-tips,,https://www.beacleaner.com/how-to-clean-baseboards-with-fabric-softener?utm_source=pinterest&utm_campaign=revive-your-home-cle,2025-05-22,Dirty baseboards can drag down the entire look of your home.  Revive your space with this simple fabric softener hack! It's quick,effective
Fabric Softener: The Unexpected Cleaner,https://res.cloudinary.com/dbcpfy04c/image/upload/v1747931613/pin_4_18_wznnhi.webp,cleaning-tips,,https://www.beacleaner.com/how-to-clean-baseboards-with-fabric-softener?utm_source=pinterest&utm_campaign=fabric-softener-the-,2025-05-22,You'll never look at fabric softener the same way again! This unexpected cleaning hack is a game-changer for your baseboards. It's gentle yet powerful,"lifting dirt and grime without damaging your paint.  We'll show you how to create the perfect cleaning solution and achieve professional results.  Click to learn how to simplify your cleaning routine. #UnexpectedCleaning #BaseboardHacks #CleaningTips #HomeHacks"""
Baseboard Cleaning: Save Time & Effort!,https://res.cloudinary.com/dbcpfy04c/image/upload/v1747931618/pin_4_19_xv5rsj.webp,cleaning-tips,,https://www.beacleaner.com/how-to-clean-baseboards-with-fabric-softener?utm_source=pinterest&utm_campaign=baseboard-cleaning-s,2025-05-22,Time is precious! Don't waste it scrubbing your baseboards. This fabric softener hack is the ultimate time-saver. It's quick,easy
Sparkling Baseboards: A Weekend Must-Do!,https://res.cloudinary.com/dbcpfy04c/image/upload/v1747931624/pin_4_20_yvyvm8.webp,cleaning-tips,,https://www.beacleaner.com/how-to-clean-baseboards-with-fabric-softener?utm_source=pinterest&utm_campaign=sparkling-baseboards,2025-05-22,Make cleaning baseboards a quick and easy part of your weekend routine! This fabric softener hack will have them sparkling in minutes.  It's a simple,affordable
The Ultimate Baseboard Cleaning Guide,https://res.cloudinary.com/dbcpfy04c/image/upload/v1747931631/pin_4_21_pazwwh.webp,cleaning-tips,,https://www.beacleaner.com/how-to-clean-baseboards-with-fabric-softener?utm_source=pinterest&utm_campaign=the-ultimate-baseboa,2025-05-22,Everything you need to know about cleaning your baseboards is right here! This guide features our amazing fabric softener hack,"plus tips for different types of baseboards and grime.  We'll show you how to achieve professional results with minimal effort.  Click to learn how to make your baseboards shine. #CleaningGuide #BaseboardCleaning #HomeCleaningTips #DIYCleaning"""
Baseboards: Don't Forget These!,https://res.cloudinary.com/dbcpfy04c/image/upload/v1747931637/pin_4_22_ozr3oo.webp,cleaning-tips,,https://www.beacleaner.com/how-to-clean-baseboards-with-fabric-softener?utm_source=pinterest&utm_campaign=baseboards-dont-forg,2025-05-22,Often overlooked,baseboards can make a big impact on the overall cleanliness of your home.  This fabric softener hack makes cleaning them a breeze! It's gentle on paint
Fabric Softener: Your Secret Weapon!,https://res.cloudinary.com/dbcpfy04c/image/upload/v1747931642/pin_4_23_wvtxum.webp,cleaning-tips,,https://www.beacleaner.com/how-to-clean-baseboards-with-fabric-softener?utm_source=pinterest&utm_campaign=fabric-softener-your,2025-05-22,Keep this cleaning hack up your sleeve! Fabric softener is your secret weapon for sparkling clean baseboards. It's a simple,affordable
Baseboard Cleaning: From Dirty to Dreamy!,https://res.cloudinary.com/dbcpfy04c/image/upload/v1747931649/pin_4_24_xkuqfy.webp,cleaning-tips,,https://www.beacleaner.com/how-to-clean-baseboards-with-fabric-softener?utm_source=pinterest&utm_campaign=baseboard-cleaning-f,2025-05-22,Transform your baseboards from dirty to dreamy with this fabric softener hack! It's a quick,easy
Baseboard Cleaning: A Simple Solution,https://res.cloudinary.com/dbcpfy04c/image/upload/v1747931655/pin_4_25_sl7t3w.webp,cleaning-tips,,https://www.beacleaner.com/how-to-clean-baseboards-with-fabric-softener?utm_source=pinterest&utm_campaign=baseboard-cleaning-a,2025-05-22,Looking for a simple solution to dirty baseboards? Look no further! This fabric softener hack is the answer. It's quick,easy
Title,https://res.cloudinary.com/dbcpfy04c/image/upload/v1747931706/pin_5_1_iboodb.webp,please-provide-the-title-and-keywords-i-need-that-information-to-suggest-a-board-name-once,,https://www.beacleaner.com/how-to-clean-beard-roller?utm_source=pinterest&utm_campaign=title,2025-05-22,Description,Keywords
Beard Roller Cleaning: A MUST!,https://res.cloudinary.com/dbcpfy04c/image/upload/v1747931713/pin_5_2_bmorya.webp,beard-care-tips,,https://www.beacleaner.com/how-to-clean-beard-roller?utm_source=pinterest&utm_campaign=beard-roller-cleanin,2025-05-22,"Is your beard roller looking a little…gross? Don't risk infection! This guide shows you exactly how to clean your beard roller safely and effectively, extending its life and keeping your skin healthy. We cover everything from disinfecting to proper drying. A clean beard roller = a happy beard & face! Don't let bacteria ruin your beard gains. Click to learn the simple steps and keep your grooming game strong! You deserve a healthy, thriving beard.","Beard roller, beard care, men's grooming, beard health #BeardRollerCleaning #BeardCareRoutine"
Dirty Beard Roller? STOP Using It!,https://res.cloudinary.com/dbcpfy04c/image/upload/v1747931720/pin_5_3_vp7icz.webp,beard-grooming-tips,,https://www.beacleaner.com/how-to-clean-beard-roller?utm_source=pinterest&utm_campaign=dirty-beard-roller-s,2025-05-22,"You wouldn't use a dirty toothbrush, would you? The same applies to your beard roller! This post reveals the shocking truth about bacteria buildup and why cleaning is non-negotiable. We break down the process into easy-to-follow steps, ensuring a hygienic experience every time. Protect your skin from irritation and breakouts. Learn how to properly sanitize and store your roller for optimal results. Your beard will thank you!","Beard hygiene, skincare, men's health, beard grooming #CleanBeardRoller #BeardHealth"
Extend Your Beard Roller's Life!,https://res.cloudinary.com/dbcpfy04c/image/upload/v1747931726/pin_5_4_cnhtbs.webp,beard-care-tips,,https://www.beacleaner.com/how-to-clean-beard-roller?utm_source=pinterest&utm_campaign=extend-your-beard-ro,2025-05-22,Don't throw away your investment! Learn how to properly clean and maintain your beard roller to maximize its lifespan. This guide provides a detailed cleaning routine that will keep your roller in top condition for months to come. Save money and get the most out of your beard growth tool. We'll show you the best disinfectants and drying techniques. A little care goes a long way! Click to learn more and keep your beard game strong.,"Beard roller care, beard growth, grooming tools, skincare routine #BeardRollerMaintenance #BeardGrowthTips"
Beard Roller Cleaning: Step-by-Step,https://res.cloudinary.com/dbcpfy04c/image/upload/v1747931733/pin_5_5_xq7bxz.webp,beard-care-tips,,https://www.beacleaner.com/how-to-clean-beard-roller?utm_source=pinterest&utm_campaign=beard-roller-cleanin,2025-05-22,"Confused about how to clean your beard roller? We've got you covered! This step-by-step guide makes the process simple and stress-free. From rinsing to disinfecting, we'll walk you through each stage.  Say goodbye to bacteria and hello to a healthier beard.  Don't let a dirty roller hinder your beard goals.  Click now for a clear, concise cleaning tutorial! Your beard deserves the best.","Beard roller tutorial, cleaning guide, men's skincare, beard grooming #BeardRollerGuide #SkincareTips"
Prevent Breakouts with a Clean Roller,https://res.cloudinary.com/dbcpfy04c/image/upload/v1747931740/pin_5_6_itol1l.webp,skincare-tips,,https://www.beacleaner.com/how-to-clean-beard-roller?utm_source=pinterest&utm_campaign=prevent-breakouts-wi,2025-05-22,"Are you experiencing breakouts after using your beard roller? A dirty roller could be the culprit! This post explains how bacteria can cause skin irritation and how to prevent it with regular cleaning.  Protect your skin and enjoy a smoother, healthier complexion.  We'll show you how to disinfect effectively and avoid common mistakes.  Don't risk your skin's health – learn to clean your beard roller today!","Beard roller acne, skincare, men's health, beard care #BeardRollerAcne #HealthySkin"
The Ultimate Beard Roller Disinfecting Guide,https://res.cloudinary.com/dbcpfy04c/image/upload/v1747931747/pin_5_7_mwe6aw.webp,mens-grooming-tips,,https://www.beacleaner.com/how-to-clean-beard-roller?utm_source=pinterest&utm_campaign=the-ultimate-beard-r,2025-05-22,"Disinfecting your beard roller is crucial for preventing infection. This guide details the best disinfectants to use and how to apply them safely and effectively.  We cover alcohol-based solutions, sterilizing sprays, and more.  Ensure a hygienic grooming experience every time.  Don't compromise on cleanliness – your skin will thank you! Click to learn the best disinfecting practices.","Beard roller disinfection, hygiene, skincare, men's grooming #BeardRollerDisinfection #BeardHygiene"
Is Your Beard Roller Harboring Bacteria?,https://res.cloudinary.com/dbcpfy04c/image/upload/v1747931754/pin_5_8_l7msu6.webp,mens-grooming-tips,,https://www.beacleaner.com/how-to-clean-beard-roller?utm_source=pinterest&utm_campaign=is-your-beard-roller,2025-05-22,"You can't see it, but it's there! This post reveals the hidden dangers of using a dirty beard roller. Learn about the types of bacteria that can thrive on your roller and the potential consequences for your skin.  Protect yourself from infection and irritation.  We'll show you how to clean your roller thoroughly and maintain a healthy grooming routine.  Don't take the risk – learn to clean your roller now!","Bacteria, beard roller, skincare, men's health #BeardRollerBacteria #SkinInfection"
Quick & Easy Beard Roller Cleaning,https://res.cloudinary.com/dbcpfy04c/image/upload/v1747931760/pin_5_9_laypof.webp,mens-grooming-tips,,https://www.beacleaner.com/how-to-clean-beard-roller?utm_source=pinterest&utm_campaign=quick-easy-beard-rol,2025-05-22,Short on time? No problem! This post provides a quick and easy beard roller cleaning routine that fits into your busy schedule.  We'll show you how to disinfect your roller in minutes without sacrificing effectiveness.  Maintain a hygienic grooming routine even when you're on the go.  Don't let a busy lifestyle compromise your skin's health. Click to learn the quick cleaning method!,"Quick cleaning, beard roller, men's grooming, skincare #QuickBeardRollerClean #EasySkincare"
