Title,Media URL,Pinterest board,Thumbnail,Link,Publish date,Description,Keywords
Title,https://res.cloudinary.com/dbcpfy04c/image/upload/v1748402120/pin_1_1_u5k17o.webp,please-provide-the-title-and-keywords-i-need-that-information-to-suggest-a-board-name-once,,https://www.beacleaner.com/how-to-clean-grease-off-metal?utm_source=pinterest&utm_campaign=title,2025-05-28,Description,Keywords
Bye Bye Grease! ✨,https://res.cloudinary.com/dbcpfy04c/image/upload/v1748402127/pin_1_2_afgroy.webp,kitchen-cleaning-tips,,https://www.beacleaner.com/how-to-clean-grease-off-metal?utm_source=pinterest&utm_campaign=bye-bye-grease,2025-05-28,"Is stubborn grease ruining your favorite metal cookware or appliances? Don't replace it, restore it! This guide reveals the *easiest* ways to clean grease off metal, from baking soda paste to vinegar power. Learn how to safely tackle different metal types (stainless steel, cast iron, aluminum & more!) and get sparkling results. Imagine enjoying cooking again without the stress of a greasy kitchen! Click to learn the secrets to a grease-free life. ➡️","Grease removal,Metal cleaning,Kitchen hacks,Cleaning tips #GreaseCleaning #MetalPolish #KitchenCleaning #HomeHacks"
Sparkling Metal: Grease Gone!,https://res.cloudinary.com/dbcpfy04c/image/upload/v1748402134/pin_1_3_qtgd9i.webp,cleaning-tips,,https://www.beacleaner.com/how-to-clean-grease-off-metal?utm_source=pinterest&utm_campaign=sparkling-metal-grea,2025-05-28,"Ugh, grease buildup is the WORST! But don't despair! This post breaks down exactly how to clean grease off metal surfaces, saving you time, money, and frustration. We cover everything from gentle daily cleaning to tackling seriously baked-on grime. Discover the best cleaning solutions you probably already have in your pantry! Get your metal shining like new – you deserve it! ✨ Click to read now!","Metal restoration,Cleaning solutions,DIY cleaning,Stainless steel #GreaseRemover #MetalCare #CleaningMotivation #HomeTips"
Cast Iron Rescue: Grease Be Gone!,https://res.cloudinary.com/dbcpfy04c/image/upload/v1748402141/pin_1_4_p272kw.webp,cast-iron-tips,,https://www.beacleaner.com/how-to-clean-grease-off-metal?utm_source=pinterest&utm_campaign=cast-iron-rescue-gre,2025-05-28,"Love your cast iron skillet but dread the grease? This guide is your new best friend! Learn the *right* way to clean grease off cast iron without ruining the seasoning. We share step-by-step instructions and pro tips for maintaining a perfectly seasoned, non-stick surface.  Protect your investment and keep cooking delicious meals for years to come! Click to learn more! 🍳","Cast iron cleaning,Seasoning cast iron,Grease removal,Skillet care #CastIronCare #CastIronCleaning #CookingTips #KitchenEssentials"
Stainless Steel Shine: Easy Grease Removal,https://res.cloudinary.com/dbcpfy04c/image/upload/v1748402149/pin_1_5_j9anh8.webp,kitchen-cleaning-tips,,https://www.beacleaner.com/how-to-clean-grease-off-metal?utm_source=pinterest&utm_campaign=stainless-steel-shin,2025-05-28,"Is your stainless steel covered in greasy fingerprints? 😩  This post shows you how to clean grease off metal – specifically stainless steel – with simple, effective methods.  We'll help you achieve a streak-free shine that will make your kitchen look brand new.  Stop scrubbing endlessly and start enjoying a sparkling clean home! Click for the full guide! ✨","Stainless steel,Grease removal,Kitchen appliances,Cleaning hacks #StainlessSteelCleaning #KitchenShine #CleaningHacks #HomeMaintenance"
Aluminum Rescue: Grease Cleaning Guide,https://res.cloudinary.com/dbcpfy04c/image/upload/v1748402156/pin_1_6_vbugna.webp,kitchen-cleaning-tips,,https://www.beacleaner.com/how-to-clean-grease-off-metal?utm_source=pinterest&utm_campaign=aluminum-rescue-grea,2025-05-28,"Don't throw away your aluminum pots and pans! This guide reveals how to clean grease off metal aluminum surfaces, restoring them to their former glory.  We cover gentle cleaning methods and solutions for tougher grease buildup.  Save money and reduce waste by giving your aluminum cookware a new lease on life! Click to learn how! ♻️","Aluminum cleaning,Grease removal,Pot and pan cleaning,DIY solutions #AluminumCleaning #GreaseFree #KitchenRescue #EcoCleaning"
Grease-Free Kitchen: Your Quick Guide,https://res.cloudinary.com/dbcpfy04c/image/upload/v1748402163/pin_1_7_j3a0tf.webp,kitchen-cleaning-tips,,https://www.beacleaner.com/how-to-clean-grease-off-metal?utm_source=pinterest&utm_campaign=grease-free-kitchen-,2025-05-28,"Dreaming of a spotless kitchen? It starts with tackling grease! This post provides a quick and easy guide on how to clean grease off metal surfaces throughout your kitchen. From stovetops to range hoods, we've got you covered.  Reclaim your kitchen and enjoy cooking in a clean, inviting space! Click to read now! 🍽️","Kitchen cleaning,Grease removal,Metal surfaces,Cleaning routine #KitchenGoals #CleanKitchen #GreaseBuster #HomeCleaning"
DIY Grease Cleaner: Save Money!,https://res.cloudinary.com/dbcpfy04c/image/upload/v1748402171/pin_1_8_fkdpjq.webp,cleaning-tips,,https://www.beacleaner.com/how-to-clean-grease-off-metal?utm_source=pinterest&utm_campaign=diy-grease-cleaner-s,2025-05-28,"Skip the expensive cleaners! This post shows you how to clean grease off metal using simple, affordable ingredients you likely already have at home.  We share DIY recipes and step-by-step instructions for a powerful, eco-friendly clean.  Save money and protect your family with these natural cleaning solutions! Click to learn more! 🌿","DIY cleaner,Grease removal,Natural cleaning,Eco-friendly #DIYCleaning #NaturalCleaning #GreaseRemover #EcoFriendlyLiving"
Baking Soda Magic: Grease Removal,https://res.cloudinary.com/dbcpfy04c/image/upload/v1748402178/pin_1_9_b64pjs.webp,cleaning-tips,,https://www.beacleaner.com/how-to-clean-grease-off-metal?utm_source=pinterest&utm_campaign=baking-soda-magic-gr,2025-05-28,"Baking soda isn't just for baking! Discover how to harness its power to clean grease off metal surfaces. This post details how to create a baking soda paste for effective grease removal, leaving your metal sparkling clean. It's a safe, gentle, and affordable cleaning solution! Click to learn the magic! ✨","Baking soda,Grease removal,Cleaning paste,DIY cleaning #BakingSodaCleaning #GreaseBuster #DIYHome #CleaningTips"
Vinegar Power: Clean Grease Off Metal,https://res.cloudinary.com/dbcpfy04c/image/upload/v1748402186/pin_1_10_kmn2ts.webp,cleaning-tips,,https://www.beacleaner.com/how-to-clean-grease-off-metal?utm_source=pinterest&utm_campaign=vinegar-power-clean-,2025-05-28,"Vinegar is a cleaning powerhouse! Learn how to use vinegar to effectively clean grease off metal, from stainless steel to aluminum. This post provides step-by-step instructions and safety tips for using vinegar as a natural cleaning agent.  Get a sparkling clean without harsh chemicals! Click to read now! 🍋","Vinegar cleaning,Grease removal,Natural cleaner,DIY solutions #VinegarCleaning #NaturalCleaning #GreaseRemover #HomeHacks"
Grease on Appliances? We've Got You!,https://res.cloudinary.com/dbcpfy04c/image/upload/v1748402193/pin_1_11_z6g7aw.webp,kitchen-cleaning-tips,,https://www.beacleaner.com/how-to-clean-grease-off-metal?utm_source=pinterest&utm_campaign=grease-on-appliances,2025-05-28,"Is grease making your appliances look dingy? This post focuses on how to clean grease off metal appliance surfaces, restoring their shine and functionality. We cover everything from stovetops to refrigerators.  Keep your appliances looking their best and extend their lifespan! Click to learn more! 💡","Appliance cleaning,Grease removal,Metal surfaces,Kitchen appliances #ApplianceCleaning #KitchenCare #GreaseFree #HomeMaintenance"
The Ultimate Grease Removal Checklist,https://res.cloudinary.com/dbcpfy04c/image/upload/v1748402202/pin_1_12_gwd9di.webp,cleaning-tips,,https://www.beacleaner.com/how-to-clean-grease-off-metal?utm_source=pinterest&utm_campaign=the-ultimate-grease-,2025-05-28,"Feeling overwhelmed by grease? This post provides a comprehensive checklist for cleaning grease off metal surfaces throughout your home. From kitchen to garage, we've got you covered.  Take control of the mess and enjoy a sparkling clean space! Click to get the checklist! ✅","Cleaning checklist,Grease removal,Metal cleaning,Home organization #CleaningChecklist #GreaseBuster #HomeOrganization #CleaningMotivation"
Before & After: Grease Removal Magic!,https://res.cloudinary.com/dbcpfy04c/image/upload/v1748402210/pin_1_13_inpevj.webp,cleaning-inspiration,,https://www.beacleaner.com/how-to-clean-grease-off-metal?utm_source=pinterest&utm_campaign=before-after-grease-,2025-05-28,See the incredible results! This post features stunning before & after photos of grease-covered metal surfaces transformed with our cleaning methods.  Get inspired and learn how to achieve similar results in your own home.  Don't just take our word for it – see the proof! Click to view the transformations! 📸,"Before and after,Grease removal,Metal cleaning,Cleaning results #CleaningTransformation #GreaseRemover #HomeImprovement #CleaningInspiration"
Protect Your Metal: Grease Prevention,https://res.cloudinary.com/dbcpfy04c/image/upload/v1748402220/pin_1_14_jnpff6.webp,kitchen-cleaning-tips,,https://www.beacleaner.com/how-to-clean-grease-off-metal?utm_source=pinterest&utm_campaign=protect-your-metal-g,2025-05-28,"Don't let grease build up in the first place! This post shares tips on how to prevent grease buildup on metal surfaces, making cleaning easier in the long run.  Learn simple habits and techniques to keep your kitchen sparkling clean.  A little prevention goes a long way! Click to learn more! 🛡️","Grease prevention,Metal care,Cleaning tips,Kitchen maintenance #GreasePrevention #MetalCare #CleaningHacks #HomeTips"
Deep Cleaning Metal: A Step-by-Step Guide,https://res.cloudinary.com/dbcpfy04c/image/upload/v1748402229/pin_1_15_fqajfx.webp,cleaning-tips,,https://www.beacleaner.com/how-to-clean-grease-off-metal?utm_source=pinterest&utm_campaign=deep-cleaning-metal-,2025-05-28,"Ready for a deep clean? This post provides a detailed, step-by-step guide on how to clean grease off metal surfaces, tackling even the toughest grime.  We cover everything from preparation to finishing touches.  Get ready for a sparkling clean that will last! Click to read now! 🧼","Deep cleaning,Grease removal,Metal cleaning,Step-by-step guide #DeepCleaning #GreaseBuster #HomeCleaning #CleaningGuide"
Grease Removal for Every Metal Type,https://res.cloudinary.com/dbcpfy04c/image/upload/v1748402235/pin_1_16_z3cczq.webp,cleaning-tips,,https://www.beacleaner.com/how-to-clean-grease-off-metal?utm_source=pinterest&utm_campaign=grease-removal-for-e,2025-05-28,"Not all metals are created equal! This post explains how to clean grease off metal, tailoring the methods to different metal types (stainless steel, cast iron, aluminum, etc.).  Ensure you're using the right cleaning solutions to protect your surfaces.  Click to learn the specifics! ⚙️","Metal types,Grease removal,Cleaning solutions,Material care #MetalCleaning #GreaseRemover #HomeMaintenance #CleaningTips"
Quick & Easy Grease Cleaning Hacks,https://res.cloudinary.com/dbcpfy04c/image/upload/v1748402242/pin_1_17_wgqgat.webp,cleaning-tips,,https://www.beacleaner.com/how-to-clean-grease-off-metal?utm_source=pinterest&utm_campaign=quick-easy-grease-cl,2025-05-28,"Short on time? This post shares quick and easy hacks for cleaning grease off metal surfaces, perfect for busy schedules.  Learn how to tackle small messes before they become big problems.  Get a sparkling clean without spending hours scrubbing! Click to learn the hacks! ⏱️","Quick cleaning,Grease removal,Cleaning hacks,Time-saving tips #QuickCleaning #GreaseBuster #CleaningHacks #HomeTips"
Say Goodbye to Sticky Grease!,https://res.cloudinary.com/dbcpfy04c/image/upload/v1748402249/pin_1_18_ij4u20.webp,cleaning-tips,,https://www.beacleaner.com/how-to-clean-grease-off-metal?utm_source=pinterest&utm_campaign=say-goodbye-to-stick,2025-05-28,"Tired of sticky, stubborn grease? This post reveals the secrets to effectively cleaning grease off metal, leaving your surfaces smooth and sparkling.  We cover the best cleaning solutions and techniques for a truly deep clean.  Reclaim your kitchen and enjoy cooking again! Click to learn more! ✨","Sticky grease,Grease removal,Metal cleaning,Deep cleaning #GreaseRemover #MetalShine #KitchenCleaning #HomeHacks"
Grease Cleaning Mistakes to Avoid,https://res.cloudinary.com/dbcpfy04c/image/upload/v1748402256/pin_1_19_w9anva.webp,cleaning-tips-ideas,,https://www.beacleaner.com/how-to-clean-grease-off-metal?utm_source=pinterest&utm_campaign=grease-cleaning-mist,2025-05-28,"Don't make these common mistakes! This post highlights the biggest errors people make when cleaning grease off metal, and how to avoid them.  Protect your surfaces and ensure a successful clean every time.  Learn from our mistakes and get it right the first time! Click to read now! ⚠️","Cleaning mistakes,Grease removal,Metal care,Prevention tips #CleaningTips #GreaseBuster #HomeMaintenance #AvoidTheseMistakes"
The Best Tools for Grease Removal,https://res.cloudinary.com/dbcpfy04c/image/upload/v1748402263/pin_1_20_ngwdll.webp,cleaning-tips,,https://www.beacleaner.com/how-to-clean-grease-off-metal?utm_source=pinterest&utm_campaign=the-best-tools-for-g,2025-05-28,"Equip yourself for success! This post recommends the best tools and supplies for cleaning grease off metal surfaces, making the job easier and more effective.  From scrub brushes to cleaning solutions, we've got you covered.  Click to see our recommendations! 🧽","Cleaning tools,Grease removal,Metal cleaning,Supplies list #CleaningTools #GreaseRemover #HomeEssentials #CleaningSupplies"
Grease-Free Living: Start Today!,https://res.cloudinary.com/dbcpfy04c/image/upload/v1748402270/pin_1_21_o6t7oh.webp,kitchen-cleaning-tips,,https://www.beacleaner.com/how-to-clean-grease-off-metal?utm_source=pinterest&utm_campaign=grease-free-living-s,2025-05-28,"Imagine a kitchen free from grease and grime! This post inspires you to take control of the mess and create a clean, inviting space.  Learn how to clean grease off metal and maintain a sparkling kitchen with our easy-to-follow tips.  Start living your best, grease-free life today! Click to learn more! 🌟","Grease-free living,Kitchen cleaning,Motivation,Home improvement #CleanLiving #KitchenGoals #GreaseBuster #HomeInspiration"
From Grimy to Gleaming: Metal Makeover,https://res.cloudinary.com/dbcpfy04c/image/upload/v1748402277/pin_1_22_gcjinu.webp,home-cleaning-tips,,https://www.beacleaner.com/how-to-clean-grease-off-metal?utm_source=pinterest&utm_campaign=from-grimy-to-gleami,2025-05-28,"Give your metal surfaces a makeover! This post showcases how to transform grimy, grease-covered metal into gleaming, sparkling surfaces.  We share before & after photos and step-by-step instructions for a stunning transformation.  Click to see the amazing results! ✨","Metal makeover,Grease removal,Cleaning transformation,Home improvement #MetalMakeover #GreaseRemover #HomeImprovement #CleaningResults"
Grease Removal on a Budget,https://res.cloudinary.com/dbcpfy04c/image/upload/v1748402284/pin_1_23_xzkkyk.webp,cleaning-tips,,https://www.beacleaner.com/how-to-clean-grease-off-metal?utm_source=pinterest&utm_campaign=grease-removal-on-a-,2025-05-28,"Cleaning doesn't have to be expensive! This post reveals how to clean grease off metal using affordable, budget-friendly solutions.  We share DIY recipes and tips for saving money without sacrificing cleanliness.  Click to learn how to clean smart! 💰","Budget cleaning,Grease removal,DIY cleaning,Affordable solutions #BudgetCleaning #GreaseBuster #DIYHome #SaveMoney"
Stainless Steel vs. Cast Iron: Grease Cleaning,https://res.cloudinary.com/dbcpfy04c/image/upload/v1748402290/pin_1_24_teloaa.webp,kitchen-cleaning-tips,,https://www.beacleaner.com/how-to-clean-grease-off-metal?utm_source=pinterest&utm_campaign=stainless-steel-vs-c,2025-05-28,"Confused about cleaning different metals? This post compares and contrasts the best methods for cleaning grease off stainless steel and cast iron, ensuring you're using the right techniques for each surface.  Protect your cookware and get sparkling results! Click to learn the differences! 🍳","Stainless steel,Cast iron,Grease removal,Metal care #MetalCleaning #GreaseRemover #CookingTips #KitchenCare"
The Science of Grease Removal,https://res.cloudinary.com/dbcpfy04c/image/upload/v1748402297/pin_1_25_m7fgpc.webp,cleaning-tips,,https://www.beacleaner.com/how-to-clean-grease-off-metal?utm_source=pinterest&utm_campaign=the-science-of-greas,2025-05-28,"Ever wondered *why* certain cleaners work? This post delves into the science behind grease removal, explaining how different solutions break down grease and grime.  Learn the chemistry of cleaning and get even better results! Click to learn more! 🧪","Science of cleaning,Grease removal,Cleaning solutions,Chemistry #CleaningScience #GreaseBuster #HomeHacks #CleaningTips"
"Don't Scrub, Soak! Grease Removal Tip",https://res.cloudinary.com/dbcpfy04c/image/upload/v1748402304/pin_1_26_qmicki.webp,cleaning-tips,,https://www.beacleaner.com/how-to-clean-grease-off-metal?utm_source=pinterest&utm_campaign=dont-scrub-soak-grea,2025-05-28,Stop scrubbing endlessly! This post reveals the power of soaking to loosen and remove stubborn grease from metal surfaces.  Learn how to create a soaking solution and let the cleaning do the work for you.  Click to learn this time-saving tip! 🛀,"Soaking,Grease removal,Cleaning tip,Easy cleaning #SoakingCleaning #GreaseBuster #CleaningHacks #TimeSavingTips"
Title,https://res.cloudinary.com/dbcpfy04c/image/upload/v1748402348/pin_2_1_pcncop.webp,please-provide-the-title-and-keywords-i-need-that-information-to-suggest-a-board-name-once,,https://www.beacleaner.com/how-to-clean-gutter-guards?utm_source=pinterest&utm_campaign=title,2025-05-28,Description,Keywords
Gutter Guard Cleaning: A Must-Do!,https://res.cloudinary.com/dbcpfy04c/image/upload/v1748402355/pin_2_2_kblcjk.webp,home-maintenance-tips,,https://www.beacleaner.com/how-to-clean-gutter-guards?utm_source=pinterest&utm_campaign=gutter-guard-cleanin,2025-05-28,Don't let clogged gutter guards cause costly water damage! This pin shows you how to easily clean your gutter guards and protect your home. Learn simple steps to remove leaves,debris
Clean Gutter Guards = Happy Home,https://res.cloudinary.com/dbcpfy04c/image/upload/v1748402362/pin_2_3_xvrdyb.webp,home-maintenance-tips,,https://www.beacleaner.com/how-to-clean-gutter-guards?utm_source=pinterest&utm_campaign=clean-gutter-guards-,2025-05-28,Imagine the peace of mind knowing your home is protected from water damage. This pin highlights the importance of clean gutter guards. Our guide provides a step-by-step process for effective cleaning,preventing costly repairs and foundation issues. Don't wait for a storm to reveal a problem! Learn how to maintain your gutter guards and enjoy a worry-free home. Click to read now and safeguard your property!
DIY Gutter Guard Cleaning Guide,https://res.cloudinary.com/dbcpfy04c/image/upload/v1748402369/pin_2_4_knkiov.webp,home-maintenance-tips,,https://www.beacleaner.com/how-to-clean-gutter-guards?utm_source=pinterest&utm_campaign=diy-gutter-guard-cle,2025-05-28,Tired of expensive gutter cleaning services? This pin shows you how to tackle the job yourself! Our blog post breaks down gutter guard cleaning into manageable steps,even for beginners. Save money and gain valuable home maintenance skills. We'll show you the best tools and techniques for a sparkling clean result. Click to learn more and become a DIY pro!
Gutter Guard Cleaning: Before & After,https://res.cloudinary.com/dbcpfy04c/image/upload/v1748402375/pin_2_5_tscy9f.webp,home-maintenance-tips,,https://www.beacleaner.com/how-to-clean-gutter-guards?utm_source=pinterest&utm_campaign=gutter-guard-cleanin,2025-05-28,Witness the dramatic difference clean gutter guards can make! This pin features a stunning before-and-after image,showcasing the impact of regular maintenance. Don't let debris build up and compromise your home's protection. Our guide provides a simple
Protect Your Foundation: Clean Gutters,https://res.cloudinary.com/dbcpfy04c/image/upload/v1748402382/pin_2_6_o7wit5.webp,home-maintenance-tips,,https://www.beacleaner.com/how-to-clean-gutter-guards?utm_source=pinterest&utm_campaign=protect-your-foundat,2025-05-28,Your home's foundation is its most important asset. This pin emphasizes the link between clean gutter guards and a healthy foundation. Clogged gutters can lead to water damage and structural problems. Learn how to prevent these issues with our easy-to-follow cleaning guide. Click to read now and protect your biggest investment!,foundation protection
Gutter Guard Cleaning: Tools You Need,https://res.cloudinary.com/dbcpfy04c/image/upload/v1748402388/pin_2_7_sexcyu.webp,home-maintenance-tips,,https://www.beacleaner.com/how-to-clean-gutter-guards?utm_source=pinterest&utm_campaign=gutter-guard-cleanin,2025-05-28,Don't start cleaning your gutter guards without the right tools! This pin showcases the essential equipment for a successful cleaning project. Our blog post details each tool and explains how to use it effectively. Make the job easier and safer with our expert recommendations. Click to discover the must-have tools for gutter guard cleaning!,gutter cleaning tools
Avoid Costly Repairs: Clean Gutters,https://res.cloudinary.com/dbcpfy04c/image/upload/v1748402394/pin_2_8_lcrrbv.webp,home-maintenance-tips,,https://www.beacleaner.com/how-to-clean-gutter-guards?utm_source=pinterest&utm_campaign=avoid-costly-repairs,2025-05-28,Ignoring your gutter guards can lead to expensive repairs down the road. This pin highlights the financial benefits of regular cleaning. Prevent water damage,foundation issues
Gutter Guard Cleaning: Step-by-Step,https://res.cloudinary.com/dbcpfy04c/image/upload/v1748402402/pin_2_9_jhruuf.webp,home-maintenance-tips,,https://www.beacleaner.com/how-to-clean-gutter-guards?utm_source=pinterest&utm_campaign=gutter-guard-cleanin,2025-05-28,Confused about how to clean your gutter guards? This pin offers a clear,step-by-step guide to the process. Our blog post breaks down each stage
Is Your Gutter Guard System Failing?,https://res.cloudinary.com/dbcpfy04c/image/upload/v1748402408/pin_2_10_aojfdt.webp,gutter-tips,,https://www.beacleaner.com/how-to-clean-gutter-guards?utm_source=pinterest&utm_campaign=is-your-gutter-guard,2025-05-28,Don't wait until it's too late! This pin helps you identify signs that your gutter guard system needs cleaning. Learn to spot clogs,debris buildup
Gutter Guard Cleaning: Safety First!,https://res.cloudinary.com/dbcpfy04c/image/upload/v1748402413/pin_2_11_kakvt9.webp,home-maintenance-tips,,https://www.beacleaner.com/how-to-clean-gutter-guards?utm_source=pinterest&utm_campaign=gutter-guard-cleanin,2025-05-28,Cleaning gutter guards can be dangerous. This pin emphasizes the importance of safety precautions. Our blog post provides essential tips for working at heights and handling tools safely. Protect yourself and avoid accidents with our expert advice. Click to read now and clean your gutter guards with confidence!,safety tips
Extend Your Home's Life: Clean Gutters,https://res.cloudinary.com/dbcpfy04c/image/upload/v1748402420/pin_2_12_e1l0sx.webp,home-maintenance-tips,,https://www.beacleaner.com/how-to-clean-gutter-guards?utm_source=pinterest&utm_campaign=extend-your-homes-li,2025-05-28,Regular gutter guard cleaning is an investment in your home's longevity. This pin highlights the long-term benefits of preventative maintenance. Protect your roof,siding
Gutter Guard Cleaning: Quick & Easy,https://res.cloudinary.com/dbcpfy04c/image/upload/v1748402426/pin_2_13_vs16em.webp,home-maintenance-tips,,https://www.beacleaner.com/how-to-clean-gutter-guards?utm_source=pinterest&utm_campaign=gutter-guard-cleanin,2025-05-28,Short on time? This pin showcases a quick and easy method for cleaning your gutter guards. Our blog post provides efficient techniques for removing debris and maintaining optimal performance. Get the job done fast without sacrificing quality. Click to read now and simplify your cleaning routine!,quick cleaning
The Ultimate Gutter Guard Cleaning Checklist,https://res.cloudinary.com/dbcpfy04c/image/upload/v1748402435/pin_2_14_t3ow7e.webp,home-maintenance-tips,,https://www.beacleaner.com/how-to-clean-gutter-guards?utm_source=pinterest&utm_campaign=the-ultimate-gutter-,2025-05-28,Don't forget a step! This pin offers a comprehensive checklist for cleaning your gutter guards. Our blog post covers everything from preparation to final inspection. Ensure a thorough and effective cleaning with our detailed guide. Click to read now and stay organized!,cleaning checklist
Gutter Guard Cleaning: Avoid These Mistakes,https://res.cloudinary.com/dbcpfy04c/image/upload/v1748402441/pin_2_15_w1fewp.webp,home-maintenance-tips,,https://www.beacleaner.com/how-to-clean-gutter-guards?utm_source=pinterest&utm_campaign=gutter-guard-cleanin,2025-05-28,Learn from the pros! This pin highlights common mistakes to avoid when cleaning your gutter guards. Our blog post provides expert advice on preventing damage and ensuring optimal performance. Don't waste time and effort on ineffective techniques. Click to read now and clean like a pro!,cleaning mistakes
