Title,Media URL,Pinterest board,Thumbnail,Link,Publish date,Description,Keywords
Title,https://res.cloudinary.com/dbcpfy04c/image/upload/v1748241142/pin_1_1_r0dtli.webp,please-provide-the-title-and-keywords-i-need-that-information-to-suggest-a-board-name-once,,https://www.beacleaner.com/how-to-clean-terrarium-glass?utm_source=pinterest&utm_campaign=title,2025-05-26,Description,Keywords
Sparkling Terrarium Glass: A Guide,https://res.cloudinary.com/dbcpfy04c/image/upload/v1748241151/pin_1_2_va0ap6.webp,plant-care-tips,,https://www.beacleaner.com/how-to-clean-terrarium-glass?utm_source=pinterest&utm_campaign=sparkling-terrarium-,2025-05-26,"Is your beautiful terrarium looking a little…cloudy? Don't let grime ruin your miniature world! This guide reveals the *easiest* ways to clean terrarium glass, from daily misting to tackling stubborn algae. Learn how to restore crystal-clear views of your thriving plants and create a stunning display. We cover safe cleaning solutions, tools to avoid scratching, and preventative measures to keep it pristine.  A clean terrarium is a happy terrarium – and a happy you! Click to learn more and breathe new life into your little ecosystem.","Terrarium cleaning,Glass cleaning,Plant care,DIY cleaning"
Terrarium Glass Cleaning: No Streaks!,https://res.cloudinary.com/dbcpfy04c/image/upload/v1748241157/pin_1_3_nmxxik.webp,plant-care-tips,,https://www.beacleaner.com/how-to-clean-terrarium-glass?utm_source=pinterest&utm_campaign=terrarium-glass-clea,2025-05-26,Dreaming of a perfectly clear terrarium? Streaks and smudges are a thing of the past! This post breaks down the best techniques for achieving a spotless finish on your terrarium glass. Discover the secret to avoiding harsh chemicals and protecting your delicate plants. We'll show you how to gently remove buildup without disturbing your miniature landscape.  Don't let a dirty glass hide your botanical masterpiece – get the sparkling clarity you deserve! Click to read now.,"Terrarium,Cleaning tips,Clear glass,Plant display"
Algae in Your Terrarium? Fix It!,https://res.cloudinary.com/dbcpfy04c/image/upload/v1748241164/pin_1_4_khthpq.webp,terrarium-tips,,https://www.beacleaner.com/how-to-clean-terrarium-glass?utm_source=pinterest&utm_campaign=algae-in-your-terrar,2025-05-26,"Ugh, algae! It's the bane of many terrarium keepers. But don't despair! This guide tackles algae growth on terrarium glass head-on. Learn how to identify the cause, safely remove existing algae, and *prevent* it from returning.  We'll share simple adjustments to your terrarium's environment that will keep it healthy and algae-free.  Protect your plants and enjoy a vibrant, thriving ecosystem. Click to learn the secrets!","Terrarium algae,Algae removal,Terrarium care,Plant health"
DIY Terrarium Glass Cleaner (Safe!),https://res.cloudinary.com/dbcpfy04c/image/upload/v1748241169/pin_1_5_lfdllt.webp,plant-care-tips,,https://www.beacleaner.com/how-to-clean-terrarium-glass?utm_source=pinterest&utm_campaign=diy-terrarium-glass-,2025-05-26,"Worried about harsh chemicals harming your plants?  You don't need them! This post reveals a simple, effective DIY terrarium glass cleaner using ingredients you likely already have at home. It's gentle on your plants, tough on grime, and leaves your glass sparkling.  Give your terrarium the love it deserves with a natural cleaning solution.  Click to get the recipe and enjoy a worry-free clean!","DIY cleaner,Terrarium safe,Natural cleaning,Plant friendly"
Terrarium Cleaning Tools: What to Use,https://res.cloudinary.com/dbcpfy04c/image/upload/v1748241176/pin_1_6_qdoucz.webp,terrarium-tips,,https://www.beacleaner.com/how-to-clean-terrarium-glass?utm_source=pinterest&utm_campaign=terrarium-cleaning-t,2025-05-26,"Choosing the right tools is crucial for cleaning terrarium glass without causing damage. This post details the best (and worst!) tools for the job. From microfiber cloths to long-handled brushes, we'll guide you through the options.  Protect your investment and ensure a scratch-free clean every time.  Don't risk damaging your beautiful terrarium – learn what to use now!","Terrarium tools,Cleaning supplies,Glass care,Scratch prevention"
Terrarium Glass: Preventative Cleaning,https://res.cloudinary.com/dbcpfy04c/image/upload/v1748241182/pin_1_7_exvlps.webp,plant-care-tips,,https://www.beacleaner.com/how-to-clean-terrarium-glass?utm_source=pinterest&utm_campaign=terrarium-glass-prev,2025-05-26,Don't wait for grime to build up! This post focuses on *preventative* cleaning techniques to keep your terrarium glass sparkling with minimal effort.  Simple daily or weekly habits can make a huge difference.  Enjoy a consistently beautiful terrarium without the hassle of deep cleaning.  A little prevention goes a long way – click to learn how!,"Preventative care,Terrarium maintenance,Easy cleaning,Plant upkeep"
Cloudy Terrarium Glass? Restore Clarity,https://res.cloudinary.com/dbcpfy04c/image/upload/v1748241189/pin_1_8_k6rg5r.webp,terrarium-tips,,https://www.beacleaner.com/how-to-clean-terrarium-glass?utm_source=pinterest&utm_campaign=cloudy-terrarium-gla,2025-05-26,Is a film of cloudiness obscuring your terrarium's beauty?  This guide provides step-by-step instructions for restoring crystal-clear glass. We'll cover everything from identifying the cause of the cloudiness to choosing the right cleaning method.  Don't hide your miniature world – reveal its brilliance! Click to learn how to bring back the sparkle.,"Cloudy glass,Terrarium restoration,Cleaning guide,Clear view"
Terrarium Cleaning: Step-by-Step Guide,https://res.cloudinary.com/dbcpfy04c/image/upload/v1748241194/pin_1_9_vlgoqi.webp,terrarium-tips,,https://www.beacleaner.com/how-to-clean-terrarium-glass?utm_source=pinterest&utm_campaign=terrarium-cleaning-s,2025-05-26,"Overwhelmed by the thought of cleaning your terrarium?  Don't be! This post breaks down the process into simple, manageable steps.  We'll walk you through each stage, from preparing your terrarium to the final polish.  Enjoy a sparkling clean terrarium without the stress. Click to get started today!","Step-by-step,Terrarium cleaning,Easy guide,Cleaning process"
Terrarium Glass & Delicate Plants: Care,https://res.cloudinary.com/dbcpfy04c/image/upload/v1748241201/pin_1_10_qamzer.webp,plant-care-tips,,https://www.beacleaner.com/how-to-clean-terrarium-glass?utm_source=pinterest&utm_campaign=terrarium-glass-deli,2025-05-26,"Protect your delicate plants while cleaning your terrarium glass! This post emphasizes gentle cleaning techniques that won't harm your miniature ecosystem.  Learn how to avoid disturbing roots, damaging leaves, and disrupting the humidity levels.  Keep your plants happy and healthy while enjoying a sparkling clean terrarium. Click to learn more!","Delicate plants,Terrarium safety,Gentle cleaning,Plant protection"
Terrarium Cleaning: Common Mistakes,https://res.cloudinary.com/dbcpfy04c/image/upload/v1748241207/pin_1_11_pkqg2a.webp,terrarium-tips,,https://www.beacleaner.com/how-to-clean-terrarium-glass?utm_source=pinterest&utm_campaign=terrarium-cleaning-c,2025-05-26,"Avoid these common terrarium cleaning mistakes! This post highlights pitfalls to avoid, such as using harsh chemicals, abrasive tools, and improper techniques.  Protect your terrarium and ensure a long-lasting, beautiful display.  Learn from our mistakes and keep your miniature world thriving. Click to read now!","Cleaning mistakes,Terrarium tips,Avoid damage,Plant care"
Terrarium Glass: Long-Handled Tools,https://res.cloudinary.com/dbcpfy04c/image/upload/v1748241214/pin_1_12_vv4e3h.webp,plant-care-tips,,https://www.beacleaner.com/how-to-clean-terrarium-glass?utm_source=pinterest&utm_campaign=terrarium-glass-long,2025-05-26,Reaching those tricky spots in your terrarium can be a challenge. This post showcases the best long-handled tools for cleaning terrarium glass without disturbing your plants.  Enjoy a thorough clean without the awkward angles.  Make terrarium cleaning easier and more efficient. Click to discover the tools you need!,"Long-handled tools,Terrarium access,Cleaning reach,Easy cleaning"
Terrarium Cleaning Schedule: Stay On Top!,https://res.cloudinary.com/dbcpfy04c/image/upload/v1748241220/pin_1_13_fqqm4q.webp,terrarium-tips,,https://www.beacleaner.com/how-to-clean-terrarium-glass?utm_source=pinterest&utm_campaign=terrarium-cleaning-s,2025-05-26,"Struggling to keep your terrarium clean? This post provides a sample cleaning schedule to help you stay on top of maintenance.  From daily misting to monthly deep cleans, we'll guide you through a routine that works.  Enjoy a consistently beautiful terrarium with minimal effort. Click to download the schedule!","Cleaning schedule,Terrarium routine,Maintenance plan,Easy upkeep"
Terrarium Glass: Before & After Cleaning,https://res.cloudinary.com/dbcpfy04c/image/upload/v1748241225/pin_1_14_mkn0kq.webp,plant-care-tips,,https://www.beacleaner.com/how-to-clean-terrarium-glass?utm_source=pinterest&utm_campaign=terrarium-glass-befo,2025-05-26,See the *amazing* difference a good cleaning can make! This post features stunning before-and-after photos of terrarium glass transformations.  Get inspired to tackle your own cleaning project and reveal the beauty of your miniature world.  Don't let grime hide your plants – see the results for yourself! Click to view the transformations.,"Before and after,Terrarium results,Cleaning inspiration,Visual guide"
Terrarium Glass: Hard Water Spots?,https://res.cloudinary.com/dbcpfy04c/image/upload/v1748241231/pin_1_15_ekpq5k.webp,plant-care-tips,,https://www.beacleaner.com/how-to-clean-terrarium-glass?utm_source=pinterest&utm_campaign=terrarium-glass-hard,2025-05-26,Battling stubborn hard water spots on your terrarium glass? This post offers effective solutions for removing these unsightly blemishes.  Learn how to restore clarity and enjoy a sparkling clean display.  Don't let hard water ruin your view – click to learn the secrets!,"Hard water spots,Terrarium cleaning,Spot removal,Glass clarity"
Terrarium Cleaning: Is Distilled Water Best?,https://res.cloudinary.com/dbcpfy04c/image/upload/v1748241237/pin_1_16_vqjc90.webp,terrarium-tips,,https://www.beacleaner.com/how-to-clean-terrarium-glass?utm_source=pinterest&utm_campaign=terrarium-cleaning-i,2025-05-26,Wondering if distilled water is the best choice for cleaning your terrarium glass? This post explores the benefits of using distilled water and compares it to other options.  Protect your plants and ensure a streak-free clean.  Make the right choice for your miniature ecosystem. Click to learn more!,"Distilled water,Terrarium cleaning,Water quality,Plant safety"
Terrarium Glass: Cleaning with Vinegar?,https://res.cloudinary.com/dbcpfy04c/image/upload/v1748241243/pin_1_17_nlqulx.webp,plant-care-tips,,https://www.beacleaner.com/how-to-clean-terrarium-glass?utm_source=pinterest&utm_campaign=terrarium-glass-clea,2025-05-26,"Can you use vinegar to clean your terrarium glass? This post explores the pros and cons of using vinegar as a cleaning solution.  Learn how to use it safely and effectively, or discover alternative options.  Make an informed decision for your terrarium's health. Click to read the details!","Vinegar cleaning,Terrarium safe,Natural cleaner,Cleaning options"
Terrarium Glass: Microfiber Cloth Magic,https://res.cloudinary.com/dbcpfy04c/image/upload/v1748241248/pin_1_18_b9pwn2.webp,plant-care-tips,,https://www.beacleaner.com/how-to-clean-terrarium-glass?utm_source=pinterest&utm_campaign=terrarium-glass-micr,2025-05-26,"Unlock the power of microfiber! This post explains why microfiber cloths are the *best* choice for cleaning terrarium glass.  Learn how to use them effectively to achieve a streak-free, sparkling clean.  Protect your glass and enjoy a professional-looking finish. Click to discover the magic!","Microfiber cloth,Terrarium cleaning,Streak-free,Glass polish"
Terrarium Cleaning: Dealing with Mineral Buildup,https://res.cloudinary.com/dbcpfy04c/image/upload/v1748241254/pin_1_19_mmpptu.webp,terrarium-tips,,https://www.beacleaner.com/how-to-clean-terrarium-glass?utm_source=pinterest&utm_campaign=terrarium-cleaning-d,2025-05-26,Mineral buildup on terrarium glass can be a real pain. This post provides effective strategies for removing this stubborn residue.  Learn how to restore clarity and prevent future buildup.  Keep your terrarium looking its best with these helpful tips. Click to learn more!,"Mineral buildup,Terrarium cleaning,Residue removal,Glass care"
Terrarium Glass: Cleaning After Repotting,https://res.cloudinary.com/dbcpfy04c/image/upload/v1748241260/pin_1_20_cw0s9h.webp,plant-care-tips,,https://www.beacleaner.com/how-to-clean-terrarium-glass?utm_source=pinterest&utm_campaign=terrarium-glass-clea,2025-05-26,Just repotted your terrarium? This post guides you through cleaning the glass after the process.  Remove any soil smudges and ensure a clear view of your newly planted landscape.  Start fresh with a sparkling clean terrarium. Click to learn the steps!,"Repotting,Terrarium cleaning,Post-repoting,Glass cleaning"
Terrarium Glass: Cleaning for Photoshoots,https://res.cloudinary.com/dbcpfy04c/image/upload/v1748241266/pin_1_21_xbdxeq.webp,plant-care-tips,,https://www.beacleaner.com/how-to-clean-terrarium-glass?utm_source=pinterest&utm_campaign=terrarium-glass-clea,2025-05-26,Want to capture stunning photos of your terrarium? This post focuses on cleaning techniques to ensure your glass is picture-perfect.  Remove any distractions and showcase the beauty of your miniature world.  Get ready for Instagram-worthy photos! Click to learn the secrets.,"Terrarium photos,Glass cleaning,Photography tips,Clear display"
Terrarium Glass: Cleaning & Humidity,https://res.cloudinary.com/dbcpfy04c/image/upload/v1748241272/pin_1_22_lfzqhf.webp,plant-care-tips,,https://www.beacleaner.com/how-to-clean-terrarium-glass?utm_source=pinterest&utm_campaign=terrarium-glass-clea,2025-05-26,Does cleaning affect your terrarium's humidity? This post explores the relationship between cleaning and humidity levels.  Learn how to maintain the ideal environment for your plants while keeping your glass sparkling.  Balance cleanliness and plant health. Click to read the details!,"Terrarium humidity,Cleaning impact,Plant environment,Humidity control"
Terrarium Glass: Cleaning with a Brush,https://res.cloudinary.com/dbcpfy04c/image/upload/v1748241277/pin_1_23_tvn1cr.webp,plant-care-tips,,https://www.beacleaner.com/how-to-clean-terrarium-glass?utm_source=pinterest&utm_campaign=terrarium-glass-clea,2025-05-26,Using a brush to clean your terrarium glass? This post details the best brush types and techniques for effective cleaning.  Reach tricky spots and remove stubborn grime without damaging your plants.  Make cleaning easier and more efficient. Click to learn more!,"Terrarium brush,Cleaning tools,Brush techniques,Efficient cleaning"
Terrarium Glass: Cleaning & Plant Health,https://res.cloudinary.com/dbcpfy04c/image/upload/v1748241283/pin_1_24_dlene9.webp,plant-care-tips,,https://www.beacleaner.com/how-to-clean-terrarium-glass?utm_source=pinterest&utm_campaign=terrarium-glass-clea,2025-05-26,How does a clean terrarium benefit your plants? This post explores the connection between cleanliness and plant health.  Learn how removing grime and algae can improve light penetration and air circulation.  Give your plants the best possible environment. Click to discover the benefits!,"Plant health,Terrarium cleaning,Air circulation,Light penetration"
Terrarium Glass: Cleaning Checklist,https://res.cloudinary.com/dbcpfy04c/image/upload/v1748241289/pin_1_25_ayjwup.webp,plant-care-tips,,https://www.beacleaner.com/how-to-clean-terrarium-glass?utm_source=pinterest&utm_campaign=terrarium-glass-clea,2025-05-26,Don't forget a thing! This post provides a handy checklist for cleaning your terrarium glass.  Ensure a thorough and effective clean every time.  Print it out and keep it handy for easy reference. Click to download the checklist!,"Cleaning checklist,Terrarium maintenance,Cleaning guide,Printable resource"
Terrarium Glass: Sparkling Clean Secrets,https://res.cloudinary.com/dbcpfy04c/image/upload/v1748241295/pin_1_26_mzfeak.webp,plant-care-tips,,https://www.beacleaner.com/how-to-clean-terrarium-glass?utm_source=pinterest&utm_campaign=terrarium-glass-spar,2025-05-26,"Unlock the secrets to a sparkling clean terrarium! This post compiles the best tips and tricks from the blog post, offering a comprehensive guide to glass cleaning.  Enjoy a beautiful, thriving miniature world. Click to discover the secrets!","Terrarium secrets,Cleaning tips,Sparkling glass,Ultimate guide"
Title,https://res.cloudinary.com/dbcpfy04c/image/upload/v1748241337/pin_2_1_znorxn.webp,please-provide-the-title-and-keywords-i-need-that-information-to-suggest-a-board-name-once,,https://www.beacleaner.com/how-to-clean-the-army-sleep-system?utm_source=pinterest&utm_campaign=title,2025-05-26,Description,Keywords
Army Sleep System Cleaning Guide,https://res.cloudinary.com/dbcpfy04c/image/upload/v1748241344/pin_2_2_eiw5bm.webp,camping-tips,,https://www.beacleaner.com/how-to-clean-the-army-sleep-system?utm_source=pinterest&utm_campaign=army-sleep-system-cl,2025-05-26,Is your Army sleep system looking…less than fresh? Don't let dirt & grime ruin your comfort! This guide breaks down *exactly* how to clean every part of your system,from the compression sack to the pad.  We'll cover washing
Cleaning Your Sleep Pad: A Must!,https://res.cloudinary.com/dbcpfy04c/image/upload/v1748241349/pin_2_3_ahuxaf.webp,cleaning-tips,,https://www.beacleaner.com/how-to-clean-the-army-sleep-system?utm_source=pinterest&utm_campaign=cleaning-your-sleep-,2025-05-26,Don't underestimate the importance of a clean sleep pad! This pin focuses on the often-overlooked step of cleaning your Army sleep pad.  We detail the best methods for removing dirt,sweat
Wash Your Army Sleep System Now!,https://res.cloudinary.com/dbcpfy04c/image/upload/v1748241357/pin_2_4_spfzda.webp,gear-cleaning-tips,,https://www.beacleaner.com/how-to-clean-the-army-sleep-system?utm_source=pinterest&utm_campaign=wash-your-army-sleep,2025-05-26,Feeling exhausted *before* you even hit the field? A dirty sleep system could be to blame! This pin highlights the importance of regular cleaning for optimal performance and comfort.  We'll show you how to safely wash each component,avoiding damage and ensuring a thorough clean.  Don't let a dirty sleep system sabotage your rest. Click to learn the easy steps! #SleepSystem #MilitaryLife #CleanGear #Rest
Army Sleep System: Step-by-Step,https://res.cloudinary.com/dbcpfy04c/image/upload/v1748241363/pin_2_5_mj3ctc.webp,camping-tips,,https://www.beacleaner.com/how-to-clean-the-army-sleep-system?utm_source=pinterest&utm_campaign=army-sleep-system-st,2025-05-26,Confused about cleaning your Army sleep system?  This pin offers a clear,step-by-step visual guide to the entire process.  From disassembly to reassembly
Drying Your Sleep System: Tips!,https://res.cloudinary.com/dbcpfy04c/image/upload/v1748241369/pin_2_6_ns3cbo.webp,outdoor-gear-tips,,https://www.beacleaner.com/how-to-clean-the-army-sleep-system?utm_source=pinterest&utm_campaign=drying-your-sleep-sy,2025-05-26,Proper drying is *crucial* to prevent mold and mildew in your Army sleep system. This pin focuses on the best drying methods,including air drying and using a dryer (with caution!).  We'll help you avoid common mistakes that can damage your gear.  Don't risk ruining your investment – learn how to dry it right! Click for expert advice. #DryingTips #MoldPrevention #GearCare #ArmyEquipment
Extend Your Sleep System's Life,https://res.cloudinary.com/dbcpfy04c/image/upload/v1748241381/pin_2_7_fitazz.webp,sleep-tips,,https://www.beacleaner.com/how-to-clean-the-army-sleep-system?utm_source=pinterest&utm_campaign=extend-your-sleep-sy,2025-05-26,Want to keep your Army sleep system in top condition for years to come? This pin emphasizes the long-term benefits of regular cleaning and proper maintenance.  We'll share tips on storage,repair
The Ultimate Sleep System Checklist,https://res.cloudinary.com/dbcpfy04c/image/upload/v1748241387/pin_2_8_a51ayv.webp,cleaning-tips,,https://www.beacleaner.com/how-to-clean-the-army-sleep-system?utm_source=pinterest&utm_campaign=the-ultimate-sleep-s,2025-05-26,Before you pack up,make sure your Army sleep system is spotless! This pin provides a handy checklist to ensure you've covered every step of the cleaning process.  From washing to drying to inspection
Combatting Sleep System Odors,https://res.cloudinary.com/dbcpfy04c/image/upload/v1748241393/pin_2_9_gh4x5h.webp,sleep-tips,,https://www.beacleaner.com/how-to-clean-the-army-sleep-system?utm_source=pinterest&utm_campaign=combatting-sleep-sys,2025-05-26,Struggling with lingering odors in your Army sleep system? This pin tackles the problem head-on,offering effective solutions for removing sweat
Dealing with Stubborn Stains,https://res.cloudinary.com/dbcpfy04c/image/upload/v1748241399/pin_2_10_yjbzs3.webp,cleaning-tips,,https://www.beacleaner.com/how-to-clean-the-army-sleep-system?utm_source=pinterest&utm_campaign=dealing-with-stubbor,2025-05-26,Got stubborn stains on your Army sleep system? This pin provides targeted solutions for removing tough dirt,grime
Sleep System Cleaning Mistakes to Avoid,https://res.cloudinary.com/dbcpfy04c/image/upload/v1748241408/pin_2_11_uyhu6b.webp,cleaning-tips,,https://www.beacleaner.com/how-to-clean-the-army-sleep-system?utm_source=pinterest&utm_campaign=sleep-system-cleanin,2025-05-26,Don't make these common mistakes! This pin highlights the pitfalls to avoid when cleaning your Army sleep system.  We'll help you prevent damage,ensure a thorough clean
The Best Cleaners for Army Gear,https://res.cloudinary.com/dbcpfy04c/image/upload/v1748241415/pin_2_12_jv7kpp.webp,gear-cleaning-tips,,https://www.beacleaner.com/how-to-clean-the-army-sleep-system?utm_source=pinterest&utm_campaign=the-best-cleaners-fo,2025-05-26,Not all cleaners are created equal! This pin recommends the best cleaning products for your Army sleep system,ensuring a safe and effective clean.  We'll share our top picks for washing
Is Your Sleep System Moldy?,https://res.cloudinary.com/dbcpfy04c/image/upload/v1748241421/pin_2_13_nkqhsd.webp,mold-removal-tips,,https://www.beacleaner.com/how-to-clean-the-army-sleep-system?utm_source=pinterest&utm_campaign=is-your-sleep-system,2025-05-26,Worried about mold? This pin helps you identify and address mold growth in your Army sleep system.  We'll share tips on prevention,removal
Proper Storage for a Clean System,https://res.cloudinary.com/dbcpfy04c/image/upload/v1748241427/pin_2_14_krnbal.webp,home-organization-ideas,,https://www.beacleaner.com/how-to-clean-the-army-sleep-system?utm_source=pinterest&utm_campaign=proper-storage-for-a,2025-05-26,Cleaning is only half the battle! This pin focuses on proper storage techniques to keep your Army sleep system clean and protected.  We'll share tips on ventilation,pest control
The Benefits of a Hygienic Sleep System,https://res.cloudinary.com/dbcpfy04c/image/upload/v1748241434/pin_2_15_uzoohf.webp,sleep-hygiene-tips,,https://www.beacleaner.com/how-to-clean-the-army-sleep-system?utm_source=pinterest&utm_campaign=the-benefits-of-a-hy,2025-05-26,Beyond comfort,a clean sleep system is vital for health! This pin highlights the health benefits of regular cleaning
Army Sleep System: Deep Cleaning Guide,https://res.cloudinary.com/dbcpfy04c/image/upload/v1748241439/pin_2_16_o9ytdm.webp,camping-tips,,https://www.beacleaner.com/how-to-clean-the-army-sleep-system?utm_source=pinterest&utm_campaign=army-sleep-system-de,2025-05-26,Take your cleaning to the next level! This pin offers a comprehensive deep cleaning guide for your Army sleep system,covering every detail and ensuring a thorough clean.  Perfect for seasonal maintenance or preparing for long deployments. Click to learn more. #DeepCleaning #DetailedGuide #ArmyLife #GearMaintenance
Title,https://res.cloudinary.com/dbcpfy04c/image/upload/v1748241483/pin_3_1_bvmiq3.webp,please-provide-the-title-and-keywords-i-need-that-information-to-suggest-a-board-name-once,,https://www.beacleaner.com/how-to-clean-the-bottom-of-slip-shoes?utm_source=pinterest&utm_campaign=title,2025-05-26,Description,Keywords
Slip Shoe SOS: Get Grip Back!,https://res.cloudinary.com/dbcpfy04c/image/upload/v1748241492/pin_3_2_fslsbf.webp,shoe-care-tips,,https://www.beacleaner.com/how-to-clean-the-bottom-of-slip-shoes?utm_source=pinterest&utm_campaign=slip-shoe-sos-get-gr,2025-05-26,Is your favorite pair of slip-on shoes dangerously slick? Don't toss them! This guide reveals simple,effective methods to clean the bottom and restore traction. From everyday household items to specialized cleaners
Slip-Ons Losing Grip? Fix It!,https://res.cloudinary.com/dbcpfy04c/image/upload/v1748241501/pin_3_3_mgvxm4.webp,shoe-care-tips,,https://www.beacleaner.com/how-to-clean-the-bottom-of-slip-shoes?utm_source=pinterest&utm_campaign=slip-ons-losing-grip,2025-05-26,Don't let worn-out soles ruin your comfort! This post shows you exactly how to clean the bottom of your slip-on shoes,bringing back the grip you need.  We cover everything from removing dirt and grime to tackling stubborn residue.  Feel secure and stylish again!  A little effort can save you from a fall and extend the life of your shoes. Read now for a step-by-step guide! #ShoeCare #SlipResistant #CleanShoes #ShoeMaintenance
