Title,Media URL,Pinterest board,Thumbnail,Link,Publish date,Description,Keywords
Dromedary Cleaning: The Ultimate Checklist,https://res.cloudinary.com/dbcpfy04c/image/upload/v1748090319/pin_2_19_hgrjg5.webp,cleaning-tips,,https://www.beacleaner.com/how-to-clean-msr-dromedary-bag?utm_source=pinterest&utm_campaign=dromedary-cleaning-t,2025-05-24,"Don't forget a step! This pin provides a handy checklist for cleaning your MSR Dromedary bag, ensuring you cover all the bases.  Stay organized and enjoy a thorough clean. Click to get the checklist!","Cleaning Checklist,MSR,Hydration,Organization"
Keep Your Water Fresh: Dromedary Cleaning Tips,https://res.cloudinary.com/dbcpfy04c/image/upload/v1748090325/pin_2_20_swesyf.webp,water-filtration-tips,,https://www.beacleaner.com/how-to-clean-msr-dromedary-bag?utm_source=pinterest&utm_campaign=keep-your-water-fres,2025-05-24,Fresh water is essential! This pin focuses on tips for keeping your water tasting fresh and clean in your MSR Dromedary bag.  Enjoy a more enjoyable hydration experience. Click to learn the freshness tips!,"Fresh Water,MSR,Hydration,Water Quality"
Dromedary Cleaning: A Guide for Hikers,https://res.cloudinary.com/dbcpfy04c/image/upload/v1748090332/pin_2_21_uenpyv.webp,cleaning-tips,,https://www.beacleaner.com/how-to-clean-msr-dromedary-bag?utm_source=pinterest&utm_campaign=dromedary-cleaning-a,2025-05-24,"Hikers, this one's for you! This pin provides a tailored cleaning guide for MSR Dromedary bags, specifically for those who use them on the trail.  Keep your hydration pack clean and ready for your next adventure. Click to learn the hiker's guide!","Hiking,MSR,Hydration,Trail Gear"
MSR Dromedary Cleaning: Prevent Bad Taste,https://res.cloudinary.com/dbcpfy04c/image/upload/v1748090338/pin_2_22_olwhou.webp,hydration-tips,,https://www.beacleaner.com/how-to-clean-msr-dromedary-bag?utm_source=pinterest&utm_campaign=msr-dromedary-cleani,2025-05-24,Don't ruin your hike with bad-tasting water! This pin focuses on preventing unpleasant tastes in your MSR Dromedary bag through proper cleaning and maintenance. Click to learn how to avoid bad taste!,"Water Taste,MSR,Hydration,Cleaning Tips"
"Dromedary Cleaning: Simple Steps, Big Impact",https://res.cloudinary.com/dbcpfy04c/image/upload/v1748090346/pin_2_23_k0iujz.webp,cleaning-tips,,https://www.beacleaner.com/how-to-clean-msr-dromedary-bag?utm_source=pinterest&utm_campaign=dromedary-cleaning-s,2025-05-24,"Small effort, big reward! This pin highlights how simple cleaning steps can have a significant impact on the hygiene and longevity of your MSR Dromedary bag. Click to learn the simple steps!","Simple Cleaning,MSR,Hydration,Easy Tips"
MSR Dromedary: Cleaning for Peace of Mind,https://res.cloudinary.com/dbcpfy04c/image/upload/v1748090352/pin_2_24_bbcrci.webp,gear-maintenance-tips,,https://www.beacleaner.com/how-to-clean-msr-dromedary-bag?utm_source=pinterest&utm_campaign=msr-dromedary-cleani,2025-05-24,Enjoy worry-free hydration! This pin emphasizes the peace of mind that comes with knowing your MSR Dromedary bag is clean and hygienic. Click to learn how to achieve peace of mind!,"Peace of Mind,MSR,Hydration,Water Safety"
Dromedary Cleaning: Don't Let It Get Gross!,https://res.cloudinary.com/dbcpfy04c/image/upload/v1748090358/pin_2_25_avgb5l.webp,cleaning-tips,,https://www.beacleaner.com/how-to-clean-msr-dromedary-bag?utm_source=pinterest&utm_campaign=dromedary-cleaning-d,2025-05-24,A little prevention goes a long way! This pin encourages regular cleaning of your MSR Dromedary bag to prevent it from becoming overly dirty and unhygienic. Click to learn how to prevent the grossness!,"Prevention,MSR,Hydration,Cleaning Routine"
MSR Dromedary Cleaning: Your Water Will Thank You!,https://res.cloudinary.com/dbcpfy04c/image/upload/v1748090364/pin_2_26_kyatsk.webp,hydration-tips,,https://www.beacleaner.com/how-to-clean-msr-dromedary-bag?utm_source=pinterest&utm_campaign=msr-dromedary-cleani,2025-05-24,"Give your water the clean container it deserves! This pin playfully encourages cleaning your MSR Dromedary bag for the sake of delicious, fresh water. Click to learn how to make your water happy!","Water Quality,MSR,Hydration,Fun Cleaning"
Title,https://res.cloudinary.com/dbcpfy04c/image/upload/v1748090414/pin_3_1_a0u3xt.webp,please-provide-the-title-and-keywords-i-need-that-information-to-suggest-a-board-name-once,,https://www.beacleaner.com/how-to-clean-my-dyson-airwrap-filter?utm_source=pinterest&utm_campaign=title,2025-05-24,Description,Keywords
Is Your Dyson Airwrap Losing Suction?,https://res.cloudinary.com/dbcpfy04c/image/upload/v1748090421/pin_3_2_bcuewu.webp,hair-care-tips,,https://www.beacleaner.com/how-to-clean-my-dyson-airwrap-filter?utm_source=pinterest&utm_campaign=is-your-dyson-airwra,2025-05-24,“Don't let a clogged filter ruin your Airwrap experience! This easy guide shows you exactly how to clean your Dyson Airwrap filter,restoring its power and extending its life. A clean filter means faster drying
Airwrap Filter Cleaning: Quick Guide,https://res.cloudinary.com/dbcpfy04c/image/upload/v1748090427/pin_3_3_brcslj.webp,hair-care-tips,,https://www.beacleaner.com/how-to-clean-my-dyson-airwrap-filter?utm_source=pinterest&utm_campaign=airwrap-filter-clean,2025-05-24,“Worried about hidden dust & debris impacting your Dyson Airwrap's performance? This quick & easy guide will show you how to clean your Airwrap filter in minutes! A dirty filter can cause overheating and reduce airflow,"leading to longer styling times and potential damage. We'll show you exactly what you need and how to do it. Protect your investment and enjoy consistently amazing results. Click to read the full tutorial and keep your Airwrap running smoothly!"""
Extend Your Airwrap's Life: Filter Care,https://res.cloudinary.com/dbcpfy04c/image/upload/v1748090433/pin_3_4_obw6wn.webp,hair-tool-tips,,https://www.beacleaner.com/how-to-clean-my-dyson-airwrap-filter?utm_source=pinterest&utm_campaign=extend-your-airwraps,2025-05-24,“Your Dyson Airwrap is an investment – protect it! Learn how to clean the filter regularly to prevent damage and maintain optimal performance. A clean filter isn't just about airflow; it's about protecting the motor and ensuring your Airwrap lasts for years to come. We've simplified the process with clear instructions and helpful tips. Don't risk a costly repair – take a few minutes to clean your filter today! Click to read the full guide and keep your Airwrap in top condition.,"Dyson Airwrap,Filter Maintenance,Hair Tools,Longevity"
Airwrap Not Working? Check the Filter!,https://res.cloudinary.com/dbcpfy04c/image/upload/v1748090442/pin_3_5_esiivc.webp,hair-tool-tips,,https://www.beacleaner.com/how-to-clean-my-dyson-airwrap-filter?utm_source=pinterest&utm_campaign=airwrap-not-working-,2025-05-24,“Is your Dyson Airwrap struggling to heat up or losing suction? The filter might be the culprit! This guide walks you through cleaning it quickly and effectively. A clogged filter is a common issue,"but easily fixed. Don't spend money on repairs when a simple cleaning can solve the problem. We'll show you exactly where the filter is located and how to remove and clean it properly. Click to read the full post and get your Airwrap back to its best!"""
DIY Airwrap Filter Cleaning - Easy Steps,https://res.cloudinary.com/dbcpfy04c/image/upload/v1748090452/pin_3_6_ywaei6.webp,hair-care-tips,,https://www.beacleaner.com/how-to-clean-my-dyson-airwrap-filter?utm_source=pinterest&utm_campaign=diy-airwrap-filter-c,2025-05-24,“Save money and keep your Dyson Airwrap performing like new with this DIY filter cleaning guide! We'll show you how to clean the filter without any special tools or harsh chemicals. A clean filter means healthier hair and a longer-lasting Airwrap. It's a simple task that makes a huge difference. Don't let dust and debris compromise your styling experience. Click to read the full tutorial and learn how to clean your Airwrap filter like a pro!,"Airwrap,DIY Cleaning,Dyson Filter,Hair Health"
Clean Airwrap Filter = Happy Hair!,https://res.cloudinary.com/dbcpfy04c/image/upload/v1748090458/pin_3_7_zn76sv.webp,hair-care-tips,,https://www.beacleaner.com/how-to-clean-my-dyson-airwrap-filter?utm_source=pinterest&utm_campaign=clean-airwrap-filter,2025-05-24,“Imagine effortlessly achieving your dream hairstyle every time! A clean Dyson Airwrap filter is key to optimal performance and healthy,shiny hair. This guide makes filter cleaning simple and stress-free. Don't let a clogged filter ruin your styling routine. We'll show you exactly how to do it
Airwrap Maintenance: Filter Cleaning 101,https://res.cloudinary.com/dbcpfy04c/image/upload/v1748090465/pin_3_8_rjzogl.webp,hair-tool-tips,,https://www.beacleaner.com/how-to-clean-my-dyson-airwrap-filter?utm_source=pinterest&utm_campaign=airwrap-maintenance-,2025-05-24,“Don't neglect your Dyson Airwrap's filter! Regular cleaning is essential for maintaining its performance and preventing damage. This guide provides a comprehensive overview of the filter cleaning process,"from locating the filter to drying it properly. We'll answer all your questions and give you the confidence to tackle this task yourself. Click to read the full post and become an Airwrap maintenance pro!"""
Restore Airflow: Clean Your Airwrap Filter,https://res.cloudinary.com/dbcpfy04c/image/upload/v1748090472/pin_3_9_zdrytb.webp,hair-tool-tips,,https://www.beacleaner.com/how-to-clean-my-dyson-airwrap-filter?utm_source=pinterest&utm_campaign=restore-airflow-clea,2025-05-24,“Is your Dyson Airwrap feeling weak? A clogged filter could be the reason! This guide shows you how to restore airflow and get your Airwrap back to its powerful best. We'll walk you through the cleaning process with clear instructions and helpful photos. Don't settle for less-than-perfect styling results. Click to read the full post and breathe new life into your Airwrap!,"Airflow,Dyson Airwrap,Filter,Hair Styling"
Airwrap Filter Cleaning: Before & After,https://res.cloudinary.com/dbcpfy04c/image/upload/v1748090478/pin_3_10_sezjyg.webp,hair-care-tips,,https://www.beacleaner.com/how-to-clean-my-dyson-airwrap-filter?utm_source=pinterest&utm_campaign=airwrap-filter-clean,2025-05-24,“See the difference a clean filter makes! This guide includes before-and-after photos to show you just how much dust and debris can accumulate in your Dyson Airwrap filter. We'll walk you through the cleaning process step-by-step,"so you can achieve the same amazing results. Don't let a dirty filter compromise your styling experience. Click to read the full post and see the transformation!"""
The Secret to a Powerful Airwrap: Filter!,https://res.cloudinary.com/dbcpfy04c/image/upload/v1748090485/pin_3_11_jtojzb.webp,hair-care-tips,,https://www.beacleaner.com/how-to-clean-my-dyson-airwrap-filter?utm_source=pinterest&utm_campaign=the-secret-to-a-powe,2025-05-24,“Want to unlock the full potential of your Dyson Airwrap? The secret is a clean filter! This guide shows you how to clean it quickly and easily,restoring its power and extending its life. A clean filter means faster drying
Airwrap Filter Cleaning: Don't Skip This!,https://res.cloudinary.com/dbcpfy04c/image/upload/v1748090490/pin_3_12_nkm1sz.webp,hair-care-tips,,https://www.beacleaner.com/how-to-clean-my-dyson-airwrap-filter?utm_source=pinterest&utm_campaign=airwrap-filter-clean,2025-05-24,“Don't make the mistake of neglecting your Dyson Airwrap's filter! Regular cleaning is crucial for maintaining its performance and preventing damage. This guide provides a simple,"step-by-step tutorial that anyone can follow. We'll show you exactly what you need and how to do it. Click to read the full post and protect your investment!"""
Airwrap Smells Bad? Clean the Filter!,https://res.cloudinary.com/dbcpfy04c/image/upload/v1748090496/pin_3_13_ubwgwd.webp,hair-tool-tips,,https://www.beacleaner.com/how-to-clean-my-dyson-airwrap-filter?utm_source=pinterest&utm_campaign=airwrap-smells-bad-c,2025-05-24,“Is your Dyson Airwrap emitting an unpleasant odor? A dirty filter could be the culprit! This guide shows you how to clean the filter and eliminate the smell. We'll walk you through the process with clear instructions and helpful tips. Don't let a bad smell ruin your styling experience. Click to read the full post and freshen up your Airwrap!,"Dyson Airwrap,Filter,Smell,Cleaning Tips"
Airwrap Filter Cleaning: Save Time & Money,https://res.cloudinary.com/dbcpfy04c/image/upload/v1748090502/pin_3_14_kv7mkl.webp,hair-care-tips,,https://www.beacleaner.com/how-to-clean-my-dyson-airwrap-filter?utm_source=pinterest&utm_campaign=airwrap-filter-clean,2025-05-24,“Stop wasting money on expensive repairs! This guide shows you how to clean your Dyson Airwrap filter yourself,"saving you time and money. A clean filter is essential for maintaining its performance and preventing damage. We'll provide all the information you need to tackle this task with confidence. Click to read the full post and start saving today!"""
Airwrap Filter: How Often to Clean?,https://res.cloudinary.com/dbcpfy04c/image/upload/v1748090512/pin_3_15_hy45ca.webp,hair-care-tips,,https://www.beacleaner.com/how-to-clean-my-dyson-airwrap-filter?utm_source=pinterest&utm_campaign=airwrap-filter-how-o,2025-05-24,“Wondering how often you should clean your Dyson Airwrap filter? This guide provides a clear answer and explains the importance of regular maintenance. We'll also walk you through the cleaning process step-by-step. Don't let a dirty filter compromise your styling experience. Click to read the full post and keep your Airwrap in top condition!,"Dyson Airwrap,Filter,Cleaning Schedule,Maintenance Tips"
Airwrap Filter Cleaning: Step-by-Step Guide,https://res.cloudinary.com/dbcpfy04c/image/upload/v1748090518/pin_3_16_hajbfy.webp,hair-care-tips,,https://www.beacleaner.com/how-to-clean-my-dyson-airwrap-filter?utm_source=pinterest&utm_campaign=airwrap-filter-clean,2025-05-24,“Confused about how to clean your Dyson Airwrap filter? This step-by-step guide makes the process simple and stress-free. We'll provide clear instructions and helpful photos to guide you through each step. Don't let a clogged filter ruin your styling routine. Click to read the full post and get started today!,"Dyson Airwrap,Filter,Step-by-Step,Tutorial"
Airwrap Filter Cleaning: Quick & Easy!,https://res.cloudinary.com/dbcpfy04c/image/upload/v1748090523/pin_3_17_tkvjwm.webp,hair-care-tips,,https://www.beacleaner.com/how-to-clean-my-dyson-airwrap-filter?utm_source=pinterest&utm_campaign=airwrap-filter-clean,2025-05-24,“Short on time? This quick and easy guide shows you how to clean your Dyson Airwrap filter in minutes! A clean filter is essential for maintaining its performance and preventing damage. We'll provide all the information you need to tackle this task quickly and efficiently. Click to read the full post and get back to styling!,"Dyson Airwrap,Filter,Quick Cleaning,Easy Tutorial"
Airwrap Filter Cleaning: Protect Your Investment,https://res.cloudinary.com/dbcpfy04c/image/upload/v1748090530/pin_3_18_zr1lvk.webp,hair-care-tips,,https://www.beacleaner.com/how-to-clean-my-dyson-airwrap-filter?utm_source=pinterest&utm_campaign=airwrap-filter-clean,2025-05-24,“Your Dyson Airwrap is a valuable investment – protect it! This guide shows you how to clean the filter regularly to prevent damage and maintain optimal performance. A clean filter isn't just about airflow; it's about protecting the motor and ensuring your Airwrap lasts for years to come. Click to read the full post and safeguard your investment!,"Dyson Airwrap,Filter,Investment,Protection"
Airwrap Filter Cleaning: Troubleshooting Tips,https://res.cloudinary.com/dbcpfy04c/image/upload/v1748090536/pin_3_19_i0rxw1.webp,hair-care-tips,,https://www.beacleaner.com/how-to-clean-my-dyson-airwrap-filter?utm_source=pinterest&utm_campaign=airwrap-filter-clean,2025-05-24,“Is your Dyson Airwrap still not working after cleaning the filter? This guide provides troubleshooting tips to help you identify and resolve common issues. We'll cover everything from clogged airways to motor problems. Don't give up on your Airwrap – click to read the full post and get it back to its best!,"Dyson Airwrap,Filter,Troubleshooting,Repair"
Airwrap Filter Cleaning: The Ultimate Guide,https://res.cloudinary.com/dbcpfy04c/image/upload/v1748090541/pin_3_20_kfrkt2.webp,hair-care-tips,,https://www.beacleaner.com/how-to-clean-my-dyson-airwrap-filter?utm_source=pinterest&utm_campaign=airwrap-filter-clean,2025-05-24,“Everything you need to know about cleaning your Dyson Airwrap filter is right here! This comprehensive guide covers everything from locating the filter to drying it properly. We'll answer all your questions and provide helpful tips and tricks. Click to read the full post and become an Airwrap filter cleaning expert!,"Dyson Airwrap,Filter,Ultimate Guide,Comprehensive"
Airwrap Filter Cleaning: For Beginners,https://res.cloudinary.com/dbcpfy04c/image/upload/v1748090547/pin_3_21_szff7h.webp,hair-care-tips,,https://www.beacleaner.com/how-to-clean-my-dyson-airwrap-filter?utm_source=pinterest&utm_campaign=airwrap-filter-clean,2025-05-24,“New to the Dyson Airwrap? This guide is perfect for beginners! We'll walk you through the filter cleaning process step-by-step,"using simple language and clear instructions. Don't be intimidated – it's easier than you think! Click to read the full post and get started today."""
Airwrap Filter Cleaning: Prevent Overheating,https://res.cloudinary.com/dbcpfy04c/image/upload/v1748090553/pin_3_22_x7z74u.webp,hair-care-tips,,https://www.beacleaner.com/how-to-clean-my-dyson-airwrap-filter?utm_source=pinterest&utm_campaign=airwrap-filter-clean,2025-05-24,“Worried about your Dyson Airwrap overheating? A clogged filter can be a major cause! This guide shows you how to clean the filter and prevent overheating,"protecting your Airwrap and ensuring safe styling. Click to read the full post and keep your Airwrap cool and functioning properly!"""
Airwrap Filter Cleaning: Boost Performance,https://res.cloudinary.com/dbcpfy04c/image/upload/v1748090559/pin_3_23_b1ukok.webp,hair-care-tips,,https://www.beacleaner.com/how-to-clean-my-dyson-airwrap-filter?utm_source=pinterest&utm_campaign=airwrap-filter-clean,2025-05-24,“Want to boost your Dyson Airwrap's performance? Cleaning the filter is the first step! This guide shows you how to restore airflow and get your Airwrap back to its powerful best. Enjoy faster drying times and more effective styling. Click to read the full post and experience the difference!,"Dyson Airwrap,Filter,Performance,Boost"
Airwrap Filter Cleaning: Healthy Hair Starts Here,https://res.cloudinary.com/dbcpfy04c/image/upload/v1748090565/pin_3_24_ybo7vq.webp,hair-care-tips,,https://www.beacleaner.com/how-to-clean-my-dyson-airwrap-filter?utm_source=pinterest&utm_campaign=airwrap-filter-clean,2025-05-24,“Healthy hair starts with a clean Dyson Airwrap! A clogged filter can compromise airflow and lead to frizz and damage. This guide shows you how to clean the filter and protect your hair. Click to read the full post and achieve salon-worthy results at home!,"Dyson Airwrap,Filter,Healthy Hair,Haircare"
Airwrap Filter Cleaning: Don't Ignore This!,https://res.cloudinary.com/dbcpfy04c/image/upload/v1748090571/pin_3_25_docg2l.webp,hair-care-tips,,https://www.beacleaner.com/how-to-clean-my-dyson-airwrap-filter?utm_source=pinterest&utm_campaign=airwrap-filter-clean,2025-05-24,“Don't ignore the importance of cleaning your Dyson Airwrap filter! It's a simple task that can make a huge difference in its performance and longevity. This guide provides a quick and easy tutorial. Click to read the full post and keep your Airwrap running smoothly!,"Dyson Airwrap,Filter,Maintenance,Longevity"
Title,https://res.cloudinary.com/dbcpfy04c/image/upload/v1748090612/pin_4_1_kcgkde.webp,please-provide-the-title-and-keywords-i-need-that-information-to-suggest-a-board-name-once,,https://www.beacleaner.com/how-to-clean-my-louis-vuitton-bag?utm_source=pinterest&utm_campaign=title,2025-05-24,Description,Keywords
Save Your LV: Cleaning Guide,https://res.cloudinary.com/dbcpfy04c/image/upload/v1748090618/pin_4_2_gcgj3r.webp,leather-care-tips,,https://www.beacleaner.com/how-to-clean-my-louis-vuitton-bag?utm_source=pinterest&utm_campaign=save-your-lv-cleanin,2025-05-24,"Is your beloved Louis Vuitton bag looking a little lackluster? Don't panic! This guide reveals the secrets to safely cleaning your luxury handbag at home, restoring its original beauty. Learn how to tackle everything from water stains to ink marks, protecting your investment for years to come. We'll cover different materials like Vachetta leather, canvas, and hardware. Don't let a dirty bag diminish your style – give it the TLC it deserves! Click to learn more and keep your LV looking pristine.","Louis Vuitton, bag cleaning, luxury care, leather care"
Louis Vuitton Care: A Step-by-Step,https://res.cloudinary.com/dbcpfy04c/image/upload/v1748090626/pin_4_3_jskx9m.webp,handbag-care-tips,,https://www.beacleaner.com/how-to-clean-my-louis-vuitton-bag?utm_source=pinterest&utm_campaign=louis-vuitton-care-a,2025-05-24,"Worried about damaging your precious Louis Vuitton? This pin leads to a detailed, step-by-step guide on how to clean your bag *without* risking its integrity. We break down the process for various materials, offering gentle yet effective solutions. Imagine the confidence of carrying a spotless, stunning LV!  Protect your investment and maintain that luxurious feel.  Click to read the full guide and learn the best techniques.","LV cleaning, handbag care, leather restoration, DIY cleaning"
Vachetta Leather: Cleaning Secrets,https://res.cloudinary.com/dbcpfy04c/image/upload/v1748090634/pin_4_4_srncon.webp,leather-care-tips,,https://www.beacleaner.com/how-to-clean-my-louis-vuitton-bag?utm_source=pinterest&utm_campaign=vachetta-leather-cle,2025-05-24,"Vachetta leather is beautiful, but notoriously tricky to clean! This pin links to our guide revealing the best methods for gently cleaning and conditioning your Louis Vuitton's Vachetta leather handles and trim.  Keep them looking light and lovely, avoiding discoloration and damage. Don't let stains ruin the elegance of your bag! Learn the secrets to Vachetta care today.","Vachetta leather, LV care, leather cleaning, stain removal"
Ink Stain on LV? Don't Despair!,https://res.cloudinary.com/dbcpfy04c/image/upload/v1748090640/pin_4_5_ygnjcx.webp,bag-repair-tips,,https://www.beacleaner.com/how-to-clean-my-louis-vuitton-bag?utm_source=pinterest&utm_campaign=ink-stain-on-lv-dont,2025-05-24,"Oh no! An ink stain on your Louis Vuitton? Before you panic, check out our guide! We share proven techniques for removing ink marks from various LV materials.  Don't let a small accident ruin your investment.  We'll help you restore your bag to its former glory. Click to learn how to tackle this common problem and save your bag!","Ink stain, LV repair, bag restoration, stain removal"
Louis Vuitton Canvas: Easy Cleaning,https://res.cloudinary.com/dbcpfy04c/image/upload/v1748090646/pin_4_6_p6h8f0.webp,handbag-care-tips,,https://www.beacleaner.com/how-to-clean-my-louis-vuitton-bag?utm_source=pinterest&utm_campaign=louis-vuitton-canvas,2025-05-24,"Keep your Louis Vuitton canvas looking fresh and vibrant with our simple cleaning guide! We show you how to remove dirt, grime, and everyday wear without damaging the iconic monogram.  A clean bag is a happy bag!  Enjoy the confidence of carrying a beautifully maintained LV. Click to learn the easy steps.","LV canvas, cleaning guide, monogram care, handbag maintenance"
Protect Your Investment: LV Cleaning,https://res.cloudinary.com/dbcpfy04c/image/upload/v1748090653/pin_4_7_vprl3a.webp,handbag-care-tips,,https://www.beacleaner.com/how-to-clean-my-louis-vuitton-bag?utm_source=pinterest&utm_campaign=protect-your-investm,2025-05-24,"Your Louis Vuitton bag is an investment – treat it like one! This pin directs you to our comprehensive cleaning guide, ensuring you know how to properly care for your luxury handbag.  Prevent damage, maintain its value, and enjoy it for years to come.  Don't wait until it's too late! Click to learn how to protect your LV.","Luxury handbag, LV care, investment protection, cleaning tips"
Water Stains on LV? Fix Them!,https://res.cloudinary.com/dbcpfy04c/image/upload/v1748090660/pin_4_8_jhmnzj.webp,leather-care-tips,,https://www.beacleaner.com/how-to-clean-my-louis-vuitton-bag?utm_source=pinterest&utm_campaign=water-stains-on-lv-f,2025-05-24,Water stains are a common problem for Louis Vuitton bags.  Our guide shows you how to effectively remove them and restore your bag's pristine appearance.  Don't let water damage ruin the beauty of your LV!  Learn the best techniques for tackling this issue and keeping your bag looking its best. Click to read now!,"Water stains, LV cleaning, leather care, stain removal"
Hardware Shine: LV Bag Care,https://res.cloudinary.com/dbcpfy04c/image/upload/v1748090667/pin_4_9_ifk0fh.webp,bag-care-tips,,https://www.beacleaner.com/how-to-clean-my-louis-vuitton-bag?utm_source=pinterest&utm_campaign=hardware-shine-lv-ba,2025-05-24,"Don't forget the hardware! This pin leads to our guide on how to clean and polish your Louis Vuitton bag's hardware, restoring its shine and brilliance.  A little attention to detail can make a big difference.  Keep your bag looking luxurious from top to bottom. Click to learn the simple steps.","LV hardware, cleaning, polishing, bag details"
