Title,Media URL,Pinterest board,Thumbnail,Link,Publish date,Description,Keywords
Mold on Concrete? Fix It!,https://res.cloudinary.com/dbcpfy04c/image/upload/v1747766056/pin_5_3_n6a7px.webp,home-cleaning-tips,,https://www.beacleaner.com/how-to-clean-mold-from-concrete-floor?utm_source=pinterest&utm_campaign=mold-on-concrete-fix,2025-05-20,Discover the simple steps to eliminate mold on your concrete floors! This isn't just about aesthetics; mold can be a serious health hazard. We'll show you how to clean it yourself,saving you money on expensive professional services.  Don't ignore the problem – a clean floor is a healthy floor!  Get the DIY guide now and breathe easier. #ConcreteMold #DIYCleaning #MoldPrevention #HealthyHome
Concrete Floor Mold: A Guide,https://res.cloudinary.com/dbcpfy04c/image/upload/v1747766063/pin_5_4_x6skhe.webp,mold-removal-tips,,https://www.beacleaner.com/how-to-clean-mold-from-concrete-floor?utm_source=pinterest&utm_campaign=concrete-floor-mold-,2025-05-20,Is mold taking over your concrete floors?  This comprehensive guide provides a step-by-step process for tackling mold,from initial assessment to final disinfection.  We'll help you understand the causes of mold growth and how to prevent it from returning.  Don't let mold win – take control today! Click to learn more. #MoldCleaning #ConcreteFloors #HomeMaintenance #DIYHome
DIY Concrete Mold Removal,https://res.cloudinary.com/dbcpfy04c/image/upload/v1747766070/pin_5_5_x70mes.webp,concrete-cleaning-tips,,https://www.beacleaner.com/how-to-clean-mold-from-concrete-floor?utm_source=pinterest&utm_campaign=diy-concrete-mold-re,2025-05-20,Save money and tackle mold yourself! This guide provides a detailed,DIY approach to cleaning mold from concrete floors.  We'll walk you through the process
Moldy Concrete? Don't Panic!,https://res.cloudinary.com/dbcpfy04c/image/upload/v1747766077/pin_5_6_s8qiiq.webp,concrete-tips,,https://www.beacleaner.com/how-to-clean-mold-from-concrete-floor?utm_source=pinterest&utm_campaign=moldy-concrete-dont-,2025-05-20,Finding mold on your concrete floor can be alarming,but don't panic! This guide offers a clear
Healthy Home: Mold-Free Floors,https://res.cloudinary.com/dbcpfy04c/image/upload/v1747766085/pin_5_7_clbtwp.webp,healthy-home-tips,,https://www.beacleaner.com/how-to-clean-mold-from-concrete-floor?utm_source=pinterest&utm_campaign=healthy-home-mold-fr,2025-05-20,Your home should be a sanctuary,not a breeding ground for mold.  Learn how to eliminate mold from your concrete floors and create a healthier living environment for you and your family.  This guide provides practical tips and proven methods.  Invest in your well-being – start cleaning today! #HealthyLiving #MoldFree #ConcreteFloorCleaning #HomeWellness
Concrete Mold: Causes & Cures,https://res.cloudinary.com/dbcpfy04c/image/upload/v1747766092/pin_5_8_jyyiqu.webp,home-repair-tips,,https://www.beacleaner.com/how-to-clean-mold-from-concrete-floor?utm_source=pinterest&utm_campaign=concrete-mold-causes,2025-05-20,Understand why mold grows on concrete and how to get rid of it! This post explores the root causes of mold growth and provides effective cleaning solutions.  We'll help you prevent future outbreaks and maintain a clean,healthy home.  Knowledge is power – read the guide now! #MoldCauses #ConcreteSolutions #HomeTips #MoldRemedy
The Ultimate Concrete Mold Guide,https://res.cloudinary.com/dbcpfy04c/image/upload/v1747766100/pin_5_9_bkf8bh.webp,concrete-crafts-ideas,,https://www.beacleaner.com/how-to-clean-mold-from-concrete-floor?utm_source=pinterest&utm_campaign=the-ultimate-concret,2025-05-20,Everything you need to know about cleaning mold from concrete floors,all in one place! This ultimate guide covers identification
Mold Removal: Step-by-Step,https://res.cloudinary.com/dbcpfy04c/image/upload/v1747766107/pin_5_10_qfvb7w.webp,mold-removal-tips,,https://www.beacleaner.com/how-to-clean-mold-from-concrete-floor?utm_source=pinterest&utm_campaign=mold-removal-step-by,2025-05-20,Follow our easy-to-follow,step-by-step guide to cleaning mold from concrete floors.  We'll break down the process into manageable tasks
Mold & Concrete: What You Need,https://res.cloudinary.com/dbcpfy04c/image/upload/v1747766114/pin_5_11_i6q6zb.webp,concrete-cleaning-tips,,https://www.beacleaner.com/how-to-clean-mold-from-concrete-floor?utm_source=pinterest&utm_campaign=mold-concrete-what-y,2025-05-20,Before you start cleaning,make sure you have the right tools and supplies! This post lists everything you'll need to effectively remove mold from concrete floors.  Be prepared and get the job done efficiently. Click to see the checklist! #CleaningSupplies #MoldTools #ConcretePrep #HomeEssentials
DIY Concrete Cleaning Power!,https://res.cloudinary.com/dbcpfy04c/image/upload/v1747766120/pin_5_12_yjrrem.webp,concrete-cleaning-tips,,https://www.beacleaner.com/how-to-clean-mold-from-concrete-floor?utm_source=pinterest&utm_campaign=diy-concrete-cleanin,2025-05-20,Unlock the power of DIY cleaning! This guide provides effective,homemade solutions for removing mold from concrete floors.  Skip the harsh chemicals and embrace natural cleaning.  A clean home
Mold on Concrete: A Checklist,https://res.cloudinary.com/dbcpfy04c/image/upload/v1747766127/pin_5_13_nwxmaf.webp,home-cleaning-tips,,https://www.beacleaner.com/how-to-clean-mold-from-concrete-floor?utm_source=pinterest&utm_campaign=mold-on-concrete-a-c,2025-05-20,Don't miss a step! This checklist ensures you cover all the bases when cleaning mold from concrete floors.  From preparation to disinfection,we've got you covered.  Stay organized and get the job done right. Click to download the checklist! #CleaningChecklist #MoldPrep #ConcreteGuide #HomeOrganization
Reclaim Your Space: Mold Free!,https://res.cloudinary.com/dbcpfy04c/image/upload/v1747766134/pin_5_14_oi5lte.webp,cleaning-tips,,https://www.beacleaner.com/how-to-clean-mold-from-concrete-floor?utm_source=pinterest&utm_campaign=reclaim-your-space-m,2025-05-20,Don't let mold control your home. Reclaim your space and create a healthy,"inviting environment by effectively cleaning mold from your concrete floors.  You deserve a clean and comfortable home! Click to read. #ReclaimYourSpace #MoldFreeHome #ConcreteCleaning #HomeComfort"""
