Title,Media URL,Pinterest board,Thumbnail,Link,Publish date,Description,Keywords
Gutter Guard Cleaning: Seasonal Tips,https://res.cloudinary.com/dbcpfy04c/image/upload/v1748402447/pin_2_16_xnhrbi.webp,home-maintenance-tips,,https://www.beacleaner.com/how-to-clean-gutter-guards?utm_source=pinterest&utm_campaign=gutter-guard-cleanin,2025-05-28,Keep your gutter guards clean year-round! This pin provides seasonal tips for maintaining your system. From spring cleanup to fall preparation,we've got you covered. Protect your home from the elements with our expert advice. Click to read now and stay ahead of the curve!
Gutter Guard Cleaning: For Every Home Type,https://res.cloudinary.com/dbcpfy04c/image/upload/v1748402453/pin_2_17_haypmv.webp,home-maintenance-tips,,https://www.beacleaner.com/how-to-clean-gutter-guards?utm_source=pinterest&utm_campaign=gutter-guard-cleanin,2025-05-28,No matter your home's style,clean gutter guards are essential. This pin highlights the importance of maintenance for all types of properties. Our blog post provides a universal guide to cleaning and protecting your home. Click to read now and safeguard your investment!
Gutter Guard Cleaning: Save Time & Money,https://res.cloudinary.com/dbcpfy04c/image/upload/v1748402459/pin_2_18_n73j5v.webp,home-maintenance-tips,,https://www.beacleaner.com/how-to-clean-gutter-guards?utm_source=pinterest&utm_campaign=gutter-guard-cleanin,2025-05-28,Stop wasting money on professional cleaning services! This pin emphasizes the cost-saving benefits of DIY gutter guard cleaning. Our blog post provides a simple,effective guide to tackling the job yourself. Click to read now and take control of your home maintenance!
Gutter Guard Cleaning: A Beginner's Guide,https://res.cloudinary.com/dbcpfy04c/image/upload/v1748402465/pin_2_19_y8zknq.webp,home-maintenance-tips,,https://www.beacleaner.com/how-to-clean-gutter-guards?utm_source=pinterest&utm_campaign=gutter-guard-cleanin,2025-05-28,New to gutter guard cleaning? This pin offers a friendly and accessible guide for beginners. Our blog post breaks down the process into manageable steps,making it easy for anyone to follow. Click to read now and gain confidence in your home maintenance skills!
Gutter Guard Cleaning: Protect Your Landscaping,https://res.cloudinary.com/dbcpfy04c/image/upload/v1748402471/pin_2_20_yhkruh.webp,home-maintenance-tips,,https://www.beacleaner.com/how-to-clean-gutter-guards?utm_source=pinterest&utm_campaign=gutter-guard-cleanin,2025-05-28,Clogged gutters can damage your landscaping. This pin highlights the importance of clean gutter guards for protecting your plants and garden. Prevent erosion and water damage with our easy-to-follow cleaning guide. Click to read now and keep your yard looking beautiful!,landscaping protection
Gutter Guard Cleaning: The Right Way,https://res.cloudinary.com/dbcpfy04c/image/upload/v1748402480/pin_2_21_mbr9cp.webp,home-maintenance-tips,,https://www.beacleaner.com/how-to-clean-gutter-guards?utm_source=pinterest&utm_campaign=gutter-guard-cleanin,2025-05-28,There's a right way and a wrong way to clean gutter guards. This pin emphasizes the importance of proper techniques. Our blog post provides expert advice on avoiding damage and ensuring optimal performance. Click to read now and clean your gutter guards the right way!,proper techniques
Gutter Guard Cleaning: Don't Ignore This!,https://res.cloudinary.com/dbcpfy04c/image/upload/v1748402489/pin_2_22_cjzl3s.webp,home-maintenance-tips,,https://www.beacleaner.com/how-to-clean-gutter-guards?utm_source=pinterest&utm_campaign=gutter-guard-cleanin,2025-05-28,Ignoring your gutter guards can lead to serious problems. This pin serves as a reminder to prioritize regular maintenance. Our blog post provides a comprehensive guide to cleaning and protecting your home. Click to read now and avoid costly repairs!,urgent maintenance
Gutter Guard Cleaning: A Visual Guide,https://res.cloudinary.com/dbcpfy04c/image/upload/v1748402495/pin_2_23_l0o1xw.webp,home-maintenance-tips,,https://www.beacleaner.com/how-to-clean-gutter-guards?utm_source=pinterest&utm_campaign=gutter-guard-cleanin,2025-05-28,Sometimes,seeing is believing! This pin features a series of images illustrating the gutter guard cleaning process. Our blog post provides a visual guide to help you understand each step. Click to read now and learn by example!
Gutter Guard Cleaning: Get It Done Today!,https://res.cloudinary.com/dbcpfy04c/image/upload/v1748402501/pin_2_24_assote.webp,home-maintenance-tips,,https://www.beacleaner.com/how-to-clean-gutter-guards?utm_source=pinterest&utm_campaign=gutter-guard-cleanin,2025-05-28,Don't put it off any longer! This pin encourages immediate action. Our blog post provides a simple,effective guide to cleaning your gutter guards. Click to read now and protect your home today!
Gutter Guard Cleaning: Your Home Will Thank You,https://res.cloudinary.com/dbcpfy04c/image/upload/v1748402507/pin_2_25_rdbdl0.webp,home-maintenance-tips,,https://www.beacleaner.com/how-to-clean-gutter-guards?utm_source=pinterest&utm_campaign=gutter-guard-cleanin,2025-05-28,Show your home some love! This pin appeals to the emotional connection homeowners have with their properties. Our blog post provides a guide to maintaining your home's protection. Click to read now and keep your home happy and healthy!,home love
Title,https://res.cloudinary.com/dbcpfy04c/image/upload/v1748402549/pin_3_1_piouyv.webp,please-provide-the-title-and-keywords-i-need-that-information-to-suggest-a-board-name-once,,https://www.beacleaner.com/how-to-clean-gutters-with-a-pressure-washer?utm_source=pinterest&utm_campaign=title,2025-05-28,Description,Keywords
Gutter Cleaning Made EASY! 💦,https://res.cloudinary.com/dbcpfy04c/image/upload/v1748402558/pin_3_2_qtcin5.webp,home-maintenance-tips,,https://www.beacleaner.com/how-to-clean-gutters-with-a-pressure-washer?utm_source=pinterest&utm_campaign=gutter-cleaning-made,2025-05-28,"Tired of the messy, dangerous chore of gutter cleaning? This guide shows you how to safely and effectively clean your gutters with a pressure washer! Learn the right nozzles, safety precautions, and techniques to blast away leaves & debris. Protect your home from water damage & foundation issues. Don't risk a fall – clean smarter, not harder! Click to learn more and reclaim your weekends! ✨","Gutter Cleaning,Pressure Washer,Home Maintenance,DIY"
Pressure Washing Gutters: A Step-by-Step Guide,https://res.cloudinary.com/dbcpfy04c/image/upload/v1748402565/pin_3_3_dvh3tt.webp,home-repair-tips,,https://www.beacleaner.com/how-to-clean-gutters-with-a-pressure-washer?utm_source=pinterest&utm_campaign=pressure-washing-gut,2025-05-28,Don't let clogged gutters ruin your home's foundation! This detailed guide breaks down the process of cleaning gutters with a pressure washer into easy-to-follow steps. We cover everything from prepping your equipment to rinsing thoroughly.  Avoid costly repairs and keep your home protected.  Get a sparkling clean finish and peace of mind!  Read now for a hassle-free solution! 🏡,"Gutter Maintenance,Pressure Washing Tips,Home Repair,DIY Home"
Avoid Costly Repairs: Clean Gutters Now!,https://res.cloudinary.com/dbcpfy04c/image/upload/v1748402571/pin_3_4_mbhj9w.webp,home-maintenance-tips,,https://www.beacleaner.com/how-to-clean-gutters-with-a-pressure-washer?utm_source=pinterest&utm_campaign=avoid-costly-repairs,2025-05-28,"Ignoring your gutters can lead to serious (and expensive!) problems. This post reveals how a pressure washer can quickly and efficiently remove debris, preventing water damage, ice dams, and foundation issues.  Protect your investment and enjoy a worry-free home.  Learn the secrets to a clean, healthy home today! 💧","Home Protection,Gutter Problems,Pressure Washer Guide,Foundation Repair"
Is Pressure Washing Gutters Safe? 🤔,https://res.cloudinary.com/dbcpfy04c/image/upload/v1748402577/pin_3_5_c0z6vt.webp,home-cleaning-tips,,https://www.beacleaner.com/how-to-clean-gutters-with-a-pressure-washer?utm_source=pinterest&utm_campaign=is-pressure-washing-,2025-05-28,"Worried about damaging your gutters with a pressure washer? We address common concerns and provide expert tips for safe and effective cleaning. Learn about nozzle selection, pressure settings, and essential safety gear.  Protect your gutters *and* yourself!  Click to read our comprehensive guide and clean with confidence! 💪","Gutter Safety,Pressure Washer Safety,Home Improvement,DIY Cleaning"
DIY Gutter Cleaning: Save Money & Time!,https://res.cloudinary.com/dbcpfy04c/image/upload/v1748402587/pin_3_6_p3tjrg.webp,home-maintenance-tips,,https://www.beacleaner.com/how-to-clean-gutters-with-a-pressure-washer?utm_source=pinterest&utm_campaign=diy-gutter-cleaning-,2025-05-28,"Stop paying professionals! This guide empowers you to clean your gutters yourself with a pressure washer, saving you time and money. We provide a complete breakdown of the process, from start to finish.  Enjoy the satisfaction of a job well done and a beautifully maintained home.  Start saving today! 💰","DIY Projects,Save Money,Gutter Cleaning Tips,Home Ownership"
The BEST Pressure Washer Nozzle for Gutters,https://res.cloudinary.com/dbcpfy04c/image/upload/v1748402593/pin_3_7_euyr1h.webp,home-cleaning-tips,,https://www.beacleaner.com/how-to-clean-gutters-with-a-pressure-washer?utm_source=pinterest&utm_campaign=the-best-pressure-wa,2025-05-28,Choosing the right nozzle is crucial for effective (and safe!) gutter cleaning. This post reveals the best nozzle types for different gutter materials and debris levels.  Avoid damage and achieve a professional-level clean.  Get the right tools for the job and make gutter cleaning a breeze! 🛠️,"Pressure Washer Nozzles,Gutter Cleaning Tools,Home Equipment,DIY Guide"
Gutter Cleaning Checklist: Don't Miss a Step!,https://res.cloudinary.com/dbcpfy04c/image/upload/v1748402600/pin_3_8_jwi6sy.webp,home-maintenance-tips,,https://www.beacleaner.com/how-to-clean-gutters-with-a-pressure-washer?utm_source=pinterest&utm_campaign=gutter-cleaning-chec,2025-05-28,"Ensure a thorough gutter cleaning with our handy checklist! This guide walks you through every step of the process, from preparation to final inspection.  Don't overlook a single detail – protect your home from water damage.  Download the checklist and get cleaning! ✅","Gutter Checklist,Cleaning Schedule,Home Maintenance Tips,Preventative Maintenance"
Pressure Washing Gutters: Before & After!,https://res.cloudinary.com/dbcpfy04c/image/upload/v1748402608/pin_3_9_wqdgmf.webp,home-repair-tips,,https://www.beacleaner.com/how-to-clean-gutters-with-a-pressure-washer?utm_source=pinterest&utm_campaign=pressure-washing-gut,2025-05-28,See the dramatic difference a pressure washer can make! This post features stunning before & after photos of gutter cleaning projects.  Get inspired and see how easy it is to restore your gutters to their former glory.  Transform your home's exterior today! ✨,"Before and After,Gutter Transformation,Pressure Washing Results,Home Exterior"
Protect Your Foundation: Clean Gutters!,https://res.cloudinary.com/dbcpfy04c/image/upload/v1748402614/pin_3_10_px6q9r.webp,home-maintenance-tips,,https://www.beacleaner.com/how-to-clean-gutters-with-a-pressure-washer?utm_source=pinterest&utm_campaign=protect-your-foundat,2025-05-28,Your foundation is the backbone of your home. Clogged gutters can lead to water damage and costly foundation repairs.  Learn how to prevent these issues by regularly cleaning your gutters with a pressure washer.  Invest in your home's long-term health! 🏠,"Foundation Protection,Water Damage Prevention,Gutter Care,Home Investment"
Gutter Cleaning for Beginners: A Simple Guide,https://res.cloudinary.com/dbcpfy04c/image/upload/v1748402623/pin_3_11_ekxyvb.webp,home-maintenance-tips,,https://www.beacleaner.com/how-to-clean-gutters-with-a-pressure-washer?utm_source=pinterest&utm_campaign=gutter-cleaning-for-,2025-05-28,"New to gutter cleaning? No problem! This guide provides a simple, step-by-step introduction to cleaning gutters with a pressure washer.  We cover everything you need to know, from safety precautions to essential techniques.  Get started today and enjoy a cleaner, healthier home! 🌱","Beginner's Guide,Gutter Cleaning 101,Pressure Washer Basics,DIY for Beginners"
Extend Your Home's Life: Clean Your Gutters!,https://res.cloudinary.com/dbcpfy04c/image/upload/v1748402629/pin_3_12_jfgbvh.webp,home-maintenance-tips,,https://www.beacleaner.com/how-to-clean-gutters-with-a-pressure-washer?utm_source=pinterest&utm_campaign=extend-your-homes-li,2025-05-28,"Regular gutter cleaning is a vital part of home maintenance. This post explains how a pressure washer can help you extend your home's life by preventing water damage and structural issues.  Protect your investment and enjoy a beautiful, well-maintained home for years to come. ⏳","Home Longevity,Preventative Maintenance,Gutter Health,Home Value"
The Ultimate Gutter Cleaning Hack! 💡,https://res.cloudinary.com/dbcpfy04c/image/upload/v1748402635/pin_3_13_arlsip.webp,home-maintenance-tips,,https://www.beacleaner.com/how-to-clean-gutters-with-a-pressure-washer?utm_source=pinterest&utm_campaign=the-ultimate-gutter-,2025-05-28,"Discover the secret to effortless gutter cleaning! This post reveals a game-changing hack using a pressure washer to quickly and effectively remove debris.  Save time, energy, and back pain!  Try this simple trick and see the results for yourself.  Click to learn more!","Gutter Hack,Cleaning Tips,Pressure Washer Tricks,Home Improvement Hacks"
Don't Let Leaves Win! Clean Gutters Now!,https://res.cloudinary.com/dbcpfy04c/image/upload/v1748402642/pin_3_14_h0f39b.webp,home-maintenance-tips,,https://www.beacleaner.com/how-to-clean-gutters-with-a-pressure-washer?utm_source=pinterest&utm_campaign=dont-let-leaves-win-,2025-05-28,Fall leaves can wreak havoc on your gutters. This post shows you how to combat the autumn mess with a pressure washer.  Keep your gutters clear and prevent clogs that can lead to water damage.  Take control of your home's maintenance today! 🍂,"Fall Cleaning,Leaf Removal,Gutter Protection,Seasonal Maintenance"
Pressure Washer Gutter Cleaning: Common Mistakes,https://res.cloudinary.com/dbcpfy04c/image/upload/v1748402650/pin_3_15_cais0i.webp,home-maintenance-tips,,https://www.beacleaner.com/how-to-clean-gutters-with-a-pressure-washer?utm_source=pinterest&utm_campaign=pressure-washer-gutt,2025-05-28,Avoid these common mistakes when cleaning gutters with a pressure washer! This post highlights potential pitfalls and provides expert advice to ensure a safe and effective cleaning.  Learn from our mistakes and achieve a professional-level clean. ⚠️,"Gutter Cleaning Mistakes,Pressure Washer Errors,Safety Tips,DIY Advice"
Gutter Guards vs. Pressure Washing: Which is Best?,https://res.cloudinary.com/dbcpfy04c/image/upload/v1748402656/pin_3_16_ghb95d.webp,home-maintenance-tips,,https://www.beacleaner.com/how-to-clean-gutters-with-a-pressure-washer?utm_source=pinterest&utm_campaign=gutter-guards-vs-pre,2025-05-28,"Should you invest in gutter guards or regularly pressure wash your gutters? This post compares the pros and cons of each method, helping you choose the best solution for your home.  Make an informed decision and protect your investment. 🤔","Gutter Guards,Pressure Washing Comparison,Home Maintenance Solutions,Cost Analysis"
Gutter Cleaning: A Weekend Project You'll Love!,https://res.cloudinary.com/dbcpfy04c/image/upload/v1748402662/pin_3_17_zkrelr.webp,home-maintenance-tips,,https://www.beacleaner.com/how-to-clean-gutters-with-a-pressure-washer?utm_source=pinterest&utm_campaign=gutter-cleaning-a-we,2025-05-28,"Turn a dreaded chore into a satisfying weekend project! This post makes gutter cleaning with a pressure washer seem manageable and even enjoyable.  Enjoy the fresh air, the sense of accomplishment, and a beautifully maintained home. ☀️","Weekend Project,DIY Satisfaction,Home Improvement Fun,Gutter Cleaning Motivation"
Pressure Washing Gutters: What You Need to Know,https://res.cloudinary.com/dbcpfy04c/image/upload/v1748402667/pin_3_18_qblkuu.webp,home-repair-tips,,https://www.beacleaner.com/how-to-clean-gutters-with-a-pressure-washer?utm_source=pinterest&utm_campaign=pressure-washing-gut,2025-05-28,"Everything you need to know about pressure washing gutters in one place! This comprehensive guide covers equipment, techniques, safety precautions, and more.  Become a gutter cleaning pro and protect your home. 📚","Gutter Cleaning Guide,Pressure Washer Information,Home Maintenance Resources,DIY Knowledge"
Say Goodbye to Clogged Gutters Forever! 👋,https://res.cloudinary.com/dbcpfy04c/image/upload/v1748402674/pin_3_19_scihlb.webp,cleaning-tips,,https://www.beacleaner.com/how-to-clean-gutters-with-a-pressure-washer?utm_source=pinterest&utm_campaign=say-goodbye-to-clogg,2025-05-28,Tired of constantly dealing with clogged gutters? This post shows you how to use a pressure washer to keep your gutters clear and functioning properly.  Enjoy a worry-free home and say goodbye to the hassle of clogged gutters.  Click to learn more!,"Clogged Gutters,Gutter Solutions,Pressure Washing Benefits,Homeowner Problems"
Protect Your Home From Ice Dams: Clean Gutters!,https://res.cloudinary.com/dbcpfy04c/image/upload/v1748402681/pin_3_20_omzgng.webp,winter-home-tips,,https://www.beacleaner.com/how-to-clean-gutters-with-a-pressure-washer?utm_source=pinterest&utm_campaign=protect-your-home-fr,2025-05-28,Ice dams can cause serious damage to your roof and gutters. This post explains how regular gutter cleaning with a pressure washer can help prevent ice dam formation.  Protect your home from winter weather and avoid costly repairs. ❄️,"Ice Dam Prevention,Winter Home Maintenance,Gutter Cleaning for Winter,Roof Protection"
"Gutter Cleaning: A Small Task, Big Impact!",https://res.cloudinary.com/dbcpfy04c/image/upload/v1748402689/pin_3_21_c0x49z.webp,home-maintenance-tips,,https://www.beacleaner.com/how-to-clean-gutters-with-a-pressure-washer?utm_source=pinterest&utm_campaign=gutter-cleaning-a-sm,2025-05-28,Don't underestimate the importance of gutter cleaning! This post highlights the significant impact clean gutters can have on your home's health and longevity.  Protect your investment and enjoy a worry-free home.  Start cleaning today! 🌟,"Home Value,Preventative Care,Gutter Importance,Long-Term Savings"
Pressure Washing Gutters: Expert Tips & Tricks,https://res.cloudinary.com/dbcpfy04c/image/upload/v1748402696/pin_3_22_v40qhw.webp,home-repair-tips,,https://www.beacleaner.com/how-to-clean-gutters-with-a-pressure-washer?utm_source=pinterest&utm_campaign=pressure-washing-gut,2025-05-28,Unlock the secrets to professional-level gutter cleaning! This post shares expert tips and tricks for using a pressure washer to achieve a sparkling clean finish.  Impress your neighbors and protect your home. 🏆,"Expert Tips,Gutter Cleaning Secrets,Pressure Washing Techniques,Professional Results"
Gutter Cleaning: Is it Worth the Effort?,https://res.cloudinary.com/dbcpfy04c/image/upload/v1748402704/pin_3_23_zrhzfb.webp,home-maintenance-tips,,https://www.beacleaner.com/how-to-clean-gutters-with-a-pressure-washer?utm_source=pinterest&utm_campaign=gutter-cleaning-is-i,2025-05-28,We answer the question: is gutter cleaning *really* worth the effort? This post outlines the benefits of clean gutters and demonstrates how a pressure washer can make the task quick and easy.  Make an informed decision and protect your home. ✅,"Gutter Cleaning Benefits,Time Savings,Home Protection,DIY Value"
From Messy to Magnificent: Gutter Cleaning Results!,https://res.cloudinary.com/dbcpfy04c/image/upload/v1748402713/pin_3_24_s6rvrf.webp,home-exterior-ideas,,https://www.beacleaner.com/how-to-clean-gutters-with-a-pressure-washer?utm_source=pinterest&utm_campaign=from-messy-to-magnif,2025-05-28,Witness the incredible transformation! This post showcases stunning before & after photos of gutter cleaning projects using a pressure washer.  Get inspired and see the power of a clean gutter system. ✨,"Gutter Transformation,Pressure Washing Power,Home Exterior Cleaning,Visual Results"
Easy Gutter Cleaning: A Pressure Washer Tutorial,https://res.cloudinary.com/dbcpfy04c/image/upload/v1748402720/pin_3_25_kxbsug.webp,home-maintenance-tips,,https://www.beacleaner.com/how-to-clean-gutters-with-a-pressure-washer?utm_source=pinterest&utm_campaign=easy-gutter-cleaning,2025-05-28,Learn how to clean your gutters like a pro with our easy-to-follow pressure washer tutorial! This post provides clear instructions and helpful visuals to guide you through the process.  Get cleaning today! 🎬,"Gutter Tutorial,Pressure Washer Guide,DIY Video,Step-by-Step Instructions"
Title,https://res.cloudinary.com/dbcpfy04c/image/upload/v1748402761/pin_4_1_s6dk6i.webp,please-provide-the-title-and-keywords-i-need-that-information-to-suggest-a-board-name-once,,https://www.beacleaner.com/how-to-clean-in-between-2-window-panes?utm_source=pinterest&utm_campaign=title,2025-05-28,Description,Keywords
Title,https://res.cloudinary.com/dbcpfy04c/image/upload/v1748402807/pin_5_1_dsdsdb.webp,please-provide-the-title-and-keywords-i-need-that-information-to-suggest-a-board-name-once,,https://www.beacleaner.com/how-to-clean-in-between-sliding-glass-doors?utm_source=pinterest&utm_campaign=title,2025-05-28,Description,Keywords
Sparkling Clean Sliding Doors!,https://res.cloudinary.com/dbcpfy04c/image/upload/v1748402815/pin_5_2_sivdkh.webp,cleaning-tips,,https://www.beacleaner.com/how-to-clean-in-between-sliding-glass-doors?utm_source=pinterest&utm_campaign=sparkling-clean-slid,2025-05-28,“Is grime building up between your sliding glass doors? Don't let dirty tracks ruin your view! This guide reveals simple,effective methods to deep clean those hard-to-reach spaces
Say Goodbye to Grimy Tracks!,https://res.cloudinary.com/dbcpfy04c/image/upload/v1748402821/pin_5_3_opk7wb.webp,cleaning-tips,,https://www.beacleaner.com/how-to-clean-in-between-sliding-glass-doors?utm_source=pinterest&utm_campaign=say-goodbye-to-grimy,2025-05-28,“Ugh,those dirty sliding door tracks! They're a magnet for dust
DIY Sliding Door Cleaner,https://res.cloudinary.com/dbcpfy04c/image/upload/v1748402828/pin_5_4_dcee1k.webp,cleaning-tips,,https://www.beacleaner.com/how-to-clean-in-between-sliding-glass-doors?utm_source=pinterest&utm_campaign=diy-sliding-door-cle,2025-05-28,“Skip the expensive cleaners! This blog post shows you how to create a powerful,yet gentle
Sliding Doors: Before & After!,https://res.cloudinary.com/dbcpfy04c/image/upload/v1748402837/pin_5_5_qu6eia.webp,home-cleaning-tips,,https://www.beacleaner.com/how-to-clean-in-between-sliding-glass-doors?utm_source=pinterest&utm_campaign=sliding-doors-before,2025-05-28,“Witness the transformation! This post features stunning before-and-after photos of dirty sliding glass doors being restored to their former glory.  See the incredible difference a little elbow grease (and our guide!) can make.  Feeling inspired?  Click to learn how to achieve these results in your own home! #BeforeAndAfter #CleaningMotivation #SlidingGlassDoorCleaning #HomeImprovement”,"before and after,cleaning motivation,sliding glass door cleaning,home improvement"
Fix Sticky Sliding Doors!,https://res.cloudinary.com/dbcpfy04c/image/upload/v1748402843/pin_5_6_e9pfbq.webp,home-repair-tips,,https://www.beacleaner.com/how-to-clean-in-between-sliding-glass-doors?utm_source=pinterest&utm_campaign=fix-sticky-sliding-d,2025-05-28,“Are your sliding glass doors stuck or difficult to move?  Dirt and grime in the tracks are often the culprit! This guide not only shows you how to clean them but also how to troubleshoot common issues that cause sticking.  Enjoy smooth,effortless gliding again! Click to learn how! #StickySlidingDoors #SlidingDoorRepair #HomeFixes #CleaningTips”
The Ultimate Sliding Door Guide,https://res.cloudinary.com/dbcpfy04c/image/upload/v1748402852/pin_5_7_izpyyc.webp,sliding-door-ideas,,https://www.beacleaner.com/how-to-clean-in-between-sliding-glass-doors?utm_source=pinterest&utm_campaign=the-ultimate-sliding,2025-05-28,“Everything you need to know about cleaning and maintaining your sliding glass doors is right here! From daily quick cleans to deep cleaning schedules,we cover it all.  Protect your investment and enjoy a beautiful
Clean Sliding Doors in 5 Steps,https://res.cloudinary.com/dbcpfy04c/image/upload/v1748402859/pin_5_8_tshlsp.webp,cleaning-tips,,https://www.beacleaner.com/how-to-clean-in-between-sliding-glass-doors?utm_source=pinterest&utm_campaign=clean-sliding-doors-,2025-05-28,“Overwhelmed by the thought of cleaning your sliding glass doors? Don't be! This post breaks down the process into just 5 simple steps.  You'll be amazed at how quickly you can achieve a sparkling clean result.  Click to learn the easy method! #5StepCleaning #QuickCleaning #SlidingDoors #EasyHomeCleaning”,"5 step cleaning,quick cleaning,sliding doors,easy home cleaning"
Best Tools for Sliding Door Cleaning,https://res.cloudinary.com/dbcpfy04c/image/upload/v1748402865/pin_5_9_jfiksg.webp,cleaning-tips,,https://www.beacleaner.com/how-to-clean-in-between-sliding-glass-doors?utm_source=pinterest&utm_campaign=best-tools-for-slidi,2025-05-28,“Don't struggle with the wrong tools! This post reviews the best brushes,vacuums
