Title,Media URL,Pinterest board,Thumbnail,Link,Publish date,Description,Keywords
Winix Air Purifier: Before & After,https://res.cloudinary.com/dbcpfy04c/image/upload/v1747923874/pin_3_7_l8azxm.webp,air-purifier-tips,,https://www.beacleaner.com/how-to-clean-winix-air-purifier?utm_source=pinterest&utm_campaign=winix-air-purifier-b,2025-05-22,See the difference a clean Winix can make! This pin showcases a dramatic before-and-after comparison,demonstrating the impact of regular cleaning.  Don't let dust and grime build up – restore your air purifier to its former glory.  Click to see the transformation and learn how! #WinixBeforeAfter #AirPurifierResults #CleaningMotivation #VisibleDifference
Winix Air Purifier: Pet Owner's Guide,https://res.cloudinary.com/dbcpfy04c/image/upload/v1747923879/pin_3_8_iq9gev.webp,air-purifier-tips,,https://www.beacleaner.com/how-to-clean-winix-air-purifier?utm_source=pinterest&utm_campaign=winix-air-purifier-p,2025-05-22,Pet owners,rejoice! This pin provides specific cleaning tips for Winix air purifiers in homes with pets.  Remove pet dander
Winix Air Purifier: DIY Cleaning Solutions,https://res.cloudinary.com/dbcpfy04c/image/upload/v1747923886/pin_3_9_nximcs.webp,air-purifier-tips,,https://www.beacleaner.com/how-to-clean-winix-air-purifier?utm_source=pinterest&utm_campaign=winix-air-purifier-d,2025-05-22,Skip the harsh chemicals! This pin offers DIY cleaning solutions for your Winix air purifier,using natural and effective ingredients.  Protect your health and the environment while keeping your air purifier clean.  Click to discover our eco-friendly cleaning tips! #WinixDIY #NaturalCleaning #EcoFriendly #NonToxicCleaning
Winix Air Purifier: Bedroom Air Quality,https://res.cloudinary.com/dbcpfy04c/image/upload/v1747923892/pin_3_10_uctqw8.webp,air-purifier-tips,,https://www.beacleaner.com/how-to-clean-winix-air-purifier?utm_source=pinterest&utm_campaign=winix-air-purifier-b,2025-05-22,Improve your sleep with cleaner air! This pin focuses on the benefits of using a Winix air purifier in the bedroom.  Reduce allergens,dust
Winix Air Purifier: Long-Term Benefits,https://res.cloudinary.com/dbcpfy04c/image/upload/v1747923897/pin_3_11_bxxwha.webp,air-purifier-tips,,https://www.beacleaner.com/how-to-clean-winix-air-purifier?utm_source=pinterest&utm_campaign=winix-air-purifier-l,2025-05-22,Invest in your health! This pin emphasizes the long-term health benefits of using a Winix air purifier.  Reduce allergies,asthma symptoms
Winix Air Purifier: Easy Maintenance,https://res.cloudinary.com/dbcpfy04c/image/upload/v1747923905/pin_3_12_inehka.webp,air-purifier-tips,,https://www.beacleaner.com/how-to-clean-winix-air-purifier?utm_source=pinterest&utm_campaign=winix-air-purifier-e,2025-05-22,Don't let maintenance intimidate you! This pin showcases how easy it is to maintain your Winix air purifier.  Simple steps for a cleaner,healthier home. Click to learn more! #WinixEasyMaintenance #SimpleCleaning #HomeCare #EasyToUse
Title,https://res.cloudinary.com/dbcpfy04c/image/upload/v1747923948/pin_4_1_jhldiz.webp,please-provide-the-title-and-keywords-i-need-that-information-to-suggest-a-board-name-once,,https://www.beacleaner.com/how-to-clean-zinsser-bin-off-brushes?utm_source=pinterest&utm_campaign=title,2025-05-22,Description,Keywords
Zinsser BIN Brush Cleaning: The EASY Way!,https://res.cloudinary.com/dbcpfy04c/image/upload/v1747923954/pin_4_2_mfbnrb.webp,painting-tips,,https://www.beacleaner.com/how-to-clean-zinsser-bin-off-brushes?utm_source=pinterest&utm_campaign=zinsser-bin-brush-cl,2025-05-22,“Don't throw away those expensive brushes! Learn the *fastest* and most effective way to clean Zinsser BIN shellac primer off your brushes. This guide saves you money & frustration,"ensuring your brushes last for years. We cover everything from the right solvents to proper drying techniques. Stop struggling & start saving! Click to learn how to revive your brushes and get back to painting. A clean brush means a flawless finish!"""
Save Your Brushes! BIN Cleaning Guide,https://res.cloudinary.com/dbcpfy04c/image/upload/v1747923960/pin_4_3_pxbdre.webp,brush-cleaning-tips,,https://www.beacleaner.com/how-to-clean-zinsser-bin-off-brushes?utm_source=pinterest&utm_campaign=save-your-brushes-bi,2025-05-22,“Is Zinsser BIN stuck fast in your brushes? You're not alone! This step-by-step guide will show you how to completely remove BIN shellac primer,restoring your brushes to like-new condition. Avoid damaging bristles and wasting money on replacements. We'll reveal the secrets to a thorough clean
BIN Brush Cleaning: Don't Make These Mistakes!,https://res.cloudinary.com/dbcpfy04c/image/upload/v1747923966/pin_4_4_b3tvsf.webp,cleaning-tips,,https://www.beacleaner.com/how-to-clean-zinsser-bin-off-brushes?utm_source=pinterest&utm_campaign=bin-brush-cleaning-d,2025-05-22,“Cleaning Zinsser BIN can be tricky! Avoid common mistakes that ruin your brushes and waste your time. This guide highlights the *do's and don'ts* of BIN brush cleaning,ensuring a perfect result every time. Learn which solvents work best
Zinsser BIN: The Ultimate Brush Rescue,https://res.cloudinary.com/dbcpfy04c/image/upload/v1747923973/pin_4_5_bxy8uz.webp,painting-tips,,https://www.beacleaner.com/how-to-clean-zinsser-bin-off-brushes?utm_source=pinterest&utm_campaign=zinsser-bin-the-ulti,2025-05-22,“Feeling defeated by dried Zinsser BIN? Don't give up on your brushes yet! This guide provides a comprehensive solution for reviving even the most stubborn BIN residue. We'll walk you through the entire process,"from initial solvent soak to final brush conditioning. Get back to painting with confidence and enjoy beautifully clean brushes. Click to learn the ultimate brush rescue technique!"""
Clean BIN Brushes Like a PRO!,https://res.cloudinary.com/dbcpfy04c/image/upload/v1747923981/pin_4_6_lppgcv.webp,cleaning-tips,,https://www.beacleaner.com/how-to-clean-zinsser-bin-off-brushes?utm_source=pinterest&utm_campaign=clean-bin-brushes-li,2025-05-22,“Want to achieve a flawless paint finish? It starts with clean brushes! This guide teaches you how to clean Zinsser BIN shellac primer off your brushes like a professional painter. Learn the secrets to removing all traces of BIN,leaving your brushes soft
Fast & Easy BIN Brush Cleaning Hack,https://res.cloudinary.com/dbcpfy04c/image/upload/v1747923990/pin_4_7_avdv4e.webp,painting-tips,,https://www.beacleaner.com/how-to-clean-zinsser-bin-off-brushes?utm_source=pinterest&utm_campaign=fast-easy-bin-brush-,2025-05-22,“Short on time? This quick and easy hack will show you how to clean Zinsser BIN off your brushes in minutes! No more hours spent scrubbing and struggling. We'll reveal a simple technique that delivers amazing results,"saving you time and effort. Get back to your painting projects faster with this must-know hack. Click to learn the secret!"""
Zinsser BIN Brush Cleaning: Solvent Guide,https://res.cloudinary.com/dbcpfy04c/image/upload/v1747923995/pin_4_8_xntpmu.webp,painting-tips,,https://www.beacleaner.com/how-to-clean-zinsser-bin-off-brushes?utm_source=pinterest&utm_campaign=zinsser-bin-brush-cl,2025-05-22,“Confused about which solvent to use for cleaning Zinsser BIN? This guide breaks down the best options,explaining the pros and cons of each. Learn which solvents are most effective
Extend Brush Life: Cleaning BIN Properly,https://res.cloudinary.com/dbcpfy04c/image/upload/v1747924001/pin_4_9_qvrzm7.webp,brush-cleaning-tips,,https://www.beacleaner.com/how-to-clean-zinsser-bin-off-brushes?utm_source=pinterest&utm_campaign=extend-brush-life-cl,2025-05-22,“Your brushes are an investment! Learn how to clean Zinsser BIN shellac primer off your brushes properly to extend their lifespan. This guide provides detailed instructions on cleaning,conditioning
Zinsser BIN Brush Cleaning: Step-by-Step,https://res.cloudinary.com/dbcpfy04c/image/upload/v1747924006/pin_4_10_xunwbn.webp,painting-tips,,https://www.beacleaner.com/how-to-clean-zinsser-bin-off-brushes?utm_source=pinterest&utm_campaign=zinsser-bin-brush-cl,2025-05-22,“Need a clear,step-by-step guide to cleaning Zinsser BIN off your brushes? Look no further! This guide provides easy-to-follow instructions with photos
The BEST Way to Clean BIN Brushes (Tested!),https://res.cloudinary.com/dbcpfy04c/image/upload/v1747924013/pin_4_11_jacs3p.webp,cleaning-tips,,https://www.beacleaner.com/how-to-clean-zinsser-bin-off-brushes?utm_source=pinterest&utm_campaign=the-best-way-to-clea,2025-05-22,“We've tested countless methods to find the *absolute best* way to clean Zinsser BIN off your brushes. This guide reveals our top-performing technique,"guaranteed to deliver amazing results. Stop wasting time on ineffective methods and start cleaning like a pro. Click to discover the secret!"""
Zinsser BIN Brush Cleaning: Drying Secrets,https://res.cloudinary.com/dbcpfy04c/image/upload/v1747924019/pin_4_12_ni5tdx.webp,painting-tips,,https://www.beacleaner.com/how-to-clean-zinsser-bin-off-brushes?utm_source=pinterest&utm_campaign=zinsser-bin-brush-cl,2025-05-22,“Proper drying is crucial for brush care! Learn the secrets to drying Zinsser BIN-cleaned brushes effectively,"preventing damage and ensuring they're ready for your next project. We'll cover the best drying techniques and storage solutions. Click to learn how to keep your brushes in top condition!"""
Don't Ruin Your Brushes! BIN Cleaning SOS,https://res.cloudinary.com/dbcpfy04c/image/upload/v1747924026/pin_4_13_xfylex.webp,art-cleaning-tips,,https://www.beacleaner.com/how-to-clean-zinsser-bin-off-brushes?utm_source=pinterest&utm_campaign=dont-ruin-your-brush,2025-05-22,“Panic mode? Dried BIN turning your brushes into rocks? Don't worry,"we've all been there! This guide is your SOS for reviving seemingly ruined brushes. Learn how to salvage your tools and get back to painting. Click to learn the rescue mission!"""
Zinsser BIN Brush Cleaning: Budget-Friendly,https://res.cloudinary.com/dbcpfy04c/image/upload/v1747924031/pin_4_14_dgs0vl.webp,painting-tips,,https://www.beacleaner.com/how-to-clean-zinsser-bin-off-brushes?utm_source=pinterest&utm_campaign=zinsser-bin-brush-cl,2025-05-22,“Cleaning Zinsser BIN doesn't have to break the bank! This guide reveals budget-friendly solutions for cleaning your brushes effectively. Learn how to use affordable solvents and techniques to achieve professional results without spending a fortune. Click to save money and clean your brushes!,"Budget Cleaning,BIN Cleaning,DIY Savings,Painting on a Budget"
Zinsser BIN Brush Cleaning: Before & After,https://res.cloudinary.com/dbcpfy04c/image/upload/v1747924038/pin_4_15_rln6vp.webp,painting-tips,,https://www.beacleaner.com/how-to-clean-zinsser-bin-off-brushes?utm_source=pinterest&utm_campaign=zinsser-bin-brush-cl,2025-05-22,“See the incredible results! This guide features stunning before & after photos of Zinsser BIN-cleaned brushes. Witness the transformation and learn how to achieve the same amazing results yourself. Click to be inspired and learn the cleaning secrets!,"Before and After,BIN Cleaning,Brush Restoration,Painting Inspiration"
Zinsser BIN Brush Cleaning: Troubleshooting,https://res.cloudinary.com/dbcpfy04c/image/upload/v1747924043/pin_4_16_gomvm8.webp,painting-tips,,https://www.beacleaner.com/how-to-clean-zinsser-bin-off-brushes?utm_source=pinterest&utm_campaign=zinsser-bin-brush-cl,2025-05-22,“Struggling with stubborn BIN residue? This guide tackles common troubleshooting issues,"providing solutions for even the most challenging cleaning scenarios. Learn how to overcome obstacles and achieve a perfectly clean brush. Click to solve your BIN cleaning problems!"""
The Ultimate Guide to BIN Brush Care,https://res.cloudinary.com/dbcpfy04c/image/upload/v1747924049/pin_4_17_t26yog.webp,brush-care-tips,,https://www.beacleaner.com/how-to-clean-zinsser-bin-off-brushes?utm_source=pinterest&utm_campaign=the-ultimate-guide-t,2025-05-22,“Everything you need to know about caring for your brushes after using Zinsser BIN! This comprehensive guide covers cleaning,conditioning
Zinsser BIN Brush Cleaning: For All Brush Types,https://res.cloudinary.com/dbcpfy04c/image/upload/v1747924055/pin_4_18_pddinn.webp,painting-tips,,https://www.beacleaner.com/how-to-clean-zinsser-bin-off-brushes?utm_source=pinterest&utm_campaign=zinsser-bin-brush-cl,2025-05-22,“Whether you use natural or synthetic brushes,this guide has you covered! Learn how to clean Zinsser BIN off *any* type of brush
Zinsser BIN Brush Cleaning: A Painter's Secret,https://res.cloudinary.com/dbcpfy04c/image/upload/v1747924061/pin_4_19_iwxkgs.webp,painting-tips,,https://www.beacleaner.com/how-to-clean-zinsser-bin-off-brushes?utm_source=pinterest&utm_campaign=zinsser-bin-brush-cl,2025-05-22,“Professional painters don't want you to know this! Learn the secret technique for cleaning Zinsser BIN off your brushes quickly and effectively. This insider tip will save you time,money
Zinsser BIN Brush Cleaning: Preventative Measures,https://res.cloudinary.com/dbcpfy04c/image/upload/v1747924067/pin_4_20_wzua3e.webp,painting-tips,,https://www.beacleaner.com/how-to-clean-zinsser-bin-off-brushes?utm_source=pinterest&utm_campaign=zinsser-bin-brush-cl,2025-05-22,“Don't wait until your brushes are a mess! This guide reveals preventative measures you can take to make cleaning Zinsser BIN easier. Learn how to protect your brushes during painting and minimize cleanup time. Click to simplify your painting process!,"Preventative Care,BIN Cleaning,Brush Protection,Painting Hacks"
Zinsser BIN Brush Cleaning: Eco-Friendly Options,https://res.cloudinary.com/dbcpfy04c/image/upload/v1747924072/pin_4_21_om1pl5.webp,painting-tips,,https://www.beacleaner.com/how-to-clean-zinsser-bin-off-brushes?utm_source=pinterest&utm_campaign=zinsser-bin-brush-cl,2025-05-22,“Looking for eco-friendly ways to clean Zinsser BIN off your brushes? This guide explores sustainable solvent options and techniques. Reduce your environmental impact without sacrificing cleaning power. Click to learn the green cleaning solutions!,"Eco-Friendly Cleaning,BIN Cleaning,Sustainable Painting,Green DIY"
Zinsser BIN Brush Cleaning: Q&A,https://res.cloudinary.com/dbcpfy04c/image/upload/v1747924079/pin_4_22_xahk5g.webp,painting-tips,,https://www.beacleaner.com/how-to-clean-zinsser-bin-off-brushes?utm_source=pinterest&utm_campaign=zinsser-bin-brush-cl,2025-05-22,“Got questions about cleaning Zinsser BIN off your brushes? This guide answers frequently asked questions,"providing clear and concise answers to your burning questions. Click to get the answers you need!"""
Zinsser BIN Brush Cleaning: Time-Saving Tips,https://res.cloudinary.com/dbcpfy04c/image/upload/v1747924086/pin_4_23_ifbzfh.webp,painting-tips,,https://www.beacleaner.com/how-to-clean-zinsser-bin-off-brushes?utm_source=pinterest&utm_campaign=zinsser-bin-brush-cl,2025-05-22,“Time is precious! This guide reveals time-saving tips for cleaning Zinsser BIN off your brushes,"allowing you to get back to your painting projects faster. Click to maximize your efficiency!"""
Zinsser BIN Brush Cleaning: The Complete Checklist,https://res.cloudinary.com/dbcpfy04c/image/upload/v1747924095/pin_4_24_acmgkb.webp,painting-tips,,https://www.beacleaner.com/how-to-clean-zinsser-bin-off-brushes?utm_source=pinterest&utm_campaign=zinsser-bin-brush-cl,2025-05-22,“Don't forget a step! This guide provides a complete checklist for cleaning Zinsser BIN off your brushes,"ensuring you don't miss anything. Click to follow the checklist and achieve perfect results!"""
Zinsser BIN Brush Cleaning: From Mess to Success!,https://res.cloudinary.com/dbcpfy04c/image/upload/v1747924102/pin_4_25_feotpz.webp,painting-tips,,https://www.beacleaner.com/how-to-clean-zinsser-bin-off-brushes?utm_source=pinterest&utm_campaign=zinsser-bin-brush-cl,2025-05-22,“Turn a messy cleanup into a successful brush restoration! This guide empowers you to tackle Zinsser BIN residue with confidence. Click to learn the techniques and achieve beautifully clean brushes!,"Brush Restoration,BIN Cleaning,DIY Success,Painting Confidence"
Title,https://res.cloudinary.com/dbcpfy04c/image/upload/v1747924147/pin_5_1_tzelsd.webp,please-provide-the-title-and-keywords-i-need-that-information-to-suggest-a-board-name-once,,https://www.beacleaner.com/how-to-steam-clean-car-seats?utm_source=pinterest&utm_campaign=title,2025-05-22,Description,Keywords
Bye-Bye Car Seat Stains!,https://res.cloudinary.com/dbcpfy04c/image/upload/v1747924154/pin_5_2_ov3fqm.webp,car-cleaning-tips,,https://www.beacleaner.com/how-to-steam-clean-car-seats?utm_source=pinterest&utm_campaign=bye-bye-car-seat-sta,2025-05-22,Is your car seat a disaster zone? Don't replace it – revive it! This guide shows you how to steam clean car seats like a pro,removing everything from spilled milk to muddy footprints.  We'll cover safety tips
Steam Clean Car Seats: Easy Guide,https://res.cloudinary.com/dbcpfy04c/image/upload/v1747924160/pin_5_3_zmfmob.webp,car-cleaning-tips,,https://www.beacleaner.com/how-to-steam-clean-car-seats?utm_source=pinterest&utm_campaign=steam-clean-car-seat,2025-05-22,Worried about harsh chemicals near your baby? Steam cleaning is a natural,effective way to sanitize and refresh your car seats. This post breaks down the process
Car Seat Deep Clean - Steam Power!,https://res.cloudinary.com/dbcpfy04c/image/upload/v1747924167/pin_5_4_yw7ftu.webp,car-cleaning-tips,,https://www.beacleaner.com/how-to-steam-clean-car-seats?utm_source=pinterest&utm_campaign=car-seat-deep-clean-,2025-05-22,Don't just wipe – *deep clean*!  This guide reveals the power of steam cleaning for car seats,eliminating hidden bacteria and allergens.  We'll show you how to choose the right steamer and avoid common mistakes.  Protect your little one from germs and enjoy a truly clean car interior.  Click to learn how to create a healthier environment for your family.  It's easier than you think! #CarSeatSafety #GermFree #SteamCleaner #AutoDetailing
DIY Car Seat Steam Clean - Save $!,https://res.cloudinary.com/dbcpfy04c/image/upload/v1747924173/pin_5_5_aefkts.webp,car-cleaning-tips,,https://www.beacleaner.com/how-to-steam-clean-car-seats?utm_source=pinterest&utm_campaign=diy-car-seat-steam-c,2025-05-22,Skip the expensive professional cleaning! This guide empowers you to steam clean your car seats at home,saving you time and money.  We'll provide a complete list of supplies and easy-to-follow instructions.  Enjoy a sparkling clean car seat without breaking the bank.  Click to learn how to become a car cleaning pro! #DIYCarCleaning #BudgetFriendly #CarMaintenance #HomeCleaning
Quick Car Seat Refresh: Steam Clean!,https://res.cloudinary.com/dbcpfy04c/image/upload/v1747924180/pin_5_6_bjzdxy.webp,car-cleaning-tips,,https://www.beacleaner.com/how-to-steam-clean-car-seats?utm_source=pinterest&utm_campaign=quick-car-seat-refre,2025-05-22,Short on time?  This guide offers a quick and effective steam cleaning method for car seats.  Perfect for busy parents!  We'll show you how to tackle light messes and freshen up your car interior in minutes.  Enjoy a cleaner,more pleasant ride without spending hours scrubbing.  Click to learn the fast track to a clean car seat! #QuickClean #BusyMom #CarCleaningTips #EasyCleaning
Steam Cleaning: Car Seat Sanitizing,https://res.cloudinary.com/dbcpfy04c/image/upload/v1747924186/pin_5_7_th1ked.webp,car-cleaning-tips,,https://www.beacleaner.com/how-to-steam-clean-car-seats?utm_source=pinterest&utm_campaign=steam-cleaning-car-s,2025-05-22,Beyond cleaning,steam cleaning *sanitizes* your car seat
The Ultimate Car Seat Cleaning Checklist,https://res.cloudinary.com/dbcpfy04c/image/upload/v1747924193/pin_5_8_dpkeok.webp,cleaning-tips,,https://www.beacleaner.com/how-to-steam-clean-car-seats?utm_source=pinterest&utm_campaign=the-ultimate-car-sea,2025-05-22,Don't miss a step! This pin provides a comprehensive checklist for steam cleaning your car seats.  From prepping the area to drying the seat,we've got you covered.  Ensure a thorough and effective clean every time.  Click to download the checklist and make car seat cleaning a breeze! #CleaningChecklist #CarSeatCare #DetailedCleaning #OrganizedCleaning
Car Seat Odor Removal: Steam Power!,https://res.cloudinary.com/dbcpfy04c/image/upload/v1747924209/pin_5_9_tpstkx.webp,car-cleaning-tips,,https://www.beacleaner.com/how-to-steam-clean-car-seats?utm_source=pinterest&utm_campaign=car-seat-odor-remova,2025-05-22,Say goodbye to lingering odors! This guide demonstrates how steam cleaning eliminates unpleasant smells from car seats.  We'll show you how to tackle everything from spilled milk to pet odors.  Enjoy a fresh,clean-smelling car interior. Click to learn how to neutralize odors naturally! #OdorRemoval #FreshCar #CarSmell #SteamCleaningBenefits
Steam Cleaning vs. Traditional Cleaning,https://res.cloudinary.com/dbcpfy04c/image/upload/v1747924216/pin_5_10_fc9a73.webp,cleaning-tips,,https://www.beacleaner.com/how-to-steam-clean-car-seats?utm_source=pinterest&utm_campaign=steam-cleaning-vs-tr,2025-05-22,Which method is best? This pin compares steam cleaning to traditional car seat cleaning methods,highlighting the benefits of steam.  We'll show you why steam cleaning is a superior choice for hygiene and effectiveness.  Make an informed decision and choose the best cleaning method for your needs. #CleaningComparison #SteamVsTraditional #EffectiveCleaning #CarSeatChoice
Steam Clean Car Seats: Step-by-Step,https://res.cloudinary.com/dbcpfy04c/image/upload/v1747924221/pin_5_11_rjv8jj.webp,car-cleaning-tips,,https://www.beacleaner.com/how-to-steam-clean-car-seats?utm_source=pinterest&utm_campaign=steam-clean-car-seat,2025-05-22,Need visual guidance? This pin features a step-by-step photo tutorial for steam cleaning car seats.  Easy to follow and understand!  We'll walk you through the entire process,from start to finish.  Click to see the visual guide and make car seat cleaning a breeze! #PhotoTutorial #StepByStepGuide #VisualLearning #EasyToFollow
Deep Cleaning Car Seats for Allergies,https://res.cloudinary.com/dbcpfy04c/image/upload/v1747924228/pin_5_12_omngut.webp,car-cleaning-tips,,https://www.beacleaner.com/how-to-steam-clean-car-seats?utm_source=pinterest&utm_campaign=deep-cleaning-car-se,2025-05-22,Suffering from allergies? This guide explains how steam cleaning can help reduce allergens in your car seat.  We'll show you how to eliminate dust mites and pollen for a healthier ride.  Breathe easy and enjoy a cleaner,more comfortable car interior. Click to learn how to allergy-proof your car seat! #AllergyRelief #DustMiteRemoval #CleanAir #HealthyCar
Revive Your Car Seat: Steam Clean!,https://res.cloudinary.com/dbcpfy04c/image/upload/v1747924235/pin_5_13_qdz123.webp,car-cleaning-tips,,https://www.beacleaner.com/how-to-steam-clean-car-seats?utm_source=pinterest&utm_campaign=revive-your-car-seat,2025-05-22,Is your car seat looking tired and worn? This pin inspires you to revive it with the power of steam cleaning.  Restore its original beauty and enjoy a fresh,clean ride.  Don't replace it – renew it! Click to learn how to breathe new life into your car seat! #CarSeatRevival #Renew #Restore #CleaningInspiration
Steam Clean Car Seats: Pet Owners!,https://res.cloudinary.com/dbcpfy04c/image/upload/v1747924243/pin_5_14_pdpq1s.webp,car-cleaning-tips,,https://www.beacleaner.com/how-to-steam-clean-car-seats?utm_source=pinterest&utm_campaign=steam-clean-car-seat,2025-05-22,Pet hair and muddy paws? No problem! This guide shows pet owners how to steam clean car seats effectively.  Remove pet dander and odors for a fresh,clean ride.  Keep your furry friend and your car seat happy. Click to learn how to tackle pet messes! #PetFriendlyCleaning #CarSeatForPets #PetHairRemoval #DogMom
Easy Car Seat Cleaning for Busy Moms,https://res.cloudinary.com/dbcpfy04c/image/upload/v1747924250/pin_5_15_eouxxp.webp,mom-life-tips,,https://www.beacleaner.com/how-to-steam-clean-car-seats?utm_source=pinterest&utm_campaign=easy-car-seat-cleani,2025-05-22,Life is hectic! This pin offers a simplified steam cleaning routine for busy moms.  Quick,effective
