Title,Media URL,Pinterest board,Thumbnail,Link,Publish date,Description,Keywords
Title,https://res.cloudinary.com/dbcpfy04c/image/upload/v1748759403/pin_1_1_v76gwu.webp,please-provide-the-title-and-keywords-i-need-that-information-to-suggest-a-board-name-once,,https://www.beacleaner.com/why-does-my-shop-vac-keep-shutting-off?utm_source=pinterest&utm_campaign=title,2025-06-01,Description,Keywords
Shop Vac Shutting Off? Fix It!,https://res.cloudinary.com/dbcpfy04c/image/upload/v1748759411/pin_1_2_tjixva.webp,diy-repair-tips,,https://www.beacleaner.com/why-does-my-shop-vac-keep-shutting-off?utm_source=pinterest&utm_campaign=shop-vac-shutting-of,2025-06-01,Is your shop vac constantly interrupting your cleaning? Don't let a frustrating shutdown ruin your day! This guide dives into the most common reasons why your shop vac keeps turning off – from full filters to electrical issues. We'll walk you through simple troubleshooting steps you can do yourself,saving you time and money on repairs.  Learn how to diagnose the problem and get back to tackling those tough messes.  Click to read the full article and reclaim your cleaning power!  Don't suffer through another interrupted clean! #ShopVacRepair #VacuumTroubleshooting #DIYFix #CleaningHacks
Shop Vac SOS: Why It's Dying!,https://res.cloudinary.com/dbcpfy04c/image/upload/v1748759417/pin_1_3_nvau2v.webp,home-repair-tips,,https://www.beacleaner.com/why-does-my-shop-vac-keep-shutting-off?utm_source=pinterest&utm_campaign=shop-vac-sos-why-its,2025-06-01,Feeling defeated by a shop vac that won't stay on? You're not alone! This post breaks down the reasons behind a shop vac shutting off unexpectedly. We cover everything from clogged hoses and filters to motor overheating and power cord problems.  We'll help you pinpoint the issue and provide clear,easy-to-follow solutions.  Stop wasting time and start cleaning efficiently! Read now to get your shop vac back in action. #ShopVacProblems #VacuumRepair #HomeMaintenance #CleaningTips
Stop the Cycle: Shop Vac Fixes,https://res.cloudinary.com/dbcpfy04c/image/upload/v1748759423/pin_1_4_omvqir.webp,home-repair-tips,,https://www.beacleaner.com/why-does-my-shop-vac-keep-shutting-off?utm_source=pinterest&utm_campaign=stop-the-cycle-shop-,2025-06-01,Tired of your shop vac turning off mid-clean? It's incredibly frustrating! This article is your ultimate guide to diagnosing and fixing the issue. We explore common culprits like a damaged power cord,a blown fuse
Shop Vac Won't Stay On? Read This!,https://res.cloudinary.com/dbcpfy04c/image/upload/v1748759429/pin_1_5_m4ia6p.webp,home-repair-tips,,https://www.beacleaner.com/why-does-my-shop-vac-keep-shutting-off?utm_source=pinterest&utm_campaign=shop-vac-wont-stay-o,2025-06-01,Don't throw away a perfectly good shop vac! Before you replace it,discover the simple fixes that could get it running smoothly again. This post details the most frequent reasons for shop vac shutdowns
Is Your Shop Vac Overheating?,https://res.cloudinary.com/dbcpfy04c/image/upload/v1748759434/pin_1_6_lzz207.webp,cleaning-tips,,https://www.beacleaner.com/why-does-my-shop-vac-keep-shutting-off?utm_source=pinterest&utm_campaign=is-your-shop-vac-ove,2025-06-01,Is your shop vac shutting off after only a few minutes of use? Overheating is a common problem! This article explains why shop vacs overheat and how to prevent it. We cover proper ventilation,filter maintenance
Shop Vac Motor Issues Explained,https://res.cloudinary.com/dbcpfy04c/image/upload/v1748759440/pin_1_7_ebqs3k.webp,vacuum-repair-tips,,https://www.beacleaner.com/why-does-my-shop-vac-keep-shutting-off?utm_source=pinterest&utm_campaign=shop-vac-motor-issue,2025-06-01,Is your shop vac motor struggling? This post dives into common motor problems that can cause shutdowns,such as worn brushes or a failing capacitor.  We'll help you diagnose the issue and determine whether a repair is possible or if it's time for a replacement.  Learn how to keep your shop vac motor in top condition! #ShopVacMotor #VacuumParts #RepairOrReplace #CleaningTech
Shop Vac Shutting Off Randomly?,https://res.cloudinary.com/dbcpfy04c/image/upload/v1748759446/pin_1_8_o31rtw.webp,diy-repair-tips,,https://www.beacleaner.com/why-does-my-shop-vac-keep-shutting-off?utm_source=pinterest&utm_campaign=shop-vac-shutting-of,2025-06-01,Random shutdowns are the most frustrating! This article explores the less obvious causes of intermittent shop vac shutdowns,such as loose connections or a faulty switch.  We provide a comprehensive troubleshooting guide to help you pinpoint the problem.  Stop the guesswork and get your shop vac working reliably! #ShopVacRandomShutdown #VacuumDiagnosis #Troubleshooting #CleaningSolutions
Extend Your Shop Vac's Life!,https://res.cloudinary.com/dbcpfy04c/image/upload/v1748759452/pin_1_9_bw21y0.webp,cleaning-tips,,https://www.beacleaner.com/why-does-my-shop-vac-keep-shutting-off?utm_source=pinterest&utm_campaign=extend-your-shop-vac,2025-06-01,Don't let a preventable issue shorten your shop vac's lifespan. This post offers proactive maintenance tips to prevent shutdowns and keep your vacuum running smoothly for years to come.  We cover filter cleaning,hose inspection
Shop Vac: Wet vs. Dry Issues,https://res.cloudinary.com/dbcpfy04c/image/upload/v1748759458/pin_1_10_mjype6.webp,cleaning-tips,,https://www.beacleaner.com/why-does-my-shop-vac-keep-shutting-off?utm_source=pinterest&utm_campaign=shop-vac-wet-vs-dry-,2025-06-01,Does your shop vac shut off when picking up wet messes? This article explains the differences between wet and dry shop vac operation and how to avoid common problems.  We'll help you choose the right attachments and settings for different cleaning tasks.  Clean with confidence,no matter the mess! #ShopVacWetDry #VacuumCleaning #CleaningHacks #HomeCleaning
Shop Vac: The Ultimate Guide,https://res.cloudinary.com/dbcpfy04c/image/upload/v1748759464/pin_1_11_szqopv.webp,cleaning-tips,,https://www.beacleaner.com/why-does-my-shop-vac-keep-shutting-off?utm_source=pinterest&utm_campaign=shop-vac-the-ultimat,2025-06-01,Need a comprehensive resource for all things shop vac? This post is your one-stop shop for understanding how shop vacs work,troubleshooting common problems
Shop Vac Shutting Off: Quick Fixes,https://res.cloudinary.com/dbcpfy04c/image/upload/v1748759471/pin_1_12_gw6opw.webp,diy-repair-tips,,https://www.beacleaner.com/why-does-my-shop-vac-keep-shutting-off?utm_source=pinterest&utm_campaign=shop-vac-shutting-of,2025-06-01,Short on time? This post provides a list of quick and easy fixes for common shop vac shutdowns.  We focus on the most frequent culprits,such as full filters and clogged hoses.  Get your shop vac back in action in minutes! #ShopVacQuickFix #FastRepairs #CleaningHacks #DIYSolutions
Shop Vac: Troubleshooting Checklist,https://res.cloudinary.com/dbcpfy04c/image/upload/v1748759477/pin_1_13_qec0xg.webp,home-repair-tips,,https://www.beacleaner.com/why-does-my-shop-vac-keep-shutting-off?utm_source=pinterest&utm_campaign=shop-vac-troubleshoo,2025-06-01,Feeling overwhelmed? This post provides a handy troubleshooting checklist to help you systematically diagnose the cause of your shop vac shutdown.  We break down the problem into manageable steps,making it easy to identify the issue.  Take the stress out of vacuum repair! #ShopVacChecklist #TroubleshootingGuide #VacuumHelp #DIYRepair
Shop Vac: When to Call a Pro,https://res.cloudinary.com/dbcpfy04c/image/upload/v1748759483/pin_1_14_deirf5.webp,home-repair-tips,,https://www.beacleaner.com/why-does-my-shop-vac-keep-shutting-off?utm_source=pinterest&utm_campaign=shop-vac-when-to-cal,2025-06-01,Sometimes,a repair is best left to the professionals. This post explains when it's time to call a qualified technician to fix your shop vac.  We cover complex motor problems and electrical issues that require specialized knowledge.  Don't risk damaging your vacuum further! #ShopVacRepairService #VacuumTechnician #ProfessionalHelp #HomeMaintenance
Shop Vac: The Right Accessories,https://res.cloudinary.com/dbcpfy04c/image/upload/v1748759489/pin_1_15_zk6sy1.webp,cleaning-tips,,https://www.beacleaner.com/why-does-my-shop-vac-keep-shutting-off?utm_source=pinterest&utm_campaign=shop-vac-the-right-a,2025-06-01,Using the right accessories can improve your shop vac's performance and prevent shutdowns. This post recommends essential attachments for different cleaning tasks,such as crevice tools and floor brushes.  Maximize your cleaning power! #ShopVacAccessories #VacuumAttachments #CleaningTools #HomeCleaning
Shop Vac: Dust Collection Tips,https://res.cloudinary.com/dbcpfy04c/image/upload/v1748759495/pin_1_16_gbjrsk.webp,workshop-tips,,https://www.beacleaner.com/why-does-my-shop-vac-keep-shutting-off?utm_source=pinterest&utm_campaign=shop-vac-dust-collec,2025-06-01,Using your shop vac for dust collection? This post offers tips for optimizing dust collection performance and preventing shutdowns.  We cover filter selection,hose routing
Shop Vac: Preventative Care Guide,https://res.cloudinary.com/dbcpfy04c/image/upload/v1748759502/pin_1_17_r3vppo.webp,cleaning-tips,,https://www.beacleaner.com/why-does-my-shop-vac-keep-shutting-off?utm_source=pinterest&utm_campaign=shop-vac-preventativ,2025-06-01,Don't wait for your shop vac to break down – take preventative measures! This post provides a comprehensive guide to preventative care,including regular filter cleaning
Shop Vac: Common Mistakes to Avoid,https://res.cloudinary.com/dbcpfy04c/image/upload/v1748759508/pin_1_18_xfjnhn.webp,cleaning-tips,,https://www.beacleaner.com/why-does-my-shop-vac-keep-shutting-off?utm_source=pinterest&utm_campaign=shop-vac-common-mist,2025-06-01,Avoid these common mistakes that can cause your shop vac to shut off prematurely. This post highlights pitfalls like using the wrong filter,overfilling the dust bag
Title,https://res.cloudinary.com/dbcpfy04c/image/upload/v1748759553/pin_2_1_cyvykg.webp,please-provide-the-title-and-keywords-i-need-that-information-to-suggest-a-board-name-once,,https://www.beacleaner.com/pressure-washer-soap-dispenser-doesnt-work?utm_source=pinterest&utm_campaign=title,2025-06-01,Description,Keywords
Pressure Washer Soap Not Working? Fix It!,https://res.cloudinary.com/dbcpfy04c/image/upload/v1748759559/pin_2_2_wdqyiu.webp,pressure-washer-tips,,https://www.beacleaner.com/pressure-washer-soap-dispenser-doesnt-work?utm_source=pinterest&utm_campaign=pressure-washer-soap,2025-06-01,Is your pressure washer refusing to suds up? Don't let a dirty machine ruin your cleaning day! This guide walks you through troubleshooting a non-functioning soap dispenser,from simple clogs to more complex issues. We'll cover common causes
Pressure Washer Soap Issues: Quick Fixes,https://res.cloudinary.com/dbcpfy04c/image/upload/v1748759564/pin_2_3_eb7utn.webp,pressure-washer-tips,,https://www.beacleaner.com/pressure-washer-soap-dispenser-doesnt-work?utm_source=pinterest&utm_campaign=pressure-washer-soap,2025-06-01,Frustrated your pressure washer isn't dispensing soap? You're not alone! This pin leads to a step-by-step guide to diagnose and resolve the issue quickly. We'll show you how to check the filter,siphon tube
DIY Pressure Washer Soap Fix - Easy Guide,https://res.cloudinary.com/dbcpfy04c/image/upload/v1748759572/pin_2_4_ahxeii.webp,home-repair-tips,,https://www.beacleaner.com/pressure-washer-soap-dispenser-doesnt-work?utm_source=pinterest&utm_campaign=diy-pressure-washer-,2025-06-01,Don't throw away a perfectly good pressure washer! A clogged soap dispenser is a common problem with a simple solution. This pin links to a detailed guide that empowers you to fix it yourself. We break down the process into easy-to-follow steps,even for beginners. Save money on repair bills and enjoy a powerful clean. Click to learn how to get your soap flowing again!  #PressureWasherDIY #SoapDispenserFix #HomeImprovement #CleaningMotivation
Pressure Washer Soap Not Mixing? Here's Why,https://res.cloudinary.com/dbcpfy04c/image/upload/v1748759578/pin_2_5_iad4yb.webp,pressure-washer-tips,,https://www.beacleaner.com/pressure-washer-soap-dispenser-doesnt-work?utm_source=pinterest&utm_campaign=pressure-washer-soap,2025-06-01,Struggling to get the right soap-to-water ratio in your pressure washer? This pin directs you to a guide explaining why your soap isn't mixing properly and how to fix it. We cover issues with the siphon tube,injector
Pressure Washer Soap Injector: How to Check,https://res.cloudinary.com/dbcpfy04c/image/upload/v1748759583/pin_2_6_lkhzeq.webp,pressure-washer-tips,,https://www.beacleaner.com/pressure-washer-soap-dispenser-doesnt-work?utm_source=pinterest&utm_campaign=pressure-washer-soap,2025-06-01,The soap injector is the heart of your pressure washer's soap dispensing system. Learn how to inspect and troubleshoot this crucial component with our easy-to-follow guide.  Don't let a faulty injector ruin your cleaning projects! Click to learn how to diagnose and fix the problem,saving you time and frustration. #SoapInjector #PressureWasherMaintenance #DIYFix #CleaningTools
Pressure Washer Soap Filter: Clean It Now!,https://res.cloudinary.com/dbcpfy04c/image/upload/v1748759588/pin_2_7_iqdcox.webp,pressure-washer-tips,,https://www.beacleaner.com/pressure-washer-soap-dispenser-doesnt-work?utm_source=pinterest&utm_campaign=pressure-washer-soap,2025-06-01,A dirty soap filter can completely block soap flow. This pin leads to a guide showing you how to locate,remove
Pressure Washer Soap Dispenser: Common Mistakes,https://res.cloudinary.com/dbcpfy04c/image/upload/v1748759594/pin_2_8_amrchh.webp,pressure-washer-tips,,https://www.beacleaner.com/pressure-washer-soap-dispenser-doesnt-work?utm_source=pinterest&utm_campaign=pressure-washer-soap,2025-06-01,Avoid these common mistakes that can cause your pressure washer soap dispenser to fail. This pin links to a guide that highlights frequent errors and provides preventative measures.  Save yourself time,money
Pressure Washer Soap: Too Much or Too Little?,https://res.cloudinary.com/dbcpfy04c/image/upload/v1748759600/pin_2_9_wvoafe.webp,pressure-washer-tips,,https://www.beacleaner.com/pressure-washer-soap-dispenser-doesnt-work?utm_source=pinterest&utm_campaign=pressure-washer-soap,2025-06-01,Finding the perfect soap-to-water ratio is crucial for effective cleaning. This pin leads to a guide that helps you determine the optimal amount of soap to use for different cleaning tasks.  Avoid streaks,residue
Pressure Washer Soap: DIY Cleaning Solutions?,https://res.cloudinary.com/dbcpfy04c/image/upload/v1748759608/pin_2_10_ltsh5q.webp,pressure-washer-tips,,https://www.beacleaner.com/pressure-washer-soap-dispenser-doesnt-work?utm_source=pinterest&utm_campaign=pressure-washer-soap,2025-06-01,Can you use homemade cleaning solutions in your pressure washer? This pin directs you to a guide that explores the pros and cons of DIY soap options.  Learn which ingredients are safe and effective,and which ones to avoid. Click to learn more. #DIYPressureWasherSoap #HomemadeCleaning #CleaningSolutions #HomeHacks
Pressure Washer Soap Dispenser: Replacement?,https://res.cloudinary.com/dbcpfy04c/image/upload/v1748759615/pin_2_11_jihlj1.webp,pressure-washer-tips,,https://www.beacleaner.com/pressure-washer-soap-dispenser-doesnt-work?utm_source=pinterest&utm_campaign=pressure-washer-soap,2025-06-01,Sometimes,a repair isn't enough. This pin leads to a guide that explains when it's time to replace your pressure washer's soap dispenser and how to choose the right replacement part.  Get back to cleaning quickly and efficiently! Click to learn more. #PressureWasherReplacement #SoapDispenserParts #HomeRepair #DIYProject
Pressure Washer Soap: Heavy Duty Cleaning,https://res.cloudinary.com/dbcpfy04c/image/upload/v1748759621/pin_2_12_snqdzr.webp,pressure-washer-tips,,https://www.beacleaner.com/pressure-washer-soap-dispenser-doesnt-work?utm_source=pinterest&utm_campaign=pressure-washer-soap,2025-06-01,Tackling tough grime? This pin links to a guide that recommends heavy-duty pressure washer soaps for challenging cleaning tasks.  Blast away dirt,grease
Pressure Washer Soap: When to Call a Pro,https://res.cloudinary.com/dbcpfy04c/image/upload/v1748759626/pin_2_13_ai3blb.webp,pressure-washer-tips,,https://www.beacleaner.com/pressure-washer-soap-dispenser-doesnt-work?utm_source=pinterest&utm_campaign=pressure-washer-soap,2025-06-01,Sometimes,DIY isn't enough. This pin directs you to a guide that explains when it's time to call a professional pressure washer repair technician.  Protect your investment and avoid further damage. Click to learn more. #PressureWasherRepair #SoapDispenserHelp #HomeMaintenance #ProfessionalCleaning
Title,https://res.cloudinary.com/dbcpfy04c/image/upload/v1748759670/pin_3_1_efcaao.webp,please-provide-the-title-and-keywords-i-need-that-information-to-suggest-a-board-name-once,,https://www.beacleaner.com/irobot-roomba-side-brush-not-spinning?utm_source=pinterest&utm_campaign=title,2025-06-01,Description,Keywords
Roomba Side Brush Fix! 🧹,https://res.cloudinary.com/dbcpfy04c/image/upload/v1748759678/pin_3_2_q9dkv4.webp,robot-repair-tips,,https://www.beacleaner.com/irobot-roomba-side-brush-not-spinning?utm_source=pinterest&utm_campaign=roomba-side-brush-fi,2025-06-01,Is your Roomba's side brush refusing to spin? Don't panic! This guide walks you through simple troubleshooting steps to get it whirling again. From debris removal to motor checks,we'll help you diagnose and fix the issue quickly. A spinning side brush is *crucial* for edge cleaning – don't let dust bunnies win! Save time & money by DIY-ing the repair instead of replacing the whole robot. Click to learn how!
Roomba Side Brush Stuck?,https://res.cloudinary.com/dbcpfy04c/image/upload/v1748759684/pin_3_3_e2bg1n.webp,robot-repair-tips,,https://www.beacleaner.com/irobot-roomba-side-brush-not-spinning?utm_source=pinterest&utm_campaign=roomba-side-brush-st,2025-06-01,Frustrated with a Roomba side brush that won't move? You're not alone! This pin leads to a detailed guide on identifying why your Roomba's side brush is stuck. We cover common culprits like tangled hair,worn brushes
DIY Roomba Repair: Side Brush,https://res.cloudinary.com/dbcpfy04c/image/upload/v1748759690/pin_3_4_t4nefb.webp,home-repair-tips,,https://www.beacleaner.com/irobot-roomba-side-brush-not-spinning?utm_source=pinterest&utm_campaign=diy-roomba-repair-si,2025-06-01,Don't throw away your Roomba! This pin links to a step-by-step guide to fixing a non-spinning side brush. We'll show you how to easily remove debris,check the motor
Roomba Side Brush Not Working?,https://res.cloudinary.com/dbcpfy04c/image/upload/v1748759695/pin_3_5_kd2zqj.webp,robot-repair-tips,,https://www.beacleaner.com/irobot-roomba-side-brush-not-spinning?utm_source=pinterest&utm_campaign=roomba-side-brush-no,2025-06-01,Is your Roomba leaving edges dirty? A non-spinning side brush is likely the culprit! This pin directs you to a comprehensive guide that will help you diagnose and fix the problem. We cover everything from simple cleaning to more complex motor issues.  Don't let a dirty edge ruin your clean floors!  Get back to enjoying a spotless home with our easy-to-follow instructions.,Roomba
Save Money: Fix Roomba Brush,https://res.cloudinary.com/dbcpfy04c/image/upload/v1748759702/pin_3_6_mh1eif.webp,home-repair-tips,,https://www.beacleaner.com/irobot-roomba-side-brush-not-spinning?utm_source=pinterest&utm_campaign=save-money-fix-roomb,2025-06-01,Stop spending money on new Roombas! This pin leads to a guide on fixing a Roomba side brush that won't spin.  We'll show you how to identify the problem and implement a quick,cost-effective solution.  A little DIY can save you a lot of money!  Don't let a simple issue lead to a costly replacement. Click to learn how to extend the life of your Roomba!
Roomba Side Brush: Quick Fix,https://res.cloudinary.com/dbcpfy04c/image/upload/v1748759708/pin_3_7_ik9h8c.webp,robot-repair-tips,,https://www.beacleaner.com/irobot-roomba-side-brush-not-spinning?utm_source=pinterest&utm_campaign=roomba-side-brush-qu,2025-06-01,Short on time? This pin links to a quick guide on fixing a Roomba side brush that's stopped spinning. We focus on the most common issues and provide fast,easy solutions.  Get your Roomba back to work in minutes!  Don't let a little problem disrupt your cleaning routine.  Click to learn the fastest way to get your side brush spinning again!
Roomba Brush Motor Issues?,https://res.cloudinary.com/dbcpfy04c/image/upload/v1748759714/pin_3_8_jftqma.webp,robot-vacuum-tips,,https://www.beacleaner.com/irobot-roomba-side-brush-not-spinning?utm_source=pinterest&utm_campaign=roomba-brush-motor-i,2025-06-01,Suspect a motor problem with your Roomba's side brush? This pin leads to a detailed guide on diagnosing and addressing motor issues. We'll help you determine if the motor is faulty and explore your repair options.  Don't let a dead motor ruin your Roomba!  Learn how to troubleshoot and potentially save your robot vacuum.,Roomba
Roomba Side Brush Replacement,https://res.cloudinary.com/dbcpfy04c/image/upload/v1748759719/pin_3_9_hcme98.webp,robot-repair-tips,,https://www.beacleaner.com/irobot-roomba-side-brush-not-spinning?utm_source=pinterest&utm_campaign=roomba-side-brush-re,2025-06-01,Is your Roomba side brush worn out? This pin links to a guide on replacing the side brush. We'll show you how to choose the right replacement brush and install it quickly and easily.  A new brush means better cleaning!  Keep your Roomba performing at its best with a simple brush replacement. Click to learn more!,Roomba
Roomba Side Brush: Hair Removal,https://res.cloudinary.com/dbcpfy04c/image/upload/v1748759725/pin_3_10_uwbm2c.webp,robot-repair-tips,,https://www.beacleaner.com/irobot-roomba-side-brush-not-spinning?utm_source=pinterest&utm_campaign=roomba-side-brush-ha,2025-06-01,Tangled hair causing your Roomba's side brush to stop? This pin leads to a guide on removing hair and debris from the brush. We'll show you the best tools and techniques for keeping your brush clean and spinning freely.  Prevent future issues with regular maintenance!  Don't let hair ruin your Roomba's cleaning power.,Roomba
Roomba Cleaning Tips: Side Brush,https://res.cloudinary.com/dbcpfy04c/image/upload/v1748759731/pin_3_11_r9bwmm.webp,robot-vacuum-tips,,https://www.beacleaner.com/irobot-roomba-side-brush-not-spinning?utm_source=pinterest&utm_campaign=roomba-cleaning-tips,2025-06-01,Keep your Roomba running smoothly! This pin links to a guide on maintaining your Roomba's side brush. We'll share tips on preventing issues and ensuring optimal performance.  A well-maintained brush means a cleaner home!  Learn how to extend the life of your Roomba and enjoy consistently clean floors.,Roomba
Roomba Side Brush: Before You Replace,https://res.cloudinary.com/dbcpfy04c/image/upload/v1748759736/pin_3_12_mkqjs1.webp,robot-repair-tips,,https://www.beacleaner.com/irobot-roomba-side-brush-not-spinning?utm_source=pinterest&utm_campaign=roomba-side-brush-be,2025-06-01,Before you replace your Roomba's side brush,check this! This pin leads to a guide on troubleshooting the issue to see if a simple fix will work.  Avoid unnecessary expenses!  We'll help you diagnose the problem and determine if a replacement is truly necessary.  Save money and time with our expert advice.
Roomba Side Brush: Step-by-Step,https://res.cloudinary.com/dbcpfy04c/image/upload/v1748759743/pin_3_13_l7kjrh.webp,robot-repair-tips,,https://www.beacleaner.com/irobot-roomba-side-brush-not-spinning?utm_source=pinterest&utm_campaign=roomba-side-brush-st,2025-06-01,Need a visual guide? This pin links to a step-by-step guide on fixing a Roomba side brush that won't spin.  Easy-to-follow instructions with photos!  Don't get frustrated with complicated repairs.  We'll walk you through the process,making it simple and stress-free.
Roomba Side Brush: Common Problems,https://res.cloudinary.com/dbcpfy04c/image/upload/v1748759748/pin_3_14_rehbp9.webp,robot-repair-tips,,https://www.beacleaner.com/irobot-roomba-side-brush-not-spinning?utm_source=pinterest&utm_campaign=roomba-side-brush-co,2025-06-01,What's causing your Roomba's side brush to stop? This pin leads to a guide outlining the most common problems and their solutions.  Identify the issue quickly and get your Roomba back to work!  Don't waste time guessing – we've got the answers you need.,Roomba
Roomba Side Brush: Is it the Motor?,https://res.cloudinary.com/dbcpfy04c/image/upload/v1748759754/pin_3_15_haxqne.webp,robot-repair-tips,,https://www.beacleaner.com/irobot-roomba-side-brush-not-spinning?utm_source=pinterest&utm_campaign=roomba-side-brush-is,2025-06-01,Is your Roomba side brush motor failing? This pin links to a guide on how to test and diagnose a faulty motor.  Learn how to determine if a replacement is needed.  Don't let a bad motor ruin your cleaning experience.  Get the information you need to make an informed decision.,Roomba
Roomba Side Brush: Preventative Care,https://res.cloudinary.com/dbcpfy04c/image/upload/v1748759759/pin_3_16_cdfsoe.webp,robot-repair-tips,,https://www.beacleaner.com/irobot-roomba-side-brush-not-spinning?utm_source=pinterest&utm_campaign=roomba-side-brush-pr,2025-06-01,Don't wait for your Roomba's side brush to break! This pin leads to a guide on preventative care to keep it spinning smoothly.  Regular maintenance is key!  Extend the life of your Roomba and enjoy consistently clean floors with our simple tips.,Roomba
